page,date,tags,questions,questions_add,answers,N_answer,url,category
4,2020.11.20,"['직업', '의사']",직업에 관한 얘기입니다. 자세히 알려주시면 감사하겠습니다.,안녕하세요. 지금 고 1인데 장래희망을 의사로 꿈꾸고 있습니다. 근데 제가 수술하거나 그러는건 도저히 못할 것같아서 직업이 의사인데 그 계열쪽에서 백신 개발 등등과 같은 일을 할 수 있나요?,['약대에 진학하셔서 연구 개발  업무를 하시면 됩니다\n꼭 성공하세요~!'],1,https://kin.naver.com/qna/detail.naver?d1id=4&dirId=40602&docId=373745418&qb=67Cx7Iug&enc=utf8&section=kin&rank=31&search_sort=3&spq=0,"교육, 연구, 학문"
4,2020.11.20,[],코로나 최소한 2~3년은 더가겠죠?,"코로나 백신이 나왔네 마네

내년은 부턴 우리나라도 맞을수 있네 없네

어쩌구 저쩌구 하는데 지아무리 빨라도 팡으로 2~3년은

더지나야 코로나가 없어지내 어쩌내 하겠죠?

사실 눈에 안보이는거니깐 평생 마스크쓰고 두려움에

살수도 있을거 같기도하네요

일단 의사랑, 대통령먼저 백신맞고 마스크 안쓰고

돌아다녀야 그나마 믿을까 싶네요","['어쩌면 코로나는 앞으로 감기처럼 우리 일상생활에 평생 안없어질지도 모릅니다. \n저도 가끔 죽을때까지 마스크를 쓰고 살아야하나 생각하면 넘 참담하기도 하는데요. 어쩔수없죠.\n 백신이 당장 나온다해도 가격도 가격이며 실험도 해봐야하고 몇년이 걸릴지도 모릅니다.\n 우리가 안걸리게끔 잘 예방하고 조심하는 수 밖에요..', '내년이지나면 괜찮아질거라 생각됩니다']",2,https://kin.naver.com/qna/detail.naver?d1id=8&dirId=80101&docId=373745230&qb=67Cx7Iug&enc=utf8&section=kin&rank=32&search_sort=3&spq=0,"연애, 결혼"
4,2020.11.20,[],코로나 백신은 우리나라에는 언제 접종되나요? 안그래도 백신 예방효과가 95%정도 나왔는데요,,"['일단 코로나 백신은 우리의 구세주가 될지 안될지는 알 수 없고 코로나 백신에 대한 큰 기대는 하지 않는 게 좋습니다. 코로나 백신은 우리나라에서는 내년 상반기에 우선 접종 받을 대상사 계층을 선정해서 먼저 접종하고 나머지 분들은 내년 독감예방접종 시기에 독감예방접종과 같이 코로나 백신을 접종을 받을 겁니다.', '인터넷만 처 하지말고 뉴스좀 처보세요\n2021년 겨울에 접종할 예정이라자나요\n그리고 채택률좀 높여라 ', '중대본 부본부장이 브리핑에서 밝힌 바에 따르면, \n내년 하반기는 되야 한다고 말했습니다..\n부작용 추이도 살피고, 저온 유통망 구축 때문이라네요..\n자세한 내용은 아래 참고해보세요 ^^\n화이자 백신, 모더나 백신 개발, 접종시기\n이번 글에서는 화이자 백신, 모더나 백신의 개발현황과 접종시기 부작용 등에 대해 전체적으로 살펴보도록 하겠습니다. 독일의 바이오엔테크와 미국의 글로벌 제약사인 화이자가 공동 개발 중인 코로나 백신에 대..\nsogunpo.tistory.com']",3,https://kin.naver.com/qna/detail.naver?d1id=7&dirId=7010107&docId=373744487&qb=67Cx7Iug&enc=utf8&section=kin&rank=33&search_sort=3&spq=0,감염내과
4,2020.11.20,[],윈도우 디펜터 끄려고 하는데요 gpedit.msc 이 파일이 아얘없네요 ㅠㅠㅠ,"윈도우 디펜더가 바이러스 및 위협 방지가 조직에서 관리됩니다. 떠 있어서
레지스트리를 수정해야 한다고뜨는데 gpedit.msc 이 안나오네요 ㅠㅠ

작업창에도 검색해도 안나오고 ㅠㅠ

실행창에 검색해도 안나와요 ㅠㅜㅠ
찾을 수 없다고 뜨네요 어떻게 해야하나요??","['윈도우 키 + R 후 gpedit.msc  입력후 엔터를 치시면 로컬그룹 정책 편집기가 실행 됩니다.\n여기서 관리템플릿 -> 윈도우 구성로 들러가면 아래와같이 디팬더 바이러스 백신을 다블클릭 하세요.\n2. 그럼 아래와 같이 설정 적용 확인을 하시면 디펜더가 끄지게 됩니다.\n이외 다른 방법으로도 가능 합니다.', 'gpedit.msc는 windows pro버전에 포함되어 있고, home 버전에서는 제공되지않습니다.\n아래 링크에서 별도로 설치해야 하는데, 영문으로 표시됩니다.\nhttp://softwant.com/cgi-bin/itgi/?m=bbs&bid=free_system&uid=4007\n소프트원트 - 시스템관리\n그룹정책관리자는(gpedit.msc) 윈도우즈 프로버전에 내장된 윈도우즈 관리도구이다. 윈도우즈 홈버전이나 스타트 버전을 사용할 경우 이 그룹정책관리자를 이용할 수 없다. 이런 경우 레지스트리를 통해 컴퓨터 설정을 변경해야 한다. 여기에 소개된 프로그램은 윈도우즈 7/\nsoftwant.com\n디펜더는 다른 바이러스백신을 중지하면 자동으로 수동상태가 됩니다. 또는 아래 동영상을 참고하세요. 아래 주소로 이동하여 더보기에 관련 파일이 있으니 참고하세요.\nhttps://youtu.be/BZhBE9u0R9w\n=================================\n랜섬웨어 대응방법\n=================================\nhttps://youtu.be/OGVbqtgpELw', '로컬그룹정책편집기 gpedit.msc 윈도우1.. : 네이버블로그 (naver.com)\n이 링크 블로그에서 설치하세요(그 컴퓨터엔 없어서 설치해야합니다)\n끄는 법은 윈도우 10 업데이트 끄기 방법 gpedit... : 네이버블로그 (naver.com) 에 있습니다']",3,https://kin.naver.com/qna/detail.naver?d1id=1&dirId=10301&docId=373742645&qb=67Cx7Iug&enc=utf8&section=kin&rank=34&search_sort=3&spq=0,윈도우
4,2020.11.20,[],시노팜 질문입니다.,"그래서 시노팜맞고 죽는 경우 잘없는데 
중국에서 코로나19 종식되어도 (시진핑이 그렇게 선언) 무증상감염자가 속출하고 산발적이지만 나오고  하는 이유가 시노팜 백신이 효과가 엄청 떨어지기 때문에 그렇습니다. 

수백만명 맞았는데도 드문드문하게 나오잖아요 ",['시노팜은 엄청 효과가 떨어지니 수입하면 안 됩니다.\n저는 제발 정부가 정신차려서 올바른 백신을 수입해서 국민들의 건강을 책임졌으면 합니다.'],1,https://kin.naver.com/qna/detail.naver?d1id=9&dirId=9020102&docId=373741491&qb=67Cx7Iug&enc=utf8&section=kin&rank=35&search_sort=3&spq=0,중국
4,2020.11.20,[],중국산 시노팜 관련 질문,"중국백신은 불활화라 불로 태워 (특수물질이용)세포독성을 많이 제거를 하기 때문헤 효능은 모더나보다 엄청 떨어져도 안전하다고 할 수 있는데 (이러면 백신효능이 많이 없어짐)

중국백신은 안전성은 최고라 사망하거나 하는건 없어도 효능이 너무 떨어져서 신뢰가 없는것입니다.
바이러스효능을 불로 태운다음 효과를 없애기 때문에 효능이 매우 떨어지는것이죠",['비효율적이네요.\n안전을 잡기위해서 효능이 떨어지면 중국산은 중국내에서는 사용될지 몰라도 \n세계적으로는 안 되겠네요.\n그런데 우리나라는 수입할 수도 있겠네요.'],1,https://kin.naver.com/qna/detail.naver?d1id=9&dirId=9020102&docId=373740469&qb=67Cx7Iug&enc=utf8&section=kin&rank=36&search_sort=3&spq=0,중국
3,2020.11.20,[],코로나 확진자 동선 안내문자,"확진자 동선안내문자가 오면 확진자가

코로나 감염검사후 양성판정받은 후 동선만 알려주는건가요?

아니면 양성판정받기 몇일전부터의 동선을 파악해서 알려주는건가요?

몇일전부터의 동선파악 안내문이면 보통 몇일전부터인지 알수있을까요?","['네, 코로나 바이러스 검사를 하여 양성이 되어야만이 확진자가 되기에 양성판정후에 동산을 알려 줄것 같습니다.\n양성 판정 전에는 확진자가 아니기에 알려줄 이유가 없다고 생각을 합니다.\n내년에 코로나 백신이 공급이 되기 전까지는 항상 마스크를 쓰고 사람들과 접촉을 피하며 식당등 실내에서는 말을 할때에는  마스크를 반드시 사용을 해야 합니다.\n감사합니다.', '줄어들줄 알던 신종 코로나19 바이러스 확진자가 점점 많아지고 있습니다. 코로나19 바이러스가 퍼지면 나도 감염되는 거 아닌지 불안한 마음이 생겨나고 최근 긴급재난 문자로 이제 정말 근처까지 다가오는 코로나19 입니다. 코로나19 확진자가 늘어날 수록 확진자에 대한 정보를 꼭 알아야 합니다. 아래 동선확인 방법 확인하시고 항상 확진자 동선은 최대한 피하셔서 건강을 지키시기바랍니다.\n▼코로나 확진자동선 확인방법(+현황 사이트 코로나맵 겹치면 천안 부산 김해 등)\nhttps://speedsalgoo.tistory.com/436\n코로나 확진자동선 확인방법(+현황 사이트 코로나맵 겹치면 천안 부산 김해 등)\n줄어들줄 알던 신종 코로나19 바이러스 확진자가 점점 많아지고 있습니다. 코로나19 바이러스가 퍼지면 나도 감염되는 거 아닌지 불안한 마음이 생겨나고 최근 긴급재난 문자로 이제 정말 근처까지 다가오는 코로..\nspeedsalgoo.tistory.com']",2,https://kin.naver.com/qna/detail.naver?d1id=6&dirId=60301&docId=373751775&qb=67Cx7Iug&enc=utf8&section=kin&rank=21&search_sort=3&spq=0,"신체검사, 병역판정"
2,2020.11.20,"['생명과학1', '백신', '당뇨병', '제1형당뇨병', '제2형당뇨병']","생명과학1 질문 (당뇨병, 백신) (내공 500)","성실하고 자세한 설명 부탁드립니다.

Q1. 당뇨병에는 제1형 당뇨병과 제2형 당뇨병이 있는데 상대적으로 어린 환자들에게서 발병하는 경우는 제1형 당뇨병과 제2형 당뇨병 중 어느 경우인지 발병 원인을 근거로 서술하고 그 증상을 완화시키기 위한 주기적인 치료 방법은 무엇인지 서술하시오.

Q2. 예방 접종이 질병을 예방하는 원리를 우리 몸의 면역 반응의 특성을 통해 서술하시오.","['1.어린환자는 제1형 당뇨병.췌장의 랑게르한스섬의 염증이 원인으로 알고 있네요.인슐린 주사를 맞아야 하지요.\n2.항체가 생기기 때문에.', ""Q1. 당뇨병에는 제1형 당뇨병과 제2형 당뇨병이 있는데 상대적으로 어린 환자들에게서 발병하는 경우는 제1형 당뇨병과 제2형 당뇨병 중 어느 경우인지 발병 원인을 근거로 서술하고 그 증상을 완화시키기 위한 주기적인 치료 방법은 무엇인지 서술하시오.\n 정의: 소변으로 당이 나오는 것만으로 당뇨병이 있다고 할 수는 없으며, 혈액 속의 포도당 수치(혈당)가 비정상적으로 높은 상태가 지속될 때를 당뇨병이라고 한다.\n포도당이 세포 속으로 들어가기 위해서는 췌장 베타세포에서 나오는 인슐린이라는 호르몬의 도움이 필요하다.\n만일 인슐린이 부족하거나 인슐린은 충분하더라도 제 역할(포도당을 세포 속으로 넣어주는 역할)을 하지 못하면 포도당이 세포 속으로 들어가지 못하게 되고 혈액 속에 남아돌게 되고. 혈액 속의 포도당 수치(혈당)가 비정상적으로 상승하게 되고 남아도는 포도당은 결국 소변으로 배출된다.\n 당뇨병은 제1형과 제2형으로 구분되는데, 제1형 당뇨병은 이전에 '소아 당뇨병'이라고 불렸었으며, 인슐린을 전혀 생산하지 못하는 것이 원인이 되어 발생하는 질환이다. 주된 연령층은 어린이와 청소년이지만 모든 연령대에서 발병할 수 있다. 인슐린을 생산하지 못하기 때문에 주사를 매일매일 맞아야 한다.\n 당뇨병이 생기는 원인은 아직 정확히 모른다.\n당뇨병이 유전병이냐고 물으시는 분들이 많이 있는데 유전병은 아니지만 유전과 관련은 있다.\n다시 말해 부모가 당뇨병이 있으면 당뇨병이 없는 경우보다 자식이 당뇨병에 걸릴 확률이 높다.\n유전적인 요인 외에도 비만, 연령, 식생활, 운동 부족, 스트레스, 약물 등의 환경적인 요인도 당뇨병 발생에 매우 중요한 역할을 한다는 것을 알 수 있다.\n 치료방법:정상 혈당과 혈중 지질의 유지, 적정한 체중의 유지, 합병증의 예방 및 지연 좋은 영양상태 유지, 20~30분 정도의 적당한 운동(땀이 날 정도), 약물요법은 경구혈당강하제를 복용하는 것과 인슐린 주사를 맞는 것\n Q2. 예방 접종이 질병을 예방하는 원리를 우리 몸의 면역 반응의 특성을 통해 서술하시오.\n 예방 접종: 불활성화되어 감염 능력이 없어졌거나 약화된 병원체를 체내에 주사하여 신체가 그에 대한 항체를 형성하게 하여 이후 해당 질병에 대한 면역을 가지게 하는 행위를 의미\n 약화된 병원체를 인체에 투여하여 인체에서 해당 병원체에 대한 내성이 생기게 됨\n 면역(immunity)은 자기 자신(self)의 물질과 외부물질(foreign material)을 구별하여 외부물질에 대항함으로써 이를 제거하는 인체의 능력이다. \n 대부분의 병원체는 면역체계에 의해 외부물질로 인식되므로 면역은 감염질환으로부터 인체를 보호하는 역할을 수행한다. 미생물에 대한 면역은 대개의 경우 항체의 존재 여부로 알 수 있다. 면역은 특정한 균 또는 밀접하게 연관된 미생물 군에 특이적인 것이다.\n 면역은 획득하는 방법에 따라 크게 능동면역(active immunity)과 수동면역(passive immunity)의 두 가지로 나뉜다. 능동면역은 자기 자신의 면역체계에 의해서 만들어지며 대부분 영구적이다.\n  한편, 수동면역은 동물 또는 사람에 의해서 만들어진 면역물질의 투여에 의해서 획득되는 면역력으로, 대개 수주에서 수개월이 지나면 소실되게 된다.\n 면역체계는 항원(antigen)이라 일컫는 외부물질을 인식하는 것을 주 목적으로 하는 세포들의 복잡한 집합체이다.\n 항원은 살아 있을 수도 있고 죽은 것일 수도 있으며, 면역체계는 이러한 외부 항원에 대한 방어능력을 생성한다. 이러한 방어능력은 면역반응(immune response)이라 하며 B 림프구가 항체(antibody) 또는 면역글로불린(immunoglobulin)이라 불리는 단백질 분자를 생산하는 것과 외부 물질을 제거하는 것을 촉진하는 특정 세포 즉, 세포 매개성 면역능(cell-mediated immunity)을 포함한다. 가장 효율적인 면역능력은 일반적으로 살아있는 항원(live antigen)에 대한 반응으로 생성된다.\n 하지만, 면역반응이 발생하기 위해서 실제의 바이러스 또는 세균 감염증처럼 반드시 살아 있는 항원이 필요한 것은 아니다.\n ""]",2,https://kin.naver.com/qna/detail.naver?d1id=7&dirId=7010106&docId=373754856&qb=67Cx7Iug&enc=utf8&section=kin&rank=20&search_sort=3&spq=0,내분비대사내과
2,2020.11.20,[],코로나...,원래 일요일마다 축구동호회하는데요...코로나 치료제나 백신나오면 종식이안되도 축구랑 피시방가도될까요...?,"['© nastya_gepp, 출처 Pixabay\n치료제, 백신이 나오면 안심은 되겠지만 사람들이 많이 모이는 장소는 가급적 피하는게 났겠죠\n94% 사람들에게 효과를 보인다고 하지만\n나머지 6% 효과없는 사람들에 포함될 수 있으니까요\n그리고 백신, 치료제 등에 임상 때 없었던 부작용이 나타날수도 있으니 아예 안 걸리도록 방역수칙을 잘 지키는게 났죠 ㅜㅜ']",1,https://kin.naver.com/qna/detail.naver?d1id=10&dirId=10010102&docId=373754891&qb=67Cx7Iug&enc=utf8&section=kin&rank=19&search_sort=3&spq=0,프로축구
2,2020.11.20,[],링크 클릭만으로 해킹,SNS의 타임라인을 내리던 중 불법 소설 텍스트본을 올린다는 유튜브 계정을 신고해달라는 글을 보고 그 유튜브 계정 링크를 누른 뒤 그 다음 유튜브 계정 더보기란에 적혀있던 티스토리의 링크를 타고 들어갔더니 불법 텍본 다운로드 글이 나왔습니다. 실제 소설 등은 신고를 위해 들어갔던 만큼 다운받은 적이 없고 유튜브 링크→ 티스토리 링크를 타고 들어갔는데 그것만으로도 휴대전화나 기타 해킹이 가능할까요? 별다른 사이트는 아니었고 그저 평범한 티스토리 블로그였던 것 같습니다.,"['가능성으로 따지자면 0.1%의 가능성만 있어도 가능이라고 하니까요.\n기술적으로도 불가능한것은 아닙니다만, 보통 이런 사례들은 티스토리나 기타 사이트 등을 이용하여\n1차적으로 접근을 유도하고 2차적으로 다운로드 서버 등으로 유도하게 됩니다.\n질문자님의 경우에는 크게 문제가 없을 것으로 보입니다만, 백신 설치나 검사 등으로 항상 정기점검 하시길 권장합니다.']",1,https://kin.naver.com/qna/detail.naver?d1id=1&dirId=11001&docId=373755215&qb=67Cx7Iug&enc=utf8&section=kin&rank=18&search_sort=3&spq=0,해킹
1,2020.11.20,[],아무리 봐도 1년도 안걸려서 효과 90% 이상 코ㄹ나 백신 2개 나왔다는건,"돈에 눈먼 제약회사들이

안전성 은 뒷전이고

구라 깠을 확률이 높습니다........",['상업성 있다보니 그리 될 수도 있겠네요 '],1,https://kin.naver.com/qna/detail.naver?d1id=6&dirId=61303&docId=373766260&qb=67Cx7Iug&enc=utf8&section=kin&rank=2&search_sort=3&spq=0,사람과 그룹
1,2020.11.20,[],이정도 상처에도 파상풍이 감염되나요..?,"매립형 가스레인지 들다가 손이 날카로운 부분에 낑겨서 억지로 빼냈더니 이렇게 피가 나더라구요(연고 발라놨습니다)
가스레인지엔 기름때도 많이 끼어 있는 상태입니다

파상풍주사는 아마 10년도 더 전에 맞은 것 같아서 불안 합니다...ㅠ

내일 외과를 가야하나요 피부과를 가야하나요...?",['파상풍은 바늘에 찔려도 걸릴 수있습니다. 파상풍 예방주사의 예방 유효기간은 10년이나 보통 7년에 재 접종을 추천합니다.\n파상풍은 무조건 맞는 것이 이익입니다.\n예방주사 백신이 있는 곳이 별로 없습니다. \n미리 전화해보시고 하셔야 합니다.\n피부과 외과 어디든 백신이 있는 곳에 가시면 됩니다.\n병원에 다녀오세요.'],1,https://kin.naver.com/qna/detail.naver?d1id=7&dirId=70122&docId=373766054&qb=67Cx7Iug&enc=utf8&section=kin&rank=3&search_sort=3&spq=0,응급의학과
1,2020.11.20,[],토익 700달성,"제가 연말에서 연초쯤에 달성하려고 하는데
토익 700 그때쯤에 할 수 있을까요?
165점에서 690으로 올린 상태인데 10점부족합니다.
lc 400 rc 300입니다.

코로나 백신도 나오고 내년 4월부터 벚꽃구경도 가려고 합니다.

토익 700이나와야 공부를졸업할 수 있어서요.","['안녕하세요\n가능하네요 노력하세요\n답변이 도움 되셨다면 ""포인트로 감사""로 마음을 전해 주세요^^']",1,https://kin.naver.com/qna/detail.naver?d1id=8&dirId=80101&docId=373765753&qb=67Cx7Iug&enc=utf8&section=kin&rank=4&search_sort=3&spq=0,"연애, 결혼"
1,2020.11.20,[],목 간지러움 기침 코로나,한 나흘 전부터 목 안이 살살 간지러우면서 목을 긁어주는 듯한 기침을 하지 않으면 그 간지러움이 극대화 되는데 물을 먹어도 간지러움이 지속되고 또 참으면 왼쪽 눈이 깜빡이게 되다가 괜찮아 지거든요. 근데 목 간지러움과 비슷하게 많이는 아니고 좀 묽은 설사를 해서 코로나일까요? 목 안이 간지러운 거는 평균 하루에 2번 정도 그랬거든요... 집에서는 간지러웠던 적이 없는데 다 밖에서 그랬어요. 비염도 살짝있긴해서... 코로나면 어떡하죠,"['체질 문제 입니다  기름진음식  커피  피하세요\n티비  피시사용 시간 많이 줄이세요\n미국의 저명한 의학평론가인 프레데릭 박사왈\n""영양요법이 살리는 환자를, 약을쓰고 수술을하는 의학은 죽여버리고만다."" 라며 탄식하고있다.\n미국 뉴욕 내과외과 대학교수인 알론조클락크 박사왈\n""우리들이 쓰는 치료약은 모두가 독이며 따라서 한번 먹을 때마다\n환자의 활력을 떨어뜨린다. 병을 낫게하려는 의사들의 열성이\n도리어 심한 해를 입히고 있는 것이다. 자연에 맡기면 저절로\n회복될 것으로 믿어지는 많은사람들을 서둘러 묘지로 보내고있다."" 며 분개하고있다.\n[뉴잉글랜드 의학저널지]에서메이어박사왈\n미국과 캐나다에서 알려지지않은최대의 영양불량 지구는 지방의 슬럼도 도시의 빈민가가 아니다.바로 대도시의 병원\n입원실이 있는 병동이다."" 라고 규탄하고 있다.\n피아보 에어롤라 박사의 견해\n\'지난 2세기 동안 화학적 물리학적인 과학은 급속히 발달되었지만\n이것은 의학적 사상에 아주 나쁜 부정적인 영향을 주었고 치료\n기술도 퇴보 시켰다.표면상으로는 의학이대단히 진보되었다고\n선전하고 있지만장래에 언젠가 때가오면 20세기는 역사상 의학의 암흑시기였다고 기록될것이다.""\n5G 무선주파수 방사선의 위험성 의사들의 경고\nhttps://m.youtube.com/watch?v=5uXzSTwYJvo\n아일랜드 아이들 5G반대 ""우리는 방사선이 필요없어요""\nhttps://m.youtube.com/watch?v=F_EwcLGIz94\n대조선 삼한역사학회 최보식 고문님 연설 COVID19와 5G 그리고 인구감축\nhttps://m.youtube.com/watch?v=7I3uFqnswjU&t=25s\n코로나 사기극\nhttps://m.youtube.com/watch?v=NNOSz_pbBIE&t=822s\n제약회사 돈벌이 위한사기극 코로나\n바이러스가 사람을 죽인다는 증거를\n보여라!!\n백신을 맞은 아이가 더 많이 질병에 걸리는 미스테리https://m.youtube.com/watch?v=iCAr2uOVXyA&t=46s\n100조원 이 다국적 제약회사로빠져나가고있다https://m.youtube.com/watch?v=7Fu347mup-g\n손녀가 있는 대한민국의 모든 할아버지가 보아야 할 영상 [ 자궁경부암 백신사기극 ]https://m.youtube.com/watch?v=Eh0IuevMv5k\n세계 최고 최대의 의학 경전이며 원전이라고 일컬어지는 ""황제내경""의\n영추, 종시편 서문에 보면, 만병의 근원은 오장 육부의 음양, 허실, 한열에 있다\n하였으며, 또 말하기를 만병의 근원이 오장 육부에 있음은 하늘의 도리인데,\n이 도리를 믿지 않고 되지 못한 사방, 즉, 증상 치료, 병명 치료, 국소 치료,\n통계 치료를 하면 하늘의 파멸이 내린다고 하였습니다\n전미의학협회총회에서 프리스박사의 고백\n""현재 미국은 세계 유수의 의학국이 되었다.그러나동시에 세계 제일의 환자국이 되고 말았다.\n의학의 진보란주장은 완전히 넌센스다.지금 우리는 현대의학을 버려야하는 단계에 와 있는\n것이다.""\n10년 전에 계획된 록펠러 재단의\n코로나 사기극\nhttps://m.youtube.com/watch?v=Y53Sv0TZBao&t=1065s\n백신사기극\nhttps://m.youtube.com/watch?v=CzJU2kVO8bg&t=1105s\n눈에 보이지 않는 세상(바이러스)\n이 조화롭게 되있으면\n탈이 안나는것이고 너무 크게\n조화로움이 께지면 탈이나게되는\n거야 ! !\n특정한 바이러스가 병을 만드는게\n아니라고 .! !\n백신팔이 할려고 전염병이네,\n특정바이러스가 병을 만드네, 등등세뇌 작업이 언론 학교를 통해\n이루어진거지 수십년 동안...\n코로나가 사기극임을 보여주는 영상\nhttps://m.youtube.com/watch?v=NNOSz_pbBIE&t=431s\n백신에 독성 수은 들어있다\n다큐멘터리 안전한 백신\nhttps://m.youtube.com/watch?v=QUrYV7GfWss&t=480s', '코로나증상도 감기 증상과 비슷해서 많이들 걱정하시고 착각하시기도 합니다.\n코로나 증상은 일단 발열부터 시작하니 이점 참고해 주시구요\n증상이 심하시면 가까운 병원이나 약국에 내원하시는것도 좋은 방법입니다.\n다만, 싫으시다면, 가볍게 드실 수 있는 음식으로 고쳐보시는건 어떠실까 합니다.\n아래 링크를 보시고 증상에 맞는 음식으로 증상 완화에 도움이 되시면 좋겠습니다.\n목이 간지럽고 기침이 날때\n목이 간지럽고 기침이 날때 안녕하세요! 날씨가 별안간 추워졌어요. 아침, 저녁으로는 쌀쌀하고 낮에는 더워서 감기걸리기가 쉬우니 조심하세요. 감기에 걸리면 목이 간지럽고 기침이 납니다. 기침은 감기나 기..\nki.shforu20.com', 'http://m.blog.naver.com/okiii1205/222168546450\n코로나 목감기(목간지러움, 목아픔) 차이 (feat. 국내 코로나 백신 누가, 언제, 얼마에 접종할 수 있나?)\n코로나 목감기 차이코로나19의 가장 흔한 증상은 발열, 마른기침, 피로이며 그외 후각 및 미각 소실, 근육...\nm.blog.naver.com\n참고하세요 ']",3,https://kin.naver.com/qna/detail.naver?d1id=7&dirId=7010101&docId=373764430&qb=67Cx7Iug&enc=utf8&section=kin&rank=5&search_sort=3&spq=0,호흡기내과
