page,date,tags,questions,questions_add,answers,N_answer,url,category
11,2020.11.08,['#자궁경부암예방주사'],"가다실 9가, 4가 백신으로 막을 수 없는 HPV바이러스","HPV 바이러스 검사를 했는데 9가, 4가를 맞아도 예방하지 못하는 바이러스는 걸리면 어떻게 해야하나요? 그냥 걸린채로 살아가야 하는건가요...? 아무리 청결하게 씻고 관리해도 계속 바이러스가 남아있는건가요? 성관계를 하게될시, 그냥 손으로 만질시, 구강성교를 하게될시 어떻게 되는건지 궁금합니다(감염여부나 그후에 취해야할 행동이라던지 유의사항)","['HPV 바이러스 검사를 했는데 9가, 4가를 맞아도 예방하지 못하는 바이러스는 걸리면 어떻게 해야하나요? 그냥 걸린채로 살아가야 하는건가요...? 아무리 청결하게 씻고 관리해도 계속 바이러스가 남아있는건가요? 성관계를 하게될시, 그냥 손으로 만질시, 구강성교를 하게될시 어떻게 되는건지 궁금합니다(감염여부나 그후에 취해야할 행동이라던지 유의사항)\n답변; 말그대로 예방접종이고 권유받았다면 9가가 훨씬 좋고요. 맞고 안맞고는 본인 결정이시고요. \n6개월에서 1년에 한번씩 자궁경부암검사 정기검지 받으세요  바이러스기에 몸에있다면 씻는다고 없어지진않아요 하지만 성관계할때는 이왕이면 깨끗하게 하는게  여러모로 좋겠지요.', '안녕하세요. 성남시 수진역 4번출구 인근에서 소음순성형, 여성 곤지름(콘딜로마, 생식기사마귀), 성인예방접종(폐렴, 대상포진, 자궁경부암-가다실)을 중점적으로 하는 산부인과 전문의 변재광입니다. \n어떤 백신도 100퍼센트 예방해주는 것은 없습니다. 성접촉이 주요매개체기 때문에 파트너가 많을 수록 감염위험이 커지겠죠. 콘돔도 사용하시는 것이 좋겠구요. 감염예방을 할 수 없는 방법으로 하지 않으시는 것이 좋겠죠. 면역력을 늘리시는 것도 좋구요. \n인유두종바이러스(HPV)는 성적 접촉을 통해 주로 전염되며 성생활을 하는 남녀 누구나 감염될 수 있는 바이러스로 성인인구의 70%는 일생동안 한번의 생식기 HPV감염을 경험할 수 있습니다. \nHPV는 자궁경부암의 약 70%, 여성 생식기사마귀(곤지름, 콘딜로마)의 약 90%의 원인으로 알려져있습니다. \n2006-2011년 만 18-79세의 우리나라 성인 여성 6만명 대상 조사 결과, 평균 약 3명 중 1명에서 HPV 감염이 보고되었고 그중 만 18-29세의 젊은 여성에서 가장 높은 약 50%에 가까운 높은 HPV 유병률을 보였습니다. 미국에서는 성생활을 하는 여성 중 50세가 될 때까지 HPV에 감염될 수 있는 비율이 80% 이상이라고 예측하고 있습니다.\n자궁경부암 예방접종은 미혼이나 관계를 시작하기 전에 접종할 수록 효과가 높습니다. \n그리고 기혼자나 성관계를 하신 분들에게 성관계 경험이 있는 경우도 70~80%의 예방효과가 있습니다.\n또한 성관계시 인유두종바이러스를 옮길 수 있으므로 남성분도 함께 맞으시는것을 권합니다. 요즘 자궁경부암예방백신의 광고모델에 남성이 주인공으로 나오고 있죠. \n자궁경부암 예방접종은 현재 세가지 종류의 백신(가다실4가 가다실9가, 서바릭스)접종이 가능하며 세가지 백신 모두 자궁경부암을 90% 예방할 수 있고, 이전 HPV에 감염된 적이 있는 경우도 70~80%의 예방효과가 있습니다.\n가다실9은 HPV 감염에 의한 자궁경부암, 외음부암, 질암 (여성 해당), 항문암 및 생식기 사마귀 등을 예방할 수 있으며, 성별 관계 없이 남녀 모두 접종할 수 있는 HPV 백신입니다. 가다실9은 가다실(4가)과 비교하여 만 16-26세 여성에서 HPV 31, 33, 45, 52, 58형 관련 자궁경부암, 외음부암, 질암 및 전암 병변에 대한 96.7%의 예방 효과를 보였다고 보고되었습니다. \n가다실9은 2014년 FDA 승인 이후, 미국, 유럽, 캐나다를 포함한 전세계 77개국에서 승인받았습니다. 미국 CDC에서는 2016년 4월부터 국가 접종 프로그램의 HPV 백신을 가다실9으로 변경했습니다.\n특히 여성 곤지름(콘딜로마, 생식기사마귀)에 대한 예방이 가능한 유일한 백신은 가다실입니다. \n자궁경부암 예방접종의 접종기간은 총 6개월 내 3회 접종을 마쳐야 하며, 1차 접종 뒤 2개월 뒤, 2차 접종 뒤 4개월 뒤 입니다.\n출산하고 수유중인 수유부도 백신은 수유부에게 접종이 가능합니다. 수유중인 수유부에 접종했을 때 이 백신에 의해 유도된 백신 항원 또는 항체가 유즙으로 이행되는지에 대해서는 알려진 바 없습니다. \n더 자세히 자궁경부암 예방접종 상담 받고 싶다면 자궁경부암 예방접종이 가능한 산부인과에 내원하여 상담을 받아 보시기 바랍니다.\n자궁경부암주사 맞을 때 통증은 일반주사제 아픈 정도하고 비슷합니다. 아이가 맞아도 아픈지 모르겠다고 하기도 하구요. 사람마다 통증느끼는 건 조금씩 다르죠. \n면역력이 약하시거나 기저질환을 가지고 계시다면 접종을 권장해드립니다.', '자궁경부암 예방접종 가다실 9가 가격 알아보기~\n안녕하세요~ 건강한 삶을 사는 건강맨입니다. 올해 초 코로나 19로 시작되어 현재는 독감 예방접종 등 바이러스로 인한 문제가 심각한데요. 오늘 알아보고자 하는 자궁경부암 또한 HPV라 불리는 인유두종 바이러..\nmoneylover.tistory.com']",3,https://kin.naver.com/qna/detail.naver?d1id=7&dirId=7011404&docId=372773814&qb=67Cx7Iug&enc=utf8&section=kin&rank=102&search_sort=3&spq=0,여성질환
10,2020.11.08,"['컴퓨터보안', '백신프로그램', '멜웨어', '웜바이러스', '트로이목마', '컴퓨터공학', '랜섬웨어', '바이러스수리', '컵퓨터바이러스', '컴퓨터']",바이러스 없이 다운받는법,"동생이 마크 하고 싶다고 해서
컴터에 마크 무료로 찾고 있는데
결국 많이들 하지만 어둠의 경로라서
바이러스 걱정이 되네요..
짜피 게임 설치는 해줘야하는데 ㅠㅠ
exe파일 실행 했더니 다른 바이러스 exe 파일들이 같이 실행되네요..다시 백신 켜서 하나 하나 지웠어요 .
지금 찾은 파일에서 바이러스만 빼고 마인크래프트 파일들만
다운받을순 없나요?",['그렇게 받는 방법은 없습니다. \n그렇게 하려면 파일을 열고 악성코드 부분 제거하고 \n다시 컴파일링을 해야 하는데 \n그렇게 치료를 하는 백신은 없습니다. \n외래 유입 파일은 삭제가 치료입니다. \n자동 압축 풀림 파일의 경우라고 해도 \n악성 파일들만 분류하는 건 불가능하다고 보면 됩니다. \n또 애당초 마인크래프트 파일들은 아예 포함이 안 되었을 가능성이 높습니다. \n제가 예전에 다음 팁에서 답변들을 하다가 보면 \n마인크래프트 불법으로 받다가 컴퓨터 망친 사람들 많았습니다. '],1,https://kin.naver.com/qna/detail.naver?d1id=1&dirId=110&docId=372780200&qb=67Cx7Iug&enc=utf8&section=kin&rank=99&search_sort=3&spq=0,보안
