page,date,tags,questions,questions_add,answers,N_answer,url,category
56,2007.09.03,[],집에서 혼자 힙합댄스 배우기,"안녕하세요~~
 바로 본론으로 들어갈게요~
 제가 5학년인데 요번에 반장이 됬어여~~
 근데 극기훈련에서 반장들 춤 시킨다드라구여~
 제가 섹시댄스 쪽은 아니어서 힙합댄스를 추려고 하는데
 동영상을 보고 따라하려하거든여~
 학원은 시간도 없고
 그래서 초보자도 쉽게 따라할 수 잇는 힙합댄스 동영상점....
 아, 그리구 판도라TV 깔면 머 바이러스 없애는 백신 같은거 자동으로 깔아져여?
 웬만한 게 다 판도라여서...
 그럼 잘부탁드려여~
  ","['네.. 혼자 배우시면 요상한 동작 그대로 답습되지여..\n 학원같은 곳을 가세요..\n 정 힘드시면 동영상을 보는게 낫겠져??\n 춤추는 유형도 여러가지가 있답니다..\n 먼저. 자기가 잘추는줄 아는 타입\n 박자가 안 맞춰져서 하면서도 이상하다 느끼는 타입.\n 리듬은 타는데 표현이 안되는 타입..\n 등등 의욕은 앞서지만 효과적으로 춤을 추지는 못하는 안타까운 유형들입니다..\n 힙합이란게..쉬워보이면서도 막상 따라하면 가장 느낌내기도 힘들고\n 정확도도 떨어지는 춤이거든요..\n 이번기회에 학원다니심을 추천해요..\n 참고.. 저는 댄스조아라는 학원을 다니는데..\n 와서 성격도 밝아지고..\n 춤도 .. 정말 진짜 많이 늘었어요.. 보장함돠.. 하하..\n 일단.. 네이버나.싸이등에서 검색해 보시고.. 함 알아보셔요.. 그럼 꾸벅', '안녕하세요!!\n집에서 혼자 댄스를 배워보시려고 하는 것 같아요~~\n저도 댄스를 좋아해서 집에서 배울 수 있는 방법을 찾아보았는데요.\nhttp://bit.ly/2uf3jg0 제가 찾은 사이트 주소 남겨드릴게요!!\n같이 화이팅해봐요~~']",2,https://kin.naver.com/qna/detail.naver?d1id=3&dirId=31101&docId=50681133&qb=67Cx7Iug&enc=utf8&section=kin&rank=551&search_sort=3&spq=0,"힙합, 브레이크 댄스"
55,2021.04.25,[],의료계 기타종사자 백신접종,"의료시설에서 기타종사자로 일하고있어요
백신접종을 어떻게 해야하는지 궁금해요
기타종사자 이기에 의료인은 아닙니다","['요즘 백신 많이 맞고 있고, 부작용도 많이 나고 있고, 많이 죽고 있습니다.\n더 좋은 백신이 나올때까지 기다려보시는게 어떨지요?\n지금 남는 백신들 시골 사람들보고 맞으라고 한다고 들었어요.\n제친구들도 회사에서 맞으라고 하는데 안맞고 있습니다.\n채택해주시면 감사하겠만 안해주셔도 괜찮아요.\n코로나시기에 건강유의하시구요. 감사합니다.', '요즘 백신 많이 맞고 있고, 부작용도 많이 나고 있고, 많이 죽고 있습니다.\n더 좋은 백신이 나올때까지 기다려보시는게 어떨지요?\n지금 남는 백신들 시골 사람들보고 맞으라고 한다고 들었어요. http://m.site.naver.com/0LPhv\n<코로나 백신 접종> 시기, 순서, 나이, 우선순위\n<코로나 백신 접종> 시기, 순서, 나이, 우선순위 2월 26일부터 코로나에서 벗어나기 위한 희망인 코로나 백신 접종이 시작이 되었어요. 대통령을 시작으로 전국에 백신이 배달되어 각 지역마다 1호 ..\nm.site.naver.com', '잔여백신 접종이 가능합니다. 카카오 네이버를 통해서 간단하게 예약\n가능한데 본인 인증과 조건이 맞으면 예약 가능합니다.\n1차 후 11주 같은 요일에 가서 2차도 맞으시면 되구요.\n해당 내용 정리해두었으니 글 확인하셔서 꼭 백신 신청하셨으면 합니다.\n코로나 노쇼 백신 카카오 네이버 예약\n코로나 노쇼 백신 소식이 들렸고 많은 분들이 예약 문의를 하신것으로 알고 있습니다. 코로나 노쇼 백신 가장 빠르게 카카오, 네이버를 통해 예약하실 수 있습니다. 코로나 노쇼 백신 예약 아래에서 바로 하실 수..\nm.site.naver.com']",3,https://kin.naver.com/qna/detail.naver?d1id=8&dirId=8020501&docId=388149744&qb=67Cx7Iug&enc=utf8&section=kin&rank=548&search_sort=3&spq=0,맥주
55,2021.04.25,[],코로나 백신 접종,지인이 접종 대상자가 아님에도 모 병원에서 백신 예약자가 안와서 남는 코로나 az백신을 맞았다고 합니다 그런 일이 가능한가요?,"['코로나 백신 접종대상자별로 접종시기 안내 후 예방접종 정보제공 누리집을 통해 인터넷으로 사전예약하거나 콜센터 1339번으로 신청하게할 예정입니다.\n문자 혹은 국민비서서비스를 통해 접종장소 및 일시를 안내하고 예약사실을 확인은 콜센터에서도 가능하도록 할 예정입니다.\n<코로나 백신 접종> 순서, 횟수, 나이, 우선순위, 시기, 방법\n대한민국 국내 코로나 백신 접종 코로나 백신 접종시기 _  먼저 국내 코로나 백신 접종대상은(?) 대상은 전국민 입니다. (단 백신 개발과정에서 임상시험에 포함되지 않은 임신부와 18세 미만 소아청소년은 접종..\nzero-news.tistory.com', '코로나 백신 접종대상자별로 접종시기 안내 후 예방접종 정보제공 누리집을 통해 인터넷으로 사전예약하거나 콜센터 1339번으로 신청하게할 예정입니다.\n문자 혹은 국민비서서비스를 통해 접종장소 및 일시를 안내하고 예약사실을 확인은 콜센터에서도 가능하도록 할 예정입니다. http://m.site.naver.com/0LPhv\n<코로나 백신 접종> 시기, 순서, 나이, 우선순위\n<코로나 백신 접종> 시기, 순서, 나이, 우선순위 2월 26일부터 코로나에서 벗어나기 위한 희망인 코로나 백신 접종이 시작이 되었어요. 대통령을 시작으로 전국에 백신이 배달되어 각 지역마다 1호 ..\nm.site.naver.com', '버려지는 백신이 안생기도록..\n근처 예방접종하는 의료기관에 대기순번을 예약해두면 혹시나 그날 예약자 중 미접종자 발생시 순번대로 연락이 온다고해요...\n연락받고 바로갈수있으면 백신접종이 가능하다고 하네요.', '네 지금 노쇼 백신 예약이 가능합니다.\n본인인증 후 예약을 하시고 1차 접종 후 11주 뒤 같은 요일에 2차 접종을 하시면 되는데\n카카오, 네이버로 예약하는 방법 정리해두었습니다. 확인해보세요. 도움 되실 겁니다.\n꼭 잔여 백신 접종 성공하세요\n코로나 노쇼 백신 카카오 네이버 예약\n코로나 노쇼 백신 소식이 들렸고 많은 분들이 예약 문의를 하신것으로 알고 있습니다. 코로나 노쇼 백신 가장 빠르게 카카오, 네이버를 통해 예약하실 수 있습니다. 코로나 노쇼 백신 예약 아래에서 바로 하실 수..\nm.site.naver.com', '잔여 백신 조회의 경우 \n27일 오후 1시부터 조회가 가능합니다. \nhttps://bit.ly/3uuj23D\n코로나 백신 접종 예약 및 잔여 백신 조회, 예약 방법 - 알아두면 쓸모있는 정보\n코로나 백신 접종 예약이 5월 부터 진해잉 되고 있습니다. 이에 따라 잔여 백신의 당일 예약이 진행되고 있으며, 27일부터 잔여 백신 검색을 통해 의료 기관 조회 후 당일 잔여 백신을 접종 받을 수 있다고 합니다.\nbit.ly']",5,https://kin.naver.com/qna/detail.naver?d1id=7&dirId=7010107&docId=388136851&qb=67Cx7Iug&enc=utf8&section=kin&rank=550&search_sort=3&spq=0,감염내과
55,2021.04.25,[],코로나 백신 접종,지인이 접종 대상자가 아님에도 모 병원에서 백신 예약자가 안와서 남는 코로나 az백신을 맞았다고 합니다 그런 일이 가능한가요?,"['코로나 백신 접종대상자별로 접종시기 안내 후 예방접종 정보제공 누리집을 통해 인터넷으로 사전예약하거나 콜센터 1339번으로 신청하게할 예정입니다.\n문자 혹은 국민비서서비스를 통해 접종장소 및 일시를 안내하고 예약사실을 확인은 콜센터에서도 가능하도록 할 예정입니다.\n<코로나 백신 접종> 순서, 횟수, 나이, 우선순위, 시기, 방법\n대한민국 국내 코로나 백신 접종 코로나 백신 접종시기 _  먼저 국내 코로나 백신 접종대상은(?) 대상은 전국민 입니다. (단 백신 개발과정에서 임상시험에 포함되지 않은 임신부와 18세 미만 소아청소년은 접종..\nzero-news.tistory.com', '코로나 백신 접종대상자별로 접종시기 안내 후 예방접종 정보제공 누리집을 통해 인터넷으로 사전예약하거나 콜센터 1339번으로 신청하게할 예정입니다.\n문자 혹은 국민비서서비스를 통해 접종장소 및 일시를 안내하고 예약사실을 확인은 콜센터에서도 가능하도록 할 예정입니다. http://m.site.naver.com/0LPhv\n<코로나 백신 접종> 시기, 순서, 나이, 우선순위\n<코로나 백신 접종> 시기, 순서, 나이, 우선순위 2월 26일부터 코로나에서 벗어나기 위한 희망인 코로나 백신 접종이 시작이 되었어요. 대통령을 시작으로 전국에 백신이 배달되어 각 지역마다 1호 ..\nm.site.naver.com', '버려지는 백신이 안생기도록..\n근처 예방접종하는 의료기관에 대기순번을 예약해두면 혹시나 그날 예약자 중 미접종자 발생시 순번대로 연락이 온다고해요...\n연락받고 바로갈수있으면 백신접종이 가능하다고 하네요.', '네 지금 노쇼 백신 예약이 가능합니다.\n본인인증 후 예약을 하시고 1차 접종 후 11주 뒤 같은 요일에 2차 접종을 하시면 되는데\n카카오, 네이버로 예약하는 방법 정리해두었습니다. 확인해보세요. 도움 되실 겁니다.\n꼭 잔여 백신 접종 성공하세요\n코로나 노쇼 백신 카카오 네이버 예약\n코로나 노쇼 백신 소식이 들렸고 많은 분들이 예약 문의를 하신것으로 알고 있습니다. 코로나 노쇼 백신 가장 빠르게 카카오, 네이버를 통해 예약하실 수 있습니다. 코로나 노쇼 백신 예약 아래에서 바로 하실 수..\nm.site.naver.com', '잔여 백신 조회의 경우 \n27일 오후 1시부터 조회가 가능합니다. \nhttps://bit.ly/3uuj23D\n코로나 백신 접종 예약 및 잔여 백신 조회, 예약 방법 - 알아두면 쓸모있는 정보\n코로나 백신 접종 예약이 5월 부터 진해잉 되고 있습니다. 이에 따라 잔여 백신의 당일 예약이 진행되고 있으며, 27일부터 잔여 백신 검색을 통해 의료 기관 조회 후 당일 잔여 백신을 접종 받을 수 있다고 합니다.\nbit.ly']",5,https://kin.naver.com/qna/detail.naver?d1id=7&dirId=7010107&docId=388136851&qb=67Cx7Iug&enc=utf8&section=kin&rank=549&search_sort=3&spq=0,감염내과
55,2021.04.27,"['경찰백신', '백신', '아스트라제네카', '인권']",경찰 백신 접종 취소,안녕하세요. 17살 학생입니다. 저희 아버지께서는 경찰이신데 고지혈증과 고혈압이 있으셔서 백신을 맞지 않으려고 하셨는데 서에서 거의 강제적으로 강요를 해서 맞게 되셨어요. ㅜㅜ 5월 6일에 백신 접종을 하시는데 혹시 취소하거나 신고할 방법은 없나요? 저와 저희 가족들이 다 걱정하고 있어요. 최대한 빨리 부탁드려요 ㅜㅜ,"['현재 경찰내부에서는 자유라고 하고 강압적인 백신 신청률 파악 또는 독려문자를 보내는데 반발하고 있으며\n아버지가 고지혈증 및 고혈압이 있으시면 본인이 맞으신다고 하여도 의사 문진에서 접종불가가 나올수도 있어요\n본인이 기저질환이 있으시면 되도록 안정적인 백신을 맞는게 좋다고 생각되네요', 'https://www1.president.go.kr/petitions/597724\n아트라제네카 백신 군인, 소방관, 경찰 접종 중단 요청 > 대한민국 청와대\n나라를 나라답게, 국민과 함께 갑니다.\nwww1.president.go.kr\n저희 아버지도 경찰이셔서 진짜 걱정 많이 하고 있는데 이거 퍼뜨려주세요 반강제 접종 반대 청원입니다ㅠㅠ', '백신 취소 가능합니다. 백신 사이트를 이용하시면 되는데 해당 내용 정리해두었습니다.\n너무 걱정하지마시고 내용 확인해보세요.\n백신 예약 신청 변경 취소 방법 신청사이트\n백신 예약 신청 사이트 변경 방법 궁금하시죠. 신종 코로나바이러스 감염증 백신 접종 예약 첫날 24만명이 넘는 대상자가 예약을 했다고 합니다. 이는 노인 대상으로 70~74세를 대상으로 한 예약 신청인대 상당히..\nm.site.naver.com', '백신 예약 취소 변경 할 수있습니다. 백신 취소 전 확인해야할 상황 그리고 방법\n정리해두었습니다. 어렵게 예약 하신만큼 잘 취소하셔서 불이익 없으셨으면 합니다.\n아래 글을 확인해주세요.\n백신 예약 신청 변경 취소 방법 신청사이트\n백신 예약 신청 사이트 변경 방법 궁금하시죠. 신종 코로나바이러스 감염증 백신 접종 예약 첫날 24만명이 넘는 대상자가 예약을 했다고 합니다. 이는 노인 대상으로 70~74세를 대상으로 한 예약 신청인대 상당히..\nm.site.naver.com']",4,https://kin.naver.com/qna/detail.naver?d1id=6&dirId=61404&docId=388337551&qb=67Cx7Iug&enc=utf8&section=kin&rank=547&search_sort=3&spq=0,"정치인, 공무원"
55,2021.04.28,[],화이자 괜찮다고 맞았다가 끝내 사망한 그 어머니,"종종 화이자 확보하고아스트라 가져오지말아라

화이자가 괜찮다는 근거없는 여론들이 떠돌아다닙니다.


백신의 심각한 부작용에도 불구하고 

방송에서 백신광고하고 자빠지고 있네요 

현실이랑은 너무나결과가 다릅니다.ㅠ

당한사람만 억울하게 되나요???

백신은 문제없다고 말하는 문정부 대체 왜이럽니까??? 


살인 백신을 강제접종하니 우리나라가 한국인지 북한인지 넘나 소름돋습니다. 개인의 자유로 둘것이지 75세 어르신들 방문동의 받겠다고 아파트방송나오는데 얼마나 많은 사람들을 죽이려하는지 책임감없고 국민 목숨을 파리보다 못하게 생각하는 행태에 화가나네요.

면역전문가이신 서울대 이왕재 교수님이 말씀하셨네요. 사람들이 백신이라고 하면 다 똑같다고 생각하는 게 문제다. 호흡기 바이러스는 백신 가지고 안 된다는 걸 이해해야 한다. 바이러스가 혈액을 타고 다니면서 질병을 일으키는 경우는 백신이 100% 유효하다. 코로나19 바이러스는 상기도(코점막, 인후두 점막)에 감염되는 것인데 백신으로 인한 혈중 항체가 접근 자체가 불가능하다. 예방할 길이 없다.

우리 가족들, 친척들, 친구들, 우리국민들 목숨 지키고 싶습니다.
살인백신 강제접종 반대하고 살길을 찾고싶습니다.
백신으로 고통받고 장애인 되시고 돌아가신 분들 모두 가슴아픕니다. 어떻게 해야하나요?

https://www.upinews.kr/newsView/upi202101280070

https://www.news1.kr/articles/?4183109","['거리두기 없이 5천 명 콘서트...""코로나19 확산 안 돼"" 출처 : YTN | 네이버\n- http://naver.me/GVA4a1yY\n● 신종감염병 중앙임상위원회 위원장인 오명돈 교수 -  코로나에대한 위험성이 과하게 인식된 상태이며, 바이러스 공포가 더 큰 피해를 준다고 함\nhttps://www.sisain.co.kr/ne\n비과학적 사실이 사람들의 삶과 목숨에 미치는 영향에 대해 오랫동안 고민해온 오 교수는, 코로나19를 만난 사회를 보면서도 비슷한 느낌을 받는다. \n“제가 보기에는 아닌데, 판단하기에는 아닌데, 떨칠 수 있는데….”\n""젊은 환자들, 50대 이하는 별 문제 없이 치료 잘 되고, 별일 없이 퇴원해요. 아이들은 감기보다도 더 가볍다고 얘기할 정도로 문제없어요.""\n“우리나라 감염자 치사율 0.1%입니다, \n..이거는 수치고 논리란 말이에요. 이런 것들이 국민들에게 전달이 잘 안 돼요. 많은 국민이 화면에서 봤던 것들, 어떤 사람이 걸렸는데, 나은 뒤에도 정신이 오락가락하고 폐가 망가졌다 등등의 스토리만 기억에 남아 있는 거예요. 실제 측정한 이 병의 위험성과 괴리가 있어요.""\n●김윤희 전 식약처 심사위원\nhttp://m.medicaltimes.com/NewsView.html?ID=1139657\n"" 코로나-19 바이러스는 기존 감기 바이러스와 다를 바 없다는 부분에 대해서 현 시점에서는 이 의견이 타당하다고 생각한다. \n최근 코로나 확진자 추이를 보면, 이제 코로나-19 감염은 지역 사회에 널리 퍼져, 이 바이러스가 인간과 편안하게 공존하고 있는 듯한 양상이다. \n일일 확진자가 날마다 300명 이상이지만, 음압병실과 감염병전담병실은 남아 돌고 있고, 사망률도 낮아지고 있다.\n이 정도면 독감보다도 중증으로의 이환율, 치사율이 낮아 보인다.""\n●확진자의99%는 환자가 아니다\nhttps://youtu.be/5IPHRTP5_QI\n영상의 유태우 박사님 - 현 닥터U와 함께 원장, 전 서울대학병원 과장,서울대 의대 교수.\n과도한 코로나스트레스를 갖고 계신 분들에게 추천하는 영상.\n(영상 핵심 내용)\n코로나 확진자의 99%는 환자가 아닙니다. \n1% 빼고는(그마저도 면역력 결핍상태이고 기저질환자인 경우가 많은) 대부분 증상이 없습니다. \n있어봤자 열 ,기침 수준이라 의료진과의 접촉도 거의 없이 3주이상 사람,외부와의 차단 속에 고립되어가는 격리의 고통을 겪다 나옵니다. \n‘특별한 치료\'를 받은 것이 아니니 \'완치자\' 라고 할 것도 없습니다.\n매년 독감 환자의 수는 코로나19 확진자 못지 않습니다.\n(심지어 독감은 코로나처럼 전 세계적으로 대대적인 테스트를 시행하지도 않는데도) \n독감의 중증환자 비율은 1%인 코로나19 보다 더 높은 5% 입니다. \n그런데 독감의 중증환자 비율은 코로나19보다 더 높은데도 불구하고 사망률은 0.1%로 매우 낮습니다. \n●전 대한면역학회 회장이자 서울대 의대 이왕재 교수\n-코로나19 글로벌 판데믹과 유전자 백신의 문제점에 대한  명쾌한 강의\nhttps://www.futurekorea.co.kr/news/articleView.html?idxno=131844\n《과장된 사망률》\n코로나 19 사망자로 분류되는 사망자들은 정신질환, 치매, 암, 고혈압, 당뇨, 신부전, 간부전, 심부전 등 다양한 기저질환을 가진 노령의 환자가 대부분이다.\n...그런데 질병 관리청은 사망자의 검체에서 코로나 19 바이러스가 검출되었다는 이유로 모두 코로나19에 의한 사망이라고 통계를 내고 있다.\n...부검도 없이 사망자들의 호흡기 점막에서 코로나 19바이러스가 검출되기만 하면 코로나19에 의한 사망자로 통계를 내고 있는데, 이는 의료인의 상식으로는 도저히 이해할 수 없는 일이다.\n-책 코로나 미스터리\n보건당국이 코로나로 인한 사망자와 코로나 양성 사망자를 구분하지 않아, 기저질환 때문에 죽은 사망자들 조차 죽기 직전 혹은 죽은 후라도 검사에서 양성이 나오면 코로나 사망자로 집계된다.\n- 책 코로나 팬데믹,무엇이 효과적인 대처인가\n(독일출간 10개국 베스트셀러,원제목 코로나 거짓 경보)\n《과장된 확진자 수》\n  - PCR 테스트는 ""실시간"" 바이러스와 비활성(비감염) 바이러스 입자를 구별할 수 없으며\nRNA 입자를 검출하는 데 사용되는 증폭 주기의 수인 사이클 임계값(CT)이 높을수록 거짓 양성일 가능성이 커진다. 34 사이클 이상, PCR 양성 테스트가 진정한 양성일 확률은 0으로 축소된다.\nhttps://articles.mercola.com/sites/articles/archive/2020/12/18/pcr-test-reliability.aspx\n-유럽 임상미생물감염병학저널(European Journal of Clinical Microbiology and Physis)의 2020년 4월 연구에23 따르면 100% 확인된 실제 양성반응을 얻으려면 PCR 검사가 단 17 사이클에서 실행돼야 한다. 17 사이클 이상이면 정확도가 급격히 떨어진다.\nhttps://articles.mercola.com/sites/articles/archive/2021/02/19/covid-pcr-test-fraud.aspx\n- 코로나 검진 테스트의 문제점을 인정한 포르투칼 법원\n법원은 코로나19 감염을 판단하는 PCR 테스트의 양성 판정이 감염을 보장하는 과학적인 증거가 되지 못한다고 지적했다. “누군가를 PCR 테스트로 양성으로 판단할 때, 35회 이상의 사이클이 사용된다면 검진자가 실제 양성일 확률은 3% 미만으로, 즉 97%의 거짓 양성 확률을 보인다.”\nhttp://conspiracynews.co.kr/?p=13588\n토니 파우치(Anthony Fauci)는 또한 PCR 테스트의 문제를 인식하여 ""치명적인 결함""이라고 부른다.\n유럽의 소송에서는 코로나 바이러스(Covid-19)를 탐지하기 위해 널리 사용되는 PCR 테스트가 최대 97%까지 신뢰할 수 없다는 사실을 입증했다. \nhttps://humansarefree.com/2020/11/bombshell-fauci-states-covid-test-has-fatal-flaw.html\n인도에서 PCR 테스트에 사용되는 주기 임계 값(Ct 값)은 37~40이므로 PCR 검사의 신뢰도는 3% 미만이고 위양성률은 97% 이상이다.\nhttps://greatgameindia.com/false-positive-covid-19/\n-현재 우리가 사용하는 코로나바이러스 검사는 몇 사이클을 기준으로 하고 있을까? 이에 대한 내용은 올해5월에 발표된 논문 <COVID-19테스트 결과 해석> 에 나와 있는데, 코로나 바이러스의 경우에는 진단키트에 따라 차이가 있으나 보통 CT값 35를 기준으로판단한다고 한다.’\n-코로나 미스터리 164p\n- 파파야도 양성이 나오는 코로나19 진단 테스트\n“우리는 염소와 파파야 샘플을 채취해 WHO 연구원 몰래 실험실로 가져갔다. \n진단 결과는 ‘양성’이었다. \n모든 파파야가 격리되어야 한다는 의미다. \n우리는 이 테스트에 더러운 공작이 있음을 알아야 한다.” 2020년 5월, 탄자니아 대통령 존 마구풀리""', '지금 인도가 어떤 상태인지 확인부탁드립니다..\n한순간에 인도와 같은 사태가 발생할수도 있습니다.\n병원에 직원으로 근무하고 있어서 이번주에 AZ 접종하는데요..\n두렵지만 저로 인하여 같이 근무하는 직원이 코로나19감염되거나 환자가 저 때문에  코로나19에 감염될까봐\n무섭고 두렵지만 접종하려고 신청하였습니다..\n저 같은 생각은 하시는 병원에서 근무하는 분들 만하고 들었습니다.', '지금 한국이 코로나 방어 잘하니까 코로나가 진짜 감기인줄 아시는지 ㅋㅋㅋ 전세계가 마비될정도로, 전쟁보다 사람 더 죽어가는 재앙이거든요ㅋㅋㅋ\n우리나라같이  막는나라가 세손가락밖에 안돼요\n안전한 환경에서 살면서 진짜  속 편한 소리하네\n외신 좀 보면서 현실감각 좀 키우시길\n아 진짜 안 맞는건 좋은데 집에 쳐박혀서 남에게 옮길 생각만 하지말길요~^^', '제가 보기에는 지금 저 빼고 글 쓰고있는 양반들 다 조선족 댓글 알바입니다.\n코로나는 건강한 사람을 죽이는 바이러스가 아닙니다 \n예를 들면 현 코로나 사망자가 1828명이고 자살자가 19년 기준 13000명\n대한민국 사망률 1위가 암입니다.\n정상적인 국가이면 인구보존을 위해 리스크 높은 백신을(맞으면 몸에 자석이 붙는) \n코로나 백신을 맞추는게 아니라 우한폐렴보다 사망자 또는 사망률이 높은 것들을\n방지하기 위해 노력해야 할 것입니다.\n주위분들에게 되도록 마스크 벗고다니고 백신도 맞게해선 안되며 꾸준히 체력 및 건강\n유지하세요 \n꼭 살아야합니다 ㅠ', '백신 !\n믿어야하는지? \n 말아야 하는지?\n아스트라제네카는 실온보관 시간 제대로 안지키면  부패가 되나봅니다.\n그걸 맞은 사람은 생명의 위태로움이 있는것 같은데.......\n맞아야 하는것이 옳은지?\n안맞는것이 좋은건지?\n걍 마스크 잘쓰고  손 잘씻고  사람 믾은 곳  가지 말고 ......\n이렇는게 좋은지......\n어서 빨리 균을 박멸 하는 방법 이 최고 일것 같은데요']",5,https://kin.naver.com/qna/detail.naver?d1id=3&dirId=30102&docId=388380835&qb=67Cx7Iug&enc=utf8&section=kin&rank=546&search_sort=3&spq=0,"연예, 오락"
