page,date,tags,questions,questions_add,answers,N_answer,url,category
10,2019.07.10,"['#스팸메일', '#지식인카드', '#랜섬웨어']",랜섬웨어 의심메일인지 좀 봐주세요~~,"랜섬웨어 의심메일인듯... 어떻해야할지???

집안쪽 사무실이기에 아무생각없이 파일을 다운 받았습니다.
웹화면으로 접속되길래 그냥 삭제하고
이것저것 앱 돌렸는데... 엄청 찝찝합니다.
물론, 그화면에 입력한것은 없습니다.

이거 이상한거 맞죠?
어떻게 조치해야할까요?
고수님들 부탁드려요.~~~","['안녕하세요. 기업메일 전문기업 메일플러그 입니다.\n첨부파일을 다운받아 실행하시거나, URL 사이트로 들어가 정보를 입력하신 이력이 있다면 가장 먼저  메일 비밀번호 변경을 꼭 하여 이용해 주세요.\n첨부파일을 다운받아 실행하신 경우, 악성코드가 감염될 가능성이 있기 때문에 백신 검사와 함께 PC 점검이 필요합니다.\nPC 점검이라 함은 인가되지 않은 프로그램이 설치되어 있다면 삭제해 주시고, 인터넷 브라우저 내에서 캐시를 초기화 하는 방법등이 있습니다.\n가장 무엇보다 유도 및 알 수 없는 첨부파일은 다운로드 하지 않고 삭제를 해주시고, 주기적으로 메일 패스워드를 변경하여 이용해주세요.\n[기업보안메일] 택배 업체 안내 메일·문자, 랜섬웨어 감염 주의\n[기업보안메일] 택배 업체 안내 메일·문자, 랜섬웨어 감염 주의 안녕하세요. 메대리입니다. 최근 택배 업체를 사칭한 랜섬웨어가 유포되고 있다고 하는데요. 택배 서비스는 많은 사람들이 이용하는 서비스이며,..\nblog.mailplug.com', '안녕하세요. 한국랜섬웨어복구센터입니다.\n랜섬웨어 바이러스에 감염이 되었는지 확장자를 확인해보시기 바랍니다.\n감염이 맞다면 감염된 폴더마다 생성된 메모장을 확인하셔서 랜섬웨어 종류를 파악하시고\n중요한 문서가 있으시다면 1차,2차 복구를 권장합니다.\n중요한 문서가 없으시다면 포맷을 권장합니다.\n랜섬웨어는 파일을 인질 삼아 금전을 요구하는 바이러스입니다.\n100%복호화는 해커에게 일정 비용을 지불하여 복호화키값을 받아 작업해야 합니다.\n★저희 한국랜섬웨어복구센터는 ""해커에게 비용 지불시 기본 대행비 무료""로 진행됩니다.★\n그 외에 다른 여러가지 복구 방법이 있습니다.\n다른 여러가지 복구 방법을 먼저 진행 후 해커와의 타협은 최후의 방법으로 하시기 바랍니다.\n데이터 복구가 필요하다면 네임카드의 랜섬웨어 카페를 통하여 점검 받아보시는건 어떤가요?\n(((랜섬웨어 복구툴)))과 (((랜섬웨어 치료 방법)))이 있습니다.', '<질문>\n랜섬웨어 의심메일인듯... 어떻해야할지???\n<답변>\n질문하신 내용처럼 htm(웹페이지)나 pdf로 위장한 랜섬웨어가 많이 퍼지고 있는 것이 사실입니다.\n아래의 포스팅을 보시면 아시겠지만 실제로 구동시 컴파일일 되면서 랜섬웨어가 구동하는 방식입니다.\n만약 실행했는데..변화가 없다면 랜섬웨어가 아닐수도 있습니다.\n랜섬웨어로 의심된다면 빠르게 재부팅하세요. 상당수의 랜섬웨어는 재부팅만으로도 구동을 멈춥니다.\n랜섬웨어가 아니라면 정보탈취를 목적으로 하는 피싱공격 싸이트일수도 있습니다.\nhttps://blog.naver.com/cmtes_inc/221556883439\nIT기술사가 말해주는 ""솔직담백한 IT스토리"" : 네이버 블로그\n- IT지식과 경험을 공유하는 정보관리기술사의 블로그 입니다.- 전문분야는 서버이중화, DB보호/서버복구, 랜섬웨어예방 솔루션 등과 시놀로지, 큐냅, 큐샌, 넷기어, 테라마스터, 씨게이트, 웨스턴디지털 등 NAS서버 입니다.서울 여의도서 근무중...02-2236-9329 / cmtes_inc@naver.com\nblog.naver.com\n도움이 되셨다면 채택 부탁드립니다.\n좀더 자세한 정보는 지식인카드를 보시면 NAS서버(시놀로지, QNAP, 큐샌, 넷기어 등)와 랜섬웨어예방, 이중화 등의 IT솔루션관련하여 기술사를 비롯한 전문가 그룹의 다양한 글과 영상을 확인할수 있습니다.\n감사합니다.', '랜섬웨어를 간단하게 방지 하는 소프트웨어 앱체크 를 설치하셔서 해결 해보세요!\n▼링크\n랜섬웨어 완벽 방지 ""앱체크""AppCheck 설치 및 사용 방법\n내 컴퓨터 인증 되지 않은 바이러스 프로그램 실행으로 인하여 랜섬웨어 및 바이러스에 걸린적 많으셨죠. 랜섬웨어는 다른 악성코드와 마찬가지로 다양한 방법으로 유포되어 사용자 PC를 감염시킵니다. 주로 악의..\nfifa3nexonblog.tistory.com', '일단 그 회사에 주문을 했는지 확인하고, 만약 주문한 이력이 있거나 없거나 걱정되시면 그 파일을 컴으로 옮겨서 백신으로 검사를 하시길 추천드립니다.', '네. 랜섬웨어 메일이 맞습니다. 그 메일을 받으셨다는건 컴퓨터가 보안에 취악하다는건데... 백신이 없으시다면 백신을 다운받으시고 그 메일에 들어가서 (첨부파일 절때 다운받지 마세요)삭제 하시면 됩니다. \n조치 방법:백신 다운받으시고 (없다면) 그 메일은 삭제시키는것이 좋습니다. 나중에 까먹고 클릭할수 있거든요.\n결론:랜섬웨어 메일이니까 건들지 마셈']",6,https://kin.naver.com/qna/detail.naver?d1id=1&dirId=11002&docId=330947740&qb=67Cx7Iug&enc=utf8&section=kin&rank=94&search_sort=3&spq=0,바이러스
10,2020.02.25,[],최강창민 결혼하는 꿈,"안녕하세요. 꿈이랑 예지몽 잘 꾸는 사람입니다.
오늘 꿈을 꾸었는데 동방신기의 최강창민님이 결혼하시는 꿈을 꿨어요. 근데 코로나가 한창이기도 하고 원래 자체가 우당탕하는 성격이 아니라서 조용히 진행하고 있었고 조용히 식을 올릴 예정이라고 꿈 속 어디서 봤어요.
꿈에서 깨고 찾아보니 완전 뒤늦게 그 분의 공개연애 소식을 접했네요..
원래 엄청 찾아보고 알던 연예인이 아니여서 꿈에 나타나길래 넘 신기했네요.
무튼 그냥 잠결에 써요. 축하드려요. 이게 꿈인지 현실인지.
다들 코로나 조심하세요 !","['이꿈을 정리해드리면\n부정의 기운이 해소가 되어 긍정의 기운으로 바뀌는 꿈입니다.\n그전의 부정이 사라지고\n좋은 일이 발생한다는 뜻으로 해석하시면 됩니다.', '와 지금결혼기사떴어요\n요새는 무슨꿈꾸세여?', '성지순례 왔습니다.\n로또 당첨되게 해주세요.\n연금복권 당첨되게 해주세요', '헉 대박이에요 좀전에 결혼한다고 기사 떴는데ㅜㅜ', '와 예지몽이네요 진짜ㅋㅋㅋㅋㅋ\n오늘 결혼발표하셨잖아요~~!!!\n진짜 진짜 최강창민! 심창민!! \n 너무축하해요!!!!!!!!!!!!!!\n최강창민을 데려갈 여자가 누군지 진짜 궁금합니다ㅋㅋㅋㅋㅋㅋ\n도대체 어떤 분이길래 동방신기 최강창민을 와...Bravo', '6월 24일 중간 고사 잘치게해주세요', '성지순례 왔습니다 꿈 이루게 해주세요', '이번년도 안에 로또 1등 당첨되게 해주세요', '대박 성지순례ㄷㄷㄷ 가족들 건강하게 해주세요!!', '와씨 성지순례 왔습니다 이번 시험 찍은 거 다 맞게해주세요 ', '성지순례 왔습니다. 여러분 모두 행복하세요~♡\n최강창민 결혼 발표, 여자친구 누구?\n동방신기 최강창민이 결혼을 발표했다. 12일 SM엔터테인먼트는 오는 9월 5일 교제중인 여자친구와 최강창민이 결혼한다고 밝혔다. 이어 예비신부는 비연예인으로 양가 가족들을 배려해 구체적인 장소와 시간 등 결..\ntextnews.co.kr', '성지순례 왔습니다!!', '성지순례 왔어요 중간고사 잘 보게해주세요 석차 올라가게해주세요', '대박 .. 성지순례 왔습니다.. 제가 하고자 하는 일 하는 족족다 성공하게 해주시고 모든 사람들 다 건강하고 행복하게 해주세요ㅠㅠ', '성지순례왔습니다 시험합격하게해주세요!! ', '성지순례 왔습니다\n제발 저 로또 1등 연금복권 당첨되게 해주세요\n우리 가족 무병장수 하게 해주세요', '성지순례 왔습니다. 시험 100점 맞게 해주세요.', '성지순례 왔습니당 \n하는일 잘풀리게 해주세연', '성지순례왔습니다. 기사자격증 시험 제발 합격하게 해주세요!!! ㅠㅠ', '성지순례 왔습니다.\n시험 잘보게 해주세요 ', '커서 람보르기니 끌게 해주세요', '성지순례 왔습니다 저 전교회장 꼭 되고 우리 가족 항상 건강하고 행복하게 해주세요', '성지순례 왔습니다.\n이번달 로또 1등 당첨되게 해주세요.\n이번달 연금복권 1등 당첨되게 해주세요.\n가족 건강과 행복하게 해주세요.\n최애나 차애랑 결혼하게 해주세요.', '성지순례 왔습니다. \n앞으로도 건강하고 행복하게 살게 해주세요. 좋은 일 많이 일어나게 해주세요.', '성지순례 왔습니다.\n부자되서 효도하게 해주세요~\nfeat. 창민아 결혼 축하한다!!!!!!!! 잘살거같음!']",25,https://kin.naver.com/qna/detail.naver?d1id=3&dirId=30104&docId=348139141&qb=67Cx7Iug&enc=utf8&section=kin&rank=93&search_sort=3&spq=0,방송연예인
10,2020.03.12,"['검색질문', '통합검색궁금증', '통합검색질문하기', '해킹의심', '해킹', '해킹인가요', '방화벽', '백신', 'mcafee', '맥아피']",맥아피 mcafee 의심스러운 네트워크 연결이 차단됨이라 뜨는데 어떻게 된건지 자문구합니다,맥아피 mcafee 백신 내용이 지금까지 1천번 이상의 위험한 연결에서 사용자를 보호했습니다 라고 뜹니다. 의심스러운 수신 네트워크 연결이 차단됨 이라 떠있는 ip 주소들을 조회해보니 국내였구요 해킹시도를 계속 받고 있는건가요? 이런 경우가 많은 경우인지 전문가님의 의견을 구합니다. 노트북 산지는 새상품 중고로 산지 1달 남짓입니다. 운영체제는 윈도우 10입니다. 전문가님 답변 잘 부탁드립니다,['저도 이거 계속 나와서 뭔가 찾아봤는데\n마이크로소프트 계정에 다른 사람이 자기 노트북 디바이스 등록해서 쓰고 있더군요ㅡㅡ\n마이크로소프트 계정 들어가서 자기 노트북 말고 다른 디바이스 등록 된 거 없는지 한번 체크해보세요.\n내 노트북 이름은 제어판 시스템 들어가면 확인할 수 있습니다.'],1,https://kin.naver.com/qna/detail.naver?d1id=1&dirId=11001&docId=349734660&qb=67Cx7Iug&enc=utf8&section=kin&rank=92&search_sort=3&spq=0,해킹
10,2020.06.18,[],V3 지워지지가 않아요,"제가 백신 끌일 이 있어서 저 2가지도 꺼야하는데
제품보호 하고 랜검웨어 보안폴더 사용은
아무리 체크 해제를 하고 적용을 해도
다시 들어가 보면 바로 켜져있네요
이것 때문에 v3 삭제하고 다시 깔라해도
삭제가 안되요 해결방법 아시나요?",['랜섬웨어 보안 폴더 사용 옆 시간이 보이는데 종료시 10분되면 다시 키게 설정되어있네요 다시 시작 안하게 변경하시면 됩니다.\n그리고 안랩 백신은 실시간 감시 종료만 가능하며 종료는 불가합니다.'],1,https://kin.naver.com/qna/detail.naver?d1id=1&dirId=110&docId=360036863&qb=67Cx7Iug&enc=utf8&section=kin&rank=91&search_sort=3&spq=0,보안
9,2020.06.22,['프로그램제거및삭제'],C드라이브 정리(삭제해도 무해한 프로그램 선별 부탁),"C드라이브 용량이 너무 많이 차지하고 있어서...
삭제해도 되는 프로그램 좀 선별 부탁드립니다....ㅠ

용량차지하는 파일을 찾아낼 수 있는 방법은 없을까요? ㅠㅠ 윈도우7 입니다....","['아래 방법들 참고하세요 (기본 용량이 작을 경우 SSD/HDD 추가 구매 권장)\n1. 최적화/레지스트리정리 기능 있는 프로그램 실행/활용 ex) 백신/최적화 프로그램\n2. 디스크정리/조각모음 실행 (단, SSD 사용 시 조각모음 불필요)\n3. 용량 큰 게임/자료(동영상,음악)정리 ex) 포토샵, 게임\n4. 불필요 시 삭제 가능 목록 정리 - 불필요 시 삭제 가능 답변 원할 경우 댓글주세요']",1,https://kin.naver.com/qna/detail.naver?d1id=1&dirId=10206&docId=360492909&qb=67Cx7Iug&enc=utf8&section=kin&rank=90&search_sort=3&spq=0,유틸리티
9,2020.06.24,[],생후 7주 된 강아지 예방접종 후 진드기약,현재 종합백신이랑 코로나 장염만 맞았는데 진드기약이랑 내부 기생충약은 언제 먹여도 될까요??,"['진드기약  먹이고  2일후에 \n사상충약  먹이세요', '진드기예방하세요\n댕댕이 진드기 고민이시죠\n더 번지기전에  얼른 뽑아버리세요.특히 발바닥 잘보시고요  주댕이쪽 잘 보셔야해요.독한것들입니다.\n아래의 제품들 이용해보세요.\n강아지 진드기에 좋은제품입니다\nhttps://coupa.ng/bE0iMd\n펫닥터 바로바로 강아지 진드기 제거 기 애견용품\nCOUPANG\ncoupa.ng\nhttps://coupa.ng/bE0htH\nNabicare 반려동물 소형 대형견 대형견용 강아지 개 애완견 고양이 애견 진드기 천연 편백 피톤치드 스프레이 똥냄새 소변 오줌 냄새 탈취제 퇴치 퇴치제 제거제 500ml 1L 4L 대용량 진드기약\nCOUPANG\ncoupa.ng\nhttps://coupa.ng/bE0hwB\n강아지 심장사상충약 외부기생충 예방 모기 진드기 해충 바이오강스 스팟온 개 약 퇴치제 하트가드 넥스가드 스펙트라 프론트라인 대체용 바이오스포틱스\nCOUPANG\ncoupa.ng\nhttps://coupa.ng/bE0hxO\n틱리스 진드기퇴치 해충방지 목걸이_오렌지\nCOUPANG\ncoupa.ng\nhttps://coupa.ng/bE0hFI\nTickEase 진드기 제거제 듀얼 스쳐 핀셋\nCOUPANG\ncoupa.ng\n진드기때문에 고생했어 댕댕아\n이젠 견사돌로 치석 제거하자\nhttps://coupa.ng/bE0hKH\n[TV][CJ단독구성][견사돌] 3박스+1박스\nCOUPANG\ncoupa.ng\n잘했어 댕댕아. 이젠 목욕하자\nhttps://coupa.ng/bE0hXy\n달본 PET 내추럴 강아지 샴푸린스겸용\nCOUPANG\ncoupa.ng\n목욕하고나니 예뻐졌떠염.♡♡\nThis is  간식 time\nhttps://coupa.ng/bE0h5V\n시저 반려견 주식캔 쇠고기와 참치\nCOUPANG\ncoupa.ng\n파트너스활동을통해일정액의수수료를제공받을수있음 ']",2,https://kin.naver.com/qna/detail.naver?d1id=8&dirId=8050105&docId=360632965&qb=67Cx7Iug&enc=utf8&section=kin&rank=89&search_sort=3&spq=0,"미용, 건강관리"
