page,date,tags,questions,questions_add,answers,N_answer,url,category
54,2020.03.18,[],진원생명과학 주식 매수 시기 좀 제발!,"하.........매번 놓치는건 제가 바보인건지
진원생명과학 주식 매수 시기 언제가
괜찮을지 답변 좀 부탁드립니다~~~~~
아직 기다려야하나 앞으로 꾸준한 상승세
어찌 보시나요?","['진원생명과학 주가 전망 정리글 남겨놓고 가겠습니다^^\nhttps://lth199305.tistory.com/189\n진원생명과학 주가 전망과 백신\n[진원생명과학 주가의 대박] 주식시장 코스피에 상장된 진원생명과학 주가는 최근 엄청난 상승세를 보이고 있습니다. 지인분 중에서 진원생명과학으로 소위 주식대박 났다고 자랑하시는 분도 계시더군요. 그래서..\nlth199305.tistory.com', '진원생명과학 \n오늘 코로나19 백신후보물질 과제 협상대상자로\n선정되었습니다. 그에따라 급등하고있는데 \n무료리딩 받아보세요.\n모멘텀플라이-성공적인 투자를 가능케 하는 대한민국 1등 리딩기업 매칭 플랫폼\n주식 투자 및 종목을 직접 권유하지 않으며, 주식 정보 및 리딩 서비스는 자체 시스템을 통해 검증된 주식 정보제공 리딩 기업이 직접 제공합니다. Momentum FLY - 모멘텀플라이\nleaderscpa.com', '8천원대에서 담아보시길 바라고, \n수익보시면 바로바로 매도하시고 단기적으로 대응하시기 바랍니다.\n전문가의 무료 급등주 추천 받아보세요. 3일 무료체험이 가능합니다.', '사기꾼들 리딩이나 광고에 속지 마시구요.\n 공부하세요.\n본인재산 본인이 공부해서 늘리시는겁니다.', '저도 진원주식 소유하고 있는데요, 금액을 떠나 흠름만 잘 봐도 어렵지 않아요..\n광고방 들어가서 흔들리지 마시고 오늘 들어 오시는것도 나쁘지 않겠네요~', '이때 많이 사뒀더라면..', '코로나19 백신후보물질 과제 협상대상자로\n되서 상승한거 같습니다\n주식이 어려우시다면 좋은 정보를 손쉽게 얻을 수 있는\n전문가들의 무료 주식리딩을 받아보시는것도 좋은거 같습니다']",7,https://kin.naver.com/qna/detail.naver?d1id=4&dirId=40603&docId=350320954&qb=67Cx7Iug&enc=utf8&section=kin&rank=532&search_sort=3&spq=0,"의료, 법률, 금융"
54,2020.05.27,['#문제풀이'],벨기에 역사 이거 사실인가요?,궁금합니다,"['75프로나죽였었는지는모르겠지만 나머지는 다맜습니다', '식민지  사람들을 대량 학살 했습니다', ""사실 맞습니다.\n레오폴트 2세는 벨기에가 약소국이라 식민지 좀 있는게 좋다고 생각했기에 모험가들에게 돈을 주고 현지 추장들을 포섭하라고 했으며 모험가들은 콩고의 각 부족을 찾아다니면서 선물을 주고 종이를 들이댄 다음 여기다가 이 펜이라는 도구로 그냥 아무렇게나 적어달라고 한 다음 그 서류를 모아서 열강들을 모아두고 '내가 백인 왕으로서 이 콩고 흑인들이 너무 불쌍하다... 지금 봐라, 다른 열강들이 아프리카 사람들 막 노예로 팔고... 이런거 내가 못하게 막으려고 하는데 현지 부족이 다 동의했다... 그니까 콩고를 내 땅으로 인정해달라' 이래서 콩고 자유국이라는 이름으로 콩고를 자기가 먹었는데, 벨기에의 식민지도 아니고 레오폴트 2세의 개인 영지였고 전적으로 레오폴트 2세의 소유였습니다.\n저 글처럼 75% 가까이 죽은것은 아니지만 수십만명 이상이 죽거나 불구가 되었는데 당시 신소재인 고무가 각광받고, 길가다 타이어가게 보면 무슨 똥같이 생긴 인형이 보일텐데 그 캐릭터의 모티프인 굿이어라는 사람이 고무에 유황을 섞으면 엄청 강해진다는 것을 발견해서 값이 치솟았습니다. 그래서 레오폴트는 콩고에 고무나무를 심게한 다음 하루에 몇빠게스씩 고무를 채취하라고 강제하고, 못채우면 용병들을 시켜서 팔을 한개씩 자르게 했습니다. 팔을 두쪽 다 잘려서 고무를 채취하지 못하게 되면 같은 마을 사람이나 가족에게 할당량을 떠넘기고, 할당량이 늘어나서 할당량을 채우지 못하면 똑같이 자르고 다른사람한테 덤터기 씌우고, 감옥에 가족을 끌고가서 고무 가져오면 풀어준다고 깡패짓하고 반란이라도 하려고 하는 즉시 용병들이 총으로 다 쏴죽였습니다.\n다른 나라 귀족들과 모험가들이 콩고에서 그런 일들이 벌어진다는걸 알고 몰래 잠입해서 사진으로 다 찍어서 언론에 대서특필되어서야 그 행각이 멈췄는데 멈춘 과정도 어이없게 벨기에 귀족들이 레오폴트 2세로부터 콩고 자유국을 빼앗고, 콩고를 벨기에의 속령으로 만들어버립니다. \n레오폴트는 원래 변태로서 성추문에 많이 연루되었고 콩고 사건도 있어서 죽고 장례식 때도 벨기에 사람들이 침을 뱉었다고 합니다.\n흑인 동물원 이야기는 벨기에만 그런게 아니고 우리나라 사람들도 당한 일이고, 서구 열강들은 그런거 다 했습니다. 가령 북극을 최초로 정복한 미국인은 이누이트(북극 원주민들)를 고용해서 북극을 탐사했는데 탐사할 때 고용한 이누이트가 사망하자 동물이라면서 박제로 만들어서 장식용으로 전시되있고, 아들이 계속해서 아버지 시신을 돌려달라고 했는데 이누이트가 인간이라는 증거가 없기에 기각되었다가 말년에 겨우 돌려받았으며, 프랑스도 사키 바트만이라는 여성을 엉덩이가 비정상적으로 크고, 흑인이라는 이유로 죽은 후에 박제해서 보관하다 독립한 고국에서 장례치루게 돌려달라고 하자 사람이라는 근거가 없다면서 돌려주길 거부했다가 국제적으로 시끄러워지니까 돌려줬습니다."", '1천만명입니다\n벨기에가 사과한다고 했는데..\n콩고가 거절했습니다\n최고 학살국 1위는 영국입니다\n하도 많아서 이름도 기억 못하겠네요\n2위가 벨기에 입니다\n3위가 600만명을 살해한 독일 입니다\n유태인뿐 아니라 집시 노숙자 부랑자 장애인 싹 죽였습니다\n좀 더 거슬러 가면 아메리칸 원주민 학살한 \n미국이 신급이지만 4000~7000만 이상\n호주 뉴질랜드는 원주민한테 사과 했지만 미국은\n극소수 원주민만 남아서 사과할 사람도 없지요!\n미국이 영국인들에 의해 이렇게 세워진 나라입니다\n현실을 직시해야!\n백신도 안나눠주는거 보세요!..']",4,https://kin.naver.com/qna/detail.naver?d1id=11&dirId=111002&docId=357832551&qb=67Cx7Iug&enc=utf8&section=kin&rank=531&search_sort=3&spq=0,세계사
53,2020.11.13,[],라파스 주가 지금 매수 적절한가요?,"라파스 주가 지금 매수 적절한가요?

라파스 주가 화이자며 백신 초저온냉장고 등 다양한 이유로 상승하는거 같은데
이럴때 매수는 어떤가요? 적절한건지 아니면, 변동이 있을때 매수를 해야 하는건지
엄청난 수익은 바라지 않아서 욕심은 없어요~ 라파스 주가 안정적일 때 들어가고 싶어요..!!","['안녕하세요, 질문자님.\n라파스는 마이크로 니들을 생산하는 기업으로 결핵 생백신 패치의 상온 유통 가능성을\n확인했다고 최근 밝히면서 투자자들의 관심을 받고 있는 종목입니다.\n또한, 이슈가 된 화이자 백신의 단점을 해결할 수 있는 마이크로니들을 주목하며\n세계 1위 업체인 라파스가 관심을 받고 있는 것으로도 분석되고 있습니다.\n다만, 주가 및 이슈 내용은 항상 변동 가능성이 높으니 내용 참고하시어 신중한 투자 하시길 바랍니다.\n요즘은 개인투자자분들이 스스로 종목을 찾고 매수매도 하시기보다\n주식자동매매프로그램을 많이들 사용하고 계시는데요.\n이름 그대로 주식을 자동으로 매도/매수해주는 알고리즘 매매형식의 프로그램입니다.\n100% 감정이 배제된 투자로 익절/손절 타이밍을 정확히 캐치하며 단순 이슈만을 포착해\n움직이는 것이 아니라 기업의 최근 실적, 영업이익, 거래 강도, 시장 흐름등 다양한 측면에서\n분석하여 움직이기 때문에 급등주 뿐만 아니라 2,200여개의 종목이 모두 대상이 되는 것이죠.\n또한, 단시간에 대량 매매까지 가능하며 초보자는 물론,\n연세가 많으신 분들도 편리하게 사용하고 계십니다.\n더 자세한 내용은 아래 블로그에서 확인해주시길 바랍니다.\nhttps://blog.naver.com/jangujoo91/222015402783\n주식 자동매매 프로그램 오토핫키로 하는 현실적인 재테크 방법\n안녕하세요 주식 자동매매 프로그램 오토핫키 입니다.코스닥은 코로나 사태 이후에 외국인들의어마 어...\nblog.naver.com\n주식자동매매프로그램 오토핫키의\n날짜별 매매 영상은 아래 오토핫키 \n네이버 TV 채널을 구독하시면\n확인이 가능합니다.\nhttps://tv.naver.com/jangkknn\n주식자동매매프로그램 오토핫키 : 네이버TV\ntv.naver.com', '라파스 주가에 대한 기업정보와 재무평가가 잘 정리되어 있는 곳이 있어서 남겨드립니다.\n주식 투자를 하실 때 기업정보와 재무평가를 바탕으로 미래가치를 살펴보시는 것이 좋습니다.\n다양한 주식의 정보들이 있으니 보시고 참고하시면 좋을 듯합니다.\nhttps://clsrndmlgodqhrgkswlq.tistory.com/68\n라파스 주가 세계최초 마이크로니들 대량 생산기술 상업화\n라파스 주가 세계최초 마이크로니들 대량 생산기술 상업화 오늘은 라파스 주가를 알아보겠습니다. 라파스는 2020년06월24일 38,900원의 최고가를 갱신하고 크게 하락하며 자리를 잡고 있는 모습인데요. 박스권을..\nclsrndmlgodqhrgkswlq.tistory.com', '매수할것인지 아닌지는 잘 분석해서 하셔야 하는데요.\n어려우시다면 전문가들의 무료주식 리딩을 받아보시길 바랍니다\n주식이 어려우시다면 좋은 정보를 손쉽게 얻을 수 있는\n전문가들의 무료 주식리딩을 받아보시는것도 좋은거 같습니다', '나쁘지 않을듯 하네요,\n주식 종목추천 3일간 무료체험 받아보세요.\n- 소액으로도 성공적인 재테크를 꿈꾸시는 분\n- 확실한 주식 종목으로 큰 돈 벌고 싶으신 분 \n- 확실한 종목 분석을 원하시는분\n3일 무료체험: https://han.gl/J0Ipn', '일단 주가의 미래는미래는 신도 알수없습니다.\n공매도 금리상승으로 주가 조정 올가능성이 많습니다.\n주식을 보유하고 있을때 마음이 편하면.. 보유하시고\n마음이 불편하고 자꾸 주식창만 쳐다보게 된다면 매도를 고려해 보는게 좋을것 같습니다.\n마음의안정이 이겨야 이길수있습니다.\n불안감을 느끼면 생활도 힘들도 스트레스 받고..ㅠㅠ 머리카락 빠지고\n돈은 잃어도 건강을 잃으면 안되요..!!\n요즘 정말 코스피 지수가 좋아서 그런지\n너도 나도 주식에 뛰어들고 오히려 주식을 안하는 사람만 바보가 되는 세상 같습니다.\n근데 무작정 뛰어들게 되면 큰코 다치죠.\n주식에 투자를 하고싶은데 어디를 투자 해야 할지 고민 이시다면 바로 여기에서\n도움 받아 보셨으면 합니다.\n제약 바이오 관련주는 신약개발 전단계의 임상만 성공해도 높은 상승률을 보여 많은수익까지 기대할 수 있어 많은 투자자들이 관심을 가지고 있습니다.\n그러나 제약바이오주 투자는 그 어떤 테마보다 신중을 기해야하며 종목선정이 무척이나 중요한 테마라고 할 수 있겠는데요.\n신약개발과정\n후보물질->전임상시험->1상임상시험->2상임상시험->3상임상시험->허가&판매->4상임상시험\n법무법인 공증 절차를 거쳐 회원들에게 투명하게 자료 공개\n2021년 수익률의 꽃이라 불리우는 제약바이오의 좋은 모멘텀이 나와 소개드리고자 합니다.\n2008년부터 13년간의 투자 노하우로 코로나19, 치료제, 백신, 주요 질병 임상 중 한가지 이슈라도 종목을 움직이는모멘텀이 있을 시 집중해서 분석하여 수익이 나는\n종목선정과 매매타이밍을 결정해 추천해드립니다.\n바이오주는 임상실험 일정,목적,결과 제약주는 원료,효능,제조가능한약품 등등..재료를 찾을수있습니다.\n신설된 제약바이오 TF팀의 합작 프로젝트 진행으로 무료로 체험 가능 가능합니다..ㅎㅎ15초영상시청 후 페이지 이동!\n↓↓↓↓↓↓↓↓↓↓↓↓↓↓↓↓↓↓↓↓↓↓↓\nhttps://jamongpick.com/41/13922\n청개구리-제약바이오 - 비디오 서비스 플랫폼 자몽pick\n청개구리-제약바이오 급등에 급등! 제약바이오 관련주! 100% 이상 수익이 가능하다고?!청개구리투자클럽 추천 - jamongpick\njamongpick.com\n정보도 받아보시면서 같이 공부도 하시고..\n어느정도 감을 익히신 후에 조금씩 조금씩 혼자만의 투자기법을 만들수있다면..\n먼 훗날에는 성공할수 있지 않을까요 ?\n#주식정보제공#제약바이오관련주#제약주종목추천\n셀트리온#삼성바이오#바이오다인#셀로메드#메디콕스#지노믹트리#바이넥스\n#제노코#비디아이#인트로메딕#엔젠바이오#박셀바이오#SK바이오사이언스#셀트리온헬스케어\n#바이오주#제약주#인피니트헬스케어#중앙백신#대성미생물#일신바이오#녹십자랩셀\n#서린바이오#비보존#에스텍파마#에이치엘비#신라젠#한국유니온제약#알리코제약#경남제약#서울제약\n#종근당바이오#코오롱생명과학#삼성바이오로직스#HMM#한화투자증권#휴켐스#우리기술투자#부방#메카로\n#자이언트스텝#빅히트#빅히트#SK바이오SK바이오\n해당게시물은업체로부터일정수수료를받고작성된 글입니다.']",5,https://kin.naver.com/qna/detail.naver?d1id=11&dirId=110832&docId=373184673&qb=67Cx7Iug&enc=utf8&section=kin&rank=530&search_sort=3&spq=0,네덜란드어
53,2021.03.15,['#지식인카드'],아이폰어플,"이 어플에대해서 설명부탁드리고
해킹이 다했다고 뜨더니 이 어플 다운받으라고 떠서 받았는데 설명쫌부탁드립니다","['사기입니다 해킹 아니구 그냥 저 어플 다운수 늘리는 거에요 \n저거 지우시구\niOS 14라면 설정 > 캘린더 > 구독한 캘린더에서 설명이 CLICK SUBSCRIBE인 계정 또는 구독하지 않은 계정을 삭제하시길 바랍니다', '안녕하세요 판다vpn지식인 상담사입니다\n무료 vpn을 이용했을때, \n또는 보안이 안전하지않은 사이트에 접속을 하였을 경우\n발생하는 악성광고 입니다!\n이런경우\n아이폰 설정> 암호및계정>구독한캘린더>해당캘린더삭제 \n이렇게 하시면 간단하게 해결 가능하십니다!\n무료VPN의 수익구조는 정보판매라는\n소문이 있을정도로 피해사례가 많이 있습니다!\n혹시나 지금 무료vpn을 이용하시고 계시다면 지우시는게 좋을 것 같습니다!\n저희 판다vpn은 전세계에서 한국서버 50개이상 보유 \n게임유저들의 위한 게임서버 다수보유, 각종 해외서버도 보유중입니다 ^^\n네이버에 ""판다VPN"" 를 검색해주세요', '안녕하세요. 킹콩VPN 지식IN 상담원입니다^^ \n광고로 인해 앱을 설치 하신거라면 해당 광고는 악성 광고 앱 설치 유도 광고입니다 \n이렇게 설치하신 앱은 추후 결제 되는 앱으로 삭제 하시는 걸 권유 드립니다 \n무료브이피엔은 악성광고및 보안에 취약하기때문에\n폰에 악성광고를 심은거같네요 브이피엔 사용하시려면 100%안전한 킹콩VPN추천드립니다\n보안을 위해서라도 VPN을 사용하신다면 안전하고 믿을 수 있는 VPN을 사용하셔야 합니다!!!\n아이폰 설정 - 프로필 - 아이튠즈 및 앱스토어 - 애플아이디 - 구독\n으로 들어가시면 구독중인 항목에 확인되는 부분이 있으실거에요~\n만약, 이 부분에 구독중인 것이 확인이 안된다면\n앱스토어 측으로 문의를 하셔서\n결제 시도가 되고 있으니 결제 취소를 요청하시면 됩니다 ^^\n시중에 많은 VPN이 있지만 무료 VPN은 개인정보의 위험이 \n존재하기때문에 사용방법이 간단하고 실시간 상담이 지원되며 \n깨끗한 서버를 제공하는 VPN업체를 찾아야합니다 ~~ \n가성비 좋은 vpn 찾으시면 저희 킹콩vpn은 어떠신가요~^^\n끊김 없고 안정성도 좋아서 걱정 없이 이용하실수있답니다~\n속도는 물론 안전성 까지 보장 되는 킹콩vpn !\n언제든지 연락주세요 :) 1일무료체험도 가능합니다 ', '안녕하세요.\n국내 최초 통신사 고정 IP로\n컴퓨터 VPN 서비스를 제공해 드리는\nESvpn입니다.\n해당 증상은 해킹당한게 아니라,\n유료 백신어플을 구매하게 하도록 유도하는 광고입니다.\n실제로 해킹당한 것이 아니기 때문에\n절대 어플을 구매하시면 안됩니다.\n물론 휴대폰 보안을 유지하길 원하신다면 구매하셔도 좋습니다.\n또한, 아이폰은 보안력이 준수한 편이기 때문에\n사이트에 방문하는 정도로는 해킹당할 염려가 없으니 \n걱정하지 않으셔도 됩니다.\n저희 ESvpn의 경우, 사용이력이 발생되지 않은\nKT 통신사 고정 IP를 제공해드리고 있어,\n보다 안전하게 사용이 가능하십니다.\n안전하고 간편하게 사용이 가능한 국내 VPN 프로그램을 찾으신다면\n저희 ESvpn을 추천드립니다.']",4,https://kin.naver.com/qna/detail.naver?d1id=5&dirId=50401&docId=384627850&qb=67Cx7Iug&enc=utf8&section=kin&rank=529&search_sort=3&spq=0,의류
