page,date,tags,questions,questions_add,answers,N_answer,url,category
5,2020.10.09,[],여자 곤지름,"제가 몇 달전에 곤지름이 생겨서 산부인과에 가서 레이저치료를 받았어요.
가다실 주사도 맞고 계속 병원에 다니는 중인데 자꾸 곤지름이 재발합니다 ㅠㅠ

검사했을 때는 질 안에는 곤지름이 없다고 하셨는데 혹시 검사했을 때는 곤지름이 없다가 몇 달뒤에 질에 곤지름이 생겨서 계속 날 수도 있나요 ?

그리고 남자는 치료방법이 없다는데 의사선생님이 제가 가다실을 맞아서 성관계를 맺어도 남친은 바이러스가 있어도 저는 곤지름이 다시 안 난다고 하는데 맞나요 ..?","[""안녕하세요. 대한의사협회·네이버 지식iN 상담의사  나다움 여성다움 아름다움을 찾아드리는 강남 다움산부인과 원장 김민경 입니다.\n곤지름이 계속 재발하여 힘드시겠습니다 ㅜㅜ\n인유두종바이러스 = HPV바이러스 6.11 형에 감염되어 발생하는 콘딜로마는 항문/생식기 사마귀로 불리기도 합니다. \nHPV 16, 18, 31, 33, 35이 항문생식기 근처사마귀로 발견되기도 합니다\n이 바이러스는 전염력이 강해 한 번의 성 접촉으로 약 50%가 감염될 수 있으며 대개 성교 2~3개월 후에 피부병변이 나타납니다. 성기 사마귀의 원인 바이러스 중 인체 유두종 바이러스 6, 11형은 성기 및 자궁경부암 발생과의 관련성이 약하며, 16, 18형은 관련성이 높은 것으로 알려져 있습니다. \n 또한 감염력이 높은 편이라 성파트너도 75%이상이 바이러스 양성으로 나타난답니다 \n비교적 성 접촉이 왕성한 2030대 젊은층에서 발견되며 정상적으로 성 생활을 하는 남녀 50% 이상이 평생에 한 번 이상 감염되는 매우 흔하다고 봐야겠죠? \n 주로 성관계시 직접적으로 접촉이 되는 질 뒤쪽이나 양쪽 음순에 잘 나타나며 항문과 질벽, 자궁경부까지 번지기도 해서 눈에 안보이는 부위에 생기면 산부인과에서 처음으로 발견되는 경우도 있습니다 감염된 사람과 구강성교를 했을 경우 입이나 목에도 생길수도 있구요 잘 부스러지고 닭벼슬 같이 뾰족뾰족한 모양이 대부분이며 각질화 및 구진성양상으로 편편한 모양인 경우로 있습니다 \n이러한 곤지름은 소양감, 통증, 열감등이 나타나고 성교시 출혈이 발생할수도 있으며 병변부위가 큰 경우는 드물게 요도, 질 , 직장입구의 협착이나 폐쇄를 일으킬 수 있습니다 \n보통 바이러스 감염된지 2-3개월 경과후 (잠복기 1-8개월)에 나타나는 경우가 많습니다\n산부인과 전문의와 진찰을 통해 전염성 연속증, 한포진, 지루성각화증, 한관종, 비립종, 중증이형성증이나 흑색종등과 감별이 필요하고 비전형적인 형태를 보이거나 색소침착이 동반된 경우는 조직검사를 시행하기도 합니다 동반 성병확률이 높아 HPV바이러스 외 다른 성병인자가 있는지 확인을 해야 합니다 \n 콘딜로마의 치료는 크기, 위치, 개수, 비용적인 문제등에 따라 치료의 방법을 결정하게 됩니다 일차적인 치료 목적은 육안적으로 보이는 병변을 제거하여 호전시키며 미용적인 측면도 고려 해야 할 것입니다\n 하지만 아직까지 인유두종바이러스를 궁극적으로 치료하는 방법은 없는 실정입니다\n따라서  치료를 해도 언제든지 면역이 떨어지거나 바이러스활성화가 되는 상황이 생기면 재발이 됩니다 \n또한  경부나 질은 육안으로 만져지거나 보이는 곳이 아니어서 정기적으로 재발이 되었는지 진찰을 통해 확인하시는 게 좋습니다 \n치료 효과에 대한 표를 보면서 알려드리겠습니다\n치료방법\n치료효과(%)\n재발률(%)\n냉동치료\n63-88\n21-39\n이퀴모드 5%크림\n33-72\n13-19\n포도필린 10-25%\n32-79\n27-65\nTCA\u3000８０ー９０％\n81\n36\n전기소작술\n94\n22\n레이저\n43-93\n29-95\n인터페론\n44-61\n0-67\n시네카테킨(베러겐연고)\n60\n자료없음\n      출처 : Berek & Novak's gynecology 16th\n1. 냉동요법 \n아산화질소나 액화질소로 병변부위를 냉각시켜서 제거하는 요법으로 1-2주간격으로 시행하면 63-88% 성공률을 보이며 부작용으로는 통증 조직의 괴사 수포등이 발생할수 있습니다 주로 외름부 표면에 발생한 다수의 작은 병변에 효과적이예요 \n 2. 이퀴모드크림\n인터페론 사이토카인의 생성과 감염된 조직의 세포자멸( apoptosis)를 촉진하는 면역 반응 조절제로 하루에 1회 도포하며 주 3회씩 최대 16주까지 사용할 수 있습니다 \n도포한후 6-10시간경과후에 물과 비누로 닦아내야하며 발적 , 고민반응, 경화작열, 저색소침착등이 생길수 있습니다 12주 추적관찰시 70% 치료성공률을 나타냅니다 \n 3. 포도필린\n항증식성 약제이며 포도필룸 식물에서 추출한 정제된 추출물로 3일 연속 도포를 권장하며 4일간 치료중단후 다시 3일 연속으로 도포하여 최대 4사이클까지 할수 있습니다 임신부에 대한 안전성은 확립되어 있지 않아 사용하지 않습니다\n 4. TCA 요법\n산성물질의 국소 제제로 화학적으로 화상을 일으켜 병변을 손상시키는 기전으로 1주간격으로 투여하며 평균 치료기간이 6-10주가량 소요됩니다 70-80%정도의 치료성공률을 보이며 36%에서 재발하는 것으로 보고되고 있습니다 부작용으로는 도포부위의 통증 화상 주변 피부조직의 손상이 발생할수 있습니다\n 5. 전기소작술 \n고주파의 전류를 사용하여 병변 부위를 태워 날리는 방법으로 국소마취를 하고 시술을 진행하며 병변부위가 클 경우는 흉터가 남을 수 있습니다 치료 성공률은 94%로 가장 높게 보고되고 있습니다\n 6.레이저 치료법\n치료성공률이 43-93%로 다양하게 나타나는 것으로 보아 시술자의 술기가 중요하다고 생각이 됩니다 장점으로는 레이저광선이 깊은 조직에 침투하는 효과가 있어 광범위하게 바이러스를 치료할수 있고 면역력이 저하된 경우 1차적으로 권장됩니다\n 7. 시네카테킨\n녹차성분에 추출하였으며 항산화 항바이러스 항종양 성질을 갖는 것으로 알려져 있으나 작용기전은 현재 밝혀지진 않았습니다 \n 실제 환자분들이 바르는 도포제재는 양을 조절하기 힘들고 표피를 박피시키는 효과로 따끔거리는 증상이 심할 수 있고 4-6주정도가 소요되기 때문에 병변이 작고 많이 퍼진 양상이 아닌 경우 시도하게 되며 병변이 퍼져 있거나 큰 경우, 빠른 치료를 원하시는 경우는 전기소작술이나 레이저시술을 하게 됩니다\n이러한 시술도 임상적인 경험과 해부학적인 병변위치에 대한 이해가 필요하답니다. 전기 소작술이나 레이저시술을 너무 약하게 받게 되면 쉽게 재발하고 피부 병변을 필요이상 너무 깊이 손상을 주면 피부과 회복되는데 심한 통증과 다른 세균성 감염에 노출되어 이차적 치료가 필요한 경우도 있고 회복되어 새살이 차오르는데 몇 달이 걸리기도 합니다\n가다실 9은 인유두종바이러스 6,11 ,16, 18, 31, 33, 45, 52, 58 번에 대한 항체를 만들어 생식기 사마귀은 곤지름(콘딜로마첨증) 뿐만아니아 자궁경부암 외음부암 질암 항문암등을 90% 예방하는 효과가 알려져 있습니다 \n성매개성 감염이 주요한 원인이다 보니 여성에게 필수일 뿐만 아니라 남성에게도 곤지름 항문암 항문 상피내 종양등의 예방효과로 접종이 필요한 백신이예요   \n이미 위 경우처럼  안타깝게도 곤지름이 생기신 후\n 예방접종을 한다고 해서 재발을 방지하거나 치료가 되는 건 아니고  \n아직 감염되어 있지 않는 타입의 감염을 방지한다고 생각하셔야 할것 같아요  \n흔하게 생길수 있지만 내가 잘 확인할 수 없는, 성병으로 알려져 물어 보기엔 부끄러움이 앞서는 생식기 사마귀에 대해 이 글이 도움이 되시길 바라는  마음입니다\n감사합니다 ^^\n ""]",1,https://kin.naver.com/qna/detail.naver?d1id=7&dirId=7011404&docId=370243230&qb=67Cx7Iug&enc=utf8&section=kin&rank=50&search_sort=3&spq=0,여성질환
5,2020.10.09,[],윈도우 10 2004 업데이트 오류 해결방법 부탁드립니다.,"업데이트 하려고 하는데,
바이러스 백신 프로그램을 끄고 다시 진행하라고 하네요..?
오류코드 0x80070005 라고 합니다..
어떻게 해야 하나요? 알약 그런거 설치한적 없습니다..ㅠ","['아래의 링크를 참조해 보시기 바랍니다.\nhttps://itfix.tistory.com/746\n""바이러스 백신 소프트웨어를 끄고 다시 시도하세요"" 0x80070005 오류 해결 방법\n\'오류가 발생했습니다. 바이러스 백신 소프트웨어를 끄고 다시 시도하세요. 오류 코드는 0x80070005입니다.""라는 오류 메시지에 대한 해결 방법입니다. 순서대로 해결 방법을 시도해 보시면 됩니다. 1. 드라이브..\nitfix.tistory.com']",1,https://kin.naver.com/qna/detail.naver?d1id=1&dirId=10301&docId=370243825&qb=67Cx7Iug&enc=utf8&section=kin&rank=49&search_sort=3&spq=0,윈도우
6,2020.10.09,[],문과출신이라서 물어봅니다 메르스완치환자들이생겨난는데 다낳았단말은 몸에항체가생겨서나은게 아닌가요? 그리고그항체로 백신을만들수는없나요?,,"['또 한 가지, 많은 분들이 오해하시는 게 있는데, 백신은 치료제가 아니라 예방약입니다.병이 안 걸린 사람이 향후에 안 걸리기 위해서 쓰는 거죠.항체는 바이러스를 없애는, 치료제인 거고요. 그렇기 때문에 서로 목적이 다릅니다.']",1,https://kin.naver.com/qna/detail.naver?d1id=7&dirId=70122&docId=370240380&qb=67Cx7Iug&enc=utf8&section=kin&rank=56&search_sort=3&spq=0,응급의학과
7,2020.10.09,[],12월이나 1월 쯤 일본여행 갈수 있나요? 2월쯤도 괜찮아요 가능한가요? 어디서 확인할 수 있을까요?? 일주일이나 3박4일 정도 그냥 관광목적으로요,,"['내년봄엔  가능할듯  3월쯤요^^', '현재의 상황으로는 12월 1월에도 일본여행은 가능하지 않을 것입니다.\n코로나가 해결이 되어야 하는데, 12-1월 사이에 코로나가 해결될 가능성은 0% 입니다.\n백신이 출시된 것도 아니고, 코로나 청정 상태가 된 것도 아닙니다.\n그래서 필수적인 경우를 제외하고 여행목적의 일본 입국이 12월에 풀릴 가능성은 거의 없습니다.\n여행목적의 입국이 가능하려면 코로나 전염이 해결되야 합니다. 백신이 일반화 되는 시점이 되어야 합니다.\n내년 중후반이나 가능 할 것입니다.']",2,https://kin.naver.com/qna/detail.naver?d1id=9&dirId=9020101&docId=370233685&qb=67Cx7Iug&enc=utf8&section=kin&rank=64&search_sort=3&spq=0,일본
7,2020.10.09,[],퇴직금 오백으로 뭘할까,,"['요즘 주식이 많이 떨어져 있잖아요. 주식사서 박아두세요.\n코로나로 여행관련 주식이 많이 떨어져 있어요. 이제 백신도 개발될 테고 하니 대한항공 주식을 사보는 것은 어떨까요? 아마 내년엔 700으로 변해 있을지 몰라요.', '제테크 돌려요 !!\n지금 노다지에요 구경이라도 하러 오세요 !!\n기다릴게요 ㅎㅎ\n카톡 Hill999\n=======================\n  제테크 프로 이다정 입니다!!\n  매일 하루 10분~1시간이면 수익나는 제테크\n  어려운 제테크로 손실은 그만!\n  확실한 투자법으로 수익 찰출\n  하루 수익 1000↑ 매일 오르는 수익\n제테크는 어려운 분야가 아닙니다!!\n남녀노소 누구나 쉽게 시작하실수 있습니다.\n""신세계제테크 이다정 프로 경력""\n●4,5,6월 분기 수익창출 1위\n●주식/펀드/저축/보험 팀장경력\n●해외/장외/선물/옵션 우수경력\n●현, ""신세계제테크"" 프로\n""누구나 쉽게 참여가능하도록, 시스템 구축""\n  가입비, 정보비, 연회비 등 금전요구 일체요구 없습니다!\n  요구한다면 사기업체일 가능성이 상당히 높습니다!!!\n  1:1 개인컨설팅 및 프로팀의 체계적 관리\n  소액부터~ 고액까지, 손실없는 플랜체계\n  모바일, PC 어디서든 30분이면 진행완료\n주식으로 폭망하신분들!\n토토나 도박으로 인해 생활고를 겪고 계시고, 대출이 많으신분들!\n⚠️카톡 상담 :https://open.kakao.com/o/sPtHOkzc\n⚠️네이버 밴드 :http://spreadfunders.com/band/42778733/\n⚠️인스타 그램 :https://www.instagram.com/d.jung_mon/\n절 선택해주시면 올바른 선택으로 이끌고,\n도움이 되겠습니다.\n지금바로 연락주세요 !\n사진 설명을 입력하세요.\n사진 설명을 입력하세요.', '뭘할까~ 고민 말고 500만원 1년짜리 예금 넣어 두세요\n이자 이딴거 생각말고 내돈 젤 안전하게 지켜줄 1금융 에다가 넣어두세요\n때가 되면 요기나게 쓰일 곳이 생깁니다.\n기회가 와도 총알이 없어 놓치는 경우가 종종 있기 마련 이지요...', '안녕하세요 BTC 24 VIP점입니다 ♥\n요즘 마진거래 상품으로 재테크 많이 하고 계시는거 다들 알고 계시죠?\n그중에서도 많이 알고 계신 재테크 상품이 \'FX시티\' 였죠\n최근에 불법판결을 받고 문을 닫게되면서 ""골드라임,IR24,FBM,비트탑,APX""로 업 \n체명을 바꿔서 운영합니다.\n저희 ""BTC 24""는 업계 최고로 불법이된 FX시티와 다르게 고객님들의 안전성을 확실하게 보장받으실 수 있도록 ""특허출원등록""이 되어있는 합법적인 법인회사 입니다.\n주식같은경우 ""실수익을 보기까지 많은 시간이 소요되고 소액으로 투자가 힘들다""는거 다들 알고있으실겁니다\n저희 마진거래 상품은 소액으로 단타로 수익을 보실 수 있고 모바일로도 쉽게 \n가능하기 때문에 남녀노소 상관없이 많이 이용하고 있으십니다.\nBTC 24 VIP점은 회원도 전국 지사 중 가장 많으며 전문 리딩자가 진행하는\n무료리딩방을 운영하고 있고 적중률 또한 가장 높다고 자부합니다!\n마진거래를 이용해보지 않으신 분들 또한 쉽게 이용하실 수 있으며 \n리딩을 통해 보다 손쉽게 수익을 보실 수 있습니다\n믿고 연락주시면 무조건 수익 보실 수 있게 해드리겠습니다.\n- FX 마진거래와 달리 365일 24시간 활성화 ""주말에도 24시간 이용가능합니다""']",4,https://kin.naver.com/qna/detail.naver?d1id=12&dirId=1202&docId=370230803&qb=67Cx7Iug&enc=utf8&section=kin&rank=69&search_sort=3&spq=0,부산광역시
7,2020.10.09,['코로나바이러스인가요'],감기인지 코로나인지 모르겠어요,"열은 37도가 기본으로 나오고 어쩌다 보면 36도도 나와요
어떤때는 열이 많이 올라 38도도 나왔습니다
기침하고 시내는 나갔다왔지만 확진자와 접촉은 없었습니다
(저의 동네는 확진자가 시내를 돌아다니지 않았어요)
콧물, 미각상실, 후각상실은 없었고 가래는 조금 나왔습니다
코로나 때문에 불안해요 감기일까요 코로나일까요..?","['네, 환절기라 감기인지 코로나인지 걱정을 하는 사람들도 많은데요.\n질문자님이 기침등을 한다면 병원등에 가서 약을 먹어 보고 그래도 낫지 않는다면 질병본부 1339, 지역번호+120이나 보건소에 상담을 받아 보시기를 바랍니다.\n코로나 바이러스는 무증상도 많고 약한 증상도 있으며 감기나 독감증세와 비슷하다고 하며 증상으로는 기침,가래,콧물,두통,발열,인후통,근육통,호흡곤란,설사,복통,결막염,후각 미각 마비등 이외에도 다양한 증세가 있다고 합니다.\n전세계 코로나 확진자는 3,600만명 그리고 사망자는 106만명으로 계속 확산이 되고 있으며 세계보건기구는 확진자가 실제로는 20배이상 많으며 사망자는 2배 이상 많을 것으로 예측을 하고 있습니다.\n아직 백신과 치료제가 개발이 되지 않아 항상 마스크를 쓰고 사람들과 접촉을 피하며 손을 자주 씻어 코로나 바이러스를 예방을 해야 할것입니다.\n감사합니다.']",1,https://kin.naver.com/qna/detail.naver?d1id=7&dirId=70102&docId=370231921&qb=67Cx7Iug&enc=utf8&section=kin&rank=66&search_sort=3&spq=0,이비인후과
9,2020.10.09,['#독감예방주사'],독감예방주사,오늘낮에 백신을 맞았는데요 맞고 3시간뒤부터 미열이나고 지금은 잠을 잘수없을정도에 근육통이있는데 타이레놀이나 진통제를 먹어도 돼나요?진짜 너무아프네요,"['원래 독감 맞으면 그렇습니다 자고 일어나셔서 그러시면 병원가세여', '안녕하세요? 황닥입니다.\n걱정 많으시죠? 2~3일 정도 경미한 증상이 있을수 있지만\n심하거나 오래되면 꼭 진료 보셔야 하고 보건소에 전화해서 문의 하시면 좋아요\n독감 예방 접종, 특히 올해 기준으로 바뀐 점 위주로 알려드릴게요\n2020 독감예방접종 https://www.youtube.com/watch?v=MKCSxo2zS38\n다시 시작된 무료접종 대상 및 상온노출독감주사 확인하는 법 https://m.blog.naver.com/ekgo83/222108219353\n상온노출된 독감주사인지 확인하는방법\n코로나 19 유행 때문에 이번에 독감 예방 접종은 아주 중요합니다.독감 접종 왜 해야 할까요? https://ww...\nm.blog.naver.com']",2,https://kin.naver.com/qna/detail.naver?d1id=7&dirId=70401&docId=370214809&qb=67Cx7Iug&enc=utf8&section=kin&rank=82&search_sort=3&spq=0,의약품
9,2020.10.09,[],독감 주사 맞는게 무서워요..,고3입니다. 제가 예방접종 맞아본게 제 기억으론 한번도 없거든요 근데 독감 걸려본적은 없어요.. 이번엔 코로나 때문에 맞아야될거같은데 제가 몸이 좀 허약(?)하다 해야되나 막 어디가 특별히 아픈건 아닌데요 몸이 많이 마른 편이라 소화가 거의 매일 안되고 설사도 자주해서 내과에 자주 가는편이에요.. 암튼 그런데 독감 주사가 항원 집어넣는거잖아요 근데 혹시 열나거나 감기 걸리는거 아닐지 걱정돼서 못맞겠어요ㅠㅠㅠ 사람들이 백신 못믿는다고 그래서 더 무서워요 의사선생님들 의견을 듣고싶습니다 독감 백신 부작용이 많나요?ㅠ,"['신생아도 주사맞아요\n코로나시대 더더욱맞아야되요', '맞았는데 괜찮았어요 너무 두려워마세요 독감 걸리면 더 많이 아플거애요 ㅠㅠ', '안녕하세요? 황닥입니다.\n독감 예방 접종, 특히 올해 기준으로 바뀐 점 위주로 알려드릴게요\n2020 독감예방접종 https://www.youtube.com/watch?v=MKCSxo2zS38', '저도 그생각으로  안맞다가 맞았는데..\n독감 주사 자체가 팔에 근육통을 살짝 일으키거든요?\n그거말고는 아무 이상없었어요.\n걱정마시고 맞고오세요. ', '고3인데 주사가 왜 무서워요?']",5,https://kin.naver.com/qna/detail.naver?d1id=7&dirId=70115&docId=370217822&qb=67Cx7Iug&enc=utf8&section=kin&rank=81&search_sort=3&spq=0,소아청소년과
8,2020.10.09,[],아무리 대통령이라 해도,"본인이 각 장관한테 어느정도 실권을 줘야 하는데 그렇게 안햇습니다. 
질본만 하더라도(지금은 청으로 됬지만) 문재인씨가 정은경 본부장한테 권한과 책임을 넘기니 정은경씨가 책임있게 융통성있게 해서 코로나19를 막는데 정말 크게 도움이 되었고 독감백신 문제가 있긴 해도 사실 100%정은경 청장의 잘못보다는 (최고권위자라 100%아니더라도 큰책음 있음) 오래전부터 내려온 관행, 악습, 안일함이라는 악재를 만나 이렇게 된거지 독감도 사실 정은경청장이 스스로 책임감있게 준비 한거에 대해서는 높이 평가 받을만하다고 생각합니다, 
이렇듯 무슨 일을 주어질때 책임도 줘야 하지마나 권한도 주고 인센티브도 주고 해야 한느데 
문재인씨는 코로나19는 자기분야 아니니 넘겨주되 오래전부터 해오고 싶어하던 검찰&부동산&세금&돈 문제는 직접 모든걸 지시해서 자기가 직접 권한내세워서 내 말에 반대된사람들을 전부 다 쳐내버리고 그 자리를 자기 입맛에 맞는 사람 홍남기, 추미애, 김현미 그리고 이낙연 (당대표로 빠지니 실질적인 영향은 아직도 큼)
이렇게 거수기들만 채워지고 이 사람은 당연히 책임있게 할 사람들이 아니고 그저 대통령이 시키면 시킨대로 하는 정도의 역활만 하는것입니다.
 과거 노무햔 대통령의 자살로 인해 많은 트라우마 때문에 직접 하는것으로 보이지만 그렇다쳐도 
대통령이라는 사람이 자기 입맛에 입맛대로 하고 싶은정책은 거수기와 허수아비를 내세우고 자기 멋대로하고 그 임명된 장돤은 욕받이로쓰고 자기가 관심이 없거나 전문분야가 아닌 쪽에는 정은경, 박능후분을 쓰고 
조금전 말씀처럼 너무 대통령 위주의 권한이 강하다보니 이러한 결과를 낳은것 같습니다., 
대통령권환을 줄이되 각 청장, 장관의 힘은 강하게 대신 책임도 쎄게 인센티브도 줘야 하는 방향으로 개헌 해야 합니다. ","['긴글 잘 읽었습니다. 그만큼 대통령제의 단점이 역대 정권을 거쳐 오면서  들어난 상황입니다. \n그만큼 정치 개혁 없이  많은 변화를 요구할 수도 없고 대통령 입장에서도 자신의 임기동안 이루려 하지만, \n야당 역시도 반대를 위한 반대만 하는 정쟁속의, 현시국에선 모두가 실패입니다. \n참으로 어려운 시기 입니다.\n아무리  좋은 대통령이 차기에 나와도, 현 대통령 제도하엔 잘 할수가 없습니다..\n정치 개혁없인 앞으로 더 어려워 집니다. \n젊은 정치 초년생들도 기성 정치인 흉내를 내고 있는 현실입니다.']",1,https://kin.naver.com/qna/detail.naver?d1id=6&dirId=61404&docId=370218190&qb=67Cx7Iug&enc=utf8&section=kin&rank=80&search_sort=3&spq=0,"정치인, 공무원"
