page,date,tags,questions,questions_add,answers,N_answer,url,category
17,2020.09.13,[],코로나 2.5단계가 더 연장되면,학교는 못가나요?,"['네 또 고3 제외 등교는 어렵습니다..\n<코로나 2.5단계> 사회적 거리두기 2.5단계 총정리 (준3단계)\n코로나 2.5단계 학교,학원,음식점,카페,배달,빵집,독서실,pc방,헬스장,스터디카페,당구장 _ 정부가 사회적 거리두기 3단계 격상은 이번에는 실시하지 않기로 했다. =코로나 3단계 격상 아직 시기상조 판단 대신..\ndingdo.tistory.com\n위는 코로나 2.5단계 실시 안내 입니다 \n(기간, 위반시 처벌, 배달음식 시간대 등)', '결국올게 왔습니다....  코로나 2.5단계로 격상했습니다. \n처음듣는거라 생소하겠지만 준3단계라지만 거의 3단계라고 보시면됩니다. \n달라지는점이 뭐가있는지 아래확인해보세요..\n간단하게 요약해드리자면 식당,술집은 9시까지만 영업가능합니다.\n술집은 사실상 영업정지라고 보면됩니다.\n카페는 포장 배달만 허용되고, 독서실 ,스터디카페,학원,헬스장 다 9월6일까지 영업정지입니다.\n정말 이러다가 어찌될지 너무 걱정입니다.\n하루빨리 백신이 나와야하겠습니다..\n▼코로나 2.5 단계 격상 달라지는 것 기간 지역 (+사회적 거리두기 2.5단계 기준) 헬스장 학교 학원\nhttps://speedsalgoo.tistory.com/414\n코로나 2.5 단계 격상 달라지는 것 기간 지역 (+사회적 거리두기 2.5단계 기준) 헬스장 학교 학원\n코로나19(신종 코로나바이러스 감염증) 신규 확진자가 전국에서 나오고 멈출기미가 보이지 않자 결단을 내렸습니다. 이처럼 확진자수가 확대되는건 수도권을 중심으로 확산하던 코로나19가 전국으로 퍼진 것은 집..\nspeedsalgoo.tistory.com', '이번에 결국 코로나 2.5단계가 연장됐다고 합니다.....\n연장기간과 달라지는점꼭 참고하시면 될거 같습니다.\n이럴거면 그냥 지난달에 8월 21일부터 31일까지 3단계 해버리지 그랬냐. 코로나 걸리기전에 굶어죽겠네요... 기타 궁금하신 점은 아래 링크 남겨드릴테니 참고하시면 도움이 되실 것 같네요.\n▼코로나 2.5단계 연장 기간 언제까지?(+사회적 거리두기 연장이유 지역 피시방 카페)\nhttps://speedsalgoo.tistory.com/454\n코로나 2.5단계 연장 기간 언제까지?(+사회적 거리두기 연장이유 지역 피시방 카페)\n9월 6일 종료 예정이던 수도권의 사회적 거리두기 2.5단계가 일주일 더 연장된다고 합니다. +추가연장되어서 9월 27일까지 연장되었습니다. 해당내용 아래살펴보세요ㅠㅠ 사회적 거리두기 2.25단계 달라지는 것 코..\nspeedsalgoo.tistory.com\nhttps://speedsalgoo.tistory.com/446\n사회적 거리두기 4단계 기준과 달라지는점(+코로나 4단계 3.5단계 예상)\n몇달 전 만해도 아침에 일어나자마자 미세먼지를 확인했었는데, 2020년은 일상도, 마음도 신체도 너무나 변화를 많이 겪고 있습니다. 이제는 문밖에만 나가도 누가 확진자라고 해도 전혀 이상하지 않은 상황이됐..\nspeedsalgoo.tistory.com']",3,https://kin.naver.com/qna/detail.naver?d1id=12&dirId=1209&docId=367943115&qb=67Cx7Iug&enc=utf8&section=kin&rank=170&search_sort=3&spq=0,경기도
17,2020.09.13,"['검색질문', '통합검색궁금증', '통합검색질문하기']","사회적 거리두기 2.5단계 연장하면 모고는 어떻게 되는거죠??
이게 연장이니까 우리 수도권은 또 10인이상 모임 금지일텐데 연기는 안할려나요??",,"['자영업자만 죽어나는거죠 공무원들은 살맛나고요', '결국올게 왔습니다....  코로나 2.5단계로 격상했습니다. \n처음듣는거라 생소하겠지만 준3단계라지만 거의 3단계라고 보시면됩니다. \n달라지는점이 뭐가있는지 아래확인해보세요..\n간단하게 요약해드리자면 식당,술집은 9시까지만 영업가능합니다.\n술집은 사실상 영업정지라고 보면됩니다.\n카페는 포장 배달만 허용되고, 독서실 ,스터디카페,학원,헬스장 다 9월6일까지 영업정지입니다.\n정말 이러다가 어찌될지 너무 걱정입니다.\n하루빨리 백신이 나와야하겠습니다..\n▼코로나 2.5 단계 격상 달라지는 것 기간 지역 (+사회적 거리두기 2.5단계 기준) 헬스장 학교 학원\nhttps://speedsalgoo.tistory.com/414\n코로나 2.5 단계 격상 달라지는 것 기간 지역 (+사회적 거리두기 2.5단계 기준) 헬스장 학교 학원\n코로나19(신종 코로나바이러스 감염증) 신규 확진자가 전국에서 나오고 멈출기미가 보이지 않자 결단을 내렸습니다. 이처럼 확진자수가 확대되는건 수도권을 중심으로 확산하던 코로나19가 전국으로 퍼진 것은 집..\nspeedsalgoo.tistory.com', '이번에 결국 코로나 2.5단계가 연장됐다고 합니다.....\n연장기간과 달라지는점꼭 참고하시면 될거 같습니다.\n이럴거면 그냥 지난달에 8월 21일부터 31일까지 3단계 해버리지 그랬냐. 코로나 걸리기전에 굶어죽겠네요... 기타 궁금하신 점은 아래 링크 남겨드릴테니 참고하시면 도움이 되실 것 같네요.\n▼코로나 2.5단계 연장 기간 언제까지?(+사회적 거리두기 연장이유 지역 피시방 카페)\nhttps://speedsalgoo.tistory.com/454h\n코로나 2.5단계 연장 기간 언제까지?(+사회적 거리두기 연장이유 지역 피시방 카페)\n9월 6일 종료 예정이던 수도권의 사회적 거리두기 2.5단계가 일주일 더 연장된다고 합니다. +추가연장되어서 9월 27일까지 연장되었습니다. 해당내용 아래살펴보세요ㅠㅠ 사회적 거리두기 2.25단계 달라지는 것 코..\nspeedsalgoo.tistory.com\nhttps://speedsalgoo.tistory.com/446\n사회적 거리두기 4단계 기준과 달라지는점(+코로나 4단계 3.5단계 예상)\n몇달 전 만해도 아침에 일어나자마자 미세먼지를 확인했었는데, 2020년은 일상도, 마음도 신체도 너무나 변화를 많이 겪고 있습니다. 이제는 문밖에만 나가도 누가 확진자라고 해도 전혀 이상하지 않은 상황이됐..\nspeedsalgoo.tistory.com', ""거리두기 2단계 및 조치 완화에 대해서 정리하였습니다. 한번 참고해 보시면 도움이 될 것 같습니다. 도움이 되셨다면 채택 부탁드립니다.\n▼ 수도권 거리두기 2단계 하향조정 자주묻는 질문 정리\nhttps://info.dinoa.xyz/136\n수도권 거리두기 2단계 하향 조정.. 피시방, 음식점, 술집, 헬스장, 카페, 도서관, 결혼식장, 교회(++자주묻는 질문 정리)\n하늘 아래 다양한 정보를 전달하는 하 늘 정 보 입니다. 오늘은 '수도권 거리두기 2단계 완화조치' 에 대해서 알아보겠습니다. 중앙재난안전대책본부는 수도권의 사회적 거리 두기를 2단계로 완화하여 9월 27..\ninfo.dinoa.xyz""]",4,https://kin.naver.com/qna/detail.naver?d1id=4&dirId=40604&docId=367944037&qb=67Cx7Iug&enc=utf8&section=kin&rank=169&search_sort=3&spq=0,"복지, 종교"
17,2020.09.13,[],"코로나 2.5단계 취소, 연장 ,일부완화 여부 오늘(13일) 몇시에발표되나요?",알려주세요!,"['결국올게 왔습니다....  코로나 2.5단계로 격상했습니다. \n처음듣는거라 생소하겠지만 준3단계라지만 거의 3단계라고 보시면됩니다. \n달라지는점이 뭐가있는지 아래확인해보세요..\n간단하게 요약해드리자면 식당,술집은 9시까지만 영업가능합니다.\n술집은 사실상 영업정지라고 보면됩니다.\n카페는 포장 배달만 허용되고, 독서실 ,스터디카페,학원,헬스장 다 9월6일까지 영업정지입니다.\n정말 이러다가 어찌될지 너무 걱정입니다.\n하루빨리 백신이 나와야하겠습니다..\n▼코로나 2.5 단계 격상 달라지는 것 기간 지역 (+사회적 거리두기 2.5단계 기준) 헬스장 학교 학원\nhttps://speedsalgoo.tistory.com/414\n코로나 2.5 단계 격상 달라지는 것 기간 지역 (+사회적 거리두기 2.5단계 기준) 헬스장 학교 학원\n코로나19(신종 코로나바이러스 감염증) 신규 확진자가 전국에서 나오고 멈출기미가 보이지 않자 결단을 내렸습니다. 이처럼 확진자수가 확대되는건 수도권을 중심으로 확산하던 코로나19가 전국으로 퍼진 것은 집..\nspeedsalgoo.tistory.com', '이번에 결국 코로나 2.5단계가 연장됐다고 합니다.....\n연장기간과 달라지는점꼭 참고하시면 될거 같습니다.\n이럴거면 그냥 지난달에 8월 21일부터 31일까지 3단계 해버리지 그랬냐. 코로나 걸리기전에 굶어죽겠네요... 기타 궁금하신 점은 아래 링크 남겨드릴테니 참고하시면 도움이 되실 것 같네요.\n▼코로나 2.5단계 연장 기간 언제까지?(+사회적 거리두기 연장이유 지역 피시방 카페)\nhttps://speedsalgoo.tistory.com/454\n코로나 2.5단계 연장 기간 언제까지?(+사회적 거리두기 연장이유 지역 피시방 카페)\n9월 6일 종료 예정이던 수도권의 사회적 거리두기 2.5단계가 일주일 더 연장된다고 합니다. +추가연장되어서 9월 27일까지 연장되었습니다. 해당내용 아래살펴보세요ㅠㅠ 사회적 거리두기 2.25단계 달라지는 것 코..\nspeedsalgoo.tistory.com\nhttps://speedsalgoo.tistory.com/446\n사회적 거리두기 4단계 기준과 달라지는점(+코로나 4단계 3.5단계 예상)\n몇달 전 만해도 아침에 일어나자마자 미세먼지를 확인했었는데, 2020년은 일상도, 마음도 신체도 너무나 변화를 많이 겪고 있습니다. 이제는 문밖에만 나가도 누가 확진자라고 해도 전혀 이상하지 않은 상황이됐..\nspeedsalgoo.tistory.com', '정부는 2주간 수도권의 사회적 거리두기를 2단계로 조정발표했습니다.\n수도권 일반음식점 술집 등 밤 9시 이후 \n철저한 방역수칙을 지키는 조건으로 정상 영업을 할 수 있다.\n또한, pc방 카페·식당·헬스장 영업제한 해제, \n프랜차이즈형 카페·빵집은 당장 14일부터 정상 영업가능\n학원과 직업훈련기관의 경우도 대면수업이 허용\n▼다음은 사회적 거리두기 1단계 2단계 3단계 기준 및 지역(+ 구분)\n코로나19 재차 확산 사회적 거리두기 (+1~3단계 알아보기)\n코로나19의 확산으로 인해 중앙재난안전대책본부는 15일 수도권 지역의 코로나19 확산을 막기 위해 16일부터 서울과 경기지역을 대상으로 사회적 거리두기 단계를 1단계에서 (2주간 사회적 거리두기) 2단계로 격상..\nclantown1733.tistory.com', '결국올게 왔습니다....  코로나 2.5단계로 격상했습니다. \n처음듣는거라 생소하겠지만 준3단계라지만 거의 3단계라고 보시면됩니다. \n달라지는점이 뭐가있는지 아래확인해보세요..\n간단하게 요약해드리자면 식당,술집은 9시까지만 영업가능합니다.\n술집은 사실상 영업정지라고 보면됩니다.\n카페는 포장 배달만 허용되고, 독서실 ,스터디카페,학원,헬스장 다 9월6일까지 영업정지입니다.\n정말 이러다가 어찌될지 너무 걱정입니다.\n하루빨리 백신이 나와야하겠습니다..\n▼코로나 2.5 단계 격상 달라지는 것 기간 지역 (+사회적 거리두기 2.5단계 기준) 헬스장 학교 학원\nhttps://speedsalgoo.tistory.com/414\n코로나 2.5 단계 격상 달라지는 것 기간 지역 (+사회적 거리두기 2.5단계 기준) 헬스장 학교 학원\n코로나19(신종 코로나바이러스 감염증) 신규 확진자가 전국에서 나오고 멈출기미가 보이지 않자 결단을 내렸습니다. 이처럼 확진자수가 확대되는건 수도권을 중심으로 확산하던 코로나19가 전국으로 퍼진 것은 집..\nspeedsalgoo.tistory.com']",4,https://kin.naver.com/qna/detail.naver?d1id=8&dirId=80902&docId=367944501&qb=67Cx7Iug&enc=utf8&section=kin&rank=168&search_sort=3&spq=0,시설보수
17,2020.09.13,[],코로나 2.5단계 기간,"2.5단계 언제까진가요. 아직 결과 안나왔나요
낼부터는 2단계인건가요","['코로나 방역 2.5단계로 외출이 더 어려워져 고생이 많으십니다.\n오늘 정부 발표에 의하면 9/13 오늘부터 2단계로 하향 관리한다고 합니다.\n다만, 곧 추석이 있어서 대대적인 방역 활동을 하고 추석 때 이동을 자제요청하고 있네요.\n코로나가 하루빨리 끝나서 일상으로 돌아갔으면 하네요.', '결국올게 왔습니다....  코로나 2.5단계로 격상했습니다. \n처음듣는거라 생소하겠지만 준3단계라지만 거의 3단계라고 보시면됩니다. \n달라지는점이 뭐가있는지 아래확인해보세요..\n간단하게 요약해드리자면 식당,술집은 9시까지만 영업가능합니다.\n술집은 사실상 영업정지라고 보면됩니다.\n카페는 포장 배달만 허용되고, 독서실 ,스터디카페,학원,헬스장 다 9월6일까지 영업정지입니다.\n정말 이러다가 어찌될지 너무 걱정입니다.\n하루빨리 백신이 나와야하겠습니다..\n▼코로나 2.5 단계 격상 달라지는 것 기간 지역 (+사회적 거리두기 2.5단계 기준) 헬스장 학교 학원\nhttps://speedsalgoo.tistory.com/414\n코로나 2.5 단계 격상 달라지는 것 기간 지역 (+사회적 거리두기 2.5단계 기준) 헬스장 학교 학원\n코로나19(신종 코로나바이러스 감염증) 신규 확진자가 전국에서 나오고 멈출기미가 보이지 않자 결단을 내렸습니다. 이처럼 확진자수가 확대되는건 수도권을 중심으로 확산하던 코로나19가 전국으로 퍼진 것은 집..\nspeedsalgoo.tistory.com', '이번에 결국 코로나 2.5단계가 연장됐다고 합니다.....\n연장기간과 달라지는점꼭 참고하시면 될거 같습니다.\n이럴거면 그냥 지난달에 8월 21일부터 31일까지 3단계 해버리지 그랬냐. 코로나 걸리기전에 굶어죽겠네요... 기타 궁금하신 점은 아래 링크 남겨드릴테니 참고하시면 도움이 되실 것 같네요.\n▼코로나 2.5단계 연장 기간 언제까지?(+사회적 거리두기 연장이유 지역 피시방 카페)\nhttps://speedsalgoo.tistory.com/454\n코로나 2.5단계 연장 기간 언제까지?(+사회적 거리두기 연장이유 지역 피시방 카페)\n9월 6일 종료 예정이던 수도권의 사회적 거리두기 2.5단계가 일주일 더 연장된다고 합니다. +추가연장되어서 9월 27일까지 연장되었습니다. 해당내용 아래살펴보세요ㅠㅠ 사회적 거리두기 2.25단계 달라지는 것 코..\nspeedsalgoo.tistory.com\nhttps://speedsalgoo.tistory.com/446\n사회적 거리두기 4단계 기준과 달라지는점(+코로나 4단계 3.5단계 예상)\n몇달 전 만해도 아침에 일어나자마자 미세먼지를 확인했었는데, 2020년은 일상도, 마음도 신체도 너무나 변화를 많이 겪고 있습니다. 이제는 문밖에만 나가도 누가 확진자라고 해도 전혀 이상하지 않은 상황이됐..\nspeedsalgoo.tistory.com']",3,https://kin.naver.com/qna/detail.naver?d1id=8&dirId=814&docId=367946756&qb=67Cx7Iug&enc=utf8&section=kin&rank=167&search_sort=3&spq=0,기타
18,2020.09.13,[],완화된 2.5단계,완화되면 어떤부분이 바뀔가요? ㅠㅠ 시간제한 없어지고 예전 처럼 생활 가능한가요? 그런다 하더라도 걱정이 되네요ㅠ,"['아직 완화된 2.5단계 내용 하나도 나온거\n없고\n13일 브리핑 공개 입니다.\n<코로나 2.5단계> 사회적 거리두기 2.5단계 총정리 (준3단계)\n코로나 2.5단계 학교,학원,음식점,카페,배달,빵집,독서실,pc방,헬스장,스터디카페,당구장 _ 정부가 사회적 거리두기 3단계 격상은 이번에는 실시하지 않기로 했다. =코로나 3단계 격상 아직 시기상조 판단 대신..\ndingdo.tistory.com\n위는 코로나 2.5단계 실시 안내 입니다 \n(기간, 위반시 처벌, 배달음식 시간대 등)', '결국올게 왔습니다....  코로나 2.5단계로 격상했습니다. \n처음듣는거라 생소하겠지만 준3단계라지만 거의 3단계라고 보시면됩니다. \n달라지는점이 뭐가있는지 아래확인해보세요..\n간단하게 요약해드리자면 식당,술집은 9시까지만 영업가능합니다.\n술집은 사실상 영업정지라고 보면됩니다.\n카페는 포장 배달만 허용되고, 독서실 ,스터디카페,학원,헬스장 다 9월6일까지 영업정지입니다.\n정말 이러다가 어찌될지 너무 걱정입니다.\n하루빨리 백신이 나와야하겠습니다..\n▼코로나 2.5 단계 격상 달라지는 것 기간 지역 (+사회적 거리두기 2.5단계 기준) 헬스장 학교 학원\nhttps://speedsalgoo.tistory.com/414\n코로나 2.5 단계 격상 달라지는 것 기간 지역 (+사회적 거리두기 2.5단계 기준) 헬스장 학교 학원\n코로나19(신종 코로나바이러스 감염증) 신규 확진자가 전국에서 나오고 멈출기미가 보이지 않자 결단을 내렸습니다. 이처럼 확진자수가 확대되는건 수도권을 중심으로 확산하던 코로나19가 전국으로 퍼진 것은 집..\nspeedsalgoo.tistory.com', '이번에 결국 코로나 2.5단계가 연장됐다고 합니다.....\n연장기간과 달라지는점꼭 참고하시면 될거 같습니다.\n이럴거면 그냥 지난달에 8월 21일부터 31일까지 3단계 해버리지 그랬냐. 코로나 걸리기전에 굶어죽겠네요... 기타 궁금하신 점은 아래 링크 남겨드릴테니 참고하시면 도움이 되실 것 같네요.\n▼코로나 2.5단계 연장 기간 언제까지?(+사회적 거리두기 연장이유 지역 피시방 카페)\nhttps://speedsalgoo.tistory.com/454\n코로나 2.5단계 연장 기간 언제까지?(+사회적 거리두기 연장이유 지역 피시방 카페)\n9월 6일 종료 예정이던 수도권의 사회적 거리두기 2.5단계가 일주일 더 연장된다고 합니다. +추가연장되어서 9월 27일까지 연장되었습니다. 해당내용 아래살펴보세요ㅠㅠ 사회적 거리두기 2.25단계 달라지는 것 코..\nspeedsalgoo.tistory.com\nhttps://speedsalgoo.tistory.com/446\n사회적 거리두기 4단계 기준과 달라지는점(+코로나 4단계 3.5단계 예상)\n몇달 전 만해도 아침에 일어나자마자 미세먼지를 확인했었는데, 2020년은 일상도, 마음도 신체도 너무나 변화를 많이 겪고 있습니다. 이제는 문밖에만 나가도 누가 확진자라고 해도 전혀 이상하지 않은 상황이됐..\nspeedsalgoo.tistory.com', '결국올게 왔습니다....  코로나 2.5단계로 격상했습니다. \n처음듣는거라 생소하겠지만 준3단계라지만 거의 3단계라고 보시면됩니다. \n달라지는점이 뭐가있는지 아래확인해보세요..\n간단하게 요약해드리자면 식당,술집은 9시까지만 영업가능합니다.\n술집은 사실상 영업정지라고 보면됩니다.\n카페는 포장 배달만 허용되고, 독서실 ,스터디카페,학원,헬스장 다 9월6일까지 영업정지입니다.\n정말 이러다가 어찌될지 너무 걱정입니다.\n하루빨리 백신이 나와야하겠습니다..\n▼코로나 2.5 단계 격상 달라지는 것 기간 지역 (+사회적 거리두기 2.5단계 기준) 헬스장 학교 학원\nhttps://speedsalgoo.tistory.com/414\n코로나 2.5 단계 격상 달라지는 것 기간 지역 (+사회적 거리두기 2.5단계 기준) 헬스장 학교 학원\n코로나19(신종 코로나바이러스 감염증) 신규 확진자가 전국에서 나오고 멈출기미가 보이지 않자 결단을 내렸습니다. 이처럼 확진자수가 확대되는건 수도권을 중심으로 확산하던 코로나19가 전국으로 퍼진 것은 집..\nspeedsalgoo.tistory.com']",4,https://kin.naver.com/qna/detail.naver?d1id=8&dirId=8010501&docId=367922129&qb=67Cx7Iug&enc=utf8&section=kin&rank=177&search_sort=3&spq=0,"성장, 영양 관리"
17,2020.09.13,[],Antimalware service executable을 삭제하고 싶습니다.,"구형 노트북인데 렘이 4기가 입니다.

Antimalware service executable가 메모리를 200MB나 사용중인 관계로 파일과 서비스를 아예 삭제하고 싶으나 삭제되지 않는 상황입니다.

지금까지 시도해본 방법은 다음과 같습니다.

1. 윈도우10 Home 버전이라 gpedit.msc 사용불가
(gpedit.msc 홈 버전 다운로드도 해봤으나 다운로드 실패 수차례 해봤습니다만 전부 실패)

2. Windows 보안 앱 실행 불가능(이유는 모르겠지만 Windows 보안 앱을 실행하려 하면 바로 창이 꺼지면서 강제 종료

3. 경로 따라가서 unlocker 프로그램을 사용하여 삭제해도
재부팅 뒤 삭제됩니다라는 안내문과 함께 재부팅하면 삭제 되어있지 않음
( 개인 노트북이라 자동 복구 유틸 이런거 사용중이지 않음.. )

4. cmd 명령으로 강제 종료 및 삭제 시도해봤으나 어림도 없음

대중적인 뻔한 해결방법으로는 도저히 해결되지 않습니다.
이 외에도 정말 여러가지 방법을 사용하였음에도 불구하고 해결이 되지 않았는데요.

정말 이 개 거지같은 프로그램 삭제하고 속편해지고싶습니다 조언 구합니다.","['중요한건 USB에 넣고 컴퓨터를 리셋하는것을 추천드립니다 아니면 전문가를 불러서 하는것도있고요', '다른 보안 프로그램(바이러스백신, 개인 방화벽)을 설치하시면, 윈도우즈 10의 바이러스백신과 방화벽이 사용중지되고 기본 기능만으로 작동합니다.\n바이러스백신과 방화벽 기능이 함께 있는 코모도 인터넷 시큐리티를 이용해보세요.\nhttps://youtu.be/KlW9Ou6Xv3Q\n아래는 윈도우즈 10 업그레이드 후에 최적화 방법 안내이니 참고하세요. \nhttp://softwant.com/cgi-bin/itgi/?m=bbs&bid=nawane&uid=10662\n소프트원트 - freedom\n윈도우즈 10 보안 소프트웨어를 다른 제품으로 대체 윈도우즈 10으로 업그레이드한 후에 윈도우즈 10을 제대로 쓰려면, 여러가지 설정을 변경해주어야 한다. 설치 그대로를 이용하기에는 윈도우즈 10 설치 시스템 최소사양을 쓰는 컴퓨터라면, 윈도우즈 10의 불필요한 요소를\nsoftwant.com', '음.. 일단 해볼만큼 해보신거 ㅓ같은데\n안되면 그냥 윈도우 초기화를 해보는게 좋을 거 같아요\n초기화 하면 아마 기존에 해봤던 방법으로 다 될 거 같은 느낌이 드네요.\n초기화 방법 아래 글 보고 따라해보세요!\nhttps://itgroovy.tistory.com/467\n윈도우10 초기화 이렇게만 따라하시면 됩니다.\n컴퓨터를 계속적으로 이용하면 당연히 PC가 점점 느려지게 됩니다. 윈도우10이 설치된 최신PC일 경우에도 사용하다 보면 상당히 느려지게 됩니다. 이렇게 컴퓨터가 느려질 때에는 포맷을 한 뒤 윈도우 재설치를 하..\nitgroovy.tistory.com']",3,https://kin.naver.com/qna/detail.naver?d1id=1&dirId=10301&docId=367954236&qb=67Cx7Iug&enc=utf8&section=kin&rank=165&search_sort=3&spq=0,윈도우
