page,date,tags,questions,questions_add,answers,N_answer,url,category
12,2021.01.30,"['우울증', '힘들어요']",삶의 의욕,"안녕하세요 저는 군대도 갓다오고 올해 25살이고
학교졸업하고 취업자리 알아보고 취업확정인
남자입니다. 요새 너무 내가 왜 사는걸까? 이런생각이
많이듭니다..

왜일까요? 정말 모르겟습니다 요새 정말 너무 힘듭니다
부모님께서 저 독립할때 보증금 300,400만원 주신다 하셔서 일용직 쿠팡 알바를 하면서 돈을 모아 첫달월세 생활비
식비 마련을 해야겟다는 생각이 들어
지원을 하지만 매번 물량 때매 떨어지고 그냥
집에만 잇어서 그런지 우울감에 미쳐버릴거같습니다
올해 초에난 국가고시에 붙어 정말 기뻣는데

요새 자괴감에 빠져 정신이 혼미합니다.
몸도 마음도 지쳐 집에서 좀 쉴려고 하면
취업하라고 계속 집에서 난리를 쳐서
미칠거같습니다 정확히 말하면

누나가 근무하는가게에서 같이 일해보라는 말인데
가족하고 일하기 거부감이 들어 싫다고 햇으나
끝까지 하라고 하고 정말 미쳐버릴거같습니다

우울감에 사로잡혀 이불에서 일어나기도 싫고
일은 일대로 안잡혀 또 나쁜생각만 듭니다

제가 복에 겨운건지 아니면 정말 한심한건지
그냥 어느순간부터 방에서 나가기도싫고 그냥
다 끝내고 싶고 뭐 먹기도싫고
그런 상태입니다 이우울감을 어떻게
극복해야할지도 모르겟고

다시 열정적인 인생을 살고싶으나 정말
그냥 의욕을 들지않고 병에 걸린거 같습니다
정말 무엇을 어디서부터 잘못된건지
고민상담좀 부탁드립니다..","['군대도 다녀오시고 국시도 붙으시고 많은걸 해내셨군요!\n일단 수고하셨습니다 고생했어요 ㅎㅎ\n고민이란건 참 상대적이에요 나는 죽을 것 같고 괴롭고\n힘든데 누군가에게는 내 고민이 복에 겹다 느낄 수도\n있고 부러울 수도 있으니 말이죠\n내가 누군가보다 덜 힘들다고해서 내 고민이 줄어들거나\n덜 힘든건 아니라고 생각해요 개인의 가치는 사람마다\n다르고 어떤 고민이든 각자 느끼는 크기가 다를테니\n말이죠  ㅎ\n요즘 코로나로 인해서 예전처럼 자유롭지도 못하고\n경제 생활도 맘편히 할 수 없는 시국이잖아요\n나의 의지가 아닌 외부적 요인으로 통제되고 차단되는\n상황이라 이런것들이 사람을 더 우울하게 만드는 것\n같아요\n생각보다 많은 사람들이 질문자님처럼 힘들고 우울감에\n빠져 지내고 있다 생각해요 나만 못나서 그런게 아니고\n모두가 공감 할 수 있는 상황이라 안타까워요\n시간이 꽤 걸리겠지만 코로나는 끝이나겠죠? 감기의\n형태든 어떤 형태든 우리 일상에 함께 존재하겠지만\n완전한 백신도 치료법도 생겨날테고 끝이 있을거란\n말이죠 다행인점은 이 시국에 끝이 있다는거에요\n질문자님의 괴로운 고민, 우울한 기분도 반드시\n끝이 있다고 말씀드리고 싶어요 상황이 그렇게 만든거지\n질문자님은 힘든 군대도 잘 다녀오시고 무려 국시도\n합격하셨잖아요!! 다 원래대로 돌아갈 수 있어요\n부모님과의 갈등도 좋은방향을 찾을 수 있으리라 믿어요\n우울하다 생각하면 한없이 우울하고 헤어나오는데\n더 힘든 것 같아요 이렇게 글 쓰신 것도 극복해 보시고자\n용기를 내신거잖아요? 잘하셨어요^^\n마스크 잘 끼고 옷 따뜻하게 입고 가벼운 산책 하시면서\n내 의지로 바꿀 수 없는 이 시간을 조금 즐겨보시는건\n어떨까요 기왕 일어난 코로나, 떨어진 알바 다 어쩔 수\n없잖아요 살아보니 기다림의 여유를 안다는게 참\n필요한 것 같더라구요 일어난 일들을 인정하고 받아들이시되 자책하지 마시길 바래요\n다 괜찮아요 잘 될거에요 !!!!!']",1,https://kin.naver.com/qna/detail.naver?d1id=11&dirId=110701&docId=380488694&qb=67Cx7Iug&enc=utf8&section=kin&rank=114&search_sort=3&spq=0,대안교육
12,2021.01.30,"['3차재난지원금', '프리랜서', '프리랜서지원금']",3차재난지원금 학원강사,"이번에 3차재난지원금 프리랜서에 조건이 맞아
신청하려고하는데 수입에 어머니께서 달아놓은
다단계 회사의 주급이 한달에 2~3천원씩 계속 있는데
이것도 수입에 추가시켜야하는거죠?
얘네때문에 뭔가 문제되지는 않겠죠ㅠㅠ?","['경기도 2차 지원금 및 3차 재난지원금\n(대상,금액,신청)에 대한 내용\n아래 글에 잘 정리되어있습니다~!\nhttp://m.site.naver.com/0JLDI\n3차 재난 지원금 대상 및 신청 방법\n3차 재난 지원금 최신 정보 ☞ 소상공인 버팀목자금 신규 신청 ☞ 3차 재난지원금 특고 프리랜서 신규 신청 ☞ 코로나 3차 소상공인 대출 정책자금 전국 지자체 재난지원금 ☞경기도 재난지원금 ☞인천 재난지원금..\nm.site.naver.com', '아뇨, \n질문자님께서 노무를 제공한 소득만 해당됩니다.\n일단 위 고용노동부 사업공고 내용(1.15일자)에 나와 있는 \n증빙서류 목록을 참조하세요.\n총 4가지 사항입니다.\n1. 필수서류\n2. 자격요건 입증 서류\n3. 소득요건 입증 서류\n4. 소득감소요건 입증 서류\n- 사업장에서 발급하는 서류\n수수료·수당지급명세서, 용역계약서, 위(촉)탁 서류, 노무미제공사실확인서\n- 홈택스에서 발급하는 서류\n종합소득세 신고내역, 원천징수증 : 홈택스(국세청)\n통장입금내역서는 인터넷 뱅킹으로 PDF 인쇄(엑셀 안됨)하거나 은행에 직접 찾아가서(가장 쉬움) 발급요청 하시면 됩니다.\n질문자님이 준비 가능한 자료로 준비하는 것이라 선택하시면 됩니다.\n그외 추가 요건내용, 신청서 양식.hwp, 증빙자료, Q&A 등의 내용 확인하세요.\n위 1번 필수서류.hwp 서식을 다운로드 받으실 수 있습니다.\n고용노동부 사업공고 내용으로 기반한 가장 자세하고 잘 정리된 글입니다.\nhttp://m.site.naver.com/0JQCa\n3차 재난지원금 특고·프리랜서 기준, 신청방법, 서식, Q&A(1.15 공고)\n1.6일과 15일에 공고된 고용 취약계층인 특수고용직과 프리랜서를 위한 지원금인 3차 재난지원금인 긴급고용안정지원금 신청방법과 신청서류에 관한 내용을 자세하게 알려드립니다. 사업공고 내용을 바탕으로 작성..\nm.site.naver.com', '= 질문에 안맞는 복붙 매크로글 답변이 아닌 내용 조건이 변경된 [재난지원금] 가장 정확한 안내 드립니다\n님이 노무를제공한 소득이 아니니\n미포함 입니다.\n<3차 재난지원금> 신청안내, 신청방법\n3차 재난지원금 홈페이지 정부 3차 재난지원금 신청안내 ■3차 재난지원금 정부가 신종 코로나바이러스 감염증(코로나19) 3차 확산으로 피해를 입은 소상공인과 고용취약계층(특고. 프리랜서)에게 3차 재난지원금..\ndingdo.tistory.com\n위는 3차 재난지원금 가장 정확한 신청 안내 출처 입니다 (신청기간, 신청사이트, 신청서류)', '안녕하세요.\n저도 3차 재난지원금에 해당이 되는지 궁금해서 많이 찾아보고했는데요,\n저의 경우에는 다행이도 나오고, 저의 친구들 중에서도 많이 못받는 상황이 있었어요.ㅠ\n제가 설명을 잘하는편이 아니고, 저역시 다른곳을 보면서 공부를 했는데요, 도움이 많이 되서\n이렇게 공유 드려요^&^\n주소 ▶ https://issueinfo.infoissue.com/177\n3차 재난지원금 신청 방법과 신청대상 알아보기\n이번에 정부의 예산안이 확정되었는데요. 국회가 본회의를 통과해 3조원 규모의 재난지원기금이 확정돼었습니다. 오늘 포스팅은 누가 얼마를 받는가 하는 문제를 보도록 하겠습니다. 2차 재난지원기금과 비교해 규..\nissueinfo.infoissue.com\n좋은 하루되세요.\n꼭 좋은소식 있기를 바라요!', '답변드리겠습니다 \n3차 재난지원금 소상공인 버팀목자금 신속지급 1차 정보입니다. \n■ 1차 대상은 집합금지 영업제한 기존 새희망자금 수급한 소상공인 지급입니다. \n적게 받으신 경우 나중에 집합금지 영업제한 대상 확인 되면 추가 지급할 수 있으나 문의처에 문의해 알아보시기 바랍니다. \n문자도 안오고 지급대상자가 아니라고 나온경우\n1월 11일부터 지원하는 집합 금지, 영업제한 업체들은 국세청과 지자체로부터 명단을 받아 1차 확정한것입니다. \n연말연시 특별방역 대상인 겨울스포츠시설, 숙박시설, 지자체 추가하는 집합금지, 영업제한 업체/20년 개업자 등은 1월 25일 이후 신청 받아 지급할 예정입니다. \n2월 1일부터 소상공인이 직접 지자체로부터 집합금지 영업제한업종 확인서를 받아 신청할 수 있습니다. 공동대표/미성년자 대표 등 비영리단체신청입니다. 첨부서류는 공동대표 사업장 위임장 첨부, 집합금지 영업제한 사업장 지자체확인서첨부입니다.\n문자로 연락받아 사업자 번호 입력 후 1차 지급 대상자가 아니라는 경우\n여러 사업장을 운영하시거나 소상공인 기준에 해당하지 않는 사업장, 버팀목 자금 지원 제외 사업장은 사업자 번호 입력한 경우입니다. 다른 사업장 사업자번호 입력을 해보시기 바랍니다. \n소상공인에 해당하는 다른 사업장의 사업자 등록번호 입력을 하거나 지원대상 업종에 해당하는 다른 사업장의 사업자 등록번호를 입력합니다. \n19년 매출이 없고 20년 매출이 있는 경우 : 20년 매출이 19년보다 늘어난 경우 지원 대상이 아닙니다. \n20년 11월 개업했지만 코로나로 매출이 없는 경우 : 매출이 없는 경우 지원대상이 아닙니다.\n1차 신속지급 추가 : 연말연시 특별방역 대상시설/ 새희망자금 미수급자 중 20년 1월~11월 개업 증 지원대상을 추가선별해 1월 25일 이후 지급합니다. \n지원내용 및 방법은 1월 중 별도 안내 예정입니다.  \n신속지급2차 또는 확인지급 2차 신청은 부가가치세 2월 25일 마감된 후 3월쯤 공고예정입니다. \n공통기준은 매출액 19년 또는 20년 매출액 10~120억원 이하여야 합니다. \n소상공인 근로자수 기준은 음식 숙박 5인미만 / 도소매 5인 미만 제조 운송 10인 미만\n개업일은 11월 30일 이전입니다. 영업 중이어야 하며 휴폐업 상태가 아니어야 합니다. \n1인 1개 업체만 가능하며 법인도 마찬가지입니다. \n영업제한 집합금지는 정부 지자체 11월 24일 이후 시행된 경우 기준으로 보시면 됩니다. \n영업제한 집합금지 대상은 아래에서 확인 가능합니다. \n영업제한 집합금지는 매출에 감소 상관없이 신청하시면 됩니다. \n일반 업종은 연매출 4억원 이하 19년 개업은 20년 연매출 19년보다 적고 20년 개업은 9월~11월 매출보다 12월 매출이 적어야 합니다. \n2월 25일 마감 후 매출 감소 하지 않은 경우 환수대상입니다. \n3차 긴급고용안정지원금/ 법인택시/ 방문돌봄종사자 지원금과 중복수급안됩니다. \n11일 부터 신청 가능하고 13일 부터는 홀짝 구분없이 신청 가능합니다. \n1차 확인지급 1월중 공고 2월 지급예정 : 공동대표 소상공인/ 1차 누락 집합금지 및 영업제한 소상공인 등 대상\n확인지급 신청 준비서류는 아래서 확인 가능합니다.\n2차 신속지급 및 확인지급 3월 중 공고 3월 지급예정 : 20년 부가가치세 신고 내용을 토대로 지원 대상 선별 합니다.  \n문의처는 1522-3500번입니다. \n■ 소상공인 신속지급 추가 신청입니다. \n2월 1일 확인지급 대상 요건 필요서류는 1월 말 공고 예정입니다.\n소상공인 버팀목 자금은 총 3차례 신청 받을 예정입니다. \n1차 확인지급은 2월 예정으로 공고는 1월 중 안내되고 공동대표 운영 소상공인, 1차 신속지급 누락집합금지, 영업제한 소상공인입니다. \n2차 신속지급 및 확인지급 신청은  3월 예정이며 별도 공고는 21년 3월 중 진행 예정입니다. 20년 부가가치세 신고 내용으로 지원대상 선별해 지원대상 선정됩니다. \n공동대표/미성년자 대표 등 비영리단체신청입니다. 첨부서류는 공동대표 사업장 위임장 첨부, 집합금지 영업제한 사업장 지자체확인서첨부입니다.\n3월중 20년 매출액 4억원 이하 19년 보다 매출이 감소한 소상공인 국세청 부가가치세신고액으로 선별해 지원합니다. \n일반업종 : 새희망자금 미수급자 중 20년 1~11월 개업 후 12월 매출액이 9~11월 평균 매출액 대비 감소한 소상공인\n집합금지 : 연말연시 특별방역/ 스키장/ 빙상장/ 눈썰매장 및 부대시설 (시설내 음식점, 편의점, 스포츠용품점, 인근 스키대여점) 파티룸/ 밀폐형야외스크린 골프장 수도권만해당\n영업제한 : 연말연시 특별방역 숙박시설\n지자체 교육부 추가 제출대상 (식당/ 카페/ 유흥시설/ 교습소/ 실내체육시설 등)\n새희망자금 기수급자 중 1차 신속지급 미포함대상 24만명\n25일 신청안내 문자를 받으면 신청 페이지 확인하시면 됩니다. \n문자 안오신 분들은 신청페이지 접속 후 대상여부 확인 지급대상이면 신청하면 됩니다. \n지급은 25일~ 27일 신청자는 당일지급 그외 내용은 아래서 확인 하시기 바랍니다. \n27일은 집합금지 영업제한 1차 신속지급시 100만원만 받은 경우 별도 신청 없이 지급예정입니다. \n추가 명단에 없는 경우 \n1월 25일 부터 지자체 교육청에서 행정명령 이행확인서를 받아 2월 1일 이후 확인지급시 지원합니다. \n학원 교습소 독서실은 교육청 그밖에 집합 영업제한은 광역 또는 지자체에서 발급하시면됩니다. \n발급기간은 1월 25일 부터 2월 19일까지 입니다. \n그 밖에 자세한 내용은 아래에서 확인하시기 바랍니다. \n■ 3차 긴급고용안정지원금 신규신청 안내 입니다. \n지원대상 : 1차 2차 미수급자 중 20년 10월 ~11월 노무를 제공하고 소득 50만원이상 발생한 이 기간 고용보험 미가입자입니다. 기준 기간에는 미가입자 였다가 신청일 기준 고용보험 가입자는 신청 가능합니다. \n해당기간 고용보험 가입기간이 10일 이하인 경우 지원 가능합니다. 기초생활 수급자 중 지원요건에 해당하시면 신청 가능합니다. 산재보험 특고 14개 직종 관련 사업자는 예외적으로 적용합니다. 100만원 지원됩니다. \n자격요건 : 10월 ~11월 특고 프리랜서 활동해 50만원 이상 소득이 있어야 하고 비교기간과 12월~1월 소득이 25% 이상 소득 감소한 사람입니다. \n제출서류는 아래 링크에 상세히 나와 있으니 참고 하시기 바랍니다. \n여러사업체 소득시 모두 제출해야 불이익이 없습니다. 중복지원 안되는 지원금 수급시 환수예정\n온라인 신청은 1월 22일~ 2월 1일까지입니다. \n방문 신청은 1월28일~ 2월1일 고용센터 방문해 신분증 및 제출서류 지참 방문하면 됩니다.\n지급은 심사완료 후 2월말 지급예정이나 변동될 수 있습니다.\n이의 신청은 부지급 결정 5일 이내에 하시면 되고 신청 페이지에서 이의신청서 다운받아 2월 2일 오픈예정 이의신청게시판에 제출하시면 됩니다. \n중복수급 불가 : 긴급복지지원 12~1월 수급한 세대주/ 소상공인 버팀목자금/ 방문돌봄종사자 지원금 중복수급 불가\n차액지원 : 취성패 구직촉진수당 12월~1월 청년 구직활동지원금 지원금액 중 100만원 보다 적은 경우 차액지원\n국민취업지원제도 : 수급받는달 구직촉진수당 미지급 남은 기간에 분할지급할 예정입니다.  \n기타 궁금한 내용은 1899-9595번으로 문의 하세요. \n자세한 내용은 아래 링크에 상세히 적혀 있으니 참고 하세요. \n■ 법인택시 재난지원금 신청 정보입니다. \n50만원 일시 지급입니다. \n매출이 감소한 택시 법인 소속 운전사 또는 소득이 감소한 운전기사입니다. 10월 1일 포함 현재 계속 근무 중인 사람만 지원가능합니다. \n1차 지급 대상자는 근속요건만 확인합니다. \n운전기사는 15일까지 회사에 신청서 및 첨부서류 제출하고 회사는 18일까지 접수 지자체 마자 지급은 다를 수 있습니다. \n이의 신청은 부지급 통보 10일 이내 이의 신청 하시면 됩니다. \n■ 방문돌봄 종사자 방과후 교사 지원금입니다. \n신청기간 : 1월 25일~ 2월 5일 신청 홈피에서 피씨만 가능 신청하면 됩니다. \n고용보험 사업자 관계없이 1월 15일 기준 지원대상 직종에 종사중인자/ 2020년 1월1일~ 12월 31일까지 월 60시간 이상 근무한 달이 6개월 이상인자/ \n국세청 신고된 2019년 연소득이 1000만원 이하인자입니다. \n2개이상 직종에 근무한 경우 근무시간과 시간을 합산/ 방과후 학교 강사는 학교장확인서 반드시 필요합니다. / 국세청 소득신고 되어 있지 않은 경우 대상자가 아님/ 2020년도 신규 종사자는 근무이력이 있는 모든 사업장에서 발급한 2020년 원천징수부를 신청서와 함께 제출합니다. \n교육부 지침에 따른 학교수업 축소 운영으로 근무하지 못한 경우 학교장 직인을 날인한 계약사실 확인서로 재직요건 갈음할 수 있습니다. \n3차 긴급고용안정지원금 수령 혹은 예정자 제외\n국민취업지원제도 구직촉진수당을 동시에 받을 수 없고 미지급된 금액은 남은 취업지원서비스 기간에 분할 지급됩니다. \n제출서류 : 2020년 신규 종사자 : 근무한 사업장에서 발급한 2020년 원천징수부 전체\n방과후 강사 : 초중고 방과후 학교 근무 기간 시간 확인서\n지급 2월 23일 이후 지급할 예정 변경될 수 있습니다. \nhttps://rira.dkswhd.com/1\n코로나 소상공인 3차 재난 지원금 대상 신청\n소상공인 경영안정을 위해 지원하고 있으며 코로나로 인해 매출이 감소한 영세 소상공인과 정부 방역조치 강화로 경영상 어려움을 겪고 있는 소상공인 임차료 등을 직접 지원하고 있습니다. ■ 지원대상 공통 요..\nrira.dkswhd.com\nhttps://rira.dkswhd.com/3\n특고 프리랜서 3차 재난지원금 신규 신청 제출서류\n소득 수준 이하인 특수형태 근로종사자 프리랜서가 3차 확산으로 인해 소득이 감소한 경우 생계안정 비용 지원하고 있습니다. ■ 지원대상 특고 : 계약 형식에 관계없이 근로자와 유사하게 노무를 제공해도 근로..\nrira.dkswhd.com\nhttps://rira.dkswhd.com/4\n코로나 소상공인 3차 지원금 신속지급 추가 대상 신청\n코로나 소상공인 3차 지원금 및 신속지급 추가 신청 대상을 공유하려고 합니다. 이 포스트를 전체적으로 읽으면 코로나 소상공인 3차 지원금 및 신속지급 추가 신청 대상을 이해하시게 될 겁니다. 코로나 소상공인..\nrira.dkswhd.com\nhttps://kuma.dkswhd.com/1\n3차 재난지원금 법인택시 대상 신청\n승객 감소로 인해 법인택시 기사에게 지원금을 지원하고 있습니다. 일반택시 사업 종사하는 운전기사에게 지원하고 있습니다. ■ 각 지자체 법인택시 지원금 공고 페이지 서울특별시 인천시 부산광역시 경상북도..\nkuma.dkswhd.com\nhttps://kuma.dkswhd.com/3\n방문돌봄종사자 방과후 교사 3차 재난지원금 신청\n방문 돌봄 종사자와 방과 후 학교 강사에 대한 한시 지원사업으로 조건 대상 신청방법에 대해 알아보도록 하겠습니다. ■ 방문 돌봄 종사자 방과 후 교사 지원금 신청 페이지 근로복지서비스 welfare.kcomwel.or...\nkuma.dkswhd.com', '노무를 제공한 소득만 해당됩니다.\n3차 재난지원금 대상자는?\n특고,프리랜서 2021년 1월 6일부터 8일 - 안내문자 발송\n소상공인희망자금 2021년 1월 11일 - 안내문자 발송, 지원금 신청 받음\n최대 당일 지급 \n소상공인,자영업자,특고 프리랜서,\n저소득 취약계층, 택시기사 등 최대 300만원 지원\n여야 558조 예산안 3차 재난지원금 3조 신규, 백신 9천억 증액\n▼3차 재난지원금 대상,신청방법 관련 내용 참고하세요.\n3차 재난지원금 신청,대상자 (+주요내용,소상공인 최대 300만원,착한 임대인)\n정부가 3차 재난지원금을 1월 중 지급하는 방안을 검토 중이며 거리두기 3단계 상향 가능성까지 나오면서 고용취약계층과 저소득층 등으로 지급 대상이 확대될 가능성도 밝혔다. (+추가 발표된 정부 지침 하단 참..\nclantown1733.tistory.com']",6,https://kin.naver.com/qna/detail.naver?d1id=4&dirId=40703&docId=380487279&qb=67Cx7Iug&enc=utf8&section=kin&rank=115&search_sort=3&spq=0,서비스업
