page,date,tags,questions,questions_add,answers,N_answer,url,category
47,2021.05.26,"['#주식', '#주식']",대한항공 주식사서 장기로 박아도되겠죠,,"['항공주가 그렇게 안정적인 주식은 아닙니다.\n코로나 종식되고 아시아나와 합병 완료되면 시너지는 클 겁니다.', '대한항공 주식은 장기로 투자는 가능하지만 문제는 지금 당장은 아시아나항공 인수로 인하여 유상증자를 엄청나게 많이 하는 바람에 자본금이 너무 크게 늘어서 주당순이익도 낮고 회사 규모에 비해 너무 자본이 큰 나머지 아시아나항공 기업을 흡수합병 하기 전까지는 상승에 제한이 있을 것입니다. \n규모가 너무 크기 때문에 대한항공이 호재가 나와도 올라가는 폭이 너무 적습니다. 그리고 대한항공 기업은 흡수합병을 목적으로 유상증자하면서 자본금을 늘린 기업으로 장기투자 하고 싶다면 아시아나항공 흡수합병까지 생각하면서 봐야 합니다. ', '답변:아시아나 인수, 여행활성화, 코로나종식, 백신 보급\n남들 다 아는 호재는 호재가 아닐 수 있음을 유의하시어 거래 바랍니다.\n암튼 전망이 좋으니 꾸준히 관심을 가지고 지켜볼 필요가 있겠네요\n건승바랍니다.\n도움이되셨다면\n우량주, 급등주, 테마주등 추천 무료로 가이드 드리는 곳 알려드릴께요~~\n#주식리딩사이트 #주식정보사이트 #주식컨설팅 전문으로 하고있고요\n12년 전통의 소비자만족 1위 주식정보회사입니다.\n“무료체험 : 주식 정보 제공 및 컨설팅” 진행중이니 \n아래 짧은 동영상 시청 후 홈페이지 구경해보세요~~\n-----------------------------------------------------------------------------------------------------\n클릭 : ""동영상 가이드"" 무료보기(15초) \n15초 동영상 시청 후 무료 체험 가능\n""청개구리투자클럽""\n위 게시물은 업체로 부터 경제적 대가를 받고 작성된 글입니다.\n이 동영상 시청 및 포스팅을 읽는\n여러분들께는 일체의 비용부담이 발생하지 않습니다', '코로나가 점점 풀리면 항공주, 여행업 관련주들이\n빠른 회복세를 보일 것으로 예상합니다.\n대한항공 주식은 장기적인 관점에서\n우상향 할 가능성이 충분합니다.\n주식에서 가장 중요한 건\n출처가 분명한 정확한 정보와\n실시간 대응이라고 볼 수 있습니다.\n호재와 악재를 예상하고 매매하는 건\n불가능에 가깝습니다.\n아래 이코노미 플라이에서는\n정확한 정보를 바탕으로\n실시간 시장 데이터 분석종목과\n테마,급등 등의 데이터별 상위주 분석을 통한\n포트폴리오를 제공 및 확인하여\n리포트 서비스를 받아볼 수 있습니다.\n아래 이코노미 소개 영상이 끝나면\n유료 회원들에게만 제공되었던\n추천 종목 서비스를 3일간 무료로 받아볼 수 있는\n사이트로 이동합니다.\n수익에 큰 도움이 되셨으면 좋겠습니다.\n이코노미 플라이 소개 영상이 끝나면 무료 종목 추천받을 수 있는 사이트로 이동합니다', '몇년 장기 보유하면  괜찮을거예요.\n제 2의 비트코인으로 유명한\n파이코인(Pi), 비코인(Bee), 타임스토프,\n스마트폰만 있으면 하루 한번 클릭으로\n누구나 채굴 가능해요.\n하루 1분만 채굴에 양보하세요.\n1~2년 후 목돈이 되어있을 거예요.\n무료채굴코인에 관한 많은 정보가 있어요.\n● 파이코인(Pi Coin) 소개 및 초간단 채굴방법, 전망\nhttps://m.blog.naver.com/ss138027/222219137601\n● 비코인(Bee Coin) 소개 및 초간단 채굴방법\nhttps://m.blog.naver.com/ss138027/222219415770\n● 타임스토프 소개 및 초간단 채굴방법 \nhttps://m.blog.naver.com/ss138027/222219382859\n● 비키원코인(VikiOne Coin) 소개 및 초간단 채굴방법\nhttps://m.blog.naver.com/ss138027/222353172038\n● 이글코인(Eagle Coin) 소개 및 초간단 채굴방법\nhttps://m.blog.naver.com/ss138027/222266420936\n● 파이퓨처스 소개 및 초간단 채굴방법\nhttps://m.blog.naver.com/ss138027/222225334152\n● Vswap코인 소개 및 초간단 채굴방법\nhttps://m.blog.naver.com/ss138027/222241482957\n● 스페라엑스(Sperax)코인 소개 및 초간단 채굴방법\nhttps://m.blog.naver.com/ss138027/222274514468\n● 앤트코인(Ant 코인) 소개 및 초간단 채굴방법\nhttps://m.blog.naver.com/ss138027/222283009663\n● 미도인코인 소개 및 초간단 채굴방법\nhttps://m.blog.naver.com/ss138027/222219314637\n● Aibox코인 소개 및 초간단 채굴방법\nhttps://m.blog.naver.com/ss138027/222227924616\n● 비트라니움(Bitranium) 소개 및 초간단 채굴방법\nhttps://m.blog.naver.com/ss138027/222310224021\n● SS코인(SSCOIN) 소개 및 초간단 채굴방법\nhttps://m.blog.naver.com/ss138027/222236851842\n● 페이팔(Q코인) 소개 및 초간단 채굴방법\nhttps://m.blog.naver.com/ss138027/222290197507\n● Chainge코인 소개 및 초간단 채굴방법\nhttps://m.blog.naver.com/ss138027/222248467378\n#파이코인#비코인#pi코인#bee코인', '안녕하세요~\n질문자님의 궁금증을 최대한 빠르게 답변하기 위해 이리뛰고 저리뛰고 있는 \n“부지런한 오리” 입니다.\n꽥꽥~~!!^^\n 질문의 내용을 보고 답변을 할까 말까 고민하다가 용기내어 답변 남깁니다.~~\n기업의 앞으로의 주가는 아무도 모릅니다.~~\n기업의 분석과 공부를 통해 해당 기업의 성장성과 가치에 대한 확신이\n선다면 나의 소중한 자금을 투자하여 기업의 성장과 나의 투자금이\n동반 성장 하는 것이 주식투자의 본질이라고 생각 합니다.\n스스로 공부하시어 스스로 판단과 결정에 힘입어 주식거래를 하셔야만이\n건강한 투자라고 할  수 있습니다.\n그래야 나중에 후회가 없는 법입니다.\n타인의 말을 듣고 주식거래 하셨다가 잘못되기라도 한다면 그 사람을 탓할겁니까..\n그래봤자 나만 속상한겁니다.\n그러니 직접 공부하시어 투자하시기 바랍니다.\n읽기에 불편하셨다면 죄송합니다...\n또 다른 궁금증 있으시면 답변채택후 추가질문 남겨주세요~\n 답변 채택! 꼭!꼭! 부탁드립니다.~~^^\n채택자에게 제공되는 콩은 모두 소외된 이웃을 위해 기부 하오니\n채택 부탁드립니다^^\n좋아요~♥♥도 꼬~옥 부탁드립니다.~\n병아리를 클릭 해주세요~~\n클릭 부탁해요~~\n 좋은 하루 되세요~~\n 쿠팡 파트너스 추천인 코드 AF7344279 입력하시고 추가 커미션\n받으세요~~\nhttps://coupa.ng/b0gpyn\n주린이가 가장 알고 싶은 최다질문 TOP 77+친절한 주식책+주가차트책+경제책 - 4권 세트 (다이어리+볼펜)\nCOUPANG\ncoupa.ng\nhttps://coupa.ng/bZGzo1\n소수몽키의 한 권으로 끝내는 미국주식 + 미국 배당주 투자\nCOUPANG\ncoupa.ng\nhttps://coupa.ng/bZHSn2\n[미국 주식 시작한다면] 미국주식 처음공부 + 미국 주식이 답이다 (전2권)\nCOUPANG\ncoupa.ng\n 쿠팡 파트너스 활동으로 일정의 수수료를 제공 받을 수 있음.', '대한민국에서 장기투자 종목은 삼성전자 하나 뿐입니다.', '장기로 보유하면 괜찮긴 하지만\n시드를 한번에 넣지마시고\n관망하시면서 분할 매수하시는 것을 추천드리고 싶네요\n미래에 도움이 될 습관을 길러보세요.\n제2의 비트코인 파이코인(Pi),\n비코인(Bee), 타임스토프(TimeStope)\n스마트폰만 있으면 하루 1번 클릭으로\n초보자도 쉽게 채굴이 가능해요.\n하루 1분의 시간만 투자해보세요.\n1~2년후에 큰 자산이 될거에요.\n▶ 파이코인(Pi Coin) ◀ 초간단 무료채굴하기\nhttps://m.blog.naver.com/misowolf1472/222261855775\n▶ 비코인(Bee Coin) ◀ 초간단 무료채굴하기\nhttps://m.blog.naver.com/misowolf1472/222261904280\n▶ 타임스토프(TimeStope) ◀ 초간단 무료채굴하기\nhttps://m.blog.naver.com/misowolf1472/222290343195\n▶ 알파코인(Alpha Coin) ◀ 초간단 무료채굴하기\nhttps://m.blog.naver.com/misowolf1472/222316158369\n▶ 이글코인(Eagle Coin) ◀ 초간단 무료채굴하기\nhttps://m.blog.naver.com/misowolf1472/222272490052\n▶ 앤트코인(Ant Coin) ◀ 초간단 무료채굴하기\nhttps://m.blog.naver.com/misowolf1472/222283142846\n▶ 스페라엑스(Spera X) ◀ 초간단 무료채굴하기\nhttps://m.blog.naver.com/misowolf1472/222296066855\n▶ 발키리스왑(Vswap) ◀ 초간단 무료채굴하기\nhttps://m.blog.naver.com/misowolf1472/222295738353\n▶ 비키원코인(VikiOne) ◀ 초간단 무료채굴하기\nhttps://m.blog.naver.com/misowolf1472/222282198904\n▶ 미도인코인(Midoin) ◀ 초간단 무료채굴하기\nhttps://m.blog.naver.com/misowolf1472/222292106373\n▶ 카우카우코인(CowCow) ◀ 초간단 무료채굴하기\nhttps://m.blog.naver.com/misowolf1472/222311121238\n▶ SS코인(SSC) ◀ 초간단 무료채굴하기\nhttps://m.blog.naver.com/misowolf1472/222295709548\n▶ 파이퓨쳐스(Pi Futures) ◀ 초간단 무료채굴하기\nhttps://m.blog.naver.com/misowolf1472/222290932702\n#파이코인 #비코인 #pi #bee #코인채굴\n#timestope #타임스토프 #무료채굴 #스마트폰채굴 #비트코인채굴', '15초만에 돈버는 방법이 궁금하다면?->>>>> 클릭해서 영상시청!!!\n  대한항공의 1분기 영업이익은 877억 순손실은 1527억으로 전망되고 있습니다.\n대한항공주가는 연초대비30%오른모습을 보여주는데요, 백신접종과 트래블버블을 비롯한 여행 재개신호에 업황개선 기대감이 주가에 반영된것으로 보입니다.\n무엇보다 대한항공의 가장큰이벤트는 아시아나 인수인데요, 대한항공은 내년 아시아나를 인수하고 자회사체계를 유지한뒤 2024년 통합항공사를 출범할 계획이라고 합니다.\n이를 위해 대한항공은 3조3천억규모의 유상증자를 실시했는데요, 대한항공이 아시아나를 인수하고 나면 20년 동안 이어진 경쟁이 종식되어 국내 유일의 대형항공사로서 시장의 지배가 강화되어 규모의 경제를 통한 시너지 효과를 낼 거란 기대감이 있습니다.\n반면 수요가 언제 회복될지 모르고 유상증자로 인해 주식 물량부담이 커져졌다는 리스크가 있습니다.\n   저 개인적으로는 주식으로 대박나기 보다는 자신의 소득을 꾸준히 주식에 투자해 연 10~15%의 수익을 보면서\n안전하게 주식투자를 이어가는 것이 가장 좋은 선택이라고 생각합니다.\n청개구리투자클럽은 12년 전통 소비자만족 1위 주식정보회사입니다.\n  아래영상 시청하시고 혜택받아가세요!!!\n  ↓↓↓↓↓↓↓↓↓↓↓↓↓↓↓↓↓↓↓↓↓↓↓↓↓↓↓↓↓↓↓↓↓↓↓↓↓↓↓↓↓↓↓↓↓↓↓↓↓\n   본 영상은 소정의 광고료를 지급받습니다.\n#주식#주식투자사이트#주식종목추천#급등주#테마주#주식리딩#주식투자#코스피#코스닥#주식으로1억만들기\n ']",9,https://kin.naver.com/qna/detail.naver?d1id=4&dirId=40102&docId=390703173&qb=67Cx7Iug&enc=utf8&section=kin&rank=469&search_sort=3&spq=0,"주식, 증권"
47,2021.05.26,"['생명과학2', '세특', '#문제풀이']",코로나19 백신 간호사 생명과학2 세특,코로나19 백신 성분에 관련된 내용에 대해 진로와 관련해서 생명과학 세특을 써야하는데 어떻게 간호사와 코로나19 백신발명을 연관지을 수 있을까요?,"['발명과는 사실상 무관합니다 ', ' 코로나 백신의 발명은 질병예방과 생명을 연장시키는데 도움을 준 생명 과학의 발전의 일환이라고 볼 수 있습니다. 코로나백신 발명이 없었으면 지금도 코로나가 창궐하여 계속 전염되어 나가고 있을 것입니다 .코로나 백신의 발명은 그야말로 생명 과학의 커다란 이정표를 세운 것으로 생각됩니다.  간호사 지망생 도움이 되는 책입니다 .간호사 너 자신이 되어라\n간호사, 너 자신이 되어라\n저자\n한화순\n출판\n메디캠퍼스\n발매\n2015.11.30.']",2,https://kin.naver.com/qna/detail.naver?d1id=11&dirId=110404&docId=390701768&qb=67Cx7Iug&enc=utf8&section=kin&rank=470&search_sort=3&spq=0,과학
48,2021.05.26,"['생명과학2', '세특', '#문제풀이']",코로나19 백신 간호사 생명과학2 세특,코로나19 백신 성분에 관련된 내용에 대해 진로와 관련해서 생명과학 세특을 써야하는데 어떻게 간호사와 코로나19 백신발명을 연관지을 수 있을까요?,"['발명과는 사실상 무관합니다 ', ' 코로나 백신의 발명은 질병예방과 생명을 연장시키는데 도움을 준 생명 과학의 발전의 일환이라고 볼 수 있습니다. 코로나백신 발명이 없었으면 지금도 코로나가 창궐하여 계속 전염되어 나가고 있을 것입니다 .코로나 백신의 발명은 그야말로 생명 과학의 커다란 이정표를 세운 것으로 생각됩니다.  간호사 지망생 도움이 되는 책입니다 .간호사 너 자신이 되어라\n간호사, 너 자신이 되어라\n저자\n한화순\n출판\n메디캠퍼스\n발매\n2015.11.30.']",2,https://kin.naver.com/qna/detail.naver?d1id=11&dirId=110404&docId=390701768&qb=67Cx7Iug&enc=utf8&section=kin&rank=471&search_sort=3&spq=0,과학
48,2021.05.26,[],백신접종 빨리 맞을 수 있는 방법은 없나요?," 저는 강연활동을 하는 사람입니다. 

 한번 강연할 때마다 상당히 많은 사람들을 만나는데요.

 프리랜서이기도 하고, 나이도 젊은편이라 백신 접종을 맞으려면 시간이 한참 남은듯 합니다.

 강연은 계속 들어오고 있는 상황이라...

 이런경우 백신을 보다 빨리 맞을 수 있는 방법은 없나요?","['27일부터 코로나백신 접종 예약에서\n잔여 백신 예약하실수 있다고해요.\n네이버/카카오등을 통해서 잔여백신 확인할수 있다고하니\n확인후 예약해보세요,', '백신접종 사전 알림 신청 서비스 신청 시 백신접종과 관련된 정보를 문자로 알려드리는 이벤트 (*참여 시 경품 추첨 응모)\n신청하기 : http://kerion.info/t6osfwpplo\n백신접종 사전 알림 이벤트\n알림 신청 서비스 신청 시 백신접종과 관련된 정보를 문자로 알려드리는 이벤트 (*참여 시 경품 추첨 응모) 경품 리스트 : 야나두 야핏 사이클(5명), 도미노피자&콜라1.25L(100명), 스타벅스 아메리카노(1,000명) 알림신청 방법 : [이벤트 신청하기] 클릭 후 약관 동의 및 개인정보 입력하고 본인인증만 진행하면 참여 완료\nkerion.info\n경품 리스트 : 야나두 야핏 사이클(5명), 도미노피자&콜라1.25L(100명), 스타벅스 아메리카노(1,000명)\n알림신청 방법 : [이벤트 신청하기] 클릭 후 약관 동의 및 개인정보 입력하고 본인인증만 진행하면 참여 완료', '오늘 부터 잔여 백신 신청을 받고 있습니다. \n오후 1시부터 신청이 가능합니다. \nhttps://bit.ly/3uuj23D\n코로나 백신 접종 예약 및 잔여 백신 조회, 예약 방법 - 알아두면 쓸모있는 정보\n코로나 백신 접종 예약이 5월 부터 진해잉 되고 있습니다. 이에 따라 잔여 백신의 당일 예약이 진행되고 있으며, 27일부터 잔여 백신 검색을 통해 의료 기관 조회 후 당일 잔여 백신을 접종 받을 수 있다고 합니다.\nbit.ly', '잔여백신을접종하시는게 가장 빠른 방법입니다.\n해당 잔여 백신 예약은 카카오 네이버로 가능한데\n예약 방법 그리고 잔여 백신 접종 할수있는 조건 정리해두었습니다.\n아래 글 확인하셔서 꼭 잔여백신 접종 바랍니다.\n코로나 노쇼 백신 카카오 네이버 예약\n코로나 노쇼 백신 소식이 들렸고 많은 분들이 예약 문의를 하신것으로 알고 있습니다. 코로나 노쇼 백신 가장 빠르게 카카오, 네이버를 통해 예약하실 수 있습니다. 코로나 노쇼 백신 예약 아래에서 바로 하실 수..\nm.site.naver.com', '안녕하세요.\n그동안 나이와 직업에 따라 제한적으로 백신 접종을 해왔는데요, 오늘(5/27) 오후부터 잔여백신 예약 및 알림신청 서비스를 네이버와 카카오톡을 통해 이용할 수 있습니다. 예약 불가능 대상자 확인 후 신청 가능여부 확인해 보심을 추천드립니다. 감사합니다.\n※ 예방접종을 이미 받은 사람, 예방접종 사전예약이 되어 있는 사람, 아스트라제네카 백신의 예방접종을 권장하지 않는 30세 미만(1992년1월 1일 이후 출생자) 등은 잔여백신 당일예약이 불가능\n노쇼백신 예약방법 & 잔여백신 우리동네 알림설정 - 카카오 네이버\n코로나19 예방접종대응추진단은 네이버, 카카오의 지도 플랫폼을 활용하여 편리하게 잔여백신 조회하고, 당일 예방접종 예약할 수 있는 기능을 개발하고 운영을 시작합니다. 아스트라제네카 ..\nm.site.naver.com']",5,https://kin.naver.com/qna/detail.naver?d1id=7&dirId=7010107&docId=390699885&qb=67Cx7Iug&enc=utf8&section=kin&rank=472&search_sort=3&spq=0,감염내과
48,2021.05.26,[],백신접종 빨리 맞을 수 있는 방법은 없나요?," 저는 강연활동을 하는 사람입니다. 

 한번 강연할 때마다 상당히 많은 사람들을 만나는데요.

 프리랜서이기도 하고, 나이도 젊은편이라 백신 접종을 맞으려면 시간이 한참 남은듯 합니다.

 강연은 계속 들어오고 있는 상황이라...

 이런경우 백신을 보다 빨리 맞을 수 있는 방법은 없나요?","['27일부터 코로나백신 접종 예약에서\n잔여 백신 예약하실수 있다고해요.\n네이버/카카오등을 통해서 잔여백신 확인할수 있다고하니\n확인후 예약해보세요,', '백신접종 사전 알림 신청 서비스 신청 시 백신접종과 관련된 정보를 문자로 알려드리는 이벤트 (*참여 시 경품 추첨 응모)\n신청하기 : http://kerion.info/t6osfwpplo\n백신접종 사전 알림 이벤트\n알림 신청 서비스 신청 시 백신접종과 관련된 정보를 문자로 알려드리는 이벤트 (*참여 시 경품 추첨 응모) 경품 리스트 : 야나두 야핏 사이클(5명), 도미노피자&콜라1.25L(100명), 스타벅스 아메리카노(1,000명) 알림신청 방법 : [이벤트 신청하기] 클릭 후 약관 동의 및 개인정보 입력하고 본인인증만 진행하면 참여 완료\nkerion.info\n경품 리스트 : 야나두 야핏 사이클(5명), 도미노피자&콜라1.25L(100명), 스타벅스 아메리카노(1,000명)\n알림신청 방법 : [이벤트 신청하기] 클릭 후 약관 동의 및 개인정보 입력하고 본인인증만 진행하면 참여 완료', '오늘 부터 잔여 백신 신청을 받고 있습니다. \n오후 1시부터 신청이 가능합니다. \nhttps://bit.ly/3uuj23D\n코로나 백신 접종 예약 및 잔여 백신 조회, 예약 방법 - 알아두면 쓸모있는 정보\n코로나 백신 접종 예약이 5월 부터 진해잉 되고 있습니다. 이에 따라 잔여 백신의 당일 예약이 진행되고 있으며, 27일부터 잔여 백신 검색을 통해 의료 기관 조회 후 당일 잔여 백신을 접종 받을 수 있다고 합니다.\nbit.ly', '잔여백신을접종하시는게 가장 빠른 방법입니다.\n해당 잔여 백신 예약은 카카오 네이버로 가능한데\n예약 방법 그리고 잔여 백신 접종 할수있는 조건 정리해두었습니다.\n아래 글 확인하셔서 꼭 잔여백신 접종 바랍니다.\n코로나 노쇼 백신 카카오 네이버 예약\n코로나 노쇼 백신 소식이 들렸고 많은 분들이 예약 문의를 하신것으로 알고 있습니다. 코로나 노쇼 백신 가장 빠르게 카카오, 네이버를 통해 예약하실 수 있습니다. 코로나 노쇼 백신 예약 아래에서 바로 하실 수..\nm.site.naver.com', '안녕하세요.\n그동안 나이와 직업에 따라 제한적으로 백신 접종을 해왔는데요, 오늘(5/27) 오후부터 잔여백신 예약 및 알림신청 서비스를 네이버와 카카오톡을 통해 이용할 수 있습니다. 예약 불가능 대상자 확인 후 신청 가능여부 확인해 보심을 추천드립니다. 감사합니다.\n※ 예방접종을 이미 받은 사람, 예방접종 사전예약이 되어 있는 사람, 아스트라제네카 백신의 예방접종을 권장하지 않는 30세 미만(1992년1월 1일 이후 출생자) 등은 잔여백신 당일예약이 불가능\n노쇼백신 예약방법 & 잔여백신 우리동네 알림설정 - 카카오 네이버\n코로나19 예방접종대응추진단은 네이버, 카카오의 지도 플랫폼을 활용하여 편리하게 잔여백신 조회하고, 당일 예방접종 예약할 수 있는 기능을 개발하고 운영을 시작합니다. 아스트라제네카 ..\nm.site.naver.com']",5,https://kin.naver.com/qna/detail.naver?d1id=7&dirId=7010107&docId=390699885&qb=67Cx7Iug&enc=utf8&section=kin&rank=473&search_sort=3&spq=0,감염내과
48,2021.05.26,[],수급자 백신,"수급자인데 백신은 언제 맞나요?

코로나 백신은 언제 맞나요?","['수급바라고 따로 맞는게 아니고요\n전국민 모두 무료백신으로 연령대별로 현재반  65~74세까지 가까운 병원에 접수하시고요\n이연령대가 아닌 30세이상이라면 5월27일 부터 네이버앱,카카오톡앱에서 잔여백신신청하세요\n 보험크리닉에서 프로 전문가와 함께 보험클리닉해 보세요 \n아래 신청해 주시면 프로 보험 전문가 배정해드립니다\nhttp://www.toppro.co.kr/sub04/sub02.php\n보험에 관한 모든것 """"보험크리닉""""(연고계약 불편사항 많아요)\n맟춤분석서비스, 보험리모델링 ,보험금찾기,유병자보험,홈페이지 상담 등록, 1대1 무료 상담 \n지식파트너란 개인이 아닌 기업이나 단체에서 전문가가 답변해주고 있으며,\n유익한 광고가 들어감을 이해해 주세요 \n ', '잔여 백신으로 조회가 가능하며\n27일 오후 1시부터 조회 및 접종이 가능합니다. \nhttps://bit.ly/3uuj23D\n코로나 백신 접종 예약 및 잔여 백신 조회, 예약 방법 - 알아두면 쓸모있는 정보\n코로나 백신 접종 예약이 5월 부터 진해잉 되고 있습니다. 이에 따라 잔여 백신의 당일 예약이 진행되고 있으며, 27일부터 잔여 백신 검색을 통해 의료 기관 조회 후 당일 잔여 백신을 접종 받을 수 있다고 합니다.\nbit.ly', '현제 잔여 백신으로 접종을 빠르게 하실 수 있습니다.\n카카오, 네이버에서 잔여백신 예약이 가능한데\n예약 조건 그리고 방법 상세히 정리해두었습니다.\n확인하셔서 얼른 접종 하시길 바랍니다.\n코로나 노쇼 백신 카카오 네이버 예약\n코로나 노쇼 백신 소식이 들렸고 많은 분들이 예약 문의를 하신것으로 알고 있습니다. 코로나 노쇼 백신 가장 빠르게 카카오, 네이버를 통해 예약하실 수 있습니다. 코로나 노쇼 백신 예약 아래에서 바로 하실 수..\nm.site.naver.com', ""연령별 순서입니다. \n코로나 백신 예약 일정\n- 70~74세(1947년~1951년), 만성호흡기장애인 : 2021.05.06(목) ~ 06.03(목)\n- 65~69세 (1952년~1956년) : 2021.05.10(월) ~ 06.03(목)\n- 60~64세 (1957년~1961년), 어린이집/유치원/초등1,2교사 등 : 2021.05.13(목) ~ 06.03(목)\n네이버 노쇼 백신 예약\n네이버에서 잔여 백신을 조회할 경우에는 네이버 앱·네이버 지도앱 또는 네이버 웹에 접속해 검색창에 '잔여 백신'을 검색하면 지도 플랫폼에 위탁의료기관 및 남은 백신 수량이 표시된다.\n잔여백신 카카오톡\n카카오에서는 카카오톡 하단의 샵(#) 탭에서 '잔여 백신' 탭을 선택하거나 카카오 맵 앱을 통해서 잔여 백신 조회가 가능하다. 잔여백신 수량이 3개 이하로 남아있을 경우에는 빨간색, 4∼6개까지는 노란색, 7개 이상은 초록색 표지가 각 접종기관 위에 나타난다.\nhttps://453010star.tistory.com/1507\n잔여 백신 예약 대상 조회 및 신청방법 [카카오톡 네이버]\n잔여 백신 예약 대상 조회 및 신청방법 [카카오톡 네이버] 5월 27일부터 네이버와 카카오 앱으로 신종 코로나바이러스 감염증(코로나19) '잔여 백신'을 조회하고 당일 예약으로 접종까지 받을 수 있다...\n453010star.tistory.com""]",4,https://kin.naver.com/qna/detail.naver?d1id=6&dirId=6100101&docId=390696256&qb=67Cx7Iug&enc=utf8&section=kin&rank=474&search_sort=3&spq=0,국민기초생활보장
