page,date,tags,questions,questions_add,answers,N_answer,url,category
8,2020.10.13,['뇌전증'],뇌전증 장애 질문 드립니다,"어떤분이 아이에게 필수 예방접종을 하고 정상적인 아이가
뇌전증 장애 4급을 받은거 같은데 백신을 잘못 맞으면 그런 질환걸리나요?

검색을 해보니 간질이라고 돼 있던데
......

간질이면 거품 물고 쓰러지던데 ... ㅜ ㅜ

백신이 위험한거 아닌가요?","['안녕하세요. 대한의사협회·네이버 지식iN 상담의사 정동문 입니다.\n주사약과 간질의 직접적인 연관성이 있어야 하며, 증명이 되어야 합니다.\n주사와 간질은 별개일 수 있습니다.\n백신이 위험하지는 않습니다.']",1,https://kin.naver.com/qna/detail.naver?d1id=7&dirId=70107&docId=370576275&qb=67Cx7Iug&enc=utf8&section=kin&rank=73&search_sort=3&spq=0,신경외과
8,2020.10.13,[],2023년엔 코로나 종식될까요?,,"['내려놓으면 마음이 편합니다', '이건 정말 아무도 모릅니다\n다만 전세계 제약 & 바이오 회사에서 혈안이 되어 개발중이고\n곧 임상3상의 결과를 알리는 회사도 등장할 겁니다\n백신은 좀더 빨리 나올것이구요\n전문가들은 평생간다는 분도 있었고  몇년이라고 기간을 말하는 분도 계셨지만\n우린  반드시 이겨낼겁니다!!']",2,https://kin.naver.com/qna/detail.naver?d1id=8&dirId=814&docId=370569781&qb=67Cx7Iug&enc=utf8&section=kin&rank=78&search_sort=3&spq=0,기타
1,2020.10.13,[],중국바이러스 우한폐렴 이거 백신 대체 언제 나오는걸까요,,['백신이 금방 만들어지지는 않아요... 1상2상 통과해도 3상에서 무너지면 처음부터 다시해야하거든요...'],1,https://kin.naver.com/qna/detail.naver?d1id=7&dirId=710&docId=370652157&qb=67Cx7Iug&enc=utf8&section=kin&rank=1&search_sort=3&spq=0,"의료기관, 의료인"
6,2020.10.13,"['코로나', '질문']",코로나 에대함거 빨리좀알려주세요ㅠㅠ 급해요,코로나에대한거알려주시면 내공 60,"['코로나바이러스감염증-19(COVID-19) 정보\n정의\nSARS-CoV-2 감염에 의한 호흡기 증후군\n질병 분류\n법정감염병 : 제1급감염병 신종감염병증후군\n질병 코드 : U07.1\n병원체\nSARS-CoV-2 : Coronaviridae에 속하는 RNA 바이러스\n전파 경로\n현재까지는 비말(침방울), 접촉을 통한 전파로 알려짐\n기침이나 재채기를 할 때 생긴 비말(침방울)을 통한 전파 등\n코로나19 바이러스에 오염된 물건을 만진 뒤 눈, 코, 입을 만짐\n잠복기\n1~14일 (평균 4~7일)\n진단 기준\n환자 : 진단을 위한 검사기준에 따라 감염병병원체 감염이 확인된 사람\n진단을 위한 검사기준\n- 검체에서 바이러스 분리\n- 검체에서 특이 유전자 검출\n증상\n발열, 권태감, 기침, 호흡곤란 및 폐렴 등 경증에서 중증까지 다양한 호흡기감염증이 나타남\n그 외 가래, 인후통, 두통, 객혈과 오심, 설사 등도 나타남\n치료\n대증 치료 : 수액 보충, 해열제 등 보존적 치료\n특이적인 항바이러스제 없음\n치명률\n전세계 치명률은 약 3.4%(WHO, 3.5 기준)\n단, 국가별 · 연령별 치명률 수준은 매우 상이함\n고령, 면역기능이 저하된 환자, 기저질환을 가진 환자가 주로 중증, 사망 초래\n관리\n환자 관리\n표준주의, 비말주의, 접촉주의 준수\n증상이 있는 동안 가급적 집에서 휴식을 취하고 다른 사람과 접촉을 피하도록 권고\n접촉자 관리\n감염증상 발생 여부 관찰\n예방\n백신 없음\n올바른 손씻기\n- 흐르는 물에 비누로 30초 이상 꼼꼼하게 손씻기\n- 특히, 외출 후, 배변 후, 식사 전·후, 기저귀 교체 전·후, 코를 풀거나 기침, 재채기 후 등에는 반드시 실시\n기침 예절 준수\n- 기침할 때는 휴지나 옷소매 위쪽으로 입과 코를 가리고 하기\n- 호흡기 증상이 있는 경우 마스크 착용\n씻지 않은 손으로 눈, 코, 입 만지지 않기\n주위 환경을 자주 소독하고 환기하기\n코로나 바이러스 분류 및 특성\n개요\n코로나 바이이러스(CoV)는 사람과 다양한 동물에 감염될 수 있는 바이러스로서 유전자 크기 27~32kb의 RNA 바이러스\n분류\n코로나 바이러스과에는 4개의 속(알파, 베타, 감마, 델타)이 있음\n알파 · 베타 : 사람과 동물에게 감염\n감마 · 델타 : 동물에게 감염\n형태\n형태는 코로나 바이러스의 명명과 같이 전자현미경 관찰시 구형\n외부 spike 단백질이 특징적인 크라운형태\n사람감염 코로나 바이러스\n사람감염 코로나 바이러스는 현재까지 6종류가 알려져 있음\n감기를 일으키는 유형(229E, OC43, NL63, HKU1)\n중증폐렴을 일으킬 수 있는 유형(SARS-CoV, MERS-CoV)']",1,https://kin.naver.com/qna/detail.naver?d1id=7&dirId=705&docId=370586182&qb=67Cx7Iug&enc=utf8&section=kin&rank=59&search_sort=3&spq=0,대체의학
3,2020.10.13,[],"삼성 갤럭시 탭 s7 사용중인데요 백신 프로그램으로 v3 깔아서 사용중인데 그 디바이스케어?? 거기서 보안상태 머라머라하면서 보안강화? 뭐랫나 그래서 확인눌렀는데 안전 뜨면서 태블릿검사버튼 생기고 McAfee맥아피 제공이라고 적혀잇는데 백신 두개쓰면 충돌 일으킨다고 해서 지우려고 앱 찾아봤는데 못찾겠네요 기본제공 백신인거같은데 앱이 깔린게 아닌가요??

깔린거라면 기존에 쓰고있는 v3랑 충돌위험이 있을텐데 어떻게 지워야하나용 ㅠㅠ",,['앱이 깔려있는 형태가 아닌 디바이스 케어 앱 보안 항목에 내장되어 있는듯합니다.\n이 경우 삭제가 불가능할 듯 보입니다.'],1,https://kin.naver.com/qna/detail.naver?d1id=1&dirId=11002&docId=370623777&qb=67Cx7Iug&enc=utf8&section=kin&rank=27&search_sort=3&spq=0,바이러스
3,2020.10.13,[],청소년 독감무료 접종,오늘 제가 접종을 안했는데 내일 접종해도 무료료 되는건가요?,"['안녕하세요. 대한의사협회·네이버 지식iN 상담의사 최연철 입니다.\n만13-18세 청소년이신 것으로 생각됩니다.\n오늘부터 재개된 인플루엔자 예방접종 국가지원 사업은\n12월 31일까지 예정이므로 내일도 무료로 접종이 가능합니다.\n단, 병원마다 백신이 남아있는 상황이 다를수 있습니다.\n방문하시기 전에 먼저 병원에 연락해보시기를 권장드립니다.\n도움이 되었길 바랍니다. 감사합니다.']",1,https://kin.naver.com/qna/detail.naver?d1id=7&dirId=70115&docId=370626248&qb=67Cx7Iug&enc=utf8&section=kin&rank=26&search_sort=3&spq=0,소아청소년과
3,2020.10.13,['생백신'],생백신 접종 간격,"12개월 반 아들엄마예요

10월 5일 A병원에서 일본뇌염 생백신 이모젭 접종

한 뒤 병원에서 1달뒤 다른 생백신 접종 할 수 있다고

들었어요

오늘 10월 13일 다른 접종이 있어서 B라는 병원에서

접종을 했는데 수두MMR 접종까지 같이 해버렸어요

A병원에서 아기 수첩에 11월 15일 이후라고 까지

적어뒀는데 간호사 분들이 확인도 안하고 저에게

뇌수막염이렁 수두 MMR 같이 하는거죠라고 물어

봤고 저는 그게 생백신이라는 사실도 모르고 네라고

대답해버렸네요 ㅠㅠ

병원에서는 자신들의 실수라고 인정했고

의사선생님 께서는 뒤에 맞은 생백신을 한달뒤에

와서 다시 맞으면 된다고 하는데 영 찝찝하네요 ㅠㅠ

아기는 평소랑 같이 잘 놀고 있어요

생백신 접종 간격이 일주일이면 정말 뒤에 맞은거만

다시 맞으면 되는건가요?",['답변드립니다.\n네 뒤에 맞은 백신만 다시 맞으시면 될 것 같네요\n걱정하지 마세요 \n답변 도움 되셨길 바랍니다'],1,https://kin.naver.com/qna/detail.naver?d1id=6&dirId=6080402&docId=370626736&qb=67Cx7Iug&enc=utf8&section=kin&rank=25&search_sort=3&spq=0,고용보험
3,2020.10.13,[],코로나 폭증해서 등교 중지되거나 1/3으로 회귀할 확률,"있나요?

제발 다시 1/3이나 등교중지ㅠㅠ 지금 자습할게 산더미인데 학교를 오라니 말이되나요ㅠ",['곧 등교중지될것 같습니다\n원래 전염병은 겨울철에 더 심해지는게 상식인데\n백신도 없는 마당에\n정부에서 너무 급하게 조치를 취한것 같군여\n아마 장사꾼들이 아이고 이게다 정부때문이다 제제풀어라 하니까 표심때문에 그런것 같습니다'],1,https://kin.naver.com/qna/detail.naver?d1id=8&dirId=814&docId=370627931&qb=67Cx7Iug&enc=utf8&section=kin&rank=24&search_sort=3&spq=0,기타
3,2020.10.13,[],b형간염 항체검사......,"피검사 결과을 받았는대...결과표을 보면
b형간염 항체가 있다는거죠..???","['HBs Ag는 B형간염 표면항원입니다. B형간염 표면항원이 음성(Negative)이면 몸에 B형간염 바이러스가 없는 것입니다. 따라서 현재 B형간염에 걸리지 않았습니다.\nHBs Ab는 B형간염 표면항체입니다. B형간염 표면항체가 양성(Positive)이면 몸에 B형간염에 대한 항체(면역력)가 있는 것입니다. \n참고로 말씀드리면 결과표에 나온 항체의 역가(양)가 10.03으로, 기준값인 10을 간신히 넘어서 있어 추후 검사에서 없다는 뜻인 음성이 나올 수가 있습니다. 이런 경우 B형간염 예방백신을 접종하면 항체의 역가를 높일 수 있습니다.\n저의 답변이 건강관리에 조금이나마 도움이 되었으면 합니다.']",1,https://kin.naver.com/qna/detail.naver?d1id=7&dirId=7010102&docId=370629510&qb=67Cx7Iug&enc=utf8&section=kin&rank=23&search_sort=3&spq=0,소화기내과
3,2020.10.13,"['검색질문', '통합검색궁금증', '통합검색질문하기']",이거 코로나인가요..?,"엄마가 어제부터 배, 머리가 아프다고 그러고 기침이랑 화장실은 많이 안가는데 열이 37.5 예요. 어제는 배만 아프다고 했는데 오늘 갑자기 머리도 아프다고 그러네요,,","['코로나증상은 글로만 판단하기 어렵습니다.\n무증상감염자도 나오는 상황이여서 근처 선별소에서 확인을 해보시는게 좋을 것 같습니다.\n자세한 증상 확인은 아래 링크에서 확인하시면 됩니다.\nhttps://zo-zoon.tistory.com/73\n코로나 증상 확인 예방하는 방법 (+필독사항)(+코로나후유증)\n코로나 바이러스 확진자수가 세자리대에서 두자리대로 떨어지긴 했지만 그렇다고 안심하긴 이릅니다. 내가 조심해야 가족, 친구도 안전할 수 있습니다. 증상 코로나바이러스감염증-19 환자에게 나타날 수 있는 임..\nzo-zoon.tistory.com', '네, 증상으로는 코로나인지를 알수가 없으며 선별진료소에서 진단키트로 검사를 해야 정확하게 알수가 있습니다.\n질문자님의 엄마가 배 등이 아프다면 병원 등에 가서 약을 먹어 보고 그래도 낫지 않는다면 질병본부 1339, 지역번호120이나 보건소에 상담을 받아 보시기를 바랍니다.\n코로나 바이러스는 무증상도 많고 약한 증상도 있으며 감기나 독감증세와 비슷하다고 하며 증상으로는 기침,가래,콧물,두통,발열,인후통,근육통,호흡곤란,설사,복통,결막염,후각 미각 마비등 이외에도 많은 증세가 있다고 합니다.\n전세계 코로나 확진자는 3,700만명 그리고 사망자가 107만명으로 계속 확산이 되고 있으며 세계보건기구는 확진자가 실제로는 20배이상 많으며 사망자는 2배 이상 많을 것으로 예상을 하고 있습니다.\n아직 백신이 개발이 되지 않아 항상 마스크를 쓰고 사람들과 접촉을 피하며 손을 자주 씻어 코로나를 예방을 해야 할것입니다.\n감사합니다.', '코로나 의심증상은 37.5도 이상부터 입니다 ㅠㅠ\n대중적으로 알고 있어야 할 최소한의 코로나 지식을 공유 해보려고 합니당~\n<코로나 언제 종식되는가?>\n코로나 종식은 생각보다 쉽지 않습니다~ 코로나 종식을 최대한 앞당기기 위해 인류가 먼저 선행했던 것중 하나가\n기존에 있었던 코로나와 비슷한 질병에 쓰였던 여러 치료제의 성분을 조사해서 치료제를 만드는 것이었습니다. 그러나 아직까진 찾지를 못하고 있죠.\n그리고 더 중요한 것은 코로나가 치료제 개발이 어려운 이유중 하나가 코로나19가 변이를 일으킨다는 것입니다~ \n그래서 아무리 치료제를 만들어도 이미 다른 코로나변이체로 변이가 되어 그전의치료제가 무의미 해진다는 것입니다. (마치 새로운 버젼의 코로나가 나오는 거죠)\n따라서 의학계에서도 코로나19 종식에 대해 정확한 기한을 정할수 없는 입장이고, 기한이 있다해도 사실 미지수 입니다. \n그러나 몇몇 학자들은 내년이나 내후년으로 예상하고 있습니다. \n다만 이 시점에 우리가 할수 있는 일은 치료제 개발과 더불어 개인이 코로나에 걸리지 않도록 최대한 예방하고 조심하는 것입니다.\n<코로나 증상>\n그리고 전 병원에서 오래는 아니지만 코로나 관련하여 일을 해본 사람 입니다~~\n코로나의 증상 중 대표적인 증상은 감기,기침,호흡기 증상입니다~ \n그래서 제가 일한 곳에서 이런 증상이 있는 분들은 혹시 모를 코로나로 간주해서 선별진료소에 가서 진료를 받게 유도 합니다\n또 열체크를 하여 고열, 37도(37.5도이상 = 코로나의심)이상만 나와도 병원 출입을 금하고 선별진료를 받도록 하고 있습니다.\n<코로나는 감염경로>\n현재까지 밝혀진 바로는 접촉이나, 체액<기침,콧물>으로 인해 그 분비물이 공기중(비말)에 날아가 전염이 되는걸로 알고 있습니다. \n하여 마스크를 반드시 코부터 입까지 완벽하게 착용해 주심이 좋구요,\n 참고로 병원에서는 눈(안경)부터 손뿐 아니라 온몸을 차단하며 코로나 관련 일을 시행하고 있습니다.\n(어떻게 감연될지 모르니 거의 원천봉쇄하는 수준이죠)\n<코로나 잠복기간>\n마지막으로 또 궁금한 것 중 하나가 코로나 잠복기간인데요~\n현재 밝혀진 공식적인 잠복기간은1~14까지 보고 있구요\n평균적으로는 4~7일 정도로 많은 분들이 증상이 나타나고 있습니다.\n마지막으로 질문자 분께서도 혹시 코로나 의심이 드신다면 혼자 걱정하는 것보다 코로나 일지도 모른다는 생각을 가지시고 \n바로 진료를 받아보심이 본인의 마음과 건강에도 도움이 되리라 생각합니다\n채택 부탁 드립니다^^7', '단순히 복통/두통일 시는 코로나로 보기는 어려울수 있습니다.\n증상을 조금 더 경과관찰 해보신 후\n37.5도 이상의 고체온/객담,기침/인후통 증상 발현 시 지역내 보건 소 및 선별진료소 방문하여\n코로나검사 받아보시길 권유드립니다.\n이번에 구매해서 사용했던 마스크인데, 착용감도 좋고 가격도 저렴하여 추천드립니다\n마침 할인행사를 합니다!\nhttps://coupa.ng/bK7Ckk\n3겹 일회용 성인 마스크\nCOUPANG\ncoupa.ng\n“파트너스 활동을 통해 일정액의 수수료를 제공받을 수 있음""']",4,https://kin.naver.com/qna/detail.naver?d1id=7&dirId=708&docId=370629615&qb=67Cx7Iug&enc=utf8&section=kin&rank=22&search_sort=3&spq=0,인체건강상식
3,2020.10.13,"['예방접종', '독감', '무료', '인플루엔자', '청소년', '국가지원', '주사', '3가', '4가']",청소년 무료 인플루엔자(독감) 예방접종 관해,"집앞 병원에서 맞고 왔는데요 저번에 뉴스에서 병원에서 돈내고 접종 받으러 온 사람에게 국가지원 백신, 무료 백신을 접종해줬다는 기사를 봤어요
제가 4가 맞는다고 맞고 왔는데 4가 말고 몰래 3가를 놔줄수도 있나요? 확인도 안하고 와서... (제가 주사 맞을때 주사기를 못봐요)혹시 아님 3가 주사와 4가 주사의 외형적 차이라도 알수 있을까요? 조금 찝찝 해서요
가족들이나 친구들 보면 주사 맞을때 엄청 아팠다고 하던데 저는 하나도 안아팠거든요 주사 바늘 들어가는 느낌도 안났어서 혹시나 싶어서요","['아니요... 유통되는 갯수를\n전부 보건당국이 검사해서..\n속일 순 없어요...\n그리고 그건 심각한 의료법 위반이라 그럴일도 없어요...\n<독감 무료접종 대상> 독감 예방접종 대상자\n독감 예방접종 무료대상 3가 4가 2020 독감 무료접종 대상자 조회/기간 _ ■독감 무료접종 대상 2020년 9월 8일부터 어린이와 임신부, 어르신을 대상으로 무료 독감 예방접종이 시작된다. 2020년은 올해는 중고생..\ndingdo.tistory.com', 'https://m.blog.naver.com/bsb9587/222087297614\n2020년 무료독감(어린이,학생) 접종시기\n전국적으로 무료독감 접종이 시작되었습니다.아시다시피 올해부터는 #4가 독감백신 접종이 무료로 진행되는...\nm.blog.naver.com']",2,https://kin.naver.com/qna/detail.naver?d1id=7&dirId=7010107&docId=370630934&qb=67Cx7Iug&enc=utf8&section=kin&rank=21&search_sort=3&spq=0,감염내과
2,2020.10.13,[],코로나에 대해,안녕하세요 제가 오늘 독감주사를 맞으려고 병원에 갔어요.근데 주사를 맞고 나오는 길이었는데 병원 앞에 어떤 아줌마와 청소년으로 보이는 남자가 마스크를 턱에쓰고 제 쪽으로 걸어오는 거에요 통화를 하는 갓 같았는데 들어보니 ‘우리 아들이 아침부터 열이 나서 병원에 왔어’라고 했어요.원래 열이 나면 밖에 나오면 안돼는 거 아닌가요?열이 나는 상태에서 마스크를 턱에 걸치고 얘기까지 해서 침이 튀겼을 수 도 있는데 어떡하죠?저 코로나 걸리는 건가요?목욕은 주사를 맞아서 못해요..,"['너무 걱정하지마세요 물론 그 아주머니가 잘못한 건 맞지만 질문자님은 마스크도 하고 계셨던 거고, 거리가 그렇게 가까이 있었던 것도 아닌 것 같으니 너무 걱정마세요 그 아주머니의 아들분이 만약 코로나라고 해도 그 아주머니는 코로나가 아닐 수도 있구요 제 경험상으로 제 친구의 부모님이 코로나에 걸리셨었는데 그 날에 친구랑 친구 부모님이랑 친구집에서 잤거든요 그리고 다음날에 집에 왔는데 친구가 친구 부모님 코로나 양성이라고 해서 저도 친구도 계속 집에서만 있었고 친구는 검사도 했는데 음성 판정 받았구요 가족이라고 해서 무조건적으로 다 감염되는 것도 아니구요 하물며 마스크쓴 상태로 감염되는 경우는 더더욱 확률이 적어요 불안해하지않으셔도됩니다', '열이 나면 병원에 가긴 가야죠.\n그 아들이 꼭 코로나라는 보장은 없으니 일단은 두고 봐야 압니다.', '네, 걱정을 안하셔도 될것 같습니다.\n코로나 바이러스는 실내에서 호흡기등으로 전파가 되는데 야외라면 질문자님이 마스크를 썼기에 코로나 감염 가능성이 없다고 생각을 합니다.\n열이 난다고 모두 코로나는 아니며 병원 등에서 약을 먹어 보고 낫지 않는다면 그때에는 선별진료소에 가서 진단키트로 감사를 받아 봐야 합니다.\n코로나 바이러스는 무증상도 많고 약한 증상도 있으며 감기나 독감증세와 비슷하다고 하며 증상으로는 기침,가래,콧물,두통,발열,인후통,근육통,호흡곤란,설사,복통,결막염,후각 미각 마비등 이외에도 많은 증세가 있다고 합니다.\n전세계 코로나 확진자가 3,700만명,사망자는 107만명으로 계속 확산이 되고 있으며 세계보건기구는 확진자가 실제로는 20배이상 많고 사망자는 2배이상 많을 것으로 예상을 하고 있습니다.\n아직 백신이 개발이 안되어 항상 마스크를 쓰고 사람들과 접촉을 피하며 손을 자주 씻어 코로나를 예방을 해야 할것입니다.\n감사합니다.', '코로나증상과 비교해보시고 체크후\n의심이 된다면 1339번에 전화후 안내 받으시기 바랍니다.\n코로나라이브 오늘은 몇명의 확진자가? 어느지역에? \nhttps://story0121.tistory.com/123\n코로나라이브 오늘은 몇명의 확진자가? 어느지역에?\n코로나로 인해 수많은 사람들이 동선을 확인하고 , 하루에 확진자가 얼마나 발생하며 , 우리지역에는 얼마의 인원이 발생했는지를 확인하며, 가는곳마다, 인적사항을 기입하고 마스크와 체온측정은 필수로 하는 시..\nstory0121.tistory.com\n코로나19 자가진단 코로나세이프 자가진단 받으러 가기\nhttps://dangcare.tistory.com/1329\n코로나19 자가진단 서비스가 개발됐다. 코로나세이프 자가진단 받으러 가기\n코로나19 자가진단 서비스가 개발됐다. 코로나세이프 자가진단 받으러 가기 고고 코로나19 선별 진료소에서 근무하는 공중보건의 등 현직 의사 9명과 MBN 측이 함께 만든 자가진단 서비스는 언제, 어디서나 손쉽..\ndangcare.tistory.com\n코로나맵’ 이어 주변 진료소 정보까지 확인 가능한 ‘코로나 알리미’\n동선확인하시고 주의하세요 ..............\nhttps://dangcare.tistory.com/1226\n코로나맵’ 이어 주변 진료소 정보까지 확인 가능한 ‘코로나 알리미’ 등장\n코로나맵’ 이어 주변 진료소 정보까지 확인 가능한 ‘코로나 알리미’ 등장 최근 ‘신종 코로나바이러스’가 국내에 확산됨에 따라 이에 대한 정보를 확인할 수 있는 창구가 하나둘씩 등장하고 있다. 지난달 30일..\ndangcare.tistory.com\n인후통코로나 증상 목아픔코로나 증상 발현 시기코로나 증상 설사코로나 증상 두통코로나코로나 증상\n트럼프 코로나\n채택시 해피빈은 코로나 관련해서 전액기부됩니다.\n코로나는 아닐거에요 , 건강한 하루되세요']",4,https://kin.naver.com/qna/detail.naver?d1id=8&dirId=8030404&docId=370631475&qb=67Cx7Iug&enc=utf8&section=kin&rank=20&search_sort=3&spq=0,"주사, 약물 요법"
2,2020.10.13,[],코로나 땜에 밖에 나가지도 못하는데,"왜 제 친구들은 잘만 싸돌아댕기는걸까요? 제가 너무 예민한걸까요? 어떤 친구는 코로나 시즌때 나간 사람들 겁나 욕해대놓고선 결국 불은 사실인데 걔도 노래방 , 카페 ,식당 , 심지어 사우나 까지 안간데가 없다네요.다른 애들은 잘만 마스크끼고 갈데는 다 가던데 심지어 어떤애는 놀이공원도 다녀오고. 하, 친구지만 진짜 가끔은 친구가 맞는지 싶고 내가 그냥 좀 많이 예민한건지. 그러고선 유혹의 말들로 너도 같이 놀이공원가자 이러는데. 고생하는 수많은 사람들은 보이지도 않나본지. 답답한건 이해하는데 왜 굳이 이시국에 잘 가지도않던 놀이공원을 간건지. 그냥 하소연 하고싶은데 주변사람들 다 싸돌아댕겨서 제가 아무리 말해도 절 이해못한다는듯이 쳐다보고. 여기다 그냥 하소연해봤어요. 다들 주변사람들은 어떤지 궁금합니다. 요즘은 술집도 열어서 마스크도 안끼고 있던데.. 너무 아무생각 없는것같아요.","['네, 코로나 바이러스가 호흡기등으로 전파가 되기에 실내등에서는 항상 마스크를 사용을 하여 자신을 보호를 하고 남에게 피해가 가지 않도록 노력을 해야 할것 같습니다.\n질문자님의 친구가 여러군데를 간다면 젊은 사람이 코로나에 걸려도 증상이 없는 경우가 많아 조심을 해야 할것입니다.\n질문자님과 친구의 행동이 서로 다른데 누가 옳은 것이지는 알수가 없지만 그러나 어디를 가면 절대로 마스크를 벗어서는 안된다고 생각을 합니다.\n마스크를 안쓰면 코로나에 걸릴수도 있고 전파를 시킬수도 있는데 무증상자도 아주 많아 마음대로 마스크를 안쓰고 돌아 다닌다면 코로나 확진자 발생은 멈추지를 못한다는 것입니다.\n내년에 백신이 나오기 전까지는 항상 마스크를 쓰고 사람들과 접촉을 피하며 손을 자주 씻어 코로나를 예방을 해야 할것입니다.\n감전세계 코로나 확진자는 3,700만명 그리고 사망자는 107만명으로 계속 확산이 되고 있으며 세계보건기구는 확진자가 실제로는 20배 이상 많으며 사망자는 2배 이상 많을 것으로 예상을 하고 있습니다.\n감사합니다.']",1,https://kin.naver.com/qna/detail.naver?d1id=3&dirId=316&docId=370631925&qb=67Cx7Iug&enc=utf8&section=kin&rank=19&search_sort=3&spq=0,초자연현상
