page,date,tags,questions,questions_add,answers,N_answer,url,category
45,2020.09.25,[],우한 코로나를 보면 광우병 때의 헬센징들 재방송이네요,"코로나는 인류를 대상으로 한 대 사기극이라고 생각합니다.
주류를 거스르는 이러한 발언은 어쩌면 미친 놈 소릴 듣고 외면당하기 딱 좋겠죠.
나와 동일한 생각을 가졌다고 하더라도 아마 대다수는 남의 시선 때문에 침묵하는 편을 선택할 것이라 봅니다.
그러나 언제나 세상은 진실을 말하고자 하는 사람들이 있어왔고
때론 진실을 말하고자 하는 이들은 생명의 위협 또는 고난을 당하기도 해왔습니다.
그럼에도 불구하고 진실을 추구하고자 하는 그 열망을 완전히 짓밟을 순 없기에
우리는 그런 이들을 통해 진실을 볼 수가 있는 겁니다.
진실유무를 떠나 집단적으로 999명이 찬성일 때 1명이 반대를 외친다면 그 한명은 이단아가 됩니다.
상황심리라고도 하는데 상황 자체가 그렇게 만들어버리죠.

평소에 나는 마스크를 사용하지 않습니다.
이유인즉 굳이 필요가 없다고 생각하기 때문이죠. 10년 전 신종플루 때도, 5년 전 메르스 때도 그랬습니다.
물론 내가 심한 감기에 걸려 남에게 피해를 주지 않기 위해서는 사용할 수도 있겠지만 그런 이유가 아닌 현재 같은 상황에선 나를 위해서도 남을 위해서도 굳이 내가 마스크를 착용할 이유가 없다고 생각하기 때문입니다. 그러나 올해 코로나의 경우는 이전과 다르게 마스크를 반드시 착용해야만 하는 곳들이 생겼습니다. 예를 들어 교회를 가든, 은행을 가든, 병원을 가든 착용을 요구받는 곳들이 생겼기에 그런 경우에는 부득불 착용합니다. 그리고 타인을 위해 착용을 해야 한다는 것이 어느새 하나의 법처럼 작용되어지고 있죠.
서울은 마스크 착용 의무화가 되어버렸습니다 경기도는 벌금까지... 사실 밀집 장소도 아닌 야외나 길을 보행할 때는 전혀 착용할 필요가 없으나 이와 같은 시행령이 내리면 이제는 내 의지와 무관하게 그리고 진실과 무관하게 마스크 미착용자는 사회의 법을 어긴 이단아가 되며 몰상식한 이가 되는 겁니다.
안그래도 오늘 운전을 하면서 보여지는 풍경이 어쩌다 미착용자가 보일 정도로 거의 대다수가 마스크 착용을 했습니다. 이처럼 사회를 통제하게 되면 대다수 사람들은 머리 아프게 따지지 않고 시키는대로 하게 되죠. 그래서 국민을 개돼지라 하는 것이며 미국에선 Sheep+People의 합성어로 Sheeple이라고도 한답니다.
내가 코로나가 사기극이라 하는 이유는 짱깨 코로나 자체를 부정함은 아니고요.
단지 코로나가 지금처럼 사람들을 통제할만큼의 질병이 아니라는 겁니다.
바이러스에 의한 질병이란 시간이 어느 정도 지나면 변형도 되고 항체가 생기게 됩니다.
요즘이라고 신종플루나 메르스가 아예 없어진 건 절대 아니고.
요즘에 신종플루에 진단을 받아도 과거처럼 난리법석을 떤답니까 ㅋ
여러번 말하는 바지만
한국만 해도 감기, 독감으로 3,4천명이 매년 사망하나 이러한 사실을 아는 이들이 거의 없죠
공기로도 감염된다는 결핵은 메르스 사망자의 60배인 2천명이 매년 사망합니다.
그러니까 전철 안에 같이 타고 있다가 옮을 수도 있다는 거죠.
만약 지금처럼 이번달에 결핵 사망자가 150명입니다. 몇명 감염됬습니다..
이런 식으로 실시간 보도를 한다고 쳐봅시다...
실제 사망자수가 코로나에 비해 엄청나기에 지금보다 더한 패닉에 빠질 것이며
한국 경제는 붕괴할지도 모를 일이며 사람들의 삶은 지금보다 더 위축될 겁니다.
코로나로 사망할 확률보다 굶어죽어 사망할 확률이 더 높아질만큼
미국의 경우, 실직자가 늘어나고 있고 월세도 내지 못하는 국민들이 엄청나게 늘었습니다.
한국 역시 피해가 엄청날 겁니다.
사실 우한발 코로나는 신세계질서(New World Order)를 꿈꾸는 예수회, 일루미나티 이런 이들이 통제 사회로 만들고 인구감축을 하려는 목적이라는 주장들이 있습니다. 이런 이야기가 나오면 보통은 음모론으로 치부해버리기 딱 좋은 것이나 전혀 근거가 없이 나오는 이야기들이 아닙니다. 미국 국립알레르기전염병연구소 소장인 앤서니 파우치는 트럼프 행정부가 출범하기 전 앞으로 큰 팬데믹이 올 것이며 펜데믹을 수년내에 보게 될 것이란 호언장담을 한 바 있죠. 빌 게이츠도 그렇게 말해왔고 세계인구를 감축해야 한다고 말해왔으며 백신을 맞아야 한다고 이야기를 하고 있습니다. 이렇게 말하는 앤서니 파우치와 빌 게이츠가 모두 우한 바이러스 연구소와 관련이 있으며 이와 관련된 내용은 지금 실은 내용만으로 많기에 이 포스팅에선 이 정도로 언급만 하고 생략하기로 한다. 실은 미국의 사망자수가 높은 것은 사망자에게서 감염이 아닌 짱깨코로나 바이러스만 검출되어도 짱깨코로나 사망자로 처리하고 사망시 코로나로 기록하면 의료보험에서 13000불을 받는다고 하죠
진실은 언제까지 감출 수 없답니다.
앞서 말했듯 맹목적으로 따라가는 대중들이 있는 반면
누군가는 진실을 추구하며 밝히는 무리들이 있기 때문이죠.
우선 코로나 감염에 대해 감기, 독감에 유의하듯 조심은 하되 두려워할 필요가 없다는 것이 내 주장입니다.
지나친 두려움은 오히려 건강에 해가 되며 마스크를 지나치게 착용함도 산소를 마시지 못하고 내가 내뱉은 이산화탄소를 흡입함으로 인해 건강에 해롭답니다.




언론에 나오진 않지만 코로나의 진실에 대해 말하는 의료 전문가들이 늘어나고 있답니다. 주목해볼 것은 코로나에 대해 폭로하거나 마스크 문제에 대해 폭로하는 영상들이 유튜브에서 계속 삭제가 되고 있다는 거죠. 그리고 우리 언론에는 현재 해외에서 이처럼 마스크 거부 운동이 일어나고 있는 것에 대해 사람들이 알만하게 비중있게 다루지 않고 있다는 겁니다.



지금처럼 코로나가 생명권을 위협한다는 논리라면 공기로도 감염되며 매년 2천명씩 사망하는 결핵은 왜 감추고 있는가 묻고 싶네요.


뭐 광우뻥같은걸 믿고 나댔던 민족에겐 이런 의문이 들 뇌가 있긴 하겠냐만요.
지금 광우병이 뻥이였단걸 알아도 그때와 같은 패턴으로 행동하는 민족이 한국인들이죠.
그러니까 연평도 공무원이 북괴애들에게 죽었는데도 월북 프레임 씌우고 멋대고 종전선언하는 문재앙이 대통령이 된거고요.","['ㅇㅇ 그래요', '이거 봇인가? 뭐 똑같은게 몇십개씩 있어']",2,https://kin.naver.com/qna/detail.naver?d1id=6&dirId=61303&docId=369099802&qb=67Cx7Iug&enc=utf8&section=kin&rank=446&search_sort=3&spq=0,사람과 그룹
45,2020.10.27,['#아질산염'],아질산염이 뭔가요??,이번에 백신독감 주사 맞고 사망한 학생이 아질산염이 검출되었다는데 대체 뭐길레 그런거에요?,"['아질산염에 관한 글은 여기서 참조하시면 이해가 빠릅니다\nhttps://jungbobadaya.tistory.com/95\n아질산염이란? 독감백신 17세 고등학생 사망\n17세 고등학생이 백신을 맞은지 2틀만에 사망했습니다 하지만 국과수 부검결과 아질산염 중독으로 사망을 했다고 합니다 하지만 유족의 친형은 그럴일이 없다며 국민청원에 까지 글을 올렸습니다 아질산염이란 육..\njungbobadaya.tistory.com', ""아질산염은 일반적으로 방부제로 쓰입니다.\n햄, 소시지, 베이컨 등 가공육 방부제로 많이 사용되죠.\n공사현장에서는 시멘트 방동액으로 사용되고요.\n지금 인천 17세 고교생 독감백신 사망 원인이 아질산염 이라고 하네요.\n'아질산염 검출' 충격적인 고등학생 독감백신 사망미스테리(+국민청원링크 아질산나트륨)\n'아질산염 검출' 충격적인 고등학생 독감백신 사망미스테리(+국민청원링크 아질산나트륨) 2020년 10월 16일 인플루엔자(독감) 백신을 맞고 이틀 뒤 사망한 인천 17세 고등학생 A군의 부검 결과 독극물로 분류되는..\nspeedsalgoo.tistory.com"", ""주로 육류의 선홍빛을 유지하는 식품첨가물로 쓰이는 방부제입니다.\n해당 관련 내용 참고하세요\n진짜 의문 투성이네요\n인천 17세 독감백신 접종 후 사망... 의문의 아질산염 검출? (+유족 국민청원)\n27일 청와대 국민청원게시판에는 '제 동생의 죽음의 억울함을 풀어주세요'라는 제목의 글이 올라오며 실시간 검색어를 장악했다. 이유는 즉? 독감 백신 접종 후 사망한 인천 17세 고등학생 A군의 사망원..\nclantown1733.tistory.com"", '아질산염 햄에 들어가는 첨가제인데..\n이거 개인에 팔지도 않는것을 어디서 샀다는것인지 궁금하네요.\n17세 남학생 아질산염 검출 구매처?\n독감백신을 맞고 사망한 사람들이 늘어나면서 독감접종에 대한 우려가 점점 커지고 있는 상황입니다. 하지만 대부분의 사람들은 독감백신으로 사망하는것은 일부이며 독감에 걸리는 위험에 대한 두려움이 더 크기..\nsopii.tistory.com', '© willieboysf12, 출처 Unsplash\n안녕하세요. \n 「음식과 건강 그리고 질병」이라는 블로그를 운영하고 있는  「 과일파는 기술사 」  입니다\n본론으로 들어가서...\n흔히들 아질산염이라 부르지만 시중에 유통되는 제품은 주로 아질산나트륨이 사용되고요 \n아질산나트륨 단독으로 또는 아질산나트륨과 질산칼륨을 함께 사용하기도 합니다. \n나트륨과 칼륨이 염기성 원소이기 때문에 아질산염 또는 질산염 이렇게 부르는 것이지요. \n아질산염은 소시지,햄,베이컨에 사용되고 있고주로  돼지고기를 원료로 사용하는 제품에 쓰입니다  \n""우리제품은  남들과는 차원이 달라!"" 라고 어필하는 회사는 돼지고기를 주원료로 여기에다 소고기를 일부 섞어 제조하기도 합니다\n그리고 어떤회사는  ""우리는  완전 달라 !"" 라고 하면서  100% 소고기만 쓰는 경우도 있답니다.  \n물론 가격은 비싸지겠죠.\n© moerschy, 출처 Pixabay\n아질산나트륨은 국내산 육가공제품과 스페인산 생햄( 하몽,비가열식품)이나 소시지 ( 살라미,비가열식품 )등 수입산 거의 모든 육가공제품에 「발색제』 또는 「보존료』의 용도로 사용하고 있는 식품첨가물입니다. \n현재 우리나라는  아질산나트륨은 발색제로 표시하게 되어 있고요. \n우선 \n아질산염의 발색의 원리는 \n질산칼륨과 같은 질산염을 사용하면 돼지고기 등 원료육에 존재하는 세균에 의해 질산염이 아질산염으로 변하게되고... 그 이후 이 아질산염이 고기의 색소인 미오글로빈 ( myoglobin )과 결합해서 고기 본래의 육색을 고정시키는 역할을 하니까 당연히 고기의 색의  변색이 방지되겠죠? 그래서 쓰는 거랍니다\n물론 아질산나트륨 단독으로 쓰는 경우도 마찬가지예요.\n사실 업계입장에서 보면 아질산염은 보존제의 목적이 더 강한것 같아요. \n아질산염은 육류의 아민 ( amine )이라는 성분과 반응해서 니트로사민 ( nitrosamine )을 생성하는데 이 물질이 발암을 일으킬 수 있다는 논란이 있었고요, \n또다른 논란은  유럽에서 햄,소시지 등의 식육제품에 많이 발생했던 식중독 사고가 바로 보툴리누스 식중독 ( 균명 : Clostridium botulinum )에 의한 사망사고 였는데 바로 이 아질산염이 보툴리늄균의 생육을 강력하게 억제한다는 것이었지요. \n발암가능성이라는 risk 와 식중독균을 강력히 억제한다는 benefit 의 논란에서 결국 미국 정부는 육가공 업계의 손을 들어주게 되었고 결국 그렇게 되서 여러 논란에도 불구하고 아질산염이 식품첨가물로 허용되게 되었던 겁니다. \n여기서 제가 꼭 강조하고 싶은 것은 \n식품첨가물이나 농약 중금속 등 유해물질의 안전성 문제는 항상 식품을 구매하는 소비자에게 risk ( 위험 )와 benefit ( 이득 )중에서 하나를 선택하도록  강요합니다.\n농약은 위험하지만 어느정도는 risk 를 감수하겠다는 개념처럼 유해물질이나 유해균의 검출기준이 식품마다 정해지게 된 것이죠.\n산에서 혼자 사는 자연인이 아닌 이상, \n우리는 무농약 쌀을 좀 비싸게 살건지, 농약을 썼더라도 허용기준치 이내인 쌀을 좀 싸게 살 것인지 결정해야 합니다. \n결론적으로\nWHO 산하기구인 국제암연구소 ( IARC )에서 아질산염을 Group 2A ( 2군 발암물질로서 인체발암 추정물질 )로 규정하고 있고 ( 흔히 1급 발암물질이나 1군 발암물질로 표현하는 것은 적절치 않음 )\n또한 아질산염은 혈액중의 헤모글로빈과 결합하여 산소 운반능력이 없는 met hemoglobin 으로 변하는 데 과량 섭취하면 산소부족증을 유발할 수 있는 risk 가 존재합니다. \n© geralt, 출처 Pixabay\n현행 식품공전에서는 소시지,햄,베이컨 등 대부분의 식육가공품에 대해, 제품 1kg 기준으로 0.07g 까지 허용하고 있어요. 그럼 어느 수준까지 먹어야 안전할까요. \n허용기준치 이내라면 안전할까요. \n아이들에겐  어떻게 먹여야 좋을까요. 이것 저것 생각할 게 참 많은 문제입니다. 저의 대답은 ""아질산염이 들어간 식품은 최대한 먹지말자""입니다. 아질산염 뿐만 아니라 ""다른 식품첨가물이 포함된 식품도 최대한 자제하는게 좋다"" 입니다\n허용기준과 관계없이요\n최종소비자인 여러분들은 앞으로 어떤 선택을 하실런지요.  감사합니다.                                                             \n우리 모두 가난과 질병과 근심이 없는 세상을 꿈꾸며..\n                        과일파는 기술사 드림']",5,https://kin.naver.com/qna/detail.naver?d1id=7&dirId=710&docId=371810595&qb=67Cx7Iug&enc=utf8&section=kin&rank=445&search_sort=3&spq=0,"의료기관, 의료인"
