page,date,tags,questions,questions_add,answers,N_answer,url,category
12,2020.08.25,[],"근데 코로나백신이 생긴다고 그걸로 끝일까요?
더 심한 바이러스가 생길 수도 있지 않나요?",,"['저도 그렇게 생각해요...\n돼지독감도 얘기 나왔었고 더 큰 감염병 터지면 나라가 어떻게 될지...ㅠㅠ', '그렇죠 ㅠㅠ\n가을, 겨울이 또 걱정입니다!\n아무쪼록 지금까지 해왔던것처럼\n우리모두 앞으로도 예방수칙 생활화하기로해요..\n마스크착용\n손씻기\n사회적 거리두기\n그리고 코로나에 면역력을 키워야하는거 아시죠?\n제가 먹고있는것도 있고한데 이 사이트 몸에 좋은 제품들\n많이 판매하고 가격도 착하드라구여..\n추후 도움되시길...\n녹용이나 홍삼, 건강즙도 좋고요\n비타민, 프로폴리스, 오메가3, 미네랄, 포도당마시는 음료,\n밀크씨슬, 루테인, 쏘팔메토, 장건강을 위한 제품, \n뼈건강이나 관절건강, 뷰티를 위한 제품, 콜라겐, 눈건강 면역력증진등등\n건강식품들도 골고루 나눠져있어요\n이번에 들어갔더니 이벤트도 하네요~\n제품 구매하신분들 카카오톡 하루건강엔 친구추가하시고\n1:1 대화로 참여완료 남기시면 추첨해서 제주신화월드 숙박권을 주는 이벤트에요\n한번 체크해보세요^^\n코로나 종식되기를 바라며 가족모두 건강유의하세요\n면역력 잘 키워서 강화시키고 코로나 잘 이겨내기로해요!\n미리 예방하는게 최우선일듯합니다\n가족들에게 맞는 영양제 한번 체크해보세요~~\n국산 마스크, 손소독제도 판매하네요\nhttps://smartstore.naver.com/haruhealthy\n하루건강엔 : 네이버쇼핑 스마트스토어\n하루건강엔 여기! 건강한 매일을 위해 안전하고 정직한 제품만을 소개합니다.\nsmartstore.naver.com', '백신이 나와도 변이 때문에 최소 2년은 더 마스크를 끼고 생활해야된다는 말도 있더라구요\n마스크 필수착용 손소독제 사용 등이 최선이겠죠\n밑에는 마스크 구매시 참고해보시라고 국내브랜드 마스크 추천하나 남겨드릴게요~\n여름철 더워져서, \n비말까지 막을수있는 비말차단용 덴탈마스크가 인기인데요. \n정식승인 받은제품으로 구매하셔야 안전합니다. \n정식승인받은 제품중에서\n가성비 가장 좋은 국내브랜드 일회용마스크로 \n추천드릴게요. \n국내 브랜드 울리울리 마스크인데요. \n추천드린이유는 믿을수있는 국내브랜드중에, \n최고 가성비의 품질좋은 덴탈마스크이고요 \n비말차단용 성적표까지 받은 마스크기 때문이고요, \n비말차단용 고급형 낱개포장되있는 마스크 보통 저렴해도 장당 700원정도하는데, \n울리울리마스크는 MB필터 99%에, 낱개포장, 비말차단용 고급형 덴탈마스크인데 한장에 300~350정도하네요.\n울리울리 마스크는 멜트브로운 필터가 99% 들어간 고급형제품이고 한장씩 개별포장되어있어요. \n[울리울리 비말차단 고급형 덴탈마스크 온라인 마켓별 최저가]\n네이버스토어\n울리울리 비말차단용 덴탈마스크 고급형 MB필터99% 1매개별포장 50매 우체국택배 : 타메몰\n[타메몰] 디지털 기기 전문업체입니다.(샤오미,삼성정품,LG정품,스마트폰악세사리)-(주)타메네트웍스-\nsmartstore.naver.com\n네이버스토어는 1만원이상구매시 \n500원 할인 이벤트중이네요!!\n옥션\n비말차단 덴탈마스크 MB필터99% 개별포장 50매(블랙) - 옥션\n건강/의료용품>호흡/수면건강용품>마스크\nauction.kr\n지마켓\nhttp://gmkt.kr/gBtu9rp\n11번가\nhttp://11st.kr/QR/P/2938846571\n인터파크\nhttp://shopping.interpark.com/product/productInfo.do?viewTp=preview&prdNo=7320813762\n위메프\nhttps://front.wemakeprice.com/product/1176916663\n요즘 택배대란이라 일반택배는 밀린다는데, \n우체국택배로 바로 배송해줘서 \n다음날 바로 받아볼수있네요!!\n울리울리 마스크는 \nFDA 인증 \nCE 인증\n를 모두 받은 믿을수있는 마스크이고요. \n3중 필터구조\n멜트 블로운 필터 99%\n를 사용한 고급형 마스크에요.\n울리울리 마스크는 방수 + 멜트브라운 + 방수 3중 필터 처리로 \n차단능력이 매우 우수해요.\n1중으로 내부필터로 우수한 통기성을 지닌 방수부직포를 사용하였고요. \n2중으로 멜트블로운 필터를 사용해서 외부유해 물질을 차단했어요. \n3중으로 외부필터로 다시 한번 우수한 통기성 + 방수부직포로 마감하였고요.\n멜트블로운 필터는 \n부직포 필터의 일종으로 보건용 마스크에 사용되는 필터라서 믿을수있고, 이 함량에 따라 원가차이가 나는데 99% 함량되있는 고급형 마스크에요.\n울리울리 마스크는 \n간편한 착용감과 와이어사용으로 코 부분도 매우 편하고, \n고탄성 이어밴드로 귀가 아픈현상을 최소화한, \n1매씩 개별포장되어서, 외부오염우려가 없는\n최고의 가성비좋은 덴탈 비말차단용 마스크에요~ \n답변이 마스크 고르시는데 도움되었길 바랍니다.']",3,https://kin.naver.com/qna/detail.naver?d1id=8&dirId=80101&docId=366120993&qb=67Cx7Iug&enc=utf8&section=kin&rank=114&search_sort=3&spq=0,"연애, 결혼"
12,2020.08.25,"['#슬링백', '#메신저백']",메신저백 추천 내공+50,매신저백을 사려는 중학생입니다 학교갈때 매려고 사는건 아니고 학원에 잠시 갈때나 짐이 적을때 정도로 사용할껀데 혹시 추천해 주실 메신저백 있으신가요?,"['안녕하세요 메신저백 추천 드립니다 \n제이백 에이덴 크로스백 슬링백 힙색 가방\nCOUPANG\ncoupa.ng\n마르코폴로 남성용 모건 메신저백 MP6408 + 키링\nCOUPANG\ncoupa.ng\n마젤란 LKML-1927 메신저백 + 키홀더 학생 가방 학원 책가방 캐주얼 크로스 숄더 백 남자 여성\nCOUPANG\ncoupa.ng\n3가지 추천 드립니다 \n쿠팡 파트너를 활동을 통해 수수료를 지급 받을수 있습니다 ', ' 안녕하세요 질문자님\n스마트인입니다.^ㅡ^\n해당 사항에 대해서 고민이 많으신거 같네요\n제가 도와드리겠습니다.!♥\n질문자님에게 딱맞는 상품을\n인기있는 상품으로 열심히 검색 해보았어요 ㅠㅠ!\n후기가 많으면 이유가 있을거 같아요~ㅎㅎ\n질문자님에게 도움이 되셧으면 합니다^^\n관련 기사글과 영상도 참고하시면\n상품 고르시는데 도움이 되실거같아요~\n채택받은 해피빈은 불우한 이웃에게 기부하는데 \n쓰고 있습니당. ^ㅡ^\n""\n후기보고 어렵게 찾은 신뢰가는 메신저백 이네요. 이건 사야합니다""\n    no.1\n핍스 essential 메신저백\n37,730원\n후기확인 (2)\n    no.2\n마젤란 LKML-1927 메신저백 + 키홀더 학생 가방 학원 책가방 캐주얼 크로스 숄더 백 남자 여성\n18,900원\n후기확인 (51)\n    no.3\n마르코폴로 남성용 모건 메신저백 MP6408 + 키링\n16,800원\n후기확인 (570)\n    no.4\n캉골 [캉골] 캔버스 메신저백 피크닉 2032\n22,000원\n후기확인 (9)\n    no.5\n후아유 남녀공용 포켓 메신져백 WHBGA2201A 메신저백\n19,900원\n후기확인 (13)\n    no.6\n바이모스 [필통증정]바이모스 맥시멈 메신저백8탄-블랙\n28,000원\n후기확인 (13)\n    no.7\n핍스 essential stripe 메신저백\n37,730원\n후기확인 (4)\n    no.8\n마르코폴로 서프크로스백 MP6460 + 키링\n15,360원\n후기확인 (615)\n    no.9\n후아유 스티브 미니 메신저백 WHBGA4932A\n22,900원\n후기확인 (7)\n    no.10\n솜니움 스푸키 메신저백\n12,900원\n후기확인 (28)\n    no.11\n르마인 폴리 600D 액티브 메신져백\n27,520원\n후기확인 (0)\n    no.12\n슈프림 남녀공용 데일리 캐쥬얼 메신저백 3698\n14,900원\n후기확인 (35)\n    no.13\n더블유팝 마젤란 LKML-1906 메신저백 + 라벨키홀더 증정 크로스백\n16,800원\n후기확인 (451)\n    no.14\n윤스미스 남여공용 바이크 슬링백 크로스백 메신저백\n14,900원\n후기확인 (43)\n    no.15\n쿠팡 브랜드 - 베이스알파 에센셜 슬림 락시스템 크로스백\n15,100원\n후기확인 (798)\n""\n<메신저백 관련 인터넷세상 이슈입니다>\n코로나19 백신개발 나선 큐어백, 나스닥 상장해 2천500억 조달\n[글로벌-Biz 24] 코로나19 백신 개발 큐어백, 출시 앞당기나\n코로나 백신 개발 獨큐어백, 나스닥 상장 2900억원 조달 계획\n[글로벌-Biz 24] 獨 백신 제조업체 큐어백, 나스닥 상장 첫 거래 250% 급등\n[기획] ‘희망 메신저’ 동아백년 파랑새 동아일보의 새로운 100년을 향한 飛上\n존재하지 않는 이미지입니다.\n#가방, #크로스백, #마르코폴로메신저백, #남자메신저백나이키, #학생메신저백"" ""\n지금 보시는글은 파트너스 제휴로 일정 광고수익을 받을수 있답니다 ^ㅠ^""', '추천드릴게요\nhttps://oneany.shop/BM2NCi\n핍스 essential 메신저백\noneany.shop', '나이키 메신저백 추천드립니다.\n나이키 힙색 테크 힙 팩 BA5751-010 S810 여행가방 웨이스트팩\ncay.kr', '적은 짐을 넣을 메신저백이라면~\n존피터뉴욕의 2040메신저백과 6015메신저백 추천해드릴 수 있을것 같아요.\n두 제품 모두 너무 부~~~하지 않아서 몸에 핏~하게 연출할 수 있는 메신저백이예요\n먼저 존피터 2040메신저백입니다.\n판매처 찾아보니까~~\n존피터뉴욕 2040메신저백이 버건디, 레드 색상만 있는것 같아요.\n2040버건디 색상은 스트레이키즈 현진이 공항패션으로도 선보였던 제품입니다.\n버건디 색상 예쁘네요~^^\n(사진 출처는 이미지에 있습니다.)\n혹시 블랙, 그레이 색상으로 본다면\n존피터뉴욕의 상위버전으로 런칭된 얼티메이크에도 2040 메신저백이 출시되고 있으니\n얼티메이크 제품으로 보셔도 될것 같아요.\n그리고 존피터 6015메신저백 입니다.\n이 제품도 가볍게 소지품 넣어가지고 다니기 좋은것 같아요.\n앞쪽 뒷쪽에 가로사이즈만한 지퍼포켓이 있어서 소지품 넣어가지고 다니기도 좋구요~\n개인적으로는 존피터 2040 버건디색상 추천드려요\n스트레이키즈 현진이 착용한 사진보니까~ 많이들 사용하는 검정 말고~\n버건디색상 너무 매력있어 보입니다. ^^\n예쁜 메신저백으로 구매하세요~', '마르코폴로 남성용 모건 메신저백 MP6408 + 키링\nCOUPANG\ncoupa.ng\nNBGCAF0203 / 보스톤 메신져 S\nCOUPANG\ncoupa.ng\n뉴발란스 뉴발란스메신저 Basic Messenger NBGC9S0201 19\nCOUPANG\ncoupa.ng\n[공식] 휠라 뉴로고 메신저백 크로스백 블랙\nCOUPANG\ncoupa.ng\n칼하트 D89 메신저백 블랙 11052301\nCOUPANG\ncoupa.ng\n캉골 [캉골] 캔버스 메신저백 피크닉 2032\nCOUPANG\ncoupa.ng\n캉골 크로스백\nCOUPANG\ncoupa.ng\n추천 드립니다.\n파트너스 활동을 통해 일정액의 수수료를 제공받을 수 있음']",6,https://kin.naver.com/qna/detail.naver?d1id=5&dirId=5040201&docId=366121114&qb=67Cx7Iug&enc=utf8&section=kin&rank=113&search_sort=3&spq=0,가방
12,2020.08.25,[],코로나19 상황이 심각한것 같아요,"언제쯤 사라질까요

저는 2021년까지 갈듯해요 ㅠ","['코로나 독감처럼 계속 남는대요..', '저도 올해는 글렀고\n못해도 내년까지도 쭉 이럴 것 같아요.\n백신\n제발\n!!']",2,https://kin.naver.com/qna/detail.naver?d1id=8&dirId=814&docId=366125542&qb=67Cx7Iug&enc=utf8&section=kin&rank=112&search_sort=3&spq=0,기타
12,2020.08.25,"['코로나바이러스', '코로나19', '코로나백신']",코로나 백신,"제가 인천에 있었을때입니다 코로나에대한 경각심이 없어서 마스크안쓰고 많이 돌아다니고 확진의심자랑도 만낫던적이 있었습니다
3달동안 그렇게하고 혹시나싶어 병원에서 검사를 받았는데 음성이 나왔습니다
그냥 아무런증상도 없고 그냥 평범히 살아가고있는데 혹시나 싶어 여쭤봅니다
만약에 아주 만약에 말입니다.
제 혈액 또는 다른 사람의 혈액으로 조금이나마 면연력이 강한사람의 혈액으로 백신을 만들수는 없을까요..?
최대한 많은 가능성을 열어두고 개발해본다면 가능성이 있을것같아서요...
사람들을 살리는데에 필요하다면 얼마든지 드릴수있습니다.
그냥 혹시나 해서 써봅니다...(욕은하지말아주세요..)","['면역력이 강한  사람이 아니라,,\n이미 코로나 감염 및 치료를 받고 완치된 사람의 혈장을 기증받아,\n혈장 치료제를 만들어 이미 임상 실험을 하고 있고, 효과를 보고 있습니다.\n질문자가 감염 후 면역이 생겼다면 혈장 기증도 가능하나,,\n감염 여부를 알아야 가능합니다.']",1,https://kin.naver.com/qna/detail.naver?d1id=9&dirId=9020309&docId=366126143&qb=67Cx7Iug&enc=utf8&section=kin&rank=111&search_sort=3&spq=0,러시아
11,2020.08.25,[],"코로나가 사라지지 않는다면
모든 생산시설은 자동화가
되고 월30만원씩 기본소득을 나눠주는
세상이 오는건가유",,"['어떻게든 물리쳐야 될 과제입니다.백신 출현 후 상황을 기대해 봅시다', '그전에 코로나와 기근, 자연재해 및 핵전쟁 등으로 세계가 멸망할 것 입니다', '그렇게 되려면 그 정도의 생산시설을 위한 인프라가 구축되어 있어야하고\n그 인프라를 위해서 노동력과 자금이 충분히 있어야하지만\n지금 그런 상황이 아니기 때문에 불가능이라고 볼 수 있습니다.\n사실 다른 선진국들도 아직 실현 못하고 있는 이상적 사회이기도 하구요.']",3,https://kin.naver.com/qna/detail.naver?d1id=6&dirId=61303&docId=366126508&qb=67Cx7Iug&enc=utf8&section=kin&rank=110&search_sort=3&spq=0,사람과 그룹
11,2020.08.25,"['코로나', '코로나19', '코로나바이러스']",코로나19 긍정적 측면,코로나19 사태의 긍정적 측면에는 어떤 것이 있을까요...,"['1. 전염병에 대한 경각심 고취\n2. 백신이나 치료제 개발기술 발전\n3. 정부나 지자체의 전염병 대처에 대한 체계적 매뉴얼 마련계기\n4. 과도한 환경파괴나 야생동물 포획금지\n5. 개인의 건강과 면역력 향상을 위한 노력확대', '국민들이 위험성을깨달았고\n전자상거래 시장은 활발해서 더욱 커질것으로 판단되며\n의료 기술도 이번에 더 많은 발전이 일어났고 위기대응에 \n뛰어난 일면을 보여주었습니다.\n지금은 아프고 힘들지만 먼 훗날에 초석이 될것입니다\n-cj 싹쓰리 기획전 \n→https://coupa.ng/bIxdCQ\n-1인가구 주방용품\n→https://coupa.ng/bIxerY\n-1인가구 신발 정리함\n→https://coupa.ng/bIxeFi\n-행거 기획전\n→https://coupa.ng/bIxeNS\n-1인가구 미니 직화그릴\n→https://coupa.ng/bIxeRx\n-노트20 자급제폰 기획전\n→https://coupa.ng/bIxeZm\n-웹캠 기획전\n→https://coupa.ng/bIxfah\n-아프리카 티비 유튜브 촬용 방송 세트\n→https://coupa.ng/bIxfgG\n-유튜브 조명\n→https://coupa.ng/bIxfnx\n-위니아 김치냉장고 뚜껑형 \n→https://coupa.ng/bIxfsR\n-딤채 김치냉장고 뚜껑형\n→https://coupa.ng/bIxfwD\n-김치냉장고 스탠드형 \n→https://coupa.ng/bIxfBW\n-미세먼지 쏴악 공기청정기\n→https://coupa.ng/bIxfFs\n-삼성 TV\n→https://coupa.ng/bIxfUB\n-삼성 엘지 노트북\n→https://coupa.ng/bIxf0r\n-맥북 기획전\n→https://coupa.ng/bIxf6Z\n-갤럭시탭 할인 정보\n→https://coupa.ng/bIxf9G\n-패드는 역시 아이패드\n→https://coupa.ng/bIxgum\n-워시타워 10% 환급\n→https://coupa.ng/bIxgF7\n-엘지 워시타워 건조기 기획전\n→https://coupa.ng/bIxgJ7\n-삼성건조기 전문선칠 기획전\n→https://coupa.ng/bIxgN6\n-엘지 스타일러\n→https://coupa.ng/bIxgZl\npartners 일환으로 수수료 제공받을수 있습니다']",2,https://kin.naver.com/qna/detail.naver?d1id=4&dirId=40605&docId=366126836&qb=67Cx7Iug&enc=utf8&section=kin&rank=109&search_sort=3&spq=0,"문화, 예술"
