page,date,tags,questions,questions_add,answers,N_answer,url,category
3,2020.10.20,[],코로나19,"일하는 같은 건물에 코로나19확진자가 발생했다는 걸 그 날 저녁에 상사가 알았는데 일하는 직원들한테 연락을 안하고 다음 날 출근해서 알게 됐습니다 황당한데 어찌저찌 일을 마치고 집에 돌아가니 직원들 모두 코로나 검사를 받아야 한다고 했습니다 그래서 다음날 아침일찍 검사를 마치고 집에서 결과를 기다리고 있었는데 직원 중 한 분이 내일 출근은 어떻게 되는거냐 물었고 상사는 마스크 챙겨서 꼭 쓰시고 출근하라고 했습니다 그래서 전 결과가 안나왔는데 출근하라구요? 라고 했고 답장이 없길래 자가격리가 맞는거다 출근하라는건 본사에서 시킨거냐 상사가 결정한거냐 물었더니 그 질문엔 답을 안하고 답 정해놓고 왜 물어보세요 나오지 마세요 이렇게 말했습니다 전 황당해서 계속 물었고 제 물음이 묻는게 아니라 따지는 거 같다고 자길 쉽게 보냐고 그런 말만 하고 말이 안통했습니다 저런 사람 밑에서 일하기 싫어서 그만두고 회사 본사에 화나고 억울하다고 메일을 보냈는데 형식적인 답장으로 사실관계확인 및 개선필요 사항에 대해서는 관리될 수 있도록 하겠습니다 라고 왔습니다 그래서 제가 다시 이러고 끝이냐고 제가 받은 기분나쁨과 잘 다니던 곳을 관뒀는데 어떻게 보상받아야하냐고 결론나면 메일 달라고 했는데 답이 없네요
전 이일에 대해 보상 받을 수 있는게 없나요?
제가 이상한 사람이 된 거 같고 잘못한 사람이 된 거 같아 기분이 너무 나쁩니다","['아니 ㅋㅋㅋㅋㅋㅋ 코로나 확진자가 나왔는데 출근??\n미친거 아님...??\n마스크 쓴다고 코로나 안걸리면 중국사람들은 코로나 왜걸림??ㅋㅋㅋ 마스크 써도 걸리는 사람들 있는데 \n무슨 마스크가 백신도 아니고ㅋㅋㅋㅋ', '같은건물인 경우는 밀접접촉자 분류가 안되어있기에\n따로 자가격리하지않아도 상관없습니다.(법적강제성이없습니다)\n마스크를 쓰고 출근을 하셔도 되는 부분 이긴합니다.\n본인이 일단 회사를 직접관두신건가요? 글에는 그렇게보입니다만 \n저일이 있고나서 부당한대우를 받으신적이있었나요. 그래서 관두신건가요 그게중요해보입니다.\n일단 글정황상 보상받을수있는 방법은 없습니다.\n매일 오후 12시마다 갱신되는 초특가 세일 최대 80% (블랙프라이데이 행사)\n▶ https://coupa.ng/bINJUT\n!! 삼성 브랜드 위크 전 품목 할인 행사중!! 최대 40%\n▶ https://coupa.ng/bFURsZ\n!! 애플(아이폰 아이패드등등) 전제품 브랜드 초특가 할인중 !!\n▶ https://coupa.ng/bINK9m\n!! 아이패드 에어▶ https://coupa.ng/bISdnL\n!! 아이패드 프로▶ https://coupa.ng/bISdqx\n!! 아이패드 7세대▶ https://coupa.ng/bISdvW\n!! 아이폰 시리즈 ▶ https://coupa.ng/bISndy\n!! 맥북 시리즈 ▶ https://coupa.ng/bI1pMA\n!! 애플펜슬 1세대 ▶ https://coupa.ng/bISdH6\n!! 애플펜슬 2세대 ▶ https://coupa.ng/bISdSt\n!!! 애플 워치 6 시리즈 ▶ https://coupa.ng/bKcPK7\n!! KF 마스크 특가 한눈에 보기 !!\n▶ https://coupa.ng/bINKic\n안마의자 특가 행사중 (최대64%할인) \n▶ https://coupa.ng/bD3eFd\nASUS RTX 3080 사전예약 최저가 ASUS X 쿠팡 기획전\n▶ https://coupa.ng/bLio6N\n파트너스 활동의 일환으로 일정액의 수수료를 제공 받습니다.']",2,https://kin.naver.com/qna/detail.naver?d1id=6&dirId=608&docId=371257256&qb=67Cx7Iug&enc=utf8&section=kin&rank=21&search_sort=3&spq=0,"고용, 노동"
3,2020.10.20,[],이거 해킹당한걱같은데맞나요?,"스마트폰이항상느리다가 백신avst깔아서 검사한번하니깐 바이러스는 안나왔는데 속도가 빨라졌어요

해킹했다가 바이러스검사하는거보고 급하게다게다지운거같은데 맞나요 ?","['정상입니다.\n안드로이드 OS는 루팅 하거나 악성 앱에 직접 권한 부여를 하는것이 아니라면 대부분 안전합니다.', '안녕하세요. \n해당 증상만으로 해킹여부를 판단하기는 어려우며, 지금까지 사례를 볼 때 일반적으로 백신을 사용한다고 해서 급하게 흔적을 지우거나 하지 않습니다. ']",2,https://kin.naver.com/qna/detail.naver?d1id=1&dirId=11001&docId=371256883&qb=67Cx7Iug&enc=utf8&section=kin&rank=22&search_sort=3&spq=0,해킹
3,2020.10.20,[],코로나...,원래 일요일마다 축구동호회하는데요...코로나 치료제나 백신나오면 종식이안되도 축구랑 피시방가도될까요...?,"['지금도 다수의 인원들이 가고있는걸로 알고있습니다.', '치료제는 이미있고 백신이 나와야하는데\n백신이 나와서 접종 받는다면 축구 피시방 정도가아니라\n마스크를 안쓰고 다녀도되요;;\n매일 오후 12시마다 갱신되는 초특가 세일 최대 80% (블랙프라이데이 행사)\n▶ https://coupa.ng/bINJUT\n!! 삼성 브랜드 위크 전 품목 할인 행사중!! 최대 40%\n▶ https://coupa.ng/bFURsZ\n!! 애플(아이폰 아이패드등등) 전제품 브랜드 초특가 할인중 !!\n▶ https://coupa.ng/bINK9m\n!! 아이패드 에어▶ https://coupa.ng/bISdnL\n!! 아이패드 프로▶ https://coupa.ng/bISdqx\n!! 아이패드 7세대▶ https://coupa.ng/bISdvW\n!! 아이폰 시리즈 ▶ https://coupa.ng/bISndy\n!! 맥북 시리즈 ▶ https://coupa.ng/bI1pMA\n!! 애플펜슬 1세대 ▶ https://coupa.ng/bISdH6\n!! 애플펜슬 2세대 ▶ https://coupa.ng/bISdSt\n!!! 애플 워치 6 시리즈 ▶ https://coupa.ng/bKcPK7\n!! KF 마스크 특가 한눈에 보기 !!\n▶ https://coupa.ng/bINKic\n안마의자 특가 행사중 (최대64%할인) \n▶ https://coupa.ng/bD3eFd\nASUS RTX 3080 사전예약 최저가 ASUS X 쿠팡 기획전\n▶ https://coupa.ng/bLio6N\n파트너스 활동의 일환으로 일정액의 수수료를 제공 받습니다.']",2,https://kin.naver.com/qna/detail.naver?d1id=10&dirId=10010102&docId=371256292&qb=67Cx7Iug&enc=utf8&section=kin&rank=23&search_sort=3&spq=0,프로축구
2,2020.10.20,[],코로나 백신,"1. 코로나 백신이 나온 후 얼마나 되야 종식이 가능한지 궁금합니다
2. 빙하속에 고대 바이러스들이 잠들어 있다 들었는데 나중에 인류에 큰 재앙이 될까요?
3. 일본이 방사능 오염수를 방류하면, 쿠로시오 해류를 타고 우리나라까지 온다 들었습니다. 그런데 왜 국제사회에서 적극적으로 막지 않는거죠? 방사능 오염수는 표층에만 떠다니나요? 심층까지 가라앉으면 전세계로 순환되지 않나요","['1. 백신이 개발되더라도 길면 1년까지도 갈 수 있습니다.\n2. 알 수 없는 일이죠.\n3. 다른 나라들은 당장 가깝지 않기도 하고, 방법이 없는 것도 사실이죠.']",1,https://kin.naver.com/qna/detail.naver?d1id=11&dirId=1116&docId=371260756&qb=67Cx7Iug&enc=utf8&section=kin&rank=13&search_sort=3&spq=0,"생물학, 생명공학"
11,2020.10.20,[],대마도 여행 언제쯤 갈수있을까요?,궁금하네요 ㅜ,"['내년 중순쯤 가능하지 않을까요', '아직은 예측이 어렵습니다.\n코로나19는 앞으로 몇년간 없어지지는 않을것이라는 것이라고 합니다.\n치료제 or 백신이 언제 나오느냐가 문제인데, 내년 중순쯤으로 예상을 하고 있지만\n예상일뿐 그것마저 확실하지는 않습니다.\nhttps://blog.naver.com/mokbs2\n퍼플트립 : 네이버 블로그\n퍼플트립은 항공권 및 여행에 대한 전반적인 업무를 합니다.개별항공권, 상용출장 항공권, 호텔, 여행자보험,\nblog.naver.com']",2,https://kin.naver.com/qna/detail.naver?d1id=9&dirId=9020101&docId=371210998&qb=67Cx7Iug&enc=utf8&section=kin&rank=101&search_sort=3&spq=0,일본
5,2020.10.20,"['사망', '독감백신']",제가 독감백신을 맞았는데.,"토요일에 병원에가서 맞았는데 4일동안 맞은부위쪽이 살짝
근육이 뭉친느낌 든거 말고는 아무런 증상이 없는데 안죽겠죠????? 너무 무섭네요","['원래 독감 주사후 \n일시적인 부작용/ 심각한 부작용 나뉩니다\n님 질문으로는 일시적인 증상으로 보입니다만\n증상이 생기고 \n심하면 아래 안내처럼 꼭 병원 방문 해야해요......\n<독감 부작용 증상> 두드러기, 발열, 근육통 (독감 예방접종 부작용)\n독감주사 부작용 독감 부작용 (구토, 두드러기, 미열, 현기증) _ 독감예방주사 우리는 대체로 9월 이후 12월 사이 환절기 부터 추운 겨울이 되면 독감주사를 맞는 시즌이 옵니다. 독감 바이러스들은 뜨겁고 습한..\ndingdo.tistory.com\n위는 독감 부작용 증상 안내 입니다(독감주사 부작용)']",1,https://kin.naver.com/qna/detail.naver?d1id=7&dirId=7010101&docId=371242772&qb=67Cx7Iug&enc=utf8&section=kin&rank=50&search_sort=3&spq=0,호흡기내과
6,2020.10.20,[],노트북에서 광고사이트 계속 떠요,"노트북으로 인터넷하다보면 광고페이지가 계속 나타납니다. (공단기, 쇼핑몰, 등등 )
제어판에서 어떤걸 삭제해야 광고가 안뜰까요?","['광고가 자동으로 뜨는 현상은 아마 애드웨어로 보이네요 \n말 그대로 계속 광고 팝업 창이 뜨는 바이러스.\n저도 예전에 애드웨어에 한 번 감염된 적이 있어요. 그때 MZK라는 (백신)프로그램으로 해결했어요 \n광고 아니고 사업용 프로그램도 아닙니다. \n네이버에 검색하시면 MZK 네이버 카페나 \n하단의 공식 사이트에서 다운이 가능합니다.\nhttps://malzero.xyz/', '프로그램 추가 설치/실행 불필요\n※ 빨간박스 [ 삭제 ] 악성코드/애드웨어\n※ 빨간밑줄 [ 삭제권장 ]\n # 그리드 딜리버리 - 랙유발, 웹하드 사용 시 설치됨\n # 웹하드 - 그리드 딜리버리 설치됨 (약관) 확인']",2,https://kin.naver.com/qna/detail.naver?d1id=1&dirId=10201&docId=371241861&qb=67Cx7Iug&enc=utf8&section=kin&rank=52&search_sort=3&spq=0,웹브라우저
8,2020.10.20,[],하... 독감주사를 맞았는데요,맞은지 일주일 됐구요 지금 장염끼가 겹쳐서 증상은 다른 특별한 거는 없는 거 같고 병원에 문의해보니 지금 뉴스에 나오는 약품이랑 병원 약품이랑은 코드가 달라서 괜찮다고 하는데 믿어도 될까요? 너무 불안하구요... 참 주사 맞고 건강해지려고 하신 분들이 마른 아침에 날벼락을 맞고 하신 거 너무 안타깝고 속상한데 한편으로는 또 제가 맞은 건 괜찮은지 걱정되고 간사한 생각이 드네요 ㅠㅠ 아무튼! 병원에서 괜찮다고 하면 괜찮은거겠죠...?,"['그렇죠..\n일단 문제의 백신 신성제약만 아니면\n괜찮을듯 합니다...\n독감백신 상온노출 (상온노출 백신 부작용)\n무료독감 상온노출 상온노출 백신 지역 (부작용 증상) _ 사건의 시작 질병관리청이 독감 백신의 무료 접종 시행을 하루 앞두고 안전상의 이유로 전면 중단했다. 일부 업체가 냉장 상태를 유지해야하는 백신을 상..\nzero-news.tistory.com\n상온노출 사건부터..\n참 말이 많네요.. 이번 독감..', '일단 병원에서 코드 다르다고 하면 믿는게 신체적, 정신적 건강상 좋습니다. 저도 3일됐지만 크게 걱정하지 않고 사니까 딱히 후유증도 없고 그렇습니다. \n병원말을 들으시면 됩니다.\n독감 예방접종 부작용 완벽정리(최신)\n금일 독감백신을 맞은 지 이틀이나 아무런 증상이 없다가 갑자기 사망한 10대 청소년이 발생하면서 독감 예방접종의 부작용에 대한 관심이 커지고 있습니다. 독감백신 사망 10대 무슨일? 독감백신 사망 10대 무슨..\nkingthecarrot.tistory.com']",2,https://kin.naver.com/qna/detail.naver?d1id=7&dirId=70102&docId=371224660&qb=67Cx7Iug&enc=utf8&section=kin&rank=79&search_sort=3&spq=0,이비인후과
8,2020.10.20,[],사무직으로 근무중인데 IT분야가 전망이 좋다고해서 이직할려고합니다.,"안녕하세요. 현재 25살 직장인 입니다.
다름이 아니라 제가 일반 사무직으로 일을 하고 있는데 사무직보다는
IT 업계가 전망성도 좋고 하다고 해서 퇴직하면 퇴직금도 나오고 하니까
그 돈으로 한번 학원다니면서 공부해서 이직 해볼까 생각중인데 괜찮을까요?
또 국비지원무료교육도 있다고하는데 국비받아서 취업가능한가요?","['우선 요즘에는 IT 업계 쪽으로 비전공자 분들도\n많이들 공부하시고 취업 하시는 분들이 많습니다.\n그렇기 때문에 질문자님께서도 지금부터 준비하신다고 \n하시면 충분히 가능하십니다.\n혹시 어느 쪽 분야로 생각하고 계신가요?\n보통 IT 쪽으로 처음부터 공부하신다고 하시면\nIT 통합기초 부터 시작하셔서 프로그래밍 언어인\n파이썬, C언어, 자바 부터 공부하시면서\n질문자님께서 생각하시는 분야 쪽으로 공부하시는\n범위를 넓혀가시는게 좋습니다.\nIT분야의 직업이 어떤 것이 있는지 잘 모르시는 것 같아서 간단하게 소개해드리겠습니다.\n1) 프로그래머: 프로그램을 설계.개발, 유지보수를 하는 직업.\n직업의 수요가 가장 많고 취업이 쉬울 수 있다.\n경력이 올라갈수록 연봉이 높아지는 직업\n웹/앱, 소프트웨어 개발자\n2) 엔지니어: 시스템 엔지니어와 네트워크 엔지니어로 나눌 수 있음.\n시스템 엔지니어는 컴퓨터와 통신장비들을 시스템에 맞춰 설계.관리하는 직업으로\n서버에 대한 지식이 많이 필요해서 실무적인 부분을 알아야 함.\n네트워크 엔지니어는 전산망과 관련된 하드웨어.소프트웨어에 관한 네트워크 시스템\n분석.설계.구축에 관한 업무\n전체적인 네트워크 시스템 구조를 분석.평가하여 문제점과 개선책을 마련하는 직업\n3) 정보보안전문가: IT 분야에서 가장 최상위에 있는 직업으로 프로그래밍, 시스템, 네트워크&서버,\n데이터베이스를 배우고나서 정보보안 분야를 배워야 함.\n정보보안전문가가 되기 위해서 실무를 중점적으로 공부해야 함.\n정보보안전문가는 다시 5개 분야의 직업으로 나눌 수 있음.\n- 모의해킹전문가: 웹/프로그램을 임시적으로 해킹하여 취약점을 분석하고 작업하는 직업\n- 보안솔루션: 모의해킹을 통해 찾은 취약점을 보안.대비하는 직업\n모의해킹 쪽과 함께 팀을 이루어 같이 다님.\n확실하게 실무적인 부분이 뛰어나야 하는 직업 \n- 보안관제: 24시간 3교대로 모니터링을 통해 1차적으로 대응하는 직업\n- 악성코드분석: 유해한 코드나 프로그램을 분석하여 백신이나 보안프로그램을 만드는 직업\nV3.알약 등 악성코드를 예방하는 역할\n- 디지털포렌식전문가: 삭제되거나 손상된 데이터를 복원/복구하는 직업\n법적 증거물들을 수집하는데 많이 이용\n경찰청, 사이버수사대 등 국가기관 쪽에서 근무\n4) 데이터베이스관리자: 회사에서 사용하는 DB서버를 구축.유지보수관리하는 직업\n금융권이나 대기업으로 취업\n5) 빅데이터전문가: 얻고자 하는 데이터들을 식별하고 분석해서 노하우에 따라 원하는 결과를 얻고\n데이터 분석에 관한 솔루션을 만들고 자료를 통계까지 하는 직업\n은행이나 카드사 같은 금융권과 광고회사 및 정부나 공공기관에서 근무\nhttp://naver.me/5hZGJlKK']",1,https://kin.naver.com/qna/detail.naver?d1id=11&dirId=110704&docId=371224298&qb=67Cx7Iug&enc=utf8&section=kin&rank=80&search_sort=3&spq=0,직업교육
9,2020.10.20,[],독감주사맞고 이틀내 사망,아니 저 독감주사 2주전에 맞았는데 멀쩡하거든요??근데 기사보니 접종후 사망한 사람들이 있다고하는디ㅜ저죽ㄱ어요???아니면 저 바보되요????,['아뇨 안죽어요 ㅎㅎ\n2주나 됬으면 괜찮은 겁니다^^ 이틀만에 사망한 사람들이 접종한 백신과 다를 거에요'],1,https://kin.naver.com/qna/detail.naver?d1id=3&dirId=30406&docId=371224233&qb=67Cx7Iug&enc=utf8&section=kin&rank=81&search_sort=3&spq=0,학원애니메이션
9,2020.10.20,"['해킹', '사이트', '바이러스']",사이트 접속,어떠한 사이트에 접속하는것만으로도 해킹이 될수있나요?,"['ㄴㄴ 사이트에 들어갔다고 바이러스는 안먹는데\n광고 같은 사이트나 이상한 사이트, 야동 그런것에 들어가면 바이러스 먹습니다.\n야동에는 아주 큰 바이러스가 들어가있죠. ㅎㅎ\n채택 부탁드려요', '안녕하세요. \nPC환경에 따라 웹사이트 접속만으로도 악성코드에 감염될 수 있으나, 최근에는 관련 업데이트도 많이 이루어졌고 백신에 의해 사전 탐지되는 경우도 있어 가능성이 높지 않습니다.']",2,https://kin.naver.com/qna/detail.naver?d1id=1&dirId=11001&docId=371223923&qb=67Cx7Iug&enc=utf8&section=kin&rank=82&search_sort=3&spq=0,해킹
