page,date,tags,questions,questions_add,answers,N_answer,url,category
21,2021.02.09,['#문제풀이'],우리나라 건국 순서,"고구려 백제 신라 중 고구려가 제일 먼저 세워진 줄 알았는데, 신라가 제일 먼저라고 하던데 진짜인가요?","['고구려 \nBC 37년: 고구려 건국, 비류국 통합\n신라건국\n서기전 57년 \n백제 건구\n서기전 18년\n신라 고구려 백제순으로 건국됌', '《삼국사기》에는 신라가 먼저라고 나오는데,\n이는 신라측이 기원을 올렸다고 볼 수 있습니다.\n삼국 중 가장 앞서는 건 고구려입니다.\n고구려의 국가 형성은 기원전 3~2세기 철기의\n보급으로 성장한 나집단에서 기원합니다.\n(나집단은 고구려의 5부족을 떠올리면 됩니다)\n이들은 기원전 1세기 초에 현토군을 몰아내며\n연맹체를 형성하게 됩니다(대략 기원전 75년 쯤).\n그리고 주몽집단과 결합해 세력을 확장하죠.\n반면 신라, 백제는 성립 시기를 알기 어렵습니다.\n두 국가가 고구려보다 늦은 건 맞는데,\n《삼국사기》와 《삼국지위서동이전》의 내용이\n서로 충돌하기 때문입니다.\n따라서 고구려가 먼저 형성 되었고,\n이후에 백제ㆍ신라가 생겼다고 볼 수 있습니다.', '아니요.\n신라후손 김부식이가 신라를 띄우려고 구라 친거고\n고백신 그 순서가 맞아요.\n고구려 시조는 모르고\n백제시조는 울구태,\n신라는 처음에 중국 진나라 사람들이 와서 마한의 허락하에 진한을 세웠다가 4세기  민족대이동기때 동해안을 타고 내려온 흉노에 의해 세워지죠. 시조는 내물마립간으로 추정됩니다.\n혹자는 고려는 고구려를 계승했기때문에 김부식이 일부러 건국연도를 조작했을리 없다고 항변하지만 일부 지배층이나 고려가 고구려라는 생각을 했지, 일반서민은 아예 관심밖이었고 성종때부터 무신정변으로 나라가 뒤집어지는 의종때까지(목종 즉, 천추태후때는 제외) 사실상 고려는 신라계가 조정을 장악하는 신라천하였죠. 분위기가 그렇다보니 삼국사기를 지을때 신라에 유리하게 했던거죠. 하지만 백제등과 동시대에 존재하면서 기록된 중국사서들이나 유물은 전혀 다른 말을 하고 있죠.\n1.고구려 \nBC 1세기를 기준으로 한다면 주몽과 가장 근접한 인물로는 『한서』에 고구려후(高句麗侯) 추(騶)라는 분이 있습니다. 그 기록을 봅시다.\n""왕망(王莽)이 고구려를 징발하여 오랑캐들을 정벌하려고 하였는데 고구려인들이 이에 따르지 않았다. 이에 따라 고구려인들을 강박하자 그들은 오히려 요새 밖으로 달아났다. 나라의 법을 범하고 도적질을 일삼자 요서(遼西)의 대윤(大尹) 전담(田譚)이 이를 추격하다가 오히려 피살되었다. 주군(州郡)에서는 이 모든 책임이 고구려후(高句麗侯)인 추(騶)에 있다고 하였다. 엄우(嚴尤)가 아뢰어 말하기를 \'맥인(貊人)이 난동을 피우는 것은 역심이 있어서이니 이를 평정하는 것이 마땅합니다. 부여의 무리들은 유순하지만 흉노는 아직도 정벌하지도 못하였고 부여·예맥이 다시 활동하면 큰 우환거리가 됩니다.\'라고 하였다. 그러나 왕망은 이를 따르지 않았고 예맥이 큰 반란을 일으키자 엄우에게 명하여 이들을 정벌하게 하였다. 엄우는 고(구)려후 추(騶)를 유인하여 오게 한 후, 추의 머리를 베어 장안에 전하였다.""\n이 기록은 AD 12년경의 것으로 추정됩니다. 제가 보기엔 이 추(騶)라는 분이 고구려의 건국과 직접적인 관련이 있을 것입니다. 이 점들을 구체적으로 봅시다.\n첫째, 위의 기록은 시기적으로 일반적으로 보고 있는 고구려 건국 시기와 대체로 일치하고 있죠. \n둘째, 추(騶)라는 말은 음을 빌려 쓴 말로 \'말먹이꾼\'이라는 비칭(卑稱)으로 묘사되어 있지만 주몽(朱蒙), 추모(鄒牟), 추무 등의 발음과 거의 동일합니다. \n셋째, 당시 고구려를 대표하는 지위를 나타내는 말은 고구려후(高句麗侯)를 사용하고 있는 점도 주목할 필요가 있습니다.\n넷째, 현도군이 압록강 중류지방에서 쫓겨난 시기가 BC 75년경이기 때문에 이 과정에서 한나라와 이 지역의 새로운 세력으로 부상하고 있는 고구려후 추의 세력과의 갈등이 깊었을 가능성이 있습니다.\n제가 보기엔 고구려후 추라는 분이 우리가 말하는 주몽일 가능성이 가장 큽니다. 이 분야의 전문가에 따르면, 몽이라는 말은 말갈족의 당나라 조공사절의 이름에 빈번히 나타나는 말로 인명을 나타내는 파생접미사로 많이 사용되기 때문에 생략이 될 수도 있는 말이라고 합니다. 그러면 결국 주몽 또는 추무는 추와 다를 바가 없죠. 결국 고구려왕 추는 한나라(사실은 신나라) 대군을 맞이하여 장렬하게 전사하고 그 목은 장안으로 옮겨져 효수되었을 것으로 추정됩니다.\n2.반도부여(백제)\n부여는 세 차례에 걸쳐 한반도로 남하합니다. \n제1차 남하는 고구려의 건국기를 즈음하여 부여 일부의 소수세력이 남하한 것으로 추정됩니다. 그것이 한강유역에 정착한 소국 백제(伯濟)로 추정됩니다.\n제2차 남하는 고이왕 계열로 3세기 초·중엽에 요동지역의 부여는 극심한 국가적 위기에 봉착하여 그 주요 세력들이 남하하여 반도부여의 기초를 세우게 됩니다. 이 때의 주체세력이 부여왕 울구태이고 이 분이 고이왕으로 추정되며 바로 백제(百濟)의 건국자로 나타나고 있습니다.\n제3차 남하는 4세기 초로 이 때는 동호계의 선비가 강성해지면서 만주에서 부여가 큰 핍박을 받게 되자 근초고왕(재위 : 346～375) 계열이 한반도로 대거 남하한 것으로 보입니다. 그래서 근초고왕 시기에는 만주에서 백제의 활동이 사라지고2), 백제는 한반도(전라도, 낙동강, 황해도)에서 왕성한 정복활동을 전개합니다.\n더욱 주목할만한 일은 이 시기(4세기)를 즈음하여 7세기 초까지의 일본에서는 이전과는 달리 대규모의 고분(古墳)들이 출현하고 있습니다. 일본의 사학자들은 근초고왕 24년(369년)에 일본의 야마토 정부가 신라와 가야를 정복하고 미마나(任那)라는 식민지을 경영하기 시작했다고 하고 있습니다. 그런데 이 시기의 야마토 정부라는 것은 실체가 없으니 결국 가야를 정벌한 주체도 근초고왕이라는 것을 알 수 있습니다.\n(부여시조)동명의 후손 가운데 구태(仇台=고이왕)라는 사람이 있었는데, 인정이 많고, 어질고 믿음이 있었다. 구태가 \'대방\'의 옛 땅에 나라를 세우고, 한나라 요동태수 \'공손도\'의 딸과 결혼하여 아내로 삼았고 이로 이 나라는 동이(東夷) 가운데서도 강국(强國)이 되었다. 처음 100 가(家)의 집으로 나라를 시작하여 \'백제\'라고 했다 한다. \n-북사(北史)\n3.신라\n4세기 초 사이에 동아시아 기마민족의 대이동의 와중에서 그 일부가 신라 쪽으로 내려왔다는 것입니다. 이 이론은 신라의 적석목곽분(금관총, 천마총 등)이 유독 경주 분지에만 나타난다는 점에 주목한 것입니다. 적석목곽분은 주로 중앙아시아에 널리 분포되어있는 것으로 유목민족들의 대표적인 무덤양식입니다. 그런데 이 적석목곽분이 4세기 초에서부터 6세기 초까지 느닷없이 경주를 중심으로 조성되었고 그 주인공은 왕족과 귀족들이었으며 이 고분에서 출토되는 부장품이 대부분 북방계의 유물이라는 점 등을 들고 있습니다.\n①『사기』― 朝鮮列傳(조선열전)\n②『한서』― 朝鮮傳(조선전)\n③『후한서』― 동이열전 : 부여, 읍루, 고구려, 동옥저, 예, 한, 왜\n④『삼국지』― 위서동이전 : 부여, 고구려, 동옥저, 읍루, 예, 한, 왜인\n⑤『진서(晉書 : 265～420)』― 동이열전 : 부여, 마한, 진한, 숙신, 왜인\n『위서(魏書 : 386～534)』― 동이열전 : 고구려, 백제, 물길\n⑥『송서(宋書 : 420～479)』― 夷蠻列傳(이만열전) : 고구려, 백제, 왜국\n⑦『남제서(南齊書 : 479～502)』― 동남이열전 : 고구려, 백제, 가라, 왜국\n『위서(魏書 : 386～534)』― 동이열전 : 고구려, 백제, 물길\n⑧『양서(梁書 : 502～557)』― 동이열전 : 고구려, 백제, >>>신라<<<, 왜국\n신라가 처음으로 『양서』에 나타나고 있는 것으로 봐서 적어도 5세기말까지 신라는 고대국가를 제대로 갖춘 상태는 아니었다는 추정이 가능합니다. 그러니까 BC 57년에 건국했다는 『삼국사기』의 신라는 확실히 신화에 불과한 것을 알 수 있습니다. 내물왕(356～402) 이전의 경우는 『삼국사기』를 제외하고는 역사적 사실로 간주할만한 다른 증거들이 없는 상태입니다.  ']",3,https://kin.naver.com/qna/detail.naver?d1id=11&dirId=111001&docId=381418076&qb=67Cx7Iug&enc=utf8&section=kin&rank=201&search_sort=3&spq=0,한국사
21,2021.02.09,[],코로나가입으로들어오는것도아닌데 누가 일부로와서 침튀기는것도아니구요,마스크왜써야되요 ?코로나가입으로들어오는것도아니고 사람이랑 침튀기면서예기하는것도아니고 등짝 골프공 쎄게한번날리고 스매쉬한번 쎄게맞고 얼음물 끼얹고 정신번쩍들어도 마스크 끼는것 이해안가요 예방차원이라는것도 이상하고 코로나걸려도 그냥 백신맞으면되잖아요 병키우는게아닌데 왜 마스크때문에.. 떼쓰는것아니구요 맞잖아요 마스크쓰기싫어서 떼쓰는것아니에요 영양섭취하기도불편하구요 먹고싶은것도 맘대로 못먹잖아요,['침은 우리가 인식하지 못하는 동안에도 사방으로 튀어요. ^^\n그리고 코로나 감염의 주된 경로는 입과 코를 통해 호흡기로 들어오는 경로가 대부분이랍니다.\n그래서 마스크를 쓰는 것이지요. \n백신은 치료제가 아니구요\n예방하는 약이랍니다.\n그리고 백신을 맞아싸고 해서 100% 코로나에 걸리지 않는것은 아니에요.\n현재 한국에 들여오는 백신은\n화이자 - 95%\n모더나 - 94%\n아스트라제네카 - 70.4%\n인센 - 임상실험 중\n의 확률로 항체가 생성되는 백신입니다.\n이제 치료제도 이야기가 나오는데 아직 정확한 임상실험이 이루어지지 않은 약이라\n어떤 부작용이 있을지 몰라요.\n그래서 가장 간편하게 마스크를 착용하여 예방하고 \n모임을 자제해서 접촉하지 않는것이지요.'],1,https://kin.naver.com/qna/detail.naver?d1id=7&dirId=71104&docId=381391400&qb=67Cx7Iug&enc=utf8&section=kin&rank=202&search_sort=3&spq=0,성인영양
21,2021.02.09,['#코로나증상'],코로나19 증상에 대해 (+백신 언제 맞을 수 있는지),"코로나 증상중에서 냄새가 안맡아지는 경우가 있잖아요..근데 제가 비염이라 원래 냄새도 잘 맡지 못하는데, 코로나에 걸리면 아예 냄새를 맡지 못하나요? 아니면 조금이라도 냄새를 맡을 수 있나요?그리고 백신을 언제 맞을 수 있는지도 궁금합니다.제발 답변 부탁드립니다..","['코로나 백신은\n전국민 대상은 순차적 진행 입니다\n그리고 알레르기등 질환환자는 검토 후 접종 입니다.\n코로나 백신 접종 순서, 시기, 일정, 순위\n질병관리청 보도자료 기반된\n가장 정확한 안내 드립니다.\n1. 접종시기: 2월부터 순차적 (우선순위 대상 적용)\n2. 접종비용 무료\n아래 참고하세요 모든 과정\n<코로나 백신 접종> 순서, 횟수, 나이, 우선순위, 시기, 방법\n대한민국 국내 코로나 백신 접종 코로나 백신 접종시기 _ 먼저 국내 코로나 백신 접종대상은(?) 대상은 전국민 입니다. (단 백신 개발과정에서 임상시험에 포함되지 않은 임신부와 18세 미만 소아청소년은 접종대..\nzero-news.tistory.com', '안녕하세요\n기침이나 호흡곤란이없다면 증상이아니니 걱정하지마세요!\n코로나는 폐렴증상이기때문에 걱정안하셔도됩니다!\n코로나인경우 발열 고열 인후통 이기때문에 그리고 기침이 심하게나옴니다\n말씀하신 증상과는 거리가있습니다!!\n그리고 백신은 아직 미확정입니다ㅜㅜ\n채택부탁드릴께요!', '코로나19에 감염이 된다면 약2주정도의 잠복기를 후 발열이 시작 됩니다 이때열은 37.5도 이상 나오며발열, 권태감, 기침, 호흡곤란 및 폐렴 등 경증에서 중증까지 다양한 호흡기감염증이 나타남그 외 가래, 인후통, 두통, 객혈과 오심, 설사 등도 나타남\n3일 정도 경과를 지켜 보시고 37.5도 이상의 기침, 열,근육통피로있다면 1339나 보건소연락하여상담 하시는걸 추천드립니다.\n특히 감기와 비슷하니 아래 증상내용 꼼꼼히 살펴보시는걸 추천드립니다.\n자세한 코로나 증상내용과 일자별 증상순서에 대해 아래 자세히 나와있으니 고민 해결하시는데 도움이 되었으면 하는 바램입니다. 기타 궁금하신 점은 아래 링크 남겨드릴테니 참고하시면 도움이 되실 것 같네요.\n▼코로나 초기증상 순서(+ 날짜별 목 두통 콧물 열 설사 기침 근육통 가래)\nhttps://speedsalgoo.tistory.com/432\n코로나 초기증상 순서(+ 날짜별 목 두통 콧물 열 설사 기침 근육통 가래)\n코로나19(신종 코로나바이러스 감염증)의 특징 가운데 하나는 증상이 매우 다양하다는 점입니다. 미국 질병통제예방센터(CDC) 웹사이트에는 현재 코로나19의 증상으로 11가지가 공식 등록돼 있습니다. 이 기관은..\nspeedsalgoo.tistory.com', '냄새를 못맡을 수도 있고, \n냄새만 가지고는 판단할 수 없습니다. \n백신 접종시기는 아래 내용 참고하세요\n2.26일부터 순차적으로 시행됩니다. \n가장 최신본 입니다.\n코로나 백신 총 정리,접종 순서\n코로나 백신 접종 순서 외 ■ 대한민국 국민 전 대상이며, 백신의 공급에 따라 순차적으로 접종함 ■ 백신 선택권은 없으며, 긴급 출국 시에는 예외경로의 마련 중에 있음 2/26일부터 코로나19에 대한 백신 접종..\nshooong-one.tistory.com', '외국 연구에 따르면 코로나 걸린 환자 중 20% 정도에서 냄새를 못 맡았다는 결과가 있었어요\n감기?독감?코로나19?폐렴? https://www.youtube.com/watch?v=Ubdnk2Rlp88\n백신접종은 2월 26일 부터 시작되어요\n현재 우리나라 코로나 백신 상황에 대하여 알려드려요\n65세 이상에서 백신 접종이 보류된 진짜 이유 https://youtu.be/EbiA2PLEmU8\n코로나 백신 부작용 어떻게 해야할까? https://youtu.be/0KXJR-DMVrc']",5,https://kin.naver.com/qna/detail.naver?d1id=7&dirId=70117&docId=381390076&qb=67Cx7Iug&enc=utf8&section=kin&rank=203&search_sort=3&spq=0,가정의학과
21,2021.02.09,['#코로나증상'],코로나19 증상에 대해 (+백신 언제 맞을 수 있는지),"코로나 증상중에서 냄새가 안맡아지는 경우가 있잖아요..근데 제가 비염이라 원래 냄새도 잘 맡지 못하는데, 코로나에 걸리면 아예 냄새를 맡지 못하나요? 아니면 조금이라도 냄새를 맡을 수 있나요?그리고 백신을 언제 맞을 수 있는지도 궁금합니다.제발 답변 부탁드립니다..","['코로나 백신은\n전국민 대상은 순차적 진행 입니다\n그리고 알레르기등 질환환자는 검토 후 접종 입니다.\n코로나 백신 접종 순서, 시기, 일정, 순위\n질병관리청 보도자료 기반된\n가장 정확한 안내 드립니다.\n1. 접종시기: 2월부터 순차적 (우선순위 대상 적용)\n2. 접종비용 무료\n아래 참고하세요 모든 과정\n<코로나 백신 접종> 순서, 횟수, 나이, 우선순위, 시기, 방법\n대한민국 국내 코로나 백신 접종 코로나 백신 접종시기 _ 먼저 국내 코로나 백신 접종대상은(?) 대상은 전국민 입니다. (단 백신 개발과정에서 임상시험에 포함되지 않은 임신부와 18세 미만 소아청소년은 접종대..\nzero-news.tistory.com', '안녕하세요\n기침이나 호흡곤란이없다면 증상이아니니 걱정하지마세요!\n코로나는 폐렴증상이기때문에 걱정안하셔도됩니다!\n코로나인경우 발열 고열 인후통 이기때문에 그리고 기침이 심하게나옴니다\n말씀하신 증상과는 거리가있습니다!!\n그리고 백신은 아직 미확정입니다ㅜㅜ\n채택부탁드릴께요!', '코로나19에 감염이 된다면 약2주정도의 잠복기를 후 발열이 시작 됩니다 이때열은 37.5도 이상 나오며발열, 권태감, 기침, 호흡곤란 및 폐렴 등 경증에서 중증까지 다양한 호흡기감염증이 나타남그 외 가래, 인후통, 두통, 객혈과 오심, 설사 등도 나타남\n3일 정도 경과를 지켜 보시고 37.5도 이상의 기침, 열,근육통피로있다면 1339나 보건소연락하여상담 하시는걸 추천드립니다.\n특히 감기와 비슷하니 아래 증상내용 꼼꼼히 살펴보시는걸 추천드립니다.\n자세한 코로나 증상내용과 일자별 증상순서에 대해 아래 자세히 나와있으니 고민 해결하시는데 도움이 되었으면 하는 바램입니다. 기타 궁금하신 점은 아래 링크 남겨드릴테니 참고하시면 도움이 되실 것 같네요.\n▼코로나 초기증상 순서(+ 날짜별 목 두통 콧물 열 설사 기침 근육통 가래)\nhttps://speedsalgoo.tistory.com/432\n코로나 초기증상 순서(+ 날짜별 목 두통 콧물 열 설사 기침 근육통 가래)\n코로나19(신종 코로나바이러스 감염증)의 특징 가운데 하나는 증상이 매우 다양하다는 점입니다. 미국 질병통제예방센터(CDC) 웹사이트에는 현재 코로나19의 증상으로 11가지가 공식 등록돼 있습니다. 이 기관은..\nspeedsalgoo.tistory.com', '냄새를 못맡을 수도 있고, \n냄새만 가지고는 판단할 수 없습니다. \n백신 접종시기는 아래 내용 참고하세요\n2.26일부터 순차적으로 시행됩니다. \n가장 최신본 입니다.\n코로나 백신 총 정리,접종 순서\n코로나 백신 접종 순서 외 ■ 대한민국 국민 전 대상이며, 백신의 공급에 따라 순차적으로 접종함 ■ 백신 선택권은 없으며, 긴급 출국 시에는 예외경로의 마련 중에 있음 2/26일부터 코로나19에 대한 백신 접종..\nshooong-one.tistory.com', '외국 연구에 따르면 코로나 걸린 환자 중 20% 정도에서 냄새를 못 맡았다는 결과가 있었어요\n감기?독감?코로나19?폐렴? https://www.youtube.com/watch?v=Ubdnk2Rlp88\n백신접종은 2월 26일 부터 시작되어요\n현재 우리나라 코로나 백신 상황에 대하여 알려드려요\n65세 이상에서 백신 접종이 보류된 진짜 이유 https://youtu.be/EbiA2PLEmU8\n코로나 백신 부작용 어떻게 해야할까? https://youtu.be/0KXJR-DMVrc']",5,https://kin.naver.com/qna/detail.naver?d1id=7&dirId=70117&docId=381390076&qb=67Cx7Iug&enc=utf8&section=kin&rank=204&search_sort=3&spq=0,가정의학과
20,2021.02.09,['#지식인카드'],Vpn작동,Vpn설치를했는대 처음에 나오는 확인버튼이 터치가 않돼요 ㅠ ㅠ 옛날에 보안강화때 아무생각 없이 강화시켜서 그런거 같아요 혹시 보안 푸는법 아시는분있나요?,"['안녕하세요 킹콩VPN 지식인 상담사입니다 \n통신사보안어플을 이용하고 계시거나 부모안심보안어플같은걸 이용하고 있으신가요 ? \n그러면 그 보안어플부터 삭제를 해주셔야 이용이 가능하세요 \n아니시면 다른 방식의 VPN을 연결시도 해보시는건 어떠신가요 ? \nVPN이 필요하시다면 저희 킹콩VPN으로 연락주세요 \n무료체험도 가능하시니까 언제든지 체험해보세요 \n추가문의사항있으시면 홈페이지로 연락주세요 \nhttp://kingkong1.co.kr/\n킹콩VPN에 오신것을 환영합니다.\n킹콩VPN은 매우 빠른 한국서버를 제공합니다.\nkingkong1.co.kr', '안녕하세요 판다vpn 입니다!\n혹시 블루라이트 필터나 백신을 사용하시는건 없으신가요?\n충돌이 생겨 그럴 수 있습니다!\n보안이 강화된 부분이 있다면, 설정 - 애플리케이션 으로 들어가셔서\n해당 vpn앱을 선택해주시고 권한허용을 해보세요 ^^\n저희판다는 다양한 고정서버를 가지고있기때문에 원터치형식으로 아이피우회가 가능하십니다.\n번거로운 VPN말고 저희 판다앱 한번 사용해보시겠어요.\n안드로이드,아이폰,태블릿,맥북,윈도우피씨 저희판다는 모든기기에 다양한접속방식을 보유하고있습니다!\n혹시 잘안되실경우 실시간상담밎 원격서비스도 빠르게 안내가능하니 걱정없이 사용가능합니다.\n다만 무료VPN 사용시 질문자님의 소중한 개인정보가 유출 될 가능성이 있기에\nVPN을 자주 사용한다면 유료VPN을 추천 드립니다.\n한국인이 가장많이 사용하는 판다VPN 입니다 !\n1일 체험 또한 가능하니 가장빠른 속도의 VPN을 느껴보세요 !\n↓↓아래 사진을 클릭하면 1:1 문의가 바로 가능합니다.↓↓']",2,https://kin.naver.com/qna/detail.naver?d1id=1&dirId=10801&docId=381433512&qb=67Cx7Iug&enc=utf8&section=kin&rank=199&search_sort=3&spq=0,"개인망, 인트라넷"
