page,date,tags,questions,questions_add,answers,N_answer,url,category
7,2020.07.10,"['검색질문', '통합검색궁금증', '통합검색질문하기']",코로나 감염위험 없애는 방법생각해봄,"코로나 중에 진짜 위헌한것도 감염율이 높아서 그렇자나여요
그러니까 전세계인이 다걸리며는요 그중에 항체가나오지 않을까요 근대 나오며는요 어케되나요? 그리고 만약에 다걸리며는 감염의 위험성도 없어지고 그대신 위험하지많요 코로나 빨리끝나길빌어요 중국 ㅗ","['재치있는 발상이네요ㅋㅋㅋ\n다만 전부 감염되는 과정에서 상당히 많은 사상자가 나올것이라 그런 방법은 현실적으로 힘듭니다 ㅠㅠ\n일종의 면역 항체 반응을 생각하신 것 같네요.\n보통 사람들도 태어나면 아기때 여러가지 예방접종을 맞잖아요?\n이미 알려진 위험한 질병들은 백신이 있기 때문입니다.\n백신이란것이 바로 위험성을 없앤 약한 병원체를 주입하여 생체 면역력을 미리 높이는 행위니깐요.\n몸이 스스로 항체를 형성하게 함으로써 말이죠.\n코로나도 현재 약 3000명 중에 1명 꼴로 항체가 형성되어 있다는 발표가 얼마 전에 있었습니다.\n전체 인구를 코로나에 감염시켜버리면 치료할 인력과 비용도 부족하고\n몸이 약한 사람은 사망의 위험이 높기에 그런 방법은 시행되지 않겠으나\n조금이라도 빨리 백신이 개발되어 모든 사람이 예방 접종을 맞는게 가장 빠른 해결책으로 보입니다.\n하여튼 중국 때문에 전 세계가 이 무슨 고생입니까\n중국 ㅗㅗㅗ', '집단 감염에 의한 집단 면역이야기가 나왔습니다만 소용없었어요.\n미국 오늘 확진자만 6만명이 넘었어요.\n감염에 걸려서 치료가되서 항체가 만들어진다면 가능한데\n이 바이러스는 자연적으로 항체생성이안되요\n계속 연쇄적으로 감염됩니다.\n========= 현재 특가 상품 ==========\n!!SNS에서 난리인 다이어트 음료 헐리우드 48시간 원조 클렌즈 음료! 32%할인행사중!!\n▶https://coupa.ng/bFQWrX\n!!뱃살 다이어트 품목 행사 할인중!!\n▶https://coupa.ng/bFQW5K\n!!갤럭시 버즈 플러스 BTS 에디션 한정판 출시!!!\n▶https://coupa.ng/bFI0JJ\n!!게이밍 컴퓨터 특집!! 할인중!!\n▶ https://coupa.ng/bFBalZ\n!!쿠쿠 브랜드 특가 할인 행사중!!\n▶https://coupa.ng/bFQXhO\n!! 에어컨 할인 특가 한눈에 보기 !!\n▶ https://coupa.ng/bEYoii\n!! 여름 가전 특가 한눈에 보기 !!\n▶https://coupa.ng/bEYmWF\n!! 인터넷 방송 장비 특가 한눈에보기!!\n▶https://coupa.ng/bFBezN\n여름 향수 브랜드 전품목 최대 60% 세일중\n여자 여름 향수 특가 한눈에 보기\n▶ https://coupa.ng/bEhHHz\n남자 여름향수 특가 한눈에 보기\n▶https://coupa.ng/bEhHQk\n행사중!! 썸머 화장품 기획전 브랜드 상품 최대 64% 할인행사중입니다.\n인기 여름 화장품 한눈에 보기 \n▶ https://coupa.ng/bEhOo0\n물과 땀에 지워지지않는 워터프루프 제품 한눈에 보기\n▶ https://coupa.ng/bEhKP0\n안마의자 최대 64% 할인 기획전\n▶ https://coupa.ng/bD3eFd\n모여봐요 동물의 숲 할인 행사중!! \n▶ https://coupa.ng/bD3fsq\n게이밍 모니터 특가 행사중\n▶ https://coupa.ng/bDZOfQ\n게이밍 데스크탑 특가 행사중\n▶ https://coupa.ng/bDZOpv\n냉장고 특가 한눈에 보기\n▶ https://coupa.ng/bDZQvO\n주방 가전 특가 한눈에 보기\n▶ https://coupa.ng/bDZSVk\n김치냉장고 특가 한눈에 보기\n▶ https://coupa.ng/bD3ez4\n========= 코로나 대비 상품 =========\n!! FDA 인증 여름용 덴탈 마스크 50매/100매 \n▶ https://coupa.ng/bEaIOi\n!! KC 인증 여름용 덴탈 마스크 장당 240원!! \n▶ https://coupa.ng/bEamgg\n!! KC 인증 여름용 덴탈 마스크 50장!!\n▶ https://coupa.ng/bEaIsf\n!! 여름용 쿨 메쉬 원단 마스크 세탁가능\n▶https://coupa.ng/bEaNkR\n<비말 차단 마스크 KF-AD> 특가 한눈에 보기\n▶ https://coupa.ng/bDPwlM\n<덴탈 마스크> 특가 한눈에 보기!\n▶ https://coupa.ng/bCdPT5\n<아이 전용 마스크> 특가 한눈에 보기!\n▶ https://coupa.ng/bDZLnP\n<KF94 필터 마스크> 특가 한눈에 보기!\n▶ https://coupa.ng/bCdP2a\n<면 마스크> 특가 한눈에 보기!\n▶ https://coupa.ng/bCdQiu\n<휴대용 손소독제!> 들고다니면서 뿌려요! 향수같은 향기 \n▶ https://coupa.ng/bAeAnZ\n<휴대용 손소독제!> 깔끔한 에탄올 70% 손소독제! \n▶https://coupa.ng/bAeBpD\n========= 필수 영양제 상품 =========\n필수 <면역력> 영양제 한눈에 보기!\n▶ https://coupa.ng/bCy7C3\n필수 <수험생> 영양제 한눈에 보기!\n▶ https://coupa.ng/bCIyp4\n필수 <다이어트> 에 좋은 영양제 한눈에 보기!\n▶ https://coupa.ng/bCZ7xg\n필수 <정력> 에 좋은 영양제 한눈에 보기!\n▶ https://coupa.ng/bCZ9eH\n필수 <여성> 영양제 한눈에 보기! \n▶ https://coupa.ng/bB5XI2\n필수 <갱년기> 영양제 한눈에 보기!\n▶ https://coupa.ng/bCjf4c\n=========여름 바캉스 패키지=========\n곧 여름 바캉스 시즌입니다. 미리 예약하시고 큰 혜택 보시기바랍니다. 조기 매진 주의\n전지역 프리미엄 펜션 (풀빌라) 20% 할인중 특가 한눈에 보기\n▶ https://coupa.ng/bDZL3V\n제주 여행 특가 행사전 (항공권/입장권/패키지상품)\n▶ https://coupa.ng/bDZNtt\n캠핑 용품 특가 행사중!! 최대 48%\n▶https://coupa.ng/bD7gc0\n낚시 용품 특가 한눈에 보기!!\n▶https://coupa.ng/bD7gvE\n초보자 입문자도 쉽게 낚시 한다 원투 낚시!\n원투 낚시 세트 한눈에 보기!!\n▶https://coupa.ng/bElXmG\n========= 여행 및 생필품 특가 상품 =========\n순백 3겹 라벤더 바닐라 롤 화장지 30롤\n▶https://coupa.ng/bD3c0b\n탐사수 20병 팩 \n▶https://coupa.ng/bD3dkh\n아기 물티슈 100매짜리 10팩\n▶https://coupa.ng/bD3dBt\n농심 육개장 사발면 6개 패키지\n▶https://coupa.ng/bD3dKG\n깨끗한 소중한 우리쌀 \n▶https://coupa.ng/bD3dU0\n======= 오늘의 반찬 특가 =======\n호주산 와규 양념 불고기 (냉장) 100g당 990원\n▶ https://coupa.ng/bD6MFq\n한돈 1등급 삼겹살 구이용 (냉장) 100g당 1466원\n▶ https://coupa.ng/bD6NgR\n한우 1+ 등급 채끝 스테이크 (냉장) 200g \n▶ https://coupa.ng/bD6NvW\n참맛나라 신선한 알이 듬뿍 알탕\n▶https://coupa.ng/bD6OSW\n빠네 크림 파스타\n▶https://coupa.ng/bD6OZe\n리코타 치즈 샐러드 2팩\n▶ https://coupa.ng/bD6N1S\n채소믹스 패키지 요새 핫한제품입니다!\n▶ https://coupa.ng/bD6OhK\n삼립 아침엔 우유토스트 식빵 2팩 3960원\n▶ https://coupa.ng/bD6Oqm\n춘천 닭갈비 (냉장) 특가 세일중\n▶ https://coupa.ng/bEv3Q8\n충남 농협 GAP 인증 대추방울 토마토 1KG 4900원 특가 행사중\n▶ https://coupa.ng/bEv31P\n동원 비엔나 소세지 1KG 3980원 특가 행사중\n▶ https://coupa.ng/bEv4dc\n파트너스 활동의 일환으로 일정액의 수수료를 제공 받습니다.']",2,https://kin.naver.com/qna/detail.naver?d1id=4&dirId=40502&docId=362187025&qb=67Cx7Iug&enc=utf8&section=kin&rank=70&search_sort=3&spq=0,수입
8,2020.07.10,"['마이크로SD카드', '자동생성폴더', '소프트웨어']",!$SIXC라는 폴더가 마이크로 SD카드에 생겼는데 이게 뭔가요?,"!$SIXC라는 폴더가 마이크로 SD카드에 생겼는데 이게 뭔가요?

마이크로 SD카드 512를 구입 하여 사진 파일을 옮긴후  핸드폰에 넣어  확인해 보니
!$SIXC라는 폴더가 생겨 있고 안네 메모 ,한글파일,사진 파일, 워드파일의 문서가 들어있는데 사진은 표시되지 않고 정확인 파일이 안보이고 다른 파일들은 숫자와 영어가 썪여 쓰여진 파일이더라구요 

우선 그 폴더를 컴터로 옮겨 열어 보았는데도 동일 했구요 
SD카드에서 지우고 그 폴더를 압축 시키고  컴퓨터로 옯겼던 폴더를 영구 삭제 하였습니다 ..
이 폴더가 왜 생겨 있는 건가요?

SD카드를 처음 사용 한느것도 아닌데 생겨 있어 문의 드립니다 ","['랜섬웨어 방지용 미끼 폴더 입니다. \n컴퓨터에 V3등의 백신이 설치되어 있고,\n랜섬웨어 방지기능을 켜 놓으면,\n미끼 폴더를 만듭니다.\n그렇게 만들어 놓은 폴더나 파일에  랜섬웨어가  \n파일 변형을 하려고 하면 즉시 차단을 해 버리는 것이지요.\n그냥 놔두시는게 좋지만, \n거슬린다면 랜섬웨어 위협을 무릅쓰고 랜섬웨어 방지를 끈다든가,\n또는 다른 백신으로 바꾸면 됩니다. \n(윈도우 디펜더는 폴더를 만들지 않습니다.. \n 문제는 하나하나 허용 프로그램을 지정해 줘야 한다는 단점은 있지만......)']",1,https://kin.naver.com/qna/detail.naver?d1id=1&dirId=1020202&docId=362184967&qb=67Cx7Iug&enc=utf8&section=kin&rank=72&search_sort=3&spq=0,한컴오피스
8,2020.07.10,[],자국 내에서 백신과 필수 의약품 등을 생산해 조달할 수 있는 능력을 가리키는 이 용어는?, 변종 바이러스 출현이 빈번해지면서 이것을 확보하지 못한 국가들은 백신 등을 타국에서 구걸하듯 수입해야 국민의 생명을 보호할 수 있게 되었다.,"[""'바이오주권'이라고 합니다.""]",1,https://kin.naver.com/qna/detail.naver?d1id=3&dirId=316&docId=362175596&qb=67Cx7Iug&enc=utf8&section=kin&rank=74&search_sort=3&spq=0,초자연현상
8,2020.07.10,[],자국 내에서 백신과 필수 의약품 등을 생산해 조달할 수 있는 능력을 가리키는 이 용어는?, 변종 바이러스 출현이 빈번해지면서 이것을 확보하지 못한 국가들은 백신 등을 타국에서 구걸하듯 수입해야 국민의 생명을 보호할 수 있게 되었다.,['바이오 주권 입니다.'],1,https://kin.naver.com/qna/detail.naver?d1id=11&dirId=111601&docId=362175587&qb=67Cx7Iug&enc=utf8&section=kin&rank=75&search_sort=3&spq=0,분자생물학
8,2020.07.10,['#문제풀이'],"코로나 오래가는데 지구가 멸망할 확률 좀 알려주세요 불안하네요,",,"['정말 적은 확률로 인류가 멸망할 수는 있겠지만, 지구는 멸망하지 않습니다.', '멸망확률은 0입니다.\n치사율이 낮은 병입니다.\n전염력이 뛰어나기때문입니다\n치사율과 전염력은 반비례합니다\n다 떠나서 백신이 만들어지고있습니다\n나오면 종결됩니다.\n의료보급이 어려운나라는 여전히 창궐하겠지만 \n주사만 맞는다면 걱정없습니다.\n에볼라 처럼요\n========= 현재 특가 상품 ==========\n!!SNS에서 난리인 다이어트 음료 헐리우드 48시간 원조 클렌즈 음료! 32%할인행사중!!\n▶https://coupa.ng/bFQWrX\n!!뱃살 다이어트 품목 행사 할인중!!\n▶https://coupa.ng/bFQW5K\n!!갤럭시 버즈 플러스 BTS 에디션 한정판 출시!!!\n▶https://coupa.ng/bFI0JJ\n!!게이밍 컴퓨터 특집!! 할인중!!\n▶ https://coupa.ng/bFBalZ\n!!쿠쿠 브랜드 특가 할인 행사중!!\n▶https://coupa.ng/bFQXhO\n!! 에어컨 할인 특가 한눈에 보기 !!\n▶ https://coupa.ng/bEYoii\n!! 여름 가전 특가 한눈에 보기 !!\n▶https://coupa.ng/bEYmWF\n!! 인터넷 방송 장비 특가 한눈에보기!!\n▶https://coupa.ng/bFBezN\n여름 향수 브랜드 전품목 최대 60% 세일중\n여자 여름 향수 특가 한눈에 보기\n▶ https://coupa.ng/bEhHHz\n남자 여름향수 특가 한눈에 보기\n▶https://coupa.ng/bEhHQk\n행사중!! 썸머 화장품 기획전 브랜드 상품 최대 64% 할인행사중입니다.\n인기 여름 화장품 한눈에 보기 \n▶ https://coupa.ng/bEhOo0\n물과 땀에 지워지지않는 워터프루프 제품 한눈에 보기\n▶ https://coupa.ng/bEhKP0\n안마의자 최대 64% 할인 기획전\n▶ https://coupa.ng/bD3eFd\n모여봐요 동물의 숲 할인 행사중!! \n▶ https://coupa.ng/bD3fsq\n게이밍 모니터 특가 행사중\n▶ https://coupa.ng/bDZOfQ\n게이밍 데스크탑 특가 행사중\n▶ https://coupa.ng/bDZOpv\n냉장고 특가 한눈에 보기\n▶ https://coupa.ng/bDZQvO\n주방 가전 특가 한눈에 보기\n▶ https://coupa.ng/bDZSVk\n김치냉장고 특가 한눈에 보기\n▶ https://coupa.ng/bD3ez4\n========= 코로나 대비 상품 =========\n!! FDA 인증 여름용 덴탈 마스크 50매/100매 \n▶ https://coupa.ng/bEaIOi\n!! KC 인증 여름용 덴탈 마스크 장당 240원!! \n▶ https://coupa.ng/bEamgg\n!! KC 인증 여름용 덴탈 마스크 50장!!\n▶ https://coupa.ng/bEaIsf\n!! 여름용 쿨 메쉬 원단 마스크 세탁가능\n▶https://coupa.ng/bEaNkR\n<비말 차단 마스크 KF-AD> 특가 한눈에 보기\n▶ https://coupa.ng/bDPwlM\n<덴탈 마스크> 특가 한눈에 보기!\n▶ https://coupa.ng/bCdPT5\n<아이 전용 마스크> 특가 한눈에 보기!\n▶ https://coupa.ng/bDZLnP\n<KF94 필터 마스크> 특가 한눈에 보기!\n▶ https://coupa.ng/bCdP2a\n<면 마스크> 특가 한눈에 보기!\n▶ https://coupa.ng/bCdQiu\n<휴대용 손소독제!> 들고다니면서 뿌려요! 향수같은 향기 \n▶ https://coupa.ng/bAeAnZ\n<휴대용 손소독제!> 깔끔한 에탄올 70% 손소독제! \n▶https://coupa.ng/bAeBpD\n========= 필수 영양제 상품 =========\n필수 <면역력> 영양제 한눈에 보기!\n▶ https://coupa.ng/bCy7C3\n필수 <수험생> 영양제 한눈에 보기!\n▶ https://coupa.ng/bCIyp4\n필수 <다이어트> 에 좋은 영양제 한눈에 보기!\n▶ https://coupa.ng/bCZ7xg\n필수 <정력> 에 좋은 영양제 한눈에 보기!\n▶ https://coupa.ng/bCZ9eH\n필수 <여성> 영양제 한눈에 보기! \n▶ https://coupa.ng/bB5XI2\n필수 <갱년기> 영양제 한눈에 보기!\n▶ https://coupa.ng/bCjf4c\n=========여름 바캉스 패키지=========\n곧 여름 바캉스 시즌입니다. 미리 예약하시고 큰 혜택 보시기바랍니다. 조기 매진 주의\n전지역 프리미엄 펜션 (풀빌라) 20% 할인중 특가 한눈에 보기\n▶ https://coupa.ng/bDZL3V\n제주 여행 특가 행사전 (항공권/입장권/패키지상품)\n▶ https://coupa.ng/bDZNtt\n캠핑 용품 특가 행사중!! 최대 48%\n▶https://coupa.ng/bD7gc0\n낚시 용품 특가 한눈에 보기!!\n▶https://coupa.ng/bD7gvE\n초보자 입문자도 쉽게 낚시 한다 원투 낚시!\n원투 낚시 세트 한눈에 보기!!\n▶https://coupa.ng/bElXmG\n========= 여행 및 생필품 특가 상품 =========\n순백 3겹 라벤더 바닐라 롤 화장지 30롤\n▶https://coupa.ng/bD3c0b\n탐사수 20병 팩 \n▶https://coupa.ng/bD3dkh\n아기 물티슈 100매짜리 10팩\n▶https://coupa.ng/bD3dBt\n농심 육개장 사발면 6개 패키지\n▶https://coupa.ng/bD3dKG\n깨끗한 소중한 우리쌀 \n▶https://coupa.ng/bD3dU0\n======= 오늘의 반찬 특가 =======\n호주산 와규 양념 불고기 (냉장) 100g당 990원\n▶ https://coupa.ng/bD6MFq\n한돈 1등급 삼겹살 구이용 (냉장) 100g당 1466원\n▶ https://coupa.ng/bD6NgR\n한우 1+ 등급 채끝 스테이크 (냉장) 200g \n▶ https://coupa.ng/bD6NvW\n참맛나라 신선한 알이 듬뿍 알탕\n▶https://coupa.ng/bD6OSW\n빠네 크림 파스타\n▶https://coupa.ng/bD6OZe\n리코타 치즈 샐러드 2팩\n▶ https://coupa.ng/bD6N1S\n채소믹스 패키지 요새 핫한제품입니다!\n▶ https://coupa.ng/bD6OhK\n삼립 아침엔 우유토스트 식빵 2팩 3960원\n▶ https://coupa.ng/bD6Oqm\n춘천 닭갈비 (냉장) 특가 세일중\n▶ https://coupa.ng/bEv3Q8\n충남 농협 GAP 인증 대추방울 토마토 1KG 4900원 특가 행사중\n▶ https://coupa.ng/bEv31P\n동원 비엔나 소세지 1KG 3980원 특가 행사중\n▶ https://coupa.ng/bEv4dc\n파트너스 활동의 일환으로 일정액의 수수료를 제공 받습니다.']",2,https://kin.naver.com/qna/detail.naver?d1id=11&dirId=1117&docId=362174570&qb=67Cx7Iug&enc=utf8&section=kin&rank=76&search_sort=3&spq=0,지구과학
8,2020.07.10,['#바이러스'],컴퓨터 바이러스인가요?,컴퓨터에서 이상한 사이트로 들어가지거나 계속 이상한게 뜹니다. 그래서 찾아봤는데 시작프로그램에 Njau setup이라는게 6개나 있더라고요. 이게 뭐지 하고 찾아봤는데 안나오고 심지허 지워지지도 않습니다. 그리고 mask vpn이라는 것도 깔렸고 또 이상한 파일도 있습니다. 이거 바이러스 맞죠? 혹시 아시는 분은 제거방법좀 알려주십쇼.ㅠㅠ,"['바이러스라 확신 할 수는 없지만\n악성 툴바 같은 게 많이 깔린 거 같은데요\n포맷을 한 번 하는 게 가장 좋은 방법이 되겠지만\n시간적 여유가 없으시다면 청소프로그램 같은 거\n설치한 후 한 번 싹 돌려주시면 거의 해결될 거예요\n고클린, ccleaner, mzk 이런 거 위주로 깔아보세요\n그리고 포맷 안 하실 거라면 현재 사용하는 os가\n윈도우10 최신 업데이트라는 전제하에\n디펜더로 전체검색 하시고, 다른 백신 사용중이면\n한 번 검사도 해보시고요', '애드웨어에 걸린 거 같은데 없애는 방법은 Avast Free Antivirus를 다운로드한 다음 실행시키면 바이러스를 알아서 차단한 다음 검역소에 이동해서 삭제할 수 있습니다. \nAvast | Free Antivirus 및 VPN 다운로드 | 쉽고 100% 무료\n4억3천5백만 명과 함께 수상 경력의 무료 안티바이러스를 PC, Mac, Android에서 사용하세요. VPN으로 안전하게 검색하세요. 지금 Avast 다운로드!\nwww.avast.com\n그리고 프로그램을 설치할때 이런 형식으로 되어있는 다운로더는 사용하지 않는게 좋습니다.', '안녕하세요 판다VPN 지식IN 상담원입니다\n제한된 사이트를 우회하셔서 이용하셨나보네요~ !\n그런경우\n크롬>메뉴>설정>사이트설정>알림>허용됨>해당광고주소>삭제 하시면됩니다 ! \n무료vpn이나, https우회서비스를 이용중이시라면 해킹이나, 바이러스감염등\n심각한 피해사례가 많으니 주의하셔야합니다 \nIP우회하는 방법 두가지가있습니다\n바로 HTTPS방법과 VPN을 이용하는 방법인데요, 이 둘의 차이는 IP의 보안성 차이입니다~\nVPN은 데이터를 암호화하여 기존 아이피를 노출하지 않고 사용이 가능합니다\nVPN을 사용하시겠다면 소재가 확실하고 소통이 잘되는 VPN을 사용하셔야 합니다\n보안성철저하고 안전하고 빠른 VPN찾으신다면 저희 판다VPN은 어떠신가요?\n전세계에서 한국서버 50개이상 보유 !!!\n게임유저들의 위한 게임서버 다수보유 !!!!!\n각종 해외서버도 보유중입니다 ^^\n혹 문제가 생기더라도 빠르게 복구 , 응대 , 처리가 가능하며\n개발팀이 직접 서버관리로 막힐걱정없이 이용가능하십니다~\n네이버에 ""판다VPN"" 를 검색해주세요\n일일무료 체험가능하시닌깐 불편함없이 저희 판다 vpn이용해보세용~', '일단 설명을 해드리자면 setup은 설정을 의미합니다. 그러니 악성프로그램이 설정되는프로그램으로 생각됩니다.(또는 실행), vpn은 네트워크를 우회하는 시스템?서버? 같은겁니다.\n일단 바이러스로 생각됩니다\n그러므로 바이러스를 제거하려면\n이거 추천합니다\nhttps://malzero.xyz/\nMalware Zero - 무료 악성코드 제거 도구\n악성코드 및 애드웨어 등 각종 유해 프로그램에 의한 고통에서 해방되기 위해 설치 없이 사용 가능한 무료 악성코드 제거 도구\nmalzero.xyz\n이사이트에 들어가셔서 설치하신후 하라는 대로 하시면 바이러스를 더이상 보실수 없을겁니다.\n이름에서도 보이다시피 멀웨어 제로 말그대로 바이러스 제로 바이러스를 완전 없엔다는 뜻이므로\n안심하고 사용하셔도 됩니다.\n그리고 이거 바이러스 아니냐고 하신다면 직접 들어가보시면 알거에요 ㅎ', '안녕하세요. 킹콩VPN 지식IN 상담원입니다^^ \n크롬들어가셔서\n메뉴-설정-사이트설정-알림-허용됨-해당광고사이트 주소-삭제 및 재설정 눌러주세요~\n제한 된 사이트나 유해 사이트 접속시 자동적으로 설치된 악성프로그램 같습니다\npc에 고클린 설치 하셔서 시작프로그램, 불필요한 프로그램 삭제 하는 걸\n추천드립니다 \n다 그런건 아니지만 무료VPN의 수익구조 자체가 광고수익이나 개인정보판매라는\n소문이 있을 정도로 보안에 취약하다고 합니다..\nVPN을 사용하신다면 안전하고 믿을 수 있는 VPN을 사용하셔야 합니다!\n실시간 상담, 빠른 피드백이 가능하고 가성비 좋은 VPN 찾으시면 \n저희 킹콩VPN은 어떠신가요~^^\n저희 킹콩VPN은 체계적으로 서버관리를 하고 있어 막힐 걱정없이 이용가능합니다! \n속도면에서도 AS대처면에서도 빠른 VPN을 찾으신다면 \n킹콩VPN을 강력추천해드립니다!!!\n무료 체험가능하시니 부담없이 저희 킹콩 VPN이용해보세용~']",5,https://kin.naver.com/qna/detail.naver?d1id=1&dirId=11002&docId=362171729&qb=67Cx7Iug&enc=utf8&section=kin&rank=77&search_sort=3&spq=0,바이러스
