page,date,tags,questions,questions_add,answers,N_answer,url,category
40,2021.05.27,[],코로나 백신,중•고등학생들은 언제부터 코로나 백신 맞을 수 있나요?,"['4분기 예정 입니다\n코로나 백신\n1분기 대상 : 요양병원/ 요양시설 입원 입소자 종사자/ 코로나 19환자를 치료하는 기관 종사자/ 고위험의료기관 종사자/ 1차 대응용원 역학조사 구급대원등\n2분기 대상 : 노인재가복지시설 이용자 종사자/ 65세 이상 고령자부터 순차 접종/ 의료기관 및 약국종사자/ 장애인 노수인 등 시설 입소자 종사자\n3분기 대상 : 성인 만성질환자/ 성인 50~64세/ 군인 경찰 소방 및 사회기반시설 종사자/ 소아 청소년 교육 보육시설 종사자/ 성인 18세~49세\n4분기 대상 : 2차 접종자/ 미접종자 또는 재접종자\n<코로나 백신 접종> 순서, 횟수, 나이, 우선순위, 시기, 방법\n대한민국 국내 코로나 백신 접종 코로나 백신 접종시기 _  먼저 국내 코로나 백신 접종대상은(?) 대상은 전국민 입니다. (단 백신 개발과정에서 임상시험에 포함되지 않은 임신부와 18세 미만 소아청소년은 접종..\nzero-news.tistory.com', ""가을 이후\n코로나 백신 예약 일정\n- 70~74세(1947년~1951년), 만성호흡기장애인 : 2021.05.06(목) ~ 06.03(목)\n- 65~69세 (1952년~1956년) : 2021.05.10(월) ~ 06.03(목)\n- 60~64세 (1957년~1961년), 어린이집/유치원/초등1,2교사 등 : 2021.05.13(목) ~ 06.03(목)\n네이버 노쇼 백신 예약\n네이버에서 잔여 백신을 조회할 경우에는 네이버 앱·네이버 지도앱 또는 네이버 웹에 접속해 검색창에 '잔여 백신'을 검색하면 지도 플랫폼에 위탁의료기관 및 남은 백신 수량이 표시된다.\n잔여백신 카카오톡\n카카오에서는 카카오톡 하단의 샵(#) 탭에서 '잔여 백신' 탭을 선택하거나 카카오 맵 앱을 통해서 잔여 백신 조회가 가능하다. 잔여백신 수량이 3개 이하로 남아있을 경우에는 빨간색, 4∼6개까지는 노란색, 7개 이상은 초록색 표지가 각 접종기관 위에 나타난다.\nhttps://453010star.tistory.com/1507\n잔여 백신 예약 대상 조회 및 신청방법 [카카오톡 네이버]\n잔여 백신 예약 대상 조회 및 신청방법 [카카오톡 네이버] 5월 27일부터 네이버와 카카오 앱으로 신종 코로나바이러스 감염증(코로나19) '잔여 백신'을 조회하고 당일 예약으로 접종까지 받을 수 있다...\n453010star.tistory.com""]",2,https://kin.naver.com/qna/detail.naver?d1id=7&dirId=701&docId=390754425&qb=67Cx7Iug&enc=utf8&section=kin&rank=395&search_sort=3&spq=0,건강상담
40,2021.05.27,[],주사 공포증,제가 나중에 백신을 맞을 때 존나 아플까봐 걱정입니다ㅠㅠ주사를 혐오하거든요ㅠㅠ어렸을 때부터 주사 맞는 것을 싫어했습니다ㅠㅠ코로나 백신 맞는 거 존나 아프겠죠?ㅠㅠ,['아니요. 그렇게 아프진 않습니다 몇초 약간 따끔한게 전부입니다'],1,https://kin.naver.com/qna/detail.naver?d1id=7&dirId=708&docId=390754099&qb=67Cx7Iug&enc=utf8&section=kin&rank=396&search_sort=3&spq=0,인체건강상식
40,2021.05.27,[],턱관절 장애,아직 나이도 어린데 턱관절 장애 같아요 귀 앞쪽에서 옆광대 같은 곳 있잖아요 거기서 자꾸 입 벌릴 때마다 딱 소리가 나는데 아프지는 않고 왼쪽만 그래용... 치아 교정 중인데 비대칭도 눈에 띄게 있고 작년보다 더 심ㅎㅐ진 거 같아요ㅠㅠ아진짜어카죠 몇주뒤에 치과가는데 턱관절 장애면 어떡하죠???ㅠㅠ,"['안녕하세요. 대한치과의사협회-네이버 지식인 상담치과의사 허재식 입니다.\n턱관절 증상은 보통 악습관에 의해서 발생됩니다. \n주무실때, 이갈이, 이악물기를 하시면 파괴적이고 과도한 힘이 얼굴 근육과 턱관절 주변의 조직, 근욕, 인대, 캡슐, 조직액 등에 영향을 미쳐서 깼을때 뻐근하거나 아프실 수 있습니다. 가끔 소리가 난다고 하시는 분들도있구요. \n이런 분들은 혀와 뺨쪽 점막을 보면 울퉁불퉁하게 하얀 라인이 보이기도 하고, 치아의 마모가 심하기도 합니다. \n우선 턱관절 분석 검사를 통해 현 상태를 파악하고 물리치료, 약물치료, 습관 조절, 그리고 스플린트(악교합안정장치)라는 장치를 착용하기도 합니다. \n밤에 일어나는 악습관 자체를 교정할 수 는 없습니다. 주무시고 계시기 때문이죠. 다만 이 악습관으로 우리몸의파괴가 일어나는 것을 차단하는 관리 치료를 받으시는 겁니다. \n주변 교정 전문의나 턱관절을 보시는 병원에 내원하셔서 턱관절 분석 검사와 적절한 치료를 받으시는것이방법입니다. \n근육은 부드럽게 풀어주면 좋습니다: 사우나, 찜질, 마사지, 목욕, 스트레칭, 그리고 가벼운 운동 등이도움이됩니다. \n술, 과도하게 집중하는 일, 그리고 스트레스는 피하셔야 하구요~ 이런 것들을 꾸준히 하는 것이 제일 좋으나, 꾸준하게 하기 쉽지 않으시죠! ^^;; 그래도 시도는 해보시길 추천드립니다. \n답변이 도움이 되었는지 모르겠습니다. \n그래도 도움이 되고 마음을 편하게 해드렸기를 바랍니다. \n이제 곧 백신도 접종이 될테고 우리 삶이 다시금 정상으로 빨리 되돌아가기를 바래봅니다. \n감사와 기쁨이 넘치시는 하루하루 되시기를 바라겠습니다\n에스플란트 치과병원장 허 재식 올림']",1,https://kin.naver.com/qna/detail.naver?d1id=7&dirId=70201&docId=390753923&qb=67Cx7Iug&enc=utf8&section=kin&rank=397&search_sort=3&spq=0,치아교정
28,2021.05.27,"['#코로나백신', '#류마티스관절염', '#류마티스']",류마티스환자들도 코로나백신 접종해도 괜찮은지 궁금합니다.,자가면역질환자들은 백신이 인체에서 다르게 인식되어 공격할수 있다던데 맞아도 될까요??,"['코로나 백신은 기저질환환자 / 약물 투여자 / 감기기운등 증상이 있는자는 증상이 나타나는 자는\n먼저 병원에 의사와 상담후 접종해야 한다 아래 코로나 접종안내 문구에 나옵니다[출처]\n<코로나 백신 접종> 순서, 횟수, 나이, 우선순위, 시기, 방법\n대한민국 국내 코로나 백신 접종 코로나 백신 접종시기 _  먼저 국내 코로나 백신 접종대상은(?) 대상은 전국민 입니다. (단 백신 개발과정에서 임상시험에 포함되지 않은 임신부와 18세 미만 소아청소년은 접종..\nzero-news.tistory.com', '걱정 되시겠어요 질병관리청에서는 금기라고 명시되어 있진 않네요\n주의사항 확인 하는 법 알려드릴게요 \n우선 현재 진료 중인 담당의한테 접종가능한상태인지 꼭 문의하셔요\n 코로나 백신 접종 전 주의사항 https://youtu.be/HUWnuVlIXZc\n코로나 백신 사전예약 https://ncvr.kdca.go.kr/cobk/index.html\n코로나19 예방접종 사전예약 시스템\n코로나19 예방접종 사전예약 시스템\nncvr.kdca.go.kr', '저도 자가면역 환자인데요, 솔직히 자가면역 환자들이 코로나 백신을 맞아도 되는지 어떤지는 아직은 어떤 의사들도 정확하게 답변을 할 수 없을 겁니다..  많은 자가면역 환자들이 백신을 맞은 후 그들의 예후를 살펴봐야 이상이 없을지 어떨지를 알수 있을텐데 아직은 그런 데이타가 없기 때문이지요.. 여기에도 자가면역 환자들의 질문에 담당의사들과 상담을 해 보라는둥 또는 그래도 맞는게 낫다는 둥 하는데 그 의미는 개개인의 복불복이고 선구자들이 임상시험 환자가 되어 맞아보고 이상 없으면 다른 사람들이 맞을때 도움이 되는 겁니다.. 정말 의사들도 답답하기는 마찬가지일테고 의사마다 대답이 다를 수도 있으니 결국 결정은 본인이 하는거지요...  다만 죽는 경우는 거의 없는 것 같으니 그냥 맞는게 나을 것 같습니다..', '안녕하세요.\n류마티스 관절염은 관절 활막의 만성적인 염증을 특징으로 하는 대표적인 자가 면역 질환입니다. 자가 면역 질환이란 어떠한 이유로 우리 몸의 면역체계에 일종의 과민 반응이 나타나 몸을 보호해야 할 면역체계가 오히려 우리 몸의 특정 영역의 조직세포나 단백질들을 외부 바이러스와 유사하게 인식하여 공격하게 되고 또한 이차적으로 염증을 야기하는 질환을 말합니다. 이러한 자가 면역 질환으로는 류마티스 관절염, 통풍, 베제트, 루프스, 강직성 척추염 등이 있습니다.\n류마티스 관절염은 과거에는 면역력이 약한 노인층에서 주로 발생하였으나, 최근에는 지속적인 스트레스와 과로, 지나친 음주와 흡연 등으로 인하여 비교적 젊은 분에게도 발생하는 비율이 점점 늘어나고 있습니다.\n병원에서의 류마티스 관절염의 치료는 대체로 관절부위의 통증을 완화하고 염증을 억제하여 관절의 변형을 예방하고 관절 활동성을 유지하는 것을 목표로 하고 있습니다. 병의 진행정도에 따라 단계적으로 비스테로이드성 항염증제, 항류마티스제, 부신피질 스테로이드제 등 염증을 억제하는 약을 복용하게 됩니다. 대개 환자 개개인의 면역력에 따라 병의 호전도에 차이가 있게 되며, 재발이 반복되거나 장기적 또는 평생동안 약을 복용해야 하는 경우가 많아, 아직까지는 완치는 불가능하고 지속적인 관리가 필요한 병으로 인식되고 있습니다.\n아울러 병의 호전도가 더딘 환자분들 같은 경우에는 식생활이나 생활 관리에 대한 관심이 높을 수밖에 없습니다. 하지만 지금까지는 류마티스 관절염에 명확하게 좋고 나쁜 음식이 밝혀지지는 않고 있습니다. 특정 음식이 류마티스 관절염을 호전시킨다는 명확한 근거가 밝혀지기 전까지는 일반적인 건강식을 유지하는 것이 좋습니다. 편식을 하지 말고 야채와 과일을 충분히 섭취하되 지방과 콜레스테롤이 적게 함유된 음식을 먹는 것이 좋습니다. 술은 가급적 마시지 말고, 적절한 체중을 유지하는 것도 중요합니다. 또한 치료약제로 인하여 영양소의 결핍이 초래될 위험이 있으므로 엽산, 비타민B6, B12, C, D, E, 칼슘 등이 충분히 함유된 음식을 섭취하는 것이 필요합니다.\n생활 요법으로는 적절한 운동과 지나친 과로, 과음, 흡연 등의 생활습관을 개선하는 것 뿐 만 아니라 지속적인 스트레스로 인해서 면역력이 떨어지지 않도록 마음을 다스리는 것도 중요합니다.\n마지막으로 한의학에서는 약 천년 이전부터 류마티스 관절염을 역절풍(歷節風)또는 백호역절풍(白虎歷節風)이라는 병명으로 부릅니다. 역절(歷節)이라는 명칭 그대로 관절 마디마디를 따라 통증이 생긴다는 의미이며, 백호에게 물린 것 같이 아프다 하여 백호역절풍으로도 부릅니다. 원인은 풍한습사(風寒濕邪)로 보고 치료를 합니다, 풍(風)은 관절 및 신경계 계통을, 한(寒)은 대상 조직 기능의 저하 또는 경직을 의미하며, 습(濕)은 조직내 독소로 인한 염증을 의미합니다. 따라서 역절풍(歷節風,류마티스 관절염)이란 것은 체내 독소로 인하여 유발된 면역계의 과잉 반응에 의한 관절, 신경 조직의 염증이 마디마디 관절로 전이되는 관절염이라 생각하면 되겠습니다. 류마티스 관절염의 한의학적 치료의 기본 원칙은 조직 또는 체내의 독소를 해독하여 면역력을 높이고 염증을 억제하는 것이라 하겠습니다.\n증상을 보고 정확한 진단을 해야 말씀드릴 수 있는 질문이기 때문에\n내원하셔서 궁금증을 해결하시는 것을 권고드립니다.', '안녕하세요.\n한의학박사 이승훈원장 입니다.\n류마티스 질환 질문에 대해\n동영상으로 답변을 준비했습니다.\n00:00 | 03:11\n화질 선택 옵션\n자동\n\n접기/펴기\n이승훈 원장님\n답변을 보고 계신 분들중 질문이 있으실 땐 언제든지\n제목에 ""울산 이승훈원장""을 넣어서 질문을 올려주시면\n(예시 : 울산 이승훈 원장님, 목디스크에 대해 알려주세요~)\n해당 질문을 찾아 답변해 드리겠습니다.\n가까운 한의원이나 신뢰가는 한의사의 도움을 받아 건강 꼭 되찾으시길 바랍니다.']",5,https://kin.naver.com/qna/detail.naver?d1id=7&dirId=7010103&docId=390772783&qb=67Cx7Iug&enc=utf8&section=kin&rank=277&search_sort=3&spq=0,순환기내과
38,2021.05.27,[],코로나 백신접종 가족에 관하여.,부모님들께서 백신을 맞게된다면 백신접종 당일로부터 다른 가족들은 거리두기를 해야하나요? 백신이라는게 약간의 바이러스를 주입해서 항체가 형성되는 과정으로 알고있는데... 혹시 다른 백신 미접종 가족들이 감염될수 있는것은 아닌지 걱정입니다.,"['부모님들께서 백신을 맞게된다면 백신접종 당일로부터 다른 가족들은 거리두기를 해야하나요? 백신이라는게 약간의 바이러스를 주입해서 항체가 형성되는 과정으로 알고있는데... 혹시 다른 백신 미접종 가족들이 감염될수 있는것은 아닌지 걱정입니다.\n= 아니요..\n코로나 백신으로 코로나 감염 안되니 걱정마세요..\n<코로나 백신 접종 후 주의사항> 부작용, 이상반응, 샤워, 증상, 음주\n코로나 백신 접종 후 이상반응 코로나 백신 접종 부작용 주의사항 안내 _ 전세계적으로 코로나 백신 접종이 시작됬습니다 대한민국 국내에서도 코로나19 백신 접종도 시작됬습니다 코로나 백신은 코로나 바이러스..\nzero-news.tistory.com', '백신접종 사전 알림 신청 서비스 신청 시 백신접종과 관련된 정보를 문자로 알려드리는 이벤트 (*참여 시 경품 추첨 응모)\n신청하기 : http://kerion.info/t6osfwpplo\n백신접종 사전 알림 이벤트\n알림 신청 서비스 신청 시 백신접종과 관련된 정보를 문자로 알려드리는 이벤트 (*참여 시 경품 추첨 응모) 경품 리스트 : 야나두 야핏 사이클(5명), 도미노피자&콜라1.25L(100명), 스타벅스 아메리카노(1,000명) 알림신청 방법 : [이벤트 신청하기] 클릭 후 약관 동의 및 개인정보 입력하고 본인인증만 진행하면 참여 완료\nkerion.info\n경품 리스트 : 야나두 야핏 사이클(5명), 도미노피자&콜라1.25L(100명), 스타벅스 아메리카노(1,000명)\n알림신청 방법 : [이벤트 신청하기] 클릭 후 약관 동의 및 개인정보 입력하고 본인인증만 진행하면 참여 완료', '바이러스를 주입하는게 아니에요\n코로나 백신 접종 전 주의사항 https://youtu.be/HUWnuVlIXZc\n코로나 백신 사전예약 https://ncvr.kdca.go.kr/cobk/index.html\n코로나19 예방접종 사전예약 시스템\n코로나19 예방접종 사전예약 시스템\nncvr.kdca.go.kr']",3,https://kin.naver.com/qna/detail.naver?d1id=8&dirId=80511&docId=390762455&qb=67Cx7Iug&enc=utf8&section=kin&rank=371&search_sort=3&spq=0,동물의료상담
