page,date,tags,questions,questions_add,answers,N_answer,url,category
8,2020.06.28,[],"부모님이 코로나바이러스 만약에 종식되도 예전처럼 돌아갈수 없다는데 사실이에요??ㅜㅜㅜ예전처럼 못돌아가면 백신개발될때까지 계속 마스크써야하는건가요 ...
그리고 제가 중1인데요,,여름방학끝나고 2학기하면 온라인수업안하고,매일 등교할수 있나요?(저는 아마 방학끝나면 8월 후반정도될 것 같아요.성의있게 써주시면 내공30드려요~^^",,"['부모님이 코로나바이러스 만약에 종식되도 예전처럼 돌아갈수 없다는데 사실이에요??ㅜㅜㅜ예전처럼 못돌아가면 백신개발될때까지 계속 마스크써야하는건가요 ...\n그리고 제가 중1인데요,,여름방학끝나고 2학기하면 온라인수업안하고,매일 등교할수 있나요?(저는 아마 방학끝나면 8월 후반정도될 것 같아요.성의있게 써주시면 내공30드려요~^^\n제 생각엔 어려울 것 같습니다 ㅠㅠ 일단 바이러스가 종식되기에도 현재 상황에선 힘들어보이고 전파성도 강해서 조금 잠잠해진 듯해도 다시 감염자가 발생해서... 백신이 만들어지기 전까진 힘들 것 같습니다. 8월쯤 되면 날씨도 많이 선선해져서 바이러스 증식도 더 활발해질 거 같고... 아마 2학기가 되어도 마스크는 계속 써야 할 것 같습니다 ,, 온라인 수업도 계속 할 거 같구요', '코로나바이러스가 완전히 종식되어도 경제에 준 영향이나 사망자 등 예전처럼 되돌아갈 수 없는 부분이 당연히 있습니다.\n다만 질문자님이 말씀하신 마스크나 등교의 경우 코로나가 완전히 종식되면 다시 되돌아갈 부분입니다. 그 종식이 지속적인 방역으로 확산이 감소해서 일어날지 백신이 개발되어 해결될지는 모르지만요.\n2학기때 해결이 될지를 질문하셨는데 그러지 못할 가능성이 큽니다. 지금도 계속해서 새로운 확진자가 나오고 있고 2차 대유행이 예상되고 있는 상황이기 때문에 빠른 시일 내에 해결되기를 기대하기는 어렵습니다.', '현실적인 답변드리겠습니다.\n보통 백신이 개발되지않으면 우리가 흔히걸리는 감기나 매년 유행했던 독감같이 풍토병이 되어버립니다. 현재 담뱃잎의 추출물이 백신화될 가능성이 있다는 정보가 존재하지만 만약 covid-19바이러스가 변이를 반복하여 백신개발이 불가능해지고 풍토병처럼 흔해져버린다면 인간이 적응하거나 아주 오랜 시간이 지나 항체를 생성하게된다면 모를까요, 아마 높은 전염성때문에 마스크는 계속 써야하고 지금과 같은 생활방식이 이 시대를 살아가는데 피할수없는 존재가 되어버릴지도 모릅니다. 그래도 언젠가는 개발될 확률이 높아질터이니 너무 걱정하지말고 지금 당장은 우리가 할수있는 일들을 하며 바이러스를 예방하는 일이 맞다고 생각합니다 ㅎㅎ']",3,https://kin.naver.com/qna/detail.naver?d1id=11&dirId=110307&docId=360998119&qb=67Cx7Iug&enc=utf8&section=kin&rank=78&search_sort=3&spq=0,학교생활
8,2020.06.28,[],인터넷 광고 익스플로러가 하나씩 뜹니다 ㅜㅜ,"백신끄고 프로그램을 깔았었는데 그와중에 광고크롬이랑 익스플로러가 계속떠가지고 다시 백신 키고 정밀검사한번하고 고클린이랑 프로그램추가제어에서도 광고 프로그램 다 삭제했습니다
그런데도 계속 익스플로러창 한개씩 뜨는데 어떻게 찾을수있는방법 없을까요... ","[' 백신 프로그램이 잡지 못한 파일이 몇 개 있는 것 같습니다. 한번 광범위한 악성코드를 잡는 툴이 아닌 애드웨어만 표적으로 해서 잡는 애드웨어 전용 탐지 및 제거 프로그램을 이용해서 지워보세요.\nHome - Adware Removal tool\nFree Adware Removal Tool Easily get rid of hard to remove adwares, PUP, Toolbars and Hijackers Free Download V 5.1 Clean browser hijackers This tool help you to get rid of Browser Hijackers. Easily clean unwanted toolbars If you are unable to uninstall any toolbar with normal way this software can...\nadwareremovaltool.org']",1,https://kin.naver.com/qna/detail.naver?d1id=1&dirId=11002&docId=360996875&qb=67Cx7Iug&enc=utf8&section=kin&rank=79&search_sort=3&spq=0,바이러스
7,2020.06.28,[],"핸드폰 해킹
라인에서 대화하다 링크 보낸걸 눌렀는데 이럴걸로 핸드폰 해킹당할수 있나요
보안검사 알약 v3 검사했을땐 이상없는데..
걍 링크 눌른것만으로 해킹당할수 있나요",,"[' 결론부터 말씀드리자면 가능합니다. 공격이 성공할 수 있는 조건은 대표적으로 아래와 같습니다.\n - 연결된 사이트 자체가 악성인 경우\n - 정상적의 사이트의 정보를 갱신하는 FTP 계정이 공격자에게 탈취되는 등의 원인으로 웹 사이트가 조작되어 바이러스가 원하지 않게 자동으로 받아지는 경우(변조 : Modification)\n - 유사하게 만들어진 사이트에 모르고 접속한 경우\n - 이 모든 사례가 있었음에도 불구하고 브라우저, 백신 앱이 사전에 감지하고 막지 못한 경우\n 일반적으로는 그렇게 쉽게 일어나지는 않지만 상당히 빈번하게 공격이 일어나고 의외로 속아 넘어가서 악성 앱까지 까시는 분이 많습니다. 혹시 URL 링크가 무엇인지 알려주실 수 있으신가요?']",1,https://kin.naver.com/qna/detail.naver?d1id=1&dirId=11001&docId=361009557&qb=67Cx7Iug&enc=utf8&section=kin&rank=64&search_sort=3&spq=0,해킹
7,2020.06.28,[],애드워드 걸린거 같은데 삭제할 앱 좀 알려주세요ㅠㅠ,제곧내 입니다ㅜㅜ 보기 힘드시겠지만 제발 알려주세요 컴알못이라...,"['바탕화면 좌측하단에 시작클릭하고 검색창에 msconfig입력하고 관리자권한으로 실행해서 시작프로그램 체크해있는거 모두다 체크해제하고 \n나오고 \n컴 다시시작해서 바탕화면 진입하면 \n멀웨어바이트 안티멀웨어를\nhttps://www.malwarebytes.com/\n사이트 좌측 home 아래 explore으로 마우스커서가져가고아래 free downloder 클릭하면14일동안 유료처럼이용할수있어요 이상태서 검사 치료하세요 기간 14일지나면 실시간 보호기능사라지나 업데이트 검사 치료기능제공하니 의심날대 검사 치료하기좋아요\n그리고 모든프로그램설치시에는 체크돼있는 제휴프로그램들이있을거니 체크됀거를 유심히보시고 본인에게 필요없는거면 체크해제하고 설치하셔야해요 이거도 안보고 그냥 있는대로 다설치하면 광고엄청나오죠 이런거는 아무리 최고백신프로그램이용해도 사용자가 동의해서 설치한거라 이상무로나오죠 이부분 주의하시고요 \nIObit Uninstaller 를 \nhttps://download.cnet.com/IObit-Uninstaller/3000-2096_4-75161625.html\n사이트 download now 요글자만 한번누르면 3초정도후 다운받아지니 다른거 더누르지말고\n다운받아 설치시 체크됀제휴프로그램인 어드밴쳐시스템케어 있을거니 체크해제하고 설치하시고\n설치한프로그램중에 nat service 35439 그거부터 삭제하세요 \n요프로그램이뭐냐면 웹하드이용시 설치돼는프로그램으로 다운다받은파일을 다른분들도 질문자님컴서 맥스스피드로다운받아지게하는거라 컴이 매우느려지죠 \n웹하드이용한다면 다운다받았으면 요프로그램 위 iqbit 로삭제하시고 이용하시면돼요 \n그리고 v3 이거 그다지좋은프로그램아니니 삭제하시는데 먼저 설정에들어가셔서 자체보호기능체크해있는거 체크해제하고 위 iqbit 로 삭제하고 강력검사진행해서 찌꺼기파일도 체크다해삭제하세요 \n그리고 microsoft corporation ,samsung electronics co ltd,realtek ,intel corporation, 이런 프로그램은 삭제하지마시고 나머지프로그램들경우 이름메모해서 네이버 구글검색해서 나쁘다라고나오는거 iqbit로 삭제하고 강력검사진행해서 찌거기파일도 체크다해 삭제하세요 \nhttps://www.ccleaner.com/ccleaner/download/portable\n위 사이트 클릭하면 자동으로 집파일 다운받아지니 알집풀고 실행만해서 인터넷 이용전후에 정리나 레지스트리 눌러 청소하고 (영어이니 세팅으로이동해서 한국어로하면돼요)\n시작프로그램 눌러 이상한게체크해있다면 체크해제하고 예약 프로그램탭이동해서도 이상한게체크해있다면 체크해제하고 그프로그램이뭐인지도 메모해서 검색하고 이상한거다하면 위에 iqbit로 삭제하고 강력검사진행해서 찌꺼기파일도 체크다해삭제하고 이용하세요\n늘 즐거운 하루되세요']",1,https://kin.naver.com/qna/detail.naver?d1id=5&dirId=502&docId=361003700&qb=67Cx7Iug&enc=utf8&section=kin&rank=70&search_sort=3&spq=0,컴퓨터
1,2020.06.28,[],전자기기에 대하여,"1.제가 핸드폰에 v3,알약,경찰청 스파이앱탐지,폰 가디언
4가지앱을 깔고있는데 폰가디언은 핸드폰을 해커들로부터 보호해준다고 했습니다 근데 vpn은 오히려 악영향을끼칠수 있다고해서 요즘은 꺼두고있습니다
2.알약,v3,경찰청 스파이앱탐지는 하루에 1번은 검사합니다
항상 이상이없다고 뜨는데 진짜 제 핸드폰이 안전한건가요
3.제가 무료음악다운어플을 play store에서 다운받아서 쓰고있는데 이것도 해킹가능성이 높을까요
4.영화처럼 제 핸드폰이 쥐죽은듯이 해킹이될수있는건가요 제가 핸드폰을 사용할때 카메라앱이 켜지지않을상태로 스파이앱도 깔려져있지 않고 제가 촬영당한다거나 제 핸드폰이 혼자 조작되어서 이상한짓을하지는 않을까 이런생각이듭니다 (제가 불안장애가 너무심해서 요즘은 통신이나 이런곳에 관심이들어서..)
5.집에 돈이 넉넉치가않은데 해킹을 배울수있는 인강이나 그런게 있을까요.. 저렴한곳으로요.. 사실은 프로그래밍이나 앱을 만들어서 많은사람들에게 즐거움과 편리함을주고 제 앱을 사용하는 사람들이 피해당하지않게 배우고싶습니다
저렴하게 배울곳이없다면 알바,학업,프로그래밍 다 할생각입니다.
6.isp나 크래커들이 제 인터넷사용기록을 해킹해서 막 지인들에게 보낼수있나요 이새기 이런취향이다 이렇게요
제 취향은 흑인이나 연상입니다

이런 조잡한궁금증 풀어주시면 제가 기도해드리겠습니다
내공또한 200드리겠슴다","[' 질문별로 나누셨으니... 나눠서 답변드릴께요..\n1.제가 핸드폰에 v3,알약,경찰청 스파이앱탐지,폰 가디언 4가지앱을 깔고있는데 폰가디언은 핸드폰을 해커들로부터 보호해준다고 했습니다 근데 vpn은 오히려 악영향을끼칠수 있다고해서 요즘은 꺼두고있습니다.\nA. 네, 실제로 그런 보안 관련 앱은 해커의 공격이나 바이러스 등으로부터 보호가 됩니다. VPN의 경우 유료 서비스가 아닌 무료 서비스나 신뢰되지 않은 서비스에서 취약점이나 공격 가능성, 품질 저하가 빈번하기 때문에 가급적 사용하지 않으시는게 좋아요. (그러니까 추천하지 않는 정도..입니다.)\n2.알약,v3,경찰청 스파이앱탐지는 하루에 1번은 검사합니다. 항상 이상이없다고 뜨는데 진짜 제 핸드폰이 안전한건가요.\nA. 안티바이러스 프로그램이 100% 완전하게 검사할 수는 없습니다만(보안의 특징 중 하나가 ""완벽한 보안은 존재하지 않는다""일 정도입니다.), 해당 앱을 매일 1번씩 검사해서 이상이 없다고 뜨면 안전하다고 보셔야 됩니다. \n3. 제가 무료음악다운어플을 play store에서 다운받아서 쓰고있는데 이것도 해킹가능성이 높을까요?\nA. 무료 음악 어플의 경우 가끔씩 플레이스토어에서 저작권 협약 위반 등으로 악성 앱으로 표시해 삭제시키거나 내리는 경우가 있는데, 이것만 봐서는 해킹 가능성은 낮다고 볼 수 있습니다.\n4. 영화처럼 제 핸드폰이 쥐죽은듯이 해킹이될수있는건가요 제가 핸드폰을 사용할때 카메라앱이 켜지지않을상태로 스파이앱도 깔려져있지 않고 제가 촬영당한다거나 제 핸드폰이 혼자 조작되어서 이상한짓을하지는 않을까 이런생각이듭니다 (제가 불안장애가 너무심해서 요즘은 통신이나 이런곳에 관심이들어서..)\nA. 아...가능합니다. 특히 데이터를 변조, 가로채기, 파괴, 복사를 하는 적극적 공격(active attack)이 아닌 단순히 조용하게 정보를 빼가거나 몰래 보는 수동적 공격(passive attack)의 경우 탐지하거나 인식하기 어려운 특징이 있기 때문이죠. 적극적 공격의 경우 사용자가 쉽게 무언가가 잘못되었음을 알기 때문에 보통 수동적 공격이 많이 일어납니다. 하지만 많은 악성코드가 백신 앱으로 탐지되고(계속 그 정보는 갱신되고 있습니다) 있으므로 크게 걱정하지 않으셔도 됩니다. (더구나 1주일에 한두번해도 충분한 검사를 하루에 한번씩 하시니까 확률적으로 봐도 걱정할 필요는 없습니다.)\n5.집에 돈이 넉넉치가않은데 해킹을 배울수있는 인강이나 그런게 있을까요.. 저렴한곳으로요.. 사실은 프로그래밍이나 앱을 만들어서 많은사람들에게 즐거움과 편리함을주고 제 앱을 사용하는 사람들이 피해당하지않게 배우고싶습니다\nA. KG ITBANK같은 사설 학원 또는 독학(인터넷과 책으로 스스로 알아서 공부하는 방법)이 있습니다. 학원은 좀 가격이 나가지만 선생님이 있으니 알기 쉽고, 독학의 경우 알기 어렵고 혼자 문제를 해결해야 하지만 솔직히 여기가 가격이 싸고 또 찾아가면서 이것저것 많이 배워갈 수 있습니다. 유튜브나 구글, 칸아카데미 등에 해킹의 기본이 되는 네트워크, 프로그래밍, 자료 구조 등의 강의가 있으니 참고해보세요.\n6.isp나 크래커들이 제 인터넷사용기록을 해킹해서 막 지인들에게 보낼수있나요 이새기 이런취향이다 이렇게요\nA. ISP(Internet Service Provider)는 사업주라서 경찰의 공적 수사 등 중대한 일이 아니라면 그런걸 보내지 않겠지만... 나쁜 마음을 먹는다면 충분히 통신 내용을 도청해서(내용은 몰라도 어디 주소에 방문하는지에 대한 헤더 정보는 쉽게 알 수 있습니다.) 지인들에게 보낼 수도 있습니다. 물론, 지인 연락처도 알아야겠네요.\n(이미 질문에 취향을 쓰신 것 같은데..)']",1,https://kin.naver.com/qna/detail.naver?d1id=1&dirId=11001&docId=361082636&qb=67Cx7Iug&enc=utf8&section=kin&rank=1&search_sort=3&spq=0,해킹
5,2020.06.28,[],중국 코로나바이러스 언제 소멸 되나요.?너무 불안해요.?,,"['내년까진 가지않을까 싶습니다..', '소멸 보다는 언제 백신이 나올까 이거겠죠\n아마 백신 개발 성공해서 나온다면 언젠간 지금의 감기처럼 갓 태어난 신생아들애게도 주사 투여하고 그럴겁니다']",2,https://kin.naver.com/qna/detail.naver?d1id=7&dirId=70105&docId=361026554&qb=67Cx7Iug&enc=utf8&section=kin&rank=45&search_sort=3&spq=0,흉부외과
2,2020.06.28,[],현재 코로나 근황,"현재 우리나라 코로나 근황좀 알려주세요
코로나가 심각한가요? 아님 좀 잔잔한가요?","['아직도 심각한 편입니다.', '네, 우리나라는 서울과 수도권에서 계속 코로나 확진자가 발생을 하고 있어서 현재로선 심각하다고 할수가 있습니다.\n수십명의 확진자가 발생을 하면 숨어있는 확진자는 더욱 많다는 것이기에 절대로 경계를 늦추면 안되는 것입니다.\n지금 전세계 코로나 확진자가 1,000만명,사망자가 50만명이라고 하며 아직 백신과 치료제가 개발이 되지 않아 항상 마스크를 쓰고 사람들과 접촉을 피하며 손을 자주 씻는등 개인위생을 잘해야 할것 같습니다.\n감사합니다.']",2,https://kin.naver.com/qna/detail.naver?d1id=9&dirId=9020203&docId=361051522&qb=67Cx7Iug&enc=utf8&section=kin&rank=20&search_sort=3&spq=0,남아메리카
2,2020.06.28,[],1살 고양이 접종,"이제 1년하고 2달 정도 나이가 먹은 성묘인데요
3차까지 접종을 어렸을적에 했다고 하는데요
이후로 주기적으로 맞아야 하는 접종은 심장사상충 말고 또 있나요??","['https://www.royalcanin.com/kr/cats/kitten/kitten-vaccinations참고하세요:)', '일반적으로 태어난지 2달정도지나고나서부터는 3차까지 종합백신을 맞추게됩니다. \n그리고 1년정도 지난 후부터는 1년에 한번씩 보강접종을 해주시게 됩니다. \n항체가검사를 통해서 항체가 충분히 있다면 1년후에 안하고 2년후나 3년후에 할 수도 있습니다만 항체가검사를 안하면 알 수 없기때문에 검사를 해보셔야 결정가능합니다. \n심장사상충은 매달 꾸준히 해주시면됩니다. ']",2,https://kin.naver.com/qna/detail.naver?d1id=8&dirId=80511&docId=361052122&qb=67Cx7Iug&enc=utf8&section=kin&rank=19&search_sort=3&spq=0,동물의료상담
2,2020.06.28,[],acronis 컴퓨터 백신,"인터넷에 안나오는데
여기서 acronis가 어떤 프로그램인가요?","[' Acronis(Acronis International GmbH)는 스위스에 본사가 있고 싱가포르에 국제 본사가 있는 기업으로, 백업, 손상된 파일 복구, 보안 파일 동기화, 사내 클라우드 서비스, 랜섬웨어 방지, 보안 위협 탐지 및 관리 등을 관리하는 서비스를 제공합니다. 해당 소프트웨어 역시 이 Acronis측에서 제공하는 소프트웨어입니다. 정확한 설명은 안 나오지만, AI기반 랜섬웨어 위협을 탐지하는 백업 소프트웨어로 추측되네요...\n (추측하는 소프트웨어는 아래에 링크를 걸어놓겠습니다.)\nhttps://acronis.ibank.co.kr/index.asp\nAcronis True Image 2019\nTrue Image 2020 Cyber Protection ₩ 57,500  ~ 지금 구매 무료시험버전 Never Lose Another File 최고의 개인 백업 소프트웨어 제품소개 신기능 특징 비교 업그레이드 고객센터 #1 개인 사이버 보호 간편하고 직관적인 백업 효율적인 올 인원 보호 사이버 위협으로부터 보호 완벽한 사이버 보호 입증된 멀웨어 방지 기술과 신뢰할 수 있는 백업을 결합한 독창적인 사이버 보호 솔루션 모든 데이터, 앱 및 시스템을 효과적으로 보호합니다. 백업 및 복구 미러 이미징 , 디스크 복제 , 일체형 복구 드...\nacronis.ibank.co.kr']",1,https://kin.naver.com/qna/detail.naver?d1id=1&dirId=11002&docId=361052844&qb=67Cx7Iug&enc=utf8&section=kin&rank=18&search_sort=3&spq=0,바이러스
2,2020.06.28,[],컴퓨터 멈춤 현상..,"컴터 산지 2년정도 되었는데요...

요새 게임중 컴터 화면이 까맣게 되면서
잠깐 멈추었다 다시 작동해요...

이거 무슨 문제일까요?....",['안녕하세요 !! IT 계열 신 등급 \n여성 지식인 답변해주는 언니 입니다 ^^\n일단 백신 한번씩 다시 돌려보시구여 이런 경우는 중요한 자료 다 옮겨놓고 포맷 하신 후에 윈도우 새로 설치하시는걸 추천드립니다 그래픽쪽 부품의 문제일수도 있겠지만 일단은 기본적인 대처는 해보시는것을 추천드려요 !\n추가로 궁금한게 있으시면 \n채택 후 추가 질문 해주세요 ~ ^^ \n감사의 인사는 표정으로 해주세요 !! ㅎㅎ'],1,https://kin.naver.com/qna/detail.naver?d1id=1&dirId=10101&docId=361054106&qb=67Cx7Iug&enc=utf8&section=kin&rank=17&search_sort=3&spq=0,데스크톱
2,2020.06.28,[],컴퓨터가 이상해요ㅠㅠ,평소처럼 컴퓨터를 하려고 컴퓨터를 켰는데 컴퓨터 바탕화면에 있던 아이콘들이 다 사라졌어요 어떡해야하죠,['안녕하세요 !! IT 계열 신 등급 \n여성 지식인 답변해주는 언니 입니다 ^^\n재부팅 해보시고 계속 그런 현상이 반복되신다면 포맷 후 윈도우 재설치를 하시는게 제일 좋습니다 만약 재부팅 했을때는 잘된다면 그때 자료를 좀 옮기시고 백신으로 바이러스 검사도 일단 해보세요 제일 좋은 방법은 다 지우고 윈도우 새롭게 설치입니다 ^^\n추가로 궁금한게 있으시면 \n채택 후 추가 질문 해주세요 ~ ^^ \n감사의 인사는 표정으로 해주세요 !! ㅎㅎ'],1,https://kin.naver.com/qna/detail.naver?d1id=1&dirId=101&docId=361054681&qb=67Cx7Iug&enc=utf8&section=kin&rank=16&search_sort=3&spq=0,"컴퓨터, 하드웨어"
2,2020.06.28,[],알약 프로그램,컴퓨터에 있는 바이러스 100퍼 다 걸러주나요?,['알약 프로그램\n무료 백신이라 100% 다 걸러주진 못하겠죠.\n실제로 알약 써도 바이러스 걸립니다. 많이들\n그래서 사람들 다 돈주고 유료백신 쓰는 사람도 많구요.\n저는 알약 쓰면서\n컴퓨터 바이러스 악성코드 한방에 해결방법! 바이러스 제로 시즌2 MZK!\n오늘은 컴퓨터 바이러스나 악성코드를 한방에 해결해주는 프로그램을 소개하도록 하겠습니다. 국내에서는 유명한 바이러스 치료하는 프로그램이며 알약같은것도 치료못하는 바이러스를 저는 이걸로 고쳤습니다. MZ..\nreview0005.tistory.com\n찝찝해서 위의 방법대로 바이러스 검사 주기적으로 해주고 있습니다.\n국내에서는 유명한 프로그램이며 바이러스 악성코드 찾아서 치료해주고요.\n문제는 다운로드만으로 설치없이 검사를 해주는 거기 때문에\n검사할때마다 새로운 버전 다운 받아서 해야합니다. DB가 자주 업데이트되서\n그래도 설치없이 검사 가능하다는게 장점이긴 하죠. ㅎㅎ\n실제로 저는 알약으로 못고치는거 이걸로 고쳤습니다. '],1,https://kin.naver.com/qna/detail.naver?d1id=1&dirId=11002&docId=361059188&qb=67Cx7Iug&enc=utf8&section=kin&rank=15&search_sort=3&spq=0,바이러스
2,2020.06.28,[],레쿠바 다운 사이트,"여기서 레쿠바 다운해서 쓰려고 하는데 안전한 사이트인가요?
recuva.kr","[' 백신 기반 바이러스 검사 엔진 Virustotal에 따르면 문제는 없는 사이트이나, 해당 사이트의 Q&A를 보니까 소프트웨어가 제대로 작동은 안 하는데 환불을 안 해준다는 불만이 좀 있네요. 직접 구매하는 건 질문자님 마음이지만 신중하게 선택하시기 바랍니다.']",1,https://kin.naver.com/qna/detail.naver?d1id=1&dirId=11001&docId=361061570&qb=67Cx7Iug&enc=utf8&section=kin&rank=14&search_sort=3&spq=0,해킹
2,2020.06.28,['#인류사'],"""인류가 질병을 극복해가기 위한 방법""을 자세히 알려 주셨으면 합니다.","""인류가 질병을 극복해가기 위한 방법""을 자세히 알려 주셨으면 합니다.","['인류가 질병을 극복해가기 위한 방법은 협력해서 백신 개발하고 정보 공유를 통한 극복 노력을 해야 합니다. ', '인류가 질병을 극복해가기 위해 많은 노력을 했습니다. \n선사시대에는 샤머니즘, 토테미즘, 애니미즘 등 자연에 의지하게 되었고, 그들과 접신(?)하는 주술사는 신께 기도를 드리거나 약초를 달여서 치료를 했었습니다. \n그러다가 경험을 기록하여서 책을 만드는 방법을 깨달은 인류는 책에 어떠어떠한 질병에 걸렸을때 어찌어찌해야 낫는지를 쓰기 시작하였고, 이것들을 토대로 의학서를 쓰기 시작했습니다. 하지만 이 방법은 시간이 오래걸리고 정확하지 않았습니다. 예를 들어 새로운 질병이 나왔을때 그 병에 걸리고, 그 병을 완치한 사람이 나오기도 오래걸리고, 사람마다 체질이 또 다르니 A 완치자는 A 약초를 먹자 병을 치료했었다고 체질이 다른 B 환자에게 A 약초를 줬다가 B 환자의 상태가 악화 될수도 있기 때문입니다. \n그래서 사람들은 이제마의 사상의학 처럼 사람들의 체질을 정리했었습니다. 그리고 임상실험을 통해 빠르게 그 질병을 완치 하도록 합니다. \n현대에는 현미경의 탄생으로 병균의 모습을 확인 할수 있게 되었고, 현미경을 통해 세균의 종도 분류할수 있게 되었습니다. 그리고 사람들은 어떤 세균의 종에는 어떤 성질을 가진 항생제가 강한지도 정리 하기 시작하였고, 백신의 개발속도도 빨라지게 되었습니다. 그리고 정보통신의 발달로 사람들에게 예방수칙을 전달하게 되었고, 감염확률을 낮추게 되었습니다. 이처럼 인류는 옛날부터 질병을 극복하기 위해 노력을 하였고, 현대에는 백신을 개발하기 위한     최신기술을 발전시키고 있습니다.\n코로나 바이러스가 기승을 부리고 있지만 지금 이 순간에도 사람들은 백신을 개발하기 위해 노력을 하고 있으니 그들에게 응원을 보내는 것을 어떨지요?']",2,https://kin.naver.com/qna/detail.naver?d1id=11&dirId=111004&docId=361063783&qb=67Cx7Iug&enc=utf8&section=kin&rank=13&search_sort=3&spq=0,인류학
