page,date,tags,questions,questions_add,answers,N_answer,url,category
6,2020.07.31,[],앞으로가 너무 두려워요,"유튜브를 보면 항상 뜨는게 자연재해 관한거에요
막 작년에는 백두산 폭발 징조 어쩌구가 뜨고
미세먼지 어쩌구랑 벌레 어쩌구도 뜨고 무서워서 보기가 망설여져요
지금도 코로나때문에 많은사람이 죽고 감염됬는데
어른들은 이건 일부일 뿐이래요 앞으로 빙하가 녹고 그러면 많은 나쁜 세균이 나온데요
그리고 이번에 중국댐 얘기도 있던데.. 진짜 너무 무서워요
초등학생 된지 얼마나 됬다고 이러면 무서워서 어케 살아요?
저랑 가족이랑 막 사람들이 끔찍하게 죽으면 어떡해요?
친구들은 이미 어른되기 전에 멸망할 것 같다고 포기했어요
이제 다 죽는거에요?","['아니요 그럴 일 없으니 안심하세여~', '실제로 빙하가 녹으면 얼어있던 바이러스가 녹아 다시 활동할 수도 있습니다\n하지만, 백두산 폭발, 댐 붕괴등의 내용은 대부분 허위사실일 가능성이 높습니다\n백두산은 지금 폭발해도 이상할게 없는 활화산 이며 아예 폭발을 안할수도, 소규모로 폭발할 수도, 대폭발을 할 수도 있습니다\n어디서, 언제, 크기 등의 내용이 적혀있으면 허위사실이며 이를 인터넷에 유포할 경우 전기통신기본법 제 47조에 의거 처벌받으실 수 있습니다\n전기통신기본법 제 47조(벌칙) 1.공익을 해할 목적으로 전기통신설비에 의하여 공연히 허위의 통신을 한 자는 5년 이하의 징역 또는 5천만원 이하의 벌금에 처한다\n답변 허접해서 죄송합니다.  추가질문 있으시면 댓글 달아주세요', '자극적인 내용으로 구독자, 조회수 늘리려는 유투버들의 허황된 상술입니다.\n1. 일본은 백두산 보다 더 위험한 화산을 수백개나 보요하고 있고 지금도 계속하여 화산이 폭발하지만 일본 \n    국민들은 화산폭발시 대응매뉴얼에 대한 전국민 행동요령을  지키며 현재까지 경제 선진국으로 잘살고       \n    있습니다\n2. 질문자님은 언급하지 않았지만 요즘 유투브에서 일본 침몰에 대한 자극방송을 계속하고 있습니다.\n     만약에 일본의  전 국토에서 동시다발의 화산과, 지진 및 해일이 발생한다고 해도 일본이 침몰하지는 않습\n     니다. 많은 사람이 죽을 수도 있으며 화산재와 주거지 파괴로 사람이 살수 없는 나라가 될지언정, 국토자체\n     는 침몰할 수 없습니다. 일본은 지금도 화산으로 인해서 오히려 국토가 늘어나고 있는 나라입니다. \n      그리고 사람이 살 수 없을 정도의 화산활동과 지진이 발생한다면 그것은 일본만의 문제가 아닌 세계 여러\n      나라의 기후와 삶의 환경에도 변화가 오는 전 지구적인 문제입니다.\n3. 코로나는 마스크를 잘 쓰고 생활속 거리두기를 지켜나가다가 백신이 개발하면 감기 같은 흔한 질병으로 \n    역시 관리하면서 살아갈 수 있습니다.\n4. 미세먼지는 중국황사와 함께 수천년 전부터 있어 왔습니다.  이 역시 녹지확보와 관련 기술의 개발 등으로 \n     극복 가능합니다.\n5. 남극과 북극의 빙하가 녹아내려도  인류는 진화하면서 생존하였듯이 지구상 만물의 영장인 사람은 우수한 \n    적응력으로  진화하고 살아남을 것입니다.\n6. 마지막으로 중국의 삼협(산샤)댐입니다.  내륙의 삼샤댐이 붕괴되어도 중국 내 일부 도시들이 침수될 뿐,  \n    중국의 바다가 도시인 상해나,  중국 동부지방의 원전이 침수된다는 내용은 페이크(가짜) 뉴스 입니다.\n이러한 것을 걱정하며 자포자기 하는 학생은 공부하기 싫은 자기 합리화 입니다.  질문하신 학생은 친구가 공부 안할때 오히려 더 열심히 공부하여  이러한 지구적 문제점 해결을 하는 큰 인물이 되기 바랍니다.\n너무 걱정하지 말고,  지금부터 공부하세요  늦은 시간 답변다는 아저씨도 열심히 살고 있습니다.  ㅎㅎ ^^']",3,https://kin.naver.com/qna/detail.naver?d1id=6&dirId=612&docId=364065448&qb=67Cx7Iug&enc=utf8&section=kin&rank=60&search_sort=3&spq=0,재난재해
7,2020.07.31,[],2학기에도 1학기처럼 격주등교 하나요?,수도권인데 지금 국내는 좀 내려간거같고 해외가 많은거 같은데 가을에 대유행 한다 들었어요.. 잘모르겠네욤 ..,['그렇게 될 가능성도 배제할순없습니다. 백신은 내년에나 나오니까요'],1,https://kin.naver.com/qna/detail.naver?d1id=1&dirId=1060101&docId=364035891&qb=67Cx7Iug&enc=utf8&section=kin&rank=69&search_sort=3&spq=0,지식iN
7,2020.07.31,[],[급함] 컴고수님들 보시고 알려주세요. 사이트 잘못들어갔을때 문제가 생길 수 있나요?,"아이템매니아 itemmnaia.com <- 주소를 잘못 적어서 밑의 주소에 들어가졌는데 이주소는 뭔가요?       
(주소가www. itemmania.com  < 들어가려다가
잘못 적어서 www.itemmnaia.com 여기에 들어가졌어요.)
들어갔을때 이상한 영어로 오류문구 하나뜨고  무슨 작은 광고로보이는(?) 창하나 떴습니다. 그래서 닫고 나왔는데요.
혹시 바이러스나 해킹위험성이 있을까요?
찝찝해서 질문드립니다.","['걱정암하셔도 될것같른데요...', ' 해당 사이트는 악성 사이트로 의심되며, 실제 연결 시도시 AhnLab V3 백신에서 악성 사이트 연결 차단으로 아예 연결을 초기화시켜버렸습니다.\n 또한 온라인 악성코드 검사 플랫폼 Virustotal의 Map 기능을 이용해 사이트를 분석하면.. 형광펜으로 노랗게 칠한 곳이 제시해주신 사이트입니다. 그러면 이 사이트가 두 번 리디렉션(redirection)되면서 독일에 위치한 서버로 가는데, 왼쪽에 보시면 아시겠지만.. 사이트에 온갖 악성코드나 악성 파일들이 실행 파일 형식으로 잔뜩 들어가 있습니다. 결론적으로 바이러스나 해킹 위험성.. 있다고 봐야 합니다. 상당히 높게 의심해 봐야죠.\nhttps://www.virustotal.com/graph/http%253A%252F%252Fwww.itemmnaia.com%252F\nVirusTotal\nVirusTotal\nwww.virustotal.com']",2,https://kin.naver.com/qna/detail.naver?d1id=1&dirId=11001&docId=364036216&qb=67Cx7Iug&enc=utf8&section=kin&rank=68&search_sort=3&spq=0,해킹
7,2020.07.31,"['코로나19', '백신']",코로나 백신 정보 다 알려주세요 자세하게요,,"['코로나 백신상용화는\n금년말 또는 내년초에나 \n우리나라도 가능할 수 있네요\n참고되시기바랍니다.', '미국 제약회사 모데나 \n임상 3상 들어감\n이 임상 3상마저 통과하면 백신으로써 발표됩니다\n보급은 내년 상반기\n========= 현재 특가 상품 ==========\n!!아디다스 여름 특별 기획전!! \n▶https://coupa.ng/bHcSwv\n!!SNS에서 난리인 다이어트 음료 헐리우드 48시간 원조 클렌즈 음료! 32% 할인행사중!!\n▶https://coupa.ng/bFQWrX\n!! 삼성 가전 브랜드 위크 40% 할인 행사중!!\n▶https://coupa.ng/bFURsZ\n!! 여름 신상 뷰티 용품 행사 기획전 81% 할인중!!\n▶https://coupa.ng/bGbK0f\n!!뱃살 다이어트 품목 행사 할인중!!\n▶https://coupa.ng/bFQW5K\n!!갤럭시 버즈 플러스 BTS 에디션 한정판 출시!!!\n▶https://coupa.ng/bFI0JJ\n오늘의 특가 세일 리스트 최대 50%\n▶https://coupa.ng/bGowm2\n!!게이밍 컴퓨터 특집!! 할인중!!\n▶ https://coupa.ng/bFBalZ\n!!쿠쿠 브랜드 특가 할인 행사중!!\n▶https://coupa.ng/bFQXhO\n!! 에어컨 할인 특가 한눈에 보기 !!\n▶ https://coupa.ng/bEYoii\n!! 여름 가전 특가 한눈에 보기 !!\n▶https://coupa.ng/bEYmWF\n!! 인터넷 방송 장비 특가 한눈에보기!!\n▶https://coupa.ng/bFBezN\n여름 향수 브랜드 전품목 최대 60% 세일중\n여자 여름 향수 특가 한눈에 보기\n▶ https://coupa.ng/bEhHHz\n남자 여름향수 특가 한눈에 보기\n▶https://coupa.ng/bEhHQk\n행사중!! 썸머 화장품 기획전 브랜드 상품 최대 64% 할인행사중입니다.\n인기 여름 화장품 한눈에 보기 \n▶ https://coupa.ng/bEhOo0\n물과 땀에 지워지지않는 워터프루프 제품 한눈에 보기\n▶ https://coupa.ng/bEhKP0\n안마의자 최대 64% 할인 기획전\n▶ https://coupa.ng/bD3eFd\n모여봐요 동물의 숲 할인 행사중!! \n▶ https://coupa.ng/bD3fsq\n게이밍 모니터 특가 행사중\n▶ https://coupa.ng/bDZOfQ\n게이밍 데스크탑 특가 행사중\n▶ https://coupa.ng/bDZOpv\n냉장고 특가 한눈에 보기\n▶ https://coupa.ng/bDZQvO\n주방 가전 특가 한눈에 보기\n▶ https://coupa.ng/bDZSVk\n김치냉장고 특가 한눈에 보기\n▶ https://coupa.ng/bD3ez4\n========= 코로나 대비 상품 =========\n!! FDA 인증 여름용 덴탈 마스크 50매/100매 \n▶ https://coupa.ng/bEaIOi\n!! KC 인증 여름용 덴탈 마스크 장당 240원!! \n▶ https://coupa.ng/bEamgg\n!! KC 인증 여름용 덴탈 마스크 50장!!\n▶ https://coupa.ng/bEaIsf\n!! 여름용 쿨 메쉬 원단 마스크 세탁가능\n▶https://coupa.ng/bEaNkR\n<비말 차단 마스크 KF-AD> 특가 한눈에 보기\n▶ https://coupa.ng/bDPwlM\n<덴탈 마스크> 특가 한눈에 보기!\n▶ https://coupa.ng/bCdPT5\n<아이 전용 마스크> 특가 한눈에 보기!\n▶ https://coupa.ng/bDZLnP\n<KF94 필터 마스크> 특가 한눈에 보기!\n▶ https://coupa.ng/bCdP2a\n<면 마스크> 특가 한눈에 보기!\n▶ https://coupa.ng/bCdQiu\n<휴대용 손소독제!> 들고다니면서 뿌려요! 향수같은 향기 \n▶ https://coupa.ng/bAeAnZ\n<휴대용 손소독제!> 깔끔한 에탄올 70% 손소독제! \n▶https://coupa.ng/bAeBpD\n========= 필수 영양제 상품 =========\n필수 <면역력> 영양제 한눈에 보기!\n▶ https://coupa.ng/bCy7C3\n필수 <수험생> 영양제 한눈에 보기!\n▶ https://coupa.ng/bCIyp4\n필수 <다이어트> 에 좋은 영양제 한눈에 보기!\n▶ https://coupa.ng/bCZ7xg\n필수 <정력> 에 좋은 영양제 한눈에 보기!\n▶ https://coupa.ng/bCZ9eH\n필수 <여성> 영양제 한눈에 보기! \n▶ https://coupa.ng/bB5XI2\n필수 <갱년기> 영양제 한눈에 보기!\n▶ https://coupa.ng/bCjf4c\n=========여름 바캉스 패키지=========\n곧 여름 바캉스 시즌입니다. 미리 예약하시고 큰 혜택 보시기바랍니다. 조기 매진 주의\n전지역 프리미엄 펜션 (풀빌라) 20% 할인중 특가 한눈에 보기\n▶ https://coupa.ng/bDZL3V\n제주 여행 특가 행사전 (항공권/입장권/패키지상품)\n▶ https://coupa.ng/bDZNtt\n캠핑 용품 특가 행사중!! 최대 48%\n▶https://coupa.ng/bD7gc0\n낚시 용품 특가 한눈에 보기!!\n▶https://coupa.ng/bD7gvE\n초보자 입문자도 쉽게 낚시 한다 원투 낚시!\n원투 낚시 세트 한눈에 보기!!\n▶https://coupa.ng/bElXmG\n========= 여행 및 생필품 특가 상품 =========\n순백 3겹 라벤더 바닐라 롤 화장지 30롤\n▶https://coupa.ng/bD3c0b\n탐사수 20병 팩 \n▶https://coupa.ng/bD3dkh\n아기 물티슈 100매짜리 10팩\n▶https://coupa.ng/bD3dBt\n농심 육개장 사발면 6개 패키지\n▶https://coupa.ng/bD3dKG\n깨끗한 소중한 우리쌀 \n▶https://coupa.ng/bD3dU0\n======= 오늘의 반찬 특가 =======\n호주산 와규 양념 불고기 (냉장) 100g당\n▶ https://coupa.ng/bD6MFq\n한돈 1등급 삼겹살 구이용 (냉장) 100g당\n▶ https://coupa.ng/bD6NgR\n한우 1+ 등급 채끝 스테이크 (냉장) 200g \n▶ https://coupa.ng/bD6NvW\n참맛나라 신선한 알이 듬뿍 알탕\n▶https://coupa.ng/bD6OSW\n빠네 크림 파스타\n▶https://coupa.ng/bD6OZe\n리코타 치즈 샐러드 2팩\n▶ https://coupa.ng/bD6N1S\n채소믹스 패키지 요새 핫한제품입니다!\n▶ https://coupa.ng/bD6OhK\n삼립 아침엔 우유토스트 식빵 2팩 \n▶ https://coupa.ng/bD6Oqm\n춘천 닭갈비 (냉장) 특가 세일중\n▶ https://coupa.ng/bEv3Q8\n충남 농협 GAP 인증 대추방울 토마토 1KG 특가 행사중\n▶ https://coupa.ng/bEv31P\n동원 비엔나 소세지 1KG 특가 행사중\n▶ https://coupa.ng/bEv4dc\n파트너스 활동의 일환으로 일정액의 수수료를 제공 받습니다.']",2,https://kin.naver.com/qna/detail.naver?d1id=7&dirId=7010107&docId=364037772&qb=67Cx7Iug&enc=utf8&section=kin&rank=67&search_sort=3&spq=0,감염내과
5,2020.08.01,[],컴퓨터 특정파일이 계속 실행되요,"삼성 usb 드라이버 설치후 삭제를 했습니다 그런데 그 이후에 자꾸 저 창이 뜨네요

그래서 다시 ubs 드라이버 재설치후 삭제를 해도 계속 저창이 뜹니다

저 알림창중 위에 창은 unistall 파일이 없다고 하는 내용이고

알림충중에 아래창은 드라이버 설치할때 썼던 실행파일이 없다는 내용입니다

아예 저위에 언급되어있는 파일을 경로에 그대로 놔두어두면 

사용자계정창이 뜨면서 언인스톨 할지에 대한 창과 또 프로그램 실행할지의 창이 또 실행됩니다

뭔가 계속 저 실행파일이 계속 실행되게끔 프로그램 되어있는거같습니다

특히 유튜브 전체화면에서 작은화면으로 돌아올때나 

동영상 플레이어 전체보기 후에 창을 끄거나 하면  저 알림이  무조건 뜨네요

레지스트리의 문제인지 모르겠습니다 

고수님들의 답변 부탁드립니다","['참고의견 입니다.\n다른분말대로 ..\n백신 최신업데이트 후 전체검사하시길 권해드립니다.\n그리고, 악성코드 검색해보시길...\n그렇게 해도 같다면,\n1. 제어판 > 프로그램 추가/삭제 에서 알수없는 프로그램은 제거해보세요.\n2. 윈도우키+R\nservices.msc > 서비스목록중 알수없는 특수문장이 있는것이 있는지 확인하시고\n중지시켜보세요.\n3. 윈도우키+R\nmsconfig > 시작프로그램 특정프로세스 실행여부 확인해보세요.\n위에 다 해보시고...\n그래도 같다면 원격열어주세요.\nhttps://939.co.kr\nezHelp PC 원격지원 서비스(ezHelpID::443)\n본 서비스는 고객님의 지원 요청에 따라 상담원이 직접 고객님의 PC에 접속하여 문제를 해결해드리는 서비스입니다. 먼저 고객지원센터로 전화하신 후 상담원의 안내에 따라 상담원 번호 아이콘 또는 접속코드(6자리) 입력 후 확인버튼을 클릭해 주십시오. 접속코드입력 접속코드 6자리를 입력하십시오.\n939.co.kr\n접속코드 : 442673\n한번봐드리겠습니다.\n문제해결이 잘 되시길...']",1,https://kin.naver.com/qna/detail.naver?d1id=1&dirId=10301&docId=364095968&qb=67Cx7Iug&enc=utf8&section=kin&rank=42&search_sort=3&spq=0,윈도우
5,2020.08.01,[],이거 어떤 프로그램 일까요??,사진에 나오는 바이러스가 제가 생각하는 그바이러스가 맞나요???,"['바이러스 감염 상황이 맞습니다.\n아래 그림 1번 표시 항목은 ㅡ>바이러스백신 명칭입니다.\n아래 그림 2번 표시 항목은 ㅡ>왼쪽 항목 백신이 검사 결과를 표시한 항목입니다.\n해킹을 할 수 있는  Trojan  감염 , spy 계열 감염이 되었다는 검사 결과 표시입니다.\n2 가지 유형 모두 해킹 진행이 가능한  바이러스입니다.\n8개의 백신에서 3 개 백신을 제외한 5 개 백신이 진단을 한 결과로 보아 감염 가능성이\n높은 상황입니다.\n사용 하시는 바이러스백신이 있다면 실행하셔서 검사 치료 과정이 필요합니다.']",1,https://kin.naver.com/qna/detail.naver?d1id=1&dirId=11002&docId=364092224&qb=67Cx7Iug&enc=utf8&section=kin&rank=43&search_sort=3&spq=0,바이러스
5,2020.08.01,['마인크래프트'],마인크래프트 서버 접속 오류(내공 500),"포트포워딩을 다마치고 
https://www.yougetsignal.com/tools/open-ports/에서
25565포트가 열려있는것을 확인하고 서버를 들어갔는데,
서버가 열리고 시간이 좀 지나고 다른 사람이 접속을 시도하면,
io.netty.channel.abstractchannel$annotatedconnectexception이게 뜨면서 접속이 안됩니다.
근데 또 /reload쳐서 서버재부팅 하면 또 들어와집니다.
혹시 이거 어떻게 고치는지 아시나요?
참고로 네트워크 초기화했고 고정ip설정 했으며, 방화벽 껐고, 그 외의 백신 프로그램들도 
전부 껐습니다. 또한 접속하다가 튕기는 일은 없습니다. 
해결방법 부탁드립니다.",['최대 인원을 초과해서 그런것 같습니다.'],1,https://kin.naver.com/qna/detail.naver?d1id=2&dirId=20411&docId=364091566&qb=67Cx7Iug&enc=utf8&section=kin&rank=44&search_sort=3&spq=0,마인크래프트
5,2020.08.01,[],빌게이츠가 무백신주의자로 백신사업을 하는 게 사실인가요,"집안 전체가 백신 한방 맞은 적도 없었다는 데
남들은 백신 맞 추려코 수천억?의 재산을
기부하고 투자하는 게 사실인가요??
지금 문재인한테 서신보내고 국내 기업들햐고
손잡고,백신 개발하고 코로나시대에
대량공급 할 목적 같은 데 다시 비싸게 팔아먹고
이게 단순 사업적 목적이아닌 뭔가 있는 건가요??",['리그오브레전드에 질문하시면 다 겜창들 뿐이라 답변이 안옵니다. 분야를 바꿔서 다시 질문하시죠.'],1,https://kin.naver.com/qna/detail.naver?d1id=2&dirId=20132&docId=364090615&qb=67Cx7Iug&enc=utf8&section=kin&rank=45&search_sort=3&spq=0,리그오브레전드
5,2020.08.01,[],파상풍 주사하고 td주사 같아 맞았어요,"듣기로는 두가지 같이맞으면 효과가 사라져버린다고 하는데

오늘 청솔모 잡다가 손가락 물려서 소독하러 간김에 맞은거거든요

주사 두가지 같이맞아도 상관없나요?

아니면 몇일있다가 따로 다시 맞아야 하나요",['TD는 파상풍과 디프테리아가 함께 포함되어 있는 혼합백신입니다.\n파상풍 주사는 파상풍 단독 백신인지 혼합백신인지 확인해봐야 합니다.'],1,https://kin.naver.com/qna/detail.naver?d1id=7&dirId=70122&docId=364087280&qb=67Cx7Iug&enc=utf8&section=kin&rank=46&search_sort=3&spq=0,응급의학과
5,2020.08.01,[],다운로드 창이 계속 떠요. ad.linkprice.com,"갑자기 사진처럼 다운로드 창이 계속떠요.
어떤걸 지워야되는건지 도움좀 부탁드립니다.

아래 사진첨부","['참고의견 입니다.\nhttps://malzero.xyz/\nMalware Zero - 무료 악성코드 제거 도구\n악성코드 및 애드웨어 등 각종 유해 프로그램에 의한 고통에서 해방되기 위해 설치 없이 사용 가능한 무료 악성코드 제거 도구\nmalzero.xyz\n악성코드 검색한번 해보세요...\n백신도 꼭 설치하셔서 DB최신업데이트 후 전체검사 하세요.\n시작프로그램 목록에 등록되어 있는지 여부확인도 하셨으면 좋겠지만...\n악성코드 검색하시면 해결될 듯 하네요.\n악성코드 검사 한후 그래도 같다면\n톡주셔요.\n아이디 hauri79 입니다. 원격봐드릴게요.', '같은 증상이 있어 제어판에서 window n~ f~  c~ 로 되어있는 프로그램을 지우고 나니 그런 증상이 없어지네요.\n~ 표시로 한 것은 지우고 나니 정확한 명칭을 몰라서 나타나는 다운로드창에서 window 응용프로그램 nfc라는 문구를 떠올려서 표시한 것입니다.']",2,https://kin.naver.com/qna/detail.naver?d1id=1&dirId=102&docId=364086895&qb=67Cx7Iug&enc=utf8&section=kin&rank=47&search_sort=3&spq=0,소프트웨어
5,2020.08.01,[],지금은 대형교회는,"사회적 거리두기 2-3m 하고 손소독, 열체크, QR코드 하고 성전 안에는 2m씩 떨어져서 예배 드리는데 코로나 백신, 치료제 성공해서 코로나 이전으로 돌아가면 대형교회는 예배를 어떻게 드려요?",['조금씩 나아지겠죠 확 바뀌지는 않을거예요'],1,https://kin.naver.com/qna/detail.naver?d1id=6&dirId=61303&docId=364085263&qb=67Cx7Iug&enc=utf8&section=kin&rank=48&search_sort=3&spq=0,사람과 그룹
