page,date,tags,questions,questions_add,answers,N_answer,url,category
62,2017.10.16,"['해외골프여행', '베트남', '호치민', '해외여행초보', '#필리핀지식인', '#베트남골프장']",해외골프여행질문요,"12월 베트남골프여행을 갈려합니다.
궁금한점은
수화물은 골프백과 캐리어 두개다 수화물 가능한가요?
그리고 국내골프장 이용시 보스턴백을 챙겨가는데
해외에골프장도 보스턴백 챙겨가야하나요
보스턴백 챙겨가면 짐이 캐리어,보스턴백,골프백이렇게 세가지가되는데 골프여행 갔다가 오신분들 짐 싸는방법좀 가르쳐주세요","['안녕하세요?\n스포츠 수하물로 신청하시면 됩니다.\n보스턴백은 안가져 가셔도 됩니다.\n감사합니다.', '안녕하세요\n네이버지식인 필리핀분야 1위 필리핀지식인 입니다\n\n보통 오실때\n골프백, 캐리어는 위탁수하물로 보내고\n기내에는 보스턴백을 가지고 탑승을 합니다.\n\n골프장 입장하실때에는\n골프백과 보스턴백을 가지고 가시면 되구요\n한국과 같이 보스턴 백에는 갈아입을 옷가지와 속옷\n골프화등을 넣어서 가시면 됩니다.', '1. 골프백과 캐리어 두개다 위탁수화물 하시면 됩니다.\n\n2. 챙겨가셔도 무방합니다만 보통 기내사이즈로 많이나오니 기내에 가지고 탑승하시면 되겠습니다.\n\n3. 짐싸는 방법은 따로 없고 갈아입을 옷과, 필요한 몇가지 물품, 생필품등 챙겨가시면 됩니다.\n\n4. 여행사를 선정하셨다면 상관없지만 혹시나 선정하지않으셨다면 네임택아래 주소한번 클릭해주세요^^', '안녕하십니까?\n골프장회원권을 찾으세요?\n요즘 베트남이 이슈가 되고 있습니다.\n국내에서 유일하게 베트남 하노이 옌중골프장을 소개해드립니다.\n무기명회원권(4인)이며 활용성이 높습니다. (부킹 100%)\n특히 비즈니스 목적으로 구입하는 경우가 많고, 임직원 복지용으로도 많이 이용합니다.\nhttps://vietnamgolf7.modoo.at/\n\n중국(남산골프) / 제주(스프링데일) 회원권도 진행하고 있습니다.\n네임카드 클릭하시면 상세정보나옵니다.\n문자 & 카톡 주시면 자료 첨부하여 전달드리겠습니다.\n궁금하신점 있으시면 언제든지 연락주세요~\n감사합니다.\n\n#베트남골프장 #옌중골프장 #중국골프장 #해외골프장 #해외골프 #필리핀골프 #필리핀골프여행 #골프여행추천 #베트남 #무기명골프회원권', '해외골프 초특가 모음 밴드로 초대합니다. \n골프몬입니다.\n- 매달 2회 해외 월례회 진행 - 1인출발가능\n  (태국,중국,필리핀,말레이시아,베트남,라오스 등등)\n- 최저가 보장\n- 이벤트 진행\n- 국내부킹 예약가능\n- 국내 1박2일 예약가능\n- 2인 예약가능\n- 조인가능\nhttps://band.us/@golfmontour', '골프백과 캐리어는 위탁수화물로 보내면 되고, 보스턴백은 챙기시면 좋아요!\n골프장 입장하실때에는 골프백과 보스턴백을 가지고 가시면 됩니다.\n한국과 같이 보스턴 백에는 갈아입을 옷가지와 속옷 골프화등을 넣어서 가시면 돼용\n보스턴백 인기순으로 정리해둔 사이트가 있어 도움 되실 것 같아 공유해드립니다.\n직접 판매하는 사이트는 아니고 여러 쇼핑몰의 인기순위를 비교해볼 수 있는 사이트예요.\n구매하실 때 참고해보세요! 제 답변이 조금이나마 도움이 됐으면 좋겠습니다 :)\nhttp://www.cjgmarket.co.kr/shop/search.php?sfl=wr_subject%7C%7Cwr_content&sop=and&q=%EB%B3%B4%EC%8A%A4%ED%84%B4%EB%B0%B1&ritem=867\n보스턴백 - 보스턴백 | 최저가마켓\n보스턴백 | 최저가마켓\nwww.cjgmarket.co.kr', '안녕하세요 질문자님 :) 한케이골프의 김대우대리입니다. 한케이골프는 대한민국 국내유일 중국,베트남, 일본,필리핀등 공항에서 가까우며 지역에서 가장 유명한 골프장들과 회장님이 직접 계약하여 국내에서 유일한 골프+패키지로 회원들을 모시고있습니다. 중국, 베트남, 필리핀, 일본 등 해외골프에 대한 계획이 있으시다면 010-8224-3434로 부담없이 전화주시면 자세하게 상담해드리겠습니다 언제나 즐거운 골프라이프를 응원합니다 !', '안녕하세요~! \nHOT한 골프/여행 소식을 알려드리겠습니다. \n정부가 5월5일부로 자가격리 없이 해외 출국을 허용하였습니다.\n현재 60~64세까지 코로나 접종을 받을수 있도록 정부에서 진행중 입니다.\n현재 코로나 백신 2차까지 접종하신 분들에 한하여 자가격리가 해제 되었습니다.\n요즘 국내 골프 부킹하기 어려우시죠? 저도 골프를 치지만 정말 어렵습니다.\n그래서 요즘 눈치 빠르신 대표님들은 해외 골프로 미리미리 준비 하시고 계십니다.\n국내/해외 골프여행 또는 회원권 정보를 알고 싶으신 분들은 문자나 연락부탁드립니다.\n항상 친절히 고객님들을 위해 정성을 다하겠습니다! 감사합니다.\n보다 많은 정보가 궁금하신 분들은 https://blog.naver.com/leo119s/222317876202\n여기로 방문하시면 좋은정보 받아보실수 있습니다.']",8,https://kin.naver.com/qna/detail.naver?d1id=9&dirId=9020104&docId=286562012&qb=67Cx7Iug&enc=utf8&section=kin&rank=616&search_sort=3&spq=0,필리핀
62,2020.02.25,[],아비간 관련주 ? 한국유니온제약 주가,"아비간 관련주 생소하네요
한국유니온제약 주가 오늘 상승세던데
이것도 코로나 이슈랑 관련된건가요?
신종플루 관련주로 뜨던데 최근
이슈 좀 공유해주세오~ ","['안녕하세요\n한국유니온제약은 아비간 관련주가 맞습니다.\n코로나 이슈랑 관련이있고, 신종플루 관련주랑도 연관이 있습니다.\n코로나테마주들이 다른 테마에 뭍혀서 조금씩 움직이고있는데\n미리 매수하셔도 나쁘지 않을걸로 보입니다.\n종목찾기 힘드시죠?\n객관적인 정보와 AI 분석으로 종목을 분석하고, 추천 해드립니다.\n무료체험이 가능하니 받아보시고 결정하세요.', '차트를 보고\n들어가셔야 할듯\n합니다. \n주식관련 사이트 네임카드 링크드립니다.\n도움받아보시길! 주식투자 무료체험 http://bit.ly/2mugJk9', '안녕하세요 \n제약/바이오 관련주에 관심있으시면\n지금 청개구리LABS-제약바이오에서 3일 무료 리딩서비스 받아보세요!\n2008년부터 13년간의 투자 노하우로 코로나19, 치료제, 백신, 주요 질병 임상 중 한가지 이슈라도 집중해서 분석하여 수익이 나는 종목선정과 매매타이밍을 결정해 추천해드립니다.\n바로가기▼\nhttps://bit.ly/3hoZued\n청개구리 LABS X 제약바이오 TF팀\n청개구리LABS 수익 UP 무료체험 0123456789 0123456789 0123456789 , 0123456789 0123456789 0123456789 , 0123456789 0123456789 0123456789 명 요청중 제약바이오 관련주의 핵심‘코로나19’ 치료제/백신, 임상 및 개발의 파급력! 강력한 글로벌 이슈 ‘제약바이오’ 수익을 부를 모멘텀에 투자 대책이 있습니까? 2021년 하반기 제약바이오 관련주는! - 코로나19의 치료와 직간접 영향 및 미래 성장성까지 꼼꼼하게 따져야합니다. 각 개발사의 임상 및 개발환경 확...\nbit.ly']",3,https://kin.naver.com/qna/detail.naver?d1id=4&dirId=409&docId=348195515&qb=67Cx7Iug&enc=utf8&section=kin&rank=615&search_sort=3&spq=0,"경제 동향, 이론"
62,2020.10.13,"['돼지열병관련주', '#돼지열병관련주']",돼지열병관련주 뭐가있을까요,제목그대로 돼지열병 관련주좀 알려주세요,"['이글벳, 백광산업 등등 ㅋㅋ\n제 유튜브도 구독하시고 많은정보 얻어가세요~\n월급쟁이 단타꾼\nwww.youtube.com', '중앙백신이 대장주라고 볼 수 있습니다.\n주식리딩 3일간 무료체험 받아보세요.\n모멘텀플라이-성공적인 투자를 가능케 하는 대한민국 1등 리딩기업 매칭 플랫폼\n주식 투자 및 종목을 직접 권유하지 않으며, 주식 정보 및 리딩 서비스는 자체 시스템을 통해 검증된 주식 정보제공 리딩 기업이 직접 제공합니다. Momentum FLY - 모멘텀플라이\nleaderscpa.com', '참고 바랍니다.\nhttps://rasdin.tistory.com/516\n돼지열병 관련주와 그 이유 정리 / ASF 테마주\n돼지열병 관련주 모음 ASF 관련주 모음 돼지고기값 상승 관련주 종목명 종목코드 테마 편입 사유 우리손에프앤지 073560 우리손에프앤지는 돼지 등 사육·가공업체이며 이지바이오는 우리손에프앤지의 모기업이다...\nrasdin.tistory.com', '돼지 열병 관련주입니다.\n도움이 되셨으면 좋겠습니다.\n글 중간에 무료로 추천종목 받으세요.\n수익 내신 분들이 많습니다.\n돼지열병 관련주 4종목\n아프리카 돼지 열병이 실시간 검색 순위에 올랐습니다. 그이유는 경기도 북부 접경 지역에 멧돼지에서 바이러스가 검출되었다고 합니다. 아프리카 돼지 열병은 ASF라고도 하는데요. 이 바이러스는 돼지 전염병이며..\nissue.suahpark.com', '안녕하세요 질문자님^^\n돼지열병 관련주 관련하여 질문을 남겨주셨네요~\n강원 영월의 한 양돈농장에서 아프리카돼지열병(ASF) 확진사례가 나오면서 돼지열병 관련주 에 대한 관심이 커지고 있습니다.\n돼지열병 관련주 종목으로는 이글벳, 체시스, 제일바이오, 우진비앤지, 파루 등이 있습니다.\n이 외에도 리딩이 필요하시다면 아래 링크 통해서 전문가 무료상담 받아보시길 추천드릴게요!', '아프리카 돼지열병은 백신과 치료제가 없어서 발병시 모두 살처분하녀 방역 소독만이 방법입니다  \n진바이오텍은 농림축산검역본부의 ASF소독 가능 권고 소독제 종류 중 국내에서 가장 많은 5개 제품이 선정돼 있는 것으로 알려져 있다. 진바이오텍의 100% 자회사 다원케미칼은 농림축산검역본부의 ‘ASF 소독 가능 권고 소독제 종류’에 소속된 소독제 중 스피드 킬, 스톱파, 퍼펙트 존, 옵티시드 액, 다원올킬 등 최다 5개 품목의 ASF 소독제가 선정돼 있다. /양한나기자 one_sheep@sedaily.com']",6,https://kin.naver.com/qna/detail.naver?d1id=4&dirId=40102&docId=370598445&qb=67Cx7Iug&enc=utf8&section=kin&rank=614&search_sort=3&spq=0,"주식, 증권"
62,2020.10.27,[],코로나 종식,빌게이츠가 내년말에나 종식된다고 했는대 정말 그리될까요,"['ㅇㅇ', '그 어떤 질병들도 평생 가지는 못했습니다.\n역사 속에서 인류가 그랬듯이\n이번 코로나라는 질병도 지나가는 것 중에 하나일 뿐\n해결방법을 찾아낼 거에요.', '네, 빌 게이츠는 2022년에 코로나 바이러스가 종식이 된다고 했는데요.\n전세계 코로나 확진자는 4,300만명에 사망자가 116만명인데 세계보건기구는 확진자가 실제로는 세계인구의 10% 정도인 8억명으로 그리고 사망자는 2배 정도 많을 것으로 예상을 하고 있습니다.\n전세계에 코로나가 종식이 되려면 수십억명분의 백신을 만들어야 하기에 2022년을 게이츠가 말을 하지 않았을까 생각을 합니다.\n감사합니다.\nhttps://www.ytn.co.kr/_ln/0104_202009160723241561\n빌 게이츠 ""코로나19, 2022년은 돼야 종식될 것""\n[앵커]마이크로소프트 창업자 빌 게이츠가 코로나19는 내...\nwww.ytn.co.kr', '아마 그때쯤 자연적으로 잡힐겁니다. 역사적으로 봐도 다 그정도 갔어요', '빌게이츠는 천재적인 사업가지만\n신의 영역까지는 알 수 없습니다.\n코로나19가 언제 종식 될지는 아무도 모릅니다.ㅠㅠ\n마스크 꼭 착용하고 외출하시길 바래요.\n코멧 일회용 마스크\nCOUPANG\ncoupa.ng\n코멧 일회용 마스크\nCOUPANG\ncoupa.ng\n파트너스에서 소정의 커미션을 지급받을 수 있습니다.', '안녕하세요 제가 답변해드리겠습니다.  \n코로나19질병은 완전히 없어지는건 아니고요 현재로서 국민들이 백신을 맞고있는데 몇번정도 백신을 맞고나면 코로나19질병은 완전 무서운 전염병 수준에서는 벗어날것이고 그냥 일반독감수준으로 내려갈까 싶은데요 백신을 맞고나더라도 면역력을 기르는데 시간이 좀걸릴예정입니다.  다시말해 코로나가 독감수준으로 내려가면 종식된것처럼 일상생활로 돌아갈수 있을거 같습니다.  옛날에는 독감도 백신이 없어서 사람들이 지금 코로나사태처럼 고생 불편을 겪고 했답니다.  언젠간 괜찮아지니까 때를 기다리세요.   ']",6,https://kin.naver.com/qna/detail.naver?d1id=11&dirId=11080104&docId=371819244&qb=67Cx7Iug&enc=utf8&section=kin&rank=613&search_sort=3&spq=0,"표준어, 방언"
62,2020.12.27,[],미국 코로나 잠잠해진거맞죠?원래 20만명때였는데 10만명때로 간거보니까 잠잠해진건가여??백신때문인가요??내년엔 미국 여행 가능하겠죠?,,"['아닙니다. 여전히 확산중입니다.\n백신접종이 순조로우면 내년 하반기에는 미국여행 가능합니다.', '미국 코로나 확진 집계를 지난 4월 19일 부터 하고 있는데 4월에는 하루에 가장 많았던적이 34,264명이였습니다.\n그러나 12월에는 가장 많았던 날이 하루에 261,659명 ( 12월 19일 ) 이였습니다. 앞에 총 확진자 전일대비 증가를 보면 12월 매일 확진 환자 숫자를 볼수 있습니다. \n지금 날이 갈수록 더 많아지고 있고 이번 크리스마스에 많은 여행객이 여행을 했으므로 연말 정도에는 하루에 이 보다 더 많은 확진자가 나올것으로 예상하고 있습니다. \n백신이 내년 늦은 봄에 나와 내년 중반에는 여행이 가능할것으로 생각하고 있었으나 지금 백신 변종이 다시 새로 나오고 있어 백신이 나와도 안심할 상태가 아닙니다. \n지금 현재도 여행을 하고 있는 분들을 적지않게 볼수 있는데 안심하고 여행하려면 내년 후반에도 쉽지 않을것으로 예상하고 있습니다. \n코로나 상태를 보려면 여기를 눌러 보면  지금까지 매일 미국의 코로나 확진자 상태를 볼수 있습니다. \n    나바호킴 미국 여행 카페\n이 답변은 답변 작성일 기준으로 답변 한 것이므로 오랜 시간이 지나면 답변이 바뀔 수도 있으므로  검색으로 답변 참고를 할 시에 사안이 중요한 경우에는 꼭 답변 한 날짜를 보시고 새로운 정보 인가를 확인 후에 참고 하시기 바랍니다.', '아닙니다. 여전히 심각성 입니다.', '미쳤군\n여길 온다고? \n지금 여기 얼마나 심각한데..\n한국인들이 정말 축복받은 방역국가에서\n살고 있으니 전세계도 그럴 줄 아나 보네\n그만큼 쉽게 징징대기도 하고 ', '2121년 5월 13일자 CDC( Center for Disease Control and Prevention)에서 미국의 코로나 지침에 대해서 새롭게 업데이트했습니다. 백안관 브리핑에서 윌렌스키 국장은 코로나 백신을 완료한 사람들은 실내에서 더 이상 마스크를 쓰지 않아도 되고, 백신접종을 마친 사람은 작은 실내,  실외 활동 시에 사회적 거리 두기를 하지 않아도 된다는 새 권고안을 발표했답니다. 그러나 버스나 비행기 등 처럼 대중교통 이나 병원 등의 밀집된 곳에서 만큼은 마스크 착용을 유지하라고 하네요. 그리고 면역체계에 이상이 조금이라도 있다면 반드시 담당의사와 상의 후에 이 권고안을 따를 지 말지 결정해야 한다고 경고했답니다. 한국에서도 잘 알려진 앤서니 파우치 소장도 백신접종 완료한 미국인 야외에서 마스크를 쓸 필요가 없다고 역시 말했답니다. \n현재 미국에서 코로나19로 사망하는 사람은 하루에 600명대로 감소했는데, 이것은 열달만에 가장 낮은 수준의 기록이라고 하네요.  참고로 미국은 5월 12일에 12살 이상에게 코로나 백신 접종을 승인했습니다. 아마도 가을에 대면수업 정상화를 위한 노력의 하나가 아닌가 싶네요. 큰 변수가 없다면 내년 미국여행도 긍정적으로 생각해 볼 수 있지 않을까 싶네요. \n한국에서는 해외에서 해외의 백신완료자에 대한 자가 격리 면제가 검토중라고 하는데 미국에서도 이러한 분위기가 하루빨리 조성되길 바랄 뿐입니다.\n작은 도움이라도 되었기를 바랍니다.    ']",5,https://kin.naver.com/qna/detail.naver?d1id=9&dirId=9020201&docId=377006066&qb=67Cx7Iug&enc=utf8&section=kin&rank=612&search_sort=3&spq=0,미국
62,2021.02.07,"['코로나종식', '#코로나종식']",코로나 종식은 언제쯤일까요?,"코로나 종식은 도대체 언제쯤 되는걸까요? ㅠㅠ
누군가는 감기처럼 평생 달고사는 질병이 될수도 있을거라고 하고..
백신이 보급되면 종식될 수 있는걸까요?
우리나라는 백신이 전국민적으로 보급되는 시기가 언제즘일까요?","['벡신이 본격적으로 보급되면서 90%이상 접종되고\n변이 코로나또한 확실하게 컨트롤이 되면서\n확진자수가 50명 미만으로 감소할때 쯤 종식이 되지 않을까 싶은데요\n그 시기는 예측하기 어려우나 아마 올해 하반기즈음이 되지 않을까 싶습니다.\n참고로 현재 식약처에서는 백신의 허가, 심사과정이 빠르게 진행중이며\n빠르면 2~3월 중 승인이 나고 고위험, 고령자 대상으로 우선 접종이\n진행될 것으로 전망됩니다.\n코로나 종식 예상시기와 백신 관련 자세한 정보는\n아래 블로그 참고하시면 도움이 될 듯 합니다.\n코로나19 백신 현황과 종식 예상시기는?\n미국 제약사 화이자와 모더나가 잇따라 개발 중인 신종 코로나바이러스 감염증(코로나19) 백신을 발표했지만, 올해중에는 백신 승인과 생산·유통 등 여러 문제를 해결하며 코로나19 대유행병이 끝날 것으로 전망..\nm.site.naver.com', '아마 올 하반기즘이 되지 않을까 싶네요\n국내에서 백신이 최종 승인돼서 모든사람들한테 전부 보급되는 시점이 그즘일 듯 합니다.\n하지만 변이코로나라는 변수도 있기 때문에\n장담하기는 어렵습니다...', '현재 코로나19가 언제 종식 될지는 전세계 누구도 알수 없습니다.\n모든 사람들이 마스크를 잘 착용하고 다니고, 백신도 맞은 후 확잔자가 줄어드는 수치를 봐야 할것 같습니다 ㅠ\n코멧 일회용 마스크\nCOUPANG\ncoupa.ng\n코멧 일회용 마스크\nCOUPANG\ncoupa.ng\n파트너스에서 소정의 커미션을 지급받을 수 있습니다.', '아마 2~3년 더 걸릴거 같습니다.\n백신보급과 백신효과도 아직까진 미미하기 때문이죠.', '안녕하세요 제가 답변해드리겠습니다.\n코로나19질병은 완전히 없어지는건 아니고요 현재로서 국민들이 백신을 맞고있는데 몇번정도 백신을 맞고나면 코로나19질병은 완전 무서운 전염병 수준에서는 벗어날것이고 그냥 일반독감수준으로 내려갈까 싶은데요 백신을 맞고나더라도 면역력을 기르는데 시간이 좀걸릴예정입니다. 다시말해 코로나가 독감수준으로 내려가면 종식된것처럼 일상생활로 돌아갈수 있을거 같습니다. 옛날에는 독감도 백신이 없어서 사람들이 지금 코로나사태처럼 고생 불편을 겪고 했답니다. 언젠간 괜찮아지니까 때를 기다리세요.   ', '지금 코로나가 확진자가 많이 나와서 한 2024년쯤 코로나가 완전 종식될거라 생각합니다\n마스크 착용 잘하시고 무엇보다 몸 건강하게 회복하시고\n코로나 시국 외국 다 건드리는 병이라 조심하셔야합니다']",6,https://kin.naver.com/qna/detail.naver?d1id=8&dirId=80302&docId=381192227&qb=67Cx7Iug&enc=utf8&section=kin&rank=611&search_sort=3&spq=0,헤어관리
