page,date,tags,questions,questions_add,answers,N_answer,url,category
22,2021.05.13,['이혼고민'],이혼 고민....길어요..,"결혼 6년차구 남편이랑 나이차이가 좀 나요..
저흰 아들 하나 있구요..
홀시어머니 있으세요. 많이 연로하셔서 거동이 불편하세요.
남편 형제들이 많아요.
위로 형 하나, 누나들, 여동생들 있구요..
그러다보니 누나들은 저희 엄마뻘이시구요..

시어머님은 큰아들네 사시고 코로나 터지기 전부터, 한두달씩 다녀가세요..
사실 한두달씩 다녀가실 때는 넘 좋았고, 마음이 평온했어요..
혼자 제대로 씻지도 못하시니, 위생이나 청결상태도 엉망이시구
그랬는데.. 저희집에 가끔 오시면 제가 씻겨드리고.. 손발톱도 깎아드리고.. 잡수시고 싶은것도 사드리고, 대화도 나누고 하니 좋더라구요. 엄마도 어린 손주 애교에 즐거워하시고 .. 남편도 행복해하니.. 좋았어요.
밤마다 소변실수 하시는데.. 제가 냄새와 이불빨래에 지쳐서 주무실때 기저귀 차시는 것도 겨우 설득했고.. 틀니관리도 심각해서 틀니세정제 쓰시게 도와드렸네요..그리고 큰 집에 가시면 기저귀와 틀니세정제 챙겨보내구요..

문제는 코로나 터지고 부터에요.
큰집에서 코로나 때문에 어디 다니시지 못하니 답답하시다고 당분간 저희 집에 모시라고 했고..
저희집에 여러달..계시고 큰 집은 한달도 못되서 모셔가라,
또 와서 몇 달 계시다 명절에 같이 올라가면, 바로 같이 모시고 내려가라, 혹은 몇주있다 모셔가라고 하더라구요.
그래서 작년 코로나시국에 전 어린 아들을 가정보육하면서 연로하신 시어머니를 같이 돌봐드려야했어요.
아이 돌보면서 목욕부터 물 한잔까지 제 손으로 다해드려야 해서 몸도 힘들고, 하루종일 거실에서 tv를 보다가 늦은 밤 작은방으로 들어가니 전 편히 쉴 수가 없더라구요. 작은 방에 tv도 놔드렸지만 외로우신지 거실에서 늦게까지 보세요. TV보다는 저와 아이만 종일 쳐다보시는 것 같아요.
특히 아이 없을때 저만 뚫어져라 보시는데.. 가끔은 숨이 턱턱 막히고더라구요. 그리고 낮에도 소변실수가 잦으시고, 평상시에도 조금씩 새서 패드착용을 권해드려도 무조건 싫다하시니 제나름 스트레스가 있네요..

기약없이 어머니를 모시다보니.. 제가 지치고.. 우울증이 왔는지.
새벽에 혼자 거실창문앞에 쪼그려앉아 우는 날들이 생기더라구요..남편에게 나도 숨 좀 쉬게해달라고.. 이제 어머니 나이드셨고,장기전이니 서로 지치지 않게 2~3달씩 돌아가면서 모시자고, 중간에서 조율 좀 해달라고 울면서 얘기했고.. 남편도 알았노라고 해서 마음을 겨우 추스렸어요.

그러다 아이가 아파서 입원을 일주일 해야했고, 아파트인 저희집에선 혼자 아무것도 못하시는 시어머니는 큰집으로 모셔다드려야했어요. 아이 퇴원 후 일주일쯤 되니 또 모셔가라 연락오고..
알겠다고 한 남편에게.. 결국 욕을 퍼붓었어요.
아이는 한 달뒤 또수술을 해야하고, 또 두달 뒤 다른 수술도 해야하는데.. 그걸 다 알면서.. 모셔가라는 니네 형제도, 알았다고 하는 너도 지긋지긋 하다고.. 니자식은 눈에도 안보이냐고 미친듯이 퍼부었어요..
내 폭언에 울면서 젊은데 시어머니 수발들게 한 나한테 미안하고, 늙어가는 어머니가 불쌍하다누 남편을 보고.
숨 막히고.. 늘고 힘없는 어머니를 상대로..죄책감 들고.. 내가 죽어야 끝나나 싶기도 하고.. 너무 혼란스럽지만..
수술 두번이 끝나고 돌아오는 명절에 모시고 오기로하고 ..
또 서로 마음을 다독였어요
그렇게 두 달 뒤에 어머니를 모시고 오는데.. 다음 명절까지 부탁한다더라구요... 백신 맞으러 다녀오신 며칠 빼곤 추석까지 쭉 저희집에 있으시는 거죠..
그래도 코로나시국이 저희 집이 낫겠다 싶어 또 참았고,
남편도 제 고충을 안다고, 제 짜증도 받아주고 하니 나름 마음을
다스렸네요.
그런데 제 쪽을 어버이날이 있는 주에 못 가서 돌아오는 주말에 가기로 선약을 해놨는데... 갑작스런 형님들 단체방문 연락이 왔어요. 어버이날 오신다는 연락이 없으시길래, 왠지 이렇게 될꺼같아서 미리 남편에게 겹치지않게 조율을 부탁하니 연락도 없는데 또 혼자 설레발친다고 면박을 주더니, 결국 같은 날 오신대요.

그래서.. 늙고 연로하신 시어머니앞에서 큰소리로 말다툼하고, 심지어 저는 국자를 싱크대안에 던졌어요..
알아요. 시어머니 앞에서 잘못했죠. 그런데 변명하자면 저희 시어머니는 늘 거실에 계시고 다보고 듣고..하실까봐 계속 참아오니 홧병이 생기더라구요. 어느 순간 분노조절인지 못 참게 되네요.
참으려면 당신이 참아라, 당신 엄마 모셔다 논 건 너니까.. 뭐 그런 심보였던 것 같네요.. 그렇게 방에 들어와 혼자 두시간을 울고.. 그 지경에도 거실에서 tv보시는 어머니, 쇼파에서 코골고 자는 남편의 변함없는 일상에 저는.. 이혼을 심각하게 고민하고 있어요.


저는 다혈질이지만, 정에 약해서 결국은 먼저 풀릴거에요..
또 유야무야 넘어갈거고.. 나만 참으면 가정의 평화가 올거에요..
문제는 반복되다보니 제 속이 병든다는 거고..
자식만 아니면 아파트에서 뛰어내리고 싶다는 생각을 수시로 하고, 그 수많은 형제가족들 중.. 유일하게 어머니가 끓이신 미역국 한그릇 아니 어머니가 타주신 커피 한잔 못먹어 본.. 나만 늙고 병들 어머니 목욕을 시키고 수발을 드는 게 공정할까라는 생각을 해요. 그리고 모든 형제들이 본인 엄마를 나에게 떠밀어놓구선, 맘 편한데.. 왜 나만 나쁜 며느리인것같아서 자책하고 죄책감 가져야할까.. 자꾸 누군가를 원망하게 되고..
제 행동 역시 미친년 같네요.
이게 결국 저를 갂아먹고, 내 아이의 유년기를 망칠까봐 겁나요.
그래서 이혼을 고민하게 되네요.



서로 마음을 터놓고 얘기하는 건 의미가 없어요.
눈물로 살려달라고 호소하고, 확 죽고싶다고 반협박도 해봤지만시정이 안되고, 가족들에게 조율해줄 의지도 노력도.. 없어요..
제 입장에선 벽보고 사는 것같고 미치겠는데
부부심리상담센터 좀 가보자고 하니, 자기는 정상이니 너만 날뛰지말아라 하는 사람이라서.


그래도 성실하고.. 아이와 보내는 시간은 많지 않지만 , 마음으론 많이 사랑하니, 아이에게 있어야할 아빠긴 해요.. 아이는 유치원생활 4시간을 제외하고.. 모든 일상과 동선을 저와 함께 해요.. 이혼해도 아빠못봐서 힘들어 하진 않을것같구..
경제적으로 여유있게 누리는 것들이 많이 줄어들것 같아요..
내 인생만 생각하면 그냥 내뜻대로 하고싶은데, 아이의 인생이 있어 겁나고 주저하게 되네요..

아무튼
이런 상황에, 이런 이유로, 이런 마음으로 이혼하는 거 괜찮을까요?
표면적으로 시어머니 부양이 싫어서 이혼하는걸로만 보일텐데.. 제가 유책 배우자가 되는걸까요?
이혼 시 아이양육권 제가 가질수 있을까요?
남편은 절대 못준대요.


징그럽게 긴 일기써서 죄송해요. 구구절절 말할 곳이 없네요..","['가사 소송은 일반 사건보다 수월하지만\n가사법 특성에 따른 변수가 많은 절차로\n이혼 종류 및 그에 따른 대처에 대한\n자세한 자문을 받아보시기 권합니다\n 상담만 받는것은 돈이 들지 않습니다\n 변호사 선임은 필수가 아니나\n풍부한 경험이 있는 변호사의 조력은\n자신의 권리와 이익을 찾기 위한\n필수적인 과정이라 볼 수 있습니다\n※ 이혼의 종류\n- 협의이혼\n  원인의 여하 관계없이 협의를 통하여 이혼\n  ★비용은 들지않으나 시간끌기가 된다는것이 단점\n - 조정이혼\n  가사소송법에 따라 조정전치주의를 채용하여\n  재판이혼의 심판청구를 위해 가정법원의 조정을 받음\n  이혼 합의가 이루어지면 재판이혼과 동일한 효력\n  ★비용은 들지만 소송보다 저렴하며 빠른 이혼 가능\n - 재판상이혼\n  부부 일방의 이혼 원인에 의거하여\n  타방을 상대방으로 하여 법원에 이혼심판 청구\n  ★이혼사유에 해당할시 소송을 통해 결정\n※ 무료법률상담의 장점\n- 전국 무료 출장상담\n- 비공개 무료상담\n- 치밀한 분석으로 높은 승소 진행\n- 의뢰인만의 이혼전담팀구성\n- 수임료 카드결제 가능\n이혼무료상담 바로가기', '이혼은 우리가 모르는 어려운 일이기도 하지만 분명 길은 있습니다.\n그런 상황을 접하시게 되서 많이 힘드시고\n답답한 마음도 십분 이해가 갑니다.\n이럴때일수록 더 힘내시어 불이익 받지 않게 잘 해결하셔야죠\n이혼, 즉 혼인의 해소도 중요하지만 미성년 자녀에 관한 문제나 재산분할, 위자료 등\n제반 부수적인 사항도 반드시 해결되어야 하기에 더더욱 신중하게 생각하시고 꼭 \n전문가에게 무료 상담 받으셔서 원활하고 빠른 진행을 하시는게 좋을것 같습니다.\n★협의이혼:원인의 여하 관계없이 협의를 통하여 이혼하는 것입니다 (민법834조)\n★재판상 이혼 : 부부 일방의 이혼 원인에 의거하여 타방을 상대방으로 하여 가정법원에 \n이혼 심판을 청구하는 것입니다\n★조정이혼 : 가사소송법에 따라 조정전치주의를 채용하여 재판상 이혼의 심판청구를 위해\n가정법원의 조정을 받아야 함으로 조정절차에서 이혼 합의가 이루어지면 \n그것은 조서에 기재함으로써 재판상 화해와 동일한 효력을 인정받습니다.\n● 최적의 수임료(분납가능)\n★이혼전담 변호사 무료상담\n★ 상담후 승소 가능성이 없다면 수임하지 않는 것을 원칙\n● 전국 출장 상담 \n상담하시고 좋은 결과 있으시길 바랍니다\n힘내세요~~~\n●☞상담 진행 http://asq.kr/nccdFau5Iijje', '안녕하세요\n문의하신 내용 잘 보았어요\n그동안 결혼생활에 있어 많이 지치고 힘드셨군요\n이혼사유가 된답니다\n이혼에는 헤어질때 헤어지더라도 재산분할, 위자료, 양육권, 양육비는 충분하게\n권리를 주장해야 합니다\n그동안 고생 많으셨습니다\n현 상황에 경우 지식인을 통해 고민을 해결하시는것보다\n전문가분과의 무료상담을 통해 고민을 해결하심이 좋을것 같네요\n- 24시간 상담 가능\n- 전국 출장 상담 가능\n- 이혼전담 변호사 무료상담\n- 의뢰인을 위한 이혼전담팀 구성\n- 사건 의뢰시 찾아가는 서비스\n- 수임료 분납 가능\n링크 걸어둘테니 참고 하시면 된답니다\n답변에 내용이 도움 되셨으면 좋겠어요\nhttps://me2.do/IG6kY47a\n법무법인 윤중(이혼)-이혼전문변호사 | 이혼변호사 | 이혼소송 | 이혼재산분할 | 이혼소송상담 | 재판이혼\n✓이혼전문변호사비용 ✓재판이혼변호사 ✓재판이혼전문변호사 ✓이혼소송 ✓재판이혼 ✓이혼변호사선임 ✓재판이혼무료상담 ✓이혼소송변호사비용 ✓이혼소송전문변호사 ✓이혼전문로펌 ✓의정부이혼\nme2.do', '안녕하세요\n문의하신 내용 잘 보았어요\n그동안 결혼생활에 있어 많이 지치고 힘드셨군요\n이혼에는 협의이혼, 조정이혼, 재판이혼이 있답니다\n이혼에는 헤어질때 헤어지더라도 재산분할, 위자료, 양육권, 양육비는 충분하게\n권리를 주장해야 합니다\n그동안 고생 많으셨습니다\n현 상황에 경우 지식인을 통해 고민을 해결하시는것보다\n전문가분과의 무료상담을 통해 고민을 해결하심이 좋을것 같네요\n- 24시간 상담 가능\n- 전국 출장 상담 가능\n- 이혼전담 변호사 무료상담\n- 의뢰인을 위한 이혼전담팀 구성\n- 사건 의뢰시 찾아가는 서비스\n- 수임료 분납 가능\n링크 걸어둘테니 참고 하시면 된답니다\n답변에 내용이 도움 되셨으면 좋겠어요\nhttps://me2.do/IG6kY47a\n법무법인 윤중(이혼)-이혼전문변호사 | 이혼변호사 | 이혼소송 | 이혼재산분할 | 이혼소송상담 | 재판이혼\n✓이혼전문변호사비용 ✓재판이혼변호사 ✓재판이혼전문변호사 ✓이혼소송 ✓재판이혼 ✓이혼변호사선임 ✓재판이혼무료상담 ✓이혼소송변호사비용 ✓이혼소송전문변호사 ✓이혼전문로펌 ✓의정부이혼\nme2.do', '안녕하세요 질문자님,\n자녀양육권은 질문자님의 권리 이기도합니다.\n시어머니를 부양하지 않는다고하여 유책사유가 되기엔 \n다소 무리가있으며 그간 많이 힘든시간 보내셨을텐데 위로말씀드립니다.\n억울하신부분이 없으시도록 자녀문제 배우자님과 협의가 안되신다면 이혼소송 진행하시어 법적판결받으실수가 있으니 도움받으시어 진행하시는것도 고려해보시길바랍니다.\n도움되실것같아서 승소율높은 이혼법률사무소 이혼전문 여성상담원이 상주하고있는곳 무료상담 출처 남겨드리겠습니다 작은 도움이라도 되셨길바랍니다 감사합니다.\n이혼소송 무료상담 \n법무법인 윤중(이혼)-이혼전문변호사 | 이혼변호사 | 이혼소송 | 이혼재산분할 | 이혼소송상담 | 재판이혼\n✓이혼전문변호사비용 ✓재판이혼변호사 ✓재판이혼전문변호사 ✓이혼소송 ✓재판이혼 ✓이혼변호사선임 ✓재판이혼무료상담 ✓이혼소송변호사비용 ✓이혼소송전문변호사 ✓이혼전문로펌 ✓의정부이혼\nhello-dm.kr', '제2의 비트코인 pi 파이코인 빨리 채굴선점하세요.\n파이코인은100% 무료이며, 최초로 스마트폰으로 채굴하는 코인입니다.\n스탠포드 대학 박사 출신들이 개발한 코인으로 20.12기준 1000만명 넘게 이용중이며, 올해 상장예정(현재 2단계로 3단계가 되면 상장예정, 상장까지 얼마 안남았습니다. 상장까지 1년정도 남았다고 봅니다. )이라고 하며, 현재로서는 화폐가치는 없고, 보유만 가능합니다. 가지고만 있어도 손해보는게 전혀 없고 제2의 비트코인이라고 불리기 때문에 많은 사람들이 채굴중입니다. \n가입자수가 1300만명이 넘었습니다.\n현재 미국과 중국에서는 1파이당 100달러 정도의 가치로 두고 있습니다.\n처음 상장시에는 가격이 낮을 수 있지만 금방 100달러로 올라갈 것 같습니다.\n그러다가 채굴 중단이 된다면 가격은 천정부지로 뛰어 오를 겁니다.\n비트코인의 가격에 근접하거나 뛰어넘을 수 있습니다.\n현재 비트코인은 5200만원을 넘었으면 연파이낸셜이라는 코인은 최근에 4000만원이 넘었습니다.(둘다 빗썸에 상장되어있음.)\n연파이낸셜이 4000만원이 넘는 이유는 단 하나입니다. 채굴중단으로 인한 희소성으로 가격이 뛰어 올랐습니다. 파이코인도 그러니 기대해 봐도 되겠죠!!!\n다른코인들과 달리 상장가능성도 매우 높고 가격도 월등히 높을거라고 보는 이유들입니다.\n파이코인(PI Coin)은 차세대 가상화폐시장을 주도할 코인으로 비트코인에 대적할 코인이라는 기대를 한 몸에 받고 있는 코인입니다. 아직 시장에 상장되지 않았으며, 시작점에 있는 코인이라고 하여도 무방한 신생 코인입니다\npi network 다운>>https://minepi.com/flash0928\n1. 가입 방법\nContinue with Facebook\nContinue with phone number\n페이스북 or 전화번호 둘중 하나로 가입하시면 되겠습니다\n2. Set up your password\n(비밀번호 설정)\n대문자 포함 8자리로 비밀번호를 설정하시면 되겠습니다\n3. Setup your account\n(계정 설정)\nFirst Name = 이름(영문)대문자\nLast Name = 성(영문)대문자\nChoose your username = 사용할 아이디\n다 적으신후 아래 SUBMIT 클릭\n4. 추천인 설정\nInvitation code = flash0928\n를 적으신후 다시 SUBMIT 클릭\n( 추천인 설정을 해주시면 채굴량이 늘어납니다 )\n그리고 나서 보이는 화면 오른쪽 번개 표시를 한번만 클릭해주시면\n앱을 종료시켜도 알아서 채굴하니 신경 쓰실 필요도 없습니다\n(한번 클릭 후 24시간 후 다시 클릭해 주시면 되겠습니다)', '안녕하세요?\n작성하신 내용을 살펴보았는데요.\n현재 상황에 처해계신 어려움으로 인해\n많이 힘드실꺼라 생각됩니다. \n질문자님께서는 분명 어떻게 해야하나 \n생각정리도 안되실꺼고 답답하시기만\n할겁니다. \n아무래도 재산문제라든가 위자료문제라던가\n아이문제라던가 막막하시기만 하실텐데요\n이런문제는 지식인보다 \n하루빨리\n전문 변호사님과 상담하시어\n방법을 찾으시는것이 \n제일 현명한 방법입니다. \nㅡ 전국 출장 상담 가능\nㅡ 책임감 있는 이혼소송!\nㅡ 이혼 전담 변호사 무료상담\nㅡ 의뢰인을 위한 이혼전담팀 구성\nㅡ 재산분할 / 위자료 / 양육권 / 상속등 권리 주장\n이혼 전담 변호사분들만 모여계신곳이라 그런지\n친절하게 성심성의껏 상담해 주셨어요\n무료상담이라 별 기대는 안했었는데\n자기일인것처럼 이것저것 말씀도 해주시고 \n위로도 해주시고 정말 고맙드라구요\n상담 비용은 일절 발생하지 않으니 \n편하게 상담 받아보시길 권해드립니다. \n변호사 무료 상담 신청하기 : \nhttps://url.kr/8gqxif\n걱정많으시겠지만. \n차근차근 꼬인매듭 풀듯이 해결하시길 바랄께요\n원하시는 좋은결과 얻으시길 바랍니다. 힘내시구요. ', '안녕하세요.\n가족문제해결법 카페에 방문하셔서 도움받아보세요.\n상처 받은 마음을 위로 받고 현실적인 해결까지 보는 카페입니다.\n가족문제(고부문제, 자식문제, 부부문제, 부모문제 등) 뿐만 아니라 우울증, 분노조절, 심리치료 등\n전문상담사님의 심리 게시글들을 확인하실 수 있습니다.\n현재 유튜브를 통해서도 많은 분들의 마음을 대변하고 있으며 \n가족문제해결법만의 새로운 보금자리인 카페를 오픈하여 보다 더 많은 분들이 위안을 받고\n정보를 공유할 수 있도록 가족문제 및 심리자가진단에 큰 노력을 다하고 있는 카페입니다\nhttps://cafe.naver.com/carelaw']",8,https://kin.naver.com/qna/detail.naver?d1id=6&dirId=60204&docId=389660047&qb=67Cx7Iug&enc=utf8&section=kin&rank=214&search_sort=3&spq=0,"가족, 이혼"
