page,date,tags,questions,questions_add,answers,N_answer,url,category
32,2016.04.07,['#가다실접종'],자궁경부암 가격 어떤가요?,"자궁경부암 가격이 궁금해요.
자궁경부암 검진 받아야하는데,
가격이 비쌀까봐 걱정되네요.
주사도 한번으로는 안되고 여러번 맞아야한다던데,
몇회 맡아야하는지, 가격은 어느정돈지 궁금해요.
강남역 근처 산부인과로 알려주세요.
자궁경부암 가격과, 주사 종류도 자세히 알려주세요.","['안녕하세요~ 자궁경부암 가격에 대해 질문 주셨네요!\n자궁경부암은 여성암 2위인 만큼 위험한 질병입니다.\n하지만 유일하게 예방접종이 가능한 질병이니 안심하세요!\n자궁경부암 예방접종을 하는것이 중요한 이유입니다.\n교대역과 구로역에 위치한 산부인과에서는 가다실을 이용하여 접종을 해드리는데요,\n가다실은 자궁경부암 발생의 주된 원인인\n4가지 인유두종바이러스를 예방하는 자궁경부암 백신으로\n자궁경부암 뿐만 아니라 자궁내에 생식기 사마귀, 질암 등의 예방도 가능합니다.\n자궁경부암 가격 저렴한 이곳에서 검진과 백신접종을 동시에 해보세요~\n또한 수유중에도 접종이 가능하다는 점 잊지마세요!\n하지만 가다실 접종을 하더라도 정기적인 산부인과 검진과\n자궁경부암 검진을 꾸준히 받는것이 중요한데요,\n이곳에서는 미혼여성검진, 웨딩검진, 산전검진 등\n여성을 위한 다양한 검진을 준비하고 있으니 참고하세요~\n검진 전에는 전문상담원이 1:1 맞춤 상담을 통해\n개개인에게 맞는 프로그램과 합리적인 비용으로 도와드리고 있으니\n언제든 내원하셔서 자궁경부암 가격 저렴함게 이용하세요~', '안녕하세요. 성남시 수정구 수진역 4번출구 인근에서 소음순성형, 여성 곤지름(콘딜로마, 생식기사마귀), 성인예방접종(폐렴, 대상포진, 자궁경부암-가다실)을 중점적으로 하는 산부인과 전문의 변재광입니다. \n자궁경부암 예방접종은 미혼이나 관계를 시작하기 전에 접종할 수록 효과가 높지만 기혼자나 성관계 경험이 있는 경우도 70~80%의 예방효과가 있습니다.\n가다실9은 HPV 감염에 의한 자궁경부암, 외음부암, 질암 (여성 해당), 항문암 및 생식기 사마귀 등을 예방할 수 있으며, 성별 관계 없이 남녀 모두 접종할 수 있는 HPV 백신입니다.\n가다실9 경우 1회에 14만5천원입니다. 지역에 따라서 다를 수 있습니다\n인유두종바이러스(HPV)는 성적 접촉을 통해 주로 전염되며 성생활을 하는 남녀 누구나 감염될 수 있는 바이러스로 성인인구의 70%는 일생동안 한번의 생식기 HPV감염을 경험할 수 있습니다.\nHPV는 자궁경부암의 약 70%, 여성 생식기사마귀(곤지름, 콘딜로마)의 약 90%의 원인으로 알려져있습니다.\n2006-2011년 만 18-79세의 우리나라 성인 여성 6만명 대상 조사 결과, 평균 약 3명 중 1명에서 HPV 감염이 보고되었고 그중 만 18-29세의 젊은 여성에서 가장 높은 약 50%에 가까운 높은 HPV 유병률을 보였습니다. 미국에서는 성생활을 하는 여성 중 50세가 될 때까지 HPV에 감염될 수 있는 비율이 80% 이상이라고 예측하고 있습니다.\n특히 여성 곤지름(콘딜로마, 생식기사마귀)에 대한 예방이 가능한 유일한 백신은 가다실입니다.\n자궁경부암 예방접종은 현재 세가지 종류의 백신(가다실4가 가다실9가, 서바릭스)접종이 가능하며 세가지 백신 모두 자궁경부암을 90% 예방할 수 있고, 이전 HPV에 감염된 적이 있는 경우도 70~80%의 예방효과가 있습니다.\n곤지름의 잠복기는 평균 3개월이고 1~2년 정도 후에도 발현되는 경우도 있으며, 개인차가 있기에 정확한 잠복기간을 확인하기는 어려운 부분이 있습니다. 단, 전염성이 높은 바이러스성 질환이기 때문에 꼭 성관계가 아니어도 다른 이유로 감염되었을 가능성도 충분히 있습니다. 또한 곤지름은 재발할 확률이 높은 질환으로 치료 후에도 바이러스가 체내에 남아 있는 경우도 있습니다.\n곤지름 발병은 인유두종 바이러스(HPV)에 취약하다는 증거가 될 수 있으므로, 다른 유형의 감염이나 자궁경부암예방을 위해 가다실 등 자궁경부암 예방접종을 하시는 것이 좋습니다. 자궁경부암 예방 접종은 이미 발생한 자궁경부암의 치료에는 아쉽게도 도움이 되지 않지만, 다른 유형의 인유두종 바이러스로 인한 질병은 예방할 수 있기 때문에 곤지름 치료를 받은 환자라면 반드시 접종하시도록 권하고 있습니다.\n자궁경부암은 현재 우리나라에 여성암 중 2위를 차지할 만큼 발생률이 높은 암입니다. 자궁경부암 예방접종은 암 발생 전 백신으로 예방할 수 있는 현존하는 유일한 백신으로 안전성과 효과가 국내에서도 충분히 입증되어 있습니다.\n가장 좋은 건 남자친구분도 곤지름까지 예방하는 자궁경부암백신주사를 접종하시는 게 좋겠구요.\n자궁경부암 예방접종은 미혼이나 성생활을 시작하기 전에 접종하면 효과가 훨씬 높지만, 기혼자나 성생활 중인 여성도 충분한 예방 효과를 얻을 수 있습니다. 답변내용 도움되셨길 바랍니다.', '안녕하세요! 반갑습니다!\n질문자님에게 아래와 같은글이 도움이 될까 하여 자궁경부암 관련글 남겨두고 가겠습니다!\n참고하셔서 질문자님에게 조금이라도 도움이 되셨으면 합니다!^^\n항상 행복하고 좋은일들만 가득하시길 바랍니다!!\n▼자궁경부암 총정리 관련글 바로가기']",3,https://kin.naver.com/qna/detail.naver?d1id=7&dirId=70116&docId=249708763&qb=67Cx7Iug&enc=utf8&section=kin&rank=314&search_sort=3&spq=0,암센터
32,2017.07.27,['#대상포진예방접종'],대상포진예방접종 ? 관리는..?,"대상포진예방접종 있다고 들었는데 이거 맞게되면 무조건 예방되는건가요?>
할머니할아버지들도 해당사항있는말인건지 ..
대상포진예방접종 후 관리는어떻게 해야효과적인지
맞아보신분이 있다면 정보좀 자세히좀 주세요 친정엄마가 작년에 대상포진 한번왔었고 최근들어서 많이 힘들어하시고 몸도 안좋으셔서 걱정되서요 ㅠㅠ 관리가필요할듯해서요 대상포진예방접종 하는데 좋은거나 후 관리법 좀 부탁드려봅니다 면역력이 너무 안좋아지신상태라 걱정이많이되네요","['대상포진 예방접종은 50세이상에게만 사용토록 허가를 받았으나 60세이상에게 추천 사용되먀 면역력이 약한 60대 경우 예방율은 55% 수준이고 신경성통증 경감율은 65% 수준이라하며 70대 경우는 더욱 낮아집니다.\n\n따라서 이작 50세 이전이면 예방접종은 하지 마세요.', '안녕하세요. 성남시 수정구 수진역 4번출구 인근에서 성인예방접종(폐렴, 대상포진, 자궁경부암-가다실)을 중점적으로 하는 산부인과 전문의 변재광입니다. \n수두 앓은 적 있는 중년은 대상포진 예방접종이 필요한데요.\n50대 이상 연령이 접종 대상이지만, 개인의 면역력에 따라 젊은 연령층에서도 환자가 빈번히 발생하고 있습니다. \n특히 40대이후의 만성질환자, 암환자, 가족력있는 경우는 고위험군으로 분류되고 일부림프종환자 경우 25%까지 대상포진에 걸린다는 보고가 있습니다. 건강보험심사평가원에 따르면 대상포진환자는 최근 5년간 꾸준히 증가하고 있습니다.\n수두균은 어른에게 발병할 때 더욱 치명적인 대상포진으로 나타나는 데 유년기에 수두를 앓은 적이 있다면, 치료 후에도 사라지지 않고 척수 속에 잠복해 있던 바이러스가 면역력이 약해졌을 때 대상포진으로 발병하기도 합니다. \n대상포진은 수두바이러스가 신경세포에 잠복해 있다가 면역력 악화 등의 원인에 의해서 재활성 되어 증식되면서, 피부에 수포를 동반한 발진 증상이 나타나는 질환입니다. 대상포진은 주로 과거에 수두에 감염 되었던 사람에게서 나타납니다.\n수두와 마찬가지로 치료법은 없지만 4주정도 지속하다 자연치유가 되며 경도가 심한 경우 의사 처방인 항바이러스제 1주일간 복용으로 바이러스 활동기간을 단축 시켜 빠른 치유 및 후유증인 신경성 통증 경감에 도움이 됩니다.\n대상포진은 극심한 통증 때문에 악명이 높고, 흉터나 신경통, 발진 부위에 따라 시력 저하 등의 후유증을 남길 수 있어 예방과 조기 치료가 매우 중요합니다. 피로 누적이나 스트레스 등으로 인해 면역력이 약화될 때 생기기 쉬우므로 평소 건강 관리가 중요합니다. 재발방지를 위해 적절한 운동과 균형 잡힌 식습관, 규칙적인생활, 과로와 과음, 과식, 스트레스를 피하는 등 신체 면역 기능을 꾸준히 강화 하는 것이 좋습니다.\n대상포진에 취약한 경우라면 예방접종을 통해 감염을 막을 수 있습니다. 1회 접종으로 60~70%의 예방효과가 있는 것으로 알려져 있으며, 신경통 발생 가능성 역시 60% 정도 감소시키는 효과가 있습니다. 따라서 미리 대상포진 예방접종을 한 사람이라면 대상포진을 앓더라도 더 가볍게 앓고 지나갈 수 있습니다.\n따라서 영유아기부터 유년기에 수두를 앓은 적이 있다면, 대상포진 예방접종은 미리 해주시구요. \n대상포진예방백신 조스타박스는 11만5천원인데 병원에 따라 가격이 다릅니다.\n코로나 사태로 면역력이 더욱 중요해진 이때, 백신은 면역이 약한 유·소아들만 접종하는 것으로 생각하기 쉬운데, 고령층은 물론 성인도 백신 접종 대상의 예외가 아닙니다. 유년기에 수두를 앓은 적이 있다면, 치료 후에도 사라지지 않고 면역력이 약해지면서 발병합니다.\n대상포진이나 감기 및 폐렴 같은 감염성 질환은 면역력이 저하될 때 생기는 질환인 만큼, 외출 후에는 반드시 손을 깨끗이 씻고 예방접종을 해두는 것이 필요합니다. \n예방접종으로 모든 질병을 100% 예방할 순 없지만, 지금까지 증명된 가장 효과적인 예방방법임에는 분명합니다. 따라서 감염성 질환에 취약한 만성질환자의 경우 접종이 필요한 시기별로 적극적으로 백신을 접종해야 하며, 규칙적인 식생활과 충분한 운동, 정기 건강검진을 거르지 않고 꾸준히 받는 등 평소 건강관리에 신경쓰는 것이 중요합니다.\n답변이 도움이 되었길 바랍니다.', '안녕하세요! 많은분들이 궁금해 하시는 대상포진 관련글 남겨두고 가겠습니다!\n아래 참고하셔서 도움이 되었으면 합니다~!\n항상 좋은 행복한 일들만 가득하시길 바랍니다^^\n▼대상포진 관련글 바로가기', '예방접종을 통해 감염을 막을 수 있으며,\n1회 접종 시 6~70%의 예방효과가 있고, 신경통 발생 가능성이 60% 정도 감소된다고 해요!\n대상포진은 흉터나 신경통, 시력 저하 등의 후유증이 남을 수 있어 예방과 조기 치료가 중요해요\n피로나 면역력 저하, 스트레스 등으로 인해 생길 수 있기 때문에\n평소에 균형 잡힌 식습관과 운동,  규칙적인 생활습관, 스트레스 관리해주시는 게 도움됩니다\n피로회복과 면역력 강화를 위해 비타민 복용하시는 것도 권해드려요\n참고하시면 좋을 것 같아 비타민 인기순위 사이트 추천해드릴게요!\n판매순, 후기많은순으로 정렬되어있어서 보기 편하더라구요\n도움됐으면 좋겠네요~\nhttp://www.cjgmarket.co.kr/shop/search.php?sfl=wr_subject%7C%7Cwr_content&sop=and&q=%EB%B9%84%ED%83%80%EB%AF%BC&ritem=175\n비타민 - 비타민 | 최저가마켓\n비타민 | 최저가마켓\nwww.cjgmarket.co.kr', '100프로는 아니예요 그래도 안맞는것보다는 대상포진예방접종 하는게 낫죠\n대상포진이 온다고 해도 심하게 안오고 힘들지않게 이겨낼수있거든요 \n면역력이 관건인 대상포진은 예방접종만 해도 훨씬나은데 그러지못했다면\n음식이나 운동등 기본적인 관리로도 예방이 됩니다 \n면역력을 높여주면 그게 대상포진 예방을하는건데 예를들면 저 같은 경우엔\n운동도 꾸준히 하면서 항상 완도정우청해원에서 만든 진액을 먹습니다 이게\n기력회복에도 좋고 면역력관리하기에도 아주괜찮더라구요 덕분에 10년전에\n대상포진 겪은이후로 몸도 건강하고 면역력하락되는거 없이 잘지내고 있습니다', 'https://tv.naver.com/v/13309503\n방송 참고하세요. \n면역력 강화, 항암으로 유명한 시베리아차가버섯 추출분말을 추천합니다.\n""<신이 인간에게 준 마지막선물>이라고도 불리는 차가버섯은\n북반구에서 자작나무 등에 기생해 자라는 버섯으로\n항암 효과와 면역효과가 뛰어난 기능성 식품으로 알려져 있다.""\n차가버섯에 대하여 지식백과에서는 짧지만 핵심적으로 이렇게 요약을 하고 있습니다.\n차가버섯은 북위 45도 이상 자작나무에서 생성된 것이 가장 효능이 좋습니다. \n그렇다면 차가버섯에 있는 어떤 성분들이 면역력을 키워주고 항암작용을 할까요?\n차가버섯에는 상황버섯 10배 이상의 베타글루칸을 함유하고 있는데요.\n이 베타글루칸에 대해 간단히 알려드리자면 버섯에 많이 함유된 영양소로,\n체내 면역세포인 백혈구, NK세포 등의 기능을 활성화시켜 면역력을 증진시켜주고,\n혈중 콜레스테롤을 줄여 지질대사를 개선시켜 주며\n따라서 피부 재생 및 보호도 되며 체내 유해 활성산소 제거, 항균작용 등을 합니다.\n폴리페놀이라는 성분은 DNA보호, 항산화 효과로 노화 방지하며, 항암,\n질병에 대한 저항도를 높여줍니다.\n베툴린산은 면역력 향상, 항염증, 항암 효과, 활성산소 제거 염증과 암에 좋습니다.\n\'이노시톨\'이라고 들어보셨죠?\n이노시톨도 다량 함유되어 있습니다.\n간 내 지방 분해, 인슐린 저항선, 지방 대사 촉진 등으로 혈당관리에 도옴주며 탈모예방, 호르몬 불균형 개선하여 우울감, 불안등을 해소시켜주며\n몸 내 노폐물배출 및 호르몬 개선에 도움을 줍니다.\n[시베리아차가버섯] 검색하시면 세계적으로 유명한 \'바이칼허브\'사 금색 파우치로 된 직수입한 최고 품질 제품 크로모겐 성분량이나 가성비 좋은 것들 있습니다.\n가격도 합리적이고 크로모겐 함량도 높고 믿을 수 있습니다. \n차가버섯 추출분말 안 드셔 본 사람들은 많을지 몰라도 한번 드신 분들은 그 효능을 알기에 계속 드십니다.\n추천합니다.']",6,https://kin.naver.com/qna/detail.naver?d1id=7&dirId=7010107&docId=281305670&qb=67Cx7Iug&enc=utf8&section=kin&rank=313&search_sort=3&spq=0,감염내과
