page,date,tags,questions,questions_add,answers,N_answer,url,category
7,2020.10.13,[],코로나때문에 정은경본부장이 머리카락이 하얐게 센 건가요.?,,"['안녕하세요\n나이도 있고 고생도 하고 그래서겠죠\n염색도 안 하기도 하고.\n답변이 도움 되셨다면 ""포인트로 감사""로 마음을 전해 주세요^^', '네, 제가 생각을 하기에는 코로나 바이러스로 인해 질병보부가 상당히 바쁘기에 염색을 하기가 어려울 정도인것 같습니다.\n업무가 많다 보니 머리카락에 신경을 쓸수가 없는 것이죠.\n방송에서도 정은경 질병 관리청장의 머리카락 하얀것을 두고 화제가 되기도 했습니다.\n내년에 백신이 나온다면 다시 머리카락이 정상적으로 돌아 오지 않을까 생각을 합니다.\n감사합니다.']",2,https://kin.naver.com/qna/detail.naver?d1id=11&dirId=1111&docId=370581074&qb=67Cx7Iug&enc=utf8&section=kin&rank=64&search_sort=3&spq=0,"철학, 심리철학"
7,2020.10.13,[],USB 가 이상해요 도와주세요 ㅠㅠ,"중고로 산 usb인데 들어가 보니 이런 파일들만 있고
삭제하거나 이름을 수정 할 수도 없다네요
게다가 파일을 안에 만들었었는데
뺐다가 다시 연결하니깐 파일이 없어져 있어요
이거 어떡하죠 못 쓰는 건가요..??","['바이러스 감염 이 의심 됩니다. \n일단 포멧 하시고 저장 장치로 사용 하세요.. 백신 검사도 해보시구요', '안녕하세요 \nusb 드라이버를 오른쪽 마우스 틀러서 포멧을 진행해보세요 ', '악성코드 감염된것 같은데 포맷하시면될것 같아요.\n<포맷시 아래 내용 참고하세요>\n먼길 떠나는 나그네 질문) NTSC 방식으로 포맷되어 있는 USB 16GB에 mp3 음악을 복사하여 차량용 USB에 꽂아들으려고 했더니 인식이 안됩니다. 컴퓨터에서는 인식이 잘됩니다. 해결방법을 알려주세요?\n커미와 명구 답변) 네, 우선 USB에 있는 모든 자료를 컴퓨터에 백업해놓고, USB를 FAT32방식으로 포맷후 컴퓨터에 저장되어있는 MP3파일을 복사해서 사용하면 잘 들립니다.\n<참고자료>\n1. NTFS [ NT file system ] \nNT file system의 약어. 윈도 NT의 출시에 맞추어 마이크로소프트는 더욱 빠르고 안정적인 디스크와 파일 접속 기능을 제공하기 위해 오래된 MS-DOS FAT를 32비트 방식으로 대체했다. 그렇지만 불행히도 NTFS는 FAT와 호환되지 않고, 윈도 NT만이 NTFS 포맷 드라이브를 읽고 쓸 수 있다.\n4GB가 넘는 크기의 파일도 자유자재로 전송, 복사할 수 있습니다.\nFull-HD 고화질, 고용량의 동영상도 볼 수 있습니다. 빠르고 쉽게 PC에서 바로 복사하여 다양한 컨텐츠를 감상할 수 있습니다. 단 MP3의 내장메모리에 한에서만 사용할 수 있습니다.\n출처:네이버 지식백과\n2. FAT32 [ file allocation table 32 ] \nfile allocation table 32의 약어. FAT16을 확장하여 테이블 길이를 32비트로 한 FAT.디스크 이용 효율면에서는, 1GB를 초과하는 디스크 클러스터 크기는 FAT16에서는 32KB이지만 FAT32에서는 4KB면 충분하다. 또한 디스크를 1드라이브로 해서 취급할 때의 크기도 FAT16에서는 2GB인 데 비해, FAT32에서는 2TB(1TB=1,024GB)가 된다. FAT32는 윈도 95 OSR2에서 채용되어 윈도 98에서는 표준 탑재되고 있다.\n도스(DOS,Disk Operating System)의 파일 시스템에서 디스크의 파일 위치 정보 등을 기록하는 영역을 나타내었으나, 이후 MS-DOS에서 채용한 FAT을 사용하는 파일 시스템의 이름을 가리키게 되었다. \n파일 할당 테이블이라는 뜻으로, 윈도우즈 계열의 운영체제에서 사용하는 표준 파일 포맷이다. 마크 맥도널드(Marc McDonals)에 의해 개발되었으며, MS-DOS 이후 윈도우ME까지 일반 가정용 운영체제의 파일 포맷으로 사용되었다. 윈도우NT 계열의 운영제체에서도 사용 가능하지만 보안 등의 문제가 발생할 수 있어 이용이 권장되지는 않으며, FAT을 이용하는 상황에서는 동작 제한도 존재한다.\nFAT는 플로피 디스크 시대에 설계되었기 때문에 디스크 용량에 있어서 관리 영역이 적어도 빠르게 접근할 수 있다. 구현이 용이하고 읽고 쓸 수 있는 운영체제가 많기 때문에 플로피 디스크나 소용량 메모리 카드, 디지털 카메라 혹은 비디오 게임 기기 등의 파일 시스템으로 여전히 사용되고 있다. 반면 대용량 디스크에 대해서는 비효율적이며, VFA(Virtual File Allocation Table)을 지원하지 않는 경우 확장성이 부족한 파일 이름(8문자+3확장자로 제한)만을 지원한다. 또한 타임스탬프(time stamp)가 현지시간으로 고정되므로 시간대를 넘어서 사용하거나 서머타임제로 시간이 다른 경우 파일 변경 시간이 제대로 표시되지 않는 등의 단점이 있다.\nFAT클러스터 번호의 관리를 위한 비트 수에 따라 FAT12, FAT16, FAT32 등의 세 종류가 있다. 윈도우에서는 FAT32를 제외하고는 FAT로 표기하고 있다. 또한 드물게 FAT64를 볼 수 있으나, 이는 윈도우NT에서 사용 가능한 클러스터 크기가 64KB라는 것으로 클러스터 번호의 비트 수를 나타내는 것은 아니다. 이동식 미디어의 파일 포맷으로는 FAT16과 FAT32가 많이 사용되고 있지만, 볼륨 및 파일 크기 제한 등의 문제들로 인해 exFAT(extended File Allocation Table)이 개발되었다. ']",3,https://kin.naver.com/qna/detail.naver?d1id=1&dirId=1010405&docId=370580831&qb=67Cx7Iug&enc=utf8&section=kin&rank=65&search_sort=3&spq=0,"외장하드, 저장장치"
7,2020.10.13,[],중학 무료독감주사?,,"['중학생 독감무료 접종\n10.13일부터 다시 시작 입니다.\n<독감 무료접종 대상> 독감 예방접종 대상자\n독감 예방접종 무료대상 3가 4가 2020 독감 무료접종 대상자 조회/기간 _ ■독감 무료접종 대상 2020년 9월 8일부터 어린이와 임신부, 어르신을 대상으로 무료 독감 예방접종이 시작된다. 2020년은 올해는 중고생..\ndingdo.tistory.com\n위는 독감예방접종 대상자 조회 안내 입니다\n(무료접종, 기간, 지정병원)', '10월 13일 부터 12월 31일 까지입니다.\n독감 무료접종 대상 완벽정리(최신)\n독감 무료접종 대상 완벽정리(최신) 요즘 독감 무료접종이 핫이슈입니다. 바로 상온 노출로 인한 변질의 우려와 해당 물량이 풀리게 되면서 자칫 변질된 백신을 투여받게 되는게 아닌가 하는 불안감 때문에 더욱..\nkingthecarrot.tistory.com', ""위에 질문주신 내용은 정확히 모르겠네요. 혹시나 아래 내용도 참고해보시면 좋을 것 같습니다.\n무료독감 백신 예방접종 대해서 정리하였습니다. 한번 참고해 보시면 도움이 될 것 같습니다. 도움이 되셨다면 채택 부탁드립니다.\n▼ 무료 독감 백신 예방 접종 신청\nhttps://info.dinoa.xyz/140\n무료 독감 백신 예방 접종 신청방법 (++홈페이지 링크)\n하늘 아래 다양한 정보를 전달하는 하 늘 정 보 입니다. 오늘은 '무료 독감백신 예방접종' 에 대해서 알아보겠습니다. 목차 2020년 무료 독감백신 예방접종 신청방법 국가에서는 '인플루엔자 국가예방접종 지..\ninfo.dinoa.xyz\nhttps://realtime.dinoa.xyz/362\n독감 무료예방접종 사업 다시 시작 (++최신 업데이트)\n독감 무료예방접종 신청 목차 독감 무료예방접종 사업 재개 유통 중 '상온 노출' 사고로 접종이 중단되었던 2020∼2021절기 겨울철 인플루엔자(독감) 예방접종 사업이 13일부터 전국 보건소와 2만1000여곳의 접종..\nrealtime.dinoa.xyz"", 'https://m.blog.naver.com/bsb9587/222087297614\n2020년 무료독감(어린이,학생) 접종시기\n전국적으로 무료독감 접종이 시작되었습니다.아시다시피 올해부터는 #4가 독감백신 접종이 무료로 진행되는...\nm.blog.naver.com']",4,https://kin.naver.com/qna/detail.naver?d1id=5&dirId=5010602&docId=370580770&qb=67Cx7Iug&enc=utf8&section=kin&rank=66&search_sort=3&spq=0,안드로이드폰
7,2020.10.13,[],독감 무료접종 유료접종,"중학생인데요 오늘 접종하려고 하는데

1. 무료접종시, 백신에 문제 없는걸로 다 바뀐거죠?
2. 유료랑 무료랑 돈 말고 어떤 차이가 있을까요?
3. 어떤걸 맞는게 더 좋을까요?","['1. 네 그렇습니다 상온노출 백신 전량회수 입니다.\n2. 유통과정만 차이지\n약품엔 차이가 없습니다.\n3. 똑같습니다...\n<독감 무료접종 대상> 독감 예방접종 대상자\n독감 예방접종 무료대상 3가 4가 2020 독감 무료접종 대상자 조회/기간 _ ■독감 무료접종 대상 2020년 9월 8일부터 어린이와 임신부, 어르신을 대상으로 무료 독감 예방접종이 시작된다. 2020년은 올해는 중고생..\ndingdo.tistory.com\n위는 독감예방접종 대상자 조회 안내 입니다\n(무료접종, 기간, 지정병원)', ""위에 질문주신 내용은 정확히 모르겠네요. 혹시나 아래 내용도 참고해보시면 좋을 것 같습니다.\n무료독감 백신 예방접종 대해서 정리하였습니다. 한번 참고해 보시면 도움이 될 것 같습니다. 도움이 되셨다면 채택 부탁드립니다.\n▼ 무료 독감 백신 예방 접종 신청\nhttps://info.dinoa.xyz/140\nhttps://realtime.dinoa.xyz/362\n무료 독감 백신 예방 접종 신청방법 (++홈페이지 링크)\n하늘 아래 다양한 정보를 전달하는 하 늘 정 보 입니다. 오늘은 '무료 독감백신 예방접종' 에 대해서 알아보겠습니다. 목차 2020년 무료 독감백신 예방접종 신청방법 국가에서는 '인플루엔자 국가예방접종 지..\ninfo.dinoa.xyz"", '1. 문제있는건 다 회수하는 걸로 알아요`\n2. 품질에는 전혀 차이가 없고 유통과정만 달라요.\n3. 무료?!\n더 많은 정보를 원하시면 방문해주세요~\n독감 무료접종 대상 완벽정리(최신)\n독감 무료접종 대상 완벽정리(최신) 요즘 독감 무료접종이 핫이슈입니다. 바로 상온 노출로 인한 변질의 우려와 해당 물량이 풀리게 되면서 자칫 변질된 백신을 투여받게 되는게 아닌가 하는 불안감 때문에 더욱..\nkingthecarrot.tistory.com']",3,https://kin.naver.com/qna/detail.naver?d1id=7&dirId=70115&docId=370580631&qb=67Cx7Iug&enc=utf8&section=kin&rank=67&search_sort=3&spq=0,소아청소년과
7,2020.10.13,['#동영상답변'],코로나 증상,제가 오늘 일어나니 기침이 그냥 나오던데 5번 정도 그뒤로는 잘 안나오는거 같긴한데 열은 안나도 기침은 그냥 가벼운거같고 가래 조금 나오네요 저희지역은 그래도 좀 있는편이라 걱정이되네요,"['코로나는 무증상부터 시작합니다.\n아래에서 날짜별 코로나 증상 알아보세요 (1일차~9일차)\nhttp://m.site.naver.com/0DPQC\n코로나 날짜별 증상, 순서\n미국 서던캘리포니아대 연구진이 호흡기 감염 질환 임상 데이터를 비교 분석한 결과, 코로나19 환자들이 겪는 여러 증상은 일정한 순서를 따르는 것으로 나타났다. 코로나 증상 순서  코로나는 다른 호흡기질환과..\nm.site.naver.com\n도움되셨다면 채택 부탁드립니다~\n감사합니다.\n.', '초기감기 증상 또는 환절기로 인한 단순 기침일 수도 있습니다.\n코로나19 바이러스 감염증 으로 보기는 어렵습니다.\n코로나19 증상과 감기는 증상만으로 구분이 어렵습니다.\n코로나19 바이러스 감염자의 80%는 별다른 치료 없이 스스로 치유되거나 무증상 완치되거나 경증만 겪는 것으로 통계 되고 있습니다.\n문제는 코로나19 바이러스 감기(폐렴) 입니다.\n특징적인 것은 코로나19 바이러스 감기(폐렴)은 콧물이 없는 마른 기침이 주 증상으로 시작되는 새로운 유형의 코로나 바이러스 19 감기(폐렴) 입니다.\n1. 코로나19는 목구멍을 먼저 감염시켜 목구멍이 3 ~ 4 일 동안 지속되는 건조한 인후통을 느낍니다 \n2. 코로나바이러스 19가 코액에 혼합되어 기관지를 통과해 폐로 들어가 폐렴을 일으킵니다. \n이 과정은 5-6 일이 소요됩니다. \n3. 폐렴으로 고열과 호흡 곤란이 발생하여 비강(코)가 물에 빠진 것처럼 답답하게 느껴지는데 이런 느낌이 든다면 전화 1339 상담 받으시고 즉시 의사의 진료를 받아야 합니다.\n독감 감기 빨리 낫는 법 코로나 19 COVID-19 치료법\n코로나19와 감기 증상 차이점 코로나19 증상과 감기는 증상만으로 구분이 어렵습니다.특징적인 것은 코로나19 바이러스 폐렴은 콧물이 없는 마른 기침이 주 증상으로 시작되는 새로운 유형의 코로나 바이러스 19 폐렴 입니다.1. 코로나19는 목구멍을 먼저 감염시켜 목구멍이 3 ~ 4 일 동안 지속되는 건조한 인후통을 느낍니다 2. 코로나바이러\nm.cafe.daum.net\n제약공학연구원', '네, 환절기라 기침등이 날수가 있는데 기침등으로 코로나인지는 전혀 알수가 없고 선별진료소에서 진단키트로 검사를 해야 정확하게 알수가 있습니다.\n감기 일수도 있기에 걱정을 하지 않아도 될것 같습니다.\n기침이 만약에 심하다면 병원 등에서 약을 먹어 보고 낫지 않는다면 질병본부 1339, 지역번호+120이나 보건소에 상담을 받아 보시기를 바랍니다.\n코로나 바이러스는 무증상도 많고 약한 증상도 있으며 감기나 독감증세와 비슷하다고 하며 증상으로는 기침,가래,콧물,두통,발열,인후통,근육통,호흡곤란,설사,복통,결막염,후각 미각 마비등 이외에도 많은 증세가 있다고 합니다.\n전세계 코로나 확진자는 3,700만명 그리고 사망자는 107만명으로 계속 확산이 되고 있으며 세계보건기구는 확진자가 실제로는 20배 이상 많고 사망자는 2배 이상 많을 것으로 예상을 하고 있습니다.\n백신과 치료제가 개발이 되지 않는 지금으로서는 항상 마스크를 쓰고 사람들과 접촉을 피하며 손을 자주 씻어 코로나를 예방을 해야 할것입니다.\n감사합니다. ', '혹시 모르니 검사한번받아보시기 바랍니다.', '코로나 증상 발현 순서는 발열->기침->인후통. 근육통->메슥거림(구토)->설사 등으로 알려져 있지만 무증상인 경우도 아주 많고 개인에 따라 발열이 없는 경우도 있고 인후통이나 근육통이 없는 경우도 있기 때문에 검사를 받기 전에는 판단이 어렵습니다. 또한 개인에 따라 증상도 천차만별이기 때문에 기침을 하는 경우도 많지만 전혀 없는 경우도 있고 가래가 있는 경우도 있지만 없는 경우도 있으므로 확진자가 속출하는 지역에 살고 있거나 공공장소에 다녀왔거나 의심이 된다면 검사를 받는 것이 안전합니다.', '코로나증상과 비교해보시고 체크후\n의심이 된다면 1339번에 전화후 안내 받으시기 바랍니다.\n코로나라이브 오늘은 몇명의 확진자가? 어느지역에? \nhttps://story0121.tistory.com/123\n코로나라이브 오늘은 몇명의 확진자가? 어느지역에?\n코로나로 인해 수많은 사람들이 동선을 확인하고 , 하루에 확진자가 얼마나 발생하며 , 우리지역에는 얼마의 인원이 발생했는지를 확인하며, 가는곳마다, 인적사항을 기입하고 마스크와 체온측정은 필수로 하는 시..\nstory0121.tistory.com\n코로나19 자가진단 코로나세이프 자가진단 받으러 가기\nhttps://dangcare.tistory.com/1329\n코로나19 자가진단 서비스가 개발됐다. 코로나세이프 자가진단 받으러 가기\n코로나19 자가진단 서비스가 개발됐다. 코로나세이프 자가진단 받으러 가기 고고 코로나19 선별 진료소에서 근무하는 공중보건의 등 현직 의사 9명과 MBN 측이 함께 만든 자가진단 서비스는 언제, 어디서나 손쉽..\ndangcare.tistory.com\n코로나맵’ 이어 주변 진료소 정보까지 확인 가능한 ‘코로나 알리미’\n동선확인하시고 주의하세요 ..............\nhttps://dangcare.tistory.com/1226\n코로나맵’ 이어 주변 진료소 정보까지 확인 가능한 ‘코로나 알리미’ 등장\n코로나맵’ 이어 주변 진료소 정보까지 확인 가능한 ‘코로나 알리미’ 등장 최근 ‘신종 코로나바이러스’가 국내에 확산됨에 따라 이에 대한 정보를 확인할 수 있는 창구가 하나둘씩 등장하고 있다. 지난달 30일..\ndangcare.tistory.com\n인후통코로나 증상 목아픔코로나 증상 발현 시기코로나 증상 설사코로나 증상 두통코로나코로나 증상\n트럼프 코로나\n채택시 해피빈은 코로나 관련해서 전액기부됩니다.\n코로나는 아닐거에요 , 건강한 하루되세요\n00:00 | 00:44\n화질 선택 옵션\n270p\n\n접기/펴기\n코로나']",6,https://kin.naver.com/qna/detail.naver?d1id=7&dirId=7010101&docId=370580616&qb=67Cx7Iug&enc=utf8&section=kin&rank=68&search_sort=3&spq=0,호흡기내과
