page,date,tags,questions,questions_add,answers,N_answer,url,category
11,2020.07.23,"['비자', '미국비자', '미국취업', '미국이민', '미국취업비자', 'o비자', '#영어공부', '#미국비자']",2년후쯤 미국 취업하려고 하는데 지금부터 비자를 위해 준비해야할것들이 뭐가 있을까요? (편집디자인),"서울에 있는 대학교 4년제 나왔고 (인테리어학과)

현재 5년차 편집디자이너 입니다. (브랜딩, 홍보, 시각 디자인등 사내 디자인)
2년후에 미국으로 3년정도 살면서 일하고 싶은데요
O visa 나 Hb1? 등등 취업비자가 여러게 있는걸로 아는데, 
제가 2년동안 뭘 준비해놓는게 좋을까요?

회사 다니면서 뭔가 관련 전시회를 참여해야하는지...ㅠㅠ 뭐 포트폴리오를 더 사이트에 올려야 하는지
영어공부를 더 해야하는지...감이 안잡히네요

그리고 비자+취업까지 그 업체 비용을 대략 알고 싶습니다.","['1. 해외취업은 학원을 통해서 하실 수는 없습니다.\n2. 취업비자 당연히 하셔야 하지만, 취업도 안했는데 취업비자를 어떻게 받을까요 ㅠㅠ\n3. 5년차 디자이너시면 포트폴리오를 해외기업으로 계속 보내셔야 합니다.\n4. 당연히 영어로 프리토킹이 가능해야 합니다. 해외에서 기본으로 생각하는 것은 소통능력입니다.\n5. 포트폴리오는 너무 중요합니다.\n포트폴리오 준비하는데 더 수준있게 다듬고 싶다면 아래 링크로 문의 주시면 포트폴리오 수업으로 강사님과 피드백형식으로 교육 받으실 수 있습니다.\n링크로 문의 주세요\nhttp://www.sbsdaegu-dg.co.kr\nSBS아카데미컴퓨터아트학원 조범식 교육실장\nPrevious Next pused 수강료조회 여름방학특강조회 취업과정조회 지점위치조회 국비지원조회 포트폴리오 수강생후기 053-719-3621 주말·공휴일 상담 및 접수가 가능합니다. 기초아트웍 유튜브크리에이터 웹디자인/웹퍼블리셔 광고편집 마야/CG 모션그래픽 인테리어 제품디자인 IT 게임 오피스 교육과정안내 기초아트웍 아트웍은 모든 디자인 학문의 기본이자 감각을 표현하는데 있어서 근간을 이루는 발상과 드로잉, 레이아웃 색에 대한 이해를 다룹니다. 이전 다음 캐릭터디자인공모전 캐릭터/팬시 디자인 디지털 드로잉 웹툰작가 매트페인팅 ...\nwww.sbsdaegu-dg.co.kr', '안녕하세요.\n(주)국제인력개발원 입니다.\n우선, 현재 조건에서 미국취업을 준비하신다면 영어회화 능력만 가지고 있다면 무난하실것 같습니다.\n총 3가지 조건을 충족해야 하는데요.\n첫번째가 대학졸업이상의 학력(4년제)인데 충족하시는것 같구요.\n두번째는 취업가능한 전공이어야 하는데요. 인테리어디자인 전공이고\n현재 그래픽디자이너로 5년간 근무하신 경력이 있다면 그래픽디자인 잡오퍼를 구하는것은 크게 어렵지않을것 같습니다. 다만, 5년간 프리랜서등으로 근무하셨으면 안되구요. 반드시 정규직으로 근무한 경력을 증빙할 수 있어야 합니다. 정규직이라기보다는 재직증명과 급여명세표가 있어야 합니다. 프리랜서라면 실제 근무경력을 증빙할 수 있는 방법이 많이 없으신것 같습니다. ~^^;\n그리고,세번째가 영어회화 능력입니다.\n일상적인 회화가 가능해야 하는데요. 회사인터뷰부터 비자인터뷰까지 모두 영어로 진행이 가능해야 합니다.\n위 3가지 조건을 만족하신다면 진행에 큰 문제는 없으시구요.\n비자타입은 J1(12~18개월)비자를 받아서 입국하신후 H1(3~6년) 비자를 받은후 근무하시면서 영주권을 준비하시는것이 가장 빠르고 저렴한 비용으로 가능한 방법입니다. \n바로 H1을 준비하는 방법도 없지않습니다만 회사를 구하기도 어렵구요. 비자도 매년쿼터가 정해져있어서 렌덤으로 지원해야하기때문에 가능성도 높지않을뿐 아니라 준비비용도 2만불이상으로 매우 높습니다.\n위에 말씀드린 J1-H1-영주권 방법이 가장 합리적인 방법입니다.\n(나이가 만 34세미만이라면 정부지원도 가능합니다.)\n다만, 현재 코로나로인해  모든 미국취업비자 승인이 이루어지고 있지않기때문에 백신이나 치료제가 나오는 내년초부터나 가능하지않을까 예상하고 있습니다.\n그럼, 해외취업 준비에 도움이 되셨으면 좋겠습니다..^^ㅎ 파이팅~ 입니다..^^\n(주)국제인력개발원', '2년후쯤 미국 취업하려고 하는데 지금부터 비자를 위해 준비해야할것들이 뭐가 있을까요? (편집디자인)\n서울에 있는 대학교 4년제 나왔고 (인테리어학과) 현재 5년차 편집디자이너 입니다. (브랜딩, 홍보, 시각 디자인등 사내 디자인) 2년후에 미국으로 3년정도 살면서 일하고 싶은데요 O visa 나 Hb1? 등등 취업비자가 여러게 있는걸로 아는데,  제가 2년동안 뭘 준비해놓는게 좋을까요? 회사 다니면서 뭔가 관련 전시회를 참여해야하는지...ㅠㅠ 뭐 포트폴리오를 더 사이트에 올려야 하는지 영어공부를 더 해야하는지...감이 안잡히네요 \nAnswer:\n한국에서 계속해서 회사를 다니면서 전문적인 경력을 쌓는 것이 필요할 겁니다. 이와 동시에 본인이 O1 비자를 하고자 한다면 O1 비자에 맞게 본인의 경력을 맞춰야 합니다 일단 미국에 I-129 청원서를 서명해줄 회사나 개인 친분이 있는 지인을 확보하고 나중에 I-129 접수 시에 도움을 받아야 합니다. 또한 O1 조건인 다음의 조건을 만족하는 자료들을 준비해야 합니다\nO1은 특별한 재능을 입증해야 하는데 이러한 특별한 재능(Extraordinary Ability)을 증명하기 위해서는 아래에 나열된 조건 중 세 가지 이상을 만족 시켜야 합니다.\n1. 잡지, 신문, 뉴스, 등을 통해 국내, 국제적으로 알려진 경우\n2. 꽤 명성이 있는 작품이나 공연에 주요한 기여를 하여 신문, 뉴스, 잡지 등에 나온 경우\n3. 자신의 분야에서 독창적인 기여를 한 증거\n4. 공연 예술에서의 상업적 성공을 보여주는 증거\n5.  예술적인 전시회나 쇼케이스에 자신의 작품이 전시된 경우\n6. 유명 단체에서 주연 급의 역할을 공연했다는 증거\n7. 외국인이 같은 분야의 종사자들에 비해 상대적으로 높은 보수를 받고 있다는 증거\n위의 기준이 신청자의 상황에 적용시키기 힘든 경우, 신청자는 “다른 비교될만한 수 있는 증거”를 제출 할 수도 있습니다.\n 본인의 경우 4년제 학위를 나왔기때문에 H1B를 신청할 경우 추첨에서 떨어질 확률이 매우 높아서 현실적으로 H1B를 신청하는  것은 어려울 수 있습니다 또한 단순 인턴쉽비자나 trainee들을 위한 J1 비자도 맞지 않아 보입니다 J1을 신청하기에는 본인의 레벨이 너무 높아 보입니다 아마도 경력을 더 쌓으시고 필요하다면 석사학위를 더 받아서 레벨을 높여서 O1 비자를 신청하는 것이 맞을 거 같습니다\n그리고 비자+취업까지 그 업체 비용을 대략 알고 싶습니다.\nAnswer:\nO1이나 H1B나 비용은 접수비가 2~3백만원 정도 나올 겁니다 여기에 추가적으로 변호사 비용이 추가될 겁니다 이 비용은 변호사들마다 비용이 다를 겁니다', '안녕하세요, English Planner 아미입니다. 질문해 주신 내용에 대해 답변드리겠습니다.\n 기본적으로 해외에서 살아갈 수 있을 정도의 영어 회화 실력은 있으셔야합니다. \n 한국 교육시스템 속 영어는 단순히 점수만 잘 받고 마는게 다인데 점수만 보고 사람을 뽑는 시댄 끝났습니다. 영어 회화 실력을 더 중요하게 보고 있습니다. 세계화 시장이 점점 더 커지고 있는 현 상황과 앞으로의 미래를 봤을 때 저는 입시나 승진 또는 내신을 위해 점수를 더 잘 받는 것 뿐만 아니라 여기에 더불어 훗날 더 넓은 세상에서 목표를 이루고 꿈을 펼칠 수 있도록 영어 회화를 위한 제대로 된 공부를 시작하셔야 된다고 말씀 드립니다.\n 현 한국식 영어교육법은 일제강점기 때부터 건너온 일본식 영어공부법입니다. 이후에 동양권 중 가장 뛰어났던 우리나라 영어회화 실력이 일제강점기 이후로 팍 낮아졌죠. 일본식 영어 교육법이 들어오기 전 원래 우리나라의 영어 교육법은 원어민의 말을 듣고 갓난 아이가 옹알이하듯 따라 하는 것부터 시작했습니다. 옛 한국식 영어교육법으로 귀가 트이게 되면 뇌가 영어를 언어로서 인식하면서 입이 트이고 문법과 단어를 자연스럽게 받아들이게 됩니다.\n https://youtu.be/2oqE2c9FKd4\n 뇌가 영어를 언어로서 인식하게 되면 기억상실증 환자들도 그 나라 말은 가능한 것과 우리가 50년 100년 시간이 가도 한국어를 잊지 않는 것과 같아지게 됩니다. 우리 뇌가 영어를 언어로서 받아드리게 되면 우리가 한국말을 할 때 문법을 생각하면서 말하지 않는 것처럼  문법을 잊어서 영어회화가 불가능한 일이 발생하지 않고 처음부터 다시 공부하는 헛수고를 할 필요가 없게 됩니다. \n 초등학교부터 고등학교까지 심지어는 대학교를 다니면서 또 취직을 한 후에도 영어를 그렇게 오래 배웠는데 안되는 건 문제가 있다는 걸 아셔야 됩니다. 영어를 일본식 벙어리 영어 교육법으로 배우셨으니까 당연한 겁니다. 그럼에도 저희는 지금 질문자님의 영어 실력이 어떻든 최대 3년을 잡고 가시면 원어민들과의 영어 회화가 너무 당연하게 가능해지는 어학연수 대체 프로그램입니다. 시작을 실질적인 영어 회화 실력을 위한 제대로 된 공부를 하느냐 그렇지 않느냐 이차이에서 가려집니다.\n 결론적으로 영어를 잘하고 싶다면 뇌가 영어를 이해할 수 있게 해주셔야 됩니다.\n저는 영어 회화를 잘하고 싶고, 의지가 있는 분들을 수강생으로서 관리해드리고 있습니다.\n 전문 원어민 선생님과의 1:1 맞춤형 수업과 저의 실시간 피드백, Listening & Speaking Training (리스닝 & 스피킹 트레이닝)을 통해 단순 암기보다 훨씬 빠르고 효율적으로 영어를 모국어처럼, 영어를 언어로써 습득할 수 있는 기반을 마련해 주는 거죠.\n 감히 말씀드리자면 저에게 관리받으신 분들은 100% 실력이 향상되었으며, 원어민들과 대화하는 데 막힘이 없습니다.\n 제가 관리해드리는 최종 목적은 딱 하나, “영어를 모국어처럼 이해하고 편하게 사용할 수 있게 하는 것”입니다.\n 질문자님께서 제대로 된 방법으로 영어를 배우고 습득하고 싶다는 의지가 있다면 아래 오픈 카톡이나 프로필을 통해 문의하시기 바랍니다. 레벨인바디부터 결과 확인과 상담, 따로 원하는 목표를 달성하실 때까지 책임지고 관리해 드리겠습니다.\n  상담 번호: 010-6837-2983\n카카오톡 오픈 상담방(모바일용): http://qr.kakao.com/talk/gz0EiVeAUFGliD5acS2ZEx6nI44-\n카카오톡 ID: army1413', '말씀하신 O비자건 H비자건 취업 2순위 건 3순위 영주권 이던지간에 미국에서 취업 혹은 영주권 취득을 위해선 회사에서 무조건 스폰서를 해줘야 가능합니다. 즉 고용주가 필요하던데... 이부분은 님께서 취직을 하면 되는 것입니다. 준비해야하는 것이라고는 본인의 능력을 쌓아서 취업하고자 하는 업체가 질문자님을 픽 하도록 하는 것이죠.. 하지만 현 트럼프 정부는 외국인 취업을 반기지 않고, 최근 코로나 이슈까지 겹쳐서 미국내에서 외국인이 취직하는것이 아주 어렵습니다.\n한가지 방법이 NIW 라는제도를 통해 미국 영주권을 취득하는 방법이 있는데요, 이는 트럼프 행정부 하에서도 오히려 장려하는 제도 중 하나입니다. NIW는 검색하시면 자세히 알 수 있고 제 블로그 (https://blog.naver.com/bshsh23) 에도 제 경험담을 상세히 적어놨습니다. NIW를 간단하게 말하자면, 미국 국익에 도움이 될 만한 고학력 (석사 이상) 인재에게 고용주의 스폰서 없이 (waiver) 영주권을 발급하는 제도인데, 말은 거창하지만 대부분의 이공계 계열 석사 학위 이상이 있거나 학사 졸업 후 5년간 일한 경력이 있다면  일단 그 자격요건이 된다고 볼 수 있습니다. 물론, 전공 관련 논문, 특허 등 객관적인 실적이 있어야 하지요. 꼭 미국에 살고있지 않아도 상관없습니다. 한국에서도 IVP (Immigration Visa Processing) 라는 제도를 통해 영주권 (NIW)을 신청할 수 있습니다. \n질문하신대로 학사 후 5년간 일하는 것이 해당될 수는 있지만, 일단 질문자님의 전공이 미국 국익에 도움이 되는 전공이어야 하며, 그 전공에 해당하더라도 님의 이력 (논문, 특허 등)을 통해 객관적으로 님이 가진 능력이 미국국익에 도움이 된다는 것을 증명해야 합니다. 따라서 NIW를 위해선 유능한 이민 변호사와의 상담을 받는 것이 매우 중요합니다. 구글에 NIW laywer 를 검색하시면 많은 결과를 얻을 수 있습니다. NIW 에서는 미국에 Wegreened 라는 로펌이 많이 유명합니다. 만약 님께서 충분한 실적이 있고, 영어 작문에 능하신 분들은 혼자서 할수도 있지만, 본인 전공을 잘 포장해서 미국 이민국에서 원하는 양식에 맡게 그들을 설득하는 글쓰는 것은 절대 쉬운일은 아니죠. ', '안녕하세요, 연율 이민법인입니다. \n편집 디자이너로서 미국 취업을 계획하고 계시다면, 말씀하신데로 O비자 또는 H비자가 있습니다. H비자는 학부 졸업 또는 석사 학위 이상을 가진 신청인이 미국 내 스폰서에게 취업한 뒤, 스폰서가 신청인을 위해서 단기 취업비자 청원서를 미국에 제출함으로서 시작됩니다. 다만, H비자의 경우, 추첨의 형식으로 신청인을 선별하므로, 아무리 서류를 잘 준비한다고 해도 그 승인이 운에 의해서 좌지우지 된다는 단점이 있습니다. \n따라서, 디자이너 분들이 많이 하시는 미국 비자는 O비자이며, 사실 자격요건만 맞다면 O비자 훨씬 유리한 측면이 많습니다. O비자의 경우, 추후 미국 EB-1 취업이민 절차를 통한 미국 영주권취득도 용이해질 수 있으므로 그러합니다. \n미국 O비자는 그래픽 디자이너, 편집 디자이너, 아트 디렉터, 크리에이티브 디렉터, 연예인, 운동선수, 예술가 분들에게 적합한 비자로서 연예인 중에선 유재석 씨와 싸이 씨가 받은 것으로 알려져 있습니다. \nO비자 자격요건\nO비자는 기본적으로 과학, 예술, 교육, 비지니스, 운동 등의 분야에서 뛰어난 능력을 가지고 계신 분들 또는 영화나 TV 산업의 분야에서 국내 및 국제적인 인지도를 가지고 계신 분들에게 주어지는 미국 비이민 취업비자입니다. \nO비자는 종류가 여러가지이며, 기본적으로 extraordinary ability의 입증을 기본으로 하고 있습니다. O비자 내에서, 운동선수, 과학 등의 분야와 예술 분야, 그리고 TV 산업 분야에서 요구하는 ""extraordinary ability""의 기준이 모두 다르므로 이 부분에 대해서 확실히 정리하실 필요가 있습니다.\n 아티스트 분들은 O-1B 비자에 해당되는데, 이는 미국 이민법상,  ""Individuals with an extraordinary ability in the arts or extraordinary achievement in motion picture or television industry"" 라고 표현됩니다. 즉, 예술, 영화 및 TV 산업 분야에서 뛰어난 능력을 가진 신청인들에게 주어지는 비자입니다. \n O-1B비자에서 요구하는 ""Extraordinary Ability""는 ""Distinction""을 의미하며, 이를 잘 입증하는 것이 가장 중요합니다. Distinction이란 두각/차별성을 의미하는데, 이는 일반적으로 얻을 수 있는 수준보다 훨씬 더 높은 수준의 성과 및 업적을 가진 상태라고 규정할 수 있습니다. \n따라서, 이러한 두각과 차별성을 입증할만한 서류들을 많이 만들어두는 것이 중요하며, 전시경력, 수상경력 등 모든 사항이 모두 위 두각/차별성을 입증하는데 사용될 수 있습니다. 미국 이민법 상, 두각은 총 6가지 사항 중에서 세 가지 사항에 대해서 입증하도록 요구하고 있는데, 그 내용은 대략적으로 다음과 같습니다. \n국제적 인정, 주요역할 수행경력, 상업적 성공 또는 비평가 찬사, 특별한 인정, 높은 보수, 각종 수상경력 등입니다. \n따라서, 디자이너 분들과 같은 예술가 분들은 O비자에 특화된 경력사항을 만들기 위해서 계획을 미리 하는 것이 매우 중요하다고 할 수 있습니다. 우선 본인의 현재 포트폴리오 및 이력서를 작성해서 미국 이민법 전문가와 면밀히 상담하시는 것을 추천드립니다. 현재 상황에서 어떠한 것이 더 보강되면 좋을지, 그리고 어떠한 내용을 앞으로 준비하면 좋을지에 대해서 컨설팅을 받고 준비하실 것을 추천드립니다. \n궁금하신 점에 도움이 되셨길 바랍니다. ']",6,https://kin.naver.com/qna/detail.naver?d1id=11&dirId=110603&docId=363327756&qb=67Cx7Iug&enc=utf8&section=kin&rank=108&search_sort=3&spq=0,"워킹홀리데이, 해외인턴쉽"
