page,date,tags,questions,questions_add,answers,N_answer,url,category
6,2020.10.13,[],독감 백신 문의합니다,"안녕하세요
독감예약하려고하는데 gsk랑 사노피중 선택이더라구여
둘중에 어떤게 더 좋은건지 알수있을까요?","['비슷함', ""위에 질문주신 내용은 정확히 모르겠네요. 혹시나 아래 내용도 참고해보시면 좋을 것 같습니다.\n무료독감 백신 예방접종 및 신청방법 대해서 정리하였습니다. 한번 참고해 보시면 도움이 될 것 같습니다. 도움이 되셨다면 채택 부탁드립니다.\n▼ 무료 독감 백신 예방 접종 신청방법 (++홈페이지 링크)\nhttps://info.dinoa.xyz/140\n무료 독감 백신 예방 접종 신청방법 (++홈페이지 링크)\n하늘 아래 다양한 정보를 전달하는 하 늘 정 보 입니다. 오늘은 '무료 독감백신 예방접종' 에 대해서 알아보겠습니다. 목차 2020년 무료 독감백신 예방접종 신청방법 국가에서는 '인플루엔자 국가예방접종 지..\ninfo.dinoa.xyz\nhttps://realtime.dinoa.xyz/362\n독감 무료예방접종 사업 다시 시작 (++최신 업데이트)\n독감 무료예방접종 신청 목차 독감 무료예방접종 사업 재개 유통 중 '상온 노출' 사고로 접종이 중단되었던 2020∼2021절기 겨울철 인플루엔자(독감) 예방접종 사업이 13일부터 전국 보건소와 2만1000여곳의 접종..\nrealtime.dinoa.xyz"", ""위에 질문주신 내용은 정확히 모르겠네요. 혹시나 아래 내용도 참고해보시면 좋을 것 같습니다.\n무료독감 백신 예방접종 및 신청방법 대해서 정리하였습니다. 한번 참고해 보시면 도움이 될 것 같습니다. 도움이 되셨다면 채택 부탁드립니다.\n▼ 무료 독감 백신 예방 접종 신청방법 (++홈페이지 링크)\nhttps://info.dinoa.xyz/140\n무료 독감 백신 예방 접종 신청방법 (++홈페이지 링크)\n하늘 아래 다양한 정보를 전달하는 하 늘 정 보 입니다. 오늘은 '무료 독감백신 예방접종' 에 대해서 알아보겠습니다. 목차 2020년 무료 독감백신 예방접종 신청방법 국가에서는 '인플루엔자 국가예방접종 지..\ninfo.dinoa.xyz\nhttps://realtime.dinoa.xyz/362\n독감 무료예방접종 사업 다시 시작 (++최신 업데이트)\n독감 무료예방접종 신청 목차 독감 무료예방접종 사업 재개 유통 중 '상온 노출' 사고로 접종이 중단되었던 2020∼2021절기 겨울철 인플루엔자(독감) 예방접종 사업이 13일부터 전국 보건소와 2만1000여곳의 접종..\nrealtime.dinoa.xyz""]",3,https://kin.naver.com/qna/detail.naver?d1id=7&dirId=7010101&docId=370586634&qb=67Cx7Iug&enc=utf8&section=kin&rank=57&search_sort=3&spq=0,호흡기내과
6,2020.10.13,[],어제 맥주 3캔먹었는데 오늘 오후1시 4가독감접종,어제 맥주3캔 먹었습니다. 오늘 오후 1시 넘어서 독감백신 예방접종 가능할까요?? 숙취는 없어보이는데요,['어젯밤 에만 맥주 3캔 마시지 않았고 지금 숙취 증상들은 없다면 오늘 오후 1시 독감예방접종 4 가는 맞아도 됩니다.'],1,https://kin.naver.com/qna/detail.naver?d1id=7&dirId=70101&docId=370587556&qb=67Cx7Iug&enc=utf8&section=kin&rank=56&search_sort=3&spq=0,내과
6,2020.10.13,"['독감주사', '독감예방접종', '#독감주소']",독감 주사 어디서 맞나요?,"제가 완전 어렸을 때부터 한번도 독감주사를 안 맞았는데 요새는 워낙 위험하기도 하고 이제 더이상 무시하고 살면 안되겠다 싶어서 맞으려는데 여지껏 안 맞았으니 아는게 없네요
1.어디서 맞아야하나요? 보건소? 병원? 정해진 병원이 따로 있고 그러나요?
2.돈 주고 맞아야 하나요 준다면 얼마정도?
3.독감 예방 주사 맞을 수 있는 날짜가 따로 정해져있나요? 시간이나...
4.예약해야하나요?","['보건소,병원등 많은곳에서 맞으실수 있습니다. 원하시는 가까운 내과 방문하셔서 맞으시면 됩니다.\n비용은 병원마다 다릅니다.', '1. 누리집 조회해보시면 가까운 곳 나와요\n아래 출처 남겨드립니다.\n보건소, 병원 등\n2. 무료대상자는 무료고 대상자 아니면 유료\n대체로 4만원 이내\n3. 무료만 정해졌어요\n4. 예약하는게 좋아요.. 지금 시즌이라..\n<독감 무료접종 대상> 독감 예방접종 대상자\n독감 예방접종 무료대상 3가 4가 2020 독감 무료접종 대상자 조회/기간 _ ■독감 무료접종 대상 2020년 9월 8일부터 어린이와 임신부, 어르신을 대상으로 무료 독감 예방접종이 시작된다. 2020년은 올해는 중고생..\ndingdo.tistory.com\n위는 독감예방접종 대상자 조회 안내 입니다\n(무료접종, 기간, 지정병원)', '1. 가까운 병.의원에서 맞으시면 되는데,  독감 사전예약 및 병원조회하는 사이트가 있습니다. \n2. 무료접종 대상이면 무료입니다. 0원!\n3. 정해져 있습니다.\n4. 예약하지 않아도 되나 백신소진시 헛걸음할 수 있습니다.\n방문전에 병원에 백신보유 등을 문의한 후 방문하시는게 좋습니다. 관련 정보는 아래링크를 확인하세요~\n독감 무료접종 대상 완벽정리(최신)\n독감 무료접종 대상 완벽정리(최신) 요즘 독감 무료접종이 핫이슈입니다. 바로 상온 노출로 인한 변질의 우려와 해당 물량이 풀리게 되면서 자칫 변질된 백신을 투여받게 되는게 아닌가 하는 불안감 때문에 더욱..\nkingthecarrot.tistory.com', '안녕하세요? 황닥입니다.\n병원에 따라서 주사 가격 일정이 달라요\n근처 병원에 전화해서 확인 후 접종 받으시면 되요\n2020 독감예방접종 https://www.youtube.com/watch?v=MKCSxo2zS38\n다시 발표된 무료접종 대상과 일정 https://blog.naver.com/ekgo83/222111652039\n재발표된 무료독감주사 일정! 10월13일 청소년! 10월 19일 어르신!\n안녕하세요 원다해 원장입니다.13세 이상 청소년과 어르신 무료접종 일정이 10월 8일에 드디어 발표되었...\nblog.naver.com']",4,https://kin.naver.com/qna/detail.naver?d1id=7&dirId=701&docId=370591715&qb=67Cx7Iug&enc=utf8&section=kin&rank=55&search_sort=3&spq=0,건강상담
6,2020.10.13,['#지식인카드'],곤지름 생겼는데 백신 맞아야하나요?,"어떻게 된 일인지 근 1년간 성관계도 없었는데 갑자기 곤지름이 생겼네요...
레이저로 지진다는데 그 이후에 백신 맞아야하나요?

접종하면 재발 안 되나요?
의사선생님들만 답변 부탁드립니다","['의사선생님 답변이 계속 안 달리면 닥터벨라라고 산부인과 전문의에게 1:1로 질문하고 답변 받을 수 있는 어플이 있는데 거기에도 한번 물어보세요 예상비용검사항목도 있어서 가다실 얼마인지도 알려주고 되게 좋더라구요 무료라서 계속 궁금하시면 거기에도 물어보시라고 알려드립니당', '곤지름은 냉동치료, 약물치료, 수술적인 치료를 할 수 있습니다.\n수술이나 마취를 하는데 문제가 있지 않은 경우에는 수술적인 치료가 효과가 좋습니다.\n그리고 예방백신은 예방을 할 뿐 이미 곤지름이 발생한 사람에게 증상 개선이나 치료의 효과는 없습니다.']",2,https://kin.naver.com/qna/detail.naver?d1id=7&dirId=7011404&docId=370591720&qb=67Cx7Iug&enc=utf8&section=kin&rank=54&search_sort=3&spq=0,여성질환
