page,date,tags,questions,questions_add,answers,N_answer,url,category
7,2021.05.27,[],접종하면 마스크 벗게 해준다 ?,"당연히 반가운 소리지만,

그것을 악용해서 누구라도 마구 벗고 다닐 텐데

대책이 있나요 ?

오히려 더 심각해지는 것 아닌가요 ?

철저하게 구별하고 단속할 수 있는 제도와 여건이 마련되지 않는다면

더 재앙이 될 수 있지 않을까요 ?


지금도  담배를 피우면 마스크를 안 써도 되는 것이 불문율이 되어

[ 노마스크 / 길거리 흡연 ]이 버젓이 당연시되는 판인데 말이죠 ??",['백신 맞은 사람이 마스크 벗는것은 찬성인데요..\n님의 생각처럼 악용이 될까봐 걱정이네요.ㅠ'],1,https://kin.naver.com/qna/detail.naver?d1id=6&dirId=61301&docId=390809435&qb=67Cx7Iug&enc=utf8&section=kin&rank=63&search_sort=3&spq=0,한국사회문화
7,2021.05.27,"['아스트라제네카', '항바이러스연고']",백신접종시 투약력,"제가 내일 아스트라제네카 2차 접종을 맞을 예정인데
오늘부터 제가 단순포진때문에 항바이러스제 복용중인데 내일 맞아도 괜찮을까요? 백신의 효과가 없을 수도 있을까요? 먹는액은 발트렉스 500mg 2t 복욘중입니다.","['네, 그렇습니다.  ^0^,']",1,https://kin.naver.com/qna/detail.naver?d1id=7&dirId=7010107&docId=390809776&qb=67Cx7Iug&enc=utf8&section=kin&rank=62&search_sort=3&spq=0,감염내과
7,2021.05.27,[],코로나 백신 질문이요!,"코로나 백신 맞으려고 하는데

집에 아기가 있는데 맞고 아기랑 같이 있어도 되나요??

알고싶네요","['코로나 백신 맞으려고 하는데 집에 아기가 있는데 맞고 아기랑 같이 있어도 되나요?? 알고싶네요\n= 백신 맞았다고\n감염 안됩니다 걱정마세여\n<코로나 백신 접종 후 주의사항> 부작용, 이상반응, 샤워, 증상, 음주\n코로나 백신 접종 후 이상반응 코로나 백신 접종 부작용 주의사항 안내 _ 전세계적으로 코로나 백신 접종이 시작됬습니다 대한민국 국내에서도 코로나19 백신 접종도 시작됬습니다 코로나 백신은 코로나 바이러스..\nzero-news.tistory.com\n출처', '네..상관 없습니다..']",2,https://kin.naver.com/qna/detail.naver?d1id=7&dirId=70105&docId=390809790&qb=67Cx7Iug&enc=utf8&section=kin&rank=61&search_sort=3&spq=0,흉부외과
6,2021.05.27,[],백신접종하고,백신접종하기전날새벽까지 술을 과음했는데 의사선생님이 괜찮다고 주사맞으라고해서 맞고 오늘은금주하라고했었는데 제가구토를 너무많이해서 티아민이랑 멕쿨주사를맞았는데 이게 항체형성의 혹시 방해되거나그럴수 있나요????,['그런 경우는 항체 생성에 방해가 될 수도 있습니다.'],1,https://kin.naver.com/qna/detail.naver?d1id=7&dirId=7010107&docId=390809876&qb=67Cx7Iug&enc=utf8&section=kin&rank=60&search_sort=3&spq=0,감염내과
6,2021.05.27,[],만성질환자 코로나백신접종,"만성질환자는 코로나백신 맞아도 되나요? 현재 저의 아버지가 당뇨, 협심증에 부정맥있으셔서 아스피린도 꾸준히 드시고있어요 최근 갑상선항진증진단받아 약먹고있습니다. 그래서인지 최근 몸이 안좋으십니다. 게다가 이주전 손가락에 철과상이 심하게생겨서 몇바늘 꿰매고 염증약을 드세요...아버지가 코로나백신을 맞아도될까요? AZ나 화이자, 모더나를 맏아도 괜찮을까요?","['코로나 백신은 기저질환환자 / 약물 투여자 / 감기기운등 증상이 있는자는 증상이 나타나는 자는\n먼저 병원에 의사와 상담후 접종해야 한다 아래 코로나 접종안내 문구에 나옵니다[출처]\n<코로나 백신 접종> 순서, 횟수, 나이, 우선순위, 시기, 방법\n대한민국 국내 코로나 백신 접종 코로나 백신 접종시기 _  먼저 국내 코로나 백신 접종대상은(?) 대상은 전국민 입니다. (단 백신 개발과정에서 임상시험에 포함되지 않은 임신부와 18세 미만 소아청소년은 접종..\nzero-news.tistory.com']",1,https://kin.naver.com/qna/detail.naver?d1id=7&dirId=7010103&docId=390810528&qb=67Cx7Iug&enc=utf8&section=kin&rank=59&search_sort=3&spq=0,순환기내과
6,2021.05.27,[],화이자 백신 접종후,화이자 2차까지 접종후 한달 지났는데 ct 찍어도 되죠?,"['네 , 화이자 백신 접종 완료하시고 한 달이 지났다면 CT 찍어도 됩니다.', ""이상없고 한달 경과면 가능합니다 \n코로나 백신 예약 일정\n- 70~74세(1947년~1951년), 만성호흡기장애인 : 2021.05.06(목) ~ 06.03(목)\n- 65~69세 (1952년~1956년) : 2021.05.10(월) ~ 06.03(목)\n- 60~64세 (1957년~1961년), 어린이집/유치원/초등1,2교사 등 : 2021.05.13(목) ~ 06.03(목)\n네이버 노쇼 백신 예약\n네이버에서 잔여 백신을 조회할 경우에는 네이버 앱·네이버 지도앱 또는 네이버 웹에 접속해 검색창에 '잔여 백신'을 검색하면 지도 플랫폼에 위탁의료기관 및 남은 백신 수량이 표시된다.\n잔여백신 카카오톡\n카카오에서는 카카오톡 하단의 샵(#) 탭에서 '잔여 백신' 탭을 선택하거나 카카오 맵 앱을 통해서 잔여 백신 조회가 가능하다. 잔여백신 수량이 3개 이하로 남아있을 경우에는 빨간색, 4∼6개까지는 노란색, 7개 이상은 초록색 표지가 각 접종기관 위에 나타난다.\nhttps://453010star.tistory.com/1507\n잔여 백신 예약 대상 조회 및 신청방법 [카카오톡 네이버]\n잔여 백신 예약 대상 조회 및 신청방법 [카카오톡 네이버] 5월 27일부터 네이버와 카카오 앱으로 신종 코로나바이러스 감염증(코로나19) '잔여 백신'을 조회하고 당일 예약으로 접종까지 받을 수 있다...\n453010star.tistory.com"", '화이자 백신 접종 완료하시고 한 달이 지났다면 CT 찍어도 됩니다.  http://m.site.naver.com/0NXio\n코로나 백신 접종 후 주의사항\n코로나 백신 접종 후 주의사항 코로나 백신이 현재 2분기 접종 중이네요. 돌봄종사자 및 항공승무원 그리고 보건의료인, 사회필수인력 마지막으로 만성질환환자들을 우선적으로 접종이 진행되고 있습니다...\nm.site.naver.com\nhttp://m.site.naver.com/0O61B\n잔여백신 예약 조회 및 당일 예약 가능(네이버, 카카오)\n잔여백신 예약 조회 및 당일 예약 가능(네이버, 카카오) 5월 27일부터 네이버와 카카오의 지도 앱에서 잔여 백신 예약을 할 수 있게 되었습니다. 잔여 백신 예약 시스템은 현재 시범 운..\nm.site.naver.com']",3,https://kin.naver.com/qna/detail.naver?d1id=7&dirId=7010107&docId=390811588&qb=67Cx7Iug&enc=utf8&section=kin&rank=58&search_sort=3&spq=0,감염내과
6,2021.05.27,[],"잔여백신이 5월27일 1시부터 시작했습니다

5월 28일도 1시부터 잔여백신 예약신청인가요

아님 28일은 9시부터인가요?",,"['잔여백신(노쇼백신)의 예약이 가능해집니다. 카카오나 네이버를 통해 쉽게 예약을 할 수 있습니다. 노쇼백신에 관해 질병관리청의 자료를 바탕으로 자주묻는 질문을 정리해보았습니다. \n관련 내용은 아래 링크를 참고해보세요.\nhttps://bit.ly/3hUcrwU\n노쇼 백신 접종 예약 신청 방법\n코로나19 백신 접종이 5월 27일부터 사전예약한 만 60세~74세 어르신들을 대상으로 시작됩니다. 아스트라제네카 백신 접종이 활성화 됨에 따라 피치못할 사정으로 예약시간에 오지 않는 경우 남은 백신은 폐기해야..\nbit.ly', ""네 28일이후는\n09시부터에요\n잔여백신예약 (코로나 백신)\n잔여백신(노쇼백신) 예약방법은 2가지에요\n■네이버 잔여백신예약방법\n네이버에서 잔여 백신을 조회할 경우에는 네이버 앱·네이버 지도앱 또는 네이버 웹에 접속해 검색창에 '잔여 백신'을 검색하면 지도 플랫폼에 위탁의료기관 및 남은 백신 수량이 표시 \n■카카오톡 잔여백신 예약방법\n카카오에서는 카카오톡 하단의 샵(#) 탭에서 '잔여 백신' 탭을 선택하거나 카카오 맵 앱을 통해서 잔여 백신 조회가 가능하다. 잔여백신 수량이 3개 이하로 남아있을 경우에는 빨간색, 4∼6개까지는 노란색, 7개 이상은 초록색 표지가 각 접종기관 위에 나타납니다.\nAZ 백신 접종을 권장하지 않는 30세 미만(1992년 1월 1일 이후 출생자) 등은 잔여 백신 당일 예약이 불가합니다\n+ 추가로 기본적인 코로나 백신 예약 안내 접종 시기 등은\n아래 참고하세요\n<코로나 백신 접종> 순서, 횟수, 나이, 우선순위, 시기, 방법\n대한민국 국내 코로나 백신 접종 코로나 백신 접종시기 _  먼저 국내 코로나 백신 접종대상은(?) 대상은 전국민 입니다. (단 백신 개발과정에서 임상시험에 포함되지 않은 임신부와 18세 미만 소아청소년은 접종..\nzero-news.tistory.com"", '28일 이후 9시라고 합니다.\n코로나 잔여 백신 예약 방법 총정리\n도움이 되셨으면 좋겠습니다.^^\n잔여백신 예약 방법\n잔여백신 예약 방법(+네이버, 카카오)\n잔여백신 예약 방법(+네이버, 카카오)  목차 코로나19 잔여백신 5월 27일 부터 누구나 접종 잔여 백신 당일 접종 27일부터 네이버·카카오톡 앱으로 예약 어제 정부에서 7월 노마스크 개방에 관련한 발표가 있고..\nlithe.xyz', ""후자입니다\n코로나 백신 예약 일정\n- 70~74세(1947년~1951년), 만성호흡기장애인 : 2021.05.06(목) ~ 06.03(목)\n- 65~69세 (1952년~1956년) : 2021.05.10(월) ~ 06.03(목)\n- 60~64세 (1957년~1961년), 어린이집/유치원/초등1,2교사 등 : 2021.05.13(목) ~ 06.03(목)\n네이버 노쇼 백신 예약\n네이버에서 잔여 백신을 조회할 경우에는 네이버 앱·네이버 지도앱 또는 네이버 웹에 접속해 검색창에 '잔여 백신'을 검색하면 지도 플랫폼에 위탁의료기관 및 남은 백신 수량이 표시된다.\n잔여백신 카카오톡\n카카오에서는 카카오톡 하단의 샵(#) 탭에서 '잔여 백신' 탭을 선택하거나 카카오 맵 앱을 통해서 잔여 백신 조회가 가능하다. 잔여백신 수량이 3개 이하로 남아있을 경우에는 빨간색, 4∼6개까지는 노란색, 7개 이상은 초록색 표지가 각 접종기관 위에 나타난다.\nhttps://453010star.tistory.com/1507\n잔여 백신 예약 대상 조회 및 신청방법 [카카오톡 네이버]\n잔여 백신 예약 대상 조회 및 신청방법 [카카오톡 네이버] 5월 27일부터 네이버와 카카오 앱으로 신종 코로나바이러스 감염증(코로나19) '잔여 백신'을 조회하고 당일 예약으로 접종까지 받을 수 있다...\n453010star.tistory.com"", ""네 28일이후는\n09시부터에요\n잔여백신예약 (코로나 백신)\n잔여백신(노쇼백신) 예약방법은 2가지에요\n■네이버 잔여백신예약방법\n네이버에서 잔여 백신을 조회할 경우에는 네이버 앱·네이버 지도앱 또는 네이버 웹에 접속해 검색창에 '잔여 백신'을 검색하면 지도 플랫폼에 위탁의료기관 및 남은 백신 수량이 표시 \n■카카오톡 잔여백신 예약방법\n카카오에서는 카카오톡 하단의 샵(#) 탭에서 '잔여 백신' 탭을 선택하거나 카카오 맵 앱을 통해서 잔여 백신 조회가 가능하다. 잔여백신 수량이 3개 이하로 남아있을 경우에는 빨간색, 4∼6개까지는 노란색, 7개 이상은 초록색 표지가 각 접종기관 위에 나타납니다.\nAZ 백신 접종을 권장하지 않는 30세 미만(1992년 1월 1일 이후 출생자) 등은 잔여 백신 당일 예약이 불가합니다 http://m.site.naver.com/0O61B\n잔여백신 예약 조회 및 당일 예약 가능(네이버, 카카오)\n잔여백신 예약 조회 및 당일 예약 가능(네이버, 카카오) 5월 27일부터 네이버와 카카오의 지도 앱에서 잔여 백신 예약을 할 수 있게 되었습니다. 잔여 백신 예약 시스템은 현재 시범 운..\nm.site.naver.com"", '이제 가능합니다 다만 잔여백신 예약과 관련해 미리 어느정도 정보를 알고 있으면\n더욱더 완벽하게 잔여백신 예약부터 변경까지 가능합니다. 해당 내용 정리해두었으니\n확인하셔서 문제 없이 잔여백신 이용하셨으면 합니다.\n코로나 노쇼 백신 카카오 네이버 예약\n코로나 노쇼 백신 소식이 들렸고 많은 분들이 예약 문의를 하신것으로 알고 있습니다. 코로나 노쇼 백신 가장 빠르게 카카오, 네이버를 통해 예약하실 수 있습니다. 코로나 노쇼 백신 예약 아래에서 바로 하실 수..\nm.site.naver.com']",6,https://kin.naver.com/qna/detail.naver?d1id=4&dirId=410&docId=390811623&qb=67Cx7Iug&enc=utf8&section=kin&rank=57&search_sort=3&spq=0,"경제 기관, 단체"
6,2021.05.27,[],코로나 백신 접종 주사맞으면 맞고 바로 집으로 가는건가요?,"아버지가 내일 동네 병원서 백신접종을 맞는데
맞고 난 후 병원서 대기했다가 집으로 가도
되는건지 아니면 주사 맞고 바로 집으로
가는건지 궁금해서요","['네 코로나 백신 주시 맞고\n한 10분정도 이상검사 확인 후\n바로 집으로 갑니다 ㅇㅅㅇ\n<코로나 백신 접종> 순서, 횟수, 나이, 우선순위, 시기, 방법\n대한민국 국내 코로나 백신 접종 코로나 백신 접종시기 _  먼저 국내 코로나 백신 접종대상은(?) 대상은 전국민 입니다. (단 백신 개발과정에서 임상시험에 포함되지 않은 임신부와 18세 미만 소아청소년은 접종..\nzero-news.tistory.com']",1,https://kin.naver.com/qna/detail.naver?d1id=8&dirId=80511&docId=390811920&qb=67Cx7Iug&enc=utf8&section=kin&rank=56&search_sort=3&spq=0,동물의료상담
6,2021.05.27,[],코로나 19 잔여백신 접종 예약 관련 질문입니다.,"혹시 잔여 백신 접종관련 예약을 할 때, 진료시간이 끝난 후 예약하면 예약이 되나요??


예약이 되면 진료시간 내에 가면 되겠죠?


답변 기다립니다.","['잔여백신(노쇼백신)의 예약이 가능해집니다. 카카오나 네이버를 통해 쉽게 예약을 할 수 있습니다. 노쇼백신에 관해 질병관리청의 자료를 바탕으로 자주묻는 질문을 정리해보았습니다. \n관련 내용은 아래 링크를 참고해보세요.\nhttps://bit.ly/3hUcrwU\n노쇼 백신 접종 예약 신청 방법\n코로나19 백신 접종이 5월 27일부터 사전예약한 만 60세~74세 어르신들을 대상으로 시작됩니다. 아스트라제네카 백신 접종이 활성화 됨에 따라 피치못할 사정으로 예약시간에 오지 않는 경우 남은 백신은 폐기해야..\nbit.ly', ""네 기간내에 가야해요\n잔여백신예약 (코로나 백신)\n잔여백신(노쇼백신) 예약방법은 2가지에요\n■네이버 잔여백신예약방법\n네이버에서 잔여 백신을 조회할 경우에는 네이버 앱·네이버 지도앱 또는 네이버 웹에 접속해 검색창에 '잔여 백신'을 검색하면 지도 플랫폼에 위탁의료기관 및 남은 백신 수량이 표시 \n■카카오톡 잔여백신 예약방법\n카카오에서는 카카오톡 하단의 샵(#) 탭에서 '잔여 백신' 탭을 선택하거나 카카오 맵 앱을 통해서 잔여 백신 조회가 가능하다. 잔여백신 수량이 3개 이하로 남아있을 경우에는 빨간색, 4∼6개까지는 노란색, 7개 이상은 초록색 표지가 각 접종기관 위에 나타납니다.\nAZ 백신 접종을 권장하지 않는 30세 미만(1992년 1월 1일 이후 출생자) 등은 잔여 백신 당일 예약이 불가합니다\n+ 추가로 기본적인 코로나 백신 예약 안내 접종 시기 등은\n아래 참고하세요\n<코로나 백신 접종> 순서, 횟수, 나이, 우선순위, 시기, 방법\n대한민국 국내 코로나 백신 접종 코로나 백신 접종시기 _  먼저 국내 코로나 백신 접종대상은(?) 대상은 전국민 입니다. (단 백신 개발과정에서 임상시험에 포함되지 않은 임신부와 18세 미만 소아청소년은 접종..\nzero-news.tistory.com"", '코로나 백신 예약 일정입니다.\n- 70~74세(1947년~1951년), 만성호흡기장애인 : 2021.05.06(목) ~ 06.03(목)\n- 65~69세 (1952년~1956년) : 2021.05.10(월) ~ 06.03(목)\n- 60~64세 (1957년~1961년), 어린이집/유치원/초등1,2교사 등 : 2021.05.13(목) ~ 06.03(목)\n75세 이상 접종은 5월 22일부터, 65~74세 접종은 5월 27일부터, 60~64세 접종은 6월 7일부터 실시됩니다. 해당 대상자는 아스트라제네카 백신을 접종받게 됩니다.\n예약은 코로나19 백신 접종 온라인 사전예약 사이트(ncvr.kdca.go.kr) 또는 ARS(1339) 에서 가능하며, 본인 또는 자녀나 배우자 등 대리인이 예약하는 것도 가능합니다.\n자세한 내용은 아래를 참고해주세요.\n코로나 백신 접종 사전 예약 방법\n현재 60~74년생(1947~1956년생) 예약이 실시 중인데 5월 13일부터는 60~64세 어르신들도 대상이 됩니다. 코로나19 백신 대상 및 예약방법에 대해서 자세하게 알려드리겠습니다. 사전예약기간 2021.05.06(목) ~ 06..\nbit.ly', '두질문다 다 맞습니다 ~\n© schluditsch, 출처 Unsplash']",4,https://kin.naver.com/qna/detail.naver?d1id=7&dirId=7010107&docId=390812681&qb=67Cx7Iug&enc=utf8&section=kin&rank=55&search_sort=3&spq=0,감염내과
6,2021.05.27,"['검색질문', '통합검색궁금증', '통합검색질문하기']",잔여백신 시스템,"잔여백신 예약완료한거 병원에서 전산오류라고 오지말라더니
병원은 취소 했다는데 ..예약내역 취소도안되어 알림도못받아~ 질병청 콜센터도 상담원마다 난몰라 6번으로거세요 1번으로거세요~네이버는 기본인 고객센터도없지. 예약됐던병원은 오늘안엔 처리 된다고하드니 취소안되고 계속 전화도안받고..팩스돌리고..

집앞에 카톡네이버예약뜨기전에 전화대기걸어둔거 갑자기 나왔다 그래서 저녁6시에 겨우 시간 맞춰갔는데 전산이막혀서 안된다니..^^?
이건뭐 개똥같은소리????


아무리 시범운영이라지만, 카톡첨에먹통이라 네이버로 했는데.......

이런건 누구책임이에요? 네이버인지 질병청인지 시스템관리 정말 구리네요.. 시간낭비 백신낭비.

제대로하세요.","[""에효.. 오늘 첫날이라\n오류가 많은듯 하네요..\n잔여백신예약 (코로나 백신)\n잔여백신(노쇼백신) 예약방법은 2가지에요\n■네이버 잔여백신예약방법\n네이버에서 잔여 백신을 조회할 경우에는 네이버 앱·네이버 지도앱 또는 네이버 웹에 접속해 검색창에 '잔여 백신'을 검색하면 지도 플랫폼에 위탁의료기관 및 남은 백신 수량이 표시 \n■카카오톡 잔여백신 예약방법\n카카오에서는 카카오톡 하단의 샵(#) 탭에서 '잔여 백신' 탭을 선택하거나 카카오 맵 앱을 통해서 잔여 백신 조회가 가능하다. 잔여백신 수량이 3개 이하로 남아있을 경우에는 빨간색, 4∼6개까지는 노란색, 7개 이상은 초록색 표지가 각 접종기관 위에 나타납니다.\nAZ 백신 접종을 권장하지 않는 30세 미만(1992년 1월 1일 이후 출생자) 등은 잔여 백신 당일 예약이 불가합니다\n+ 추가로 기본적인 코로나 백신 예약 안내 접종 시기 등은\n아래 참고하세요\n<코로나 백신 접종> 순서, 횟수, 나이, 우선순위, 시기, 방법\n대한민국 국내 코로나 백신 접종 코로나 백신 접종시기 _  먼저 국내 코로나 백신 접종대상은(?) 대상은 전국민 입니다. (단 백신 개발과정에서 임상시험에 포함되지 않은 임신부와 18세 미만 소아청소년은 접종..\nzero-news.tistory.com"", '잔여백신(노쇼백신)의 예약이 가능해집니다. 카카오나 네이버를 통해 쉽게 예약을 할 수 있습니다. 노쇼백신에 관해 질병관리청의 자료를 바탕으로 자주묻는 질문을 정리해보았습니다. \n관련 내용은 아래 링크를 참고해보세요.\nhttps://bit.ly/3hUcrwU\n노쇼 백신 접종 예약 신청 방법\n코로나19 백신 접종이 5월 27일부터 사전예약한 만 60세~74세 어르신들을 대상으로 시작됩니다. 아스트라제네카 백신 접종이 활성화 됨에 따라 피치못할 사정으로 예약시간에 오지 않는 경우 남은 백신은 폐기해야..\nbit.ly', ""트래픽 폭증으로 에러 투성이네요.\n차츰 좋아지길 기대합니다\n코로나 백신 예약 일정\n- 70~74세(1947년~1951년), 만성호흡기장애인 : 2021.05.06(목) ~ 06.03(목)\n- 65~69세 (1952년~1956년) : 2021.05.10(월) ~ 06.03(목)\n- 60~64세 (1957년~1961년), 어린이집/유치원/초등1,2교사 등 : 2021.05.13(목) ~ 06.03(목)\n네이버 노쇼 백신 예약\n네이버에서 잔여 백신을 조회할 경우에는 네이버 앱·네이버 지도앱 또는 네이버 웹에 접속해 검색창에 '잔여 백신'을 검색하면 지도 플랫폼에 위탁의료기관 및 남은 백신 수량이 표시된다.\n잔여백신 카카오톡\n카카오에서는 카카오톡 하단의 샵(#) 탭에서 '잔여 백신' 탭을 선택하거나 카카오 맵 앱을 통해서 잔여 백신 조회가 가능하다. 잔여백신 수량이 3개 이하로 남아있을 경우에는 빨간색, 4∼6개까지는 노란색, 7개 이상은 초록색 표지가 각 접종기관 위에 나타난다.\nhttps://453010star.tistory.com/1507\n잔여 백신 예약 대상 조회 및 신청방법 [카카오톡 네이버]\n잔여 백신 예약 대상 조회 및 신청방법 [카카오톡 네이버] 5월 27일부터 네이버와 카카오 앱으로 신종 코로나바이러스 감염증(코로나19) '잔여 백신'을 조회하고 당일 예약으로 접종까지 받을 수 있다...\n453010star.tistory.com"", '잔여백신 예약 취소할 수있습니다. 잔여백신 취소 전 확인해야할 상황 그리고 방법\n정리해두었습니다. 어렵게 예약 하신만큼 잘 취소하셔서 불이익 없으셨으면 합니다.\n아래 글을 확인해주세요.\n잔여백신 예약 취소 하는 방법\n잔여백신이 풀리면서 많은 분들이 예약을 하시는데 그중에 취소를 원하는 분들이 또 많습니다. 오늘은 잔여백신 예약 취소 방법 알려드리려고 합니다. 잔여백신 예약 취소 하는 방법 이곳을 보시면 됩니다. 목차..\nm.site.naver.com', ""오늘 첫날이라\n오류가 많은듯 하네요..\n잔여백신예약 (코로나 백신)\n잔여백신(노쇼백신) 예약방법은 2가지에요\n■네이버 잔여백신예약방법\n네이버에서 잔여 백신을 조회할 경우에는 네이버 앱·네이버 지도앱 또는 네이버 웹에 접속해 검색창에 '잔여 백신'을 검색하면 지도 플랫폼에 위탁의료기관 및 남은 백신 수량이 표시 \n■카카오톡 잔여백신 예약방법\n카카오에서는 카카오톡 하단의 샵(#) 탭에서 '잔여 백신' 탭을 선택하거나 카카오 맵 앱을 통해서 잔여 백신 조회가 가능하다. 잔여백신 수량이 3개 이하로 남아있을 경우에는 빨간색, 4∼6개까지는 노란색, 7개 이상은 초록색 표지가 각 접종기관 위에 나타납니다.\nAZ 백신 접종을 권장하지 않는 30세 미만(1992년 1월 1일 이후 출생자) 등은 잔여 백신 당일 예약이 불가합니다 http://m.site.naver.com/0O61B\n잔여백신 예약 조회 및 당일 예약 가능(네이버, 카카오)\n잔여백신 예약 조회 및 당일 예약 가능(네이버, 카카오) 5월 27일부터 네이버와 카카오의 지도 앱에서 잔여 백신 예약을 할 수 있게 되었습니다. 잔여 백신 예약 시스템은 현재 시범 운..\nm.site.naver.com\nhttp://m.site.naver.com/0LPhv\n<코로나 백신 접종> 시기, 순서, 나이, 우선순위\n<코로나 백신 접종> 시기, 순서, 나이, 우선순위 2월 26일부터 코로나에서 벗어나기 위한 희망인 코로나 백신 접종이 시작이 되었어요. 대통령을 시작으로 전국에 백신이 배달되어 각 지역마다 1호 ..\nm.site.naver.com""]",5,https://kin.naver.com/qna/detail.naver?d1id=4&dirId=410&docId=390812716&qb=67Cx7Iug&enc=utf8&section=kin&rank=54&search_sort=3&spq=0,"경제 기관, 단체"
6,2021.05.27,[],백신 예약 30세 이상 부터 라는데 왜 1992-01-01 이전 출생자 인가요?,1992-07 출생이라 30세 인데 왜 해당이 안되는지 궁금해요,"['만 나이를 기준으로... 그해 출생한 사람을 기준으로 나누고 있습니다.', '만 나이로 계산해서 나오는 수치입니다.  ^0^,']",2,https://kin.naver.com/qna/detail.naver?d1id=7&dirId=7010107&docId=390813034&qb=67Cx7Iug&enc=utf8&section=kin&rank=53&search_sort=3&spq=0,감염내과
6,2021.05.27,[],백신 질문 합니다, 백신 30대 백신 언제 하나요?,['우선접종 대상자가 아닌 \n30대 일반인은 3분기 (7~9월) 접종대상 입니다.'],1,https://kin.naver.com/qna/detail.naver?d1id=1&dirId=10201&docId=390813124&qb=67Cx7Iug&enc=utf8&section=kin&rank=52&search_sort=3&spq=0,웹브라우저
