page,date,tags,questions,questions_add,answers,N_answer,url,category
16,2020.12.15,"['#동영상답변', '#지식인카드', '#지식인카드']",아토피 얼굴에까지 올라오네용,"원래 몸에만 있던 아토피가 22살되서 술 엄청마시고 난 후 얼굴에 두드러기가 엄청 나더니만 얼굴에까지 아토피가 올라ㅏ온 것 같아요

방치하니 겨울되니까 엄청 심해져서 피부과를 갔는데
약 먹고 바르는 1~2주정도는 깨끗하게 나았다가 엊그제 약 다 먹어서 평소대로 지내니 다시 또 얼굴이 가렵네요..ㅠ

성인 되면 아토피 낫는다더니만 더 심해졌어요. 처음으로 피부과 가서 약 먹으니 지금은 몸이랑 얼굴 상처 다 나을만큼 완화가 됐는데

약을 안 먹으면 다시 올라오는 거 같네요. 병원 의사 아저씨가 심해지면 다시 오라하시던데 전 그럼 평생 약먹으면서 살아야 되나요? 아토피 피부약도 내성이 생긴다면 이제 약빨 들어먹지도 않을텐데.

먹는 피부약도 몸에 안좋다던데 지금은 백수라 괜찮지만 곧 일하게 되거나 공부를 한다면 한창 꾸밀 나인데 화장도 못할 수도 있고 이럴 때 마다 무책임한 말이지만 사는 의미가 없네요.

귀찮아요 그냥 모든게. 돈도 없어서 피부에 좋다는 거 하기도 어렵고. 평생 안나을 거 같은 아토피 낫더라도 이미 흉터때문에 돌이킬수도 없고.

그냥 인생 한탄 해봤어요. 귀찮게 이것저것해도 돈들고 낫더라도 잠깐뿐이고ㅠ 아토피를 주던가 무기력함을 주던가 하나만 하지

두개 다 줘서 이도저도 못하고 우울해지네요.","['우리는 피부의 산도를 건강하게 유지할 필요가 있습니다. 아토피 피부는 대부분 약알칼리성의 산도를 보입니다. 우리 피부의 장벽이 건강하게 피부를 보호할 때, 산도는 약산성을 띕니다. 약알칼리성의 피부는 외부 오염에 취약하여 피부병에 걸리기 쉬워집니다. 털로 몸을 보호하는 동물의 피부가 약알칼리성의 산도입니다. 그러므로 기초화장품을 약산성의 제품을 사용하여 피부의 산도를 맞춰 주세요.\n아하+바하 토너를 사용한다면 피부의 산도를 약산성으로 맞출 수 있으며 필링 성분인 아하가 흉터 자국등을 연화하여 피부결을 고르게하여, 바하가 염증을 완화합니다. 사용 후 건성 피부라면 피지와 성분이 비슷한 호호바오일을 로션이나 크림에 섞어 발라주세요. 지성이라면 산뜻한 보습제품을 발라주세요. 자외선에 취약하니 밤에 사용해주세요. 자극이 있으니 놀라지 마세요\nhttps://coupa.ng/bNOa0l\n코스알엑스 아하 바하 클래리파잉 트리트먼트 토너\nCOUPANG\ncoupa.ng\nhttps://coupa.ng/bNOa2d\n데저트에센스 100% 퓨어 호호바오일\nCOUPANG\ncoupa.ng\n둘 다 만원이 안되는 가성비 슈퍼갑의 제품입니다. 평소 데일리 케어도 치료만큼 중요합니다.\n파트너스 활동을 통해 일정액의 수수료를 제공받을 수 있으며\n채택 시 콩은 불우이웃에게 사용됩니다.', 'https://www.amarda.co.kr/product/detail.html?product_no=61&cate_no=1&display_group=2\n건조한 문제성 피부를 위한 솔루션 세트\n아말다 세트(토너500ml+크림50g+선크림50ml)\nwww.amarda.co.kr', '현대 의학 불치병 병.   포기 하지 마세요\n아토피 피부염 \n사타쿠니가려움. \n주부습진 여드름\n얼굴 가려움\n알러지파부\n곰팡이피부염  \n두피지루성가려움 비듬 각질\n포기하지 마세요 \n지구 사람 환경파괴로 인해 알 수 없는 \n피부병에 \n현대인들은 고통 받고 있습니다.\n공기 오염\n 물 오염\n 먹거리 오염\n피부에 바르는 화장품 샴푸 파마 \n염색 세제 화학물질 피부침투?\n지구 사람 환경 생활하는 대부분이 화학물질로\n오염되어 있습니다\n국가도 기업도 양심이 오염 되어있습니다\n.우리의 건강 은 국가나 기업이 책임져 주지 않습니다\n자신의 건강은 자신이 지켜 나가야 합니다\n국제 비영리 환경 단체 보고 서에의하면\n 북국곰 \n나르는 새\n임산부 피를 빼서 검출 해 보면 \n화학 성분이 280여가지 검출 된다고 합니다\n          아토피 피부질환은 두 종류가있습니다\n1 엄마로부터 유전 된 아토피 \n 2 생활습관 먹거리  환경의한\n아토피 피부질환\n 임신하고 약을먹었다던가\n엄마의 먹거리 인스턴트 음식 화장품 샴푸 파마\n염색 등등\n화학 성분 선택에 따라 아기 의 행복과 불행이 태어나면서 시작 됩니다\n우리 몸은 60조에서 100조 세포로 유지되고 세포는 먹거리로 만들어 집니다. \n환경 파괴로 인하여 지구의생명체가 \n사라져 가고 있으며 \n먹거리의 농약 잘 유물  등등 \n화학성분 남용으로\n현대 의학 치료가 안되는 희귀병\n아토피 \n피부병 \n곰팡이 염 \n사타구니 가려움 \n얼굴가려 움\n두피 가려움 움\n몸 가려움 \n기저귀 발진\n농약 중화독\n주부습진\n피부염 \n생활 속에서 사용하는 화학 제품\n삼푸. 주방세제 화장품 헤어제품 파마 염색\n인해 가려움 의 고통을 받고 있습니다\n  아토피 피부병 가려움이생기면 \n병원, \n한의원  좋다는 것 이것저것\n 다해 보지만\n반복적으로 아토피. 피부 염 가려움은 더 심해지고 \n완치되지 않기 때문에 \n이병원 저병원 한의원 이곳저곳 민간요법 \n다해 보고 시간 돈낭비만  하게 여. 지쳐서 포기 하게 됩니다\n          아토피 치료가 됩니다\n천연100% 탄산 온천에서 탄생한 \n 음이온 조정액을 추천합니다\n옛부터\n피부병 은 온천을 찾아 치료 했다는 \n문헌이 세계적으로 얼마든지 많이있습니다\n천연 100% 온천치료 법을 알고 계시나요\n세계 24개국특허 \n탄산온천 이온추출성공  \n음이온조종액 \n하버드대학교\n도쿄대학교\n옥스퍼드  대학병원에 서 치료 후\n효과가 없으면 \n환불 해 줍니까\n한의원에서 환불 해줍니까\n상담후 \n음이온조정액 상용후 효과없으면\n인류역사 최초\n세계 최초100% 환불해드립니다\n자동차 수리 후 수리가 안 되면 환불 받는 건 당연 하지 않겠습니까\n병원 한의원은 환불 안 해 주지만\n반드시상담 후\n음이온조정액 \n사용 후 효과 없으면 \n인류 역사 최초  \n세계 최초\n100% 환불 해 드립니다\n이오너스회사의 명운을 걸고 약속 드리겠습니다\n아토피 피부염 가려움 개인 차이 나이 상황에 따라\n다르게 반응나타나므로 \n맞춤형 형 상담이 필요합니다\n 맞춤형상담 02 502-6969\n   네이버   구굴\n1 음이온 조정액. \n2 이 오 너스\n3 3D 스파\n클릭 \n          피부에  생기는 질병알아야 산다\n습진 여드름 건선과 같은 모든 종류의 피부 질한은공통적으로한가지  원인을 공유 한다\n피부질환을 가지고 있는 대부분 사람들은 소화기 장애를 동시에 겪고 있으며 특히 피가 맑지 못하다\n또한 불규칙적인 식습관과 생활 습관 을한다는 것이다 \n  흔히 피부질환이라 부르는 것도 \n사실은 몸은 자신을 스스로 보호하려는 노력 의 일 부분이다 \n대장과 신장 간 림프계에서 없애거나 해독하지 \n못한 것을 제거하려는 \n과정에서 피부 아래쪽은 \n산성 노페 물로 넘처나는 과중한 부담을 않게 된다 \n피부는 몸에서 가장 큰 배설 기간임에도 불구하고 몸 안에서 부터 시작된 산성 물질을 공격에 결국은 굴복하게 된다\n독성물질은 제일 먼저 진피 아레쪽에있는 결합조직에 쌓인다\n이 노폐물 이 창고가 가득 차면 피부 트러블이 생기면서 발진이 일어난다\n피부세포와 피부에 있는 면역체계는 노출 된 독성물질이나 \n항원이 어떤 종류인지 따라 각기 다른 방식으로 반응 할 수 있다\n오늘날에는 백신주사 오염된 공기 가공식품 \n불소 나 염소로 처리 된 수돗물 화장품 염색 파마제보디 케어 \n제품 등을 통해. 수만은 독성 황 물질이 몸쪽으로 유입 될 수 있다\n이 때문에 글자 그대로 수천 가지의 서로 다른 피부 상태가 있을 수 있다\n따라서 면역체계는 막 닥드린독성 물질이나 항원의 종류에 따라 매번 다른 방식으로 반응을 해야 한다\n이것은 어떤 사람에게 나타난 피부 문제가 다른 사람에게서 완전히 똑같이 나타난다는 경우는 절대 없음을 의미한다\n다시 말해 어떤 사람의 습진 여드름 건선 지성 등의 피부질환으로 고통을 겪고 있다면 \n그것은 그 에게에서만 볼 수 있는 특별한 것이라는 말이다\n그렇기는 하지만 대부분 피부질환이라는 염증 \n종창  피부 변색 등을 동반한다\n서로 다른 여러 경로를 통해 들어온 과도한 양의 \n독성물질 산성 물질세포 장애물 미생물 \n그리고 제대로 소화 되지 않은 음식물에서 \n나온 여러 가지 항원 물질이 림프계의폐색을 \n일으키고 \n피부 여러 층에서 림프 액이적절하게 \n배출 되는 것을 가로막는다\n손 상을 입거나 파게 된 피부세포에서 나온 독성 물질과. 부패 중인 단백질이 미생물을 끓여드리고\n피부의 끊임없는 자극과 감염을 일으킨다 \n이제 피부세포는 영양 결 핍 으로 \n고통을 격 기 시작 하며 \n그로 인해 4주에서 6 주에 한번 꼴로 일어나는 \n세포교체 \n속도가 급속하게 떨어진다\n이것은 다시 피부신경 의 광범위한 손상의로 \n이어진다\n원인은 독성물질 하나인데사람마다 \n천차만별로 피부에 반응이 나타난다는 것이다\n독성물질을\n피부에 빼낼 수만 있다면 피부 질환은 간단하게 \n해결할 수 있다는 것이 된다\n그 독성물질을 피부에서 빼내는것이바로\n탄산온천에서 탄생한\n세개 \n24 개국 제도특허\n음이온조정액 이다\n지루성 건성 주부습진 사타구니 피부염 곰팡이염 얼굴 가려움 효과없으면 100% 환불 3D스파 : 이오너스\n사용 후 효과 없으면 100% 전액 환불\nnaver.me\n00:00 | 01:18\n화질 선택 옵션\n자동\n\n접기/펴기\n이오너스\n00:00 | 04:28\n화질 선택 옵션\n자동\n\n현대 의학 불치병 병. 포기 하지 마세요 아토피 피부염 사타쿠니가 (1)\n아토피 포기하지 마 세하세요 치료 가능합니다', '안녕하세요.\n네이버 지식인으로 피부질환을 상담하고 치료하는 한의학박사 나헌식 원장입니다.\n글 내용을 읽어보니,\n얼굴까지 아토피 증상이 발생하여,\n피부과에서 치료하고 있지만 증상이 낫지 않고 반복하여 나타나 질문을 주셨군요.\n아토피의 원인은, \n피부의 독립적인 기능중에 체온조절 기능이 떨어져 발생하는 증상이며,\n체질개선의 방법으로 치료될 수 있는 증상이니 치료에 자신감을 갖으시길 바라겠습니다.\n아토피에 대한 자료를 올려드리니 참고하시길 바라겠습니다.\n아토피는 우리가 섭취하는 음식물로 인하여 증상이 발생하는 것이 아니어서,\n어떤 음식이든지 가리지 않고 섭취하여도 괜찮으며,\n생활습관이 잘못되어서 아토피가 발생하는 것은 아니니,\n생활하는데 주의할 사항은 탁히 없습니다.\n아토피의 원인을,\n열이 많고 독이 있어서...면역기능이 약해져서...기혈순환이 안되어...내적인 건강에 문제가 있어서..등등으로 원인을 진단하는 곳이 많은데,\n저는 그렇게 원인을 진단하지 않고,\n피부의 여러가지 기능중에 체온조절 기능이 떨어져 나타나는 증상으로 진단합니다.\n아토피는,\n피부의 여러가지 기능중에 체온조절 기능이 떨어져 발생하는 증상입니다.\n아토피는 피부의 여러가지 기능중에 체온조절, 열 배출과 연관이 있으며,\n내적인 건강과는무관한 증상입니다.\n피부의 독립적인 여러가지 기능중에 체온조절 기능이 떨어지면,\n몸에서 유발되는 열이 피부의 땀구멍을 통하여 빠져나가지 못하기 때문에,\n피부 내측에 열이 누적됩니다.\n열이 누적되면,\n누적되어 있는 해당 부위의 피부 표면에 붉은 증상이 보입니다.\n피부 내측에 누적된 열이 피부에 있는 가는 모세혈관을 확장하여,\n피부 표면에서는 빨갛게 발진이 보이며,\n열은 발산작용이 있어 땀구멍을 뚫고 빠져 나갈려고 피부를 자극할 때 따갑거나 가려운 증상을 느끼는 것입니다.\n인체의 생리적인 기능은,\n열이 발생하여 누적되어 있으면 그 열을 식히기 위하여 물이 모입니다.\n물이 열과 합쳐지면 탁한 물이 형성되고,\n그 탁한 물을 우리는 보통 진물이라고 표현하는데,\n좁쌀처럼 수포가 발생하기도 하고,\n피부 내측에 진물이 피부의 땀구멍을 뚫고 나와서 건조되어 각질이 보이기도 하며,\n증상 부위엔 열이 누적되어 머물러 있기 때문에 해당 부위의 피부 표면은 당연히 건조한 증상이 나타나는것입니다.\n다시 설명드리면,\n1), 피부의 정상적인 기능이 떨어져 빨갛게 발진(내적인 열이 많다는 표시로...)이 보이거나,\n2), 증상 부위가 건조(증상 부위의 내측에 열이 많으면 그 위의 부위는 당연히 건조하게 됩니다)하고,\n3), 누적된 열은 발산작용이 있어 피부의 땀구멍을 뚫고 나올려고 (피부의 정상적인 기능에서는 피부 내측의 열이 땀구멍을 통하여 수분이나 땀의 형태로 빠져나와 체온 조절을 해 주는 기능이 있기 때문에...) 자극을할 때에 따갑거나 가려운 증상을 느끼게 되며,\n4), 증상이 심해지면 피부 내측에 고여있는 진물이 포화 상태가 되면 피부를 뚫고나와 진물 형태를 보이거나 건조되어 각질을 형성하게 됩니다.\n아토피의 증상 형태를 보면 빨갛게 발진이 보이고 가려우며 건조하고 부스러기 같은 각질이 발생하는 것을 알 수 있는데,\n위와같은 원리로 그런 증상이 나타난다고 생각할 수 있습니다.\n증상이 있는 부위는 피부내측에 열이 배출되지 못하고 머물러 있음으로써 증상부위에서 열감을 느끼는 것입니다.\n피부 증상이 나타나면 열이 많다고 하여,\n열을 내리는 방법으로 치료하는 곳이 있긴 하지만,\n저는 열이 많아서 발생하는 증상이 아니고,\n열이 배출되지 못하여 발생한 증상으로 원인을 진단하기 때문에,\n열이 원활하게 배출될 수 있도록 치료해야만 한다고 생각합니다.\n아무리 열이 많아도 피부가 정상적인 기능을 해 준다면,\n그 열은 땀구멍을 뚫고 잘 빠져 나가기 때문에,\n피부 트러블을 유발하지 않지만,\n피부가 정상적인 기능을 하지 못한다면 배출되지 못함으로써 약간의 열에도 피부 증상이 나타납니다.\n아토피 치료는 피부기능이 개선되어 정상적인 기능을 할 수 있도록 치료하는 것이 중요한데,\n체질개선 방법으로 치료될 수 있으니,\n피부과에서 치료를 했는데도 낫지 않으면 치료방법을 바꿔보시길 바라겠습니다.\n체질개선으로 몸의 기능을 활성화시키면 몸의 일부위인 피부기능은 정상적인 기능을 회복하게 되고,\n정상적인 기능이 회복되면 아토피 증상은 자연스럽게 치료가 된다는 말씀을 드립니다.\n그리고 아토피는,\n우리가 섭취하는 음식물이나 환경적인 영향에 의해 발생하는 증상은 아니니,\n어떤 음식이든지 섭취하시고 일상생활에서 주의할 점은 없습니다.\n아토피는 한방적인 체질개선 방법으로 치료가 가능한 증상으로 설명드리니,\n치료에 자신감을 갖기를 바라겠습니다.\n아토피를 한의원에서 치료하고자 할 때에는,\n체질개선 방법이라도 한의원마다 치료방법이 다르고,\n한의원마다 치료비용도 많은 차이가 있으니,\n잘 검토하고 신중하게 선택하시길 바라겠습니다.', '아토피로 고민이 많으시군요, 아토피는 갑자기 생길 수도 있습니다\n일단 병원에 가서 아토피인지 검사를 받아보시는게 좋을 것 같습니다\n피부과에 가면 당연히 스테로이드 처방을 해줍니다. 하지만 남용을 해선 안되는 약물 중에 하나 인데요,\n스테로이드 연고 없이도 치유가능한 비타민D 자외선요법을 소개해드립니다\n아래 내용이 도움이 되셨으면 좋겠습니다.\n아토피 관리에 있어서 비타민D가 효과적이라는 뉴스가 있습니다\n비타민 D 부족하면 아토피 피부염 증상 악화\n-2016.06.06 / 파이낸셜뉴스\n비타민 D가 부족하면 아토피 피부염 증상이 악화될 수 있는 것으로 나타났다. 비타민 D는 햇볕을 쬐면 몸 안에서 생성되며 음식으로도 섭취할 수 있다.\n울산대병원 피부과 서호석 교수팀은 2013∼2014년 아토피 피부염 어린이(19세 이하) 61명을 포함한 총 181명의 어린이를 대상으로 조사했다고 6일 밝혔다.\n서 교수는 ""아토피 어린이의 혈중 비타민 D 농도가 낮을수록 증상이 심했다""며 ""비타민 D 결핍이 기존 아토피 환자의 증상 악화을 악화시킬 수 있다""고 설명했다. \n햇볕을 덜 쬐거나 비타민 D 함유 식품을 적게 섭취해 혈중 비타민 D 농도가 낮은 아토피 환자에게 비타민 D를 보충해주면 증상이 호전될 수 있다는 것이다.\n연구팀은 어린이의 아토피 증상이 얼마나 심한지를 보여주는 스코라드 지수(SCORAD index)를 산출했다. 스코라드 지수는 피부과 의사가 환자에게 질문을 던지거나 직접 환자 상태를 눈으로 확인한 뒤 매긴다. 아토피의 범위가 넓을수록, 의사가 확인한 증상이 심각할수록, 가려움증ㆍ수면 장애 등 환자가 느끼는 주관적 증상이 심할수록 스코라드 지수가 높아진다.\n이번 연구에서 햇볕 노출시간이 길수록 어린이의 혈중 비타민 D 농도가 높았다. 하지만 대상자의 연령대가 높을수록 혈중 비타민 D의 농도는 낮았다.\n서 교수는 ""학년이 높아질수록 선크림, 모자 등의 사용이 많아지고, 과도한 학업 부담 등으로 인해 햇볕을 쬘 수 있는 외부 활동이 줄어들기 때문""이라고 분석했다.\n일반적으로 어린이의 혈중 비타민 D 농도가 혈액 1㎖당 15ng(나노그램, 10억분의 1g) 미만이면 결핍, 15∼20ng이면 부족, 20ng 이상이면 충분한 상태이다.\n이번 연구결과는 대한피부과학회지 최근호에 소개됐다. \n아토피 치료의 시작은 적절한 일광욕\n2014.05.19 일요서울\n박치영 한의학 원장\n한의학에서 양기(陽氣)는 생명력을 의미한다. 생명력 자체라고 할 수도 있고 생명력을 유지하는데 필수불가결한 요소이기 때문이다. 지구상의 모든 생물체는 햇빛에 의해서 각기 필요한 에너지대사를 유지하면서 생명력을 유지한다. 우리 인체와 피부도 이처럼 햇빛에 의해서 양기를 보충하고 활성화하면서 생명활동을 연속하게 된다.\n피부학적인 측면에서 볼 때 햇빛이 가진 치유력은 매우 놀랍다. 피부 진피층 아래 깊은 곳까지 침투해서 치유력을 발휘하고 피부조직의 재생력을 극대화한다. 게다가 각종 세균과 바이러스, 진균 등을 소독하고 제거하며 알레르기 반응을 억제하는 역할도 한다. 그래서 햇빛에 꾸준히 오래 노출되면 자연스레 피부가 검어지고 각질층이 두꺼워진다. 피부 속 멜라닌 색소가 늘어나 검어질수록 외부 자극에 대한 방어 능력이 높아지기 때문이다.\n피부과학적으로 햇빛을 쬐면 자외선에 의해 비타민 D가 합성된다. 비타민 D는 달걀노른자, 간, 생선 등에 들어 있지만 음식을 통해서는 거의 합성되지 않고 대부분 햇빛(자외선)이 피부에 자극을 주면 합성이 일어난다고 알려져 있다. 이처럼 햇빛은 인체 생리 기능을 활성화하는데 필수불가결한 존재다.\n한약과 비타민을 복용하지 않더라도 일광욕을 꾸준히 하는 것만으로도 피부는 튼튼해진다. 하루 30분~1시간 정도의 일광욕은 피부의 각질을 두껍게 하고 피부를 건강한 조직으로 유지시키는 데 기여한다. 그런데 현대인들은 자외선에 대한 과잉된 공포심으로 인해 아토피 피부염을 앓고 있으면서도 자외선 차단제를 듬뿍 바르고 외출하는 경우가 많다.\n아토피 피부염이나 습진 환자의 경우에는 적당한 양의 햇빛에 노출되도록 일광욕을 꾸준히 하는 것이 좋다. 자외선이 피부노화와 주름을 유발한다는 이유로 무조건 피해야 하는 것은 아니라는 것이다. 특히 피부질환으로 고생하고 있는 분들에게는 일광욕이 실보다 득이 더 많은 것은 분명한 것이다.\n아토피 피부염이나 건선을 앓고 있는 환자들의 경우 대부분 피부색이 하얀 편이다. 피부가 검은 환자들은 아토피 피부염이나 건선 등에 걸릴 위험이 상대적으로 낮다. 만약 걸리더라도 하얀 피부를 가진 환자들보다 치료 속도가 더 빠르다는 것을 오랜 진료 경험을 통해 확인할 수 있었다. 물론 유전적 요인이나 다른 생활습관의 영향도 있겠지만 피부 건강을 위해서는 확실히 적절한 일광욕이 도움이 된다.\n햇빛이 강한 한여름에 갑자기 일광욕을 시작하면 화상을 입을 수 있기 때문에 봄부터 일광욕을 시작하는 것이 좋다. 최소 5월부터는 서서히 하루에 30분 이내로 햇빛에서 활동하면서 피부의 적응력을 높여줘야 한다. 6~7월이 돼 갑자기 야외활동을 늘리면 지나친 자외선 노출로 인해 피부가 새빨갛게 부풀어 오르고 수포가 생기는 화상 반응을 입을 수 있기 때문이다.\n과유불급이라고 했다. 일광욕도 지나치지 않으면서 자신의 피부 상태에 맞게 적절히 조절해야 할 것이다. 서서히 노출시간을 늘려나가면서 구리빛 피부를 만들어가는 것이 중요하다.\n1년 내내 햇빛을 받아 검게 그을린 아이들이 아토피 피부염을 걱정할 것 같은가. 매연과 스모그, 아파트 숲과 아스팔트 도로에 갇힌 도시의 아이들이 산과 바다에서 마음껏 햇빛을 받으면서 뛰논다면 아토피 증세는 머지않아 사라질 것이다.\n비타민D를 합성하기 위해 필요한 햇빛은 보통 얼굴, 손, 발 등의 부위를 일주일에 2〜3회씩 화상을 입을 정도의 25% 강도로 노출하면 된다. 즉 1시간 내에 피부에 화상을 입는 사람이라면 15분간 일광욕을 하면 된다. 또 비타민 D는 뼈를 만드는 데 중요한 역할을 한다는 점도 잊지 않길 바란다.\n아토피에 좋다는 비타민D, 입보다 몸으로 섭취해야\n2013.03.19. 스포츠한국\n아토피피부염 환자에게 가장 필요한 것이 햇빛이라는 연구결과가 나와 주목 받고 있다.\n최근 강북삼성병원이 발표한 연구결과에 따르면 아토피 피부염이 의심되는 어린이 79명을 대상으로 조사한 결과 아토피 피부염 환자에서 증상이 심할수록 비타민D 농도가 결핍 혹은 부족한 비율이 높았던 것으로 나타났다. \n원영호 하늘마음한의원(강동점) 원장은 “비타민D는 마크로파지를 자극해 아토피 피부염을 유발하는 인자를 억제하는 천연항생제가 몸에서 분비되도록 돕는 효과가 있다”며 “또한 체내의 면역력을 향상시켜주고, 피부 장벽을 강화해 주는 효과가 있다”고 설명했다.\n이 같은 비타민 D는 일반적으로 입으로 섭취해서도 보충이 가능하지만 햇볕을 받는 것으로도 보충이 가능하다. 때문에 이 연구결과는 햇빛을 많이 받으면 아토피의 완화 효과도 기대해 볼 수 있다는 기대로 통할 수 있다. \n물론 비타민D는 버섯, 참치, 붕어, 꽁치, 고등어 등에서 섭취할 수 있고, 비타민 보충제로도 섭취가 가능하다. 하지만 과다섭취하면 식욕부진, 구토, 체중감소가 일어날 수 있다. 따라서 비타민 보충제는 의사, 한의사와 상담한 뒤 섭취 여부를 결정하는 것이 좋다. \n(중략)\n면역력 교란은 아토피 발병의 주원인이다. 신체 면역시스템이 교란되면 혈관이 확장되고 각질의 성장주기가 빨라지는 등 다양한 이상이 생긴다.\n----------------------------------------------------------------\n바람직한 비타민D 섭취방법은 음식과 햇빛을 통한 방법입니다\n계란이나 생선 간같은 음식을 통해서도 섭취할 수 있지만 필요한 양의 10%밖에 충족을 못 시키기때문에 햇빛을 통해 자신의 피부로 광합성을 하는것이 가장 좋습니다\n비타민D 자외선요법으로 아토피에 호전을 본 후기입니다\n비니수아님 후기입니다\n[...요즘은 아토피맘들 많으실거같은데요.\n정말 꼭 추천하고싶습니다.\n제일 큰 이유는 이건 조사기아래에 누워있기만 하면 되는거라서 아이가 치료받는 과정이 고통스럽지 않다는거!\n낫는것도 중요하지만 그 과정이 매우 고통스럽다면ㅠㅠ 부모의마음은 어떨지ㅠㅠ 아토피로 간지럽고 피나서 고통스러운것만으로도 충분한데말이죠ㅠㅠ\n첫째딸도 햇빛하는거 하나도 안아프다고 누워만있으면 된다고 좋다고 적극 협조합니다ㅎㅎ\n(이빈후과가면 자지러지는7살입니당^^;;;)\n저희딸은 호전반응보이고있습니다.\n멀린님께서도 앞으로 리바운딩이 있을 수 있으니 염려는 해두시라고 했는데 지금으로썬 호전이기때문에 맘껏 뿌듯해할랍니당! 그동안 시간투자하고 열심히 노력했답니다ㅠㅠ\n그저 리바운딩없길 바랄뿐ㅠㅠ\n사진첨부합니당\n요사진은 가장심한 오금부분ㅜㅜ\n엄청긁어댔죠.\n조사할때 진물이 나왔던사진이에요ㅜㅜ 혐오샷ㅜㅜ\n사진보다 더심했어요ㅠㅠ...\n비교하여 보기 쉽게 제일심했던부분만 사진첨부했어요.\n긁는것도 예전이 10중에 8이었다면 요즘은 10중에 3정도 에요. 긁는것도많이줄었구요.\n그리고 호전된 부분의 피부가 두껍지않고 보들보들해졌어요! 아토피 피부는 두껍자나요 울퉁불퉁하고.. 그런데 그렇지않고 부드러워져서 너무 신기했어요ㅎㅎㅎ 저만 신기한가요@.@ 헤헷...]\n네임카드통해 카페에 오시면 다양한 후기를 볼 수 있습니다\n한번 놀러오세요\n#아토피#아토피치료#아토피증상#아토피관리#비타민d#자외선요법#아토피피부관리#피부염', '안녕하세요. 네이버 지식인으로 아토피·습진, 피부질환을 상담하고 치료하는 피부질환 한의학 전문가 임은교 한의사입니다.\n이 글은 제가 10년이상 아토피습진으로 고생하면서 치유한 경험을 알려드리는 것으로 내용이 좀 많습니다. 제대로 치료를 받는 방법과 재발이 되지 않기 위해 고쳐야 할 생활습관교정에 관심이 있다면 읽어보시길 추천 드립니다.\n우선 질문에 대한 답변을 간단히 드리면 아토피, 습진과 같은 만성 피부질환은 사람마다 체질과 생활습관, 피부 증상이 심해지는 요인에 따라 치료 및 관리방법이 달라집니다. \n현재 많은 분들이 모르시는 부분이 피부질환 아토피, 습진 등은 식단조절, 배변습관, 주거환경, 생활패턴, 운동습관, 스트레스 대처요령 등을 잘 지켜서 몸의 면역기능과 소화기능을 좋게 만들어주면 병.의원에 다니면서 약을 먹거나 연고(스테로이드)를 바르지 않고도 증상을 잘 관리할 수 있다는 점입니다. \n발병 유형에 따라 즉, 신체 어느 부위에 발명한 것이냐에 따라 염증의 원인(스트레스문제/감정상태/식탐.고열량음식.과식.폭식.식사불규칙/소화기의과잉열/상열증/심장기능/자율신경/기온상승/장기능/혈액순환/하복부순환문제/면역계/수면습관)이 다를 수 있습니다. \n스테로이드 연고, 항염증, 면역억제 약을 사용하는 것은 꼭 필요할 때만! 안전하게! 증상완화 효과를 위해 사용하고, 기존에 사용하던 분들은 리바운드를 최소화 할 수 있도록 서서히 사용량을 줄이며, 한약을 먹는 것은 몸의 열을 조절하고 면역력과 소화기관을 좀 더 빨리 개선해서 치유기간을 줄이기 위해 일정기간 드신다고 생각하시면 됩니다.\n● 재발률 높은 아토피&습진치료, 연고부작용 어디까지 알고 있나요? <=[링크] 참조하시면 도움이 되실 것입니다.\n아래에 도움이 되는 내용을 올려드립니다. 아래 내용을 참조하셔서 도움 되시길 바랍니다.\n아토피피부염, 습진 치료와 더불어 식이요법과 생활관리도 중요!\n  오랜 기간동안 아토피나 습진 같은 피부질환이 잘 낫지 않고 갈수록 심해지는 환자분들의 공통점은 무엇일까요? 치료를 오랫동안 받아도 ""본인의 피부질환이 왜 생겼는지""를 모르고 연고나 약에만 의존하여 매뉴얼적인 진료만 받고 병을 키워서 오신다는 점입니다.\n충격적인 것은 생각보다 많은 분들이 의사.한의사와 병.의원을 선택함에 있어 신중하지 않다는 사실이었습니다. 일시적인 피부염, 가벼운 두드러기와 같은 피부질환은 가까운 병.의원을 찾는 게 맞습니다. 하지만 약을 먹고 연고를 발라도 잘 낫지 않거나 오랜 기간동안 지속되는 아토피, 습진과 같은 피부질환에 대해서는 얘기가 달라집니다.\n현재 질문자님께서 겪는 증상은 다양한 원인에 의해 발생합니다. 아토피, 습진 증상은 누구나 비슷하지만 원인과 치료 및 관리법은 사람마다 달라집니다.\n● 나의 아토피피부염 병변 중증도 상태체크와 생활자연치유법 알아보기 <= 참조하시면 도움이 되실 것입니다.\n즉, 피부가 붉고 간지러우며 증상이 악화되면 진물이 나거나 피부가 거칠고 두껍고 색깔이 어두워지는 현상은 비슷하지만 누군가는 육체노동을 많이 하다가 생기고 누군가는 사람은 스트레스를 많이 받다가 생깁니다. 또 다른 누군가는 잠을 푹 못자다가 생기기도 하고 야식을 자주 먹다가 생기기도 합니다. 그러면 이 사람들이 똑같이 아토피, 습진이 있다고 해도 치료와 생활관리법은 전혀 달라질 수 있습니다.\n저 또한 어렸을 때부터 한의사가 되기 전까지 10여 년간 아토피피부염으로 고생을 한 경험이 있습니다. 많은 아토피환자분들과 마찬가지로 저도 대학병원에서 알레르기 첩포 검사도 해봤지만 알레르기 반응을 보인 것도 없어 원인을 알 수 없었습니다. \n그래서 저도 여느 환자분들처럼 식이요법, 운동 등 아토피와 습진피부에 좋다는 것들을 많이 찾아서 해봤기 때문에 아토피.습진 피부 환자분들이 \'아토피에 좋은 연고, 아토피음식, 아토피로션, 습진 연고, 피부질환에 좋은 유산균\'과 같은 것들을 가장 궁금해 하시는 심정을 모르는 것은 아닙니다.\n그러나 아토피와 습진은 내게 맞는 연고를 못 찾아서, 약을 먹지 않아서, 특정 로션을 바르지 않아서, 피부에 좋은 영양제를 잘 챙겨먹지 않아서 발생한 것이 아니라는 점을 아셔야 합니다.\n저 또한 중학생 때부터 대학생 때까지 아토피피부염을 앓았던 사람으로서 당장 아토피피부염이나 습진 때문에 가렵고 괴로울 때 피부병이 왜 생기는지 보다 치료 방법, 개선방법에 더 관심이 가는 마음을 이해하지 못하는 건 아닙니다. 하지만 아토피와 습진이 왜 생기는지를 제대로 이해하는 것이야 말로 올바른 치료를 위한 첫 걸음입니다.\n진물이 심하게 나고 가려움증이 극심할 때 증상에 맞게 연고나 약을 쓰는 것 자체가 잘못된 것은 아닙니다. 그러나 그 연고와 약에만 매달려서 피부질환이 생긴 원인을 해결하지 않으면 밑 빠진 독에 물 붓는 것과 다름없습니다.\n원인을 해결하지 않으면 피부질환이 만성화되는 것은 물론이고 안면홍조, 쿠싱증후군, 혈당 증가 등의 스테로이드 부작용까지도 겪을 수 있습니다.\n아토피, 습진이 발생하는 이유는?\n  아토피나 만성 습진은 접촉성 피부염이나 음식 알레르기처럼 어느 특정 한두 가지 요인이 사라진다고 해서 낫는 병이 아닙니다. 이런 만성 피부질환은 체내 면역계가 무너지고 피부가 약해지는 여러 요인들이 누적되어 생긴 결과물입니다.\n그렇기 때문에 한두 가지 원인만 조절하는 것만으로, 즉 염증을 억누르는 치료만으로는 증상이 완전히 낫지 않고 재발되는 것입니다. 체내 면역계를 망가뜨리고 만성 염증을 만들어 아토피피부염과 습진을 악화시키는 요인은 다음과 같이 매우 다양합니다.\n불규칙한 식습관, 영양 불균형, 과체중, 부족한 수면 시간, 수면의 질 저하, 잦은 감기 치레, 온도변화에의 취약성, 부종, 소화불량, 설사, 변비, 음식 민감성, 과로, 운동 부족, 건조한 호흡기, 부족한 수분 섭취, 잔뇨감, 생리불순, 냉대하증, 유정, 성적/일/돈 스트레스, 가족 간의 불화, 짜증, 우울, 피로, …\n피부에 아토피나 습진이 생기는 것은 집에 불이 난 상황과 비슷합니다. 당장 불(염증)이 났을 때는 소화기(연고나 약)로 불을 끄는 것도 필요하지만 불이 왜 났는지(원인)를 해결하지 않으면 계속 불이 날 수밖에 없습니다. 그렇기 때문에 시간이 걸리더라도 무슨 이유로 불이 나는지를 찾고 해결해야 하는 것이 중요한 것입니다.\n가끔 아토피와 습진이 음식과 소화기 문제로만 발생한다고 생각하여 극단적인 식이요법을 하시는 분들이 계시는데요. 물론 많은 아토피, 습진 환자분들이 소화기능이 떨어져 있는 것은 사실이지만 모든 소화불량 환자분들이 아토피나 습진을 앓고 계시지는 않습니다. 피부문제는 그 원인이 그렇게 단순하지가 않습니다.\n“왜 아토피 습진은 원인을 찾는 것이 중요할까요?”\n앞서 말씀드린 것처럼 아토피나 습진은 증상은 비슷해도 사람마다 피부질환이 생긴 원인과 과정은 각각 다릅니다. 그러나 많은 분들이 피부 때문에 치료를 받으러 가면 결과물, 즉 면역계에 이상이 생겼다는 얘기만 들으셨을 것입니다.\n없었던 알레르기나 피부 질환이 생겼다는 것은 내 몸 상태가 변했기 때문입니다. 피부질환이 생긴 시점에서 생활습관이 바뀌거나 스트레스가 생기고 이로 인해 몸 상태가 변했기 때문에 피부병이 생긴 것입니다. 또는 밥먹듯이 하던 생활습관 중에서 피부에 나쁜 영향을 주는 것이 있었는데 그것이 오랜 시간 누적되어 피부병이 생긴 것입니다. 다만 사람마다 생활패턴과 스트레스, 문제가 되는 신체 증상이 각각 다르기 때문에 원인을 찾기 어려울 뿐입니다.\n오랫동안 앓았던 아토피, 습진을 10분, 20분만의 진료 상담을 통해 원인을 파악하고 개개인에 맞는 치료와 관리법을 모두 알아낸다는 것은 사실상 불가능한 일입니다. 안전하고 부작용을 최소로 줄이는, 후회 없는 치료를 생각하신다면 병.의원을 3곳 정도 방문해보시고, 진료상담은 매 진료시 마다 최소 1-2시간을 해주는 곳에서 치료를 받는 것이 가장 좋습니다.\n피부 상태뿐만 아니라 환자분들의 피부질환이 생긴 시점에서의 변화, 피부질환 이전에도 자주 불편했던 신체증상(스트레스문제/감정상태/식탐.고열량음식.과식.폭식.식사불규칙/소화기의과잉열/상열증/심장기능/자율신경/기온상승/장기능/혈액순환/하복부순환문제/면역계/수면습관)등을 찾고, 종합적으로 파악해야 각각의 환자분들이 어떤 이유로 피부질환이 생겼는지를 알 수 있기 때문입니다.\n이 과정을 통해 가장 문제가 되는, 피부에 영향을 끼치고 있는 요인이 무엇인지 파악하면 내가 어떤 부분이 조절돼야 아토피와 습진에서 벗어날 수 있을지 알 수 있습니다. 원인을 제대로 안다면 치료는 물론이고 앞으로도 어떤 부분을 조심해야 피부증상이 재발하지 않을지 까지도 알게 되는 것입니다.\n다시 한 번 강조하지만 아토피나 습진과 같은 만성적인 피부질환을 치료하기 위해서는 원인을 제대로 해결하는 것이 중요합니다. 어떤 것이 피부에 좋다더라 하는 얘기만 듣고 무작정 따라하다가 치료에 대한 의욕마저 잃지 마시고 시간이 걸리더라도 원인을 정확히 파악하여 증상을 치료하고 재발까지도 막을 수 있게 되시기를 바랍니다.\n마지막으로 잘못된 치료방법은 증상을 악화시킬 수 있으므로 섣부른 자가 진단과 자가 치료보다는 정확한 진단을 받고 치료를 받아보는 것이 좋습니다. 1~2시간이 소요되는 정밀역학진료를 받는 비용은 3만원 정도 밖에 하지 않기 때문입니다.\n※ 아래 칼럼들은 기본적으로 알아야 하는 아토피 치료에 도움이 되는 방법들 입니다.\n※ :) 현재 많은 환자분들을 만났습니다. 충격적인 것은, 생각보다 많은 분들이 한의원과 병원을 선택함에 있어 신중하지 않고, 본인이 어설프게 치료를 받고 있다는 사실조차 모른다는 점입니다. 제 블로그에는 피부질환 치료와 생활습관교정을 통해 자연치유방법을 알아보고 계신 분을 위한 글을 쓰고 있습니다. \n증상과 관련된 더 자세한 정보는 아래 네임카드의 홈페이지(블로그)를 방문해 보시면 됩니다.\n[칼럼 보러가기]● 나의 아토피피부염 병변 중증도 상태체크와 생활자연치유법 알아보기\n[칼럼 보러가기]● 아토피.습진 피부질환 치료 좋은 의사.한의사를 선택하는 법\n[칼럼 보러가기]● 10년 동안아토피피부염, 화폐상 습진 치료 경험과 더불어 식이요법도 중요\n[칼럼 보러가기]● 성인얼굴아토피 치료방법, 부위별로 원인과 치료법이 다르다.\n[칼럼 보러가기]● 목아토피, 목 주변에 발생한 아토피 피부염, 원인과 치료법?\n[칼럼 보러가기]● 허벅지에 아토피가 생기는 원인과 치료 및 완화법은?\n[칼럼 보러가기] ● 다리와 팔 접히는 부분에 생긴 아토피, 왜 발생하는 걸까?\n[칼럼 보러가기]● 아토피, 습진에 스테로이드 부작용과 리바운드 줄이는 방법\n[칼럼 보러가기]● 아토피초기증상, 어느 날 갑자기 왜 생기는 걸까?\n[칼럼 보러가기] ● 아토피,습진 관리방법 1 - 로션·크림·보습제·샤워 주의사항\n[칼럼 보러가기] ● 아토피,습진 관리방법 2 - 수면위생\n[칼럼 보러가기] ● 아토피,습진 관리방법 3 - 실내 환경 및 청소\n[칼럼 보러가기] ● 아토피,습진 관리방법 4 - 음식\n[칼럼 보러가기] ● 아토피,습진 관리방법 5 - 식습관\n[칼럼 보러가기] ● 아토피,습진 관리방법 6 - 운동\n[링크] 참조하시면 도움이 되실것입니다.\n긴 글 읽어주셔서 감사합니다. 임은교 한의사였습니다.\n계획하고 계신 모든 것들이 다 뜻대로 되시길 바라며 채택 기다리겠습니다^^\n채택으로 주어진 해피빈 콩은 어려운 사람들을 위한 모금활동에 쓰입니다']",6,https://kin.naver.com/qna/detail.naver?d1id=7&dirId=70111&docId=375887034&qb=67Cx7Iug&enc=utf8&section=kin&rank=160&search_sort=3&spq=0,피부과
