page,date,tags,questions,questions_add,answers,N_answer,url,category
31,2019.04.09,['#폐렴예방접종'],폐렴 예방접종 가격 시기 치료 조언바랍니다..,"70대 후반이신 저희 아버지께서 얼마전에 폐렴으로 입원을 하셨었고 지금은 퇴원을 하셨는데
2년에 한번씩은 고생을 하시는편이라서 폐렴 예방접종을 맞혀드리려고
가격이랑 시기 알아보다가 이렇게 글 남기게 되었습니다
치료만으로는 안될것 같아서 그러는데 비용이랑 언제 맞히는게 좋은지 아시는분 답변 좀 해주세요","['시기적으로는 기온차가 큰 봄이나 가을에 맞으시면 되구요\n65세 이상은 보건소에서 무료로 접종을 해주고\n병원마다 차이가 있어서 5~15 정도 생각하시면 될거에요\n그리고 예방접종뿐만 아니라 호흡기 건강에도 신경을 쓰셔야 하는데\n폐렴으로 자주 입원을 하셨던 저희 어머니께서는 호흡기에 좋은것들을 엄청 챙겨드렸거든요\n여러가지를 드렸었는데 제주하도건강원에서 파는 희락진액을 드시면서부터는\n기침 가래로 고생하는 일이 없어지셨고 폐렴도 걸리지 않고 계세요\n숨쉬는게 많이 편해지셨다고 하실정도로 좋아지셨는데\n폐렴으로 고생하시는분들이 많이 찾는걸로 유명하고 저희 어머니도 도움이 되고 있는거라\n이렇게 답변 남기네요', '안녕하세요. 성남시 수정구 수진역 4번출구 인근에서 성인예방접종(폐렴, 대상포진, 자궁경부암-가다실)을 중점적으로 하는 산부인과 전문의 변재광 입니다.\n폐렴은 독감의 대표적인 합병증으로 독감 백신을 접종할 때 폐렴 백신도 함께 접종하는 것이 좋구요. 또 폐렴구균 백신이 코로나 19 예방주사는 아니지만 2차로 올 수 있는 폐렴구균 폐렴이나 폐렴구균 감염 합병증을 예방하는 데 도움이 됩니다.\n춥고 건조한 계절에는 폐렴을 예방하기 위한 폐구균 예방접종도 필요합니다. 폐구균은 폐렴, 패혈증, 뇌막염의 원인이 되고, 축농증과 중이염도 일으키는 균이라서, 겨울을 잘 나기 위해서는 예방접종을 해 주는 것이 좋습니다. 65세 이상 연령대는 보건소에서 무료 접종이 가능하지만, 보다 여러 가지 폐구균 예방 효과를 얻을 수 있는 프리베나13 등을 접종하고 싶다면 가까운 병의원을 방문하면 됩니다.\n폐렴구균 백신은 다당질백신23(프로디악스)가와 단백질결합백신13(프리베나)가 2가지로 나뉘게 됩니다. 단백결합백신이 다당질백신보다 항체를 더 많이 형성하고 항체역가가 오래 지속되는 장점이 있지만, 가격이 비싸다는 단점이 있습니다. 2세 이하 소아는 단백질결합백신을 맞아야 하며 건강한 성인은 다당질백신이나 단백질결합백신 두가지 모두 접종해도 됩니다.\n다만 항체 형성 능력이 떨어지는 65세 이상 만성질환자에게는 단백질결합백신을 먼저 접종하고 일정 기간이 지난 후 다당질백신을 접종하도록 권고하고 있습니다. 그리고 폐쇄성폐질환, 기관지 천식 등 폐질환이 있는 환자도 반드시 접종해야 합니다. 그리고 23가 백신을 먼저 투여받은 65세 이상의 성인인 경우에는 1년 후에 13가 백신 접종하도록 가이드되고 있습니다. \n폐렴구균 예방접종으로 항체가 형성되더라도 예방접종 후에 시간이 오래 경과하면 항체역가가 줄어들어 예방 효과가 떨어집니다. 보건소에서 연령에 따라 무료 접종할 수 있는 23가 폐렴구균 백신을 맞았다 할지라도 5년 후 재접종을 권장합니다.\n폐렴백신 프리베나13은 9만5천원인데 병원에 따라 가격이 다릅니다.\n수두 앓은 적 있는 중년은 대상포진 예방접종이 필요한데요.\n코로나 사태로 백신의 필요성이 더욱 중요해진 이때, 고령층은 물론 성인도 접종 대상의 예외가 아닙니다']",2,https://kin.naver.com/qna/detail.naver?d1id=7&dirId=7010101&docId=324918827&qb=67Cx7Iug&enc=utf8&section=kin&rank=301&search_sort=3&spq=0,호흡기내과
30,2020.08.29,[],"코로나 백신없나요? 대한민국 거리두기 3단계
하면 경제상황 치명적임 상황ㅡㅡㅡ",,"['아직은 임상 3단계 진행 중입니다.\n러시아에서 백신을 등록했지만, 러시아 외에서는 믿지 않고 있는 듯,,,', '<질문> 코로나 백신없나요? 대한민국 거리두기 3단계\n하면 경제상황 치명적임 상황ㅡㅡㅡ \n<답변>\n1. 질문자님...백신이 개발 되었다고 해서 바로 사람에게 투여할 수 있는 게 아니고요. \n안전성이 검증되어야 합니다. 매체 상에서는 어느 나라가 개발했다, 어느 나라가 개발했다 등의 보도들이 있는데요... 정부 보건당국에서는 안정성이 검증되지 않으면 사용하지 않을 것입니다. \n사회적 거리두기 내용에 관해서는 다음 내용을 참고 하세요. \n1단계 : \n▶생활속 거리두기, 일상적인 경제활동을 하며 방역수칙 준수\n▶집단 모임 허용하되 방역수칙 준수\n▶스포츠행사, 경기 허용하되 관중 수 제한\n▶공공다중시설 이용 허용하되 필요 시 일부 중단하거나 제한\n▶민간다중시설 허용하되 고위험시설 운영 자제 명령\n(*다중이용시설 : 학원(300인 미만), 오락실, 워터파크, 음식점, 종교시설, 공연장, 실내결혼식장, 영화관, 목영장업, 실내체육시설, 멀티방, DVD방, 장례식장 등)\n▶학교, 유치원, 어린이집 등교나 원격수업\n▶공공기관, 기업은 유연 재택근무 등을 통한 근무밀집도 최소화(예컨대 전 인원의 1/3)\n▶민간기관, 기업은 유연하게 운영, 재택근무 등 활성화 권고\n2단계:\n▶외출자제, 최대한 집안에 머울기. 불필요한 외출, 모임, 외식, 행사, 여행 등 자제(연기, 취소)하고, 다중이용 시설 지용 자제\n발열, 호릅기 증상(기침, 인후통 등)시 출근하지 않고 집에서 휴식하기\n생필품 구매, 의로기관 방문, 출퇴근 제외한 외출 자제하기\n악수 등 신체 접촉 피하고 2m 거리두기\n마스크, 손씻기, 기침예절 등 개인위생수칙 준수(악수 등 금지)\n매일 주변환경 환기, 소독\n직장에서 식사시 마주보지 않고 일정 거리 두고 식사하기\n컵, 식기 등은 개인물품 사용하기\n탈의실, 실내휴게실 사용하지 않기\n퇴근후 바로 집으로 가기\n▶집합모임 실내 50인, 실외 100인 이상 금지\n▶스포츠행사, 경기는 실시하되, 무관중으로 경기\n▶공공다중시설 운영 중단\n▶민간자중시설 고위험시설 운영 중단, 기타 시설 방역수칙 준수 강제, 4제곱미터당 인원 수 제한\n▶학교, 어린이집, 유치원 등교는 하되 인원 축소 또는 원격수업\n▶공공기관, 기업 유연 재택근무 등을 통한 근무인원 제한(예컨대, 전 인원의 1/2)\n▶민간기관, 기업 유연 재택근무 등을 통한 근무인원 제한\n방역수칙위반 사항은 중앙재난안전대책본부 <안전신문고>(https://www.safetyreport.go.kr)로 신고하세요. 해당 구청에도 신고하세요. \n3단계 :\n▶모든 활동 원칙적 금지(단, 필수적 사회경제 활동 예외)\n▶집합모임 실내, 실외 모두 10인 이상 금지\n▶스포츠행사, 경기 등 모두 중지\n▶공공 다중시설 운영 중단\n▶민간 다중시설 고위험시설 운영 중단, 그외 시설 방역수칙 준수 강제화, 오후 9시 이후 운영 중단\n▶학교, 유치원, 어린이집 모든 수업 원격(온라인)수업, 또는 휴업\n▶공공기관, 기업은 필수 인원 외 전원 재택근무\n▶민간기관, 기업은 필수 인원 외 전원 재택근무 권고\n보건당국이 매체에 흘린 3단계 내용(아래에 제시해 드린 내용 참조)에 의하면 기업, 자영업자는 물론이고 개인의 자유와 경제활동이 많이 통제 됩니다. \n질문자님... 현재(8월28일), 사회적거리두기 3단계와 관련하여 아직 확정 된 것은 없습니다. \n가짜뉴스에 속지 마세요. \n다만, 8월 28일 보건당국에서 발표한 것(중앙재난안전대책본부 홈피 ""수도권방역조치 강화방안""참조)을 보면 : \n▶8월 30일(일요일) 0시부터 9월 6일(일요일) 밤12시까지, \n▶수도권에서는\n▶ 음식점, 휴게음식점, 제과점 등은 전자출입명부를 설치 이용 또는 수기명부 비치 성명, 전화번호, 신준증 확인, 4주 보관후 폐기. 탁자 1~2m 간격 유지, 주문 대지가도 1~2m 간격 유지. 밤9시까지만 영업하도록 하고 밤 9시~익일 오전5시는 포장, 배달만 가능하다. \n▶카페 중 프렌차이즈형 커피전문점은 전자출입명부를 설치 이용 또는 수기명부 비치 성명, 전화번호, 신준증 확인, 4주 보관후 폐기. 매장 내 음식, 음료 섭취 금지한다. 포장, 배달만 가능하다. 포장해 갈 때도 출입자 명부를 작성, 마스크 착용, 이용자 간 간격 1~2m 유지해야 한다.\n▶헬스장, 당구장, 탁구장, 골프연습장 등 실내체육시설 집합금지 조치를 실시한다, \n▶학원은 비대면 수업만 허용 한다\n▶독서실, 스터디카페도 집합금지 조치를 실시한다.\n▶교습소는 전자출입명부 설치 이용 또는 수기명부 비치 성명, 전화번호, 신분증 확인, 4주 보관후 폐기, 발열체크, 유증상자 출입제한.\n▶독서실, 스터디카페, 학원 등에 대한 집합금지, 제한 조치는 8월31일(월요일) 0시부터 9월6일(일요일( 24시까지 적용한다... 등등의 내용을 발표했습니다. \n구체적인 내용은 중앙재난안전대책본부 홈피 ""수도권방역조치 강화방안"" 내용을 참조하세요.\n코로나19 사회적거리두기 3단계는 정부정책이니 정부손에 달려 있겠지요.\n사회적거리두기 3단계에 관해서 아직 확정된 것은 없습니다.\n그러나 보건당국이 매체에 흘린 3단계 내용은 다음과 같습니다 :\n▶모든 활동 원칙적 금지(단, 필수적 사회경제 활동 예외)\n▶집합모임 실내, 실외 모두 10인 이상 금지\n▶스포츠행사, 경기 등 모두 중지\n▶공공 다중시설 운영 중단\n▶민간 다중시설 고위험시설 운영 중단, 그외 시설 방역수칙 준수 강제화, 오후 9시 이후 운영 중단\n▶학교, 유치원, 어린이집 모든 수업 원격(온라인)수업, 또는 휴업\n▶공공기관, 기업은 필수 인원 외 전원 재택근무\n▶민간기관, 기업은 필수 인원 외 전원 재택근무 권고\n2. 8월28일 현재, 사회적 거리두기 3단계에 관해서 아직 확정 된 것은 없습니다. 가짜뉴스에 속지 마세요. \n3단계로 격상할지 안할지는 정부정책이니 정부손에 달렸어요...\n사회적 거리두기 3단계 내용에 대해서 확정된 것은 아직 없습니다.\n3. 질문자님...대한감염학회 등 유관학회에서는 사회적 거리두기 3단계 격상 찬성편에 있다고 연합뉴스(8월24일)가 보도했고요, 신종 코로나 바이러스 감염증(코로나19) 공동 대응 상황실 및 신종감염병 중앙임상위원회는 사회적 거리두기 3단계 격상을 반대한다고 연합뉴스(8월25일)가 보도 했네요...\n4. 문제는, 지금 정부에서 알려진 사회적 거리두기 3단계로 되면 지금보다도 더 한층 개인의 자유와 경제활동이 억압되고 통제되는 것이지요...\n5. 공산주의 국가가 아닌 자유 민주주의 국가인 대한민국에서는 사회적 거리두기 3단계와 같은 정책은 실시해서는 안 됩니다. 독일이나 미국 등 일부 국가에서 우리의 3단계와 유사한 것을 시행했다가 코로나19 확진자는 확진자 수대로 늘어났고, 재정적자는 재정적자대로 늘어 났다는 것 같습니다. 미국은 현재(8월14일 기준) 약 580만명의 확진자와 약 18만명의 사망자가 발생했다고 하는 것 같습니다. 독일은 현재(8월 14일기준) 약 23만9천명의 확진자와 약 9천3백명의 사망자가 발생했다고 하는 것 같습니다. \n6. 사회적 거리두기 1단계와 2단계만으로도 정책 조율이 가능합니다. \n7. 본 네이버 블로그의 감사사랑 블로그에 있는 다음 내용들을 참고하세요.\n▶ 문재인 대통령의 결단이 필요한 문재인정부 보건당국 사회적 거리두기 1단계, 2단계, 3단계, 코로나19 예방과 치료 정책과 <활기혈단>(천대윤)\n▶코로나19확산, 바이러스 팬데믹과 정부 보건당국과 종교계(교회)와 코로나19 예방과 치료를 위한<활기혈단>(천대윤) \n8. 코로나19 예방을 위해 마스크 잘 쓰시고, 환자와 접촉 금지(사회적 거리두기 포함), 세숫비누로 손과 얼굴 잘 씻으시고, 손소독 잘 하시고, 집에 귀가 하면 입안을 따뜻한 물로 헹구시고, 따뜻힌 물로 샤워 하세요... 건강이 최고에요. 건강을 잃으면 모든 것을 잃게 되어요... 평소에, 천대윤 박사님의 <활기혈단>(천대윤 지음) 책에 제시된 영양, 운동, 수면, 십이단전, 건강양생운동, 기혈지압마사지, 14경맥, 365경혈 등을 날마다 잘 실천하셔서 건강관리 잘 하시기를 권유합니다. ', '현재 백신이 유일하게 나온나라는\n러시아 밖에 없지만 아직 두고봐아해요...\n<러시아 코로나 백신 개발 성공> 세계최초 코로나 백신 개발 (러시아 백신 관련주)\n러시아 백신 코로나 백신 (러시아) _ 러시아가 세계 최초로 코로나19 백신 개발에 성공해 백신 등록을 마쳤다고 발표했다. 블라디미르 푸틴 러시아 대통령은 오늘 원격 내각회의에서 ""오늘 아침 세계에서 처음으..\ndingdo.tistory.com', 'Sheikh Khalifa Specialty Hospital 진단검사의학과 과장 홍덕진 의사님\n가톨릭대학교 인천성모병원 가정의학과 임상부교수 서민석 의사님\n께서 소견을 내주셨습니다\nhttps://www.a-ha.io/questions/4d25df930238f859b6891266ddf0f37e?recBy=3PEGVU\n코로나 백신 언제 나오나요? 그리고 백신이 나와도 코로나는 안 끝나나요? | 전문 지식 검색은 아하!\n의료 - 코로나19 백신이 개발 중에 있는데 정확히 언제쯤 상용화되고 나오는지 알고 싶습니다. 또한 백신이 나와도 코로나19가 끝이 아니라는데 왜 이런 얘기가 나오는지도 알고 싶습니다. 감사합니다.\nwww.a-ha.io', '질문 수준하고는']",5,https://kin.naver.com/qna/detail.naver?d1id=9&dirId=9020203&docId=366512918&qb=67Cx7Iug&enc=utf8&section=kin&rank=300&search_sort=3&spq=0,남아메리카
30,2020.11.11,['#코로나'],코로나19 백신은 언제쯤,코로나19 백신은 언제쯤 상용화될까요....,"['코로나19 백신에 대해서 아래에서 자세히 알아보세요.\nhttp://m.site.naver.com/0IsVd\n화이자 코로나 백신 90%예방 맞나? 팩트체크\n안녕하세요 오늘은 화이자 코로나 백신에 대해서 글을 적어보려고 합니다. 미국 제약사 화이자가 임상시험에서 코로나19를 막는 데 90% 이상의 효과를 보인것으로 나타났는데요! 그럼 아래에서 자세히 알아보도록..\nm.site.naver.com\n도움이 되셨다면 채택 부탁드립니다.\n감사합니다.', '안녕하세요.\n미국의 화이자 라는 제약회사에서 코로나 효과과 90%이상인 백신 개발 임박했다 라고 발표 했습니다.\n기사를 인용하자면 미국 복지부 장관은 이르면 내년3월말 모든 국민에게 코로나 백신이 준비 될 것 이라는 말을 하였는데요.\nFDA 긴급 승인이 떨어지면 12월 부터 응급 환자에게 투여할 계획 입니다.\n적어도 내년초에는 종식에 대한 희망이 있지 않을까 예상해 봅니다.\n백신이 예정대로 진행 되어 하루빨리 종식 되는 날이 오길 바랍니다.\n감사합니다.\n채택 부탁드립니다 :)', ""코로나 19 백신은 지금 임상시험 단계에 있지만 약의 특성상 상당히 오래걸립니다. 사람에게 투약되다 보니 그 부작용이 엄청난 파급력을 지니게 되기 때문입니다. 이번에 나온 화이자도 너무 부풀려져 잇네요..\n코로나 백신, 화이자 백신 기대감? (+섣부른 판단하기에 이르다)\n 화이자 코로나19 백신 기대감  독일 '바이오엔테크'와 함께 코로나 19 백신을 개발 중인 화이자가 코로나 백신에 관해 반가운 소식을 전했다. 임상 시험 결과 코로나 19 백신의 효과가 90% 이상이라는 중간 결..\nsirano-burnstein.tistory.com"", '안녕하세요~\n정확한 시기는 아무도 예측할 수 없으며\n그 동안 마스크 쓰고 손 소독하고 물건도 살균 및 소독하시는게 좋습니다.\n화장실 변기 대비 세균수가 마우스는 3배, 시계/악세사리는 5배, 칫솔은 13배, 스마트폰은 18배, 마스크는30배라고 합니다. 이렇게 우리의 일상은 생각보다 많이 각종 세균과 바이러스에 노출되어 있습니다!\n손은 손 세정제나 손 소독기로 세정한다고 하지만 그 외의 물건의 세균은 어떻게할까요?\n자외선 살균기로 소독하면 99.9% 정도 이러한 세균을 없앨 수 있습니다.\n제가 추천드리는 이스타 uv-자외선 살균 소독기 EST-UV900은\n고효율 UV-C 살균램프를 사용하여 각종 세균을 효과적으로 살균합니다!\nhttps://smartstore.naver.com/lamostore/products/5148801158\n이스타 다용도 UV 살균기 : 라모LAMO\n[라모LAMO] 라이프의 모든것 - 우리 삶에 필요한 소형가전을 전문적으로 판매합니다.\nsmartstore.naver.com', '현재 세계 각지에서 개발을 위해 노력하고 있어요\n조만간 좋은 소식 나왔으면 좋겠어요\n코로나백신 안전성 https://www.youtube.com/watch?v=Fmp-d3ENYgY&t=4s', 'http://m.blog.naver.com/okiii1205/222151828989\n국내외 코로나백신 및 치료제 현황[화이자관련주, 모더나관련주, 셀트리온, SK케미칼(SK바이오사이언스),삼성바이오로직스]\n전세계 코로나19 확진자 수가 가파르게 늘어나고 있는 상황에서 코로나19 백신 소식이 나와서 얼...\nm.blog.naver.com\n참고하세요 ', ""코로나 19 백신에 대한 정부의 계약 계획이 나왔습니다.\n모더나 화이자 아스트라제네카 얀센 '정부'와 코로나 19 백신 계약 합의\n우리나라도 코로나 19의 3차 팬더믹의 위험에 들어가고 있습니다. 이미 전 세계적으로 백신 확보를 위해 각 나라의 정부에서 경쟁이 치열합니다. 그래서 우리나라도 정부가 글로벌 제약사와 다국가 연합체를 통해..\ndadaminf.tistory.com""]",7,https://kin.naver.com/qna/detail.naver?d1id=11&dirId=111604&docId=372984568&qb=67Cx7Iug&enc=utf8&section=kin&rank=299&search_sort=3&spq=0,해부학
30,2020.11.20,[],디지몬 마스터즈 알파섭 질문입니다.,"현재 테이머렙60 밀레니엄 조그 5/4 단 / 블리츠게레이몬 4단 / 크레스가루몬 5단
이렇게 있습니다
현재 캐시 2만5천원이남아서그러는데 현재 알파몬 많이추천하시는데 알파몬 고급 패키지 산후에
5단알 하나만들어야하는데 캐쉬더질러야할가요 ? 추천해주시면 감사하겠습니다.","['블리츠 그레이몬, 크레스 가루루몬은 오메가몬 알터s 라는것이 되어 나중에 데이터 속성이 악역인 던전에서 쓰이게 됩니다 \n그리고 알파몬각성모드x(알엑)는 바이러스 악역 디지몬이 현재 게임내에 많으므로 백신속성 디지몬을 보유하고 계시면 바이러스 몹이 있는 던전에서 편하실 겁니다 (ex : 데블몬의균열, 로얄베이스 등)\n그래서 알엑이 있으시면 좋습니다 그러므로 알파몬 패키지를 구매하셔서 만드신 후에 알파몬각성모드x를 위해 캐시말고 유저간 t거래로 알엑 만드시는게 좋습니다']",1,https://kin.naver.com/qna/detail.naver?d1id=2&dirId=20109&docId=373718303&qb=67Cx7Iug&enc=utf8&section=kin&rank=298&search_sort=3&spq=0,디지몬알피지
30,2020.11.20,['#아스트라제네카관련주'],코비드19 관련주.대장주,옥스퍼드 대학에서 코비드19 백신 연구중이라는데 관련주.대장주 알려주세요,"['http://m.blog.naver.com/okiii1205/222151828989\n국내외 코로나백신 및 치료제 현황[화이자관련주, 모더나관련주, 셀트리온, SK케미칼(SK바이오사이언스),삼성바이오로직스]\n전세계 코로나19 확진자 수가 가파르게 늘어나고 있는 상황에서 코로나19 백신 소식이 나와서 얼...\nm.blog.naver.com\n참고하세요 ', '질문자님 안녕하세요^^\n코로나백신 관련주 에 대해서 질문 주셨네요.\n미국에서 최근 코로나19 백신의 보급될 것을 알렸습니다.\n특히 초기 백신 공급 물량은 일선 근로자, 의료진, 노인 등 먼저 사용될 것이라고 합니다.\n이와 관련하여 주식 시장에서는 코로나백신 관련주 가 급등세를 보이고 있습니다.\n특히 코로나19가 1년 넘게 지속되고 있고, 이로 인해 백신 개발을 꾸준히 개발 중이죠.\n그러다보니, 국내에서도 백신을 개발하고 있기 때문에, 앞으로 코로나백신 관련주 로 분류되는 기업의 상승세가 예상되고 있습니다.\n코로나백신 관련주 종목으로는 [SK케미칼/에이비프로바이오/진매트릭스/동아에스티] 등이 있습니다.\n이 외에도 투자를 위해서는 최근 급등주, 인기 테마주에 대해 알아보시는게 좋겠죠~\n아래 링크 통해서 전문가 무료상담 받아보세요^^', '안녕하세요\n제가 친절하게 관련주들 다 적어놓았습니다\n한번 보시고 참고하시면 좋을것 같습니다!\n코로나 백신 관련주 총정리\n코로나 백신 관련주 총정리 안녕하세요 나샘입니다 오늘은 제가 코로나 백신 관련주들을 총정리 해보려고합니다 근래에 제가 코로나 백신 관련주라고 해서 아스트라제네카, 모더나, 화이자 관련주들을 상세히..\nnahaa.tistory.com\n아스트라제네카, 모더나, 화이자관련주들까지 세밀하게 정리해놓았습니다\n존슨앤존슨 관련주 총정리\n존슨앤존슨 관련주 총정리 안녕하세요 나샘입니다 오늘은 또 코로나백신주 하나가 부상했습니다 바로 존슨앤존슨 인데요 코로나 백신주 중에서 상당히 후발주자로 평가되어왔는데요 아스트라제네카, 화이자, 모..\nnahaa.tistory.com', '아스트라제네카는 영국 제약사인 아스트라제네카와 옥스퍼드 대학이 공동으로 개발한 코로나 19 백신입니다. 옥스퍼드 대학교에서는 지난 23일 2차 임상 시험 결과 강력한 면역 반응이 나타났다고 밝혔습니다. 예방 효과는 평균 70%의 중간분석 결과를 확보했고 투약방법에 따라서는 예방 효과가 90%까지 올라간다고 합니다. \n아스트라제네카 관련주는 SK케미칼, 진매트릭스, 유나이티드제약, 에이비프로바이오 등이 거론되고 있습니다.\nhttps://chandori11.tistory.com/143\n아스트라제네카 관련주 :^)\n아스트라제네카 관련주 안녕하세요 하루를그리다입니다:^) 현재까지 정부는 4,400만 명분의 코로나 백신을 확보한 상태입니다. 이 수치는 국민의 85%가 맞을 수 있는 양이며 국내에서는 가장 먼저 아스트라제네카..\nchandori11.tistory.com', '안녕하세요\n영국 옥스퍼드대학과 공동으로 코로나19백신 을 개발하고 있는 업체는 아스트라제네카 입니다. 임상 3상이 12월 25일 전 발표될 예정입니다. \n국내 아스트라제네카 관련주 로는 SK케미칼  진매트릭스  유나이티드제약  에이비프로바이오 가 있습니다.\n관련 자세한 내용은 블로그글 참조해주시기 바랍니다. 감사합니다.\n아스트라제네카 코로나 백신 기대! 크리스마스 전 발표- 관련주 급등 (진매트릭스, SK케미칼, 에이비프로바이오)\n안녕하세요.#코로나바이러스 #백신 개발 관련 긍정적인 뉴스들이 속속들이 발표되고 있습니다. 아직은 전세...\nm.blog.naver.com\nFDA 모더나 긴급 승인 / 모더나 관련주 영향은? 코로나 3단계 가능성\n안녕하세요.12월 18일 미국 식품의약국 FDA 는 미국 제약사 모더나가 개발한 코로나19 백신의 긴급 사...\nm.blog.naver.com\n12/10 미국 화이자백신 긴급승인 배포 - 여행 항공 관련주 상승 (참좋은여행, 카니발 주가)\n안녕하세요.#미국 #보건복지 장관은 모든 게 잘 진행되면 우리는 12월 10일 이후 곧장 #백신 을 배포할 수 ...\nm.blog.naver.com']",5,https://kin.naver.com/qna/detail.naver?d1id=11&dirId=111601&docId=373762294&qb=67Cx7Iug&enc=utf8&section=kin&rank=297&search_sort=3&spq=0,분자생물학
