page,date,tags,questions,questions_add,answers,N_answer,url,category
17,2013.05.16,[],인터넷창 좌측 하단에 광고가 계속 뜹니다 -_-;;," adserving.cpxinteractive.com 이 출처같은데요 시도때도 없이 떠서 미치겠습니다.

어드밴스드 시스템케어 아비라백신 두개 돌리는데 못잡네요 -_-;;;

구글  크롬씁니다. 빠른답변좀 부탁드려요","['  애드웨어가 설정되신것으로 제어판삭제나 전문프로그램사용법이 있습니다.\n-제어판삭제 후에도 지속된다면 서비스영역의 애드웨어이므로 아래 전문프로그램을 정확한 방법으로 사용합니다.-\n 님도 모르게 애드웨어( Adware ; AD)-툴바,검색도우미,팝업창, 광고창, 끼워넣기사이트 등-가 설정되셨는데 이런 애드웨어는 컴퓨터 오류현상을 나타냅니다.\n애드웨어가 설치된 경우 익스플로러오류현상과 익스플로러 창이 꺼지고 인터넷속도를 느리게하는등의 문제가 발생합니다.\n 바이러스가 아니라서 백신의 검색창에는 떠도 치료는 잘 않되십니다. 일반적으로는 님이 웹하드(oo다운 등 다운로드사이트)나 토렌트, p2p 등을 이용시 그리드딜리버리와 같이 깔립니다.\nhttp://v.daum.net/link/17377177\n 제어판 프로그램 추가 제거에 가세요\n그리고 ad, Search, Toolbar, Side, Tip, Tab, Point, g코덱 IPLUS.smartsearch,웹컴파스,POP,bar,tool,guide, windows suggestions downmanager, micropop,KTH열린주소창 ,opensearchp 1.00, icon guide,icon manager,iconview\n이렇게 써있는것들 꼭지워주세요 당연히 win search 도 지우셔야죠 search 가 들어가니깐요\n이단어 들어간것들 전부다 지워주셔야 합니다\n 그래도 나온다거나 컴퓨터속도가 향상되지 않고 제어판삭제가 어려우시면 불필요한 프로세스가 설치되어 있어 나오는 현상이니 프로세스 초기화 프로그램을 쓰시면 그리드딜리버리와 애드웨어가 제거되어\n절대 광고창및툴바 나오지 않을것이고 인터넷도 정말빨라집니다\n-프로세스초기화 재부팅하시도 재부팅 후 다시 프클 사용후 확인해보세요-\n http://file.daum.net/pc/view.html?fnum=349169&cat=1&scat=31다음자료실-로그인없이 다운로드 눌러주세요-\nhttp://software.naver.com/software/summary.nhn?softwareId=MFS_100028\n 네이버 자료실에서 가져온 무료 프로세스 초기화 프로그램입니다 프로세스클린이라합니다 이용해보세요\n프로세스초기화에 좋은점은 악성프로세스및불필요한 프로세스등을 다 강제로 종료시켜주어서 인터넷 오류현상과 광고창이 나오는현상 등등 을 해결하실수있고 인터넷 속도 또한 정말 빨라집니다\n 사용법은 설치후 서비스초기화 후 재부팅 하시고\n프로세스 초기화 와 바이러스 검사 -빠른검사하기-,하드디스크최적화 버튼만 눌려주심됩니다 그럼 재부팅 된 후 인터넷을 하실때 더이상 광고성음악이나 광고창이 나오지 않을거에요또한 인터넷 도 정말빨라질거에요\n 일반백신-v3 등-은 재설치하신 후 초기화제외설정을 합니다.-\nhttp://www.processcrack.co.kr/bbs/board.php?bo_table=B22&wr_id=3100\n 앞으로 인터넷 시작시 프로세스 초기화를 해주시면 인터넷 정말빨라지고 님의광고창 절대 나오지 않고\n게임렉에도 도움이 됩니다. http://v.daum.net/link/17844648\n광고창과 툴바들 이 설치 되지 않게 하기 위해서는 어떤 프로그램 설치하실때 약관을 잘봐서 제휴사이트 설치를 체크 해제 해주어야 합니다\n 아 그리고 3일에 한번씩 하드디스크최적화와 바이러스검사 해주어서 좀더 나은 컴퓨터를 사용하시길바랍니다^^\n프로세스클린 설명서 입니다. http://www.processcrack.co.kr/bbs/board.php?bo_table=B22&wr_id=4421\n도움되셨다면 채택 부탁드립니다', '안녕하세요. 킹콩VPN 지식IN 상담원입니다^^ \n아마 크롬사용하시면서 IP우회프로그램 사용하시다가\n바이러스가 생기신거 같아요~\n크롬들어가셔서 메뉴-설정-사이트설정-알림-허용됨-해당광고사이트 주소-삭제 및 재설정 눌러주세요~\nIP우회하는 방법 두가지가있습니다\nhttps 와 VPN의 차이가 IP보안성의 차이입니다~\nVPN은 데이터를 암호화하여 기존 아이피를 노출하지 않고 사용이 가능합니다\nVPN을 사용하시겠다면 소재가 확실하고 소통이 잘되는 VPN을 사용하셔야 합니다\n실시간 상담, 빠른 피드백이 가능하고 가성비 좋은 VPN 찾으시면 \n저희 킹콩VPN은 어떠신가요~^^\n저희 킹콩VPN은 체계적으로 서버관리를 하고 있어 막힐 걱정없이 이용가능합니다! \n속도면에서도 AS대처면에서도 빠른 VPN을 찾으신다면 \n킹콩VPN을 강력추천해드립니다!!!\n무료 체험가능하시니 부담없이 저희 킹콩 VPN이용해보세용~']",2,https://kin.naver.com/qna/detail.naver?d1id=1&dirId=106&docId=172710847&qb=67Cx7Iug&enc=utf8&section=kin&rank=162&search_sort=3&spq=0,인터넷
17,2019.10.30,['#정보보안전문가되는법'],정보처리 자격증종류,"제가 이번에 특성화고 IT쪽을 지원했습니다
그래서 필요한자격증이먼지알아야하는데
IT보안쪽(사이버수사관)에서 필요로하는자격증이 무엇이있는지 알려주세요 최대한빨리요 취업희망서에 써야되서요
중학생이 지원할만한 자격증도 같이써주세요","['자격증을 알아보시고 계신거 같은데 답변 드리겠습니다\n우리나라에서 직업에 종류는 정말로 다양한거같더라구요\n그래서 질문자님과 같이 남들보다는 좀더\n특별한 나만의 직업을 찾는 분들이 차차 더 많아지고 있는 추세인거 같습니다.\n앞으로는 100세 시대라고 하는데 남들보다 좀더 특별한 나만의 평생직업을 찾는분들이\n점차 많아지고 있는거 같아요.\n무엇보다도 지금 현재 추세에서는 특별하며 신비적인 자격증이 필요한 시대인거 같습니다.\n남들도 많이들 하고있는 흔한 일보다는 특별하면서 나에게 잘 어울리는\n그러한 직업이 가장 좋을거같은데요.\n그렇게 하실려면 특별한 자격증을 찾아서 공부하시는것이\n이게 어떻게 보면 가장 최고로 중요할것으로 생각이 되어 집니다.\n요즘 많이들 찾고들 계시는 자격증 종류 여러가지 추천을 해드리도록 할게요.\n부담없이 편안하게 무료상담 신청을 하셔서 상담 받아보시기 바랍니다.\n사회복지사 자격증 무료상담 http://m.site.naver.com/0lK9j\n공인중개사 자격증 무료상담 http://m.site.naver.com/0lLmX\n반려동물관리사 자격증 무료상담 http://m.site.naver.com/0lV47\n주택관리사 자격증 무료상담 http://m.site.naver.com/0lKkx\n심리상담사 자격증 무료상담 http://m.site.naver.com/0lMby\n유치원행정실무사 자격증 무료상담 http://m.site.naver.com/0h04Q\n한자지도사 자격증 무료상담 http://m.site.naver.com/0h04R\n토종식물해설사 자격증 무료상담 http://m.site.naver.com/0h04S\n산지식물자원관리사 자격증 무료상담 http://m.site.naver.com/0h04T\n베이비시터 자격증 무료상담 http://m.site.naver.com/0h04U\n약용식물지원관리사 자격증 무료상담 http://m.site.naver.com/0h04Y\n체형관리사 자격증 무료상담 http://m.site.naver.com/0h04Z\n식이지도사 자격증 무료상담 http://m.site.naver.com/0h052\n산후관리사 자격증 무료상담 http://m.site.naver.com/0h053', '안녕하세요! 각종 국가공인자격에 관한 모든 정보가 모여 있는 세상의 모든 시험, 세모시 카페를 운영 중인 매니저입니다!\n정보처리기능사 시험 추천!!\n컴퓨터 정보처리 / 소프트웨어쪽 가장 기본적인 지식을 준비하실 수 있는 국가기술자격입니다!\n보통1달정도 빡시게 준비하시면 합격 가능합니다!\n혹시 정보처리기능사를 비롯 각 분야별 국가공인 자격증에 대한 더욱 자세한 정보, 합격후기, 기출문제, 시험일정, 등등이 궁금하시면 제 이름 옆 카페 ‘세모시’ 클릭하셔서 각 메뉴로 들어오세요!\n(정보처리기능사는 컴퓨터/IT -> 시스템 운영 및 네트워크 -> 정보처리기능사 메뉴로)\n응원합니다! 파이팅!     ', '중학생이 시험 볼 수 있는 정보처리 자격증 종류는 아래와 같이 기능사 뿐입니다.\n· 정보기기운용기능사\n· 정보처리기능사\n사이버수사는 아래와 같습니다.', 'IT보안에서 사이버수사쪽이라고하면 컴퓨터와 보안에 대한 전반적인 지식과 더불어 디지털 포렌식 기술을 배웠느냐가 중요할 것 같습니다.\n디지털 포렌식의 경우 장치에 남은 흔적을 통해 데이터를 복구하고 범죄수사에 도움이 될만한 증거를 찾아내는 기술입니다.\n추가적으로 현재 중학교 신분에서 준비할 수 있는 자격증이라고하면 다른 것보다 정보처리 기능사를 취득하셔서 차후에 산업기사나 기사를 취득할 수 있는 자격요건을 갖추시는데 초점을 맞추시고 이후엔 체계적으로 프로그래밍부터 시작해서 웹, 시스템, 네트워크에 대한 공부를 진행하시는게 좋습니다.\n일단은 이정도로만 답변을 드리도록 하구요.\n저는 현재 강남의 정보보안 전문교육기관에서 질문자님처럼 진로나 학업에 어려움을 겪고계신분들께 교육컨설팅을 진행하며 도움을 드리고 있습니다.\n혹시 더 궁금하신점 있으시면 아래 오픈카톡으로 연락주세요. 더 자세히 듣고 도와드리도록 하겠습니다.\n추가적으로 It쪽으로 정보도 나누고 공부도 하실 수 있는 카페링크를 남겨놓을테니까요 한번 들러보시는 것도 좋다고 생각합니다.\nIT법인교육기관 코리아IT아카데미 김영덕 교육실장입니다\nIT분야 진로, 취업에 대한 고민들 편하게 상담받아보세요.\nopen.kakao.com', '[정보처리 자격증종류\n제가 이번에 특성화고 IT쪽을 지원했습니다\n그래서 필요한자격증이먼지알아야하는데\nIT보안쪽(사이버수사관)에서 필요로하는자격증이 무엇이있는지 알려주세요 최대한빨리요 \n취업희망서에 써야되서요\n중학생이 지원할만한 자격증도 같이써주세요]\nIT 보안쪽 화이트 해커 및 사이버수사관 IT 보안쪽에 대해 설명드리고 \n필요 자격증 취득 하면 좋은 자격증 작성해드리겠습니다\n중학생이 지원할만한 자격증도 마지막에 포함해드리겠습니다.\nIT 업계 정보보안전문가 <화이트해커> 해킹을 대응 또는 방어하는 사람으로 알고계실텐데요.\n세부적으로 분야가 많이 나뉘어지게됩니다.\n보안관제 - 실시간으로 침입되는 해킹을 감시하거나 분석하는 업무를하게됩니다.\n침해대응 CERT - 모든 전산망에 침입되는 해킹을 역으로 추적하거나 역으로 공격하는 업무를합니다.\n악성코드분석가 - 악성프로그램 또는 바이러스와 같은 모든것들을 분석하여 해결하는 업무를합니다.\n모의해킹전문가 - 모의해킹으로 업무하는 기업에대한 모든곳을 말그대로 모의해킹을 시도하면서 취약점과 악성코드 모든것들을 분석하고 찾아내어 해결하는 업무를합니다. (선의의해킹 사전에 해킹을 하여 진단하는업무)\n보안솔루션개발자 - 방화벽 , 침입탐지시스템 , 백신프로그램들을 개발하는 업무를합니다.\n이러한 식으로 분야가 나뉘어집니다.\n본인이 하고 싶은게 무엇인지에 따라 자격증 준비과정도 조금씩 달라지게 되겠죠.\n질문자분께서 보안 자격증 종류라고 하셨는데 보안쪽으로 가기 위한 IT 업계 자격증\n리스트 적어드리겠습니다.\n→정보보안전문가 : CISA, CISSP, CHE, 정보보안 산업기사 / 기사\n→프로그래밍 : OCJP, OCWCD, OCBCD, 정보처리 산업기사 / 기사\n→서버 / 운영체제 : LPIC, MCITP, OCSA, OCNA, 리눅스 마스터\n→네트워크 : CCNA, CCNP, CCIE, 네트워크 관리사★★\n→데이터베이스 : OCA, OCP, OCM\n→응용 프로그래머 - C / C++ / C# [ C언어 기술 위주 ]\n→시스템 프로그래머 - C / C++ / C# / Linux Server / Python\n→웹 프로그래머 - JAVA / JSP / Spring / Linux / PHP\n→앱 프로그래머 - C / JAVA / Object-C / Android 개발 능력\n위 자격증 중에 중학생이 준비해서 취득 할만한 자격증은 네트워크관리사 2급 정도 될 것 같습니다. \n고졸이상 학력이신분들에 한해 추가적인 답변 적습니다.\n+ 질문자분 외\n산업기사 / 기사 자격증 준비하시는분들 중\n응시자격이 아직 안되시는 분들은\n학점은행제를 통해 빠르게 응시자격 갖출 수 \n있습니다.\n관심있으신 분들은 아래링크로 문의주시면\n자세히 설명 드리겠습니다.\n-카카오톡 플러스친구\n- http://pf.kakao.com/_cnERK/chat\n클릭이 안될시, 카카오톡 메인화면 검색창 → sj현팀장 \n-오픈채팅 상담 ( 비실명 가능)\n- https://open.kakao.com/o/sB973Lnc\n★전화상담예약\n- https://forms.gle/a3U3rtHsVNefLxJr5\n★바로상담하기\n.0.1.0. - .5.6.5.4. - .6.5.6.9.', '네. 정보처리기능사 자격증을 준비해보세요. IT특성화고를 지원하셨지만 아직 정보가 많이 부족해보이세요. 더 정확한 진단과 상담이 필요해보입니다. 아래 링크로 자세히 문의주세요.\nIT취업 컨설팅\n#정보보안#네트워크#소프트웨어#데이터베이스#코딩#빅데이터#프로그래밍#정보처리#C언어#해킹#앱개발#시스템서버#정보처리기사#파리썬#자바#클라우드\nopen.kakao.com', '안녕하세요.\n정보보안1000제에 가입하세요.\nhttps://m.cafe.naver.com/is1000\n우리나라 최고의 CISA. CISSP. CISM. CIA. PMP. 보안기사. 감리사. 기술사 자격증 카페입니다.\n오셔서 많은 정보를 얻어 가시길 바랍니다.\n저자들이 우리나라 최고의 기업인 삼성에 근무하고\n있습니다.\n세미나도 자주하고 질문 내용은 바로바로 업데이트를 합니다. 전부 다 공짜 입니다.\n궁금하신 내용은 질문바랍니다']",7,https://kin.naver.com/qna/detail.naver?d1id=11&dirId=110704&docId=339331626&qb=67Cx7Iug&enc=utf8&section=kin&rank=161&search_sort=3&spq=0,직업교육
16,2019.12.18,"['노트북', '노트북광고', '노트북광고창', '노트북광고창제거', '광고창없애는방법', '백신프로그램', '광고제거', '#노트북광고']",노트북 하단에 사각형의 광고가 자꾸 떠요,크롬에서 자꾸 노트북에 광고가 떠요 인터넷에 찾아보니까 무슨 백신프로그램 다운받아보라고 해서 몇개 다운받아봤는데 계속뜨고 어떻게 하죠 ?,"['혹시 PC카카오톡 쓰시면 카카오톡 로그인하면 뜨는 광고이니 참고하시구요\n그것이 아니라면 \n크롬 알림광고입니다\n크롬 주소창에 아래 주소 입력 후 엔터키 누르시고\nchrome://settings/content/notifications\n1.허용 항목에서 등록된 도메인 오른쪽에  2.    아이콘 클릭하고 \n3.삭제한다\n4.알림 - 보내기 전에 확인(권장)의 체크를 해제한다', '크롬 브라우저의 푸시 알림 기능을 이용한 노트북 광고입니다.\n크롬 실행 후, 주소창에\nchrome://settings/content/notifications\n입력하셔서 알림 설정으로 진입하세요.\n거기서 알림 허용된 것들을 모두 차단으로 바꿔주시면 됩니다.\n설정 변경 이후에도 여전히 노트북 광고가 뜨거나\n다른 종류의 광고가 발생한다면\n사용하고 계시는 pc 내에 다른 애드웨어가 설치돼 있을 수 있습니다.\n그런 경우 별도의 애드블록을 이용해서 노트북 광고를 제거하시길 권합니다.\n애드블록을 이용하면 노트북 광고를 띄우는 애드웨어 프로세스를 사전에 차단하는 방식으로\n간편하게 광고를 제거하실 수 있습니다.\n프리웨어 중에는 네이버 소프트웨어에 있는 헬프클린이\n간편최적화로 애드블록을 제공합니다.\n광고 제거 용도로 사용해보세요.\n헬프클린\n인터넷 광고창 제거 및 PC 최적화 프로그램\nsoftware.naver.com\n답변이 도움이 됐다면 채택 부탁드립니다.', '자\n잘들으세요\n진짜 딴거 하나도 필요없습니다\n다른 답변 거르세요\n제어판 들어갑니다\n프로그램제거 들어갑니다\nNGplus 혹은 NEWGOPLUS 지웁니다.\n끝.', '도움이 되었으면 좋겠네요.\nhttp://www.ezclean.info/tip/5278 <- 참고\n크롬 토스트 광고는 이지클린""검사""기능으로 해결이 가능합니다.\n그 외 애드웨어 삭제 방법 참고 <- 참고\nhttp://www.ezclean.info/malware_solution\n----------------------------------------\n애드웨어 삭제 기능이 추가된 컴퓨터 무료 최적화 프로그램의 최강자\n이지클린(EzClean)을 생활화하세요.\nhttps://software.naver.com/software/summary.nhn?softwareId=GWS_003052&categoryId=B0600000', '안녕하세요. 킹콩VPN 지식IN 상담원입니다^^ \n아마 크롬사용하시면서 IP우회프로그램 사용하시다가\n바이러스가 생기신거 같아요~\n크롬들어가셔서 메뉴-설정-사이트설정-알림-허용됨-해당광고사이트 주소-삭제 및 재설정 눌러주세요~\nIP우회하는 방법 두가지가있습니다\nhttps 와 VPN의 차이가 IP보안성의 차이입니다~\nVPN은 데이터를 암호화하여 기존 아이피를 노출하지 않고 사용이 가능합니다\nVPN을 사용하시겠다면 소재가 확실하고 소통이 잘되는 VPN을 사용하셔야 합니다\n실시간 상담, 빠른 피드백이 가능하고 가성비 좋은 VPN 찾으시면 \n저희 킹콩VPN은 어떠신가요~^^\n저희 킹콩VPN은 체계적으로 서버관리를 하고 있어 막힐 걱정없이 이용가능합니다! \n속도면에서도 AS대처면에서도 빠른 VPN을 찾으신다면 \n킹콩VPN을 강력추천해드립니다!!!\n무료 체험가능하시니 부담없이 저희 킹콩 VPN이용해보세용~']",5,https://kin.naver.com/qna/detail.naver?d1id=1&dirId=10201&docId=342892513&qb=67Cx7Iug&enc=utf8&section=kin&rank=160&search_sort=3&spq=0,웹브라우저
16,2020.03.26,[],코로나에 이어 한타바이러스 발생,제가 지금 뉴스를 봤는데 코로나 뿐만 아니라 한타바이러스도 나왔다고 했어요. 그러면 한타바이러스도 전 세계가 난리나고 있어요???,"['안녕하세요~ ""유캔두 학점은행제"" \n여러분의 유캔두 학습설계팀입니다!\n중국에서는 이미 한타바이러스 백신을 보유하고 있으며\n아직 사람 간 감염은 나타나지 않아서\n코로나 만큼의 타격은 없을 것으로 보입니다\n도움이 되셨다면 채택 부탁드립니다', '안녕하세요! 즐거움이 가득한 진로뉴스 ‘자스트미디어’입니다.\n한타바이러스에 대한 정보를 출처와 함께 남겨뒀으니 참고해주세요!\n중국 코로나 이후 또 다른 재앙 한탄바이러스 발생 1명 사망\n출처: https://jastmedia.tistory.com/57\n중국 코로나 이후 또 다른 재앙 한탄바이러스 발생 1명 사망\n([서울] 자스트 미디어) 중국 윈난성(雲南) 출신의 노동자 톈모씨(田)는 일터가 있는 산둥성(山東)으로 이동 중 지난 23일 산시성(山西)을 지나다 사망했다. 노동자 톈모씨(田)는 사후 검사 결과 한탄바이러스(Ha..\njastmedia.tistory.com', '지금은 특별히 난리가 한타바이러스 때문에 나고 있진 않습니다. 다만 중국에서 1명이 사망했죠.. 한타 바이러스는 들쥐한테서 전염이 되고, 백신은 있기때문에 큰 타격은 주지 않을 것 같습니다. 채택 부탁드려요~♡', '중국에 1명이 나왔을 뿐입니다. 걱정마세요.\nhttps://smartdata-shop.com/blog/hantavirus/\n한타바이러스 중국 또 다른 바이러스 시작? > 내일을 바꾸는 습관\n한타바이러스 중국 또 다른 바이러스 시작 - 바이러스는 살아 있는 세포 안에서만 활동을 하는 전염성 감염원이다. 세균과 바이러스의 차이점을 알아보고 한타 바이러스 예방법을 바로 알자. 국민 스스로 바이러스의 예방을 철저히 하고 현명하게 대처하자.\nsmartdata-shop.com', '한타바이러스백신있어요', '한타바이러스는 전세계 몇 군데에서도 일어나는 바이러스 입니다.\n그리고 백신도 이미 있지만\n이번에 백신맞은 군인이 사망했다는 보도가 나왔습니다.\n<한타바이러스 증상> 예방법, 백신, 잠복기 (한타바이러스 관련주)\n한타바이러스 감염증 백신 한타바이러스 관련주 한타바이러스 예방 _ 강원도 철원의 한 군부대에서 풀 깎기 작업을 했던 병사 1명이 들쥐로부터 옮는 한타바이러스 의심증세로 숨졌습니다. = 제초작업중 사망 예..\ndingdo.tistory.com\n위는 한타바이러스 증상\n(예방법, 백신) 잠복기등 안내 입니다.', '그래도 약이 있긴 다행이죠 그래도 정말 조심해야합니다.', ""날씨가 풀리면서 야외 활동을 즐기는 분들이 늘어나고 있는데요. 일단 환자가 많이 발생했던 지역에서는 들쥐 등을 특히나 조심해야 합니다. 코로나19와 달리 한국과 중국 등에서 관찰되는 한타바이러스 백신은 이미 개발이 되어 있지만 미국, 캐나다 등 남미 한타바이러스는 백신과 치료제가 아직 개발되지 못했습니다.\n한타바이러스 감염증 원인은 설치류, 증상 및 치사율은?\n코로나19 발원지 중국에서 한타바이러스로 사망자가 발생하자 또 다시 전염병이 유행할지도 모른다는 우려가 쏟아지고 있습니다. 코로나19 처럼 무방비로 당하지 않기 위해 현재 많은 사람들이 '#hantavirus' 해시..\nalltop4.tistory.com\n한타바이러스 감염증 원인은 설치류, 증상 및 치사율 입니다."", '한타바이러스란?\n폐렴과 유행성 출혈열을 일으키는 바이러스이며\n최소한 7종류가 알려져 있다.\n국내 한탄강에서 처음으로 발견되어 붙여진 명칭이다.\n한타바이러스는 들쥐 같은 설치류에 의해 소변이나 침, 대변을 통해\n사람에게 감염되는 것으로 알려지며 감염되면 고열과 출혈, 신장 손상 등이 생긴다.\n한타바이러스 등장? (+증상,예방법)\n25일 SBS 8시뉴스에서는 강원도 철원 소속의 한 병사가 한타바이러스 증상으로 사망했다고 전해졌다. 육군 관계자에 따르면 25일 육군에 따르면 6사단 소속 A 일병은 이달 11∼12일 부대에서 제초 작업..\nclantown1733.tistory.com', '아닙니다. 한타바이러스는 예전부터 계속적으로 발생했던 바이러스입니다. 한국전쟁당시에도 미군 3천여명이 걸려 수백명이 죽었습니다. 하지만 현재는 이호왕박사님이 최초로 한탄바이러스 병원체를 발견하셔서 백신도 만들어진 상태입니다. 아시아, 유럽에서 유행하는 신장증후군출혈열에 대해서만 백신이 있는상태이고 북미에서 유행하는\n치사율이 50%되는 폐증후군 한타바이러스는 아직 백신이나 치료제가 없는상태입니다. 더 자세한 사항은\n참고하시기 바랍니다.\nhttps://haruharu88.tistory.com/112\n한타바이러스 감염증 증상, 치사율, 예방접종\n한타바이러스는 설치류를 숙주로 삼지만 설치류에게는 질병을 유발시키지는 않습니다. 하지만 인간은 설치류의 침, 소변, 대변을 통해 한타 바이러스에 감염될 수 있습니다. 한타바이러스 중에서도 몇몇 종은 인간..\nharuharu88.tistory.com']",10,https://kin.naver.com/qna/detail.naver?d1id=6&dirId=60906&docId=351130153&qb=67Cx7Iug&enc=utf8&section=kin&rank=159&search_sort=3&spq=0,소규모종교
