page,date,tags,questions,questions_add,answers,N_answer,url,category
5,2020.09.14,[],프로그래밍공부 어렵다는데...,파이썬이나 c언어 자바공부하려면 힘든가요?,"['안녕하세요^^\n혹시 처음 공부를 해보려고 하시나요?\n그럼 좀 어렵습니다..ㅠㅠ뭐든 처음은 힘드니깐..\n공부목적에 따라 단순 취미면 몰라도 전문적으로 공부를 생각하고 있다면\n전문학원을 추천해드려요~\n현재 무료로 전화상담이 가능한 전문학원을 알려드릴테니깐\n도움이 되셨으면 좋겠네요~!\n문의전화 : 02-3676-1491', '저는 edwith 강의 이용하고 있습니다 무료 치고 퀄이 좋아서 애용합니다\n파이썬 공부 중입니다', '안녕하세요. IT 멘토 정원입니다.\n어렵다는 기준은 사람마다 다르기 때문에 확실히 어렵다 쉽다라고 말씀을 드리기는 어려울것 같습니다.\n비교적 난이도가 쉬운 언어는 파이썬이라고 생각이들고 추천을 해드리고 싶습니다!!\n파이썬으로 기초를 잡고 C, C++, JAVA로 넘어가시는것을 추천드려요!!!\n독학이 어려우시면 인강이나 전문 교육기관을 병행하는것도 좋은 방법이라고 생각합니다!\n공부커리큘럼과 진로/ 진학/ 취업/ 고민 등\n1:1 무료상담 진행중이니 언제든 편하게 말씀해주세요!\nhttps://open.kakao.com/o/scnm3pqc\nIT 취업 1:1 무료 상담\n#아이티뱅크#취업#상담#java#c언어#개발자#프로그래머#웹개발자#서버#네트워크#포트폴리오#IT\nopen.kakao.com', '안녕하세요. IT 멘토 입니다. \n프로그래밍 공부 \n독학은 추천드리고싶지 않습니다\n사실 대학 전공자들도 실무자들도 \n가장 어려워하는 기본언어입니다.\n가장 중요한 언어인만큼 처음 배울때가 중요한데 독학으로 어떻게 할지 궁금하네요\nIT의 모든 기술은 모를때나 공부하다 막힐때 누군가에게 물어보고\n즉각 해결할수있어야합니다\n그래서 준비하는 모든 학생들이 교육기관에서 교육을 받거나 인강을 청취하고있습니다\n느낌이 오시나요?\n독학으로 할 만큼 만만한 분야가 아닙니다\n프로그래밍을 배우시려면 IT기초인 파이썬부터 시작하시는 것이 좋습니다.\nIT분야는 독학으로 하기 어려운 부분이 있어서 전문교육기관에서 배우시는 것이 좋습니다.\n프로그래밍언어를 배우시려는 목적이 취업이신가요?\n그렇다면 IT전문교육기관에서 기초부터 배우시는 것을 추천드립니다.\nIT분야에서 원하는 진로도 생각해보시는 것이 좋습니다.\n진로에 따라서 공부하는 내용이 달라지기 때문입니다.\n프로그래밍언어를 처음 배우신다면 Python부터 시작하시는 것이 좋습니다.\nPython은 프로그래밍언어의 기초이기 때문에 처음 배우시는 분들에게 추천드립니다.\nPython을 배우고나서 C언어->JAVA->JSP->SPRING 순서로 배우시면 좋습니다.\n어느 분야로 진로를 정하셨는지는 모르지만 대부분 이 순서대로 배우시고 있습니다.\n이런 교육과정은 독학으로 하기 힘든 점이 있어 전문교육기관에서 공부 계획을 짜서 학습하고\n있습니다.\n프로그래밍 언어에 대해서 간단하게 소개해드리겠습니다.\n1) Python: 오픈 소스를 제공하며 문법이 쉽고 간단해서 쉽게 배우고 익힐 수 있음.\n            다양한 표현법 사용으로 소스 코드의 길이가 매우 짧으며, 개발 시간을 단축할 수\n            있어서 개발자들이 선호하는 언어.\n            초보자부터 전문가까지 쉽게 접근할 수 있는 프로그래밍 언어로 다양한 플랫폼에서\n            활용 가능\n            다양한 라이브러리 지원으로 IT 전 분야에서 널리 사용되고 있음. \n2) c언어: 컴파일러나 소프트웨어 개발용 도구로 사용되는 언어\n           시스템 기술 언어로 개발\n           프로그램을 기계어 명령에 가까운 유형으로 직접 기술할 수 있으며 언어를 간단하게\n           하여 풍부한 표준 자료집을 갖게 할 수 있으며 연산자가 많고 다른 기종에 프로그램\n           이식이 쉬움\n3) Java: 객체 지향 프로그래밍 언어. 보안성이 뛰어나며 컴파일한 코드는 다른 운영체제에서\n          사용이 가능.\n4) JSP: Java Server Pages의 약자. 자바 서블릿 기술을 확장시켜 웹 환경 상에서 100% 순수한\n         자바만으로 서버 사이드 모듈을 개발하기 위한 기술\n5) SPRING: 오픈 소스 프레임워크. 엔터프라이즈 애플리케이션 개발의 복잡함을 해결하기 위해\n             만들어짐.\n             Java에서 DB작업을 편하게 해주는 프레임워크\n   IT분야의 직업이 어떤 것이 있는지 잘 모르시는 것 같아서 간단하게 소개해드리겠습니다.\n1) 프로그래머: 프로그램을 설계.개발, 유지보수를 하는 직업.\n                   직업의 수요가 가장 많고 취업이 쉬울 수 있다.\n                   경력이 올라갈수록 연봉이 높아지는 직업\n                   웹/앱, 소프트웨어 개발자\n2) 엔지니어: 시스템 엔지니어와 네트워크 엔지니어로 나눌 수 있음.\n                 시스템 엔지니어는 컴퓨터와 통신장비들을 시스템에 맞춰 설계.관리하는 직업으로\n                 서버에 대한 지식이 많이 필요해서 실무적인 부분을 알아야 함.\n                 네트워크 엔지니어는 전산망과 관련된 하드웨어.소프트웨어에 관한 네트워크 시스템\n                 분석.설계.구축에 관한 업무\n                 전체적인 네트워크 시스템 구조를 분석.평가하여 문제점과 개선책을 마련하는 직업\n3) 정보보안전문가: IT 분야에서 가장 최상위에 있는 직업으로 프로그래밍, 시스템, 네트워크&서버,\n                        데이터베이스를 배우고나서 정보보안 분야를 배워야 함.\n                        정보보안전문가가 되기 위해서 실무를 중점적으로 공부해야 함.\n                        정보보안전문가는 다시 5개 분야의 직업으로 나눌 수 있음.\n- 모의해킹전문가: 웹/프로그램을 임시적으로 해킹하여 취약점을 분석하고 작업하는 직업\n- 보안솔루션: 모의해킹을 통해 찾은 취약점을 보안.대비하는 직업\n                  모의해킹 쪽과 함께 팀을 이루어 같이 다님.\n                  확실하게 실무적인 부분이 뛰어나야 하는 직업  \n- 보안관제: 24시간 3교대로 모니터링을 통해 1차적으로 대응하는 직업\n- 악성코드분석: 유해한 코드나 프로그램을 분석하여 백신이나 보안프로그램을 만드는 직업\n                     V3.알약 등 악성코드를 예방하는 역할\n- 디지털포렌식전문가: 삭제되거나 손상된 데이터를 복원/복구하는 직업\n                             법적 증거물들을 수집하는데 많이 이용\n                             경찰청, 사이버수사대 등 국가기관 쪽에서 근무\n4) 데이터베이스관리자: 회사에서 사용하는 DB서버를 구축.유지보수관리하는 직업\n                               금융권이나 대기업으로 취업\n5) 빅데이터전문가: 얻고자 하는 데이터들을 식별하고 분석해서 노하우에 따라 원하는 결과를 얻고\n                         데이터 분석에 관한 솔루션을 만들고 자료를 통계까지 하는 직업\n                         은행이나 카드사 같은 금융권과 광고회사 및 정부나 공공기관에서 근무\nIT분야의 직업에 대해 소개드렸습니다.\nIT분야는 실무적인 부분이 중요하게 여겨지고 있습니다. 그에 따른 실력도 갖추어야 합니다.\n진로고민, 취업준비, 자격증 취득 등 IT분야에 꿈이 있지만 아는 것이 없어 막막하신 분들을 위해\n학력, 나이, 조건, 상황, 실력 등에 따라서 취업, 진학, 공부 방법을 무료상담을 통해서 맞춤형\n컨설팅을 해드리고 있습니다.\n프로그래밍 관련 책 \nHello Coding 프로그래밍\n- 프로그래밍 언어 입문서가 아닌 프로그래밍 기초 개념 입문서\n윤성우의 열혈 C프로그래밍\n- 윤성우 열형강의『C 프로그래밍』는 C언어에 대한 기본을 배울 수 있는 개론서이다.\nJAVA의 정석\n- 자바의 기초부터 실전활용까지 모두 담다\n 이것이 자바다\n-『이것이 자바다』은 15년 이상 자바 언어를 교육해온 자바 전문강사의 노하우를 아낌 없이 담아낸 자바 입문서이다.\nDo it! 점프 투 파이썬\n- 지난 10년간 온라인 독자들의 질문 댓글에 답변하며 쌓아온 저자만의 노하우를 초보자들이 이해하기 쉽게 풀어냈다.\n여러 이유로 시작을 망설이시거나 걱정이 많으신 분들께서는 부담 없이 무료상담을 받으셨으면\n합니다.\nIT직업에 대해 더 궁금하신 점이 있으시면 아래 연락처로 문의 남겨주세요.\n상담신청: www.happy-itbank.com\n오픈상담 : https://open.kakao.com/o/sIQvmT4\n전화상담 : 010-2317-9164', '안녕하세요 \n처음 공부하시는분이면 당연히 힘들고 어렵습니다 \n그것도 학원이 아닌 독학으로 하면 더욱더 힘들어요  ㅜ ㅜ\n독학같은 경우\n장점은 \n적은 비용, 시간 효율적으로 할수 있지만\n단점은\n자신이 하고 있는 공부방법이 맞는지 아닌지 알수 없고\n모르는 문제을 누구한테 물어볼사람이 없고 IT분야에대한 정보을 얻을 수 없습니다\n학원같은 경우\n단점은\n비싸지만 \n학원의 장점은 \n모르는 문제을 강사님한테 물어볼수 있고\nIT분야에 대한 많은 정보을 알수 있고\n같이 공부하는 학생들이랑 많은 정보공유 모임,스터디 을 만들어서 공부할수 있습니다 \n그래서독학 보다는 학원에서 공부하시는것을 권해드리고 있습니다 \n학생분들의 목적 &상황에 따라 공부하는것 , 기간 방향이 다르기 때문에\n학원에 방문상담을 오셔서 학생분들의 어떤 공부해야하는지 ,기간이 얼마나걸리지에 대한 \n방향을 상담받아 보시는것을 추천드립니다\n상담이 많아 예약제로 운영되고 있으니 사이트 들어가셔서 방문상담예약을 해보시기 바랍니다\nKG아이티뱅크\nIT 교육의 중심! 아이티뱅크에서 성공하십시오!\nit-kg.it-bank24.com\n코딩 즉 프로그래밍언어공부을 처음하시면\n입문자들을 위한 it통합기초\nor\n프로그래밍언어 중 기초언어인 파이썬 C언어>C++ >JAVA 순으로 \n공부하시면 큰어려움은 없을 것입니다\nIT공부는 실무가 가장 큰 비중으로 보고 있어서\n책으로 보는 것보다 온라인인강을 보면서 실력을 항샹시키는게 좋습니다 ', '게임 개발을 하고 싶으시다면 프로그래밍을 공부하시면 됩니다.\n간혹 게임기획과 프로그래밍을 같이 배우시는 분들이 있고, \n게임개발에 기획은 필수는 아닙니다. \n4년제와 전문대보다는 컴공과 나오면 되구요 \n비전공자여도 전문적으로 공부해서 게임 개발가능합니다.\n게임분야는 자격증보다 실무적인 능력이 중요합니다. 그걸 증명하는 것이 포트폴리오이구요 \n그래서 포폴 준비에 힘쓰면 됩니다. \n게임 프로그래밍은 언리얼엔진과 유니티엔진으로 나눌 수 있고\n각각 공부해야하는 것들도 다르고, 쓰임새도 다릅니다. \n근데 c언어는 기본적으로 배웁니다.\nc / c++ 가 상형문자라고 생각한다면 여기서 파생된 것이 c# 언어라고 생각하시면 되요ㅎㅎ\n언리티 같은 경우는 대형회사에서 사용하고 , 유니티를 배우시면 모바일 출시가 가능합니다.\n근데 요즘은 크로스 플랫폼이라서 그다지 중요하지는 않습니다. \n각 엔진마다 특징과 장단점이 있는데 이 내용은 상담을 받아 보시는게 \n결정하시는데 도움이 될 것 같습니다. \n제로베이스로 독학으로 하기에는 어려운 부분이라고 생각합니다. \n혼자 생각하시는 것보다 학원에서 전문가들의 교육을 받고 시간 낭비없이 확실하게 나아가시는 게 좋습니다. \n게임전문교육기관 SBS아카데미게임학원 강남점 소개해주고 싶어요\n강남점이 본원이다보니 \n직접 엔진을 개발하셨던 강사님의 실무적인 노하우도 배워 보실수 있습니다. \n아래 링크 남겨드릴테니 살펴보시고 문의 남겨주세요 \nhttp://naver.me/xIJDCo53\n게임학원 최고의 취업컨설팅\n게임 개발을 목적으로 둔 학생들에 대한 진로 상담입니다. 무료진로 및 취업상담을 진행하고자 설문을 진행하고 있습니다. 많은 참여 부탁드립니다.\nnaver.me\nhttp://sbsgameacademy.kr/renewal2016/\nhttps://open.kakao.com/o/syZ4KNmc\nSBS 게임아카데미 김우정멘토\n#게임학원#게임아카데미#게임배우는곳#게임기획#포토샵#3D그래픽#게임원화#웹툰기획#1:1전문멘토#맞춤커리큘럼#교육상담#프로그래밍#이모티콘제작\nopen.kakao.com']",6,https://kin.naver.com/qna/detail.naver?d1id=1&dirId=1040201&docId=368057711&qb=67Cx7Iug&enc=utf8&section=kin&rank=47&search_sort=3&spq=0,"자바, JSP"
5,2020.09.14,[],코로나?,"내년 7,8월에 나올수있죠 백신이?",['제가 백신 만드는 회사도 아닌데 어떻게 알겠어요?\n뉴스에서 그렇다고 애기하니까 그런가보다 하고 있지요\n어차피 모든 백신은 2상까지는 어떻게 통과가 되어도 3상에서 자빠지는 경우가 많습니다\n부작용이 나타나게 되면 다시 시작해야 하는게 백신입니다'],1,https://kin.naver.com/qna/detail.naver?d1id=7&dirId=705&docId=368057192&qb=67Cx7Iug&enc=utf8&section=kin&rank=48&search_sort=3&spq=0,대체의학
5,2020.09.14,[],아무런증세없이미열,요번백신을 맞고 3일?뒤 갑자기 미열기가 생겼는데 다른증세는없이요.. 왜그런걸까요?,['내과 가보세요'],1,https://kin.naver.com/qna/detail.naver?d1id=7&dirId=7010103&docId=368056955&qb=67Cx7Iug&enc=utf8&section=kin&rank=49&search_sort=3&spq=0,순환기내과
5,2020.09.14,[],독감 접종,성인인데 10월말에서 11월초에 맞는게 효과 좋다는걸 모르고 오늘 맞아버렸는데 상관없나요?,"['괜찮습니다 \n독감은 10월 부터유행 시작하고 12월 절정이기 때문에 통상 10~11월 이라고 하는데 \n항체 형성까지 2주정도 걸리기 때문에 조금 미리 맞는 건 괜찮습니다 \n개인차가 있긴 하지만 백신 효과는 6개월 정도 지속되기 때문입니다 ~ ', '안녕하세요~!!\n코로나19로 인해 뒤숭숭한 요즘\n정부에서 독감 무료접종을 실시한다고 합니다.\n무료접종 관련 자세한 내용은 아래글을 참고해보세요~!!\n▼독감 무료접종 예방접종 바로가기']",2,https://kin.naver.com/qna/detail.naver?d1id=7&dirId=701&docId=368056340&qb=67Cx7Iug&enc=utf8&section=kin&rank=50&search_sort=3&spq=0,건강상담
6,2020.09.14,[],"내년7,8월에 나올수도있죠 코로나 백신?",,"['효과적인 백신이 개발되고 접종을 실시하면 코로나는 진정될 것으로 예상합니다.\n내년 7,8월 이전에 나올 것같습니다.\n전 세계적으로 약 150종이 넘는 백신이 개발 중에 있습니다.\n미국에서도 유력한 백신 후보(모더나 제품)가 3상 임상시험 중인데요,\n최근 노인층을 대상으로 실험한 결과 면역이 감염에서 회복한 사람보다도 강하게 형성되었다는 좋은 소식도 있습니다.\n이르면 올해 말경, 늦어도 내년 상반기에는 개발된 백신이 출시될 것으로 봅니다.\n전 국민의 백신 접종으로 사회적 거리두기가 해제되고 예전처럼 일상으로 돌아가기를 기대합니다.']",1,https://kin.naver.com/qna/detail.naver?d1id=7&dirId=705&docId=368055717&qb=67Cx7Iug&enc=utf8&section=kin&rank=51&search_sort=3&spq=0,대체의학
3,2020.09.14,[],백신 수입하면 코로나19는 종식되나요?,백신과 치료제가 수입하면 코로나19는 종식되나요?,"['현재 코로나 사태가 믿을 건 코로나 백신 이외에는 없지만 코로나 백신이 개발되어서 코로나 백신이 전 세계 모든 국민들한테 접종을 할만한 양이 되어야 하고 코로나 백신이 그런 양이 되어서 전 세계 모든 분들이 접종 받아도 상당수 분들한테 부작용이 생길 수도 있고 그 코로나 백신을 맞고 최소 6개월은 되어야지 그 코로나 백신이 효과가 있는지 없는지 알 수 있어서 코로나 백신이 전 세계 모든 국민들한테 상용화되어서 전 세계 모든 국민들이 모두 다 코로나 백신을 맞고 그 코로나 백신 다 사용되고 6~7개월 되어서 코로나 백신이 효과의 결과가 코로나19 백신이 효과가 없을 수도 있고 효과가 있어도 부작용으로 사망하는 분들도 있을 수도 있고 코로나 백신 효과가 있어도 진정한 효과는 언제까지나 전 세계 모든 분들이 한 명도 빠짐없이 모두 다 접종 받아야 하는데 실제로는 코로나 백신을 접종 받는 사람들 보다 접종 받지 못하는 사람들이 더 많을 가능성이 커서 그렇게 된다면 코로나19는 종식이 되지 않아서 너무 코로나 백신만 나오면 코로나가 종식이 된다고 집착하고 기대하는 건 금물이고 차라리 제가 볼 적에는 코로나19는 여름철에 매우 덥고 겨울철에 매우 추운 정상적이고 여름에 매우 무더운 날씨가 되는 식의 예전에 정상적인 자연적인 힘이 코로나 백신보다 코로나19 종식에 훨씬 큰 효과가 있어서 차라리 자연에 힘으로 코로나19가 종식이 되기를 바라는 게 더 나을 수도 있습니다. 올여름이 우리나라는 물론이고 전 세계적으로 제일 안 더운 여름이라는 거 질문자님은 아십니까?', '당장 종식은 어려울것 같고 항체가 만들어져서 감기 수준이 되지 않을까요? 뗄레야 뗄수 없는\n임 보건산업정책국장은 ""내부적으로 예방접종 전략을 논의 중""이라며 ""(확보한 백신이)위험이 없다는 판단이 선다면 올해 10월 정도까지는 질병관리청에서 예방접종 시행계획을 수립할 것""이라고 말했는는데요. \n현재 전 세계 인구의 20%까지 백신 균등 공급을 목표로 세계보건기구(WHO)와 감염병혁신연합(CEPI), 세계백신면역연합(GAVI) 등을 중심으로 코박스(COVAX Facility)가 구성돼어 있는데요.\n정부는 우선 코박스 참여를 통해 약 1000만명분의 백신을 확보할 계획이라고 합니다. https://m.blog.naver.com/everewder83/222090156444\n속보 한국정부 코로나백신 국민 3천만명 10월까지 추진 (+접종대상 시기 가격)\n#코로나백신 #코로나백신성공 #코로나백신관련주 #한국코로나백신 #중국코로나백신 #코로나백신개발 #독일...\nm.blog.naver.com']",2,https://kin.naver.com/qna/detail.naver?d1id=7&dirId=7010107&docId=368071521&qb=67Cx7Iug&enc=utf8&section=kin&rank=28&search_sort=3&spq=0,감염내과
6,2020.09.14,[],프로그램 설치를 했는데 문서뒤에 이상한 글자가 있어요,"프로그램 설치를 했는데
프로그램은 깔리지 않고 이상한 문구가 문서마다 붙어 있어요
예) 123.docx.991a6qh259
991a6qh259 이런 문규가 여러가지 문서에 다 붙어있어요","['안타깝지만 랜섬웨어 감염이에요\n※ 랜섬웨어: 시스템을 잠그거나 데이터를 암호화해 사용하지 못하도록 한 뒤, 이를 풀어주는 대가로 금전을 요구하는 악성 프로그램\n안그래도 요즘 랜섬웨어 관련 피해가 극심한데, 연결된 외장하드나 USB가 있다면 모두 연결을 해제해 놓는게 안전하고, 더이상 컴퓨터에 다른 문서를 받거나 옮기지 않는 게 좋으세요\n어떤 확장자들은 일반 사용자도 복구할 수 있도록 백신 개발사 등 다양한 경로에서 무료 복구툴을 제공해주기도 하는데(이 또한 100%는 복구 불가), fmvodlel 확장자는 아직 복구툴이 나오지 않은 것으로 확인되네요. 따라서 중요 데이터가 없다면 컴을 포맷하는 게 가장 빠른 복구 방법이니, 포맷할 줄 아시는 분이라면 직접 바로 하시면 되고, 잘 모르는 분이라면 이른 시일 내에 가까운 A/S센터나 컴 수리점에 포맷해달라고 맡기시는 게 좋으세요\n※ 해당 디스크는 나중에 복호화툴이 나올 때까지 보관해두고 새로 디스크를 구매해 사용하는 방법도 있어요\n참고로 오래전 랜섬웨어에 감염됐던 유저로서 말씀드리면, 이미 감염된 데이터는 잊고 빨리 포맷 후 다시 컴을 세팅하시는 게 가장 빠르고 좋은 방법이라고 봐요. 이후엔 시스템 복구 수단도 철저히 만들어 두시면, 추후 감염시에도 빠르게 대처할 수 있을 거고요. 제 경우는 감염되더라도 5분내에 복구할 수 있도록 세팅해두고 작업하고 있거든요\n예방과 대처방법에 대한 내용은 KISA 인터넷 보호나라에 잘 나와있으니 천천히 둘러보셔요. 유저 수준에선 대략 이정도까지 조언드릴 수 있을 듯해요']",1,https://kin.naver.com/qna/detail.naver?d1id=1&dirId=102&docId=368054309&qb=67Cx7Iug&enc=utf8&section=kin&rank=52&search_sort=3&spq=0,소프트웨어
3,2020.09.14,[],곤지름 질문,"안녕하세요
커플인데요
근데 오늘 곤지름인거같다는 병원 처방이내려졌는데요
둘다 다른 이성과 관계맺은적이없는데...
왜 생겼을까요...?","['인유두종 바이러스(Human Papilloma Virus, HPV)의\n감염에 의해 피부 또는 점막에\n과도한 양성 증식이 일어나는 사마귀 중\n성기, 항문, 사타구니 부위 및\n그 주변 피부에 발생하는\n사마귀 질환으로 주로 HPV6, 11, 16, 18 type과\n관련되어 발생한다고 알려져 있습니다.\n[출처] 곤지름 성접촉으로만 발생할까?|작성자 생기찾아', '곤지름(성기 사마귀)은 대부분 성관계, 신체 접촉 등으로 HPV(인유두종바이러스) 저위험군에 감염되어 발병됩니다\n집단생활 시엔 젖은 수건 또는 옷 등으로 감염되기도 합니다\n남성은 무증상 보균자인 경우가 많고 성관계로 파트너를 감염시키게 됩니다\n예방을 위해 남, 여 모두 백신을 접종하는 게 좋고 백신을 접종 안 했다면 콘돔을 사용하는 게 좋습니다\n또한, 흡연(간접흡연) 시 발병 위험이 2~3배 이상 높으므로 금연을 해야 합니다\n곤지름 치료 후 HPV 백신을 접종하면 재발을 막을 수 있고 2년 이내에 재발하지 않으면 완치로 볼 수 있습니다']",2,https://kin.naver.com/qna/detail.naver?d1id=7&dirId=7011404&docId=368073581&qb=67Cx7Iug&enc=utf8&section=kin&rank=27&search_sort=3&spq=0,여성질환
3,2020.09.14,[],이거 핸드폰 카메라 해킹되었는지 알 수 있는방법 있나요?,"안녕하세요
얼마전 인터넷 게임에서 만난 외국 친구하고 채팅을 하고 있었는데
갑자기 게임에서 저하고 찍은 영상을 유튜브에 재미있게 편집해 두었다면서 링크를 보내주더라고요
그래서 저도 들어갔는데 빈 화면만 떴습니다.처음에는 로딩인줄 알고 기다렸는데 10초뒤에 링크가 무슨 라이브 스트리밍 이런거여서(유튜브가 아니고 완전 다른 사이트였음)
뭔가 이상해서 바로 나갔고 그사람 차단하고 친구삭제 했습니다.

일단 폰도 재부팅 하고 백신도 돌려보았는데(v3,어베스트)바이러스가 없다고 뜹니다. 하지만 인터넷에서 백신이 못찾아낸다는 바이러스도 있다기에 좀 불안해서 물어봅니다.확실히 핸드폰이 해킹되었는지 알 수 있는 방법 있나요?요즘 카메라나 마이크 해킹해서 도청하거나 랜섬웨어 같은게 많다고 들어서요. 핸드폰을 바꾸거나 ip를 바꾸는 방법만 있는건가요? 불안해서 핸드폰을 못 키고 있는 상태입니다.","[' 질문자님이 언급하신 백신은 실시간 기능을 지원하거나 기타 여러 해킹 등 보안 위협에서 기기를 잘 보호할 수 있다고 인정받은 백신 프로그램입니다.\nV3 백신 안드로이드 성능 평가 / AVtest\nAvast 백신 안드로이드 성능 평가 / AVtest\n 따라서 굳이 과도한 불안감을 가지실 필요는 없습니다. 다만 그래도 카메라나 마이크에 원치 않은 앱이 접근하고 있는지 확인해보시고 싶으시다면 휴대폰의 설정에 가셔서 권한을 보면 카메라, 저장장치, 마이크, GPS, SMS같은 권한이 허용된 앱이 있습니다. 카메라나 녹음 장치 권한이 허용된 앱을 한번 살펴보셔서 이상이 없는지 체크해보시는것도 좋을 것 같습니다.']",1,https://kin.naver.com/qna/detail.naver?d1id=1&dirId=11001&docId=368076465&qb=67Cx7Iug&enc=utf8&section=kin&rank=25&search_sort=3&spq=0,해킹
