page,date,tags,questions,questions_add,answers,N_answer,url,category
22,2021.05.07,[],보험 질문드립니다,"지금 제가 들고있는 보험이 한화생명 (무)VUL적립  한화생명 (무)명품암 삼성화재 무배당 삼성Super보험 
이렇게 3개인데 이중 자궁경부암 예방주사나 백신 예방주사 청구 할수 있는 보험이 있나요?","['지금 제가 들고있는 보험이 한화생명 (무)VUL적립  한화생명 (무)명품암 삼성화재 무배당 삼성Super보험 \n이렇게 3개인데 이중 자궁경부암 예방주사나 백신 예방주사 청구 할수 있는 보험이 있나요?\n_예방접종은 보험청구 되지 않습니다_\n수많은 보험사의 보험료를 한번에 간편히 비교견적을 받을수 있는곳입니다.\n아래 사이트에서 한번에 내 보험료를 무료 비교견적 받아보세요\n무료보험상담 http://m.site.naver.com/0w8jm', '담보내용을 확인해 보세요.\n비트코인은 놓쳤지만 이번만은 놓치지 마세요!!! 파이코인 !!!! \n핸드폰으로 무료채굴 가능 !!! 비상장에도 개당 10~100$로 거래 중 !!!\n빨리 선점하셔서 상장시에 큰 수익 거두시기 바랍니다 !!!\n【 파이코인 】\n1. 파이코인이란 ?\n파이코인(PI Coin)은 차세대 가상화폐시장을 주도할 코인으로 비트코인에 대적할 코인이라는 기대를 한 몸에 받고 있는 코인입니다. 아직 시장에 상장되지 않았으며, 시작점에 있는 코인이라고 하여도 무방한 신생 코인입니다.\n파이코인은 스텐포드 박사 3명이 만든 것으로 Pi Network라는 어플에서 채굴할 수 있으며, 상장이 되지 않았기 때문에 아직은 선점할 수 있는 기회가 있습니다.\n파이코인은 모바일로 채굴이 가능하며, 채굴방법이 아주 간단하고, 별도의 비용이 발생하지 않고 핸드폰의 데이터를 사용하지도 않습니다. 매일 5초만 투자하시면 누구나 채굴이 가능합니다. 하루라도 빨리 시작하는 것이 선점할 수 있는 지름길입니다. 심심풀이로 하더라도 향후에 적지 않은 수익이 예상되는 좋은 기회입니다.\n2. 파이코인(PI Coin) 채굴방법\n1) “Pi Network” 앱 다운로드 : 안드로이드 기기는 플레이스토어, 아이폰은 애플스토어 이용\n2) 앱 설치 및 가입\n(1) 로그인은 전화번호 또는 페이스북계정 중 원하는 방법으로 가입 가능\n* 전화번호 가입 : 국가 선택 → 휴대폰번호 입력 → 암호 입력(암호는 8자리 이상으로 영문 대문자 및 소문자, 숫자 포함) → 암호 재입력\n* 페이스북계정 가입 : 페이스북 아이디 입력 → 비밀번호 입력\n(2) 이름과 성을 입력하고, 사용자이름(ID)를 입력\n3) Invitation code : heemeet (또는 @heemeet)\n추천인을 입력하면 본인도 25%의 채굴속도 증가\n4) 채굴 시작 : 하루에 한 번씩 채굴버튼(번개 모양) 눌러주면 됨(폰을 꺼두어도 자동 채굴됨)\n5) 핸드폰 인증 : 메뉴(홈화면 죄측 상단) → 프로필 → 휴대폰 인증하기 → Manual instructions(무한로딩시 국가 변경) → Recipient((번호) 복사 → Manual steps(×) → START → 확인 → 복사한 번호 입력 → 문자 발송 → 완료\n【 BEE코인 】\n1. BEE코인이란 ?\nBee코인은 제2의 파이코인으로 불리우는 모바일 블록체인으로 2020년 12월에 출시되었음에도 불구하고 벌써 전세계적으로 100만명 이상이 가입하여 모바일채굴에 참여하고 있으며, 향후 얼마나 빠른 속도로 가입자가 늘어나고 채굴이 확산될지 기대되는 코인입니다.\n가입자가 300만이 되면 상장하여 거래소에서 매매가 가능하며, 향후 메인넷 개설이나 플렛폼 네트워크 구축이 이루어지는 등 파이코인과 유사한 형태의 미래의 전망있는 가상화폐입니다. \nBee코인은 모바일로 채굴이 가능하며, 채굴방법이 아주 간단하고, 별도의 비용이 발생하지 않고 핸드폰의 데이터를 사용하지도 않습니다. 매일 5초만 투자하시면 누구나 채굴이 가능합니다. 차세대 가상화폐시장을 주도할 코인으로, 하루라도 빨리 시작하는 것이 선점할 수 있는 지름길입니다. 심심풀이로 하더라도 향후에 적지 않은 수익이 예상되는 좋은 기회입니다.\n2. BEE코인 채굴방법\n1) “bee Network” 앱 다운로드 및 설치\n안드로이드 기기는 플레이스토어, 아이폰은 애플스토어 이용하여 앱 다운로드 후 설치\n2) 가입 순서\n국가 선택 → 휴대폰번호 입력 → 인증번호 입력 → 이름 입력(가능하면 여권상 영문이름) → 아이디 입력 → referral code(ihis2923)입력\n3) referral code : ihis2923\n추천인을 입력하면 본인도 채굴속도 증가\n4) 채굴 시작\n24시간에 한 번씩 채굴버튼(초록색 번개 모양) 눌러주면 됨(폰을 꺼두어도 자동으로 채굴됨)', '지식인 활동을하며 해피빈,콩을 모아서 기부를 하고 있습니다. 작은 힘이라도 보태고자 하니 도움이 되셨다면 꼭 채택 부탁드립니다.\n5년차 보험설계사 보험하는 남자입니다.\n백신주사는 보험에서 안해줍니다.\n치료 목적이 아닌, 질병의 예방이라서 각종 보험에서 보장대상이 아닙니다.\n더 자세한 내용은 상담을 통해 도움드리겠습니다.\n▼카카오톡 상담 바로가기▼\n보험하는 남자\n카카오톡 채팅을 해보세요.\npf.kakao.com\n보험하는 남자가 누군지 궁금하시다면 블로그를 통해 알아보세요^^\n보험하는 남자의 즐거운 일상 : 네이버 블로그\n보험 정말 복잡하고 어렵습니다. 워낙 다양하고 끊임없이 새로운 상품이 출시되기 때문입니다. 어렵고 복잡하기만한 보험, 고객님께서 쉽게 이해하고 제대로 보장받을 수 있도록 도와드립니다. 고객님의 다양한 사례를 소개하고 있으니 많은 도움되시길 바랍니다. 보험하는 남자 김민석 설계사, ☎️010-6736-1883, 카카오채널 http://pf.kakao.com/_pxmyCxb/chat\nblog.naver.com', '특약이나 약관등을 봐야 자세히 알수있지요\n보험크리닉에서  프로 전문가와 함께 보험클리닉해 보세요 \n아래 신청해 주시면 프로 보험 전문가 배정해드립니다\nhttp://www.toppro.co.kr/sub04/sub02.php\n보험에 관한 모든것 """"보험크리닉""""(연고계약 불편사항 많아요)\n1.대한민국 전보험사 콜센타안내 \n2. 맞춤보장분석서비스, 보험리모델링 ,보험금찾기,유병자보험,홈페이지 상담 등록, 1대1 무료 상담 \n3.전문가 채용 \n보험크리닉 상표출원, 대한민국 전국 프로 보험전문가들과 공동으로 성장할수 있는 온라인 플랫폼 구축,\n기존소속사 변경없이 DB생성 미래 고객 확보, 회원비만 내면 평생사용,\n기존홈페이지 소유자는 기존 홈페이지 사용, \n대한민국 모든 보험 프로전문가로 참여하실수 있습니다.\nhttp://www.toppro.co.kr/sub03/sub02.php\n지식파트너란 개인이 아닌 기업이나 단체에서 전문가가 답변해주고 있습니다\n ', '안녕하세요.^^\n예방목적의 사항은 보장받으실 수 없습니다.\n도움이 되셨다면 채택부탁드리며, 보다 더 자세한 상담을 원하신다면\n아래링크를 통해 최대한 빨리 도와드리겠습니다.\n♩ 무료상담(영양보험 나혜주) : https://open.kakao.com/o/stZK9PZb\n♩ 네이버톡톡 : https://talk.naver.com/W4WPOF', '안녕하세요.\n질문자님이 올리신 질문에 답변해드리도록 하겠습니다\n아쉽지만 예방주사는 청구할 수 있는게 없습니다\n✔제가 답변드린 내용은 복사해서 붙여넣기식이 아닌 직접 100% 수기로 작성한 내용임을 말씀드립니다\n✔채택되면 지식인으로부터 받은 해피빈은 어려운 환우분들께 기부를 하고있습니다\n연락주시면 궁금하신 사항에 대해서 최대한 빠르게 답변 드리겠습니다\n✔무료상담 : https://open.kakao.com/o/swVw6qX\n✔블로그 : https://blog.naver.com/sfhk3957', ""반갑습니다. 정직하고 정확한 보험 상담사 '잎새노랑' 입니다.\n아쉽게도 어떤 보험이든 예방주사 관련은 모두 면책입니다. (보장하지 않음)\n예방주사가 아닌 수술이나 치료, 약처방 이라면 수술특약, 진단특약 등으로 보장이 될 것 같습니다.\n추가적인 질문 있으시면, 아래 오픈채팅으로 문의 주시면, 정직하고 친절하게 상담 도와드리겠습니다. 감사합니다.\nhttps://open.kakao.com/o/sFbI0C7c\n잎새노랑 김민형님의 오픈프로필\n보험 전문 상담사\nopen.kakao.com"", '안녕하세요^ㅡ^\n예방주사나 백신주사같은 경우는\n치료의 목적이 아니기 때문에 보험금 청구가 불가합니다. \n그리고 보험회사의 이름만으로는 보장내용을 확인할 수 없기 때문에\n나중에 다른 사유로 보험금 청구가 가능한지 알고싶으시면\n가입한 보험의 보장내용이 나와있는 증권을 올려주셔야 확인가능합니다^ㅡ^\n▼30여개 보험사를 취급하며 부담없이 보험설계 해드려요▼\n▼보험설계사 ""두리"" 오픈카카오▼\nhttps://open.kakao.com/o/sIiubN2c\n보험설계사 ""두리""입니다\nopen.kakao.com', '◈ 문의글 잘 보았습니다. 답변 드릴께요\n▶\n_ 없습니다.\n.\n_비갱신형 암보험으로저렴하고 보장범위가 넓고 보장한도를 높게할수있는 \n인기 상품으로 2곳 추천드릴께요\n한화손해보험 ""무배당 라이프플러스 처음부터지켜주는 암보험"", 흥국화재 ""실속플러스\n암보험"" 90세만기 비갱신형으로 비교설계 받아보세요\n.\n아래 보험비교사이트 이용하시면 되고요, 중요한건 최대한 많은 보험사 설계와보험료\n비교하는 것이니 참고하세요. 가입 안해도 되며 무료이니 편하게 비교하세요\n.\n2 ) 제 프로필에 보험비교사이트를 통해 무료로 비교설계 받아볼수 있습니다.\n아래 비교보험사이트에 상담신청하여 여러보험사의 비교설계를 이메일 또는 문자로 받아보세요\n보험료도 명시되어 있으니, 잘 비교해서 저렴하고 조건 유리한곳에 가입하면 됩니다.\n[보험료만 비교해봐도, 20%절약효과를 볼수 있습니다.]\n◈암보험가입요령\n1) 가족력 참고할것\n=> 가족중 특정질병에 가족력 이력이 있다면 해당질병에 대해 든든한\n보장을 대비하는것이 가장 좋습니다.\n2) 순수보장형으로 가입할것!\n=> 만기환급금은 돌려받는만큼 보험료가 올라가는 것입니다.\n저축은 은행에 하시고, 순수보장형으로 보험료를 낮추세요\n3) 비갱신형으로 가입할것!\n=> 갱신형은 초기 보험료가 낮으나 정기적으로 보험료가 상승하여\n만기까지 납입금을 비교해 보면 비갱신형이 20%가량 저렴합니다.\n4) 주보장암을 확인할것 (*가장중요합니다.)\n=> 같은암에 걸려도, A보험사는 5천만원을 B보험사는 3백만원을 보장해 주는 경우가 있습니다.\n이는 보험사마다 주력으로 보장해 주는 암이 다르기 때문입니다.\n그러니 꼭 확인해야 겠죠?\n5) 비교보험사이트를 통해 20% 보험료 절감효과 보기\n=> 같은 조건이라도 보험사마다 보험료는 천차만별 다름\n6) 암보험은 중복보장 가능합니다.\n=> 의료실비와 달리 두개의 상품에 가입했다면 암발견지 두 상품에서 모두 보험금을 줍니다.\n◈비교보험사이트 장점\n1) 9곳 대표보험사와 제휴하여, 60여가지 상품을 쉽게 비교해 볼수 있는곳\n=>시간적노력, 활동적노력의 수고를 덜어줍니다.\n2) 제휴보험사로는 동*화재/ K*손해/ M*손해보험/ 메**화재/ 현*해상\n삼*화재/ 흥*화재/ 한*손해보험 등\n3) 가입권유가 없으며, 무작위로 전화하지 않으니 편한한 상담과 견적 받아보실수 있습니다.\n*상담요령\n-여러보험사 상품을 알고있으니 비교보험사이트의 통합상담원을 잘 활용할것\n-상담전 예산을 미리 정하고 예산에 맞는 설계 요청\n-비교설계를 받아 잘 비교해서 저렴한곳 찾을것\n-설계는 이메일, 문자, 카카오톡등으로 쉽게 받을것\n출처 : http://cancer-mall.com/?num=3472\n다이렉트암보험사이트\n다이렉트암보험사이트, 건강보험인터넷가격비교사이트, 인터넷건강보험비교견적\ncancer-mall.com\n(실손보험, 어린이보험, 종합보험 등 모든 상품을 비교설계 해볼수 있습니다)\n""저는 위 내용을 소개 하면서 케이에스자산관리(주) 로부터 포인트를 제공 받았음""']",9,https://kin.naver.com/qna/detail.naver?d1id=4&dirId=4010302&docId=389128260&qb=67Cx7Iug&enc=utf8&section=kin&rank=214&search_sort=3&spq=0,보장성보험
20,2021.05.07,[],우리나라 코로나 백신,"제가 알기론 종류엔 화이자 모더나 얀센 아스트라제네카가 있는데
현재 우리나라에서 백신 접종하고 있는 건 이 중에서 어떤 거죠?? 모더나는 다른 거에 비해 적은지 많은지 접종률이 어떻게되나요?
이 외에도 제가 현재 고3인데 언제 맞을 수 있고 백신을 거부/선택할 수 있나요?",['현재\n우리나라는 화이자와 아스트라제네카만\n접종되고있어요\n아직 학생에게는 계획없고요\n백신 거부할수는 있으나\n선택권은 없습니다\n참고되시기바랍니다.'],1,https://kin.naver.com/qna/detail.naver?d1id=7&dirId=7010107&docId=389140762&qb=67Cx7Iug&enc=utf8&section=kin&rank=198&search_sort=3&spq=0,감염내과
18,2021.05.07,[],군대 백신 접종시 조기전역,"20년 7월군번 개짬찌입니다

다음달에 백신 접종 한다는데

그렇게 되면 이제 격리도 없어지고

휴가도 내보내서 조기전역이 없어질것 같습니다 ㅠ

전역전까지 생길 휴가가 60일이라고 치면

그걸 다 쓰도록 할까요 ?

조기전역하면 11월이라 ...

희망을 버려야 겠죠 ?

백신맞아도 휴가가 많아서

그냥 조기전역 시켜준다던지","['백신맞고 휴가가 다 풀리게 된다면, 조기전역은 못하지만 아마 주중에만 휴가쓰고 주말 복귀해서 꿀빨면서\n휴가 더 길게 나갈 수 있지 않을까 싶내요\n휴가 많아서 조기전역 은 절대 없을 이야기고, 휴가는 쓰게 해주고, 계속 부대 왔다 갔다하고 그렇게 될거같아용']",1,https://kin.naver.com/qna/detail.naver?d1id=6&dirId=603&docId=389149042&qb=67Cx7Iug&enc=utf8&section=kin&rank=180&search_sort=3&spq=0,병역
18,2021.05.07,[],백신은 예약을 해야맞을수있나요,63센대 코로나 백신예약을 해야만 맞을수 있나요,"['네네! 예약하셔야 합니다!\n예약 하는곳\n⬇️\nhttps://ncvr.kdca.go.kr/cobk/index.html\n코로나19 예방접종 사전예약 시스템\n코로나19 예방접종 사전예약 시스템\nncvr.kdca.go.kr', '네네\n5월6일부터 상시 예약을 진행중입니다.\n온라인과 전화 예약이 가능해요~\n관련글 참고해서 예약해보세요~\nhttps://m/naver.com/juy1172', '코로나 백신 접종대상자별로 접종시기 안내 후 예방접종 정보제공 누리집을 통해 인터넷으로 사전예약하거나 콜센터 1339번으로 신청하게할 예정입니다. \n 문자 혹은 국민비서서비스를 통해 접종장소 및 일시를 안내하고 예약사실을 확인은 콜센터에서도 가능하도록 할 예정입니다.\n코로나 백신 접종 순서·비용·부작용 안내\n국내에서도 코로나19 백신 접종이 26일부터 본격적으로 시작됩니다. 국내 코로나19 확진자가 나온 지난해 1월 20일 이후 1년 37일 만인데요. 정부는 오는 9월까지 전 국민 70% 임상에 대한 1차 접종을 마치고 11월..\nnaver.me']",3,https://kin.naver.com/qna/detail.naver?d1id=4&dirId=410&docId=389149643&qb=67Cx7Iug&enc=utf8&section=kin&rank=179&search_sort=3&spq=0,"경제 기관, 단체"
20,2021.05.07,"['중성화수술', '혈변', '묽은변', '거품', '질문나누기']",[나눈질문1] ㅠ중성화수술후 혈변에 묽은변을 그자리에 ...,"6~7개월 추정 으로 몸무게가 2kg
작은 몸에 발정이 빨리와서 하루에 잠은 낮잠 새우잠 다 합해서 6~8시간 새벽에두 내내 놀지 않으면 울어서 수술을 서둘렀습니다.
어제 2시반에 수술하구 집에왔는데 .. 혈변을 (냥이화장실) 두번 보구 밤10시에 물 조금 마시고 .. 새벽3시쯤 또 화장실에 혈변이랑 묽은변을 놓구 나왔더라구요

그리곤 사료두 캔두 안먹구 츄르만 10g먹구 아침내내 잤어요

오전10시쯤 병원가니 그럴수 있다고
항생제주사 맞고 (약을 전혀 안먹어서 ) 그리고 집으로 왔습니다.

사료는 건들지두 않고 물만 조금 먹구 츄르15g
그러더니 갑자기 방석에서 서서 피가 섞인 오줌을 놓습니다.

그리고 내내 누워있더니 이번엔 누워서 묽은변을 또 싸고 ... 한시간 정도 지나서 또 묽은변을 그냥 누운상태에서 또 ㅠㅠ

암컷중성화 세번째인데 이런 일은 한번두 없었는데 물론 토두 6번하구요 하얀거품 양이 좀 많터라구요

무슨일이 생긴 건가요 ? 왜 이러지요 ?
첫번째 사진은 토한거 두번째 화장실
세번째는 방석위에 소변
누운 상태에서 사진을 못 찍었습니다.
두번째는 넘 심해서 엉덩이 부분 씻어주었구요","['안녕하세요? 지식iN 동물의료상담 활동을 하고 있는 헬릭스동물메디컬센터 김성호입니다\n제일 중요한 것은 \n해당 동물병원 집도 수의사 선생님의 의견입니다.\n마취에대한 감수성이 높은 아이들도 있고, 그렇지 않은 아이들도 있습니다.\n마취에대한 감수성이 높은 환자일 경우,\n- 심장 및 순환기\n- 기관 / 폐와 같은 호흡기\n- 소화기 \n등에 예상치 못한 부작용이 속출할 수 있습니다.\n위의 모든 문제를 세세하게 검사하기 위해서는 \n상당히 많은 검사항목이 필요하고,\n그 비용 또한 막대하다고 할 수 있습니다.\n가장 포괄적인 검사는\n- 신체검사 (청진 및 혈압측정 포함)\n- 흉부 / 복부 방사선 촬영\n- 전염병 관련 검사 / 백신 항체가 검사\n- 기본 혈액검사 (CBC, Chem, 전해질, SAA)\n정도 입니다.\n위의 포괄적 마취전 검사는 전신관련 기본검사로써\n마취 사전 검사 및 감별진단을 위해 활용됩니다.\n따라서, 특정 기관 / 장기에대한 추가검사는 별도로 진행이 필요합니다.\n해당 동물병원에서 진행한 마취전 검사항목 중에 이상은 없었는지...\n마취 및 수술중 / 수술후 특이 사항은 없었는지...\n물어보시고, 아이의 정상적 회복을 위해 입원처치를 권장드립니다.\n대부분의 경우, 하루 이틀 정도 입원처치후 잘 개선되는 사례가 많습니다.\n너무 걱정하지 마세요.\n마취약물에대한 감수성이 예민한 경우,\n예상치 못한 소화기 부작용이 흔합니다.\n아이의 특이체질이 문제되는 경우가 대부분 입니다.\n큰 문제없이 이 위기를 극복하고 쾌유될 수 있기를 바랍니다.\n감사합니다.\n안녕히 계세요.']",1,https://kin.naver.com/qna/detail.naver?d1id=8&dirId=80511&docId=389139992&qb=67Cx7Iug&enc=utf8&section=kin&rank=199&search_sort=3&spq=0,동물의료상담
19,2021.05.07,[],헌혈할때 헌혈불가한 피,"제가 헌혈을 하려고 했는데요
첫 헌혈때 피뽑고 두번째 헌혈하려고 방문했더니
제 피가 다른사람에게 수혈하게 되면 혈액을 응고 시킬 수도 있다고 헌혈이 불가능하다고 하더라구요
직원분이 혈액성분 얘기해주시고 rh 뭐라고 하셨던거 같은데
그때 정확히 듣지를 못해서요
혹시 왜 그런지 제대로 설명해 주실 수 있나요?
혹여나 코로나 백신 접종시에 문제가 있을까봐 걱정돼요","['해당 정보만으로는 알 수가 없습니다.\n헌혈의 집 고객센터로 전화해서 자세히 문의하시기 바랍니다.\nCRM센터 1600-3705 (월~금 09:00~20:00 토 09:00~20:00 일,공휴일 10:00~18:00)']",1,https://kin.naver.com/qna/detail.naver?d1id=7&dirId=7010104&docId=389146002&qb=67Cx7Iug&enc=utf8&section=kin&rank=181&search_sort=3&spq=0,혈액종양내과
19,2021.05.07,['화이자백신'],화이자 백신 접종 후 음주,화이자 백신 맞고 당일은 안되지만 이틀째는 술먹어도되나요?,"['코로나 화이자 백신 접종 후\n음주는 대략 2-3일 뒤에 마시는게 가장 좋습니다.\n<코로나 백신 접종 후 주의사항> 부작용, 이상반응, 샤워, 증상, 음주\n코로나 백신 접종 후 이상반응 코로나 백신 접종 부작용 주의사항 안내 _ 전세계적으로 코로나 백신 접종이 시작됬습니다 대한민국 국내에서도 코로나19 백신 접종도 시작됬습니다 코로나 백신은 코로나 바이러스..\nzero-news.tistory.com\n출처']",1,https://kin.naver.com/qna/detail.naver?d1id=7&dirId=70602&docId=389145524&qb=67Cx7Iug&enc=utf8&section=kin&rank=182&search_sort=3&spq=0,"술, 담배"
19,2021.05.07,[],80세 어르신들 코로나백신 안 맞으면 국민의료보험 혜택을 안준다는게 사실입니까?,"저희 할머니가 예방접종 안내받고 왔는데

AZ포함해서 코로나백신을 안 맞으면


문재인정부가. 어르신들은 국민의료보험 혜택을 안준다고 하더군요.


이게 사실입니까? 문재앙","['아뇨\n코로나 백신 안맞아도 불이익은 없습니다..\n<코로나 백신 접종> 순서, 횟수, 나이, 우선순위, 시기, 방법\n대한민국 국내 코로나 백신 접종 코로나 백신 접종시기 _  먼저 국내 코로나 백신 접종대상은(?) 대상은 전국민 입니다. (단 백신 개발과정에서 임상시험에 포함되지 않은 임신부와 18세 미만 소아청소년은 접종..\nzero-news.tistory.com', '코로나가 불안한 사람을 위해서 \n백신을 무료로 접종해 주겠다는 것이지... \n의무접종(?) 까지는 아니라서... 원치 않으면 접종하지 않아도 되며 \n의무(?)가 아니다보니 \n백신을 거절한다고 해서... 국가에서는 벌금(?)등을 부과하거나 \n국민의료보험 혜택이 중지(?)되지는 않습니다.\n다만, 본인의 부주의로 인해서 코로나에 감염된 이후 \n또 다른 사람에게 코로나를 전파시키거나... 영업방해 등으로 손해를 끼친 경우... \n다른 사람이 손해배상을 청구할 수는 있는데... 그때부터는 변호사의 도움이 필요한 영역 입니다.']",2,https://kin.naver.com/qna/detail.naver?d1id=6&dirId=6100401&docId=389145213&qb=67Cx7Iug&enc=utf8&section=kin&rank=184&search_sort=3&spq=0,국민건강보험
19,2021.05.07,"['화이자', '백신']",화이자 백신 2차 꼭 3주 후에 맞아야되나요?,"제가 군인이라 5월 말 ~ 6월 초에 화이자 백신 1차를 맞는데 2차 맞기 전에 전역을 합니다.
근데 20대는 제일 마지막에 맞게 되잖아요.
그럼 이 경우엔 다시 1차를 또 맞고 2차를 맞아야 되나요?
그럼 그냥 백신 안 맞고 전역 후에 1차 2차 맞는 게 나을까요?",['군대에서 \n방역당국에 신청을 해주면... 전역후에 민간 접종센터에서 2차 접종이 가능합니다.'],1,https://kin.naver.com/qna/detail.naver?d1id=7&dirId=7010107&docId=389144827&qb=67Cx7Iug&enc=utf8&section=kin&rank=185&search_sort=3&spq=0,감염내과
