page,date,tags,questions,questions_add,answers,N_answer,url,category
22,2019.11.27,"['검색질문', '통합검색궁금증', '통합검색질문하기']",학점은행제 정보보호학 학사학위에 대하여,"저는 지금 중2고 정보보안전문가가 꿈인데 답변 부탁드립니다.
1. 학점은행제 정보보호학 학사학위 딴 후 취업 어떻게 하나요?
2. 학점은행제 할때 강의를 어디서 듣나요?
3. 고졸후 시작하면 몇년정도 걸리나요?
4. 취업 쉽게 할 수 있나요?","['안녕하세요, 학습전문가 김수현입니다.\n - 수기답변 도와드릴게요. 네 가능합니다! 안내 도움 드리겠습니다!\n -----------------------------------------------------------------------------\n 학점은행제는 정식 인가된 교육기관에서만 진행 가능한 국가평생교육제도로써,\n전문학사(전문대), 그리고 학사(4년제)학위의 정해져있는 전공교양일반 학점만큼만 이수하게 되면 학위가 나오는 제도입니다. 진행과정에 있어, 수업으로만 학점을 이수할 수도 있고, 자격증과 독학사 시험의병행을 통해 학점을 추가적으로 인정받아 일반 대학보다 더 빠른 조기졸업이 가능한 제도입니다.\n  학점은행제도를 통해 취득할 수 있는 학위는 총 2가지 입니다!\n 전문학사(2,3년제 전문대)학위\n전공45 + 일반20 + 교양15 => 80 학점을 채워야 학위취득이 가능\n 학사(4년제)학위\n전공60 + 일반50 + 교양30 => 140 학점을 채워야 학위취득이 가능\n ==================================================================\n 진행과정에 있어 가장 주의하셔야 할 부분은 가장 효율적은 학습계획안으로 진행이 가능한지와, 진행과정을 도와줄 학습전문가의 역량에 대해 파악하셔야 합니다. 만약 학습전문가가 너무 많아 구분이 안가신다면, 직접 상담을 통해 확인해보시는편이 가장 효율적이고, 빠릅니다.\n 문의주시면 학습자님의 현재상황 먼저 파악한 후, 가장 효율적인 학습설계로 안내 돕겠습니다.\n *상담은 24시간 무료로 진행 도와드리고 있습니다.\n ↘↘↘↘↘ 네임카드 클릭하시면 바로 상담문의 가능합니다.  \nNo.56756865', '  안녕하세요? 보람멘토 입니다.\n 하루 학습투자시간이 얼마나 가능하신가요? \n학우님께서 원하시는 니즈와 진로방향에 맞게 컨설팅 도움드리고 있습니다.\n늦은 시간까지 무료상담 진행 가능합니다.\n  sdsd1113sdfsdf', ' 안녕하세요. 교육법인 가이던스 소속 김형수입니다.\n#왜 학점은행제로 해야하는가?\n* 100% 온라인진행으로 누구나 쉽게 접근\n* 고졸도 가능\n* 시간적 여유가 없는 바쁜 현대인(직장인, 주부 등등) 원하는 시간대에 가능\n* 평일에 시간이 없어도?? 주말만 이용해도 가능\n* PC만 있으면 어디서든 가능\n#비용\n학습설계를 어떻게 하느냐에 따라서 약50~60만원으로 일반대학이나 사이버대학교, 방통대 등등에 비해 굉장히 저렴한 비용\n#기간\n6개월만에도 학위취득 가능\n일반적으로 2년제 전문학사는 6개월~1년6개월, 4년제 학사는 1년 6개월~2년정도 필요합니다.\n온라인상으로는 질문자님의 현상황을 정확히 캐치할수 없습니다.\n때로는 100번의 검색보다 한번의 상담이 보다 큰 도움이 될 수 있습니다.\n누구와 진행하느냐에 따라 2년과정도 1년이 될 수 있고 비용과 난이도까지 대폭 줄일 수 있습니다.\n 상담에는 비용이 발생하지않습니다.\n 아래 링크로 문의를 주시면 질문자님의 목표와 현상황을 캐치해서 누구보다 합리적이고\n효율적인 과정으로 도와드리겠습니다.\n   ', '안녕하세요. 전문교육상담원 김찬미입니다.\n  (수기 답변)\n  학점은행제는 학점 인정 등에 관한 법률에 의거하여 \n학교와 학교 외의 다양한 형태를 학점으로써 인정하고\n대학교와 동등한 자격의 학위가 수여됩니다.\n  전공학사(2년 전문대 졸) 취득학점\n전공학점\n일반학점\n교양학점\n45점\n20점\n15점\n  학사학위(4년제 대학 졸) 취득학점\n전공학점\n일반학점\n교양학점\n60점\n50점\n30점\n  전적대 학점, 시간제 수업, 자격증, 독학사\n등을 이용해서 학점을 채워 학위를 취득하게 되며,\n학사학위는 2년 전문학사는 1년만으로\n일반 대학교보다 빨리 취득이 가능합니다.\n    학위수여를 받기 위해서는,\n정식인가 받은 평생교육원에 수업을 등록하셔야 하는데요.\n이 때문에, 정식교육원 소속 전문교육상담사에게 상담을\n받아보시는편이 가장 좋습니다.\n    왜냐하면 학점을 이수하는 과정에서 발생하는\n행정 절차가 복잡하고 까다롭기 때문에\n질문자님 혼자서 수행하시기에 많이 힘드세요.\n    또한 어떤 식으로 계획을 세우고 준비하느냐에 따라 \n학점을 채우는 기간과 비용이 천차만별로 달라지기 때문에,\n시작하시기 전에 전문가에게 상담을 받으셔서\n구체적인 학습설계를 세우신 이후 \n전문가의 지도 하에 진행하셔야 합니다.\n    정식인가 교육원 소속의 전문상담사는\n학위, 자격증 취득의 진행과정 상담에 있어\n별도의 비용이 발생하지 않기 때문에\n부담 없이 관심 있으신 학과 또는 자격증관련 문의 주시면 \n자세한 진행과정과 비용 안내해드리겠습니다 :-)\n  저희 교육원은 1:1 담당자 배정으로 학위나 자격증 취득 시까지 \n개인 관리해드리고 있습니다.\n 아래 네임카드 클릭하시면 상담가능합니다.\n  존재하지 않는 이미지입니다.\nsdf', '안녕하세요! 학점은행제 전문플래너 SJ사이버평생교육원 오세윤팀장입니다.\n   문의주시면 자세한 상담 및 진행 도와드리겠습니다 :D\n   학점은행제에 대해서 설명드리자면 국가에서 만들고 교육부에서 운영하는 제도이며, 정규 대학에 진학하지 않고도 온라인강의로 대학교 졸업과 동등한 학위을 취득할수있는 제도입니다.\n  학점은행제로 취득할 수 있는 학위는 대표적으로 2가지가 있는데\n1.학사학위(4년제졸업과 동등) 2.전문학사(2년제졸업과 동등)입니다.\n학사학위에 필요한 학점은 전공 60학점 일반 50학점 교양 30학점 총 140학점이고,\n전문학사에 필요한 학점은 전공 45학점 일반 20학점 교양 15학점 총 80학점입니다.\n학위취득에 필요한 소요기간은 학사학위는 1년6개월 ~ 2년 정도 소요되고, 전문학사는 1년정도 소요됩니다.\n그리고 중퇴한 대학의 학점이나 학점으로 인정되는 자격증이 있거나,\n독학사를 병행해서 진행하게되면 학위취득의 소요기간을 더 단축시킬 수 있습니다.\n  독학사 1단계는 과목별로 교양 4학점으로 인정해주며 최대 5과목까지 응시할 수 있고,\n2단계 ~ 4단계까지는 과목별로 전공 5학점으로 인정해주며 최대 6과목까지 응시할 수 있습니다.\n  학점은행제의 장점이라고 한다면 학위취득에 걸리는 소요기간을 단축시킬 수 있다는것과,\n온라인강의로 진행되기 때문에 직장인들도 일과 병행해서 진행할수 있다는것입니다.\n그러나 아무것도 모르는 상태로 진행하게되면 학습자등록, 학점인정신청, 학위신청 같은 신청기간들을 놓치게 될 수 있어서 예정기간보다 더 오래 걸릴수도 있고\n 다른 문제가 발생할 수 있기 때문에,\n제가 질문자님의 목표를 최단기간에 달성할 수 있는 플랜을 세우고\n전담 교육플래너가 되어서 안내 및 진행을 도와드리겠습니다.\n 저희 교육원은 국가에서 정식으로 인정받는 교육원이기 때문에 걱정하실필요가 없으시고, 학위, 자격증 등 목표하시는바를 취득하실때까지 담당자가 1:1로 관리해드립니다.\n상담비용은 절대 받지않으니 부담없이 언제든지 문의주시면 상담 도와드리겠습니다.\n   오픈카톡 : https://open.kakao.com/o/sZGDwI1\n※ 상담신청 ↓↓ 이미지 클릭\n  cvxxcx', '1. 취업은 원하시는 기업에 이력서 제출을하거나 취업포털에 이력서를 올리면됩니다.\n2. 정보보호학강의를 들을 수 있는 교육원은 따로 안내해드릴 수 있습니다.\n3. 최소 2년입니다.\n4. 취업은 자격증 취득같은 스펙을 다야하게 쌓으면 가능합니다!', '학점은행제 정보보호학 학사학위 질문주셔서\n답변드립니다 :)\n1. 학점은행제 정보보호학 학사학위 딴 후 취업 어떻게 하나요?\n-> 정보보학 학사학위 취득 과정에서 적어도 정보보안산업기사를\n취득하셔야 합니다. 정보보안기사 자격증 까지 취득하시면 좋지만\n이것은 본인이 준비하기에 따라 달라질것 같습니다.\n정보보안산업기사  / 기사 자격증 취득 및 정보보학 학사학위를 가지고계시면\n정보보안관련 취업을 하시면 되는데 이 부분은 정말 다양합니다.\n침해대응 CERT - 모든 전산망에 침입되는 해킹을 역으로 추적하거나 역으로 공격하는 업무를합니다.\n악성코드분석가 - 악성프로그램 또는 바이러스와 같은 모든것들을 분석하여 해결하는 업무를합니다.\n모든것들을 분석하고 찾아내어 해결하는 업무를합니다. \n보안솔루션개발자 - 방화벽 , 침입탐지시스템 , 백신프로그램들을 개발하는 업무를합니다.\n보안관제 - 실시간으로 침입되는 해킹을 감시하거나 분석하는 업무를하게됩니다.\n모의해킹전문가 - 모의해킹으로 업무하는 기업에대한 모든곳을 말그대로 모의해킹을 시도하면서 취약점과 악성코드 \n등으로 직업 폭도 한정되어있지않고 다양합니다.\n2. 학점은행제 할때 강의를 어디서 듣나요?\n-> 온라인 학점은행제로 100% 이수가 가능하며 평생교육원 사이트에서 인터넷 강의식으로\n강의를 듣게 됩니다. \n3. 고졸후 시작하면 몇년정도 걸리나요?\n-> 고졸후 시작시 그해 1학기 시작으로 최소 걸리는 기간은 4학기 과정으로 플랜설계를\n할 수 있으며 학습자의 진행과정에서 자격증 취득현황 및 독학사 시험 합격수에 따라\n플랜기간은상이합니다.\n4. 취업 쉽게 할 수 있나요?\n-> 취업을 쉽게 할 수 있다고는 장담을 못하지만 미래 유망 직업중 하나 인것은 맞습니다.\n정보보호 쪽에 관심이있고 숙달된 실력을 겸비하신다면 충분히 취업 하실 수 있다고 봅니다!\n학점은행제 진행에 있어 IT관련학과\n정보보호학과 학사학위 취득을 생각하고 계신다면\n아래링크로 상담 받아보시고 플랜설계 받으시고\n진행에 있어서 도움드리니 편하실 때 연락주시기 바랍니다.\n※ 네이버 검색창 "" Kombe ED "" or "" Circe 학위 "" 검색 → 다양한 과정 문의 가능 ※\n┌──────────────────────┐\n-카카오톡 플러스친구\n- http://pf.kakao.com/_cnERK/chat\n클릭이 안될시, 카카오톡 메인화면 검색창 → sj현팀장 \n★전화상담예약\n- https://forms.gle/a3U3rtHsVNefLxJr5\n★바로상담하기\n.0.1.0. - .5.6.5.4. - .6.5.6.9.\n└──────────────────────┘', '안녕하세요, SJ사이버 평생 교육원, 김홍기 플래너입니다.\n 질문자님께서 남겨주신 글 잘 읽어봤습니다.\n ------------------------------------------------------------\n 네, 가능합니다. 연락주시면 상담 도와드리겠습니다.\n ------------------------------------------------------------\n 학점은행제의 진행은?\n ◎온라인 수업의 경우 15주과정이며, 1주마다 2강의씩, 총 30강으로 이루어져있습니다.\n ◎ 과목별 평가는 출석/ 중간, 기말고사 / 쪽지시험 / 토론과제 / 레포트과제가 존재하며,\n이를 합산한 점수가 총점이 됩니다.\n ◎ 총점이 60점 미만이 되면 F학점을 받으며, 출석률이 전체 80%미만이면 F학점으로 과락입니다.\n ◎ 과제, 시험 등 학습자 분들이 까다롭다고 생각하실 수 있는 부분에 대한 관리 및 도움을 드리고 있습니다!\n ◎현실적이고 체계적인 플랜 수립 도와드리겠습니다! \n ◎ 궁금한 점이 있으면 언제든 연락주세요! 성심성의 것 답변 드리겠습니다 :)\n ◎교육원을 잘못 선택하면, 강의 진행에 아무런 도움을 받지 못할 수도 있습니다. \n ◎학습자 분들의 목표 끝까지 책임감 있게 함께 가겠습니다.\n ------------------------------------------------------------\n학점은행제란?\n 일반 대학을 다니지 않고도,\n누구나 학점을 취득하여 학위를 받을 수 있는 평생 교육제도입니다.\n 학점은행제에서는 일정 학점 이수가 완료되면,\n 학사 - 140 학점 (전공 : 60학점 , 교양 : 30 학점, 일반 : 40학점)\n전문학사 - 80학점 (전공 : 45학점, 교양 : 15 학점, 일반 : 20학점)\n 2월과 8월에 나오는 학위를 수여 받을 수 있습니다.\n 수여받은 학위는 일반 4년제 대학, 전문대학의 학위와 완전히 동등한 법적 권리를 가지며,\n편입 , 대학원 진학, 대졸자 전형 등 다양한 분야에서 사용이 가능합니다.\n 학점은행제는 학위 취득에서만 끝나는 것이 아닌, 국가 자격증을 취득할 수 있는 과정도 있으며,\n 학점은행제로 사회복지사/ 보육교사/ 청소년 지도사 등 \n자격 과정과 국가 기술 시험의 응시 자격을 갖추는 과정도 존재합니다.\n 또한, 대부분의 수업을 온라인이나, 모바일로 들을 수 있어,\n직장인, 늦은 나이의 만학도, 편입 공부 등으로 바쁜 편입생들도 수월하게 진행이 가능합니다.\n ', '    안녕하세요:)\n학점은행제 김지수 입니다.\n학점은행제는 교육부에서 주관하는 학위제도로\n일정 학점을 모으시면 학위취득이 가능합니다.\n  고등학교 졸업자이시라면 누구나 학점은행제 진행을\n하실 수 있으며, 시간과 장소에 제약이 있으신 분들이나 \n빠른 시일내로 학위 취득을 하셔야하는 분들, 응시자격 또는 \n편입조건을 갖추셔야 하는 분들에게 추천드리고 있습니다.\n  80학점을 모아주시면 학점은행제 전문학사를 취득하실 수 있고\n140학점을 모아주시면 학점은행제 학사학위 취득이 가능합니다.\n  학점은행제 전문학사 기간은 1년에서 1년6개월 과정이며,\n학점은행제 학사학위 기간은 2년에서 2년 6개월로 진행됩니다.\n  학점은 학점은행제 수업, 자격증, 독학사, 전적대를 \n통해 학점을 모으실 수 있으며, 이러한 과정으로\n기간 단축이 가능합니다.\n  학점은행제를 진행을 희망하신다면\n플래너와 같이 기간, 비용 등을 고려하여\n체계적인 학습 플랜을 세워 보셔야합니다.\n  상담 및 학습설계는 무료로 진행됩니다.\n더 자세한 과정에 대해 궁금하시면 편하게 연락주세요:)\n카톡ID : ssdoj7\n오픈카톡 : https://open.kakao.com/o/sMLMdpic\nTeam Sherpa 대표 홈페이지 : https://teamsherpa.modoo.at/\n-다양한 합격 후기를 확인 하실 수 있습니다. \n - 이 컨텐츠의 소유권은 Team Sherpa에 있습니다. 무단도용 / 모방 / 복사 시 법적 조치를 받을 수 있으며\n만일 이 사항들을 위반하여 발생하는 모든 법적 책임은 전적으로 불법행위자 본인에게 있습니다.\nNo. 6365367457457', '    안녕하세요:)\n학점은행제 김지수 입니다.\n학점은행제는 교육부에서 주관하는 학위제도로\n일정 학점을 모으시면 학위취득이 가능합니다.\n  고등학교 졸업자이시라면 누구나 학점은행제 진행을\n하실 수 있으며, 시간과 장소에 제약이 있으신 분들이나 \n빠른 시일내로 학위 취득을 하셔야하는 분들, 응시자격 또는 \n편입조건을 갖추셔야 하는 분들에게 추천드리고 있습니다.\n  80학점을 모아주시면 학점은행제 전문학사를 취득하실 수 있고\n140학점을 모아주시면 학점은행제 학사학위 취득이 가능합니다.\n  학점은행제 전문학사 기간은 1년에서 1년6개월 과정이며,\n학점은행제 학사학위 기간은 2년에서 2년 6개월로 진행됩니다.\n  학점은 학점은행제 수업, 자격증, 독학사, 전적대를 \n통해 학점을 모으실 수 있으며, 이러한 과정으로\n기간 단축이 가능합니다.\n  학점은행제를 진행을 희망하신다면\n플래너와 같이 기간, 비용 등을 고려하여\n체계적인 학습 플랜을 세워 보셔야합니다.\n  상담 및 학습설계는 무료로 진행됩니다.\n더 자세한 과정에 대해 궁금하시면 편하게 연락주세요:)\n카톡ID : ssdoj7\n오픈카톡 : https://open.kakao.com/o/sMLMdpic\nTeam Sherpa 대표 홈페이지 : https://teamsherpa.modoo.at/\n-다양한 합격 후기를 확인 하실 수 있습니다. \n - 이 컨텐츠의 소유권은 Team Sherpa에 있습니다. 무단도용 / 모방 / 복사 시 법적 조치를 받을 수 있으며\n만일 이 사항들을 위반하여 발생하는 모든 법적 책임은 전적으로 불법행위자 본인에게 있습니다.\nNo. 141234524534r', '    안녕하세요:)\n학점은행제 김지수 입니다.\n학점은행제는 교육부에서 주관하는 학위제도로\n일정 학점을 모으시면 학위취득이 가능합니다.\n  고등학교 졸업자이시라면 누구나 학점은행제 진행을\n하실 수 있으며, 시간과 장소에 제약이 있으신 분들이나 \n빠른 시일내로 학위 취득을 하셔야하는 분들, 응시자격 또는 \n편입조건을 갖추셔야 하는 분들에게 추천드리고 있습니다.\n  80학점을 모아주시면 학점은행제 전문학사를 취득하실 수 있고\n140학점을 모아주시면 학점은행제 학사학위 취득이 가능합니다.\n  학점은행제 전문학사 기간은 1년에서 1년6개월 과정이며,\n학점은행제 학사학위 기간은 2년에서 2년 6개월로 진행됩니다.\n  학점은 학점은행제 수업, 자격증, 독학사, 전적대를 \n통해 학점을 모으실 수 있으며, 이러한 과정으로\n기간 단축이 가능합니다.\n  학점은행제를 진행을 희망하신다면\n플래너와 같이 기간, 비용 등을 고려하여\n체계적인 학습 플랜을 세워 보셔야합니다.\n  상담 및 학습설계는 무료로 진행됩니다.\n더 자세한 과정에 대해 궁금하시면 편하게 연락주세요:)\n카톡ID : ssdoj7\n오픈카톡 : https://open.kakao.com/o/sMLMdpic\nTeam Sherpa 대표 홈페이지 : https://teamsherpa.modoo.at/\n-다양한 합격 후기를 확인 하실 수 있습니다. \n - 이 컨텐츠의 소유권은 Team Sherpa에 있습니다. 무단도용 / 모방 / 복사 시 법적 조치를 받을 수 있으며\n만일 이 사항들을 위반하여 발생하는 모든 법적 책임은 전적으로 불법행위자 본인에게 있습니다.\nNo. 135135', '  안녕하세요! 교육부 정식 인가 현대사이버평생교육원 소속\n현성민 플래너입니다\n   1. 학점은행제 정보보호학 학사학위 딴 후 취업 어떻게 하나요?\nㄴ 원하시는 취업처에 따라 준비해야하는 것이 달리집니다\n2. 학점은행제 할때 강의를 어디서 듣나요?\nㄴ 평생교육원에서 이수가능합니다! 정보보호학의 경우 원격 교육원에서 100% 온라인으로도 진행 가능합니다\n3. 고졸후 시작하면 몇년정도 걸리나요?\nㄴ 일반적으로 4년제 학위는 2년을 기준으로 취득합니다. 난이도를 낮추면서 기간을 늘리거나 더 컴팩트하게 진행해서 기간을 줄일 수도 있습니다\n4. 취업 쉽게 할 수 있나요?\nㄴ어느정도의 직장을 생각하는지에 따라 다릅니다.\n학점은행제는 학점 취득 방법이 다양하기 때문에 학습설계도 다양합니다\n그래서 질문자님의 상황과 목적에 맞는 학습설계를 한 후\n그에 맞춰 진행하시는 것이 가장 효율적이고 안전합니다\n상담주시면 질문자님에게 맞는 학습설계 도와드리고\n복잡한 행정적인, 제도적인 부분부터\n학사 일정 관리까지 지원해드리겠습니다\n 상담은 무료이며 언제든지 가능합니다\n편하게 연락주세요:)\n   《학점은행제》\n◎ 다양한 활동으로 학점을 모아 필수 학점을 모두 채우면 학위를 주는 국가 제도\n학년제가 아닌 학점제이기 때문에 기간 단축에 유리\n  《학점 취득법》\n◎ 학점은행제 강의 수강\n◎ 국가 자격증 취득\n◎ 독학사\n◎ 전적대\n  《전문 플래너가 필요한 이유》\n◎ 학점 은행제는 학점을 취득하는 방법이 다양\n→ 같은 학력으로 같은 전공을 취득하더라도 소요되는 기간이나 비용이 다름\n  《〃딱맞춤〃 현성민 플래너의 강점》\n〃다양〃\n플래너로서 오랜 경험으로 다양한 학습 플랜을 제공하여 학우님의 취향에 맞는 커리큘럼 선택 가능\n〃정확〃\n필요 학점만을 채운 단순한 강의 나열이 아니라 학우님들 각각 사정에 맞춰서 실행 가능한 학습 플랜을 제공\n〃꾸준〃\n학우님의 목표가 달성될 때까지 커리큘럼을 진행하는 중에도 지속적인 1:1 전담 성적 관리\n       ']",12,https://kin.naver.com/qna/detail.naver?d1id=11&dirId=110703&docId=341343845&qb=67Cx7Iug&enc=utf8&section=kin&rank=216&search_sort=3&spq=0,"방송, 통신 교육"
22,2020.06.30,"['검색질문', '통합검색궁금증', '통합검색질문하기', '#하트독']",강아지 자가 예방접종 주사기에 미리,"저희집 강아지 예방접종을 자가 접종을 하는데요 어제 4차라 백신+켄넬을 맞아야되는데
저희집 강아지가 엄살이 너무 심해서 ㅠㅠ 어제 백신만 맞히고 켄넬을 못맞췄거든요 ... 부어오르지도 않았고 잘뛰어놀길래 오늘 놓을려고 하는데 놓아도되나요? ㅠㅠ 아그리고 제가 어제 미리 켄넬이랑 백신 같이 맞춘다고 주사기에 미리 약을 빼놨습니다 .. 근데 백신뿐이 못 맞춰가지고 ... 우선 어제 바로 켄넬은 주사기 안에 담겨있는대로 냉장고에 다시 넣어 놨는데 켄넬코프 인가 요거 오늘 맞춰도 되나요? 아님 약을 다시 바꿔서 해야 할까요?ㅎㅎ","['본인이 직접 주사를 놓는다고요?? \n전문적인 지식이 있어서 그런건가요?? ', '주사기에 접종할 주사액을 미리 뽑아두었다가 하루밤 묵힌 것은 다시 주사해서는 안됩니다.\n주사액이 변질되면 강쥐에게 치명적일 수 있습니다.\n새것으로 바꾸세요.', '안녕하세요.\n반려견에 대한 궁금증을 해결해주는 ""하트독"" 입니다.\n새로운 약을 사용하시길 추천합니다.\n답변이 도움이 되셨다면 채택도 부탁드립니다.', '그것도 모르는데 백신을 놓겠다는 게 너무 무모하다고 생각되지 않나요?\n혹시 몰라 자가접종 부작용 관련 뉴스 링크 걸고 가겠습니다.\nhttps://www.dailyvet.co.kr/news/policy/133151\n`반려동물 직접 치료…이래도 하시겠습니까？`\n반려동물에 대한 보호자의 진료행위(자가치료, 자가진료)는 불법이다. 수의사법 제10조(무면허 진료행위 금지) 위반으로 2년 이하의 징역 또는 2천만원 이하의 벌금에 처할 수...\nwww.dailyvet.co.kr\n집 주변에 여러 동물병원 많이 다녀보고, 양심적인 수의사가 운영하는 동물병원을 주병원으로 해서 다니시길 추천드립니다.']",4,https://kin.naver.com/qna/detail.naver?d1id=8&dirId=8050105&docId=361202718&qb=67Cx7Iug&enc=utf8&section=kin&rank=215&search_sort=3&spq=0,"미용, 건강관리"
22,2020.08.15,"['다운로드안지워짐', '저절로다운로드', '다운로드지우기']",다운받지않은사진이 다운되서 지워지지않아요ㅜㅜ,"구글에서 과일사진몇장다운받았는데,나중에보니 제가받지도 않은 사진들이 왕창다운되어있어요
지울려고하니 이름이넘길다고,그래서 이름바꾸기하고 지워도 안지워지고 개별로 지워도 지웠는데 다시또있고,어떻하죠?피씨용량도 별로안큰데.얘들이 왕창용량먹는것같고.혹시 바이러스인가요?어떻하죠????",['최신 버전의 백신으로 악성 코드 감염을 점검해보세요.\n백신을 사용해도 문제가 지속된다면 중요한 자료를 별도의 스토리지에 백업하고 윈도우를 초기화하거나 다시 설치하는 것이 좋겠습니다.'],1,https://kin.naver.com/qna/detail.naver?d1id=1&dirId=10301&docId=365315229&qb=67Cx7Iug&enc=utf8&section=kin&rank=213&search_sort=3&spq=0,윈도우
