page,date,tags,questions,questions_add,answers,N_answer,url,category
9,2020.11.05,[],여성 곤지름 증상,"갑자기 어젯밤인가 오늘부터 사진에 표시해둔쪽이 아파서 더듬더듬 만져봤더니 뭔가 나있는게 만져졌습니다
그런데 인터넷에 쳐보니까 여성 곤지름이라고 나오더라구요
근데 일반적으로 여성 곤지름은 오돌토돌한 돌기같은게 만져진다고 하는데 저는 오돌토돌하다기보단 얼굴에 나는 염증성 여드름?처럼 돌기보단 크고 볼록한 뭔가가 났어요 갯수도 그거 하나만요..
현재 남자친구가 있어서 성관계를 할때 저부분이 좀 쓸렸다는 느낌이 났거든요? 그래서 아픈거라고 생각했었는데 갑자기 저부분에 저런게 났어요
저것도 곤지름인가요..?
그리고 전에도 비슷한 부위에 같은 통증을 느꼈던때가 있었는데 그땐 그냥 참으니까 통증이 없어졌었어요 만약이게 곤지름이 맞다면 그냥 놔둔다고 이미 나있던것이 없어질수 있나요..?","['곤지름은 질 주변 항문 주변에서 시작하여 퍼지는 질병입니다.\n면역력 관리만 잘하시고 그러신다면 없어지긴 하지만\n병원에 내원 하셔 치료나 레이저로 없애는 편이 좋습니다.', '곤지름 아닙니다\n바르톨린낭종이 의심됩니다\n증상은 앉거나 걸을 때 외음부에 극심한 통증을 유발하고 성교통, 발열, 부종 등이 생깁니다\n불편한 증상이 없고 크기가 크지 않다면 자연적으로 호전될 수 있지만, 낭종이 커지고 악화되어 고름이 차면, 절개하여 고름을 빼내고 약물 치료를 해야 합니다\n정확한 원인은 산부인과 진료받아보세요', '안녕하세요.\n16년째 여성곤지름(콘딜로마, 여성성기사마귀)을 주로 치료를 하고 있는 노원 산부인과 전문의 조병구입니다.\n곤지름을 의심하고 계시군요.\n우선 이것이 곤지름이 맞는지 병의원에서 정확히 진찰을 받아보시는 것이 중요합니다.\n치료에 관해서는 곤지름이 맞는지 확인한 후에 결정하시면 되는데요.\n곤지름은 육안으로 90%이상 진단이 가능하지만, 10%에서는 다른 질환과 구분이 되지 않아\n조직검사를 통해 확인해야합니다.\n확인 후 곤지름이 맞으면 바로 치료가 가능합니다.\n저희 병의원에서는 곤지름 치료 시에 약물요법은 사용하지 않습니다.\n재발율이 높고, 자주 치료를 받아야하기 때문입니다.\n주로 레이저나 고주파 전기소작술을 이용한 치료를 해드리는데요.\n재발을 해도 한 달 간격으로 2~3회 정도면 대부분 완치될 수 있습니다.\n불편을 줄이기 위해 수면마취가 필요할 수 있으며 마취 수준에 따라 추가비용이 발생할 수 있습니다.\n곤지름 치료 시에 외음부, 질 속, 항문 속까지 모두 진찰해서 발견한 곤지름을\n의사에게 제대로 제거 시술 받아야 재발율과 재치료율이 낮습니다.\n저희 병의원은 질 속과 외음부 항문 속 요도 안쪽까지 모든 부분의 곤지름을 제거할 수 있는 유일한 의료기관입니다.\n일상생활의 불편을 줄이기 위해 곤지름은 재발을 하더라도 보통 한 달에 한번 정도만 진찰을 하고 치료해드리고 있습니다.\n국소마취 시 비용은 8~10만원 정도이고, 수면마취는 10~15만원 정도 추가비용이 있습니다.\n곤지름 진찰 시에는 보통 성병종합검사를 같이 받아야하는데요.\n곤지름 자체가 성병의 일종이라서 감염이 가능한 모든 성병에 관한 검사와 치료가\n반드시 필요합니다.\n비용은 8~13만원 정도입니다.\n병의원마다 검사의 종류가 다양하고 검사해야하는 이유도 다양하지만, 처\n음 진료 받을 때\n제대로 검사 받는 것이 중요합니다.\n이전에 여타 병의원에서 검사받으신 적이 있으시면 결과지를 가지고 오시거나 정확히 결과를 알고 오시면 중복되는 검사는 받지 않으셔도 됩니다.\nHPV에 의한 자궁경부암과 곤지름을 예방하기 위해 곤지름을 경험하신 분들은\n향후 예방을 위해 자궁경부암 백신을 반드시 맞도록 하고 있습니다.\n자궁경부암/곤지름 예방백신에 관해서도 함께 안내를 드리겠습니다.\n백신은 현재 2가지가 나와 있는데요.\n각각 가다실과 가다실 9(nine)이라고 불립니다.\n가다실은 4가 백신으로 자궁경부암과 곤지름 예방을 목적으로 하고,\n가다실 9(nine)는 9가 백신으로 9가지 바이러스 타입에 예방효과가 있어\n가다실 (4가)보다 효과가 좋습니다.\n저희 병의원(서울 강북지역)에서는 보통 20~30대 여성에게는 가다실 9(nine)을 40대 이후에는\n가다실을 주로 추천하고 있습니다.\n가다실이 치료백신은 아니라서 지금 있는 곤지름은 없애주지는 못하지만,\nHPV에 의해 생길 수 있는 더 심각한 질환인 자궁경부암을 비롯한 여성암을 예방해주기 때문에 반드시 필요합니다.\n혹시 수도권에 사시거나 지방에서 사셔서 좀 멀더라도 체계적인 치료를 원하시는 경우\n예약 후 방문주시면 정확한 진찰 후에 속 시원한 상담과 치료를 해드리도록 하겠습니다.\n빨리 완치되시길 바랍니다.']",3,https://kin.naver.com/qna/detail.naver?d1id=7&dirId=7011404&docId=372544782&qb=67Cx7Iug&enc=utf8&section=kin&rank=82&search_sort=3&spq=0,여성질환
10,2020.11.05,[],폰으로 유튜브틀어놓고 컴퓨터 하고있엇는데 폰 스스로 화면캡쳐를 했는데 해킹일까요?,"손도 대지도 않았고 무선충전 거치대에 올려놓고 유튜브를 틀어놓기만 했는데 캡쳐음이들려서 깜짝놀랬네요.
해킹인지 궁금하네요 해킹이라면 확인할수있는방법이 있을까요?","['스마트폰 시스템로그를 볼 수 있다면 간단하겠지만 그건 안되겟지요.. 가까운 수리센터에 방문하셔서 의뢰해보세요~', '안녕하세요? 지식파트너 가비아입니다.\n우선은 캡쳐를 하였다면 갤러리에 캡쳐로 저장이 되어 있는지 확인이 필요합니다.\n또한, 확연한 이상증상이 아니 상태에서 기기에 대한 점검을 할수 있는 방법은 백신 프로그램 밖에는\n있지 않습니다.\n백신 프로그램을 통해서 점검을 하고 기기안에 있는 파일을 확인해야 하지만 기기안의 파일은\n전문가가 아닌 이상 확인이 어렵기 때문에 백신 프로그램에서 검출되지 않고 이상 증상이 지속되어\n발생을 한다면 기기 초기화를 해주는 것이 좋습니다.\n도움이 되었나요? 가비아였습니다.']",2,https://kin.naver.com/qna/detail.naver?d1id=1&dirId=11001&docId=372489916&qb=67Cx7Iug&enc=utf8&section=kin&rank=92&search_sort=3&spq=0,해킹
9,2020.11.05,[],"bcg 주사 4주이내에 맞아야하죠?
31일째 되는 날에 맞으면 안되나요?
선생님들 도와주세요..

백신 효과가 더 높다해서 곧 죽어도 피내용 맞히고싶어 전화하니 그 날짜밖에 안된다해서요 미리예약을 했어야했는데..",,"['저는 어지간하면 접종일에 다맞췄어요... 다른병원가보세요!', '4주이내로 맞는게 좋고 안되면 몇일정도는 괜찮다고하더라구요\n저도 첫째때 보건소에서 피내용 맞추려니 예약이 늦게밖에 안되서 35일차인가에 맞추었어요!', '몇일정도는 괜찮아요\n접종하시면 됩니다']",3,https://kin.naver.com/qna/detail.naver?d1id=7&dirId=70115&docId=372514634&qb=67Cx7Iug&enc=utf8&section=kin&rank=89&search_sort=3&spq=0,소아청소년과
