page,date,tags,questions,questions_add,answers,N_answer,url,category
9,2020.11.09,[],모의해킹 전문가 진로,"안녕하세요 중2 학생입니다. 최근 해킹과 프로그래밍에 관심이 생겨서 공부하다가 모의해킹 전문가란 직업을 알게되었는데 제가 하고싶은 직업 같더라고요.
그래서 어떻게해야 모의해킹 전문가가 될 수 있는지 방법이 궁금합니다 자격증같은거나 전공이요(특성화고는 틀린거같아요) 자세한 답변 주시면 감사하겠습니다!","['자격증보다 우선으로 공부해보셔야하는게, 기본적으로 IT 기초와 프로그래밍 배워보시는게 필요할 것 같아요. \n화이트해커 되고 싶은 중학생들을 위한 Q&A\n안녕하세요! 은챕터입니다. 어제는 화이트해커가 되고 싶은 중3인 학생이 오픈카톡으로 문의를 ...\nblog.naver.com\n지금 중2 학생들 중에 해킹 쪽에 관심 있는 학생들은 어떤 공부를 하고 있는지 아래 오픈채팅으로 카톡 남겨주시면 같이 어떻게 공부 해볼지 계획 세워보아요!\n지금 안 물어보면 까먹을테니 생각날 때 물어보세요!\n#IT #it공부 #IT취업 #인테리어 #인테리어공부 #인테리어취업 #학점은행제 #국비지원 #취준생 #KG아이티뱅크 #KG인테리어뱅크\nopen.kakao.com', '안녕하세요!\n모의해킹 전문가로 진로를 정하셨나요?\n모의해킹 전문가는 기본적으로 언어 + 서버 + 네트워크 그리고 보안 기술까지 아셔야 합니다.\n해킹과 프로그래밍에 관심이 생겨서 공부하셨다고 하셨는데\n어디까지 공부하셨고 어디까지 이해하셨나요?\n모의해킹 전문가가 되기 위해 관련 공부, 관련 학과, 포트폴리오 준비 등 \n자세히 정하신 게 있으신가요?\n더 궁금하신 게 있으시다면 오픈 카톡으로 연락 주세요!\nIT 1:1 무료상담\n#아이티뱅크 #IT #무료상담 #1:1 #앱개발자 #웹개발자 #C언어 #java\nopen.kakao.com', '안녕하세용~\n지식냥이입니당!\n자격증은 공부 충분히하고 응용할 수 있는 단계까지 간 후에\n취득해도 늦지 않습니다.\n오히려 지금 준비해도 생기부에 기재 안되는 경우도 많다고 해서\n기초적인 공부부터 차근차근 하시는걸 추천드리구요.\n전공은 컴퓨터공학과, 소프트웨어학과, 정보보호학과, 정보보안학과 등이 있습니다.\nSW중심대학으로 생각하시면 되겠습니다.\n모의해킹전문가 준비방법에 대해 쓰여있는\n블로그 링크 남겨드릴테니 참고해주세요.\n모의해킹전문가 준비, 어떤 부분을 어떻게 해야 할까?\n안녕하세요.유쌤입니다. 이번 글은 모의해킹전문가가 되기 위해서어떤 준비가 필요한지 알려드리고자 합니...\nblog.naver.com\n기초부터 공부할 수 있고 진학준비를 할 수 있는 IT전문교육기관 링크 남겨드릴테니\n참고해주시구요.\n코딩 과정 교육과정 IT진학코칭학원\nedu3.kgitbankcoding.co.kr\n지금부터 준비하시는걸 추천드립니다.\n이유는 대학 수시전형과 함께 설명드릴께요.\n먼저, 수시전형은 크게 3가지가 있습니다.\n학생부 교과전형\n내신 100%\n학생부 종합전형\n교과 + 비교과 \nSW특기자 전형\n교과 + 비교과 + 추가자료\n교과 = 내신\n비교과 = 출결, 독서활동, 동아리, 봉사, 진로탐색, 교내대회\n추가자료 = 대회참가, 포트폴리오, 박람회/설명회 참가, 자격증(생기부기재 가능한것)\n내신 3등급 중반 정도는 되야 하구요.\nSW특기자 전형을 통해 진학준비를 할 수 있지만\n지금부터 해야하는 가장 큰 이유는 추가자료에 해당하는 부분을\n준비하기 위해서 빠르게 움직여야 하기 때문입니다.\n좀 더 자세히 알아보고 싶으시다면 문의주세요.\nIT 진로와 진학/취업 문의하기!\n안녕하세요 유쌤입니다~ IT 분야의 진로와 관련 전공학과 진학 방법, 관련 분야로의 취업 방법에 대해 궁금한 부분이 있으시면 편하게 문의주세요~!\nnaver.me\nIT분야 취업 진학 문의주세요\n#정보보안#네트워크#소프트웨어#데이터베이스#빅데이터#시스템서버#프로그래밍#해킹#c언어#자바#정보처리기사#웹개발#정보처리#빅데이터분석#학점은행제\nopen.kakao.com', '안녕하세요~\n정보보안 분야 상담을 도와드리고 있습니다\n특성화고는 현재 학생분의 거주지역과 남은기간동안에\n어떤 학교의 학과로 특별전형을 준비할것인지에 따라 달린거라\n아직 포기하기에는 이릅니다\n그리고 특성화고나 일반 인문계중에서도 어느곳으로 진로를 잡고\n가시는지에 따라서도 모의해킹전문가라는 직업군을 하기 위해\n필요한 과정들이 무엇이 있는지와 앞으로의 진학여부도 어디로\n설정할지에 따라 달라지기에 여기에 대한 상담을 먼저 받아보시는게 좋습니다\n아래의 [오픈카톡]을 통해 문의주시면\n학생분의 나이와 공부상황에 맞게 준비과정에 대한\n자세한 상담을 도와 드릴게요^^\n24시간 IT 실시간 상담 전화 02-3675-6855\n#it교육 #코딩 #국비지원 #it취업 #진학 #it자격증 #aws #클라우드 #자바국비지원 #aws국비지원 #정보보안국비지원 #파이썬 #c언어\nopen.kakao.com', '모의해킹전문가 취업, 화이트 해커의 준비과정!!\n안녕하세요~ 아름쌤이에요:)날씨가 쌀쌀해진 탓에 급 몸살이 와서 어제 포스팅을 놓쳤네요 ㅠㅠ여러분들도 ...\nblog.naver.com\n안녕하세요~ 1:1 전문 컨설턴트 아름쌤입니다:)\n글만 봐서는 정확한 정보를 알 수 없어 확실한 답변드리지 못하는 점 양해부탁드립니다.\n자격증에는 정보처리기사/산업기사/기능사, 정보보안기사/산업기사, 네트워크관리사, 리눅스마스터 등이 \n있습니다. 진로 방향, 질문자님의 상황에 따라 정해서 들어가시면 될것 같아요.\n현실적으로만 답변드리겠습니다.\nIT 시장이 전망도 좋고 활발해진것은 맞습니다.\n하지만 전망 좋다고 인터넷에 나와서 또는 그런 말들이 많이 나와서 이러한 마음으로 시작하시는거면 비추천입니다.\n왜냐하면 IT 공부 자체는 쉬운 공부가 아니기 때문에\n한번 해보자라는 마음으로 들어왔다가 중도 포기하시는분들이 한두명이 아닙니다.\n제가 말씀드리는건 제대로 된 의지 가지고 해도 될까 말까 한다고 말씀드리는겁니다.\nIT 국비지원 받으면 전액 다 받을 수 있다는 장점이 있습니다.\n하지만 국비지원을 지원해주는 이유도 취업 목적으로 하는 전공자를 위한 지원으로 \n국비지원만 들으시면 아마 1~2개월 안에 책 덮어버릴겁니다.\n왜? \n전공자들이 듣는 수업을 비전공자가 바로 알아듣는게 더 이상하다고 봅니다.\n그렇기 때문에 프로그래밍 기초 언어부터 먼저 들으시고 국비 들어가시는걸 추천드립니다.\n또한 독학을 하시는 것도 안됩니다.\n시간 버리는 일입니다.\nIT에는 다양한 직업들로 이루어져 있습니다.\n질문자님께서는 그 직업들이 뭐가 있고 어떠한 일을 하는 사람인지 정확히 아시나요?\n최소한 내가 앞으로 하는 일에 대해서는 정확히 알아야하는게 당연한겁니다. \n아 그냥 학교가서 알지뭐 , 학원가서 배워보면 알겠지뭐 이런 생각!!\n대충 인터넷 검색해서 나오는 직업 정의들만 보고 아 재밌겠네~ 하면서 시작하시는 분들 수도 없이 많이 봐왔지만 오래 못갑니다.\n교육기관 먼저 방문한다음 많은 IT직업들의 직무파악을 정확히하고 세부 진로들을 정하며 질문자님 상황에 맞는 커리큘럼부터 알아봐야 합니다.\n이게 질문자님께서 우선해야 할 일 입니다.\n다시 정리해 말씀드리면 국비지원 받으러 고용센터를 가기전에 전문 교육기관부터 방문해서 진단을 받는게 우선이라고 말씀드리는겁니다.\nIT는 고졸, 비전공자도 교육기관에서 열심히 하면 취업 가능합니다.\n정말 이 IT분야에 대해 정확히 알고 싶고 배울 의지 있으신분들만 번거로우시겠지만 카톡으로 연락주시길 바랍니다.\n공부할 의지 가지고 연락주시는분들 마다 하지 않습니다.\n아래 링크로 연락주시면 성심성의껏 답변도와드리겠습니다.\nIT분야 취업및상담\n#IT#국비지원#진학상담#sw특기자전형#진로상담#취업상담\nopen.kakao.com', '정보보안전문가(화이트해커)에 대해서 자세히 알려드리겠습니다\n 4차산업을 맞아 기술이 발전하며 점점 더 편리한 삶을 살고 있습니다\n하지만 그에 따라 해킹에 대한 우려는 더욱 높아지고 있죠\n악의적인 목적으로 해킹을 하는 개인, 집단에 맞서는 직업이 정보보안전문가입니다\n (카카오뱅크같은 인터넷 전문 은행이 나오고,\n테슬라같은 자율주행자동차로 인해 삶이 편해지고 있지만\n그만큼 해킹의 위험은 커지고 있습니다\n  예전에는 해킹으로 인한 피해라고 하면\n게임아이디나 아이템, 혹은 계좌해킹으로 인한 금전적인 피해였다면\n요즘엔 각종 기기등과 프로그래밍이 융합하며\n생명에까지도 직접적인 피해를 줄수가 있게된 셈이죠)\n 높은 연봉과 사회의식, 또한 인력수요가 늘고 있어\n전망과 비전이 좋은 매력적인 직업입니다\n   정보보안 전문가 종류\n (정보보안전문가는 하나의 직업이 아니라 여러개의 직업을 포함하는 직업군입니다)\n 모의해킹 전문가\n- 사이트나 시스템을 모의로 해킹함으로써 취약루트를 파악, 대응방안을 제시해줍니다\n보통 시스템이나 네트워크, 웹루트를 통해 실제 해킹기술을 시연해야 하므로\n시스템이나 네트워크, 웹과 프로그램등 다양한 루트와 방법을 알고 있어야 합니다\n 보안솔루션 전문가\n- 분석된 취약루트에 대해 솔루션장비 및 인프라 구축, 유지를 합니다\n업무특성상 보안솔루션장비와 네트워크장비를 많이 다루게 되므로\n각종스펙보다는 다양한 장비에 대한 이해, 실무적인 부분이 중요합니다\n악성코드분석 전문가\n- 악성코드를 분석하여 치료 방법을 엔진에 적용합니다 (백신개발)\n악성코드를 분석하기 위한 리버싱기술과 탐지 및 치료 모듈을 개발합니다\n해킹기술은 물론 프로그래밍에 대한 깊은 이해가 요구됩니다\n 침해대응, 보안관제 전문가\n- 해커가 시스템에 침투하면 역추적하여 범인을 찾아냅니다\n또한 실시간 모니터링을 통해 들어오는 해킹을 감시, 대응합니다\n실시간감시가 모토기 때문에 보통 교대로 24시간 대비를 합니다\n네트워크 패킷분석을 위한 7계층구조이해, OS명령어와 활용능력이 요구됩니다\n 보안 컨설턴트\n- 정보보호 수준과 취약점을 분석하고, 고객의 요구수준에 맞춰 시스템을 구축합니다\n기업의 리스크를 최소화하기 위해 위험요소를 분석, 이에따른 대응방안을 제시합니다\n모의해킹전문가와 마찬가지로 각종해킹기법에 대한 이해가 요구됩니다\n 포렌식 수사관\n- 해킹범죄 발생시 범인을 쫓는 과학수사관입니다\n디지털 자료를 법적 증거자료로 만들어 제출합니다\n보통 공무원으로 근무하며 검찰, 경찰청이나 국방부산하에서 근무한다고 보면됩니다\n삭제되거나 파손된 자료를 복구해야 하므로 복원작업에 대한 능력이 요구됩니다\n또한 증거자료를 구분할 보안법에 대한 지식도 있어야 합니다\n정보보안 전문가 자격증\n 정보보안전문가\n정보보안기사/산업기사, CISA, CISSP\n 시스템서버\n리눅스마스터, LPIC, MCITP, MCSE\n 네트워크\n네트워크관리사, CCNA, CCNP, CCIE\n 데이터베이스\nOCA, OCP, OCM\n 프로그래밍\n정보처리기사/산업기사, OCJP, OCWCD, OCJD\n  위 자격증을 전부 취득해야 하는 것은 아닙니다\n내 목적에 맞춰 (진학 or 취업등)\n필요한 자격증만 순서에 맞춰서 취득해 나가면 됩니다\n   정보보안 전문가 공부\n 정보보안전문가가 되기위해서는\n프로그래밍, 네트워크, 서버시스템에 대한 공부가 선행이 되어야 합니다\n위 과정이 선행이 된후 해킹보안에 대한 교육을 배울수 있습니다\n 왜냐하면 악성코드 분석을 할 때\n프로그래밍 쿼리에 대해 어떤 구조와 이론을 사용했는지\n그를 통해 어떤 결과를 만들어내는지 예측해야 합니다\nC로 만들어진프로그램이라면 C를 알고 있어야 하고\nJAVA나 파이썬으로 만들어졌다면 JAVA와 파이썬을 알고 있어야 하죠\n따라서 많은 언어를 구사할줄 안다면 더욱 유리합니다\n 해킹에 대비할 프로그램을 개발하려면\n프로그래밍에 대한 창의적인 생각과 분석이 필요한데\n이미 나와있는 책을 통한 주입식공부가 아닌\n실제 전문가들의 노하우가 깃들어 있는\n다양한 케이스별 실무중심교육이 좋습니다\n 네트워크 쪽은 대표적인 해킹의 침투 경로로써\n네트워크의 물리적인 구성환경을 정확하게 이해하고 파악해서\n각종 공격을 미연에 방지하고 대처할수 있습니다\n기초 패킷분석과 더불어 경로에 대한 실전 공부를 하기 위해서는\n각종 네트워크 장비에 대한 공부를 해둬야 하는데\n이또한 책을 통해서 보는 공부로는 한계가 있습니다\n실제 네트워크 장비운용을 통한 실무중심적 교육을 통해 실력을 쌓길 추천드립니다\n 운영체제 시스템의 CPU, 메모리 구조분석, 어셈블리어 활용등의 내용을 통해\n실무에서 일어날 수 있는 해킹 기법 분석 능력을 향상시켜야 하기 때문에\n운영체제 공부 또한 필수입니다\n많이 들어보셨을 DDOS해킹법 또한 서버시스템해킹의 종류입니다\n 프로그래밍 – 악성코드분석, 리버싱, 웹 어플리케이션 해킹\n네트워크 – 네트워크해킹\n서버시스템 – 시스템해킹\n 이렇게 연계되는 과목이라고 생각하시면 됩니다\n    마지막으로 독학을 하는 것도 좋은 방법이지만\n이미 학교에서 배워봤던 전공자들에게 적합한 방법이라고 볼수 있습니다.\n전공자들도 최소 한학기 이상 배우는 심화과정이기 때문입니다.\n 만약 전공자가 아니고 처음 배우는 입장이라면\n독학을 하기전 최소한 전문학원에서는 어떤 교재로,\n그리고 어떤 순서로 공부를 하는게 좋은지 정도라도 알고 진행하는게 좋습니다.\n   상담문의\n진로설정에 대한 불안감이 있거나\n정확한 준비방법에 대해 더 궁금하신 점 있으시면\n아래 톡으로 상담신청을 통해 문의주시면\n객관적인 자료를 통해 성심성의껏 상담을 도와드리도록 하겠습니다\nhttps://open.kakao.com/o/sIQvmT4', '안녕하세요! 질문 남겨주셔서 답변드립니다!!\n우선 모의해킹 관련한 제 블로그 하나 남겨드리겠습니다! \n한번 읽어보시면 좋을 거 같아요!\nhttps://blog.naver.com/hjchoi1500/222102945524\n모의해킹 전문가에 대해서\n안녕하세요. 소나입니다.벌써 내일이 추석 시작이네요. 이렇게 보니이번 연도도 거의 마지막을 향해서 가...\nblog.naver.com\n그리고 진로에 대해 정말 생각이 있다고 하신다면\n전문적인 상담을 받으시는 것이 좋습니다\n지금 현재 어떤 것이 부족하고 어떻게 준비를 해야하는지 \n또한 앞으로는 어떻게 해야하는지를 상담을 하면서 \n앞으로의 방향성 설정할 수 있는겁니다.\nIT분야로 관심 있거나\n진로,진학,자격증 준비, 취업, 학점은행제 에대해서\n1대1 전문 맞춤 컨설팅을 무료로 진행하고 있습니다.\n아래 링크 클릭하셔서 문의주시면 질문자님 상황에 맞추어서\n자세하게 안내해드리도록 하겠습니다.\nhttp://naver.me/F2rbw6Q0\n♧ IT 무료 컨설팅 문의\nIT 분야로 진로/ 진학, 취업 이나 자격증에 관해서 궁금하신 부분들 편하게 문의 주시면 됩니다. 간단한 정보와 관심사, 실력 ,궁금하신 부분들을 적어주세요!\nnaver.me', '안녕하세요.\nIT 전문 컨설턴트 찬주쌤이에요.\n질문하신 내용으로는 질문자님에 상황& 정보를 정확히 알 수 없어서 정확한 정보를 \n알려드리지 못하는 점 양해 부탁드립니다.\n질문자님께서 모의해킹 전문가에 관심이 있으신가 보네요.\n모의해킹 전문가란 기업의 의뢰를 받아서 웹, 앱, 시스템 등을 실제 해커가 하는 것처럼 \n모의해킹을 통해 취약점을 찾아 분석하고 보안하는 일을 합니다.\n모의해킹 전문가 되기 위해서 배워야 하는 것은 네트워크, 서버, 프로그래밍, 데이터베이스, \n보안 기술 등을 IT 분야의 전반적인 지식이 필요한 분야입니다.\n필요한 자격증은 정보 보안산업기사, 정보보안기사, 네트워크 관리사, 리눅스 마스터 \n등이 있습니다.\n지금 질문자님께서 공부를 하고 있다고 하셨는데요.\n어떤 공부를 하신 건가요?\n모의해킹 전문가는 위에 말씀드린 것들을 배워야 하기 때문에 질문자님 상황& 목적에 맞는 \n커리큘럼을 짜서, 체계적이고 효율성 있게 공부를 해야 하는 분야입니다.\n그러니 IT 전문교육기관 상담을 받아보시는 것을 추천드립니다.\nIT 관련 진학& 취업& 포트폴리오 등 궁금하신 게 있으시면 1:1상담문의하세요.\n자세히 알려드리겠습니다.\nIT분야 취업및 진로 1:1 상담\n#IT#국비지원#진학상담#SW특기자전용#진로상담#취업상담\nopen.kakao.com']",8,https://kin.naver.com/qna/detail.naver?d1id=1&dirId=11001&docId=372795029&qb=67Cx7Iug&enc=utf8&section=kin&rank=85&search_sort=3&spq=0,해킹
9,2020.11.09,[],코로나 백신에 대한 제약회사들의 연구의 정부 도움,코로나 백신을 제약회사들이 개발할때 과연 정부가 그 연구를 도와야 한다고 생각하는지 찬성과 반대중 하나만 골라서 알려주세요. 내공 다 드립니다,"['당연히, 도와줄 부분이 있으면 도와서 - 조금이라도 백신이 빨리 개발/생산 되는데 힘을 보태야죠.']",1,https://kin.naver.com/qna/detail.naver?d1id=6&dirId=61401&docId=372794325&qb=67Cx7Iug&enc=utf8&section=kin&rank=86&search_sort=3&spq=0,정부기관
9,2020.11.09,[],자궁경부암 3차,"안녕하세요 저는 13살 여학생입니다
제가 자궁경부암을 2차까지 맞았는데
3차도 있나요?","['아니오', '이게 접종 주사마다 다른데\n기본으로 2~3회라 안내문엔 안내됩니다.\n<자궁경부암 예방접종> 무료대상, 가격, 부작용, 남자, 시기 등 (총정리)\n자궁경부암 총정리 자궁경부암 대상자 확인 _ 자궁경부암 이란? 자궁경부암은 한국인이 가장 많이 걸리는 5대 암 중 하나 입니다. 건강보험심사평가원에 따르면 국내에서 자궁경부암으로 병원을 찾은 환자는 점차..\ndingdo.tistory.com\n위는 자궁경부암 예방접종\n(무료대상, 비용, 시기, 백신종류, 맞아야하는 이유 등 안내)\n= 남자도 맞아야 하나?']",2,https://kin.naver.com/qna/detail.naver?d1id=7&dirId=7011404&docId=372794015&qb=67Cx7Iug&enc=utf8&section=kin&rank=87&search_sort=3&spq=0,여성질환
7,2020.11.09,[],조 바이든 대통령,바이든 대통령께서 당선이되셨는데 우리나라에게 좋은점은 무엇이있을까요. 예를들면 국방비절감 북한과의관계 수출문제 등등. 답변부탁드리겠습니다.,"['GDP상승', '바이든저는 그사람 싫어합니다\n일루미마티고(악마 숭배 하는 사람)\n트럼프는 코로나 백신이 있어 트럼프가 되야\n코로나가  끝나는데\n선거 결과긴 좋지 안네요\n바이든 되도 우리나라 이익되는거 하나도 없음\n바이든 환경 하는데 그거 수입 안할려고 그런거임', 'https://blog.naver.com/okiii1205/222139412558\n바이든이 당선되면 달라질 정책들\n바이든 확정이 유력바이든 후보는 개표가 진행 중인 조지아와 애리조나 주를 제외하고도 279명으로 과반...\nblog.naver.com\n참고하세요', '바이든 미국대통령당선자는 우리나라를 대할 때  동맹관계로 파트너쉽으로 대 할려고 하지요.']",4,https://kin.naver.com/qna/detail.naver?d1id=6&dirId=60601&docId=372806525&qb=67Cx7Iug&enc=utf8&section=kin&rank=70&search_sort=3&spq=0,남북관계
