page,date,tags,questions,questions_add,answers,N_answer,url,category
14,2021.02.07,[],주식 질문이요,"날마다 메인이 되는 주가 있는거같은데.
예를들어 어떤날은 제지, 어떤날은 화장품, 어떤날은 반도체
이런걸 장 열리기 전에 어디서 보고 파악을 하나요.","['질문자님 안녕하세요?\n작성하신 내용을 살펴보았는데요.\n주식 초보분들의 경우\n이런저런 정보들을 많이 보면\n더욱 혼란스러울수있어요 \n현제 상황에서는 지식인을 통해\n고민을 해결하려고 하시기 보다는\n전문가와 무료 상담을 통해 \n현재의 고민을 명확하고 빠르게\n해결하시는게 좋으실것 같습니다.\n- 4년연속 자동매매프로그램 1위!\n- 소비자만족 1위 검증!\n- 매일 꾸준히 3% 수익!\n- 실제 수익 후기 확인!\n- 무료로 프로그램 설명!\n무료상담 :http://asq.kr/2Jv9ApxUZOzi\n저의 답변의 내용이 도움이 되셨길 바라며\n좋은 결과로 이뤄지길 바라겠습니다.\n감사합니다!', '요즘같은시기에는 목돈만들기 또는\n재테크가 더욱더 절실해지는데요!\n질문하신 내용 잘 살펴보았습니다.\n주식에 대해 자세한 내용이 궁금하시군요.\n주식에 대한 정보가\n 필요하시다면 참고하시기 바랍니다.\n혼자서 주식을 처음시작하시거나\n주변사람들 말만듣고 시작하시기에는\n너무나 위험부담이 클수도 있는데요!\n매일 고급 주식정보 컨텐츠를 업로드하여\n정보를 나눌수 있으며 \n남녀노소 연세가 있으셔도 사용하기 쉬운\n주식좀 한다는 사람들의 대세라고 하더라구요.\n심리적인 스트레스와 부담감 없이\n주식을 할수 있다고 하니 현 상황은 지식인이 \n아닌 무료상담을 통해서 고민을 해소시키는 것도\n좋으실듯 합니다.\n- 부담감 스트레스 없이\n- 차곡차곡 안전하게 \n- 주식초보도 가능\n- 남녀노소 연세가 있으셔도 손쉽게 사용\n- 누구보다 빠르고 안전하게 매수와 매도까지\n- 손실은 최소화\n무료상담 ▶ http://asq.kr/9S9lBrfZVJuHLN\n무분별한 정보로 투자하여 후회하지 마시고\n보다 실속있고 꼼꼼하게 목돈만들기의 꿈을 실현하시길 \n바랍니다.. 감사합니다. ^^', '작성자님 안녕하세요:)\n요즘 같은 시기에 주식 안하면 손해!!\n간단하게 영상 보고 오늘부터 나도 주식하자!\nhttps://jamongpick.com/31/11644\n*이 글은 소정의 광고료를 받고 작성되었습니다*', '주도주 섹터를 이야기 하는거 같습니다. 산업군별로 집중을 받았다가 또다른 산업군으로 넘어가는게 요즘 트렌드입니다. 단순히 어디에 나온건 없지만 HTS에서 업종별 추세전환정도는 파악이 되지만 결국 앞으로 어떤 이슈가 생길건지에대한 이해가 필요합니다. 지금은 특별한 시장이라 단정짖기는 힘들지만 제지야 설날이 다가오니 택배수요가 늘어난다는 단순한 이유로 상승한거고 앞으로 백신을 맞으니 여행주, 항공주가 오를수 있겠죠.. 여름이 다가오면 제습기나 여름관려주가 또 집중을 받을거구요. 결론은 현재 관심 받지 못하는 바닥에서의 저평가 구간의 종목을 미리 사놓고 준비하면 되는겁니다. 현구간 저평가 앞으로 오를종목들에 대하여 집중 점검하고 소개해 드리고 있으니 참조 바랍니다~\nhttps://www.youtube.com/channel/UCScaLQV_F4qbq-FyybAHJOg/featured\n주식차트대장\n주요 기법 기반으로 차트분석을 통한 세력주,매집주 선취매로 안정적 수익 창출 - 매집 2~3종목 - 단기매매 섹터별 3~4종목 선순환 - 당일단타(필요시) 차트가 뉴스와 공시를 예견합니다!\nwww.youtube.com', '저도 나름 공부하고 주식을 시작했는데\n생각처럼 잘 되질 않아 고민을 많이 했어요\n그러던 중 회사 동료한테 자동프로그램 얘길 들었어요.\n수익률이 90% 이상으로 높은데 \n내가 할 일은 잘 돌아가나 하고 \n확인만해주면 되더라구요.\n종일 컴퓨터 앞에 앉아 있지 않아도 \n프로그램이 매수 매도 다 알아서 해주니 편해요.\n제 머리보다는 주식자동매매프로그램이 낫더라구요.\n무료 설명 들을 수 있으니 설명 들으면 도움될거예요.\nhttps://bit.ly/3ak3zLQ', ""저도 주식 정말 1도 모르고 시작한 왕초보인데요,\n나중에 알고보니, 주식은 초보가 벌 수 있는 구조가 아니에요.\n주변에서 주식으로 돈 좀 벌었다 하는 분들은,\n정말 전문가 아니고는, 프로그램을 쓴다고 하더라구요.\n저도 그래서 얼마전에, AI가 알아서 사고, 팔아주는 \n주식자동매매프로그램으로 갈아탔는데,\n인간의 머리하고는 비교가 안되더라구요.\n하루 종일 컴퓨터 쳐다보고 그럴 필요도 없고,\n제 생각보다 AI가 훨씬 더 빅데이터를 분석해서\n팔 때 팔고, 살때 사니까,\n제가 할 일은 가끔 얘가 잘 움직이나 쳐다보는 정도에요.\n주식 책을 읽어봤더니,초보들이 주식하고 망하는 이유가,\n주식을 모르면서 사고, 자기 '감'만 믿고 팔아서라는데,\n주식초보라면 사람보다 훨씬 더 잘하는\nAI에 맡기시라고 조언드리고 싶네요.\n암튼 여기 들어가보면 더 자세히 써있어요.\nhttps://bit.ly/3p2gdVJ"", '한국경제tv(8:30~9:30) 채널 찾아서 들어보세요\n지역마다 채널이 달라서..\n그리고 주식투자에는 여러 방법이 있는데요~\n혼자 공부하기엔 범위도 넓고 너무 어려운 주식..;;\n주식초보도 수익낼 수 있는 방법 공유해 볼게요\n무슨 일이든 아는만큼 보이는 법이니 이 방법 저방법 알아보시고 \n질문자님께 맞는 방법을 택하시면 도움이 많이 되실거예요~\n주식은 정확한 정보와 매수매도 타이밍이 수익이냐 손실이냐를 결정짓는데\n그게,,쉽지만은 않으니 주식으로 망한 사람들이 더 많은거겠죠? ㅠ\n그런데 주식투자..요즘은 그렇게 어렵고 복잡하고 힘들게 하지 않아도 되더라구요\n저도 수업료 비싸게 주고 배웠다죠 ㅠ\n그렇게 호되게 당하고는 오토핫키라는 주식자동매매프로그램으로 돌리는데요~\n이게 꽤 수익률이 좋더라구요\n먼저 상담을 받아 보시는게 어떨까 싶어요~\n주식자동프로그램 오토핫키는 92% 이상의 적중률을 가지고 있구요\n알고니즘이 데이터를 분석해서 스스로 종목을 찾고 3분도 안되는 시간 동안\n매수! 매도!~끝!!~\n하루 종일 신경 쓰고, 컴퓨터와 핸드폰만 쳐다보면서 힘들게 관리했던 내 주식!\n자동으로 알아서 척척해주니 신경 쓸 일도 없고\n마이너스 칠 염려가 없더라구요~\n저도 덕분에 수익을 올리고 있어서 요즘엔 살 것 같아요 ^^;;;\n남편 몰래 한 주식 종잣돈 까먹고ㅜ그때 생각하면 지금도 끔찍한데요..;;;\n오토핫키는 4년 연속 소비자 만족지수 1위, 소비자감동지수 1위를 \n수상했다고 해서 더욱 믿음이 가더라구요\n제가 이용하는 사이트 주소 남길게요~\n무료상담이니 오토핫키 주식자동프로그램 전문가와 상담받아 보세요\n부담없이 이것저것 물어보시다 보면 \n주식에 대한 정보도 많이 알게 되어 도움이 되더라구요~\n https://bit.ly/37k3OWD', '휴대폰 플레이스토어나 애플스토어 pi network. 무료채굴\n가상화폐\n☆ 가입완료후. 파이에보면 유저들 채팅창에보시면 한국유저 까페에서 채굴속도 올리는 방패생성.휴대폰인증하기(지갑생성.KYC인증시 본인코인소유 인정되기위해필요함) 등..  정보를 쉽게알려줍니다\n파이pi코인(네트워크).시작하기 전에 가장 궁금해 하는 사항들에 대해 알아볼께요.\n1. 스마트폰 배터리 소모가 있거나, 성능이 떨어지지는 않나요?\n→ 베터리 소모가 없으며, 성능이 전혀 떨어지지 않습니다.\n2. 어플을 계속 켜두어야 하는 건가요?\n→ 24시간에 한번 클릭만하면 채굴이 됩니다.\n24시간에 한번 클릭은 사람이 운영하는 것인지를 체크하기 위함이라고 합니다.\n3. \n이제부터.파이코인 설치 및 가입방법에 대해서 설명하겠습니다.\n파이코인. 추천인이 필수이며, 추천인(seng6262) 코드 입력시 1코인을 받을 수 있습니다.. \n1. 앱스토어에서 파이코인(세계최초)설치하기\n2. 휴대폰 인증하기\n페이스북 인증도 가능하나, 저는 휴대폰 번호 인증으로 해서 휴대폰 번호 인증으로 설명드립니다.\n한국의 경우 82로 시작하며 처음 010에 0을 빼고 10xxxxxxxx로 기입하고 GO를 누르시면 됩니다.\n3.비밀번호생성 4 계정 설정하기(이름)\n향후에 소유권을 주장하려면 이름을 작성해야 하는데 여권의 영문과 동일하게 대문자로작성\n5.Username은 본인이 사용할 아이디입니다\n4. 추천인 입력\n추천인 코드에 ※ (seng6262) 입력하시면1코인과함께 25%채굴속도 업됩니다. 1년이면 방패적용시 속도2배가되어 2100개. 상장이되겠어하시는분은 올해 개인간코인이 옮겨지는 지갑이생성된다하니 그때. 개당150원에 매입하겠습니다. 가치가없을때 미래를보고 투자해볼려합니다. 2000개면 30만원. 저에게 파실분은 앱설치후 미리 seng626262 친추하고 톡주세요. 방패만들어드림 선착순20명.', '안녕하세요 질문자님!\n질문하신 내용 살펴보았는데요\n 요즘 많은분들이 주식에 관심을 갖고 \n어떤식으로 해야하는지 \n알아보시는 분들이 많으시더라구요\n 특히기존에 주식을 하시는 분들도\n어떤 종목이 수익률이 좋을지 몰라서\n신중하게 고민을 하시는데요!\n 주식을 할때 스마트 알고리즘을 통해서\n충족되는 종목만 자동으로 매수해주고\n수익분기점에서 자동으로 매도까지 해주는\n프로그램이 있어요 ^^\n 많은분들이 이용하고 있고\n유투브에서도 구독자가 1K를 돌파한 곳이에요\n꾸준하게 주식정보 컨텐츠를 제공하고 있다보니\n주식을 처음하시는분들도 기존 주식을 하시는분들도\n두루두루 도움을 받으시고 있는 곳이에요\n 높은 수익 적중률 92% 돌파했구요^^\n 스스로 종목을 찾아서 3분도 안되는 \n시간에 매수 매도를 하고 있고\n실시간으로 진행상황을 확인하실 수 있어요\n특허출원을 받은 믿을 수 있는 곳이구요\n한국소비자감동지수1위 수상한 곳이예요\n무료상담이 가능하시니 한번 알아보시면\n주식하시는데 큰 도움이 되실꺼에요 ^^\n▼ 자동매매프로그램 무료상담 \nhttps://bit.ly/3pwVSIc\n주식몰 오토핫키\n넌 아직도 손으로 주식하니? 난 켜고 끄고만 해서 벌고 있어! ※ 실계좌를 통해 오로지 오토핫키로만 만들어낸 결과를 소개합니다 10월 HTS 11월 HTS 12월 HTS 10~12월 HTS 2020년 4사분기 오토핫키 스윙투자 매매 결과!! 투자원금 대비 17.34% 수익!! 투자원금 이체내역 이제는 더이상 힘들게 스트레스 받지 말고 ""매일매일"" 연금처럼 ""차곡차곡"" 안전하게 돈을 벌어보자!! 지금 신청하시면 오토핫키 설명을 무료로 친절히 해드리겠습니다. 개인정보취급방침 동의 (필수) [약관보기] 마케팅 수신 동의 (필수) ""모두가...\nbit.ly']",9,https://kin.naver.com/qna/detail.naver?d1id=4&dirId=40102&docId=381262688&qb=67Cx7Iug&enc=utf8&section=kin&rank=131&search_sort=3&spq=0,"주식, 증권"
14,2021.02.07,"['강아지', '강아지백신', '강아지코로나', '새끼강아지', '말티푸', '빠른답변부탁드립니다', '빨리해주세요', '빨리답변해주세요현기증난단말이에요', '최대한빠른답변부탁드려요', '최대한빠른답변부탁드립니다ㅠㅠ', '#하트독']",70일된 말티푸 백신주사,"안녕하세요 70일정도 된 말티푸를 키우고 있는데요
애기가 570g이고 몸도 작아요
근데 내일 코로나백신과 2차접종을 같이 맞기로했는데
같이 맞아도 되는건가요 ???
애기가 쇼크 같은게 오진 않겠죠 ?? 작은강아지들은 쇼크가 잘 온다고 해서 걱정이돼서요 ㅜㅜ","[' 수의사 선생님께 문의하시는 게 제일 좋아요. 대부분 주사 맞기 전 기본적인 상태(맥박, 몸무게, 치아, 등등등) 확인하고 이상 없다고 판단하실 때 접종해 주셔요. 수의사 선생님 말씀 들으면 괜찮을 거에요', ""동물병원 의사쌤이 잘 접종해 주실거에요. \n너무 걱정되시면, 의사쌤에게 아이가 너무 작아서 걱정되어요. 말씀하시면 좀 더 상세히 보시고 안내 주실거에요. \n생각보다 어린 강아지들은 전염병 때문에 많이 병이 들어요. 그래서 아이가 주사를 맞을 수 없는 상황이 아니면 예방접종 하는 것이 좋습니다. \n작은 아이일수록 예방접종, 구충약 잘 먹이고 챙겨주세요. \n그리고 보니까 작은 아이들이 토도 많이하고 예방접종하고 나면 설사끼도 있고 하더라고요. 이럴 때는 몸상태 안떨어지도록 습식사료도 섞어주면서 아이가 잘 먹게 도와주세요. \n저도 아이키우면서 자주 사용하는 앱이 있습니다. 요즘 추천을 많이 드리게 되네요. 한 번 사용해 보세요. 견주님들이 의견을 잘 달아줘서 도움이 되어요. \nhttps://msbg.page.link/64mX\n멍생보감 - 내 강아지의 견종, 나이, 체질을 고려한 맞춤사료 추천 - Apps on Google Play\n■ 빅데이터 기반 '멍생보감'에서 내 반려견에게 꼭 맞는 사료를 추천받아 보세요. '멍생보감'은 유저들이 온라인에 남긴 후기 87만개 이상을 직접 분석해 반려견의 견종, 성별, 나이 및 건강상태에 맞추어 적합한 사료를 추천해 드리는 어플입니다. '멍생보감'에서 내 반려견에게 안전한 사료, 질병에 좋은 사료, 가성비가 좋은 사료들을 만나보세요. ■ 내 반려견과의 추억들을 일기장에 남기고 친구들에게도 공유해 보세요. 댕댕이와 함께한 소중한 순간들과 아름다운 이야기들을 멍생일기로 남겨보세요. 반려캠핑 일기, 간식일기, 투병 일기 등 개성...\nmsbg.page.link"", '안녕하세요. \n천만 반려인과 함께하는 애견 동반 여행 플랫폼 하트독 입니다.\n예방접종은 반려견과 보호자 모두를 위해서 꼭 하셔야 합니다\n예방접종은 생후 6주 이후 시작하며 2주정도의 간격으로 진행됩니다.\n1차접종 : 종합백신 + 코로나장염\n2차접종 : 종합백신 + 코로나장염\n3차접종 : 종합백신 + 켄넬코프\n4차접종 : 종합백신 + 켄넬코프\n5차접종 : 종합백신 + 광견병 \n1개월 마다 : 심장사상충, 외부기생충 약 복용\n※프로하트 주사의 경우 1년에 1회 주사\n12개월 마다 : 종합백신 접종, 광견병 접종\n위와 같은 순서대로 예방접종을 진행하시면 됩니다.\n답변이 도움이 되셨다면 채택도 부탁드립니다.']",3,https://kin.naver.com/qna/detail.naver?d1id=8&dirId=8050104&docId=381262293&qb=67Cx7Iug&enc=utf8&section=kin&rank=132&search_sort=3&spq=0,"훈련, 배변"
13,2021.02.07,"['노트북', '해킹의심', '해킹당한건가요', '해킹당했어요', '해킹피해']",노트북 해킹인가요,"컴퓨터 해킹 당한 것 같습니다
안녕하세요 부모님한테 선물받은 노트북이 해킹 당한 것 같습니다 제가 컴퓨터로는 야동본적 몇 번 밖에 없고 노래 다운받은 것 말고는 해킹 당할 요소가 없는 것 같은데 해킹인가요
 몇개월 전부터 하루에 한 번 꼴로 컴퓨터를 켜면 자동으로 크롬에 들어가 이상한 게임 사이트에 접속하게됩니다 
저 15살이고 절대로 부모님께 제가 귀중한 컴퓨터를 이렇게 만든 사실을 알리고 싶지 않는데 어떻게 하는게 좋을까요 해킹이라면 대처하는 방법 좀 알려주세요 제발 저를 살려주세요 부탁드려요","['사진을 보면 아마도 자동으로 저 사이트가 켜지는거 같습니다\n그냥 멀웨어같습니다 포맷하시거나 어베스트 백신같은거 돌려보세요\n+크롬을 켰을때만 저런 사이트가 뜨신다면 어베스트 시큐어리티 브라우저로 접속하시면 뜨지 않습니다\nhttps://www.avast.com/ko-kr/secure-browser#pc\n추적을 차단하는 개인 브라우저 | Avast Secure Browser\n""모두 허용""을 클릭하면 사이트 탐색 환경을 향상하고 사이트 성능 및 사용을 분석하며 Avast의 마케팅 활동을 지원하기 위해 귀하의 디바이스에서 쿠키를 사용하는 데 동의하는 것입니다. 쿠키 설정은 아래에서 관리할 수 있습니다. ""확인""을 클릭하면 현재 설정에 동의하는 것입니다. 쿠키 정책을 참조하십시오 모두 허용 관리 Avast Secure Browser 속도가 4배 빠른 개인 브라우저 지금 다운로드 Mac , Android 및 iOS 에서도 사용할 수 있습니다. NEW 속도 광고 없이 빠르게 검색 Avast Secure Brow...\nwww.avast.com']",1,https://kin.naver.com/qna/detail.naver?d1id=1&dirId=11001&docId=381271804&qb=67Cx7Iug&enc=utf8&section=kin&rank=121&search_sort=3&spq=0,해킹
14,2021.02.07,"['곤지름치료', '곤지름치료비용']",곤지름 치료비용,"곤지름 치료할때 성병검사 꼭하고 치료해야되나요??
곤지름크기가 점점 커지기도 하나요..?","['곤지름은 흔히 성병이라고 말하는 사람들이 많지만, 기타 직 간접적인 피부 접촉을 통해서 바이러스에 감염되기도 합니다. \n.그래서 바이러스 감염을 막기 위한 개인 면역 관리가 매우 중요한 질환으로, 꾸준하게 면역 관리를 위한 노력을 해야합니다. \n남성 곤지름 은 성기 및 인접부위, 항문 부위에 주로 발생하고, 여성 곤지름 은 대음순 및 항문 부위에 주로 발생하지만 바이러스 감염 세포와 증식에 따라서 생식기 및 요도 안에도 발생할 수 있습니다 \n일반적으로 곤지름 증상을 겪는 대부분의 사람들은 본인이 곤지름에 걸린 것을 수치스럽게 생각하지만, 곤지름은 지극히 일상적인 수준의 접촉들이나 행동들, 물건, 장소 등 직접적이지 않더라도 HPV에 감염될 수 있습니다. \nHPV는 전염이 유독 잘되기 때문에 곤지름 병변의 단순한 접촉만으로도 전염이 쉽게 발생할 수 있으며, 잠복기가 평균 3~4개월에서 6개월까지도 됩니다. \n검사비용은 2만원 안쪽으로 본인 부담금이 발생합니다. \n성에 대해 민감하게 반응하는 한국 사회에서 성병이란 부끄럽고 수치스러운 병으로 인식되고 있습니다.\n하지만 신체부위 특성상 여자로써는 병원방문이 힘들겠지만 여성 의사선생님이 진료하는 피부과를 찾아 진료하는게 좋겠군요\nhttp://e-name.kr/5gUpB06w\nMoon Jungjung 러브솔루션 EXPERT\nMoon Jungjung EXPERT의 명함입니다\ne-name.kr', '안녕하세요.\n노원역 인근에서 17년째 여성곤지름(콘딜로마, 여성성기사마귀)를 중점 진료하고 있는 산부인과 전문의 조병구입니다.\n곤지름을 의심하고 계시군요.\n우선 이것이 곤지름이 맞는지 병의원에서 정확히 진찰을 받아보시는 것이 중요합니다.\n치료에 관해서는 곤지름이 맞는지 확인한 후에 결정하시면 되는데요.\n곤지름은 육안으로 90%이상 진단이 가능하지만, 10%에서는 다른 질환과 구분이 되지 않아\n조직검사를 통해 확인해야합니다.\n확인 후 곤지름이 맞으면 바로 치료가 가능합니다.\n제대로 진료하는 병의원에서는 곤지름 치료 시에 약물요법은 사용하지 않습니다.\n재발율이 높고, 자주 치료를 받아야하기 때문입니다.\n주로 레이저나 고주파 전기소작술을 이용한 치료를 해드리는데요.\n재발을 해도 한 달 간격으로 2~3회 정도면 대부분 완치될 수 있습니다.\n불편을 줄이기 위해 수면마취가 필요할 수 있으며 마취 수준에 따라 시술 비용이 다양해질 수 있습니다.\n곤지름 치료 시에 외음부, 질 속, 항문 속까지 모두 진찰해서 발견한 곤지름을\n의사에게 제대로 제거 시술 받아야 재발율과 재치료율이 낮습니다.\n저희 산부인과는 질 속과 외음부 항문 속 요도 안쪽까지 모든 부분의 곤지름을 제거할 수 있는 유일한 의료기관입니다.\n일상생활의 불편을 줄이기 위해 곤지름은 재발을 하더라도 보통 한 달에 한번 정도만 진찰을 하고 치료해드리고 있습니다.\n곤지름 진찰 시에는 보통 성병종합검사를 같이 받아야하는데요.\n곤지름 자체가 성병의 일종이라서 감염이 가능한 모든 성병에 관한 검사와 치료가\n반드시 필요합니다.\n병의원마다 검사의 종류가 다양하고 검사해야하는 이유도 다양하지만, 처음 진료 받을 때\n제대로 검사 받는 것이 중요합니다.\n이전에 여타 병의원에서 검사받으신 적이 있으시면 결과지를 가지고 오시거나 정확히 결과를 알고 오시면 중복되는 검사는 받지 않으셔도 됩니다.\nHPV에 의한 자궁경부암과 곤지름을 예방하기 위해 곤지름을 경험하신 분들은\n향후 예방을 위해 자궁경부암 백신을 반드시 맞도록 하고 있습니다.\n자궁경부암/곤지름 예방백신에 관해서도 함께 안내를 드리겠습니다.\n백신은 현재 2가지가 나와 있는데요.\n각각 가다실과 가다실 9(nine)이라고 불립니다.\n가다실은 4가 백신으로 자궁경부암과 곤지름 예방을 목적으로 하고,\n가다실 9(nine)는 9가 백신으로 9가지 바이러스 타입에 예방효과가 있어\n가다실 (4가)보다 효과가 좋습니다.\n저희 병의원에서는 보통 20~30대 여성에게는 가다실 9(nine)을 40대 이후에는\n가다실을 주로 추천하고 있습니다.\n가다실이 치료백신은 아니라서 지금 있는 곤지름은 없애주지는 못하지만,\nHPV에 의해 생길 수 있는 더 심각한 질환인 자궁경부암을 비롯한 여성암을 예방해주기 때문에 반드시 필요합니다.\n혹시 수도권에 사시거나 지방에서 사셔서 좀 멀더라도 체계적인 치료를 원하시는 경우\n예약 후 방문주시면 정확한 진찰 후에 속 시원한 상담과 치료를 해드리도록 하겠습니다.\n빨리 완치되시길 바랍니다.']",2,https://kin.naver.com/qna/detail.naver?d1id=7&dirId=7011404&docId=381260510&qb=67Cx7Iug&enc=utf8&section=kin&rank=134&search_sort=3&spq=0,여성질환
