page,date,tags,questions,questions_add,answers,N_answer,url,category
15,2018.04.23,"['진로고민', '진로', '성격', '내성적인성격', '소심한성격', '문과직업', '내성적인', '직업']","내성적이고 소심한성격에 맞는직업을 찾는중입니다..
제 성격으로 말할거같으면 사람많은곳 싫어하고 발표같은거도 너무싫어해서 발표하기한달전부터 고민을하고 친구도 마니없습니다.학교에서 존재감도 없고요..또 모둠활동같은 단체,팀활동을 못합니다..근데 이런 저한테 맞는직업이 있을까요...데충찾아봤는데 없다라고요..진짜사는게 의미도 없고 희망도 없어지네요..18살학생인데 가끔 자살생각도 듭니다..하루빨리 저어게 맞는직업 찾고싶어요",,"['안녕하세요\n\n\n\n교육부 컨설턴트입니다!\n\n\n성격에 맞춰서 직업이라..\n어떠한 직업을 가지시더라도 무조건 단체\n활동입니다 \n\n사회생활이 어쩔수없이 팀구조 단체 활동 이라서...\n\n그리고 직업을 찾으실때는\n\n돈,적성,전망,건강 을 생각해서\n찾으시는 것을 추천드립니다!\n\n아니면 컴퓨터 직업군을 선택해\n보시는것도 추천드릴께요!\n\n컴퓨터직업 즉IT분야로\n여러가지 직업들이있습니다\n\n프로그래머\n네트워크관리사/엔지니어\n빅데이터전문가\n정보보안전문가등\n컴퓨터를 이용한 직업군이라서\n\n사람하고 많이 엉키지는 않는직업군이죠!\n\n또한 미래유망적으로도 밝은 직업군이구요!\n\n18살에 무슨 자살생각입니까?!\n아직 미래가 밝습니다! 30살넘어서도 직업을\n못찾아 취업 걱정하는 사람들을보면\n아직 학생은 늦지도않았습니다!\n\n저는 IT분야 전문교육기관 컨설턴트입니다\n\nIT분야 궁금한점이나\n진로/진학/취업/자격증등\n무료로 상담 컨설팅 도와드리고있습니다\n\n혼자 고민하지말고 도움 필요하시면\n아래 이미지 클릭하시거나 참고하셔서 문의주시면\n상세히 도와드리겠습니다!', '안녕하세요 IT 휴선생이라고 합니다\n\n질문자님이 스스로 내성적이고 소심한 성격이라고 말씀하셨는데\n\n그게 결코 이상한건 아닙니다\n\n다만 나중에 성인이되서 어떤 회사든 사회에 들어가게되면\n\n그부분에 대해서는 분명 걸림돌이 될거같습니다\n\n그러기위해서는 지금이라도 고쳐야 할 부분은 고쳐야한다는 생각이들거든요?\n\n질문자님이 직업을 찾고 싶다고 하셨는데\n\n좋아하시고 잘하시는것이 어떤건지 몰라 더 자세히 못쓴점 죄송하게 생각됩니다\n\n저는 IT분야쪽을 생각해보시는게 어떠실지 생각을 해보시는것도 괜찮을 것같다고 생각됩니디\n\n밑에다가 IT 전반적인 직업들에 대해 설명을 드릴게요\n\n\n(1)프로그래머는 웹,어플리케이션,게임,소프트웨어 개발자 같은 직업들을 가지고 있네요\n프로그래머는 프로그램을 설계및 개발,유지보수를 하는 직업을 말합니다.\n\n직업의 수요는 가장 많고 취업도 쉬울수도 있지만 급여도 작고 야근도 많이 합니다.\n다만 경력이 올라갈수록 연봉이 높아지는 직업입니다.\n\n(2)엔지니어는\n 시스템엔지니어, 네트워크 엔지니어 이렇게  크게 두가지로 나눌수 있습니다.\n시스템엔지니어는 컴퓨터및 통신장비들을\n시스템에 맞춰 설계및 관리하는 직업을 말합니다.\n특히 서버에 대한 지식이 많이 필요하기 때문에\n 실무적인 부분을 알아 두셔야 합니다.\n\n네트워크 엔지니어는\n전산망과 관련된 각종 하드웨어및 소프트웨어에 관한\n 네트워크시스템의 분석,설계및 구축에 관한 업무를 하며\n또 전체적인 네트워크 시스템의 구조를 분석하고 평가하여\n 문제점과 개선책을 마련하는 직업입니다.\n\n데이터베이스관리자는\n회사에서 사용되는 DB서버를\n구축및 유지보수관리를 하는 직업을 말합니다.\n보통 금융권이나 대기업으로 취업을 하지만\n신입채용이 별로 없어서 보통 개발쪽에서\n경력을 쌓고 나서 이직을 하는 경우가 많습니다.\n\n(3)정보보안전문가는\nIT 직업군중 최상위 직업군으로\n 프로그래밍/ 네트워크&서버/시스템/데이터베이스/정보보안을\n전반적으로 배워야하는 분야입니다.\n정보보안전문가가 되실려면\n 이론적인 공부보다 실무위주로 공부를 하셔야 합니다.\n정보보안전문가는 여러가지 분야로 나눌수도있지만\n 크게 5가지로 분류가 됩니다.\n\n1. 모의해킹전문가는\n웹이나 프로그램을 임시적으로 해킹을 하여\n취약점을 분석하고 작업하는 직업을 말합니다.\n중요한건 신입채용이 별로 없고\n대체적으론 경력직위주로 채용을 많이 하는 편입니다.\n\n2.보안 솔루션은\n 모의 해킹을 통해 찾은 취약점을 보안/대비를 하는 직업을 말합니다.\n이부분에서는 모의 해킹 쪽과 팀을\n 이루어 같이 다니며 확실하게 실무적인 부분이 뛰어나야하는 직업입니다.\n\n3.보안관제는\n 24시간 3교대로 모니터링을 통해\n1차적으로 대응하는 직업입니다.\n이부분 업무가 단순해서 급여도 낮고\n 실무적인 부분에서도 크게 어려운 점이 없기때문에\n능력을 향상시키는 부분이 어렵습니다.\n이런부분떄문에 고졸 출신들도 취업이 가능한 직업입니다.\n4. 악성코드 분석은\n 유해되는 코드나 프로그램을 분석하여\n백신이나 보안프로그램을 만드는 업무를 말합니다.\n대중적으로는 V3나 알약등 악성코드를 예방하는 역활을 합니다.\n\n5. 디지털포랜식 전문가는\n 삭제되거나 손상된 데이터를 복원/복구하는 업무를 말합니다.\n무엇보다 이 업무는 법적 증거물들을\n 수집하는데 많이 이용되며 주로 경찰정, 사이버수사대, 등\n국가기관쪽에서 근무를 많이 합니다.\n\n(4)빅데이터 전문가는\n 얻고자 하는 데이터가 무엇인지 이것들을\n식별하고 분석과 노화우에 따라서 원하는 결과들을 얻고\n데이터 분석에 관한 솔루션을 만드는 일을 말합니다.\n또한 그자료를 통계까지 하는 직업을 말합니다.\n\n그리고 빅데이터 전문가는 은행이나 카드사 같은\n 금융권과 광고회사 및 정부나 공공기관에도 위업을 하실수 있습니다.\n\n이렇게 각직업에 대해서 말씀을 드렸는데\n이런IT부분들다 실무적인 부분들과 실력들이 필요합니다\n위에 말씀드렸던 직업들 중에 잘선택하시고\n포기하지마시고 열심히 하시길 빌겠습니다\n더욱 자세한 부분에 대해서 알고 싶으신 것이있으시다면 아래로 연락주세요\n\n네이버폼 http://naver.me/xHSf5pAG\n\n휴쌤\nhttps://open.kakao.com/o/sWZdJMH', '저는 전직 개발자로 근무를 했었고, 현재 프로그래밍\n관련된 IT분야에 대한 1:1전문상담을 도와드리고 있습니다.\n\n=> 우선 질문자님께서 어떤 분야로 취업을 하실지가 중요합니다.\n현재 학력으로 공기업, 대기업 취업을 계획 하시더라도\n내가 어떤 직무를 볼지, 어떤 분야로 취업을 할지에 따라 가능여부가\n결정된다고 보셔야 하는데요.\n\n요새 문재인 정부가 들어오면서, 블라인드 채용이라 하여,\n학벌 , 학력을 보는게 없어지고 있습니다.\n\n물론 학벌 학력을 안보는 조건으로 직무 능력이나, 자격증\n등을 토대로 채용하는 경우가 많아졌으니\n\n채용을 희망하는 분야를 선정해 NCS 기반의 직무 능력과\n기술 자격증을 취득 하여 취업을 준비하시는게 좋습니다.\n\n현재 정부에서 강조 하고 있는 4차 산업혁명 \nIT분야로 취업을 계획 하시는게 향 후 전망 및 비전이 있다고 생각 됩니다.\n\n아래IT 직업군 남겨드릴테니 자세한 설명이 필요하거나\n진로를 계획 하신다면 네임카드 통해 연락주시면\n자세하게 설명 드리고 도움드리겠습니다.\n\n< 개발자 >  (연봉 대졸기준 신입 초봉) \n\n응용 프로그래머 : SW를 개발 의뢰를 받거나 필요한 SW를 설계하고 개발하는 직업\n( 대졸 기준 2600 ~ 2800 )\n자바 개발자 : 사내에서 사용하는 웹 사이트를 설계하여 구축하고 유지보수 하는 직업\n( 대졸 기준 2800 ~ 3000 ) / 모바일 앱 개발자, DB분야 이직 가능\n빅데이터 개발자 : 대용량 데이터를 수집하여 분석하고 통계를 내는 직업\n( 대졸 기준 3200 ~ 3500 ) / 분석가, 전문가 포함\n\n< 엔지니어 >\n\n시스템 엔지니어 : 사내 시스템을 설계 및 구축 하고 유지보수 하며, 클라우드 기술 개발\n( 대졸 기준 2800 ~ 3000 )\n네트워크 엔지니어 : 사내 네트워크 통신망을 구축 하고 설계하며 장비 관리 하는 직업\n( 대졸 기준 2200 ~2400 )\n\n< DB >\n\n데이터 베이스 관리자 : 사내 DB를 구축 하고 관리하며, 백업 및 유지 보수 하는 직업\n( 대졸 기준 2800 ~ 3000 )\n\n< 보안 >\n\n모의해킹 컨설턴트 : 기업으로부터 의뢰를 받아 해킹을 받을 수 있는 취약점 분석을 하는 직업\n( 대졸 기준 3200 ~ 3300 )\n보안 솔루션 : 발견된 취약점을 보안할 수 있는 보안 솔루션 및 인프라를 구축 하는 직업\n( 대졸 기준 2800 ~ 3100 )\n보안관제 - 실시간 해킹 공격을 감시하며 1차 대응을 하는 직업\n( 대졸 기준 2400 ~ 2600 )\n악성코드 분석가 - 악성코드를 분석 하여 백신을 개발 하거나 백신S/W 업데이트\n( 대졸 기준 3000 ~ 3500 ) / 경력직 우선 채용\n디지털 포렌식 수사관 - 사이버 수사 요원이라 불리며, 포렌식 기술을 통해 범죄 증거물\n복구 및 수집\n( 대졸 기준 3500 ~ 4000 ) / 경력에 따라 지원 조건이 있으며 연봉차이가 있음\n\n정확하게 계획세우고 전망보고 준비하셨으면 합니다. \n멘토역활 해드리니 궁금한점 있으시면\n전문가를 통해 정확한 공부계획을 세우시길 바랍니다.\n아래 정보를 참고하시고 상담 신청 남겨주세요\n\n<1:1 상담>\nhttps://open.kakao.com/o/sGFOwwC\n\n<방문 상담 신청>\nhttp://naver.me/5qi7Ts4e', '  통역 작업 관련은 어떠신가요. 물론 소득을 창출하기 위해선 사람과의 소통을 어느 정도 필요 하겠으나\n재택 근무 할 수 있는 쪽으로 알아보시면 좋을거 같습니다.', '1. 웹디자이너 (웹 에이전시는 커뮤니케이션이 많고 쇼핑몰은 작업툴이 정해져있어서 쇼핑몰쪽이 차분하게 자기 일만 하면 됩니다. 약간의 소통은 있지만 소규모의 사람들과 일할 수 있음)\n2. 저는 문과보다는 이과를 추천하는데 전기 계통에서 발전소,배전소 등의 관리인은 소수의 팀원들과 상대하지만 자신 혼자 맡은바를 열심히 하면 됩니다. 정확하기만 하면되고 전기쪽으로도 추천합니다.\n3.  프로그래머, 소프트웨어 개발자\n이쪽도 작업할때는 혼자 집중해서 고뇌하는 작업인데 대신 머리를 많이 써야 되서 신경쓰는 일이 많습니다.\n웹디자이너가 머리는 좀 덜쓰는 편입니다.\n4. 출판사 편집인\n역시 아예 사람을 상대안할 수는 없지만 인디자인부터 포토샵 일러스트 레이터 프로그램을 익혀두시고 \n한번 들어가면 꿀직장입니다. 대신 글을 많이 읽고 보는 것에 대해서 스트레스받지 않아야 하고 오탈자 주의해야하며 정확하고 꼼꼼해야 합니다.\n5. 법원 서기 및 기록자\n법조인이 아니고도 법원의 재판내용등을 녹음된 것 등을 파일을 듣고 기록하고 타이핑 하는 것입니다.\n타자가 빠르면 좋고 외모나 여러가지 성격과 상관없이 화상입은 얼굴을 가지신 분도 하는 것을 봤습니다.\n개인적으로는 강력추천 직업입니다.\n주의할것은 사회복지계통은 사람을 많이 상대하고 내가 케어를 해야하므로 추천하지 않습니다.\n왠만하면 문과보단 꼭 이과쪽으로 진로를 정하시길 추천합니다.\n이과에서 기초지식이 있으면 여기저기 찔러볼 수 있는 곳이 많습니다~', '안녕하세요\n저는 IT 전문 교육 컨설턴트 수빈쌤이라고 해요\n 제가 꼭 도움을 주고 싶은 친구네요~\n 제가 추천드리고 싶은 직업은요~\n정보보안전문가에는\n취업이 잘 되는 순으로\n 관제\n보안관제 : 실시간 해킹을 감시하거나 분석\n방어\n침해대응 CERT : 모든 전산망 해킹 역으로 추적 / 역 공격\n악성코드분석가 : 악성프로그램, 바이러스를 분석 / 해결\n해킹\n보안솔루션개발자 : 방화벽 , 침입탐지시스템 , 백신프로그램 개발\n모의해킹전문가 : 모의해킹으로 취약점과 악성코드 모든것들을 분석하고 찾아내어 사전 해결\n 이러한 직업이 있는데요\n 정보보안전문가가 되기 위한 자격증은\n국가/국제 공인 자격증 위주로 취득하시는 것이 좋아요\n 프로그래밍\n국가공인 : 정보처기능사/산업기사/기사\n국제공인 : OCJP, OCWCD\n 네트워크\n국가공인 - 네트워크관리사 2급\n국제공인 - CCNA, CCNP, CCIE\nCCIE는 실무자도 어렵다는 점 참고 해주세요\n 시스템\n국가공인 - 리눅스 마스터 1, 2급\n리눅스 마스터 1급은 해외취업할 때 많이 도움이 됩니다\n국제공인 : LPIC, MCSE\n 데이터베이스\n국제공인 : OCA, OCP, OCM\nOracle 회사에서 관리하는 자격증이기 때문에 경쟁력이 있어요\n 정보보안\n국가공인 - 정보보안산업기사/기사\n좋은 회사에 취업하려면 4년제 학사 학위를 학점은행제나, 대학교를 통해서 취득하셔서 정보보안기사를취득하시는 것을 추천드려요\n국제공인 - CISA, CISSP\nCISCO에서 운영하는 자격증입니다\n 가 있겠네요\n 아무래도 IT 최고 정점인 직업이기 때문에 컴퓨터공학과 친구들을 많이 뽑고 있으니\n 만약 컴공과가 아니시라면 학점은행제 2년과정을 통해서 컴공과 취득을 추천드렵니다\n 지식IN 글을 보시고 연락주시는 분들 대상으로 무료로 맞춤 컨설팅을 진행하고 있기 때문에\n 맞춤 상담을 받기를 희망하신다면 클릭 해주셔서 문의를 남겨 주시면\n 친절하게 1:1 맞춤 컨설팅을 도와드릴게요\n우리 같이 고민해봐요~', '안녕하세요. 서울호서전문학교입니다. \n우리학교는 국내 최대 규모의 종합 전문학교로\nIT, 항공, 게임, 뷰티, 애완동물, 조리, 제과제빵, 바리스타, 호텔, 관광, 인테리어, 애니메이션 등 실무위주의 다양한 학과를 운영하고 있습니다.\n우리학교의 교육 시스템은\n 학점과목(일반대학 학점과목)\n+\n비 학점과목(취업을 위한 실무수업)\n+\n전공 특성화 프로그램(취업을 위한 현장수업)\n+\n자격증 특강\n이렇게 실무 위주 시스템으로 진행이 되고 있는데요, \n실무수업 비중이 평균 실무 70%이고, 학과에 따라 실무 수업 비중이 90%가 넘어가는 학과도 있습니다!\n그리고 해외교류 수업도 진행을 하고 있는데요, 매년 30~40여건의 해외대학 연수 혹은 해외대학 교수진이 우리학교에 방문해서 교육진행하고 있습니다!\n이러한 결과로 취업은 기본이고, 아래 사진과 같이 매년 우수 취업처로 취업을 하고 있습니다!\n최근 대표 취업처는 아래 이미지와 같습니다!\n뿐만 아니라 매년 대학교 편입이나 대학원 진학도 하고 있는데요,\n최근에는 한양대, 동국대, 세종대, 홍익대 등 인서울 명문대학으로 진학을 하고 있습니다!\n더 자세한 내용은 아래 링크에서 확인해 보실 수 있습니다~\nhttps://www.shoseo.ac.kr/']",7,https://kin.naver.com/qna/detail.naver?d1id=4&dirId=40604&docId=299934006&qb=67Cx7Iug&enc=utf8&section=kin&rank=144&search_sort=3&spq=0,"복지, 종교"
