page,date,tags,questions,questions_add,answers,N_answer,url,category
16,2020.01.29,"['해킹당한건가요', '광고창없애는방법', '폰해킹의심', '폰해킹가능성', '광고제거']",폰에 자꾸 팝업 광고가 떠요ㅠㅠ 해킹인지,"최근에 동생이랑 같이 게임하려고 인터넷으로 뭘 깔았었는데 그 사이트가 인증된 사이트드 아녔고 해외 사이트 같아요ㅠㅠ

게임 설치할때 최근 안드로이드 감염 발생이 잦습니다. 귀하의 안드로이드도 바이러스에 감염 위험이 있습니다. 백신을 설치하세요. 같은 문구가 떴었는데 게임생각에 미쳐 가볍게 넘겼었거든요ㅜㅠㅜㅜㅠㅠ?

근데 언제부턴가 화면 전체에 이상한 광고가 뜨고 팝업창에 의미심장한 이미지가 나오고... 심지어 키보드 밑에도 광고가 떠요 그냥 폰 보고 있어도 광고가 무작위로 뜹니다ㅠㅠ 제가 설치했던 게임 다 지우고 고클린 뭐 클리너 앱 다 깔아봤는데 변한건 없더라고요 제발 앞으론 게임같은거 인터넷으로 설치 안할게요ㅠㅠㅠㅠㅠㅠ 어떻게 하는 방법 없을까요","['바이러스에 감염되었다는 문구는 사실 거짓입니다.\n그 문구는 클릭을 유도 시키는 것이며, 실제 바이러스나 해킹 등 스마트폰에 유해한 어플을 설치하게 만드는 것입니다.\n그 문구를 유발하는 어플을 지우거나 사이트를 차단하면 됩니다.\n이게 어렵다면, 필요한 데이터만 백업하고 폰 초기화하는 걸 추천해요', '아래 내용 확인해 보세요. \nhttp://bit.ly/스마트폰팝업광고차단\n스마트폰 팝업광고 차단하기\n요즘들어 갑자기 스마트폰에 팝업광고 떠서 깜짝 깜짝 놀라곤 한다. 브라우저로 인터넷 서핑을 하게되면 보는 그런 광고수준이 아니다. 어플간 전환을 하게되면 갑자기 대문짝만한 팝업광고가 뜨는 것이다... 화..\nbit.ly', '안녕하세요 판다VPN 지식IN 상담원입니다\n제한된 사이트를 우회하셔서 이용하셨나보네요~ !\n그런경우\n크롬>메뉴>설정>사이트설정>알림>허용됨>해당광고주소>삭제 하시면됩니다 ! \n무료vpn이나, https우회서비스를 이용중이시라면 해킹이나, 바이러스감염등\n심각한 피해사례가 많으니 주의하셔야합니다 \n그리고 해당 악성 광고로 유료 앱 설치 유도를 하니 이 점도유의하세요!\n혹시 무료 vpn 사용하신적 있으신가요 ?? \n무료 vpn을 이용했을때, \n또는 보안이 안전하지않은 사이트에 접속을 하였을 경우\n발생하는 악성광고이니 무시하셔도됩니다.\n무료VPN의 수익구조는 정보판매라는\n소문이 있을정도로 피해사례가 많이 있습니다!\n혹시나 지금 무료vpn을 이용하시고 계시다면 지우시는게 좋을 것 같습니다!\n저희 판다vpn은 전세계에서 한국서버 50개이상 보유 \n게임유저들의 위한 게임서버 다수보유, 각종 해외서버도 보유중입니다 ^^\n네이버에 ""판다VPN"" 를 검색해주세요', '안녕하세요 킹콩vpn 지식인 상담원입니다!\n해당오류는 무시하셔도 되는 악성 광고입니다.\n해당앱은 삭제해주셔야합니다 ! \n그리고 무료vpn은 개인정보 유출에 매우 심각합니다!\n만약 설치를 하셨다면 당장 지워주시는 것을 추천드립니다!\n많고 많은 vpn업체가 있지만 안전하고 믿을 수 있는 vpn이용 원하시면\n저희 킹콩vpn이용해보시는건 어떠실까요 ^^\n실시간으로 상담 가능하며 보안도 문제 없습니다!\n실시간 상담 가능하고 속도 빠른 킹콩vpn한번 이용해보세요 ^^\n저희 킹콩VPN 은 고객님께 가장 잘맞는 접속방식을 제공해\n가장 빠르고 완벽한 VPN을 제공해 드리고 있습니다.\n실시간 상담, 빠른 피드백이 가능하고\n빠른 상담 및 AS가 가능한 킹콩VPN을 추천드립니다. 감사합니다.\n추가로 무료 체험가능 또한 가능하니 부담없이 저희 킹콩VPN 찾아주세요.']",4,https://kin.naver.com/qna/detail.naver?d1id=11&dirId=11050405&docId=345874241&qb=67Cx7Iug&enc=utf8&section=kin&rank=156&search_sort=3&spq=0,예체능대학
