page,date,tags,questions,questions_add,answers,N_answer,url,category
2,2020.07.29,[],고양이 용품,"샵에서 2~3개월 되었는 고양이를 데리고 왔거든요오
진짜 겁나 귀엽.

아직 아가야라 종합 백신도 맞아야 하구

잘 적응 하는데 어우 구석탱이에 계속 들어가거나 아님 먼지구디를 계속 들어가서 청소를 했는데요

으음 유의 사항은 잘 알겠는데
용품과 주기를 잘 몰라서요ㅠㅠ

모래는 언제 언제 갈아줘야하죠?

또 샴푸나 고양이 브러쉬 목줄이나 세정제

그리고 모래 같은 것들을 좀 추천해주세요!

또 냄새가 나지 않는 사료는 없는 걸까요?","['모래는 언제 언제 갈아줘야하죠?\n또 샴푸나 고양이 브러쉬 목줄이나 세정제\n그리고 모래 같은 것들을 좀 추천해주세요!\n또 냄새가 나지 않는 사료는 없는 걸까요?\n모래는 1주일에 한번 모두 교체해주시고\n1일 아침,저녁으로 청소2회 해주시면됩니다.\n모래는 두부모래 검색하셔서 찾아보시면됩니다.\n브러쉬도 장모,단모에 따라 달라지니 네이버쇼핑에 검색해서 보시면되고\n목줄은 안쓰셔도됩니다. \n사료에 냄새가 나지않으면 고양이가 먹지않습니다.\n냄새안나는 사료는 없습니다.\nhttps://blog.naver.com/go4nam\n고양이와 사는 남자 : 네이버 블로그\n고양이 공부하는 공간\nblog.naver.com', '모래는 2주~3주에 한번씩 갈아주면 되구요,, 모래는 종류로 따지자면 벤토나이트.두부.크리스탈.가필드.카사바.소나무 등 이 있어요 일단 벤토는 입자가 작아 고양이들이 좋아하지만 먼지가 많이 날린다는 단점이 있어 집사분이나 고양이가 호흡기질환을 앓고 계신다면 추천드리지 않아요...하지만 그런게 아니라면 괜찮을듯 해요! 두부는,,대부분 입자가 커  고양이들은 별로 안좋아할수 있지만 변기에 버릴수있고.먼지도 덜나고 하는 장점덕분에 집사분들은  좋으실거예요 딴것들은 비싸고,아프고 하기 때문에 그렇게 추천드리진 않지만 고양이가 그것을 고른다면 따라주는것도 괜찮지요 참고로 저는 샌드마스터 크랙형두부모래를 써요 저휘 가족과 고양이가 호흡기 쪽으로 별로 좋지않아서 벤토는 포기,, 했는데 이건 진짜 알갱이도 꽤 작고 장점이 많아요!! 그리고 \n샴푸는 저는 오가닉 자묘용 린스샴푸를 쓰고 있구요 아직 1살안된애라.. 그리고 빗은 조개빗.손으로 빗어주는빗등 많아요~ 더 알려드리자면 캣타워는 좀 비싸더라도  튼튼한걸 사는게 좋아요... 저희는 처음에는 임보였던터라..7만원정도 되는 싼걸 샀어요 근데 넘 부실해서 진짜 후회중입니다.... 그리고 윈도우 해먹은 진짜 싸고 좋아요!! 보통 3만원 이하인데 진짜 잘써요~ㅎㅎ 더 궁금한거 있으시면 댓글로 부탁 드릴게요:) ', '반려동물 인플루언서 입니다. \n1. 모래는 언제 언제 갈아줘야하죠? \n- 벤토나이트 모래 :  매일 한번씩 삽으로 청소 / 한달에 한번 전체갈이\n  중간중간 모래보충은 해주셔야해요. \n2. 샴푸나 고양이 브러쉬 목줄이나 세정제\n샴푸 https://blog.naver.com/lsj87815/222027791201\n브러쉬 https://blog.naver.com/lsj87815/221941364558 / 단모기준 \n목줄 : 왜 필요할까요? 산책은 안하는것이 좋습니다. 필요하다면 목줄이 아닌 몸줄 검색하세요. \n특히 방울달린 목걸이는 고양이에게 스트레스를 준다고 해요. \n3. 모래 : 저는 벤토나이트 모래를 사용하기 때문에 벤토로 알려드릴께요. \n- 더스트몬(무향), 디그앤롤  - 두개섞어서 사용하고 있습니다. \n4. 냄새가 나지 않는 사료는 없는 걸까요?\n사료는 집사가 아닌 고양이에게 맞춰주셔야 할 것 같아요. 고양이사료 샘플 다양하게 받은 후 고양이가 잘 먹는 사료로 선택하시길 바랍니다. 저가사료는 피하셨음 좋겠어요. \n5. 기타 필요한 물품 \n - 스크레쳐(필수) https://smartstore.naver.com/bonggun/products/5034139046\n-  고양이화장실(필수)  https://smartstore.naver.com/bonggun/products/5035611918 \n8년차 집사, 4묘 반려하고 있으면서 현재 사용하고 있는 괜찮은 제품 추천해드렸으니 \n도움이 되셨길 바랍니다. 이쁘게 건강하게 키우시길 바랄께요~ \n혹시 궁금한 점 있으시면 네이버 @오뽀홍또  검색하시면 됩니다. \n오뽀홍또와 집사 이야기 : 네이버 블로그\n♥️오뽀홍또를 보러 오신 모든 분들 환영합니다♥ (리뷰문의는 메일,쪽지로) 인플루언서 @오뽀홍또 팬하기 꾹!\nblog.naver.com', '저도 모래 특유의 냄새, 그리고 고양이 분변 섞이면 더 심해지는\n냄새때문에 고생좀 해보고 모래 제품 이것 저것 써봤는데..\n더스트몬 향 첨가 제품이 제일 좋았습니다.\n녹차향, 라벤더향, 참숯향, 레몬향 등등 있는데\n참숯, 레몬이 제일 좋았습니다.\n한번 써보셔요. 후회안하실겁니다.\n고양이 화장실 두부모래 추천 더스트몬 초극세 입자 참숯향 1.5mm\nhttps://coupa.ng/bGKzPK\nblog.naver.com\n추가로 제가 쓰고있는 브러쉬도 추천드립니다.\n고양이 강아지 애견 털 빠짐 관리 개털 엉킨 뭉친 죽은털 제거기 장갑 빗 브러쉬 : 메리마트\n강아지빗, 고양이빗, 고양이털제거, 고양이털, 고양이브러쉬, 강아지브러쉬, 강아지털빠짐, 강아지털제거, 고양이털빗, 고양이털관리\nbit.ly']",4,https://kin.naver.com/qna/detail.naver?d1id=8&dirId=80502&docId=363872890&qb=67Cx7Iug&enc=utf8&section=kin&rank=13&search_sort=3&spq=0,고양이
2,2020.07.29,"['코로나백신', '코로나']",코로나 백신 나왔나요??,제목 그대로 코로나 백신 나왔나요,"['안녕하세요\n아직 안나왔을겁니다.. 백신이 개발이 되어도 임상실험을 거쳐 실제 사람들에게 투약하는 시간이\n아직은 안나온걸로 압니다... \n미국 화이자인가에서 수달내로 나온다고 들었고 국내에선 내년이나 나온다고 들은거 같습니다....', '아직 나오지 않은것 같습니다만...ㅠㅜ']",2,https://kin.naver.com/qna/detail.naver?d1id=8&dirId=815&docId=363872869&qb=67Cx7Iug&enc=utf8&section=kin&rank=14&search_sort=3&spq=0,날씨
2,2020.07.29,[],휴마시스 주가 최근 뭐 없을까요?,휴마시스 주가 최근 뭐 좋은 소식 없나요? 주식 커뮤니티 보면 다들 뭔가 기대하는 눈치인데 뭔가 그런 여론형성이 괜히 되는 건 아닌거 같고 꼭 이렇게 우루루 기대된다 얘기되면 상승세 보이기도 하더라구요 휴마시스 주가 전망이라 함은 거창하지만 종목 관련 정보 좀 공유 부탁드려요~!,"['휴마시스 주가는 체외진단 의료기기\n생산 기업으로 코로나19 진단키트 개발,\n식약처 수출 허가 신청 소식에 상승세를\n보인 종목이죠! \n휴마시스 주가 같은 경우 6월말 \n6거래일 연속 상한가 기록을 달성, \n투자경고 종목 이후 하루 매매 거래가\n정지되기도 했었는데요, \n휴마시스 주가가 엄청난 매수세가 \n몰렸던 것은 코로나19 항원진단키트를\n셀트리온 주가와 협업하여 개발한다 밝혀\n강세를 보였던 것으로 추측됩니다. \n대한민국이 코로나19 예방 및 방역과\n관련 발빠른 대처 방안으로 모범 국가로\n지정되며 해외 진단키트 수급 및 수출로 \n인해 관련 종목들이 엄청난 상승 랠리를\n보여줬던 지난 상반기였죠, \n미국, 유럽 등 아직까지도 코로나19 \n확산세가 지속적인 추가 발생을 보이고 있는\n만큼 휴마시스 주가와 같은 진단키트 관련주는\n더이상 테마주가 아닌 매출 증가가 기대되는\n실적주라 이야기 되고 있는 시점입니다. \n그럼에도 불구하고 휴마시스 주가의 \n예측 할 수 없는 상승/하락세에 고점에\n물리신 분들도 계실테고, \n진입을 시도해볼까 고민하시는 분들도\n분명 계실텐데요! \n아래 출처를 클릭하시면 휴마시스 주가에\n대한 최적의 매수, 매도 시점 추천 뿐만 \n아니라 아직 바닥권에 머물고 있는\n코로나 백신/치료제 급등 유망주까지\n모두 무료로 받아보실 수 있다고 하니, \n참여하셔서 하반기 성투하시길 바랍니다! \n내일장 급등 1순위 종목 분석결과 받기\n2020년 누적이용자 10,051 명 이름 연락처 - - 개인정보취급방침 동의 보기 마케팅 수신 동의 보기 Copyright ⓒ 이상투자그룹. All rights reserved.\nstarstock.co.kr']",1,https://kin.naver.com/qna/detail.naver?d1id=4&dirId=40102&docId=363868011&qb=67Cx7Iug&enc=utf8&section=kin&rank=15&search_sort=3&spq=0,"주식, 증권"
1,2020.07.29,[],해킹 막는법,요즘 해킹 증상이랑 비슷한 증상 들이 나타나는거 같은데 해킹 막는법 알려주세요,"['일반적으로 해킹은...\n백신 꾸준히 돌리시고요,\n아무거나 무단으로 다운로드하시지만 않으면 됩니다.\n해킹의 이유 중 약70%이상이 무단 복제나 백신 없음 에서 나오거든요.\n채택 부탁드립니다.', '백신입니다 ...\n백신으로  바이러스 잡아주시면 됩니다 ..\n아무리 뛰어난 해커라두 바이러스 침투 안시키고 해킹하는게 어렵게죠 \n그래서 안철수 연구소 .같은분들이 먹고 살게죠 ..\n백신으로 바이러스을 자주 잡아주시면됩니다 ..']",2,https://kin.naver.com/qna/detail.naver?d1id=1&dirId=11001&docId=363878522&qb=67Cx7Iug&enc=utf8&section=kin&rank=9&search_sort=3&spq=0,해킹
8,2020.07.29,[],어떤 시작 프로그램을 지워야하나요??,고클린 시적프로그램 제거 부탁드립니다.,"['고클린 쓰지 마세요.\n업데이트를 전혀 하지 않아 윈도우10에서 레지스트리 문제를 일으키는 것을 지식인에서 자주 봐왔습니다.\n시작프로그램은\nCtrl+shift+Esc\n3 키를 동시에 눌러서\n상단에 ""시작프로그램""\n보시고 적당히 ""불필요한"" 프로그램만 ""사용 안함"" 하시면 됩니다.\n(현재 질문자님 프로그램중에서 특별히 사용으로 두어야할 프로그램은 없네요)\n시작 프로그램은 말 그대로 부팅시 작동하는 프로그램입니다.\n그래서 함부로 삭제하면 영원히 부팅을 할 수 없게 되어버릴지도 모릅니다.\n실제로 그런 사례가 많구요.\n> 사용 으로 두어야만 하는 프로그램\n1. 필수 드라이버\n타블렛이나 기타 외부기기를 사용하신다면, 이런 기기들을 운영하기 위한 드라이버류는 놔두어야 합니다.\n2. 필수 프로그램\n여러가지 이유로 상시 켜둘 필요가 있는 프로그램은 시작프로그램에 있으면 좋습니다.\n이외에는 전부 끄시면 됩니다.\n+\n알약, 알집과는 거리를 두시기 바랍니다.\n압축프로그램은 반디집,\n영상 프로그램은 팟플레이어가 권장됩니다.\n윈도우7은 모든 보안, 기능서비스가 종료된 OS입니다.\n빠른 시일 이내로 윈도우 10으로 업데이트 하셔야 합니다.\n악성 바이러스등에 의해 개인정보가 유출될 가능성이 매우 높습니다.\n국내백신을 신뢰하지 마십시오. 바이러스가 가장 먼저 노리는건 유사백신입니다.\n지난 랜섬웨어 사태때 알약, 안랩은 랜섬웨어를 전혀 방어하지 못했습니다.\n다만 윈도우10의 윈도우디펜더는 방어를 해냈습니다.', '중요 부분에 오렌지색에 체크된것 빼고,나머지는 모두 제거하셔도 됩니다.']",2,https://kin.naver.com/qna/detail.naver?d1id=1&dirId=10301&docId=363811126&qb=67Cx7Iug&enc=utf8&section=kin&rank=71&search_sort=3&spq=0,윈도우
4,2020.07.29,[],윈도우 초기화,"컴퓨터에 바이러스같은게 걸린거같아서 윈도우 포맷하려하는데 윈도우에 있는 기능인 윈도우 초기화로 해도 포맷이랑 똑같은 효과 나나요?
컴퓨터에 있던 악성코드랑 바이러스들이 다지워지나요?",['그냥 바이러스를 지우시죠...\n mzk랑 다른 백신들 같이써서..'],1,https://kin.naver.com/qna/detail.naver?d1id=1&dirId=10301&docId=363852882&qb=67Cx7Iug&enc=utf8&section=kin&rank=35&search_sort=3&spq=0,윈도우
