page,date,tags,questions,questions_add,answers,N_answer,url,category
9,2021.01.31,"['#문제풀이', '#재택부업', '#문제풀이']",사무직하다가 다른직종이직하신분들 무슨일하세요,,"['보톡 직장다니면서 배우고 싶았던거 배워서 창업도 많아 하시더라구요.\n제주변은 마카롱가개 커피숍 천연화장품 오픈하신분이 있어요', '안녕하세요 사장님! 인사드립니다\n요즘 코로나때문에 이리저리 정말힘든시기입니다!\n1. 달 30~60씩 무조건 오릅니다.\n2. 흐지부지한게 여기저기 쑤시는 것 아닙니다.\n3. 요식업 등 판매통한 수익 아닙니다.\n4. 소자본으로 시작이가능하나 수익적으로는 좋습니다 ( 설명드립니다)\n5. 처음부터 끝까지 서포터완벽하게 하여드립니다.\n6. 부업,재태크로 당연히 굴릴 수 있습니다 (서포터 완벽히 하여드리기때문)\n""소자본창업""좋은 것이있어 글남깁니다.\n창업아이템이라하여 몇가지놓고 추천하는 것 아닙니다!\n단1가지아이템입니다. 그 만큼 수익적으로도 보장되니 추천드릴수있습니다.\n수자본 사무실이긴하지만, 소액만지고 그런 것 아닙니다^^\n( 다단계 등 이런부류 절대아닙니다. )\n관심있으시면 오픈채팅 & 1:1문의 & 쪽지 부탁드리겠습니다!\nhttps://open.kakao.com/o/s5WHUdGc', '재택근무 하고 있어요\n[대기업 플랫폼 비지니스 설문조사]\nform.office.naver.com', '저는 사무직 -> 생산직으로 넘어갔었고요. 지금은 퇴사했습니다 ㅎㅎ', '솔직히 재택알바 찾으시려면 알바몬가서 찾으시고 지식인에 재택알바는 다 거르세요..\n돈 아예안들고 시간안드는 전망밝고 가치있는 부업거리 있는데 정말 한번만 진지하게 읽어주세요!!!\n돈과 시간이 전혀 들지않고 지역 나이 시간대 상관없이 무자본 스마트폰으로 간단하게 할 수 있는 앱테크 한번 관심가져보세요\n*파이코인은 장기 프로젝트로 길게 보셔야합니다(비트코인 이더리움도 초창기 무료채굴 되었던 것처럼요)\n*내용이 길어 불편하거나 보기 힘드신 분들은 <<가장 하단>>에 5번부터~1번까지의 항목들만 참고하셔도 무방합니다 한번만 읽어주세요!!(블로그주소 복사해서 붙여넣기 부탁드립니다)\n대부분의 인터넷 포스팅이나 관련 알바는 수익이 적거나 특히 사기행위가 많습니다..\n그리고 에드픽이나 캐시워크 등 관련 앱테크 또한 한달 내내 만지고 있어야 2~3만원씩 힘들게 수익이 들어오곤 합니다..\n주식이나 코인 또는 ETF외에 펀드 등 사행성 불법 파생상품 전부 자기 자본으로 재테크나 투자하시는 건 자유지만 큰 리스크가 따릅니다..\n그렇기 때문에 아예 무자본으로 시작해 미래에 큰 먹거리가 될 간단한 부업거리 2가지를 소개해드리고자 합니다!\n(사실 부업이라 하기도 머한게 24시간에 한번씩 스마트폰 클릭 한번 해주면 됩니다ㅎㅎ)\n안하셔도 좋으니 한번정도만 정독해주세요!!\n벌써 실거래(kyc인증된 테스터들에 한해서)되고 있는 무료채굴코인입니다.\n가상화폐 무료채굴 종류가 많지만 그중 최고로 비젼있고 전망좋은 파이코인에 대해서 알려드리겠습니다.\n세계 최초 스마트폰 채굴 암호화폐 파이코인은 150개 이상의 국가에서 40여개 언어로 운영되고 있는 가상화폐입니다.\n파이네트워크(Pi Network)는 미국 스탠퍼드 대학교 박사 출신들이 개발한 모바일 마이닝 프로젝트입니다.\n현재는 전세계 글로벌 누적 1000만명 넘게 참여하여(최근) 파이코인을 채굴 하고 있습니다.(1000만명 반감기를 맞이해 채굴량이 반으로 감소합니다 자연스럽게 희소가치가 올라가게 됩니다)\n비트코인도 무료로 채굴되었던 시기가 있었던만큼 전세계 압도적으로 속도가 빠르고 인지도 있는 파이코인을 미리 선점해 채굴하신다면 향후 좋은 결과가 생기리라 자신합니다!\n스마트폰 데이터나 배터리가 닳거나 해킹,광고,사기 등과는 전혀 관련없으니 마음 편하게 설치 후 24시간마다 한번씩 클릭만 해주시면 됩니다.\n*블로그 가장 하단부에 소개하고 있는 Bee Network 또한 2020년 12월3일 나온 신생코인이므로 꼭 다운 받으시기 바랍니다 Pi와 유사한 점이 많은 코인으로 4번의 반감기를 맞이한 Pi보다 한번의 반감기를 맞이한 Bee는 상대적으로 훨씬 많은 코인을 채굴할 수 있습니다(반감기 한번 거칠때마다 전체 채굴속도 50%씩 감소하게 됩니다)이것은 극초기 코인 마이닝의 절대적인 이점입니다!! 그리고 구글 정식 앱스토어에 출시한 앱으로써 당연히 검증되서 나온 것이므로 해킹위험 전혀 없습니다 안심하세요^^\n1.플레이스토어-파이코인 검색 후 설치\n2. 파이네트워크 회원가입\n3.Get started 클릭해주고, Tap to earn 눌러주고 계속 start 엔터만 클릭해주면 채굴되기 시작하며, 채굴 된 수량은 가장 상단에 나타납니다.\n4. 회원가입시 추천인등록\ninvitation code : kant5\n추천시 좋은점 : 코인을 하나 무료로 얻을 수 있고, 속도0.2%퍼씩 더 빨라진다.\n파이코인 1개에 시세가 얼마입니까?\n2020년 10월 16일 기준으로 15달러 정도입니다.\n중국은 한국보다 거래가 원활하며, 미국시세로는 1파이당 100달러까지 치솟았습니다.(거래규모는 아직 작습니다 전세계 테스터300명 한정)\n현재 비상장 상태라 거래는 일부 인원에 한해서만 가능합니다만, 그럼에도 시간이 지날수록 계속 올라가고 있으므로 지금 모아두었다가 나중에 판매하시는걸 추천합니다.\n시간이 흘러갈수록 파이코인의 난이도는 상승하고 채굴량은 줄어들고 있다는걸 명심하십시오\n추천인 kant5 등록하시고 365일 24시간 채굴하는 제 속도버프 받으세요\n첫 추천인이 정말 중요합니다!\n(7개월차 항시채굴중 제 어닝팀 500명 돌파하였습니다!!)\n(채굴이 시작되면 24시간 단위로 세션이 종료됩니다. 24시간 후 다시 번개버튼을 눌러주시면 됩니다.)\n*코인마켓캡에 비상장코인으로는 최초로 그 이름이 등재되었으며 최근에는 암호화폐 전문가들도 세계적인 판도를 바꾸게 될것이라고 정식도서를 통해 추천하기 시작하였다.(휴대폰 인류의 블록체인 디파이 혁명 참고)\n*최근 소식 : 현재 Pi Coinvention 이 미국시간 기준 2020.10.15~29일까지 진행되었으며 최근 파이유저 공식 1000만명을 돌파하여 반감기가 적용되었습니다!\n(채굴중지는 아직 이르다고 봅니다)\n파이코인에 대해서 의구심을 갖거나 믿음이 없어서 주저하시는 분들 or 코인에 가치나 행보에 대해 정보를 얻고 싶으신분들 or 가입방법이나 방패형성,kyc,최근소식 등의 정보를 얻고 싶으신 분들은 제 어닝팀 채팅방 @kant5`s earning team(파이앱 실행하시면 메인화면 번개표시 바로 위에 사람 문양 클릭->어닝 팀 채팅하기 누르시면 저 포함 500명의 어닝팀 채팅방에 참여하게 됩니다)\n(현재는 7개월차 500명이지만 계속 늘어나고 있는 추세입니다)\n제 어닝팀 채팅방 오시면 정말 친철하고 상세히 알려드립니다.\n같이 정보도 공유하고 채굴 독려도 하면서 대박나는 그날까지 함께 힘내보아요!\n다음은 한국에서 최근에 발간된 블록체인관련 저서입니다\n한국에서 내노라하는 법조계 교수진 기업체회장들이 공동저자로 내놓은 블록체인 관련 저서내용중 파이코인에 관한 내용이 상당부분 차지하고 있습니다\n직접 확인해보세요!!\n디파이 혁명의 표지입니다\n디파이 혁명의 목차입니다\n디파이혁명 내용중 ""파이코인""에 대한 설명입니다\n다음은 이 책의 공동저자입니다.(검색하셔도 간단히 나온답니다)\n구태언 법무법인 Tek&Law 변호사, 박성준 동국대 교수, 김형중 고려대 교수, 한국IoT 블록체인 기술연구조합 대표, 김형주 블록체인산업진흥협회 이사장, 신근영 블록체인 스타트업협회 회장, 안동수 블록체인 기업진흥협회 부회장, 박한식 테크월드 회장.\n아직도 채굴을 망설이십니까?\n파이코인은 스캠이 아닙니다.\n디지털 금입니다.\n*10월말 컨밴션 행사가 끝났고 2020년 12월 8일 기준으로 공식 1000만명 돌파 반감기를 맞이해 채굴속도가 반으로 줄었습니다(희소가치가 올라감)\n*그리고 2021년안에 메인넷을 실행한다 합니다!(니콜라스 개발 자 오피셜입니다 메인넷을 실행하게 되면 거래소 상장과 채굴중지가 가능해집니다!!!!)\n늦기전에 하루라도 빨리 파이 무료채굴을 시작하세요!!\n*Pi에 관한 꼭 필요한 정보를 모아놨어요 Pi시작하신 분들은 꼭 블로그 오셔서 참고 바랍니다!\nhttps://blog.naver.com/kant685\nkant685님의 블로그 : 네이버 블로그\n안녕하세요 뒤늦게 재테크 관련 블로그 시작해봅니다 한번 읽어보고 가세요~!\nblog.naver.com\n<<<그리고 Pi외에도 3가지 코인을 더 소개해 드리겠습니다>>>\n(신생코인들입니다 신생코인은 극초기 선점 마이닝이 정말 중요합니다!)\n특히 Aibox와 Chainge는 추천입니다 Aibox는 설치할때 백신에 감지되는데 무시하시고 백신프로그램 실시간감시 off 또는 지웠다가 Aibox 깔고나서 다시 설치하시면 됩니다!\n(무시하셔도 되는 이유는 Aibox 소개 블로그 링크에 설명해놨습니다)\n*하단에 네이버 블로그주소 링크 지원이 안될수도 있으니 불편하시더라도 복붙하여 살펴보시기 바랍니다 \n중요한 내용들이 많습니다! \n링크지원이 안되시면 불편하시더라도 블로그주소 ctrl+c ctrl+v 부탁드리겠습니다!)\n*파이코인은 장기 프로젝트로 길게 보셔야합니다(비트코인 이더리움도 초창기 무료채굴 되었던 것처럼요)\n*파이코인외 나머지 소개해드리는 코인들도 다 백서와 기술 전망이 밝고 분명하여 제2의 pi가 될 가능성을 충분히 지닌 코인들입니다!\n*돈이 되는 그날까지 하루도 놓치지 않고 꾸준하게 끝까지 함께하실분 모십니다!!(전부무료입니다)\n(저는 365일 연중무휴 4종코인을 돌리고 있어서 제 코드를 등록하시게 되면 무한 채굴속도버프 받으십니다!)\n*핸드폰 배터리,데이터,수명,해킹 등 일체 관련 없습니다!!\n1. Chainge(극초기)\n--자체적인 탈중앙화 시스템에 도전하는 3월 출시예정인 Chainge 금융코인\n--Chainge코인 홍보시스템에 따라 직추천 1세대 10 포인트 2세대 3포인트\n--3세대 1포인트(10 - 3 - 1)의 포인트로 변환\n--포인트만큼 1:1 비율 토큰발행(1포인트=1chainge)\n--1월7일 부터 시작한 이벤트이며 3월 출시전까지 유효하며 거의 알려지지\n않았으니 미리 선점하세요!(가입시 70~110포인트를 얻으며 중복가입은 되지 않습니다)\n가입방법------->https://blog.naver.com/kant685/222207615990\n(블로그 주소로 가시면 Chainge 개발진이 만든 유투브 영상이 소개되어 있습니다)\n2. Aibox(초기,추천)\n--2020년 12월8일 출시해 채굴생산량 총 19억개 한정\n--세계2위 거래소 후오비와의 스마트체인 공식 파트너 체결\n--BeeSwap의 공식 파트너 체결\n--BeeSwap협업의 첫 성과물 Ghost miner출시\n--Aibox를 채굴하는 이용자에게\n<<1+1 동시채굴지원으로 Aibee코인 무료지급>>\n가입방법------->https://blog.naver.com/kant685/222182443901\n3. Pi Network(필수)\n--스탠퍼드대 박사진들이 개발, 2019년 3월 출시된 스마트폰 무료채굴계의 비트코인\n--2020년 12월 1000만명 돌파, 4번째 반감기 실행완료\n--kyc인증 테스터 일부 파이코인 개당 10~100달러 사이 거래가능\n--2021년 안에 메인넷 진행예정\ninvitation code(추천) --------> kant5\n가입방법------->https://blog.naver.com/kant685/222166163147\n(블로그 주소로 가시면 고려대학교 암호화폐도서로 선정된 책의 문구중 파이코인에 대해 자세히 기술되어 있습니다)\n4. Bee Network(초기)\n--2020년 12월3일 Pi코인을 롤모델로 출시\n--홍콩 게임앱 블록체인으로 Pi코인의 반감기, 채굴형식, p2p거래 등을 본따 개발중\n--100만명 2번째 반감기를 거치고 12개국 언어지원 완료\n--역대급 빠른 속도로 300만명 돌파\nReferral code(추천) --------> kant5\n가입방법------->https://blog.naver.com/kant685/222176971001\n5. TimeStope(초기)\n--2020년 10월에 출시한 pi코인을 참고한 한국형 파이코인\n--가격변동없이 고정 15원으로 매년마다 한번 현금으로 유저에게 보상\n가입방법------->\n1.구글 앱스토어 가셔서 timestope 치시고 다운완료 후 가입\n2.Sign up에서 본인아이디 입력란 밑에 Witness(추천) --------> kant5\n3.영문이름 입력란 오른쪽 SAME 클릭은 절대 X\n4.타임 앱 실행 후 가장 오른쪽 하단 달력 클릭후 지구본 클릭(24시간마다 한번)\n꾸준함이 중요합니다\n경험상 가장 좋은 방법은 취침전 몰아서 한번씩 클릭해 주는것이 가장 편합니다!\n다음 반감기가 오기전에 또 더 늦기전에 서둘러 채굴하여 미리 선점하시는게 무조건 유리합니다!!\n같은팀이 되어 진심으로 서로서로 잘 되었으면 합니다!\n감사합니다!!', '사무직하시는거면\n아무래도 컴퓨터는 잘다루실꺼같아요\n글쓰기포스팅부터\n다양한 30가지수익아이템으로\n재미있게 수익낼수있는 부업은 어떻습니까?\n휴대폰이나 컴퓨터로만\n원하는시간대에 \n수익낼수있으며\n초기비용있지만 100%환급되십니다\n제프로필보시면 링크있으니깐 글읽어보시고\n언제든지문의주세요', '안녕하세요!\n이직 준비중이신가요?\n저같은 경우는 작장에 다니면서 직업병으로 인한\n어깨와 손목통증으로 오랫동안 다닐 수 없다고 판단이 되어 다른 일자리를 알아보다가 찾은 사업을 공유하려합니다\n유명 대기업에서 시작한 플랫폼 사업으로\n하루 한두시간 투자로 육체적 노동이 없어 많은 분들이\n부업으로도 참여하여 수익을 얻고 계시더라구요.\n •비용없는 온라인 마케팅 교육\n •팀원과 함께하는 시스템\n •리스크가 없는 부업\n •인세 소득 가능한 수익구조\n저는 시작하지 않았으면 정말 후회할뻔 했습니다.\n비대면 시대에 알맞는 비젼 있는 사업 시작하실 분들!\n자세한 내용이 궁금하시다면 아래링크 확인해보시고\n설문조사 작성해보세요!\n편하신 시간에 연락드리겠습니다^^\nhttp://naver.me/5aVOKLSl\n[대기업 플랫폼 비지니스 설문조사]\nnaver.me\n*리치패밀리는 합법적인 네트워크 사업을 하는 팀이며\n수익을 보장하지 않습니다\n*함께 네트워크 마케팅 활동을 할 비지니스 파트너 모집이 주 목적입니다', '무료채굴, \ufeff제2의 비트코인. 중국에서 어플 다운로드 상승세 1위, 하루 5초면 가능\n하루 1번 클릭으로 채굴합니다. (휴대폰)\n2020년 12월에 오픈을 해서 채굴 속도가 말도 못하게 빠릅니다. 당연히 해야지요.\n자세한 내용은 링크 참조요. 극초기 단계이니 꼭 채굴하십시오\nhttps://m.blog.naver.com/jhj800618/222185033725', '안녕하세요~\n마케팅 회사에서 \n리뷰어 (키워드) 알바 모집 합니다 !\n단순 업무라 초보자/주부/직장인투잡 가능입니다 !\n궁금하신 점 있으시면 따로 쪽지나 카톡 주셔도 되세요 !\n키워드 검색 리뷰어 모집\n✔️ 800명 리뷰어 참여중 \n✔️ 리워드당 100원 \n✔️ 핸드폰 1분 투자 !\n✔️ 가이드 제공 !!\n✔️ 쉽고 간단한 작업 \n✔️ 조건 :\n네이버 아이디 있으신 분 !\n✔️ <!!!!!전용 작업 공지방은 사담 금지입니다 !!!!!>\nhttps://open.kakao.com/o/gUfgr2Dc\n개인 톡 문의 : https://open.kakao.com/o/sJ4QL1Uc', '제 블로그에 부업에 관한 무료코인에 관한 내용이 자세하게 나와있습니다.\n확인해보시면 절대 후회하지 않습니다.\n절대로 사기아니닙니다.\n컴퓨터만 켜놓기만 하면 됩니다.\nhttps://blog.naver.com/ppogura/222174662750\n비트코인채굴보상 입금받기 컴퓨타computta.com\n정말로 비트코인을 줄까?conputtal.com에서 비트코인을 정말 받을 수 있을까?의문이 들었지만 손해보는건 ...\nblog.naver.com', '저녁에 배달도 뛰고있는데 차이가 큽니다.\n몸이 확실히 힘들긴해요..\n대신 정신적인 스트레스가 적더라구요\n//////////////////////////////////////////////////////////////////////////////////////////////////\n틱톡 추천인 : E8442288 엠브레인 추천인 : mant2008\n추천인 입력하시고 시작하시면 5000원받고 시작하실 수 있으십니다.\n틱톡 이벤트로 진짜 쉽게 최대 15000원 받을 수 있어요! 요즘 코로나라 밖에 나가서 일하기도 무서운데.. 틱톡으로 하루 간단한 미션 + 추천인으로 용돈버니 다행이에요. 요즘 하고 있는 앱테크 중에 제일 수익 좋은 것 같아서 하루도 안 빠져먹고 하고 있어요 ㅋㅋ 지금 설날 이벤트 중이라 7일 연속 시청시 5,000원 추가 지급이에요!\n1) 앱스토어나 플레이스토어에서 틱톡 다운로드 해주세요.\n2) 틱톡 회원가입 간편이라 인증 필요 없어요~ [성인, 생년월일로 입력]\n3) 오른쪽 하단에 (나) 사람모양 클릭해주세요\n4) 왼쪽 상단에 노란색 틱톡표시 클릭!\n5) 중앙에 초대코드 입력하기 ( E8442288 ) -> 하시면 바로 6천원 받아요!\n(추천코드 반드시 확인해서 입력)\n6) 여러가지 미션하면 하루 1400원씩 추가적립으로 2만원까지 받으실 수 있습니다!\n7) 이렇게 버신 돈은 바로 페이코 앱으로 자체 현금화 - 출금 가능해서 부업으로 쏠쏠하게 버실 수 있어요 ㅎㅎ\nE8442288 추천인 코드 입력해 주시면 일단 6천원이 무조건 적립되고 시작됩니다! 정해진 간단한 미션만 일주일 완료하면 최고 30,000원까지 받아보실 수 있어요!']",11,https://kin.naver.com/qna/detail.naver?d1id=11&dirId=110412&docId=380509859&qb=67Cx7Iug&enc=utf8&section=kin&rank=87&search_sort=3&spq=0,기술가정
10,2021.01.31,[],구글메일 피싱 질문드립니다.,"구글 스펨함에 이상한 메일이 있길래 호기심에 한번 열어봤는데 피싱같아서 내용만 읽고 지웠는데 좀 찜찜한게 있어서요

시기가 대략 한두달 정도됐고, 외국인이 구글메일로 자기 직업 밝히고 사진도 한장 보내서 자기는 사랑하는 사람을 찾고있다고 자기는 어디살고 무슨일을 하고있으며 이렇게 생겼다라고 사진한장을 보내줬는데 그 메일을 답장을했고 사진은 그냥 클릭만하고(누르면 바로 봐지는거)다운 받지 않았는데 무슨 문제가 될까요?","['이메일 내용을 확인하고 사진 미리보기만 했으면 문제가 될 가능성은 거의 없습니다.\n답변 메일을 보내면서 개인정보를 전혀 노출하지 않았다면 이 또한 문제될 가능성은 거의 없습니다.\n그래도 걱정된다면\n백신 앱을 설치해서 바이러스 검사를 해보고,\n구글 계정 관리의 보안 메뉴로 가서\n낯선 흔적이 있는지 살펴보는 것도 좋습니다.']",1,https://kin.naver.com/qna/detail.naver?d1id=1&dirId=1060305&docId=380505152&qb=67Cx7Iug&enc=utf8&section=kin&rank=95&search_sort=3&spq=0,구글
10,2021.01.31,[],북한원전 뭐 때문에 사람들이 화난 거예요?,"정치에 대해 모르고 어려워서요...
원전 지으면 어떻게 되는 거예요?","['기레기들이 가짜뉴스 퍼트려서요.', '1. 일단 우리나라 전기도 그다지 많은 상황이 아닌데 굳이 우리도 없는 상황에서 북한에 지어줄 이유가 있냐는 게 첫 번째 이유입니다.\n2. 원전에서 사용하는 핵연료를 핵폭탄 관련 기술에 사용할 여지가 전혀 없는 게 아니기에, 섣불리 지어줄 수 없습니다.\n위에 적은 두 가지 이유만으로도 충분히 설명이 됩니다ㄷ...', '예를 들어서\n님이 부모님한테 용돈을 받았슴\n근대 님이 그돈을 부모님이랑 사이 안좋은 사람한테\n기부함\n그리고 님이 다시 부모님한테 용돈 달라함\n부모님이 화내심\n여기서 님은 문재인 대통령이고 \n부모님은 국민\n사이안좋은사람은 북한임', '한마디로 북한에대해 무조건식의 퍼주기정책때문이죠.\n북한에 실제로 원전을 지어주는건 현상황에선 UN과 미국의 대북제재땜에 사실상불가능합니다.\n근데 그런생각을 실제로 계획을 세워서 진행했다는게 특히나 이문건이 문대통령의 남북정상회담 즈음에 작성된것으로 알려져서 파문이 일어난거죠.\n사실 민주당정권에선 북한에대한 지원이 기본입니다.\n정세균총리도 백신접종후 남는게 있다면 북한에 지원도 가능하다고했고 뭐 통일부장관과 국정원장은 두말이 필요없는 대북지원파입니다.\n힘을합쳐서 북핵문제를 해결하기도 벅찬데 북한에대해 어떠한 북핵진전도 없이 원전을 지어준다면 사실상 김정은 체제를 유지시켜주는 돈줄역할밖에 안되며 그것도 코로나로 힘든 국민들은 뒤로한체 혈세를들여서 북한에 지원한다는데 대해 국민들이 분노하는거죠.']",4,https://kin.naver.com/qna/detail.naver?d1id=6&dirId=61303&docId=380501613&qb=67Cx7Iug&enc=utf8&section=kin&rank=97&search_sort=3&spq=0,사람과 그룹
8,2021.01.31,[],컴퓨터를 켜면 갑자기 서든어택 광고소리가 나와요,"뭐 인터넷 창 켜지는 것도 아니고 빈 바탕화면에 소리만 나와요..
이거 왜 이래요? 바이러스 먹은 걸까요? ","['PC에 악성코드가 있는지 없는지 확인하는 가장 좋은 방법은 백신프로그램으로 전체검사를 수행해 보는 것이 가장 좋습니다.\n개인적으로 사용하시는 백신프로그램이 있으시다면 그것으로 전체검사를 수행해 보세요.\n간혹 지워지지 않고 리부팅하면 되살아 나는 악성코드나 백신에서 탐지를 못하는 악성코드도 있습니다.\n이러한 악성코드들은 오프라인 검사를 통해서 어느정도 해결할 수 있습니다.\n윈도우디팬더는 윈도우10 사용자는 모두 설치 되어 있기 때문에 윈도우 디팬더를 통해서 검사 진행해보세요.\n옵션은 4가지가 있지만, 악성코드 감염의심 상황이 있기 때문에 오프라인 검사를 수행해보시면 됩니다.\n방법은 아래링크를 참고하세요.\nhttps://www.youtube.com/watch?v=NJrJi58YvfQ\n빠른검사 : \n일반적인 상황에서 악성코드 감염이 자주 발생하는 영역에 대해서 빠르게 검사를 수행합니다.\n시간은 시스템에 따라 다르지만 대략적으로 10~30분 사이 정도에 검사를 수행 합니다.\n빠른 검사는 시간이 오래 걸리지 않기 때문에 자주 수행하셔도 무방 합니다.\n전체검사 : \n전체 검사는 컴퓨터의 모든 디스크에서 모든 파일 및 실행 프로그램을 검사합니다. 1시간 시간이 걸릴 수도 있으며, 하드디스크 용량이나 컴퓨터의 성능에 따라서 검사시간은 크게 차이가 발생 합니다. 장기간 검사를 수행하지 않았거나 악성코드 감염에 대한 의심이 있는 경우에는 전체검사를 수행하는 것이 좋습니다. 또는 자기전에 돌려 놓고 주무시는 것도 하나의 방법 입니다.\n사용자지정검사 : \n사용자 지정 검사는 특정 폴더를 선택해서 검사를 수행하는 것으로 특정폴더(USB, 다운로드 폴더, 새로 연결한 HDD, 등)에 대한 검사를 수행하고 싶을 경우에 사용할 수 있습니다. 사용자 지정 검사를 선택한 후에 지금검사를 선택하면, 파일 목록이 팝업 창이 발생 합니다. 거기서 원하는 폴더를 선택하면 해당 폴더에 대해서 검사를 수행할 수 있습니다.\n오프라인검사 : \nWindows Defender에만 있는 오프라인 검사 기능 입니다. 일부 악성코드는 메모리에만 상주하고 있으며, 삭제를 한다하더라도 리부팅 할때마다 아시 업로드 되는 악성코드들이 있습니다. 또는 삭제를 방지하기 위한 여러가지 안티AV기능을 포함하고 있기도 합니다. 이러한 경우에 오프라인 검사를 통해서 일반적으로 탐지하거나 삭제할 수 없는 악성코드를 탐지 할 수 있습니다. 오프라인 검사를 시작하면 시스템이 재부팅 되기 때문에 반드시 사용중인 프로그램이 있다면 저장하고 닫은 다음에 수행하시면 됩니다.']",1,https://kin.naver.com/qna/detail.naver?d1id=1&dirId=11002&docId=380515821&qb=67Cx7Iug&enc=utf8&section=kin&rank=79&search_sort=3&spq=0,바이러스
