page,date,tags,questions,questions_add,answers,N_answer,url,category
4,2020.08.01,[],"코로나때문에 외출를 안하고 있어요
주기적 검진하는 병원도 갈지말지 고민할정도로
집에만 있는데 아직도 종식이 안됐는데
왜 외출하는건가요? 종식될 때까지 바깥생활 안하는
제가 이상한건가요? 취준도 코로나가 국내발생하고
난 다음부터 안하고 있어요",,"['네. 많은 사람들이 코로나 때문에 외출을 안합니다.\n질문자님만 특이한게 아닙니다.\n외출하는사람들은 급한일이 있다거나 꼭 나가야 할일이 있다거나\n집에 있는게 답답해서 싫어해서 위험감수하곤 ㅏ가는거죠. \n님이 이상한게 아닙니다.\n국내 발생하고 저도 외출을 자제하고 있습니다.\n지금 시기에는 외출안하는게 좋아요.', '아뇨 제일 안전한 방법이기도 하지요.\n본인 스스로가 자택 생활에 문제만없다면 이보다 좋은 방법은없습니다.\n백신은 올해 연말에 미국에서 1~2종 발표\n임상실험 3상에 들어간 미국의 모더나가 가장 앞서서 개발하고있습니다\n3상마저 성공한다면 백신으로써 발표되며\n보급은 내년 상반기로 예상하고있습니다\n조금만 견뎌내시길 바랍니다\n========= 현재 특가 상품 ==========\n!!아디다스 여름 특별 기획전!! \n▶https://coupa.ng/bHcSwv\n!!SNS에서 난리인 다이어트 음료 헐리우드 48시간 원조 클렌즈 음료! 32% 할인행사중!!\n▶https://coupa.ng/bFQWrX\n!! 삼성 가전 브랜드 위크 40% 할인 행사중!!\n▶https://coupa.ng/bFURsZ\n!! 여름 신상 뷰티 용품 행사 기획전 81% 할인중!!\n▶https://coupa.ng/bGbK0f\n!!뱃살 다이어트 품목 행사 할인중!!\n▶https://coupa.ng/bFQW5K\n!!갤럭시 버즈 플러스 BTS 에디션 한정판 출시!!!\n▶https://coupa.ng/bFI0JJ\n오늘의 특가 세일 리스트 최대 50%\n▶https://coupa.ng/bGowm2\n!!게이밍 컴퓨터 특집!! 할인중!!\n▶ https://coupa.ng/bFBalZ\n!!쿠쿠 브랜드 특가 할인 행사중!!\n▶https://coupa.ng/bFQXhO\n!! 에어컨 할인 특가 한눈에 보기 !!\n▶ https://coupa.ng/bEYoii\n!! 여름 가전 특가 한눈에 보기 !!\n▶https://coupa.ng/bEYmWF\n!! 인터넷 방송 장비 특가 한눈에보기!!\n▶https://coupa.ng/bFBezN\n여름 향수 브랜드 전품목 최대 60% 세일중\n여자 여름 향수 특가 한눈에 보기\n▶ https://coupa.ng/bEhHHz\n남자 여름향수 특가 한눈에 보기\n▶https://coupa.ng/bEhHQk\n행사중!! 썸머 화장품 기획전 브랜드 상품 최대 64% 할인행사중입니다.\n인기 여름 화장품 한눈에 보기 \n▶ https://coupa.ng/bEhOo0\n물과 땀에 지워지지않는 워터프루프 제품 한눈에 보기\n▶ https://coupa.ng/bEhKP0\n안마의자 최대 64% 할인 기획전\n▶ https://coupa.ng/bD3eFd\n모여봐요 동물의 숲 할인 행사중!! \n▶ https://coupa.ng/bD3fsq\n게이밍 모니터 특가 행사중\n▶ https://coupa.ng/bDZOfQ\n게이밍 데스크탑 특가 행사중\n▶ https://coupa.ng/bDZOpv\n냉장고 특가 한눈에 보기\n▶ https://coupa.ng/bDZQvO\n주방 가전 특가 한눈에 보기\n▶ https://coupa.ng/bDZSVk\n김치냉장고 특가 한눈에 보기\n▶ https://coupa.ng/bD3ez4\n========= 코로나 대비 상품 =========\n!! FDA 인증 여름용 덴탈 마스크 50매/100매 \n▶ https://coupa.ng/bEaIOi\n!! KC 인증 여름용 덴탈 마스크 장당 240원!! \n▶ https://coupa.ng/bEamgg\n!! KC 인증 여름용 덴탈 마스크 50장!!\n▶ https://coupa.ng/bEaIsf\n!! 여름용 쿨 메쉬 원단 마스크 세탁가능\n▶https://coupa.ng/bEaNkR\n<비말 차단 마스크 KF-AD> 특가 한눈에 보기\n▶ https://coupa.ng/bDPwlM\n<덴탈 마스크> 특가 한눈에 보기!\n▶ https://coupa.ng/bCdPT5\n<아이 전용 마스크> 특가 한눈에 보기!\n▶ https://coupa.ng/bDZLnP\n<KF94 필터 마스크> 특가 한눈에 보기!\n▶ https://coupa.ng/bCdP2a\n<면 마스크> 특가 한눈에 보기!\n▶ https://coupa.ng/bCdQiu\n<휴대용 손소독제!> 들고다니면서 뿌려요! 향수같은 향기 \n▶ https://coupa.ng/bAeAnZ\n<휴대용 손소독제!> 깔끔한 에탄올 70% 손소독제! \n▶https://coupa.ng/bAeBpD\n========= 필수 영양제 상품 =========\n필수 <면역력> 영양제 한눈에 보기!\n▶ https://coupa.ng/bCy7C3\n필수 <수험생> 영양제 한눈에 보기!\n▶ https://coupa.ng/bCIyp4\n필수 <다이어트> 에 좋은 영양제 한눈에 보기!\n▶ https://coupa.ng/bCZ7xg\n필수 <정력> 에 좋은 영양제 한눈에 보기!\n▶ https://coupa.ng/bCZ9eH\n필수 <여성> 영양제 한눈에 보기! \n▶ https://coupa.ng/bB5XI2\n필수 <갱년기> 영양제 한눈에 보기!\n▶ https://coupa.ng/bCjf4c\n=========여름 바캉스 패키지=========\n곧 여름 바캉스 시즌입니다. 미리 예약하시고 큰 혜택 보시기바랍니다. 조기 매진 주의\n전지역 프리미엄 펜션 (풀빌라) 20% 할인중 특가 한눈에 보기\n▶ https://coupa.ng/bDZL3V\n제주 여행 특가 행사전 (항공권/입장권/패키지상품)\n▶ https://coupa.ng/bDZNtt\n캠핑 용품 특가 행사중!! 최대 48%\n▶https://coupa.ng/bD7gc0\n낚시 용품 특가 한눈에 보기!!\n▶https://coupa.ng/bD7gvE\n초보자 입문자도 쉽게 낚시 한다 원투 낚시!\n원투 낚시 세트 한눈에 보기!!\n▶https://coupa.ng/bElXmG\n========= 여행 및 생필품 특가 상품 =========\n순백 3겹 라벤더 바닐라 롤 화장지 30롤\n▶https://coupa.ng/bD3c0b\n탐사수 20병 팩 \n▶https://coupa.ng/bD3dkh\n아기 물티슈 100매짜리 10팩\n▶https://coupa.ng/bD3dBt\n농심 육개장 사발면 6개 패키지\n▶https://coupa.ng/bD3dKG\n깨끗한 소중한 우리쌀 \n▶https://coupa.ng/bD3dU0\n======= 오늘의 반찬 특가 =======\n호주산 와규 양념 불고기 (냉장) 100g당 990원\n▶ https://coupa.ng/bD6MFq\n한돈 1등급 삼겹살 구이용 (냉장) 100g당 1466원\n▶ https://coupa.ng/bD6NgR\n한우 1+ 등급 채끝 스테이크 (냉장) 200g \n▶ https://coupa.ng/bD6NvW\n참맛나라 신선한 알이 듬뿍 알탕\n▶https://coupa.ng/bD6OSW\n빠네 크림 파스타\n▶https://coupa.ng/bD6OZe\n리코타 치즈 샐러드 2팩\n▶ https://coupa.ng/bD6N1S\n채소믹스 패키지 요새 핫한제품입니다!\n▶ https://coupa.ng/bD6OhK\n삼립 아침엔 우유토스트 식빵 2팩 3960원\n▶ https://coupa.ng/bD6Oqm\n춘천 닭갈비 (냉장) 특가 세일중\n▶ https://coupa.ng/bEv3Q8\n충남 농협 GAP 인증 대추방울 토마토 1KG 4900원 특가 행사중\n▶ https://coupa.ng/bEv31P\n동원 비엔나 소세지 1KG 3980원 특가 행사중\n▶ https://coupa.ng/bEv4dc\n파트너스 활동의 일환으로 일정액의 수수료를 제공 받습니다.']",2,https://kin.naver.com/qna/detail.naver?d1id=6&dirId=61303&docId=364098529&qb=67Cx7Iug&enc=utf8&section=kin&rank=39&search_sort=3&spq=0,사람과 그룹
2,2020.08.01,[],노트북 호스트파일 변경시도..이게뭐죠???!!,이것이 떳는데 이게뭔지 자세히 알려주실분 ㅠㅠ 위험한건 아니겠죠??,['호스트 파일은 우리가 사용하는 IP주소마다 호스트 이름을 알려주는 텍스트 파일이라고 생각하시면 됩니다. 호스트 파일이 변조될시 파밍을 통해 해킹 당하실 수 있습니다. 백신이 잘 걸러냈네요. 백신 검사 한번 돌려보시는걸 추천드립니다.\n“ 도움이 되셨다면 채택 부탁드립니다 :D “'],1,https://kin.naver.com/qna/detail.naver?d1id=1&dirId=10102&docId=364117545&qb=67Cx7Iug&enc=utf8&section=kin&rank=19&search_sort=3&spq=0,노트북
3,2020.08.01,[],어쩌면 이 지긋지긋한 코로나,금년 1월인가 2월달에 시작되어 지금까지 계속 기승을 부리고 있는 코로나가 있습니다. 지금의 이 코로나가 생각보다 오래가고 있습니다. 그래서 어쩌면 이 지긋지긋한 코로나가 금년 연말이 되어도 안끝나는것 아닐까요? 왜 코로나가 아직도 안끝나고 있습니까? 도대체 뭘 어떻게해야 코로나가 끝날까요?,"['백신 나오고 전국민 접종 되야 종료\n내년 되야 종료 ㅜ', '코로나는 독감처럼 해마다 사람들을 괴롭힐 겁니다.\n독감은 독한 감기가 아니라 인플루엔자에 의해 감염되죠.\n신종플루 할때의 그 플루가 인풀루엔자를 뜻합니다.\n독감은 백신도 있고 치료제도 있지만 해마다 독감으로 아주 많은 사람이 죽어 나가죠?\n그와 마찬가지로 코로나도 백신이나 치료제가 나온다하여 완전히 퇴치하기 어렵습니다.\n다만 백신과 치료제가 나온다면 피해를 줄일 수 있는 거지요.', '연말? 내년까지보셔야죠\n내년 상반기에 보급됩니다 백신이\n백신이나와야 해결되는겁니다.\n안끝나는이유요?\n몸에서 항체가 안만들어지는 바이러스니까요\n========= 현재 특가 상품 ==========\n!!아디다스 여름 특별 기획전!! \n▶https://coupa.ng/bHcSwv\n!!SNS에서 난리인 다이어트 음료 헐리우드 48시간 원조 클렌즈 음료! 32% 할인행사중!!\n▶https://coupa.ng/bFQWrX\n!! 삼성 가전 브랜드 위크 40% 할인 행사중!!\n▶https://coupa.ng/bFURsZ\n!! 여름 신상 뷰티 용품 행사 기획전 81% 할인중!!\n▶https://coupa.ng/bGbK0f\n!!뱃살 다이어트 품목 행사 할인중!!\n▶https://coupa.ng/bFQW5K\n!!갤럭시 버즈 플러스 BTS 에디션 한정판 출시!!!\n▶https://coupa.ng/bFI0JJ\n오늘의 특가 세일 리스트 최대 50%\n▶https://coupa.ng/bGowm2\n!!게이밍 컴퓨터 특집!! 할인중!!\n▶ https://coupa.ng/bFBalZ\n!!쿠쿠 브랜드 특가 할인 행사중!!\n▶https://coupa.ng/bFQXhO\n!! 에어컨 할인 특가 한눈에 보기 !!\n▶ https://coupa.ng/bEYoii\n!! 여름 가전 특가 한눈에 보기 !!\n▶https://coupa.ng/bEYmWF\n!! 인터넷 방송 장비 특가 한눈에보기!!\n▶https://coupa.ng/bFBezN\n여름 향수 브랜드 전품목 최대 60% 세일중\n여자 여름 향수 특가 한눈에 보기\n▶ https://coupa.ng/bEhHHz\n남자 여름향수 특가 한눈에 보기\n▶https://coupa.ng/bEhHQk\n행사중!! 썸머 화장품 기획전 브랜드 상품 최대 64% 할인행사중입니다.\n인기 여름 화장품 한눈에 보기 \n▶ https://coupa.ng/bEhOo0\n물과 땀에 지워지지않는 워터프루프 제품 한눈에 보기\n▶ https://coupa.ng/bEhKP0\n안마의자 최대 64% 할인 기획전\n▶ https://coupa.ng/bD3eFd\n모여봐요 동물의 숲 할인 행사중!! \n▶ https://coupa.ng/bD3fsq\n게이밍 모니터 특가 행사중\n▶ https://coupa.ng/bDZOfQ\n게이밍 데스크탑 특가 행사중\n▶ https://coupa.ng/bDZOpv\n냉장고 특가 한눈에 보기\n▶ https://coupa.ng/bDZQvO\n주방 가전 특가 한눈에 보기\n▶ https://coupa.ng/bDZSVk\n김치냉장고 특가 한눈에 보기\n▶ https://coupa.ng/bD3ez4\n========= 코로나 대비 상품 =========\n!! FDA 인증 여름용 덴탈 마스크 50매/100매 \n▶ https://coupa.ng/bEaIOi\n!! KC 인증 여름용 덴탈 마스크 장당 240원!! \n▶ https://coupa.ng/bEamgg\n!! KC 인증 여름용 덴탈 마스크 50장!!\n▶ https://coupa.ng/bEaIsf\n!! 여름용 쿨 메쉬 원단 마스크 세탁가능\n▶https://coupa.ng/bEaNkR\n<비말 차단 마스크 KF-AD> 특가 한눈에 보기\n▶ https://coupa.ng/bDPwlM\n<덴탈 마스크> 특가 한눈에 보기!\n▶ https://coupa.ng/bCdPT5\n<아이 전용 마스크> 특가 한눈에 보기!\n▶ https://coupa.ng/bDZLnP\n<KF94 필터 마스크> 특가 한눈에 보기!\n▶ https://coupa.ng/bCdP2a\n<면 마스크> 특가 한눈에 보기!\n▶ https://coupa.ng/bCdQiu\n<휴대용 손소독제!> 들고다니면서 뿌려요! 향수같은 향기 \n▶ https://coupa.ng/bAeAnZ\n<휴대용 손소독제!> 깔끔한 에탄올 70% 손소독제! \n▶https://coupa.ng/bAeBpD\n========= 필수 영양제 상품 =========\n필수 <면역력> 영양제 한눈에 보기!\n▶ https://coupa.ng/bCy7C3\n필수 <수험생> 영양제 한눈에 보기!\n▶ https://coupa.ng/bCIyp4\n필수 <다이어트> 에 좋은 영양제 한눈에 보기!\n▶ https://coupa.ng/bCZ7xg\n필수 <정력> 에 좋은 영양제 한눈에 보기!\n▶ https://coupa.ng/bCZ9eH\n필수 <여성> 영양제 한눈에 보기! \n▶ https://coupa.ng/bB5XI2\n필수 <갱년기> 영양제 한눈에 보기!\n▶ https://coupa.ng/bCjf4c\n=========여름 바캉스 패키지=========\n곧 여름 바캉스 시즌입니다. 미리 예약하시고 큰 혜택 보시기바랍니다. 조기 매진 주의\n전지역 프리미엄 펜션 (풀빌라) 20% 할인중 특가 한눈에 보기\n▶ https://coupa.ng/bDZL3V\n제주 여행 특가 행사전 (항공권/입장권/패키지상품)\n▶ https://coupa.ng/bDZNtt\n캠핑 용품 특가 행사중!! 최대 48%\n▶https://coupa.ng/bD7gc0\n낚시 용품 특가 한눈에 보기!!\n▶https://coupa.ng/bD7gvE\n초보자 입문자도 쉽게 낚시 한다 원투 낚시!\n원투 낚시 세트 한눈에 보기!!\n▶https://coupa.ng/bElXmG\n========= 여행 및 생필품 특가 상품 =========\n순백 3겹 라벤더 바닐라 롤 화장지 30롤\n▶https://coupa.ng/bD3c0b\n탐사수 20병 팩 \n▶https://coupa.ng/bD3dkh\n아기 물티슈 100매짜리 10팩\n▶https://coupa.ng/bD3dBt\n농심 육개장 사발면 6개 패키지\n▶https://coupa.ng/bD3dKG\n깨끗한 소중한 우리쌀 \n▶https://coupa.ng/bD3dU0\n======= 오늘의 반찬 특가 =======\n호주산 와규 양념 불고기 (냉장) 100g당\n▶ https://coupa.ng/bD6MFq\n한돈 1등급 삼겹살 구이용 (냉장) 100g당\n▶ https://coupa.ng/bD6NgR\n한우 1+ 등급 채끝 스테이크 (냉장) 200g \n▶ https://coupa.ng/bD6NvW\n참맛나라 신선한 알이 듬뿍 알탕\n▶https://coupa.ng/bD6OSW\n빠네 크림 파스타\n▶https://coupa.ng/bD6OZe\n리코타 치즈 샐러드 2팩\n▶ https://coupa.ng/bD6N1S\n채소믹스 패키지 요새 핫한제품입니다!\n▶ https://coupa.ng/bD6OhK\n삼립 아침엔 우유토스트 식빵 2팩 \n▶ https://coupa.ng/bD6Oqm\n춘천 닭갈비 (냉장) 특가 세일중\n▶ https://coupa.ng/bEv3Q8\n충남 농협 GAP 인증 대추방울 토마토 1KG 특가 행사중\n▶ https://coupa.ng/bEv31P\n동원 비엔나 소세지 1KG 특가 행사중\n▶ https://coupa.ng/bEv4dc\n파트너스 활동의 일환으로 일정액의 수수료를 제공 받습니다.']",3,https://kin.naver.com/qna/detail.naver?d1id=6&dirId=612&docId=364116677&qb=67Cx7Iug&enc=utf8&section=kin&rank=21&search_sort=3&spq=0,재난재해
4,2020.08.01,[],조립컴 구매 후에,"조립컴퓨터 구매 후에 윈도우 설치한 다음 설치해야 하는 것들이 뭐뭐 있나요 ㅠㅠㅠ

막 그래픽카드 드라이버 이런거 다 설치하면 되는건가요,,? 간단한 메뉴얼 알려주시면 정말 감사하겠습니당 ㅠㅜㅜㅜㅜ",['USB 하나 준비해서 그래픽카드랑 메인보드 드라이버 미리 받아놓는게 좋음\nLAN선을 빼놓은 상태에서 윈도우 설치하고 \n윈도우 설치가 끝나면 그래픽카드랑 메인보드 드라이버 설치\n윈도우 디펜더 성능이 좋기 때문에 따로 백신 프로그램은 설치 안해도 됨\nLAN선을 연결한 다음 윈도우 업데이트 최신입니다 더 이상 업데이트 할게 없습니다 뜰떄까지 계속 업데이트\n여기까지가 기본'],1,https://kin.naver.com/qna/detail.naver?d1id=5&dirId=50201&docId=364100463&qb=67Cx7Iug&enc=utf8&section=kin&rank=37&search_sort=3&spq=0,데스크톱
4,2020.08.01,[],코로나 백신은,이제 곧 나오는검가요,"['늦어도 연말 안에는 나오지 않을까요?', '이제 곧 나옵니다. 몇달도 안 남았습니다.\n백신이 나오면 코로나는 확실히 줄어들 것으로 예상됩니다.', 'https://penguinworld9.tistory.com/204\n신종 코로나바이러스(코로나19) 치료제 백신·신약 개발 현황\n신종 코로나바이러스(코로나19)가 전 세계로 확산되고 있다. 코로나19의 확산은 중국을 넘어 한국, 일본, 이탈리아, 이란 등에서 수백 명의 확진자가 속출하고, 사망자도 점점 늘어나고 있다. 이에 코로나19를 치..\npenguinworld9.tistory.com']",3,https://kin.naver.com/qna/detail.naver?d1id=11&dirId=111604&docId=364103579&qb=67Cx7Iug&enc=utf8&section=kin&rank=36&search_sort=3&spq=0,해부학
4,2020.08.01,[],스팀 오류 질문,c드라이브에 용량이 없어서 d드라이브에 게임을 옮긴뒤로 이런 오류가 뜹니다 해결방법좀 알려주세요,['백신 프로그램이 있을 경우 해당 오류가 생길 수 있습니다.\n방법은 간단한데 백신 프로그램 설정에서\n해당 게임이 있는 폴더 경로를 예외설정을 해주신 다음 다시 설치를 해보세요.'],1,https://kin.naver.com/qna/detail.naver?d1id=2&dirId=211&docId=364105751&qb=67Cx7Iug&enc=utf8&section=kin&rank=35&search_sort=3&spq=0,"게임사, 게임사이트"
4,2020.08.01,[],Avast Free Antivirus 라는 앱이 6월 6일 갑자기 설치되었습니다.,"Avast Free Antivirus 라는 앱이 6월 6일 갑자기 설치되었습니다.
바이러스 검사를 한다는 둥, 보호 중이라는 둥 이상합니다.
이 방법 고칠 방법 없을까요?ㅠㅠ",[' 질문자님이 어떻게 의도하지 않게 해당 백신 프로그램이 광고용(유료 버전 구매 유도) 목적으로 끼워팔기 식으로 깔린 것 같습니다. 원하시지 않으신다면 제어판에 가셔서 해당 프로그램을 삭제하셔도 됩니다.'],1,https://kin.naver.com/qna/detail.naver?d1id=1&dirId=11002&docId=364106727&qb=67Cx7Iug&enc=utf8&section=kin&rank=34&search_sort=3&spq=0,바이러스
4,2020.08.01,"['컴퓨터', '바이러스']",이거 뭔가요? 바이러스 인가요? 어떻게 지우나요,이거 사라지게 하는 법좀 알려주세요 컴퓨터 바이러스 인가요,"['그저 다운로드 알림창이고,\n안받으려면 취소버튼 누르시고요.\n시험 관련자료같은데 파일명만으로는 바이러스인지 몰라요.\n압축파일이고 다운받기전에\n윈도우 자체 안티바이러스나 타사 안티바이러스 프로그램 깔아두면\n왠만한 바이러스 자동으로 잡아줍니다.\n보안프로그램 깔려있는지 확인 또는 물어보신 후 진행하세요.\n윈도우10이면 윈도우 디펜더라고 기본 백신 있기도 하구요.']",1,https://kin.naver.com/qna/detail.naver?d1id=1&dirId=11002&docId=364107089&qb=67Cx7Iug&enc=utf8&section=kin&rank=33&search_sort=3&spq=0,바이러스
4,2020.08.01,[],코로나 백신,만약에 올해안에 나온다고 치면 국내에서는 언제 맞을수 있어요?,"['나라마다 다르겠죠.만약 북한도한다는데 북한이 하면 ... 믿음직 스러운 미국이 하다면 몇주 후 가능 하죠', '올해 12월에 미국에서 1~2종 발표\n내년 상반기에 보급됩니다\n========= 현재 특가 상품 ==========\n!!아디다스 여름 특별 기획전!! \n▶https://coupa.ng/bHcSwv\n!!SNS에서 난리인 다이어트 음료 헐리우드 48시간 원조 클렌즈 음료! 32% 할인행사중!!\n▶https://coupa.ng/bFQWrX\n!! 삼성 가전 브랜드 위크 40% 할인 행사중!!\n▶https://coupa.ng/bFURsZ\n!! 여름 신상 뷰티 용품 행사 기획전 81% 할인중!!\n▶https://coupa.ng/bGbK0f\n!!뱃살 다이어트 품목 행사 할인중!!\n▶https://coupa.ng/bFQW5K\n!!갤럭시 버즈 플러스 BTS 에디션 한정판 출시!!!\n▶https://coupa.ng/bFI0JJ\n오늘의 특가 세일 리스트 최대 50%\n▶https://coupa.ng/bGowm2\n!!게이밍 컴퓨터 특집!! 할인중!!\n▶ https://coupa.ng/bFBalZ\n!!쿠쿠 브랜드 특가 할인 행사중!!\n▶https://coupa.ng/bFQXhO\n!! 에어컨 할인 특가 한눈에 보기 !!\n▶ https://coupa.ng/bEYoii\n!! 여름 가전 특가 한눈에 보기 !!\n▶https://coupa.ng/bEYmWF\n!! 인터넷 방송 장비 특가 한눈에보기!!\n▶https://coupa.ng/bFBezN\n여름 향수 브랜드 전품목 최대 60% 세일중\n여자 여름 향수 특가 한눈에 보기\n▶ https://coupa.ng/bEhHHz\n남자 여름향수 특가 한눈에 보기\n▶https://coupa.ng/bEhHQk\n행사중!! 썸머 화장품 기획전 브랜드 상품 최대 64% 할인행사중입니다.\n인기 여름 화장품 한눈에 보기 \n▶ https://coupa.ng/bEhOo0\n물과 땀에 지워지지않는 워터프루프 제품 한눈에 보기\n▶ https://coupa.ng/bEhKP0\n안마의자 최대 64% 할인 기획전\n▶ https://coupa.ng/bD3eFd\n모여봐요 동물의 숲 할인 행사중!! \n▶ https://coupa.ng/bD3fsq\n게이밍 모니터 특가 행사중\n▶ https://coupa.ng/bDZOfQ\n게이밍 데스크탑 특가 행사중\n▶ https://coupa.ng/bDZOpv\n냉장고 특가 한눈에 보기\n▶ https://coupa.ng/bDZQvO\n주방 가전 특가 한눈에 보기\n▶ https://coupa.ng/bDZSVk\n김치냉장고 특가 한눈에 보기\n▶ https://coupa.ng/bD3ez4\n========= 코로나 대비 상품 =========\n!! FDA 인증 여름용 덴탈 마스크 50매/100매 \n▶ https://coupa.ng/bEaIOi\n!! KC 인증 여름용 덴탈 마스크 장당 240원!! \n▶ https://coupa.ng/bEamgg\n!! KC 인증 여름용 덴탈 마스크 50장!!\n▶ https://coupa.ng/bEaIsf\n!! 여름용 쿨 메쉬 원단 마스크 세탁가능\n▶https://coupa.ng/bEaNkR\n<비말 차단 마스크 KF-AD> 특가 한눈에 보기\n▶ https://coupa.ng/bDPwlM\n<덴탈 마스크> 특가 한눈에 보기!\n▶ https://coupa.ng/bCdPT5\n<아이 전용 마스크> 특가 한눈에 보기!\n▶ https://coupa.ng/bDZLnP\n<KF94 필터 마스크> 특가 한눈에 보기!\n▶ https://coupa.ng/bCdP2a\n<면 마스크> 특가 한눈에 보기!\n▶ https://coupa.ng/bCdQiu\n<휴대용 손소독제!> 들고다니면서 뿌려요! 향수같은 향기 \n▶ https://coupa.ng/bAeAnZ\n<휴대용 손소독제!> 깔끔한 에탄올 70% 손소독제! \n▶https://coupa.ng/bAeBpD\n========= 필수 영양제 상품 =========\n필수 <면역력> 영양제 한눈에 보기!\n▶ https://coupa.ng/bCy7C3\n필수 <수험생> 영양제 한눈에 보기!\n▶ https://coupa.ng/bCIyp4\n필수 <다이어트> 에 좋은 영양제 한눈에 보기!\n▶ https://coupa.ng/bCZ7xg\n필수 <정력> 에 좋은 영양제 한눈에 보기!\n▶ https://coupa.ng/bCZ9eH\n필수 <여성> 영양제 한눈에 보기! \n▶ https://coupa.ng/bB5XI2\n필수 <갱년기> 영양제 한눈에 보기!\n▶ https://coupa.ng/bCjf4c\n=========여름 바캉스 패키지=========\n곧 여름 바캉스 시즌입니다. 미리 예약하시고 큰 혜택 보시기바랍니다. 조기 매진 주의\n전지역 프리미엄 펜션 (풀빌라) 20% 할인중 특가 한눈에 보기\n▶ https://coupa.ng/bDZL3V\n제주 여행 특가 행사전 (항공권/입장권/패키지상품)\n▶ https://coupa.ng/bDZNtt\n캠핑 용품 특가 행사중!! 최대 48%\n▶https://coupa.ng/bD7gc0\n낚시 용품 특가 한눈에 보기!!\n▶https://coupa.ng/bD7gvE\n초보자 입문자도 쉽게 낚시 한다 원투 낚시!\n원투 낚시 세트 한눈에 보기!!\n▶https://coupa.ng/bElXmG\n========= 여행 및 생필품 특가 상품 =========\n순백 3겹 라벤더 바닐라 롤 화장지 30롤\n▶https://coupa.ng/bD3c0b\n탐사수 20병 팩 \n▶https://coupa.ng/bD3dkh\n아기 물티슈 100매짜리 10팩\n▶https://coupa.ng/bD3dBt\n농심 육개장 사발면 6개 패키지\n▶https://coupa.ng/bD3dKG\n깨끗한 소중한 우리쌀 \n▶https://coupa.ng/bD3dU0\n======= 오늘의 반찬 특가 =======\n호주산 와규 양념 불고기 (냉장) 100g당\n▶ https://coupa.ng/bD6MFq\n한돈 1등급 삼겹살 구이용 (냉장) 100g당\n▶ https://coupa.ng/bD6NgR\n한우 1+ 등급 채끝 스테이크 (냉장) 200g \n▶ https://coupa.ng/bD6NvW\n참맛나라 신선한 알이 듬뿍 알탕\n▶https://coupa.ng/bD6OSW\n빠네 크림 파스타\n▶https://coupa.ng/bD6OZe\n리코타 치즈 샐러드 2팩\n▶ https://coupa.ng/bD6N1S\n채소믹스 패키지 요새 핫한제품입니다!\n▶ https://coupa.ng/bD6OhK\n삼립 아침엔 우유토스트 식빵 2팩 \n▶ https://coupa.ng/bD6Oqm\n춘천 닭갈비 (냉장) 특가 세일중\n▶ https://coupa.ng/bEv3Q8\n충남 농협 GAP 인증 대추방울 토마토 1KG 특가 행사중\n▶ https://coupa.ng/bEv31P\n동원 비엔나 소세지 1KG 특가 행사중\n▶ https://coupa.ng/bEv4dc\n파트너스 활동의 일환으로 일정액의 수수료를 제공 받습니다.']",2,https://kin.naver.com/qna/detail.naver?d1id=8&dirId=814&docId=364108403&qb=67Cx7Iug&enc=utf8&section=kin&rank=32&search_sort=3&spq=0,기타
4,2020.08.01,[],여자친구랑 뽀뽀하구싶어요,,"['하세요. 그럼.', '하면됨', '이시국에 좀만 참고 백신맞고 하세요']",3,https://kin.naver.com/qna/detail.naver?d1id=6&dirId=61303&docId=364108781&qb=67Cx7Iug&enc=utf8&section=kin&rank=31&search_sort=3&spq=0,사람과 그룹
