page,date,tags,questions,questions_add,answers,N_answer,url,category
7,2020.11.06,"['컴퓨터공학과', '소프트웨어', 'c언어', '프로그래', '컴퓨터소프트웨어', '#코딩']",컴퓨터 공학과 가기전에 해야할 준비,"아아아무것도 모르고 컴공입학하게된 학생입니다
가기전에 준비해야 할게 뭐가 있을까요
초보자를 위한 코딩강의 영상도 봤는데
왕초보자 기준으로 만든 그 영상조차 너무 어려운 단어들이 많이나와서 이해를 못하겠더라고요ㅠㅠ
Java가 c언어와 관련된 단어인지도 모를 정도에요... 그냥 백지입니다 ㅠㅠㅠㅠ
뭐 읽고 뭐를 배워가야 할지 알려주세용..
그리거 뭣모르고 썼는데
코딩을 해서 뭐 개발을 한다 이정도는 아는데
정확히... 어떤 걸 하는지도 알려주시면 감사하겠습니다
지금은 이렇게 백지지만 열심히 할생각이니 한심하게 보진 말아주세요....","['저는 오래전의 컴공 출신이네요.\n과거와 지금은 많이 바뀌었겠지만 경험상 얘기를 해보면\n1. 기본적인 얘기가 되겠지만 수학과 영어를 잘할 수 있어야해요. \n수학은  집합과 같은 이산수학을 의미합니다.\n영어는 능통할 필요는 없지만 남의 코딩을 읽어볼수 있는 어휘능력이 필요한 것같습니다.\n2. 일단 컴퓨터는 잘 사용할 수 있어야할 것 같아요.\n파일관리, 폴더관리, 웹서핑, 오피스 등등\n이런게 늘기로는 컴퓨터 활용능력 같은걸 방학 때 시험봐보면 좋지않을까 싶습니다.\n3. 프로그래밍은 어떤 언어를 알지 못해도 개념을 잡으면 좋을 것같아요\n요즘 엑스퍼트로써 코딩 상담을 하고 있는데 개념을 못잡는 사람에게 \n제가 추천하는 건 온라인 강좌를 들으라고 하는데 \n추천하는 사이트는 엘리스 코딩으로 실습형으로 해볼수 있어 좋은 것같습니다.\nC언어같은 걸 한번 따라해보면 좋겠습니다.\nhttps://blog.naver.com/ytlee64/222097948116\n무료 C언어 교육 사이트-Elice Academy\nhttps://academy.elice.io/courses/434/info엘리스 :: elice파이썬&#...\nblog.naver.com\n4. 꾸준히 뭔가해보는 것이 중요합니다.\n위의 교육사이트도 처음해보면 어려울수 있지만 다시해보고 다시해보가보면 점점 더 알게되는 게 생겨 익숙해질수 있습니다.\n관련해서 정리해놓은 글 참고하세요\nhttps://blog.naver.com/ytlee64/222135330680\n점진적인 반복\n#점진적인반복 은 영어로 #IncrematalIteration반대말은 #폭포수 #Waterfall 입니다.폭포수 모델책을 ...\nblog.naver.com', '안녕하세요~\nit 진학, 진로 온라인 상담 사 입니다 . \n컴공가기전에 공부는 코딩 즉 프로그래밍언어 공부을 하고 가시면 됩니다. \n코딩 즉 프로그래밍언어공부을 처음하시면\nIT전문용어들을 숙지하고 구사할수 있는 it통합기초\nor\n프로그래밍언어 중 기초언어인 파이썬 C언어>C++ >JAVA 순으로 \n공부하시면 큰어려움은 없을 것입니다\n코딩은 무엇일까? 중요한 이유는 ?\n코딩이란컴퓨터언어를 사용하여 프로그램을 만드는 행위입니다.다른 말로는 프로그래밍언어 입니다.코딩이 ...\nblog.naver.com\nKG에듀원 이룸은 어떤 사이트인가요?\nKG에듀원이룸은IT.인테리어,취업/이직 ,경제/경영,자격증온라인으로 볼수 있는온라인강의 사이트입니다...\nblog.naver.com\nIT분야의\n공부방법,자격증. 진학,진로 에 대해\n그동안 궁금하셨던 점이 있으시면\n온라인 무료상담 해드리고 있는\n1:1 카카오톡오픈채팅방으로 연락주시면 자세한 이야기 해드리겠습니다\nIT 분야 공부법 ,자격증 진학,진로,무료상담\n#IT #화이트해커 #IT학과#빅데이터 #인공지능#개발자\nopen.kakao.com', '학과 공부나 미래에 취업이나 창업을 준비하고자 하면, 먼저 컴퓨터공학의 기본이자 핵심인 코딩 다른 말로는 프로그래밍을 제대로 배우도록 하세요.\n코딩 다른 말로는 프로그래밍을 제대로 배우고자 하면, 코딩 다른 말로는 프로그래밍을 체계적이고 전문적으로 배워 창의적인 혹은 창조적인 문제 해결 능력과 프로그래밍 능력을 갖추도록 하세요. 그러면, 나이, 성별, 학력, 전공과 상관없이 누구나 코딩 다른 말로는 프로그래밍할 수 있습니다. 그렇게 먼저 코딩 다른 말로는 프로그래밍을 배우면, 어떠한 프로그래밍 언어라도 보다 쉽고 재미있게 효율적으로 배울 수 있습니다.\nC언어, 파이썬, 자바는 프로그램을 만드는 일인 프로그래밍할 때 사용되는 도구로 프로그래밍 언어입니다. C언어, 파이썬, 자바같은 프로그래밍 언어를 배워야 프로그래밍을 배울 수 있다고 생각하십니까? C언어, 파이썬, 자바같은 프로그래밍 언어를 배우는 것이 프로그래밍을 배우는 것이라 생각하십니까? C언어, 파이썬, 자바같은 프로그래밍 언어를 배우면 프로그래밍할 수 있을 것이라 생각하십니까? 매우 잘못된 바보같은 생각입니다. C언어, 파이썬, 자바같은 프로그래밍 언어를 배운다고 프로그래밍할 수 없습니다. C언어, 파이썬, 자바같은 프로그래밍 언어를 배우는 것과 프로그래밍을 배우는 것은 별개 문제입니다.\n프로그래밍이 무엇인지 간략하게 봅시다. 프로그램으로 만들고자 하는 것을 전산(컴퓨터) 분야에서는 문제라고합니다. 그리고 프로그램은 데이티와 명령어로 구성됩니다. 그래서 문제를 풀어 프로그램을 만들고자 한다면, 문제 관련 데이터들을 어떠한 기억장치에 어떻게 저장하고 어떻게 쓰고 읽을지를 결정하고(자료구조 설계), 어떠한 명령어들을 어떠한 순서로 몇 번씩 실행시킬지를 결정하여(알고리듬 설계), 이렇게 설계된 자료구조와 알고리듬을 C언어나 자바같은 프로그래밍 언어로 문법에 맞게 변환하여(구현) 프로그램을 만드는 일이 프로그래밍입니다.\n요약하면, 프로그래밍은 컴퓨터를 이용한 문제 해결 과정입니다. 그래서 프로그래밍을 배울 때는 체계적이고 전문적으로 배워 4차 산업 혁명 하에 살아야 하는 사람이면 반드시 갖춰야 하는 능력인 창의적인 혹은 창조적인 문제 해결 능력과 프로그래밍 능력을 갖춰야 합니다.\n이러한 데 프로그래밍할 때 사용되는 도구들인 C언어나 자바같은 프로그래밍 언어를 배운다고 저절로 창의적인 혹은 창조적인 문제 해결 능력과 프로그래밍 능력이 갖춰 지겠습니까? 그렇지 않습니다. C언어나 자바같은 프로그래밍 언어를 보다 쉽고 재미있게 효율적으로 배우고자 하면, 프로그래밍을 체계적이고 전문적으로 배우세요.\n""이렇게 하면 나도 프로그램을 잘 만들 수 있다(나프잘)"" 시리즈 책들을 참고해 보세요. 나이, 성별, 학력, 전공과 상관없이 누구나 독학으로 프로그래밍을 체계적이고 전문적으로 배워 창의적인 혹은 창조적인 문제 해결 능력과 프로그래밍 능력을 갖출 수 있습니다. 네이버 카페 ""프로그래밍을 배우자""에서 공부하는 방법도 배우고 멘토링을 활용하면, 보다 재미있고 효율적으로 프로그래밍을 배울 수 있습니다.\n컴퓨터 앞에 놓고, C언어나 자바같은 프로그래밍 언어, API, 유니티, 언리얼 게임엔진같은 라이브러리, Visual Studio, NetBeans, Eclipse같은 언어 프로그램들 같은 개발 도구 사용법만을 가르쳐 남이 시키는 일만 남이 만든 코드를 편집하는 노가다를 양성하는 학원이면, 차라리 독학하세요. 충분히 할 수 있습니다. 그렇지 않고 컴퓨터 없이 문제를 풀어 개발 도구들로 프로그램을 만드는 방법을 가르쳐 프로그래머를 양성하는 학원이면, 스스로 문제를 풀어 프로그램을 만드는 일인 프로그래밍을 체계적이고 전문적으로 배워 창의적인 혹은 창조적인 문제 해결 능력을 갖출 수 있어 많은 도움이 될 것입니다. 왜냐하면, 개발 도구들로 하는 일인 프로그래밍이란 컴퓨터를 이용한 문제 해결 과정이기 때문입니다.\n프로그래밍을 공부하는 데는 공부하는 방법이 매우 중요합니다. 공부하는 방법부터 배우고 시작해 보세요. 그렇지 않지만, 우리나라에서는 대부분 C언어부터 배우고 자바를 배우라고 해서(자바부터 배워도 됩니다) C언어나 자바를 배우다 보면, C언어나 자바 책에 적힌 내용은 그럭저럭 이해되지만, 장마다 제시되는 문제를 풀어 C언어나 자바로 프로그램을 만들고자 하면, 어떻게 해야 하는지 모르겠고, 잘되지 않습니다. 그러면 답지를 구해 코드만 외우고 넘어 갑니다. 망하는 지름길입니다.\nC언어나 자바 책에 적힌 내용은 C언어나 자바의 문법이고, 장마다 제시되는 문제를 풀어 C언어나 자바로 프로그램을 만드는 일은 프로그래밍입니다. 따라서 C언어나 자바의 문법만 배운다고 프로그래밍을 할 수 있는 것은 아닙니다. 그래서 C언어나 자바의 문법을 배울 것인지 아니면 C언어나 자바로 하는 일인 프로그래밍을 배울 것인지를 먼저 명확하게 하세요. 공부하는 방법이 다르기 때문입니다. 공부하는 목표에 맞게 공부하는 방법을 배워 공부하면 보다 쉽고 재미있게 배울 수 있습니다.\n공부하는 방법도 설명드려 보겠습니다. 참고해 보세요.\nC언어나 자바를 보다 쉽고 재미있게 배우고, 스스로 문제를 풀어 C언어나 자바로 프로그램을 만들고자 한다면, 먼저 프로그래밍을 배우세요. 문제를 풀어 프로그램을 만드는 일인 프로그래밍을 먼저 체계적이고 전문적으로 배우세요. 그래서 창의적인 혹은 창조적인 문제 해결 능력을 갖추도록 하세요. 왜냐하면, C언어나 자바로 하는 일인 프로그래밍이란 컴퓨터를 이용한 문제 해결 과정이기 때문입니다.\n위쪽 프로그래밍의 정의에 의하면, 먼저 문제를 풀어 알고리듬과 자료구조를 만드는 방법을 배우세요. 그리고 C언어나 자바로 알고리듬과 자료구조로 프로그램을 만드는 방법을 배우세요. C언어나 자바로 알고리듬과 자료구조로 프로그램을 만들 때 필요한 C언어나 자바의 문법적인 기능을 이제 C언어나 자바 책에서 찾아서 읽어 보고 적용하는 방식으로 공부하세요. 난이도를 높여 가면서 많은 문제를 풀어 프로그램을 만들다 보면, 스스로 문제를 풀어 프로그램을 만들 수 있고, C언어나 자바도 머리로 기억하는 것이 아니라 몸으로 기억되어 있을 것입니다. 그래서 숨쉬는 것처럼, 걷는 것처럼 자연스럽게 C언어나 자바로 프로그램도 만들 수 있을 것입니다.\n알고리듬과 자료구조를 만드는 방법을 배우라고 해서 시중에 출간된 알고리듬과 자료구조 책들을 사서 이미 만들어져 책에 실린 정렬과 검색 알고리듬, 배열, 연결리스트, 트리, 그래프, 스택, 큐들을 외우지 마십시오. 정렬과 검색 알고리듬, 배열, 연결리스트, 트리, 그래프, 스택, 큐들을 만들 수 있도록 알고리듬과 자료구조를 만드는 방법을 먼저 배우라는 것입니다.\n인터넷에서 사용되는 논리가 ""C언어를 알아야 프로그램을 만들 수 있으므로 C언어를 먼저 배우라""고 합니다. 이러한 논리가 우리나라 영어 교육이나 학습에서도 적용되었지요. 우리나라 영어 교육이나 학습은 영어의 문법부터 시작합니다. 그렇게 해서 중학교, 고등학교 심지어 대학교까지 똑같은 방식으로, 영어 문법을 외우는 방식으로 공부하게 됩니다. 그렇게 십 수년을 하지만 헤밍웨이의 유명한 소설 책 한 권 제대로 읽지 못하고, 두 세쪽 되는 에세이 하나 제대로 작성하지 못하고, 지나가는 외국인과 담소한 번 제대로 나눌 수 없지 않습니까?\n""C언어를 알아야만 프로그램을 만들 수 있다""는 논리라면, 영어의 문법을 공부했다면, 영어 소설책도, 에세이도 회화도 가능해야 하지 않습니까? 어느 분야에서 성공하려면, 10000시간 정도 분야에 집중하면 된다는 이론이 있지 않습니까? 우리나라에서 영어 공부에서는 적용되지 않는 이유는 무엇일까요? 교육과 학습에 문제가 있다는 것입니다.\n그래서 요사이는 영어 교육과 학습이 매우 실용적으로 바뀌고 있습니다. 문법을 암기하는 것이 아니라, 듣기와 말하기로 바뀌고 있습니다. 듣기와 말하기할 때 필요하면 문법을 공부하고 적용하는 방식으로 말입니다. 그래서 좋은 결과를 내고 있습니다.\n프로그래밍 교육과 학습도 바뀌어야 합니다. 문법위주 교육과 학습보다는 문제 해결 중심의 교육과 학습으로 바뀌어야 합니다. 프로그래밍을 공부하는 방법을 배우세요.\nC언어나 JAVA언어같은 프로그래밍 언어와 프로그래밍을 체계적이고 전문적으로 공부하는 방법도 설명드려 보겠습니다. 참고해 보세요.\n프로그래밍은 우리가 생활하는 데 있어 부닥치는 복잡한 문제를 새로운 생각으로 풀어 프로그래밍 언어로 컴퓨터가 처리하도록 하는 프로그램을 만들어 보다 편하게 살 수 있는 세상을 만드는 일입니다. 그래서 어렵습니다. 그렇지만 내가 생각한 프로그램을 만들고 세상 사람들이 사용한다면 엄청난 성취감과 자부심을 느낄 수 있습니다.\n이러한 프로그래밍을 하고자 한다면 다음과 같은 최소한의 능력을 갖추어야 합니다.\n(1) 문제 해결 능력\n(2) 프로그래밍 언어 구사 능력\n(3) 개발 툴 사용 능력\n이 중에서 가장 중요한 것은 문제 해결 능력입니다. 문제를 해결할 수 없으면, 프로그래밍 언어 구사 능력도 개발 툴 사용 능력도 아무 소용이 없습니다. 문제 해결 능력은 많은 문제를 풀어 프로그램을 만들어 봄으로 해서 나만의 문제 해결 방법을 만들었을 때 갖추어 지는 것입니다. 따라서 프로그래밍을 배우고자 한다면 체계적이고 전문적인 학습을 해야 합니다. 그러면 누구나 프로그래밍을 할 수 있습니다.\n프로그래밍 언어나 프로그래밍을 배울 때는 C언어나 자바같은 프로그래밍 언어만 배우지 마시고, C언어나 자바로 하는 일인 프로그래밍을 먼저 공부하세요. 프로그래밍 언어만 배운 사람이면 프로그래밍 언어가 배우기 어렵다고 하고, 어려운 프로그래밍 언어를 한 권 내지 두 세권 책으로 공부를 마친 후에도 문제를 스스로 풀어 배운 프로그래밍 언어로 프로그램을 만들려고 하면 어디서 부터 시작하여 어떻게 해야 하는지가 막막하다고 합니다. \n왜 그럴까요? 프로그래밍 언어 책에 적힌 프로그램을 이해하기 위해서는 프로그래밍을 배워야 하는데 그렇지 않고 프로그래밍 언어를 배우고자 하기 때문입니다. 프로그래밍 자체는 어렵습니다. 프로그래밍은 문제를 풀어 컴퓨터가 처리하도록 하는 프로그램을 만드는 일이기 때문입니다.\n프로그래밍 언어 책에서는 문제를 풀어 프로그램을 만드는 것을 설명하지 않고, 문제를 풀어 해결책(알고리듬)을 만든 후에 컴퓨터가 처리하도록 하는 프로그램을 만들 때 프로그래밍 언어가 언제, 어떻게 적용되는지만을 설명합니다. 그래서 프로그래밍과 프로그래밍 언어를 재미있게 공부하고자 한다면 체계적이고 합리적인 학습을 해야 합니다.\n프로그래밍 언어를 배우기 전에 프로그래밍 언어로 하는 일인 프로그래밍을 먼저 공부하세요. 프로그래밍이 무엇인지, 어떻게 하는지, C언어같은 프로그래밍 언어가 언제, 어떻게 사용되는지 그리고 프로그램이 어떻게 작동하는지를 공부하세요. 또한 이러한 개념과 원리를 바탕으로 문제를 풀어 프로그램을 만드는 절차를 배우세요. 이러한 내용을 배우고자 하면, 다음 책들을 참고해 보세요.\n책들은 ""이렇게 하면 나도 프로그램을 잘 만들 수 있다(나프잘)"" 시리즈입니다.\n이렇게 프로그래밍을 이해했다면, 프로그래밍 언어를 배우세요. 무작정 프로그래밍 언어 책을 사고 동영상강의를 보면서 책에 적혀 있는 프로그램을 아무 생각없이 입력해서 실행시켜 보고 머리를 끄덕이고 외우는 방식보다 쉽게 재미있게 프로그래밍 언어를 배울 수 있습니다. 왜냐하면 왜 프로그래밍 언어를 배워야 하는지를 명확하게 이해했고, 프로그래밍 언어 책에 나온 프로그램이 어떻게 작성되었는지를 이해할 수 있고, 마지막으로 프로그래밍 언어 책에 제시되는 문제를 풀어 프로그램을 만들 수 있기 때문입니다.\nC언어를 공부하고자 한다면 다음 책을 참고해 보세요.\n책은 ""C를 배우면 함수를 잘 만들어야 한다""입니다.\n문법만 설명하는 것이 아니라 문제를 풀어 프로그램을 만들 때 C언어가 언제, 어떻게 적용되는지를 설명합니다. 특히 책의 처음부터 끝까지 C언어를 배우면 반드시 만들 수 있어야 하는 함수를 만들어서 사용하는 방법을 설명합니다.\n네이버 카페 ""프로그래밍을 배우자""에서 게시글과 동영상강의로 프로그래밍이 무엇인지, 어떻게 하는 것인지 그리고 C언어나 JAVA언어가 언제, 어떻게 사용되는지를 확인해 보세요. 그리고 프로그래밍과 C언어나 JAVA언어를 어떻게 배워야 할지를 생각해 보고 시작하세요. 그래서 시행착오를 줄이세요.\n독학을 하신다면 책을 읽는 방법을 바꾸세요. 책을 볼 때 바로 정독을 하지 마시고, 빠른 속도로 전체 내용을 훓어 보는 방식으로 여러 번 보고, 정독을 하십시오. 왜냐하면 모든 내용은 질문자 님에게 새로운 내용입니다. 따라서 어려울 수 밖에 없습니다. 그래서 최소한 책에 어떠한 내용이 담겨 있는지와 자주 사용되는 용어(혹은 개념)에는 익숙해야 정독을 할 수 있지 않습니까? 책의 줄거리나 용어에 익숙하기 위해서 빠른 속도로 전체 내용을 훑어 보는 방식으로 먼저 읽어 보시라고 권하는 것입니다.\n좋지 않은 프로그래밍 공부 방법이지만, C언어나 자바의 문법만 배우고자 한다면, 책을 훑어보기로 처음부터 끝까지 빠르게 3-4회 읽어 어떠한 내용인지, 자주 사용되는 용어들에 익숙해 지도록 하세요. 내용이 파악되고, 용어들에 익숙해지면, 처음부터 책에 실린 코드도 컴퓨터에 입력해 보면서, 컴퓨터가 없으면 공책에 적어 보면서 어떠한 문법이 언제, 어떻게 사용되는지를 외우세요. 이때는 ""왜 이렇게 할까"", ""어떻게 작동할까""라는 생각들은 하지 마시고, 외우세요.', '안녕하세요!\n프로그래밍언어를 전혀 모르신 상태에서 컴공과에 진학하게 되신다면 수업을 따라가기 힘드십니다.\n입학 전 학원이나 인강을 통해 기초적인 언어부터 탄탄히 배우시면서 실력을 쌓으시는 걸 추천드립니다.\n컴공과 졸업 후 취업하실 직업, 관련 공부, 포트폴리오 준비 등 자세히 정하신 게 있으신가요?\n더 궁금하신 게 있으시다면 오픈 카톡으로 연락 주세요!\nIT 1:1 무료상담\n#아이티뱅크 #IT #무료상담 #1:1 #앱개발자 #웹개발자 #C언어 #java\nopen.kakao.com', '안녕하세요.\nIT 전문 컨설턴트 찬주쌤이에요.\n질문하신 내용으로는 질문자님에 상황& 정보를 정확히 알 수 없어서 정확한 \n정보를 알려드리지 못하는 점 양해 부탁드립니다.\n질문자님께서 컴공과로 입학을 하신다고 하셨는데요.\n대학교 입학 전 미리 기본적인 프로그래밍언어를 공부하시고 입학을 하셔야 \n수업 때 배우시는 내용을 이해할 수 있습니다.\nIT 분야 공부를 처음 하실 때에는 IT 통합 기초를 먼저 공부하신 다음에 기본적인 \n프로그래밍언어인 파이썬, C언어, 자바 등을 배우시는 것이 좋습니다.\n기본적인 프로그래밍언어라도 혼자 독학으로 공부하기에는 어려움이 있으며, \n질문자님의 상황& 목적에 따라서 배우는 순서도 달라집니다.\n그러니 IT 전문교육기관 상담을 받아보시고 나서 질문자님에게 맞는 커리큘럼을 \n짜서 체계적이고 효율성 있는 계획을 세 우서 공부하시는 걸 추천드립니다.\nIT 관련 진학& 취업& 포트폴리오 등 궁금하신 게 있으시면 1:1상담문의하세요.\n자세히 알려드리겠습니다.\nIT분야 취업및 진로 1:1 상담\n#IT#국비지원#진학상담#SW특기자전용#진로상담#취업상담\nopen.kakao.com', '안녕하세여 냥~\n지식냥이입니다!\n관련 내용의 블로그 링크 남겨드릴테니 참고해주세요.\n컴퓨터공학과 전공대비 이렇게 해보세요!\n안녕하세요.유쌤입니다. 비싼 등록금을 내고대학을 다니고 있지만요즘 온라인 강의로만진행되는 수업이 많...\nblog.naver.com\n1. 가기전에 준비해야 할게 뭐가 있을까요\n기초지식을 쌓고 가시는걸 추천드립니다.\n지금 상태로 대학 수업들어도 이해 안될거 뻔하니까요.\n2. 코딩을 해서 뭐 개발을 한다 이정도는 아는데\n정확히... 어떤 걸 하는지도 알려주시면 감사하겠습니다\n코딩과 프로그래밍은 비슷하지만 다릅니다.\n코딩이란 무엇인지 쓰여있는 블로그 링크 남겨드릴테니 참고해주세요.\n코딩이란 무엇일까? 코딩의 필요성!\n안녕하세요.유쌤입니다. 코딩이란? 코딩이 무엇인지에 대한주제로 말씀드려보려합니다. 계속 이슈가 되고 ...\nblog.naver.com\n개발은 웹개발, 앱개발, 게임개발, 바이러스나 악성코드를 막기위한 백신개발\n인공지능개발 등 다양하게 있구요.\n좀 더 자세히 알아보고 준비하고 싶으시다면 문의주세요.\nIT 진로와 진학/취업 문의하기!\n안녕하세요 유쌤입니다~ IT 분야의 진로와 관련 전공학과 진학 방법, 관련 분야로의 취업 방법에 대해 궁금한 부분이 있으시면 편하게 문의주세요~!\nnaver.me\nIT분야 취업 진학 문의주세요\n#정보보안#네트워크#소프트웨어#데이터베이스#빅데이터#시스템서버#프로그래밍#해킹#c언어#자바#정보처리기사#웹개발#정보처리#빅데이터분석#학점은행제\nopen.kakao.com', '안녕하세요 질문남겨주셔서 답변드립니다 \n우선 아마 처음이라고 하시면 당연히 공부하는데 어려우실겁니다ㅠ\n지금 공부중인 전공생 분들도 어려워 하시는 분들 많아요\n기본적으로 프로그래밍 언어를 공부하신다고 하면 \n파이썬< C언어 < 자바 순으로 공부하시는게 좋습니다.\nC언어는 기본이지만 기초는 아닙니다. 난이도가 있는 어려운\n언어이기 때문에 C언어부터 공부하시면 아마 힘드실겁니다ㅠ\n코딩은 프로그래밍언어를 이용하여 코드를 작성하는 것이고\n이 코딩을 이용해서 프로그램을 만드는것을 프로그래밍 이라고 합니다.\n할 수 있는건 프로그래밍에 필요한 다른 부분들도 공부하셔서\n웹,앱 개발, 게임개발, 응용 SW 개발 하실 수가 있습니다.\nIT분야로 관심 있거나\n진로,진학,자격증 준비, 취업, 학점은행제 에대해서\n1대1 전문 맞춤 컨설팅을 무료로 진행하고 있습니다.\n아래 링크 클릭하셔서 문의주시면 질문자님 상황에 맞추어서\n자세하게 안내해드리도록 하겠습니다.\nhttp://naver.me/F2rbw6Q0\n♧ IT 무료 컨설팅 문의\nIT 분야로 진로/ 진학, 취업 이나 자격증에 관해서 궁금하신 부분들 편하게 문의 주시면 됩니다. 간단한 정보와 관심사, 실력 ,궁금하신 부분들을 적어주세요!\nnaver.me', '안녕하세요~ 1:1 전문 컨설턴트 아름쌤입니다:)\n글만 봐서는 정확한 정보를 알 수 없어 확실한 답변드리지 못하는 점 양해부탁드립니다.\n현실적으로만 답변드리겠습니다.\nIT 시장이 전망도 좋고 활발해진것은 맞습니다.\n하지만 전망 좋다고 인터넷에 나와서 또는 그런 말들이 많이 나와서 이러한 마음으로 시작하시는거면 비추천입니다.\n왜냐하면 IT 공부 자체는 쉬운 공부가 아니기 때문에\n한번 해보자라는 마음으로 들어왔다가 중도 포기하시는분들이 한두명이 아닙니다.\n제가 말씀드리는건 제대로 된 의지 가지고 해도 될까 말까 한다고 말씀드리는겁니다.\nIT 국비지원 받으면 전액 다 받을 수 있다는 장점이 있습니다.\n하지만 국비지원을 지원해주는 이유도 취업 목적으로 하는 전공자를 위한 지원으로 \n국비지원만 들으시면 아마 1~2개월 안에 책 덮어버릴겁니다.\n왜? \n전공자들이 듣는 수업을 비전공자가 바로 알아듣는게 더 이상하다고 봅니다.\n그렇기 때문에 프로그래밍 기초 언어부터 먼저 들으시고 국비 들어가시는걸 추천드립니다.\n또한 독학을 하시는 것도 안됩니다.\n시간 버리는 일입니다.\nIT에는 다양한 직업들로 이루어져 있습니다.\n질문자님께서는 그 직업들이 뭐가 있고 어떠한 일을 하는 사람인지 정확히 아시나요?\n최소한 내가 앞으로 하는 일에 대해서는 정확히 알아야하는게 당연한겁니다. \n아 그냥 학교가서 알지뭐 , 학원가서 배워보면 알겠지뭐 이런 생각!!\n대충 인터넷 검색해서 나오는 직업 정의들만 보고 아 재밌겠네~ 하면서 시작하시는 분들 수도 없이 많이 봐왔지만 오래 못갑니다.\n교육기관 먼저 방문한다음 많은 IT직업들의 직무파악을 정확히하고 세부 진로들을 정하며 질문자님 상황에 맞는 커리큘럼부터 알아봐야 합니다.\n이게 질문자님께서 우선해야 할 일 입니다.\n다시 정리해 말씀드리면 국비지원 받으러 고용센터를 가기전에 전문 교육기관부터 방문해서 진단을 받는게 우선이라고 말씀드리는겁니다.\nIT는 고졸, 비전공자도 교육기관에서 열심히 하면 취업 가능합니다.\n정말 이 IT분야에 대해 정확히 알고 싶고 배울 의지 있으신분들만 번거로우시겠지만 카톡으로 연락주시길 바랍니다.\n공부할 의지 가지고 연락주시는분들 마다 하지 않습니다.\n아래 링크로 연락주시면 성심성의껏 답변도와드리겠습니다.\nIT분야 취업및상담\n#IT#국비지원#진학상담#sw특기자전형#진로상담#취업상담\nopen.kakao.com']",8,https://kin.naver.com/qna/detail.naver?d1id=1&dirId=1040101&docId=372574979&qb=67Cx7Iug&enc=utf8&section=kin&rank=65&search_sort=3&spq=0,"C, C++"
