page,date,tags,questions,questions_add,answers,N_answer,url,category
3,2020.06.28,[],코로나 증상,제가 추위를 워낙 잘 타는데 학교에서 에어컨 바람 계속 맞고 비와서 온도가 낮아진 탓인지 목이 하루 잠깐 아팠고 지금은 편두통이 있는데 이게 어제 신경 쓴 일 탓인가 싶기도 하고 코로나 때문에 좀만 아파도 걱정돼요 ㅠㅠ 코로나의 결정적인 증상은 어떤 것인가요,"['네, 코로나는 증상으로서는 절대로 알수가 없습니다.\n선별진료소에서 코로나 바이러스 검사를 하여 몸안에 코로나 바이러스가 있으면 양성,없으면 양성으로 판별이 나게 됩니다.\n질문자님이 증상이 있다면 약을 먹어 보고 그래도 낫지 않는다면 질병본부 1339나 지역번호+120이나 보건소에 전화를 하여 상담을 받아 보시기를 바랍니다.\n코로나 바이러스는 무증상도 있고 아주 경미한 증상도 있으며 감기나 독감증세와 비슷하다고 하며 증상으로는 기침,가래,콧물,발열,인후통,근육통,호흡곤란,설사,복통,결막염,후각 미각  마비등의 다양한 증세가 있다고 합니다.\n코로나 전세계 확진자가 1,000만명 사망자가 50만명이라고 하고 아직 백신과 치료제가 개발이 되니 않아서 항상 마스크를 쓰고 사람들과 접촉을 피하며 손을 자주 씻는등 개인위생을 잘해야 할것 같습니다.\n감사합니다.', '코로나증상 비교해보시고 확진자동선 체크후 그래도 의심이 된다면 1339번에 전화후 안내 받으시기 바랍니다.\n코로나19 자가진단 코로나세이프 자가진단 받으러 가기\nhttps://dangcare.tistory.com/1329\n코로나19 자가진단 서비스가 개발됐다. 코로나세이프 자가진단 받으러 가기\n코로나19 자가진단 서비스가 개발됐다. 코로나세이프 자가진단 받으러 가기 고고 코로나19 선별 진료소에서 근무하는 공중보건의 등 현직 의사 9명과 MBN 측이 함께 만든 자가진단 서비스는 언제, 어디서나 손쉽..\ndangcare.tistory.com\n코로나맵’ 이어 주변 진료소 정보까지 확인 가능한 ‘코로나 알리미’\n동선확인하시고 주의하세요 *********\nhttps://dangcare.tistory.com/1226\n코로나맵’ 이어 주변 진료소 정보까지 확인 가능한 ‘코로나 알리미’ 등장\n코로나맵’ 이어 주변 진료소 정보까지 확인 가능한 ‘코로나 알리미’ 등장 최근 ‘신종 코로나바이러스’가 국내에 확산됨에 따라 이에 대한 정보를 확인할 수 있는 창구가 하나둘씩 등장하고 있다. 지난달 30일..\ndangcare.tistory.com\n인후통코로나 증상 목아픔코로나 증상 발현 시기코로나 증상 설사코로나 증상 두통코로나코로나 증상\n대전코로나,광주코로나,익산코로나,경기도코로나,서울코로나,인천코로나,코로나확진,수원코로나\n채택시 해피빈은 코로나 관련해서 전액기부됩니다.\n코로나는 아닐거에요 , 건강한 하루되세요', '코로나는 지속적인 고열과 인후통을 동반하며 숨쉬기가 힘든것으로 알고있습니다\n이러한 증상이 1-2주 사이 발견되는거라서 지켜보시죠\n열이 관건입니다! 코로나가 아니시길...\n일반 감기일수있으니 먼저 일반병원에 먼저가셔서 진찰을 받아보심이 좋을듯합니다\n그리고 지금까지 해왔던것처럼\n우리모두 앞으로도 예방수칙 생활화하기로해요..\n마스크착용\n손씻기\n생활속거리두기\n그리고 코로나에 면역력을 키워야하는거 아시죠?\n제가 먹고있는것도 있고한데 이 사이트 몸에 좋은 제품들\n많이 판매하고 가격도 착하드라구여..\n추후 도움되시길...\n녹용이나 홍삼, 건강즙도 좋고요\n비타민, 프로폴리스, 오메가3, 미네랄, 포도당마시는 음료,\n밀크씨슬, 루테인, 쏘팔메토, 장건강을 위한 제품, \n뼈건강이나 관절건강, 뷰티를 위한 제품, 콜라겐, 눈건강 면역력증진등등\n건강식품들도 골고루 나눠져있어요\n이번에 들어갔더니 이벤트도 하네요~\n제품 구매하신분들 카카오톡 하루건강엔 친구추가하시고\n1:1 대화로 참여완료 남기시면 추첨해서 제주신화월드 숙박권을 주는 이벤트에요\n한번 체크해보세요^^\n코로나 종식되기를 바라며 가족모두 건강유의하세요\n면역력 잘 키워서 강화시키고 코로나 잘 이겨내기로해요!\n미리 예방하는게 최우선일듯합니다\n가족들에게 맞는 영양제 한번 체크해보세요~~\n국산 마스크, 손소독제, 살균소독제도 판매하네요\nhttps://smartstore.naver.com/haruhealthy/notice/content/2001414538\n하루건강엔 : 네이버쇼핑 스마트스토어\n하루건강엔 여기! 건강한 매일을 위해 안전하고 정직한 제품만을 소개합니다.\nsmartstore.naver.com']",3,https://kin.naver.com/qna/detail.naver?d1id=7&dirId=701&docId=361049780&qb=67Cx7Iug&enc=utf8&section=kin&rank=22&search_sort=3&spq=0,건강상담
3,2020.06.28,[],v3 컴퓨터 백신,v3앱으로 노트북 웹캠 해킹같은 해킹 막거나 감지할수 있나요??,"[' 실시간 감지가 켜져 있다면 상당히 많은 공격을 미리 탐지해 막을 수 있습니다. 물론 해킹 기법이나 바이러스, 악성 코드는 계속 변종이 나와서 백신의 데이터베이스가 업데이트 되기까지의 공백 기간동안 백신이 탐지하지 못할 수도 있다는 점을 참고하셔야 합니다(왠만한 건 다 미리 감지하지만요..).\n 팁) 웹캠 해킹 100% 막는 방법 : 웹캠을 쓰지 않을 때는 포스트잇 등으로 카메라를 가려두면 됩니다. 제일 쉽지만 제일 효과적이죠. 해킹당해도 피해가 발생하지 않습니다.']",1,https://kin.naver.com/qna/detail.naver?d1id=1&dirId=11001&docId=361049355&qb=67Cx7Iug&enc=utf8&section=kin&rank=23&search_sort=3&spq=0,해킹
3,2020.06.28,"['코로나', '코로나목감기', '목감기', '코로나바이러스증상']",코로나 목감기,머리가 계속 아프고 목도 아픈지 3일정도 됐습니다. 기침은 안하고요. 속이 계속 울렁거리고 배도 아프며 설사도 가끔씩 하는데 혹시 코로나일까요 ? 열 재봤는데 36.8~37.2도 사이로 나와서요. 근육통도 조금 있습니다..,"['그건 모르는 일이죠.. 병원 가보세요', '네, 코로나는 증상으로서는 알수가 없습니다.\n선별진료소에서 검사를 하여 몸안에 코로나 바이러스가 있으면 양성,없으면 양성으로 판별이 됩니다.\n질문자님이 증상이 있다면 약을 먹어 보고 그래도 낫지 않는다면 질병본부 1339나 지역번호+120이나 보건소에 전화를 하여 상담을 받아 보시기를 바랍니다.\n코로나 바이러스는 무증상도 있고 아주 경미한 증상도 있으며 감기나 독감증세와 비슷하다고 하며 증상으로는 기침,가래,콧물,발열,인후통,근육통,호흡곤란,설사,복통,결막염,후각 미각 마비등의 다양한 증세가 있다고 합니다.\n코로나 바이러스 전세계 확진자가 1,000만명 ,사망자가 50만명이라고 하며 아직 백신과 치료제가 개발이 되지 않아서 항상 마스크를 쓰고 사람들과 접촉을 피하며 손을 자주 씻는등 개인위생을 잘해야 할것 같습니다.\n감사합니다.', '코로나증상 비교해보시고 확진자동선 체크후 그래도 의심이 된다면 1339번에 전화후 안내 받으시기 바랍니다.\n코로나19 자가진단 코로나세이프 자가진단 받으러 가기\nhttps://dangcare.tistory.com/1329\n코로나19 자가진단 서비스가 개발됐다. 코로나세이프 자가진단 받으러 가기\n코로나19 자가진단 서비스가 개발됐다. 코로나세이프 자가진단 받으러 가기 고고 코로나19 선별 진료소에서 근무하는 공중보건의 등 현직 의사 9명과 MBN 측이 함께 만든 자가진단 서비스는 언제, 어디서나 손쉽..\ndangcare.tistory.com\n코로나맵’ 이어 주변 진료소 정보까지 확인 가능한 ‘코로나 알리미’\n동선확인하시고 주의하세요 *********\nhttps://dangcare.tistory.com/1226\n코로나맵’ 이어 주변 진료소 정보까지 확인 가능한 ‘코로나 알리미’ 등장\n코로나맵’ 이어 주변 진료소 정보까지 확인 가능한 ‘코로나 알리미’ 등장 최근 ‘신종 코로나바이러스’가 국내에 확산됨에 따라 이에 대한 정보를 확인할 수 있는 창구가 하나둘씩 등장하고 있다. 지난달 30일..\ndangcare.tistory.com\n인후통코로나 증상 목아픔코로나 증상 발현 시기코로나 증상 설사코로나 증상 두통코로나코로나 증상\n대전코로나,광주코로나,익산코로나,경기도코로나,서울코로나,인천코로나,코로나확진,수원코로나\n채택시 해피빈은 코로나 관련해서 전액기부됩니다.\n코로나는 아닐거에요 , 건강한 하루되세요', '코로나 의심증상으로 기본적으로 고열 37.5도 이상이거나, 마른기침 가슴통증, 두통, 설사, 인후통, 몸살끼 등이 있으며 종종 무증상 사례도 나오고 있어서 코로나 확진을 검사받기전에 미리 판단하기엔 어려움이 많아졌어요. \n다만, 제가 의사는 아니지만 코로나 의심 확인할때, 첫번째로 확진자 동선과 본인의 동선, 또는 주변(최근 같이 식사를 했더나 비말접촉이 높은사람) 사람들 동산을 파악하는게 중요해요. \n이는 해당 지역 시청, 구청 등의 홈페이지나 SNS 채널을 통해 확진자 동선을 공지하고 있어요. 그리고 두번째로는..\n열체크를 먼저해보시고 37.5도가 넘어가고 기본적인 코로나 증상이 미약하게나마 있다고 느끼시면 일단 존버타시면서 사회적 거리두기를 실천하시고 하루이틀 몸상태를 지켜봐야해요. \n단순 스트레스성 컨디션 저하나 피로감으로 인한 영향인 경우도 많아서 증상이 뚜렷하다면 바로 선별진료소나 보건소가서 검사하시고 조금 미약하시면 위생관리 잘하시면서 조금은 지켜보셔도 괜찮을꺼에요. \n그럼 부디 무탈하시길 바랍니다. ^^ \n도움이 되셨다면 채택과 좋아요 부탁드립니다~\n[AD] 여름용 마스크 최저가 할인특가 모음\n""KFAD"" 비말차단 마스크 할인 [개당 200원대]\n✔ https://bit.ly/2Bb3In9\n""의료용"" 국내산 덴탈 마스크 50매 할인 [개당 100원대]\n✔ https://bit.ly/3g0E1Vb\n품절대란 ""유한킴벌리"" 프리미엄 비말차단 마스크\n✔ https://bit.ly/2A2eBad\n이번에 보급형으로 나온 아이폰 SE와 아이폰 11\n공기계 용량/색상별로 쿠팡에서 할인 이벤트중이네요\n아이패드 프로 11도 할인중이니 구경한번 해보세요~\nApple 아이폰 SE\n✔ https://coupa.ng/bE4D7q\nApple 아이폰 11\n✔ https://coupa.ng/bE4D9S\nApple ipad pro 11\n✔ https://coupa.ng/bE4EfN\n요즘 여름특가로 선풍기 냉방기 에어컨 할인 이벤트를 많이 하고 있어요\n선풍기 냉방기 에어컨 같은 가전제품들은 시즌에 맞춰 구매하는 방법에 따라 가격 차이가 상당합니다.\n아래 가성비 좋고 할인율 높은 인기제품들을 소개해드립니다!\n날개없는 선풍기 할인 특가\n✔https://coupa.ng/bEVfYK\n서큘레이터 선풍기 할인 특가\n✔ https://coupa.ng/bEVf3X\n선풍기 초특가 한눈에 보기\n✔ https://coupa.ng/bEVf7B\n이동식 냉방기 할인 특가\n✔https://coupa.ng/bEVgb6\n더블할인 받을 수 있는 대한민국동행세일\n꼭 활용하셔서 온라인 쇼핑하세요!!\n재난지원금에 이어 대한민국정부와 지방자치단체 주최로 \n중소기업유통센터가 주관하여 국내 온/오프라인 매장을\n통해 대대적인 쇼핑지원이 6월 26일부터 시작되었습니다.\n온라인 쇼핑몰 기획전, 전통시장, 라이브커머스\nTV홈쇼핑, 농축수산물, 외식업계, 백화점 대형마트 등\n대한민국 모든 쇼핑 세일을 지원하고 있습니다. \n대한민국 동행세일 한번에 정리해둔표가 있어서\n보기 쉽고 언제든 바로 활용하기 좋은곳 추천드려요!\n아래 링크 넣어놨어요~ \n✔https://bit.ly/3fXicpo\n대한민국 동행세일\n대한민국 동행세일 온라인품목 정리\nbit.ly']",4,https://kin.naver.com/qna/detail.naver?d1id=7&dirId=71103&docId=361048495&qb=67Cx7Iug&enc=utf8&section=kin&rank=24&search_sort=3&spq=0,질환영양
5,2020.06.28,[],코로나바이러스2021년 까지도 종식 안 될 수 있나요.?,,['2개월 내에  치료제가 나오고\n1년 정도 백신 만드는데 걸린다고하네요\n백신은 예방접종 같은거니까\n아마 종식되도 독감같이 남을것같네요\n우리나라는 종식된다해도 다른나라도 문제가..'],1,https://kin.naver.com/qna/detail.naver?d1id=7&dirId=70105&docId=361026759&qb=67Cx7Iug&enc=utf8&section=kin&rank=44&search_sort=3&spq=0,흉부외과
5,2020.06.28,[],코로나 있잖아요..,"해외 미국 브라질이런곳은 모르겠고
국내는 언제쯤 종식될까요?
다들 그렇겠지만 더위에 마스크땜시 힘들고
갑갑하네요..ㅜㅜ",['빨라야 올겨울쯤 늦으면 내년봄까지 갑니다.\n근거는 이전 대규모전염병인 신종플루나 메르스등이 지속기간이 6~8개월이였는데 그것들은 전파력이 상대적으로 약했지만 이번 코로나19는 전파력이 상대적으로 더높아서 대략 1년정도 간다고 본다면 작년 겨울에생겨난걸 감안할때 대충짐작할수있습니다.\n백신이 중간에 나올가능성은 현재로선 희박합니다.'],1,https://kin.naver.com/qna/detail.naver?d1id=6&dirId=612&docId=361028901&qb=67Cx7Iug&enc=utf8&section=kin&rank=43&search_sort=3&spq=0,재난재해
5,2020.06.28,[],코로나 고온생존,"제가 시를 쓰고 있는데 주제가 코로나를 과학적으로 예방?
이어서 태양의 코로나로 병 코로나를 물리치자
왜냐면 코로나는 고온에 생존할 수 없다해서
그렇게 쓰고있는데
Q.코로나가 고온에 생존 못한다는것에 과학적 이유가 있나요",['아직 백신도 없어서요..'],1,https://kin.naver.com/qna/detail.naver?d1id=6&dirId=6020602&docId=361029226&qb=67Cx7Iug&enc=utf8&section=kin&rank=42&search_sort=3&spq=0,강력범죄
5,2020.06.28,"['근거자료', '정확한답변부탁드려요']",코로나 언제까지,안녕하세요 학교도 한번 못가보고 계속 학원 집 학원 집에만 살고 있습니다 언제 끝날까요? 언제 7-8-9월달중 종식 가능 할까요?,"['내년가지는 갈거 같습니', '독감처럼 종식은 안될 것 같구요..\n백신도 여러가지 만들고 있는중이니깐\n아마도 내년이나 내년중후반 쯤에 잠잠해질 것같네요']",2,https://kin.naver.com/qna/detail.naver?d1id=11&dirId=110209&docId=361032186&qb=67Cx7Iug&enc=utf8&section=kin&rank=41&search_sort=3&spq=0,"학원, 온라인교육"
4,2020.06.28,"['바이러스', '컴퓨터백신', '불필요한프로그램삭제', '검색질문', '통합검색궁금증', '통합검색질문하기']",컴퓨터 백신 프로그램,"컴퓨터가 많이 느려지고 인터넷 하면 쓸데 없는 인터넷 사이트 팝업창이 뜨는데 제거하는 프로그램이 뭐였는지 기억이 나지 않아서요 알약, V3, 네이버 백신 말고 해외 백신 프로그램이었는지 국내 백신 프로그램이었는지 기억은 안나는데 다운 받고 폴더에 메모장 있고 사용법이나 유의사항 적혀있고 시작하면 컴퓨터 종료되고 컴퓨터에 여러 글자 뜨면서 폴더 검사중, 불필요한 프로그램, 바이러스, 그런거 찾아내고 제거하는 프로그램이었는데 그거 하니 더 이상 팝업 안뜨고 11번가나 G마켓등 프로그램이 안뜨고 해서요 그 프로그램 뭐였는지 알려주실 수 있으실까요?? 내공 50드려요","['말씀만 들어보면 MZ (Malware Zero, 구 MZK) 를 말씀하시는것으로 보입니다.\nhttps://malzero.xyz/ 가 공식 사이트 입니다.\nMalware Zero - 무료 악성코드 제거 도구\n악성코드 및 애드웨어 등 각종 유해 프로그램에 의한 고통에서 해방되기 위해 설치 없이 사용 가능한 무료 악성코드 제거 도구\nmalzero.xyz']",1,https://kin.naver.com/qna/detail.naver?d1id=1&dirId=11002&docId=361032828&qb=67Cx7Iug&enc=utf8&section=kin&rank=40&search_sort=3&spq=0,바이러스
4,2020.06.28,[],엔테로코커스 페시움(페슘)은 유익균인가요 유해균인가요?,엔테로코커스 페시움()은 유익균인가요 유해균인가요 아니면 중간균인가요?,"['유익균 입니다. 엔테로코커스 페슘은 장 점막에 살고 있는 균으로 위산에 견디는 강력한 균입니다. 중금속을 제거하여 해독작용을 합니다.\n하지만 과잉 우점되는 경우 중간자적인 균으로 변합니다.\n그래서 사균(죽은균)을 보통 사용합니다. 사균은 일종의 백신과도 같다고 보셔도 되는데요.\n이런 사균들이 병원성균을 억제하고 유산균 증식에 도움을 주며 면역력을 건강하게 합니다.\n제약공학연구원', '장 건강에 어떤 유산균을 드셔야 할지 고민이시라면 순위를 보여드릴 테니 확인해보시기 바랍니다\n제가 매번 저렴하게 사 먹는 곳인데 유산균도 처음에는 프로바이틱스, 프리바이오틱스, 신바이오틱스,\n모유, 프롤린 등 다양하게 맞는 걸 찾으려고 바뀌더라고요\n그래서 여러 가지 뭐가 더 유리할지 따져보실 수 있게 순위로 되어있으니 편리하실 거예요 \n다양한 만큼 본인이 원하는 성분과 함량인지 따져보시고 선택하시기 바랍니다.\nhttp://www.cjgmarket.co.kr/shop/search.php?sfl=wr_subject%7C%7Cwr_content&sop=and&q=%EC%9E%A5+%EC%9C%A0%EC%82%B0%EA%B7%A0&ff=1313%7C20200630\n장 유산균 - 장 유산균 | 최저가마켓\n장 유산균 | 최저가마켓\nwww.cjgmarket.co.kr']",2,https://kin.naver.com/qna/detail.naver?d1id=11&dirId=111606&docId=361034349&qb=67Cx7Iug&enc=utf8&section=kin&rank=39&search_sort=3&spq=0,미생물학
4,2020.06.28,[],진돗개 믹스견 꼭필요한 접종좀 알려주세요,"시골에서 잡아먹는다해서 서울로 데려와서 키우고 있습니다 강아지를 좋아하는 편은 아닌데
그래도 몇번 안면이 있어서 집에서 키운지 지금 한달정도 됫구요
`1년 2년정도 살은거 같은데 아직 접종같은거 하나도 안했습니다 어려서 그런지 건강에 대해서 신경은 별로
안쓰이는데 시골에서 못먹어서 그런지 조금 마른편이긴 합니다 심장사상충약 일단 요번에 먹였는데
꼭필요한 예방접종같은게 있을까요?? 뭐 광견병 주사 뭐이런거 맞아야된다는데 일단 저희집개는 도둑놈한테도 꼬리흔드는 개라서 절대 물지않기는합니다 동물종류 보면 환장하기는 하고 사람한테는 엄청순한데 그래도 광견병주사 이런거 해줘야할까요?? 답변부탁드려요","[""심장사상충을 구충했으면,\n'종합백신'만 맞춰주세요.\n광견병은 지자체에서 봄가을에 한번씩 무료로 접종을 할 때 맞춰주세요.\n그렇게 해주면 좋겠어요."", '종합백신과 광견병은 꼭해주세요\n광견병은 님 강아지가 안걸려서 안맞아도 된다가 아니라 광견병 걸린강아지가 (야생동물에게도 광견병이 있을수 있습니다.)혹여라도 물었을때 광견병에 대한 예방이 될수있습니다.\n(강아지 등록하셨으면 봄,가을철에 병원에서 3,000원에 광견병주사를 맞출수있으니 금액적으로 부담은 덜하실껍니다.)\n또 종합백신은 강아지들 전염병 예방에 도움이되니 맞춰주시는게 좋습니다.\n종합백신은 어릴때 2주에1번씩 총5번을 맞춘뒤 연간접종으로 1번씩 맞춰주는게 기본이고, 광견병은 1년에 1번씩 맞춰주시면 됩니다.\n그리고 밖에서 키운아이였다면 심장사상충감염 검사도 한번해보세요.']",2,https://kin.naver.com/qna/detail.naver?d1id=8&dirId=80511&docId=361034477&qb=67Cx7Iug&enc=utf8&section=kin&rank=38&search_sort=3&spq=0,동물의료상담
