page,date,tags,questions,questions_add,answers,N_answer,url,category
26,2021.02.19,['#코로나'],문재인 임기 언제 끝나나요,"고딩인데요 이 새기 백신 확보했다면서 왜 아직까지 백신 안들어오는거죠? 일본은 화이자 어제부터 맞는다던데
하 진짜 짱개들때문에 마스크쓰는것도 짜증나는데 미세먼지까지 하루하루가 족같네요 정말 그래서 문재앙 임기 언제 끝나죠?","['2022년 5월 10일에 끝납니다. 솔직히 임기기간 너무 기네요. 탄핵됐으면 좋겠습니다.', '임기는 2017년 5월 10일에 시작했고 대한민국 대통령의 임기는 5년이니까 2022년 5월 10일에 신임 대통령에게  정권을 이양하고 퇴임한단다.\n근데 문재인이가 니 친구냐 이 새끼야!\n어디 어린놈의 새끼가 친구 이름 부르듯이 문재인 문재인 거려?\n그리고 백신 접종 먼저 시작하는게 무조건 장땡 같냐?\n일본은 인구비율로 따져도 우리나라보다 코로나 확진자와 사망자 숫자가 훨 많고 미국은 우리나라보다 인구가 여섯배 쪼끔 더 많은데 사망자는 300배 이상이지?\n유럽도 우리보다 훨씬 심각하고!\n그러니까 백신 부작용이고 뭐고 따질 겨를이 없어서 실험실 생쥐처럼 백신 접종하는거잖아?\n빨리하는게 중요한게 아니라 잘하는게 중요한거야.\n빨리하는건 누구나 다 할수가 있어.\n그냥 엄벙덤벙 대충하면 되는거니까!\n근데 잘하는건 누구나 못한단다.\n신중히 준비해서 잘하는 것과 능력이 없어서 늦는걸 좀 구분하라고 새꺄!', '임기관심 없슴 ~ 마스크쓰면 감기예방에도 도움되니 넘 미워하지마~세요', '문죄인 또는 문재앙 임기는 내년 5월까지입니다. K 방역 어쩌구 하면서 방정만 떨줄 알았지 실제로 하는 것은 아무것도 없습니다. 오죽하면 작년 그 고생하며 치료에 힘쓴 간호사들 중에 아직도 월급 못받은 사람이 있을 정도입니다. 은근히 간호사들이 일하는 것을 방해하는 것이지요. 작년에 마스크도 삼성아니었으면 확보 못했습니다. 그러자 이재용을 구속한 것입니다.  정부가 못하는 것을 삼성이 해냈다는 말을 듣기 싫은 거지요. 이 정부가 있는한 코로나는 절대 해결되지 않습니다. 이 정부는 해결할 의지가 없기 때문이지요. 이래서 투표를 잘해야 하는 것입니다. ', '문재앙은 제대로 하는게 하나도 없고 존재자체가 재앙이네요 역대 대통령중 이렇게 무능력한사람도 참 없을듯 진심 탄핵하고 싶죠?  다들 그래요 성인이 봐도 한심한데 학생들은 얼마나 한심할까  어휴 하루하루가 끔찍한데 도대체 언제 끝나는지 참 다들 간절히 사라지길 바래요\n재앙이 업적\n1.집값 폭등 시키기\n2.화이자,모더나 백신 못구해서 훠훠 거리며 AZ백신으로 대체하고 자기는 안맞겠다고 발 빼기\n3. 비정규직을 정규직으로 전환시켜서 취준생\n벼랑 끝으로 내몰기 취업률 더 떨어짐\n4.공수처법 만들기,삼성 괴롭히기\n5.자기보다 잘난 사람들 괴롭힘 \n윤총장 사퇴시키기 \n(왜냐 자기가 관심 받아야 하니까)\n백신도 못구해서 AZ구해놓고 사람 다 죽게 만들고\n다른나라는 화이자 모더나 구해서  그냥 무능력하고 멍청한게 죄지 \n문재앙=무능력=돌데가리', '앞길이 창창한 청소년이시군요. 응원합니다.', '솔직히말해서  문재인대통령이 잘못한거도있지만 잘한거도있잖아요 문재인욕할시간에 더공부해요 님들은 권력잡으면 잘할거같죠 아니에요 그리고 님들 한국대통령중에서 깨끗한분 봐서요? 다 먼지 나와잖아요 그리고 정부욕하는시간에 더 취업자리 알아봐여 ', '2022년5월10입니다 ', '22년  5월이  쫑  입니다\n얼마  안  남았죠\n22년  3월에  선거 입니다\n5년이  50년  같습니다\n나라를  이렇게  단  시간에  망가뜨리는것도  재주 라면  재주입니다.', '2022년 5월 입니다.\n한전좀 살려내라..\n탈원전으로 적자 내 놓고..\n정작 그 기술을 북에다가 주냐..\n경제 퇴폐를 어떻게 이렇게 시키지 진짜로. .\n이래놓고  출산률 세계 최하위 0.8명 시대에 대학들 줄줄이 사라져가는데\n각종 특혜, 강제 취업보장. . 기업 입장에서도 쓸모없는 한전공대를 전라도에 꾸역꾸역 설립ㅋㅋㅋㅋ\n심지어 2022년3월 신입생모집 5월 대선인데..^^\n뻔하다 진짜로ㅋㅋㅋㅋㅋ\n7시에 표받으면 뭐하냐..대한민국에 7시만 있는게 아닌데..\n지지율 36% \n이쯤되면 사실 민주당 안티를 만들기위한  잠입세력이 아닐까 싶다.\n투표잘하자.. 제발.. 알고뽑아..', '버릇없는자슥.생각없는자슥.처맞을자슥 ㅋㅋ생각좀하고살자!', '문재인대통령이 임기 끝나도 이나라는 이미 공화국체제로 가고 있어서 늦음 다음 차기 대통령도 이재명 이낙연 싸움 똑같은 사람들이고 문재인대통령 보다 더 어마어마한 사람들 고딩 이시면 백신은 안맞아도 충분히 살아가는데 지장은 없으니 스스로 마스크 쓰면서 청결 유지하면 충분히 극복 합니다. 그냥 이제 답은 하나 공부 열심히 하셔서 지금 이라도 죽어라 미친듯이 들어오는 모든 돈은 저축 하면서 악착 같이 아끼는 습관 가지고 돈을 유지해 나갈수 있도록 재테크 공부도 하고 경제 지식 쌓으면서 나라 변하는거 파악 하세요. 이나라는 앞으로도 계속 돈 많은 사람만 살아남고 비참한 사람들은 더욱 비참해 집니다.  대학교 꼭 원하는 쪽으로 자기 적성에 맞는 전공 살려서  성공 하셧으면 좋겠네요. ', '대통령이 누구건 아무 상관없었는데\n너무 체감됩니다 지금부터라도 관심 가지고 열심히 투표 하려고 합니다\n관심 가지다 보니깐\n이제 보이기가 시작합니다\n살고 싶네요 잘 살고 싶네요', '22년5월10일 입니다', '남탓하지말고 열심히 삽시다', '임기는 내년 5월 나와서 구치소 에서 새로운 임기가 시작 될찌 모르겠네 ', 'ㅎ\n그러게요\n넘 못하네요.\n얼른 바뀌었으면 좋겠네요.', '고딩 학생이시네 ~\n고등 학생 치고는 사회 현실에  많은 관심이 있으시고 . . .\n뉘 집 자제분인지   정직하고 의롭고 사회적 약자들을 돕는  어른이 되기를 바랄께요.\n임기는  22년 5월까지로 알고 있는데,\n이 할배 생각으로는 ,  \n문 재인씨 같은 분이  우리 대한민국 대통령을 계속 맡아야 한다고 생각해요.\n지금의  헌법으로는 불가능하니, 개헌을 해서라도 연임을 하셨으면 좋겠네요 ~\n오늘이 4월 12일인데\n일본은 화이자 백신만 공급 계약을 했는데\n백신 만드는 국가에서  수출을 금지하고 있어서  백신이 원활하게 들어오지 않아\n고민이 많은 모양입니다.\n백신이 들어오면 접종하고 . . .  떨어지면 중단하고. . .\n이런 식으로 접종 중입니다.\n오늘부터  2천명인가 접종을 한다고  NHK뉴스에  나왔습니다.\n일본 인구 - 1억 2천만명 정도\n한국 인구 -    5천 2백만명 정도 \n고등학생이  코로나 백신에도 관심이 많으시고  . . .\n우리 사회에 꼭 필요한 인재가 되시길 바랄께요 ~   !\nNext image\n한국.일본의  코로나 19 환자 발생 현황\n( 2021. 04. 12. 현재 )\n일본 환자 발생 - 50만 7천명정도 \n한국 환자 발생 -  11만명 정도 \n일본 코로나 사망자 -   9,400명 정도\n한국 코로나 사망자 -   1,770명 정도 ', ' 2022년5월10일 입니다.  감사합니다 ', '외국에 있는분들은  불안해서  한국에  못들어와 난리인데  정작 안전한곳에 있는 이분들은 감사를 모르네요\n그렇게 싫으면  외국으로 떠나시면 됩니다\n직접 몸으로 체험해야 알것같네요\n미국은 바로 맞을수있는걸로 압니다\n급하게 만든 백신. 부작용 검증안된 백신   맞는거  불안해 하는사람 많아요\n최대한 늦게 맞고싶고  서두르는게 장땡은 아닙니다\n정책이  성공하는것도 실패하는것도 있는데  성공은 비하하고 실패만 부각시키는건 정치색이 많이 보여서   보기 좋진않네요\n나라의 순위가 높아지고.  한국의 인지도가 세계적으로  높아지고 있음에도 대통령을 옆집개이름처럼  부르시는데  기본은 지키시기 바랍니다\n저도 집 팔았다가  너무올라  다시 사지를 못하고있는 사람입니다\n역대 어느정권도  부동산에 해답은 없었습니다\n대통령 바뀐다고 제가   당장 집을 다시살수  있을거같지는 않네요 ', '그러게요 진짜 너무하네요 ㅎㅎ 빨리 진행되었음 하는 마음이네요', '말단공무원보다 일을 못해보임\n아 아직도1년.. 이인간 코로나덕을\n톡톡히 보고있는듯..\n그러니..멍청하게 투표를하니..\n우리나라 살기 좋~~~아졌네요', '공손한바퀴벌래\n이런데서그런말쓰면어케합니까\n댁에자제분이배웁니다\n어른들이부끄러운줄알아야지\n참한심하네요\n학생들이보는시각과\n님이보는시각은차이점이있읍니다\n먼저손내밀어사과하세요\n기성인들반성들합시다', '공산정권이죠\n공산당이 활개치고\n미디어 장악해서 뉴스 하나 없고\n돈은 어마어마어마하거 쓰고\n부정부패도 어마어마어마하그', '훠훠훠 학섕뉨도 짜장면 먹고 싶은 뭐, 그런 생강 없어요?', '문재인 대통령님은 정말 무능하시고 부도덕 하시고 위선적이십니다. 무사히 임기를 마치시고 직권남용, 직무유기에 대해서 법의 심판을 받으시길 바랍니다.', '진짜 아직도 1년이나 남았네요... 문재인 하나때문에 나라가 진짜 엉망입니다 ', '싹쓸어버려야한다    ᆞ\n문죄인   일당들\n부정부패자들 \n라임 옵팅머  편드 사기범들\n성폭력범들  ᆞ\n부동산 ᆞ땅투기범들 ᆞ\n북한유에스비\n나라부채늘리고  세금폭탄에  니들일당들은\n배터지게  국민혈세 어마하게 받아처먹고 배터지게  살지   ᆞᆞ\n싹쓸어버려야한다   ᆢᆞ\n국토부 ᆞ산자부ᆞ법무부  지낸장관들  사형시켜야한다 ᆞ\n문죄인일당들 나라부채 다갚고떠나라  ᆞ\n국민혈세 환수조치하고 재산몰수해야한다 글고 손해배상청구  차참수형에처해야한다  ᆞ\n이도적놈들아 ', '끝나도 민주당찍은 1600만 사형시켜야 됩니다.\n빡대가리새끼들 ', '짱개 같은 소리하고 있네 어린노무 색기가 뭘안다고 지끄리노 ?백신맞을라무 중국에서 가져다 맞으면되는거 아녀 ? 미국눈치 보느라 지금 이꼴아녀 ~세금만 더 늘리고 집값 폭등시키고 모루면 닥치고 있어요 ', '2022년 5월 10일에 끝납니다.\n개 앙몽이죠', '인제 10개월도 안 남았네요 하루 빨리 문재인이 철장호텔에 가든지 어느 산에서 추락할지 기대가 되네요', '오늘도 문재앙왕은 청해부대 코로나 확산을 군탓하며 마음으로 사과하셧어요 2022년 5월 10일 붕어 하시면 좋겟네요', '2022년 5월 10일입니다. 이제 10개월 남았네요. ㅠㅠ', '나라를 걱정하는 정말 멋진 청년이십니다. 대견스럽고 자랑스럽네요. 지지합니다', '네 임기기일은 약9개월쯤  남았겠고요 지루하더라도 좀기다리세요  다음정권은 당을배제한 지혜롭고  난세를잘풀어갈수있는 된사람을뽑아서 정직하게 일잘할수있도록 팍팍밀어줍시다']",36,https://kin.naver.com/qna/detail.naver?d1id=6&dirId=60701&docId=382433684&qb=67Cx7Iug&enc=utf8&section=kin&rank=251&search_sort=3&spq=0,대통령선거
