page,date,tags,questions,questions_add,answers,N_answer,url,category
13,2019.07.11,"['대상포진', '수원김찬', '대상포진병원', '대상포진치료']",수원김찬병원 대상포진치료 아시는분 계신가요?,"집안 어르신께서 수년전 대상포진이 걸리셨었는데, 아직까지 통증에 시달리고 계십니다.

우연히 버스광고에 김찬병원 대상포진 전문병원이라는 광고를 봤는데, 인터넷을 찾아보니

유명한 의사분이신듯 합니다.

혹시 김찬병원에서 치료받으면 호전이 될지 궁금하여 글남깁니다.","['대상포진 치유후에 지속되는 싱견성통증은 피부병이 아닌 신경세포 손상에 의한 \n증상이고, 연세가 많을 수록 대상포진 치유후 수년간 지속하는 경우니 신경과 \n전문의와 상담을 충고합니다.', '저도  대상포진 늦게 알아서 시골서 보름보름만에 갓는데 치료를 세게 해주셨어요 그러나 11년이 지난 지금도 저녁되면 아파서 고생합니다\n이틀후 일주일입원으로 집중치료하려구요\n그러시는분들이 꽤많으세요\n전문전문이니 다른긴 햇어요', '오늘까지 진료받은 생생후기입니다. 결론부터 말씀드리자면 완전 비추합니다. 처음가면 x-ray, 체열진단, 자극반응검사 , 혈액검사, 대상포진 dna검사 이렇게 5개 강제로 진행하고 30만원받구요. 실제로 대상포진 dna검사로 대상포진인지 아닌지 판단하는데 결과나오기까지 4일정도 걸립니다. 그 사이 병원은 두번 더 가게 되는데 말초신경주사와 레이져치료를하는데 이것도 갈때마다 가격이 다르지만 73000~85000원사이입니다. (이 부분은 나중에 따졌더니 10000원 환불해 줬습니다. 부르는게 값이더라구요.) 참!왜 이리 비싸냐구요? 대부분 다 비급여네요. 이거 환자 입장에서 내가 의사도 아닌데 치료하라고 하면 해야잖아요. 이 부분도 소비자 보호원에 문의했더니 자기네는 치료가 잘못된경우만 중재한다고....아놔 소비자보호원은 도데체 소비자를 보호하는건지 지네를 보호하는건지 뭐 하는 기관인지 모르겠네요.) 다시 본론으로 돌아와서 오늘 결과나오는 날이라 갔는데 dna검사결과 음성이라네요. 뭔소리냐면 대상포진이 아니란 뜻입이다. 그 사이 치료한건 멀쩡한 사람한테 이상한 주사 놓고 8만원(총 3회니 24만원이네요)이나 쳐받아먹었죠. 결국 피부과가라고 의뢰서 써줍니다. 질문 주신분은 대상포진일지 모르지만 광고하면 그 광고비 환자들이 내는겁니다. 잘 생각하셔요', ' 6월 말경 대상포진 별병 후 피부과 내과 대학병원 응급실 까지 갔었습니다.\n어느 곳에서도 대상포진 진단명을 못 내리시더라구요..아니 저 보다 더 몰랐습니다.\n진통제 .수액 맞고 온게 다 였네요. 통증은 갈수록 심해지고 지인분 소개로 김찬병원 갔습니다.\n3일 집중 치료 하고  퇴원해서 통원치료 받고 있습니다.첫째날 비급여 검사 포함되어 있으나 선택 사항이고 검사결과 당일 한시간 후에 교수님 다시 진료 보면서 병명 듣고 치료 계획 알려 주십니다.\n검사 결과 기다리는 동안 저는 입원을 계획 하여서 입원 절차 받고 좀 쉬다가 검사 결과 듣고 치료 받았습니다.\n아픈데 여기저기 돌다가 시간 낭비 하지마세요~~괜히 명의가 아니십니다^^\n어르신 빠른 괘유 빌께요!!', '지금 저희 어머니가 현재 치료중이십니다\n저는 수원사람 이구요\n토요날 피부과갔다오시고 대상포진이라고 하셨고 주말에 병원이 없어서 월요일8시 진료갔더랬죠 (아는분 반은  과잉진료,바가지 진료라함/또아는분  반은 대상포진 전문병원이라 가면 좋다고함)참고로  저희엄만실비없음제가 일때문에 남동생이갔는데  위에분처럼 1차 검사비만 286,000원? 선택검사아님 필히해야함  오전8시에가서3시되어 입원  꼬리쪽 허리쪽 주사놓는다고 함(부위마다 틀릴거라봄) 수욜날 잠깐들려 혹시나 하는 마음에 입원비 물으니 3일치 80만원은 넘는다고함 정확하지않아 영수증발급안됨   어떤사람들은 한달있으면500정도 나온다고도 함 ㅠㅠ\n그래도  엄마에게 여쭤보니 통증도 별로없고 밥도 괜찮게 나온다고 하셨음\n(5년전인가 백신접종해드림)\n돈걱정없고 실비되고 항바이러스같은주사만 나주는 피부과를 가서 심한 통증을 느끼신다면 가시는걸추천합니다  아직 치료중이시지만 아프지않다는 말씀만 들어도 안심이되거든요 그래도 곧 퇴원하고 통원치료 하려고합니다 \n병원비 압박@.@  통원비도 십여만원 나온다 하네요\n거의 주사는 비급여같고 급여라도 비싸다고 합니다. ', '수원 대상포진 전문 병원을 모아둔 사이트가 있으니 추천드려볼께요 !\n여러 병원이 한번에 모아져 있기때문에 보기에도 편리한 사이트에요\n최대한 꼼꼼하게 비교해보시고 참고하시면 도움 될것같습니다 ✔\nhttp://soonwidot.co.kr/rank/search.php?stx=%EC%88%98%EC%9B%90+%EB%8C%80%EC%83%81%ED%8F%AC%EC%A7%84\n수원 대상포진 - 인기순위 순위닷\n맛집순위, 여행순위, 교육순위, 보험순위, 신용카드순위, 자동차순위, 대출 순위 등 다양한 순위 정보 제공 사이트\nsoonwidot.co.kr', '김찬병원  비추천합니다.\n쓸데없는 진료비겁나 나옵니다.', '병원비엄청비쌈 비급여\n그리고 치료받고 더악화됨\n약조제도 잘못해서 택배로받음\n약물주사도잘못된듯  \n아무튼 혹때러갔다가 혹더붙이고\n시술받고 더아픔  의사왈  자기네는 거기안건드렸는데\n왜거기가아프냐고함\n의료사고인듯ㅎㅏ여\n전문변호사선임중 법정소송불가피']",8,https://kin.naver.com/qna/detail.naver?d1id=7&dirId=710&docId=331024714&qb=67Cx7Iug&enc=utf8&section=kin&rank=122&search_sort=3&spq=0,"의료기관, 의료인"
13,2020.10.16,"['독감예방접종', '독감예방주사']",독감 예방 접종 한 후에 아프면 어떻게 해야 하나요?,"상온 노출 아니고 그 후에 나온 독감 예방 접종을 어제 했는데 몸이 아프더라고요. 며칠 더 지켜본 후에 그때도 아프면 병원을 가라고 하던데 독감 접종 맞은 곳으로 가야 하나요? 아니면 집에서 가까운 근처 병원에 가도 되나요? ( 주변 동네 병원은 청소년 독감지원병원이 아니라 다른 곳으로 갔어요.)
그리고 만약에 병원을 가서 진단을 받았는데 독감이 아닌 경우 그냥 단순 감기로 판명나는 지 궁금합니다.","['독감 예방접종을 하면 접종부위에 발적, 부기, 멍울, 통증 등이 있을 수 있고, 발열과 근육통 등의 전신증상도 있을 수 있습니다(*이런 증상들은 대부분 수일내에 저절로 없어집니다).\n참고로 말씀드리면 접종부위에 열이 나거나 통증이 있으면 냉찜질을 하는 것이 증상 완화에 도움이 되며, 발열과 근육통 등의 전신증상이 있으면 해열진통제 등의 약을 복용해도 괜찮습니다. \n만약 심하게 아프면 병원치료가 필요하므로, 예방접종을 한 병원이나 집 근처 내과병의원에 가서 치료를 받으시기 바랍니다.\n저의 답변이 건강관리에 조금이나마 도움이 되었으면 합니다.', '안녕하세요 ㅎㅎㅎ\n가장 정확한 안내상\n원래 독감 주사후 \n일시적인 부작용/ 심각한 부작용 나뉩니다\n<독감 부작용 증상> 두드러기, 발열, 근육통 (독감 예방접종 부작용)\n독감주사 부작용 독감 부작용 (구토, 두드러기, 미열, 현기증) _ 독감예방주사 우리는 대체로 9월 이후 12월 사이 환절기 부터 추운 겨울이 되면 독감주사를 맞는 시즌이 옵니다. 독감 바이러스들은 뜨겁고 습한..\ndingdo.tistory.com\n위는 독감 부작용 증상 안내 입니다(독감주사 부작용)', ""위에 질문주신 내용은 정확히 모르겠네요. 혹시나 아래 내용도 참고해보시면 좋을 것 같습니다.\n무료독감 백신 예방접종 대해서 정리하였습니다. 한번 참고해 보시면 도움이 될 것 같습니다. 도움이 되셨다면 채택 부탁드립니다.\n▼  전국 11명 사망 무료 독감 백신 이대로 괜찮은가? (++보건복지부 입장)\nhttps://info.dinoa.xyz/158\n전국 16명 사망 무료 독감 백신 이대로 괜찮은가? (++보건복지부 입장)\n무료 독감 백신 안전한가? 목차 11번째 사망자 발생 대전에서 독감 백신을 맞은 후 의식 불명에 빠졌던 70대 여성이 끝내 숨졌습니다. 대전에서 독감 백신 접종 후 숨진 두 번째 사례입니다. 전국에서는 11번째입..\ninfo.dinoa.xyz\nhttps://info.dinoa.xyz/140\n무료 독감 백신 예방 접종 신청방법 (++홈페이지 링크)\n하늘 아래 다양한 정보를 전달하는 하 늘 정 보 입니다. 오늘은 '무료 독감백신 예방접종' 에 대해서 알아보겠습니다. 목차 2020년 무료 독감백신 예방접종 신청방법 국가에서는 '인플루엔자 국가예방접종 지..\ninfo.dinoa.xyz\nhttps://realtime.dinoa.xyz/362\n독감 무료예방접종 사업 다시 시작 (++최신 업데이트)\n독감 무료예방접종 신청 목차 독감 무료예방접종 사업 재개 유통 중 '상온 노출' 사고로 접종이 중단되었던 2020∼2021절기 겨울철 인플루엔자(독감) 예방접종 사업이 13일부터 전국 보건소와 2만1000여곳의 접종..\nrealtime.dinoa.xyz"", ""위에 질문주신 내용은 정확히 모르겠네요. 혹시나 아래 내용도 참고해보시면 좋을 것 같습니다.\n무료독감 백신 예방접종 대해서 정리하였습니다. 한번 참고해 보시면 도움이 될 것 같습니다. 도움이 되셨다면 채택 부탁드립니다.\n▼  전국 11명 사망 무료 독감 백신 이대로 괜찮은가? (++보건복지부 입장)\nhttps://info.dinoa.xyz/158\n전국 16명 사망 무료 독감 백신 이대로 괜찮은가? (++보건복지부 입장)\n무료 독감 백신 안전한가? 목차 11번째 사망자 발생 대전에서 독감 백신을 맞은 후 의식 불명에 빠졌던 70대 여성이 끝내 숨졌습니다. 대전에서 독감 백신 접종 후 숨진 두 번째 사례입니다. 전국에서는 11번째입..\ninfo.dinoa.xyz\nttps://info.dinoa.xyz/140\nhttps://realtime.dinoa.xyz/362\n독감 무료예방접종 사업 다시 시작 (++최신 업데이트)\n독감 무료예방접종 신청 목차 독감 무료예방접종 사업 재개 유통 중 '상온 노출' 사고로 접종이 중단되었던 2020∼2021절기 겨울철 인플루엔자(독감) 예방접종 사업이 13일부터 전국 보건소와 2만1000여곳의 접종..\nrealtime.dinoa.xyz""]",4,https://kin.naver.com/qna/detail.naver?d1id=7&dirId=7010101&docId=370926590&qb=67Cx7Iug&enc=utf8&section=kin&rank=121&search_sort=3&spq=0,호흡기내과
12,2020.10.21,[],스미싱 당했어요ㅠㅠㅠ 도와주세요ㅠㅠ,제가 스미싱을 당했는데요..ㅜㅜ 해결책좀 알려주세요ㅜㅠ 너무 무서워요ㅠㅠㅠ 자꾸 메세지가 크롬이 기본앱으로 바뀌는데 어떡하죠ㅠㅠ 미자인데 너무 무서워요ㅠㅠ,"['* 질문자님께서 수신받으신 문자의 원본을 캡쳐하여 1:1 질문이나 추가질문을 통해 첨부 하여 문의주시면 사이트 차단 및 유사한 사례 수집에 많은 도움이 됩니다.\n악성앱 설치로 보입니다. 크롬이라고 말씀하신걸 보아 Chrome 애플리케이션으로 위장한 스미싱 앱 다운로드로 보입니다.\n아래 내용 참고하셔서 조치하시기 바랍니다.\n질문자님께서 수신받으신 문자는 스미싱 입니다.\n참고 : https://blog.supersu.kr/security/smartphone/20200603-moqhao-cj-parcel-smishing-warning\n참고 : https://blog.supersu.kr/security/smartphone/fake-delivery-smishing-warning\n* 수신받으신 문자의 원본을 캡쳐하여 1:1 질문이나 추가질문을 통해 첨부 하여 문의주시면 사이트 차단에 많은 도움이 됩니다.\n< Android 기기만 해당 >\n웹 사이트에서 Chrome 버젼을 업데이트 해달라고 하면서 앱 설치를 요구하는것은 사기 입니다!!!\n악성앱을 설치하셨다면 반드시 제거 바랍니다.\n* 악성앱은 약 200KB ~ 3MB 사이의 매우 적은 용량을 가진 Chrome (혹은 Chrome. / Chrome.. / Chrome . / Chrome Beta ) 이란 이름을 가졌습니다. 직접 수동으로 제거 바랍니다.(단, 악성앱마다 약간의 차이가 보일 수 있습니다.)\n< iOS 기기만 해당 >\niOS 는 답변일 기준으로 가짜 사이트로 연결되지는 않지만, 언제든지 가짜 사이트로 연결될 수 있으므로 주의하시기 바랍니다.\n택배사는 절대로 핸드폰 번호로 인증을 요구하지 않으며, 무조건 운송장 번호 입니다!!!\n택배사는 절대로 Chrome 업데이트를 요구하지 않습니다!!!\n택배사는 절대로 이름이나 생년월일을 요구하지 않습니다!!!\n또한, 택배사가 Apple 계정에 대한 보안을 요구하거나, Apple 계정에 대해서 입력을 요구하는 경우는 절대 존재하지 않으므로 이 점 각별히 유의 하시기 바랍니다.\n택배사는 긴급재난지원금을 지원하지 않으므로 절대로 핸드폰 번호 인증은 하지 마시기 바랍니다!!!', '안드로이드 스미싱 패턴은 흔히 링크를 클릭하면 기기곤리자 권한을 요구하면서 앱을 설치하거든요.\n백신을 검사하거나 요즘은 소액결제도 요구하므로 우선 차단하는 것이 좋아보여요.\n문자 스미싱 공격사례 신고 및 수신거부 차단 방법\n문자 스미싱 공격사례 신고 및 수신거부 차단 방법. 요즘 스미싱 문자를 수신하여 악성앱이 설치되거나 개인정보가 유출되지 않을까 걱장하는 분이 많습니다. 지금은 너무 불안하지만 택배, 카톡, 건강검진 등 문..\ndazemonkey.tistory.com']",2,https://kin.naver.com/qna/detail.naver?d1id=1&dirId=1070202&docId=371342172&qb=67Cx7Iug&enc=utf8&section=kin&rank=119&search_sort=3&spq=0,휴대전화사용
12,2020.10.21,[],독감주사 맞고 6~7일 정도 지났는데 어제밤부터 오늘 아침에 일어났더니 너무피곤하고 좀 힘이 없어요 지금은 학교갔다와서 좀 나아진것같은데 어제 분명 일찍잤는데 피곤하고힘이없는게 무서워요 요새 갑자기 독감주사맞고 돌아가신분들도 좀 계셔서 ... 뉴스에서 나온 폐혈증이나 부작용아닐까하고 너무무서워요 뭐원래도 또래들보다 면역력이 딸리기도하고 피곤한건 있었는데 오늘 조금 심한거같아요 병원가봐야할까요? 혹시 주사맞고 밴드를 엉뚱한데 붙이고 주사맞은곳을 꾹누르지도 않아서 그런걸까요..,,"['병원에 가봐야 될것 같애요', '안녕하세요~~! 최근 독감주사로 인해 사망사건이 발생했다고 합니다... 독감주사 맞기전에 어디제품인지 확인하고 맞으시는걸 추천드립니다... 그게 더욱 안전하니까요 ㅠㅠ저도 이곳저곳 알아보고 여러글 살펴보다가 독감 예방접종 시기 가격 정리 ,무료로받는 꿀팁까지!!잘 정리된곳이 있어서 정보드립니다~!\n고민 해결하시는데 도움이 되었으면 하는 바램입니다. 기타 궁금하신 점은 아래 링크 남겨드릴테니 참고하시면 도움이 되실 것 같네요.\n▼독감주사 사망 가장 충격적인 이유(+성분 부작용 두통 신성약품 인천)\nhttps://speedsalgoo.tistory.com/683\n독감주사 사망 가장 충격적인 이유(+성분 부작용 두통 신성약품 인천)\n독감주사 사망 가장 충격적인 이유(+성분 부작용 두통 신성약품 인천) 인천에서 17세 청소년이 독감백신을 맞고 이틀 뒤 사망한 사례가 확인됐습니다. 정은경 정부 중앙방역대책본부장은 2020년 10월 1..\nspeedsalgoo.tistory.com\n▼독감 부작용 증상 총정리(+팔 통증 몸살 두드러기 설사 두통 붓기 미열 구역질)\nhttps://speedsalgoo.tistory.com/691\n독감 부작용 증상 총정리(+팔 통증 몸살 두드러기 설사 두통 붓기 미열 구역질)\n독감은 보통 11월 말에서 2월 말까지 유행 하는 급성 호흡기 질환 입니다. 예방 주사 접종 후, 2주 뒤 부터 효과가 나오니 10월 말에서 11월 초가 독감 예방 접종의 최적의 시기 입니다. 하지만 요즘 독감 부작용..\nspeedsalgoo.tistory.com', ""위에 질문주신 내용은 정확히 모르겠네요. 혹시나 아래 내용도 참고해보시면 좋을 것 같습니다.\n무료독감 백신 예방접종 대해서 정리하였습니다. 한번 참고해 보시면 도움이 될 것 같습니다. 도움이 되셨다면 채택 부탁드립니다.\n▼ '무료 독감 백신 사망자 계쏙 발생' 이대로 괜찮은가? (++보건복지부 입장)\nhttps://info.dinoa.xyz/158\n전국 16명 사망 무료 독감 백신 이대로 괜찮은가? (++보건복지부 입장)\n무료 독감 백신 안전한가? 목차 11번째 사망자 발생 대전에서 독감 백신을 맞은 후 의식 불명에 빠졌던 70대 여성이 끝내 숨졌습니다. 대전에서 독감 백신 접종 후 숨진 두 번째 사례입니다. 전국에서는 11번째입..\ninfo.dinoa.xyz""]",3,https://kin.naver.com/qna/detail.naver?d1id=7&dirId=70122&docId=371337676&qb=67Cx7Iug&enc=utf8&section=kin&rank=120&search_sort=3&spq=0,응급의학과
12,2020.10.24,[],마태복음1:21 : 예수님이 인간들 중에서 지금까지 죄를 구원한 사람이 있는가요?,"예수님은 스스로 자신은 사생아라고 했습니다. 사실 예수님은 로마병사와의 사이에서 태어난 사생아이지요.

그런 예수님이 인간중에서 죄를 구원해준 사람이 있는가요?
소경들은 저 뜻이 뭔지 모릅니다.","[""안녕하세요.\n예슈아(ישוע - 예수님 히브리어 표기)를 사모하는 평신도입니다.\n세상의 끝이 얼마 안남았습니다.\n예슈아 주님이 이 세상에 곧 다시 오십니다.\n시간이 없습니다. 급박합니다. 주님께서 이와 같은 메세지를 전파하라고 하십니다.\n우리 모두 새하얀 세마포를 걸쳐 신랑되시는 주님을 기다리는 슬기로운 신부가 되어야 합니다.\n전심으로 회개하십시오, 주님께 다시 돌아가십시오. 뜨뜨미지근한 믿음에 성령의 기름 부으시고 주님을 경외하며 주님과 동행하십시오. 성화의 삶을 사십시오!\n믿지 않으시는 분들은 주 예슈아를 영접하세요. 주님은 우리 모두를 사랑하십니다. 우리 한 영혼 한 영혼을 구원하시길 원합니다. 예슈아 외에는 구원의 길이 없습니다, 여러분. 죄의 삯은 사망이요, 우리의 죄를 사하실 수 있는분은 오직 예슈아입니다. 그의 십자가를 통해 예슈아의 피로 우리의 죄를 사하여 주셨습니다. 예슈아를 구주로 영접하세요. 시간이 없습니다.\n-마태복음 24장-\n21. 이는 그 때에 큰 환난이 있겠음이라 창세로부터 지금까지 이런 환난이 없었고 후에도 없으리라\n22. 그 날들을 감하지 아니하면 모든 육체가 구원을 얻지 못할 것이나 그러나 택하신 자들을 위하여 그 날들을 감하시리라\n23. 그 때에 사람이 너희에게 말하되 보라 그리스도가 여기 있다 혹은 저기 있다 하여도 믿지 말라\n24. 거짓 그리스도들과 거짓 선지자들이 일어나 큰 표적과 기사를 보여 할 수만 있으면 택하신 자들도 미혹하리라\n25. 보라 내가 너희에게 미리 말하였노라\n26. 그러면 사람들이 너희에게 말하되 보라 그리스도가 광야에 있다 하여도 나가지 말고 보라 골방에 있다 하여도 믿지 말라\n27. 번개가 동편에서 나서 서편까지 번쩍임 같이 인자의 임함도 그러하리라\n28. 주검이 있는 곳에는 독수리들이 모일 것이니라\n29. 그 날 환난 후에 즉시 해가 어두워지며 달이 빛을 내지 아니하며 별들이 하늘에서 떨어지며 하늘의 권능들이 흔들리리라\n30. 그 때에 인자의 징조가 하늘에서 보이겠고 그 때에 땅의 모든 족속들이 통곡하며 그들이 인자가 구름을 타고 능력과 큰 영광으로 오는 것을 보리라\n-요한계시록 14장-\n9. 또 다른 천사 곧 셋째가 그 뒤를 따라 큰 음성으로 이르되 만일 누구든지 짐승과 그의 우상에게 경배하고 이마에나 손에 표를 받으면\n10. 그도 하나님의 진노의 포도주를 마시리니 그 진노의 잔에 섞인 것이 없이 부은 포도주라 거룩한 천사들 앞과 어린 양 앞에서 불과 유황으로 고난을 받으리니\n11. 그 고난의 연기가 세세토록 올라가리로다 짐승과 그의 우상에게 경배하고 그의 이름 표를 받는 자는 누구든지 밤낮 쉼을 얻지 못하리라 하더라\n12. 성도들의 인내가 여기 있나니 그들은 하나님의 계명과 예수에 대한 믿음을 지키는 자니라\n13. 또 내가 들으니 하늘에서 음성이 나서 이르되 기록하라 지금 이후로 주 안에서 죽는 자들은 복이 있도다 하시매 성령이 이르시되 그러하다 그들이 수고를 그치고 쉬리니 이는 그들의 행한 일이 따름이라 하시더라\n-진리를 전파하는 유투브 채널-\n-코뿔소TV 서울 김포영광교회 https://www.youtube.com/channel/UC2Brddysh5qpf3zD2wrTbRg\n-예슈아커밍 https://www.youtube.com/channel/UCFerZk-FqpLbEi1JYMhZA4Q\n-흰비둘기TV https://www.youtube.com/channel/UCZ0tF-Gf8sOokp893AMvRIw\n-마지막기회- 휴거를 보고 깨어나십시오 https://www.youtube.com/channel/UCyGXE-IVpnM8xKoVCIIEIDA\n-에베드 아도나이 עבד אדני חן χάρις https://www.youtube.com/channel/UCZDdAJED2FhTtorgwa42RVQ\n-여호와로이 2TV https://www.youtube.com/channel/UCknb4JOYDMhikrnevMdW69w/videos\n-genoark2 https://www.youtube.com/channel/UC--L--_f3e5In69IyzMPLRg\n-좁은길 가이드 https://www.youtube.com/channel/UCUosVs6x-0iVuZRB4AkQHZg\n-Yeshua is coming soon https://www.youtube.com/channel/UC3eXQwYT825mR-ykCfCBYTg/videos\n위 유투브 채널들을 구독하시고 시청하시기 바랍니다. 영적으로 잠든 우리들은 빨리 깨어나야 합니다.'\n휴거를 사모하십시오. 대환란이 곧 시작됩니다.\n들림받지 못하더라도 짐승의 표 (생체칩, 백신 등..)를 절대 받지 말아주세요.구원을 받을 수 없습니다.\n세계종교통합에 앞장선 음녀 로마 카톨릭, WCC, WEA 가입한 교단에 가입된 교회들로부터 도망치세요. 진리를 갈구하세요. 성령님께 분별의 영을 달라고 사모하시기 바랍니다.\n저를 사이비/이단이라고 불리시지 말아주세요.\n저는 예슈아를 갈망하는 평범한 신자입니다.\n여러분을 사랑하여 이렇게 글을 씁니다.\n이 글을 널리 널리 퍼트려주세요.\n감사합니다.""]",1,https://kin.naver.com/qna/detail.naver?d1id=6&dirId=60901&docId=371579247&qb=67Cx7Iug&enc=utf8&section=kin&rank=118&search_sort=3&spq=0,개신교
12,2020.10.27,[],코로나 종식,1년안에 안되겠죠?,"['종식되더라도 개도국은 완벽히 종식이 어렵죠', '백신과 치료제가 나오는 시간이 오래 걸려서 완전 종식까지는 오래 걸린다고 합니다.\n기모란교수님이 인터뷰 한 내용 있는데 참고하세요\nhttps://masterofhope.tistory.com/8\n코로나 백신 언제 맞을 수 있나(다스뵈이다-기모란교수 출연 내용 정리)\n코로나 백신 언제 맞을 수 있나(다스뵈이다-기모란교수 출연 내용 정리) 안녕하세요 노는시간입니다. 요즘 코로나 시대를 맞이해서 생활패턴이 많이 변화되면서 불편하고 답답한 부분들 참 많으시죠? 저도..\nmasterofhope.tistory.com']",2,https://kin.naver.com/qna/detail.naver?d1id=7&dirId=705&docId=371767062&qb=67Cx7Iug&enc=utf8&section=kin&rank=117&search_sort=3&spq=0,대체의학
