page,date,tags,questions,questions_add,answers,N_answer,url,category
21,2019.11.20,[],해킹 바이러스 원격,"질문 올립니다. 전문가님

 PC 대기모드를 시킵니다.
말그대로 대기모드입니다.
언제든지 바로 pc를 사용하고 싶어서요.

그런데, 가끔, 대기모드 상태에서 , 마우스를 움직이면, 
나도 모르게, 윈도설치 모드로 가버립니다.

저 번에는 아애 포멧이 되어 버렸어요,

전문가님의 추측이 아닌 전문 지식의 답변을 부탁드리겠습니다.
이런 일 첨 입니다.
(문서 작업을 많이 하고 있습니다..)","['혹시 CD롬에 윈도우 설치 CD가 들어있거나 ISO파일이 컴퓨터에 마운트 되어있는지 확인해보셨는지요.\n보통 윈도우 설치 모드로 간다고 하시면은 윈도우 설치 CD나 ISO파일이 마운트 되어있는 경우가 많습니다.\n아니면 윈도우 복구모드일 가능성도 염두에 두셔야 되고요\n포맷이 되어버린걸로 봐서는 아마 해커가 자료소실을 목적으로 실행한것으로 보입니다만...\n제가 작성자님 컴퓨터를 직접 확인할 수 없는 상황이라\n데이터 복구 센터나 기타 컴퓨터 조사 업체에 의뢰하셔야 될것으로 판단됩니다.', '러시안백신 써보세요\n훨씬 죻습니']",2,https://kin.naver.com/qna/detail.naver?d1id=1&dirId=11001&docId=340782953&qb=67Cx7Iug&enc=utf8&section=kin&rank=203&search_sort=3&spq=0,해킹
21,2020.10.08,[],마케팅 관련 연구윤리가 지켜지지 않은 사례3가지 알려주세요,마케팅 관련 연구윤리가 지켜지지 않은 사례 3가지 알려주세요 ㅠㅠ,"['요번 코로나 백신 관련해서도 그렇지 않아요? \n아직 백신 개발 안 되었는데도 할 가능성이 있다고 해 주가를 높였다는 의혹도 있거니와 \n백신 때문에 사람이 죽었다는데도 보건당국에서는 별로 대수롭지 않게 여기는 등 ... \n만병통치약, 최대 효과 등, 극단적인 표현을 사용한 광고는 제재 대상입니다. \n방송에 출연 했다가 나중에 모자이크 처리 돼서 뉴스에 나오기도 ... ']",1,https://kin.naver.com/qna/detail.naver?d1id=11&dirId=110310&docId=370169410&qb=67Cx7Iug&enc=utf8&section=kin&rank=202&search_sort=3&spq=0,"도덕, 윤리"
21,2020.10.09,"['검색질문', '통합검색궁금증', '통합검색질문하기']",우리나라 코로나19 백신 확보 상황,,"['아직까지 나온 백신은 없다고 들었습니다 \n항상 코로나조심하시고 마스크 필수로 챙겨다니세요 ㅎㅎ\nhttps://coupa.ng/bLnXGM\n탐사 국내생산 KF-AD 비말차단 마스크 대형\nCOUPANG\ncoupa.ng\n“파트너스 활동을 통해 일정액의 수수료를 제공받을 수 있음""']",1,https://kin.naver.com/qna/detail.naver?d1id=8&dirId=816&docId=370272288&qb=67Cx7Iug&enc=utf8&section=kin&rank=201&search_sort=3&spq=0,외국인 한국생활
20,2020.10.10,"['임신부', '예방접종', '백신', '#임신부인플루엔자']",임산부 독감주사 맞았는데요,"현재 17주 임산부입니다.
이번주 수요일 a형 간염, b형간염 백신을 동시 접종 하였습니다.
별 다른 이상 증상 없었고
토요일에는 독감 무료 백신 접종 했는데요..
막상 하고 나니 너무 연달아 맞은 거 아닌지 걱정이 되어서요.
물론 병원 문진표에 한달내에 접종한 적 있다고 표시는 했지만
그게 3일전 이란 얘긴 안 했어요 ㅠㅠ
저는 별 이상 없지만 아기도 괜찮을까요?
병원을 가봐야 할까요?","['안녕하세요~!!\n코로나19로 인해 뒤숭숭한 요즘\n정부에서 독감 무료접종을 실시한다고 합니다.\n무료접종 관련 자세한 내용은 아래글을 참고해보세요~!!\n▼독감 무료접종 예방접종 바로가기', '안녕하세요~~! 최근 독감주사로 인해 사망사건이 발생했다고 합니다... 독감주사 맞기전에 어디제품인지 확인하고 맞으시는걸 추천드립니다... 그게 더욱 안전하니까요 ㅠㅠ저도 이곳저곳 알아보고 여러글 살펴보다가 독감 예방접종 시기 가격 정리 ,무료로받는 꿀팁까지!!잘 정리된곳이 있어서 정보드립니다~!\n고민 해결하시는데 도움이 되었으면 하는 바램입니다. 기타 궁금하신 점은 아래 링크 남겨드릴테니 참고하시면 도움이 되실 것 같네요.\n▼독감주사 사망 가장 충격적인 이유(+성분 부작용 두통 신성약품 인천)\nhttps://speedsalgoo.tistory.com/683\n독감주사 사망 가장 충격적인 이유(+성분 부작용 두통 신성약품 인천)\n독감주사 사망 가장 충격적인 이유(+성분 부작용 두통 신성약품 인천) 인천에서 17세 청소년이 독감백신을 맞고 이틀 뒤 사망한 사례가 확인됐습니다. 정은경 정부 중앙방역대책본부장은 2020년 10월 1..\nspeedsalgoo.tistory.com\n▼독감 예방접종 시기 가격 정리 (+ 독감 무료접종 대상자 예약기간)\nhttps://speedsalgoo.tistory.com/485\n독감 예방접종 시기 가격 정리 (+ 독감 무료접종 대상자 예약기간)\n가을이 되면서 독감과 신종 코로나바이러스 감염증의 동시 유행을 뜻하는 더블 팬데믹에 대한 우려가 커지고 있습니다. 정부는 독감과 코로나 19 환자가 뒤섞일 경우 방역 체계에 혼란이 올 수 있는 만큼, 올해는..\nspeedsalgoo.tistory.com', '저도 돌아다니다가 블로그에서 정보를 얻었는데 질문자님께 도움이 되었으면 합니다.\n임산부 인플루엔자(독감) 예방접종 꼭 하세요!\n열일하는 질병관리청! 오늘은 임신부 인플루엔자 예방접종 소식을 들고왔습니다! 함께 확인해보아요. 두 생명을 살리는 소중한 예방접종, 임신부 인플루엔자 예방접종 꼭 하세요! 인플루엔자는 임신부와 태아에..\neasykook.tistory.com', ""무료독감 백신 예방접종 대해서 정리하였습니다. 한번 참고해 보시면 도움이 될 것 같습니다. 도움이 되셨다면 채택 부탁드립니다.\n▼ '무료 독감 백신 사망자 계쏙 발생' 이대로 괜찮은가? (++보건복지부 입장)\nhttps://info.dinoa.xyz/158\n전국 16명 사망 무료 독감 백신 이대로 괜찮은가? (++보건복지부 입장)\n무료 독감 백신 안전한가? 목차 11번째 사망자 발생 대전에서 독감 백신을 맞은 후 의식 불명에 빠졌던 70대 여성이 끝내 숨졌습니다. 대전에서 독감 백신 접종 후 숨진 두 번째 사례입니다. 전국에서는 11번째입..\ninfo.dinoa.xyz"", ""무료독감 백신 예방접종 대해서 정리하였습니다. 한번 참고해 보시면 도움이 될 것 같습니다. 도움이 되셨다면 채택 부탁드립니다.\n▼ '무료 독감 백신 사망자 계쏙 발생' 이대로 괜찮은가? (++보건복지부 입장)\nhttps://info.dinoa.xyz/158\n전국 16명 사망 무료 독감 백신 이대로 괜찮은가? (++보건복지부 입장)\n무료 독감 백신 안전한가? 목차 11번째 사망자 발생 대전에서 독감 백신을 맞은 후 의식 불명에 빠졌던 70대 여성이 끝내 숨졌습니다. 대전에서 독감 백신 접종 후 숨진 두 번째 사례입니다. 전국에서는 11번째입..\ninfo.dinoa.xyz""]",5,https://kin.naver.com/qna/detail.naver?d1id=7&dirId=7010101&docId=370372434&qb=67Cx7Iug&enc=utf8&section=kin&rank=200&search_sort=3&spq=0,호흡기내과
20,2020.10.13,['#광고사이트'],인터넷 광고 사이트가 계속 뜹니다.,"다운 받다가 바이러스에 걸렸는지 인터넷 쇼핑몰 사이트와
각종 광고사이트가 1분에 3~4개씩 자꾸 뜹니다..
뭐가 깔린 걸까요..?

내공 100 드립니다.","['광고가 자동으로 뜨는 현상은 아마 애드웨어로 보이네요 \n말 그대로 계속 광고 팝업 창이 뜨는 바이러스.\n저도 예전에 애드웨어에 한 번 감염된 적이 있어요. 그때 MZK라는 (백신)프로그램으로 해결했어요 \n광고 아니고 사업용 프로그램도 아닙니다. \n네이버에 검색하시면 MZK 네이버 카페나 \n하단의 공식 사이트에서 다운이 가능합니다.\nhttps://malzero.xyz/\nMalware Zero - 무료 악성코드 제거 도구\n악성코드 및 애드웨어 등 각종 유해 프로그램에 의한 고통에서 해방되기 위해 설치 없이 사용 가능한 무료 악성코드 제거 도구\nmalzero.xyz', '애드웨어 설치에 따른 인터넷 광고 사이트 표출 문제로 보입니다.\n애드웨어는 개념상 바이러스가 아니므로\n일반 백신으로 검사해도 큰 효과를 보기 어렵습니다.\n보통은 프로그램 목록에서 해당하는 항목을 찾아\n일일이 삭제해주는 것으로 문제를 해결합니다.\n제어판 > 프로그램 제거에서\n최신순으로 정렬하신 뒤\n문제가 발생한 기점으로부터 설치한 기억이 없거나\n수상한 프로그램들을 모두 삭제해주세요.\n정확히 어떤 걸 지워야하는지 잘 모르겠다면\n프로그램 목록을 캡쳐해서 추가질문 남겨주셔도 됩니다.\n혹은 별도의 툴을 이용해서 인터넷 광고 사이트를 제거하시는 방법도 있습니다.\n프리웨어 중에는 헬프클린 추천드려요.\n네이버 자료실에서 받을 수 있고\n간편최적화로 인터넷 광고 사이트 제거가 가능합니다.\n헬프클린\n인터넷 광고창 제거 및 PC 최적화 프로그램\nsoftware.naver.com']",2,https://kin.naver.com/qna/detail.naver?d1id=1&dirId=10201&docId=370633500&qb=67Cx7Iug&enc=utf8&section=kin&rank=199&search_sort=3&spq=0,웹브라우저
20,2020.10.15,"['컴퓨터', '백신', '#컴퓨터광고']","컴퓨터가 계속 광고가 뜨는 바이러스가 걸렸는 데 좋은 백신 있을까요??
(알약 백신 말고)",,"['저는 백신은 모르겠는데 windows 검색창에 %appdata% 치고들어가면 앱들이 막 있어요!\n그런데 거기에 보도 못한 이상한 앱이 있으면 검색창에 그걸 쳐보고 바이러스 라고 하면 지우세요\n그리고 바이러스른 완전히 지우려면 그 바이러스의 이름을 치고 우클릭, 제거를 누르세요.\n그걸 지우고 재시작하면 더 좋아요\n혹시 작동중이라고 안지워지면\nCtrl+shift+C를 눌러서 작동중인 앱을 볼수 있는데 거기서 자세히 보기를 누르고 바이러스의 아이콘이나 이름 을 찾으세요. 그걸 작동중지 한뒤 지우세요\n전 그렇게 했는데 그게 지워져서 더이상  광고가 안 뜨더라고요.\n채택해주세요', '악성코드/애드웨어(툴바,검색도우미)등 설치돼서 일어나는 증상입니다\n▶ 직접 삭제 원할 경우, 해결되지 않으면 다음 단계 점검 방법\n① 제어판 설치된 목록에서 날짜순 정렬 > 최근 설치된 목록 중 모르는 항목 삭제 > 재부팅\n ex) 윈도우10 경로 - 제어판\\프로그램\\프로그램 및 기능\n② 제어판 목록 점검 → 제어판 설치된 목록 캡처 이미지 추가 후 질문주세요\n③ 해당 폴더 목록 점검 → Program Files , Program Files (x86)\n④ 해당 폴더 목록 점검 → Local , LocalLow , Roaming , ProgramData\n▶ 프로그램 사용해서 삭제 원할 경우, mzk 검색(확인)후 결정하세요 (무료/가입불필요/광고없음)', '바이러스 감염을 의심해봐야 될 것 같으며,\n광고창이 다 발생되는 멜웨어 바이러스에 감염되었을 확률이 큽니다.\n해결방안으로는 mzk라는 치료프로그램을 사용하는 방법이 있어요.\nhttps://malzero.xyz/ [Malware Zero - 무료 악성코드 제거 도구]\n위 사이트 가셔서 mzk 툴 다운 받으시고 실행하세요.\nmalwareZero 파일 내 start 배치파일 실행하시면 말끔히 치료되어집니다.\n부가적으로 아래 앱체크 다운/설치하고 검사해서 랜섬웨어 방지 하는것도 추천드립니다.\nhttps://software.naver.com/software/summary.nhn?softwareId=GWS_001571\n좋은결과 있기를 바랍니다 ^^', '안녕하세요 판다VPN 지식IN 상담원입니다\n제한된 사이트를 우회하셔서 이용하셨나보네요~ !\n그런경우\n크롬>메뉴>설정>사이트설정>알림>허용됨>해당광고주소>삭제 하시면됩니다 ! \n무료vpn이나, https우회서비스를 이용중이시라면 해킹이나, 바이러스감염등\n심각한 피해사례가 많으니 주의하셔야합니다\n저희 판다vpn은 전세계에서 한국서버 50개이상 보유 \n게임유저들의 위한 게임서버 다수보유, 각종 해외서버도 보유중입니다 ^^\n네이버에 ""판다VPN"" 를 검색해주세요', '컴퓨터 광고는 애드웨어 설치에 따른 문제입니다.\n애드웨어는 개념상 바이러스가 아니기 때문에\n일반 백신으로 검사해도 큰 효과를 보기 어렵습니다.\n보통은 프로그램 목록에서 해당하는 항목을 찾아\n일일이 삭제해주는 것으로 문제를 해결합니다.\n제어판 > 프로그램 제거에서\n최신순으로 정렬하신 뒤\n문제가 발생한 기점으로부터 설치한 기억이 없거나\n수상한 프로그램들을 모두 삭제해주세요.\n삭제 후에도 여전히 컴퓨터 광고가 뜬다면\n프로그램 목록을 캡쳐해서 추가질문 남겨주셔도 됩니다.\n혹은 별도의 툴을 이용해서 컴퓨터 광고를 띄우는 애드웨어를 차단하는 방법도 있습니다.\n프리웨어 중에는 헬프클린 추천드려요.\n네이버 자료실에서 받을 수 있고\n간편최적화로 컴퓨터 광고 제거가 가능합니다.\n헬프클린\n인터넷 광고창 제거 및 PC 최적화 프로그램\nsoftware.naver.com']",5,https://kin.naver.com/qna/detail.naver?d1id=1&dirId=11002&docId=370776574&qb=67Cx7Iug&enc=utf8&section=kin&rank=198&search_sort=3&spq=0,바이러스
