page,date,tags,questions,questions_add,answers,N_answer,url,category
34,2021.04.21,"['코로나', '백신', '접종', '20대', '의료인']",20대 아스트라제네카 백신 접종,"20대구요. 병원에서 근무중입니다.
백신접종하라고 문자가 왔는데 92년 이후 출생자는 제외라고 했어요.근데 공문이 내려왔는데 92년 이후 출생자도 원한다면 맞을 수 있도록 한다고 했다 하더라구요.
지금 부작용이 이슈가 많기도 하고 20대는 맞지 말라고 제외한다고 했으면서 원한다면 맞도록 해준다하고 하는데... 이렇게 표현하는게 맞는지 모르겠는데 뭔가.. 이해?신뢰?가 가지 않는 달까요 ..
지금 2주안에 안맞았으면 거부한게 되서 나중에 맞게 된다는데 솔직히 이건 문제는 아니고 문제는 혹시라도 걸리게되면 구상권 청구를 한다고 하더라구요. 제가 정확히 알지 못하는 걸 수도 있어요. 어떻게 하는게 맞는건지 지금 어떻게 돌아가고 있는건지 제가 잘못 알고 있는 정보가 있다면 알려주세요.","['아스트라제네카든\n코로나 백신 접종대상자별로 접종시기 안내 후 예방접종 정보제공 누리집을 통해 인터넷으로 사전예약하거나 콜센터 1339번으로 신청하게할 예정입니다.\n문자 혹은 국민비서서비스를 통해 접종장소 및 일시를 안내하고 예약사실을 확인은 콜센터에서도 가능하도록 할 예정입니다.\n<코로나 백신 접종> 순서, 횟수, 나이, 우선순위, 시기, 방법\n대한민국 국내 코로나 백신 접종 코로나 백신 접종시기 _  먼저 국내 코로나 백신 접종대상은(?) 대상은 전국민 입니다. (단 백신 개발과정에서 임상시험에 포함되지 않은 임신부와 18세 미만 소아청소년은 접종..\nzero-news.tistory.com', '- 코로나가 불안한 사람을 위해서 \n백신을 무료로 접종해 주겠다는 것이지... \n의무접종(?) 까지는 아니라서... 원치 않으면 접종하러 가지 않으면 됩니다.\n- 백신을 접종하지 않았다고 해서 \n정부에서는 벌금 또는 구상권을 청구하지는 않습니다.\n그외 \n본인의 부주의로 인해서 코로나에 감염된 이후 \n또 다른 사람에게 코로나를 전파시키거나 \n영업방해 등으로 손해를 끼친 경우... 다른 사람이 손해배상을 청구할 수는 있는데 \n그때부터는 변호사의 도움이 필요한 영역 이라서... ', '원하면 맞게 해준다는 것이기 떄문에 거부하셔도 되고\n감염자이면서 알리지 않고 다녔을경우 구상권 청구 하는 것입니다\n백신접종 피해 국가 보상금 신청기한/백신에 대해 궁금한것\n코로나 19 백신 접종에 대하여 궁금한 것들.... 질병관리청을 통해 평소 코로나 19 백신에 대하여 가장 궁금할 것들에 대한 답변을 살표 보았습니다. ▶코로나19 백신 접종을 거부할 경우 긴급체포? -코로나1..\nrobin2236.tistory.com\n참고하셔요']",3,https://kin.naver.com/qna/detail.naver?d1id=7&dirId=7010107&docId=387809340&qb=67Cx7Iug&enc=utf8&section=kin&rank=332&search_sort=3&spq=0,감염내과
34,2021.04.21,['#코로나'],코로나 언제끝날까요,여행가고 싶은데 언제 끝날까요,"['▶ 4월7일 이후 무증상도 보건소 무료검사 가능\n4월7일 중대본 회의에서 코로나 3차 대유행이 다시 확산세를 보이고 있어서 , 앞으로 거리 두기 단계나 증상에 상관없이 \n보건소를 방문하면 코로나 검사를 무료로 받을 수 있도록 지침을 변경하였습니다.\n보건소에서도  증상  없더라도  무료로  코로나  검사 받는다\n정부 “코로나19 검사의 접근성 높이기 위한 조치”\n출처 : 의사신문(http://www.doctorstimes.com)\n▶ 아래 링크는 지역별,종류별로 보건기관을 검색할 수 있습니다.\n보건기관찾기\n▶ 검사는 어떻게 이루어지나요?\n(검체 채취) 검체는 의사, 간호사, 임상병리사가 지정된 장소(선별진료소 등)에서 채취합니다.\n필수검체는 상기도 검체이며, 하기도 검체는 가래가 있는 환자에서 채취합니다. 검체 채취시 불편감ㆍ통증이 있을 수 있습니다\n▶ 자가격리를 하면 생활지원을 해 주나요?\n자가격리에 따른 생활지원, 유급휴가 등을 지원하고 있습니다. 자세한 사항은 관할 읍, 면, 동사무소에 문의하시기 바랍니다. 단 해외 입국자 격리 시 생활지원비는 미지원이나 격리기간 중 생필품 지원 등 최소생활이 보장될 수 있도록 지원.\n▶ 의사환자의 코로나 19 선별진료소 방문 및 검사는 어떻게 이뤄지나요?\n의사환자일 경우, 선별진료소(보건소 또는 의료기관)의 격리공간 또는 독립된 공간으로 이동하여 검체 채취가 진행됩니다. 검사결과가 음성일 경우에는 격리기간 유지(최종 접촉일 기준 14일) 후 격리가 해제되며, 검사결과가 양성일 경우에는 증상에 따라 적절한 치료를 받습니다.\n▶ 코로나 19의 공식 명칭은 무엇인가요?\n이 감염증의 새 명칭은 코로나바이러스 감염증 2019(Coronavirus disease-2019)이며, 줄임말로 코로나19 (COVID-19)입니다.', '모든 사람들이 백신을 투여받아 집단 면역이 생기기 전까지는 계속 지속될 것입니다.\n즉, 올해 12월까지는 지속될 예정이라고 합니다.\n다만 이 계산도 백신 수요에 따른 예측이여서 늦으면 내년까지 지속될 수 있습니다.']",2,https://kin.naver.com/qna/detail.naver?d1id=9&dirId=9020202&docId=387810253&qb=67Cx7Iug&enc=utf8&section=kin&rank=331&search_sort=3&spq=0,캐나다
33,2021.04.21,[],코로나19백신이 일반 사람들에게 언제 접종을 시작할것 입니까,,"['일반인은 3분기에요\n코로나 백신\n1분기 대상 : 요양병원/ 요양시설 입원 입소자 종사자/ 코로나 19환자를 치료하는 기관 종사자/ 고위험의료기관 종사자/ 1차 대응용원 역학조사 구급대원등\n2분기 대상 : 노인재가복지시설 이용자 종사자/ 65세 이상 고령자부터 순차 접종/ 의료기관 및 약국종사자/ 장애인 노수인 등 시설 입소자 종사자\n3분기 대상 : 성인 만성질환자/ 성인 50~64세/ 군인 경찰 소방 및 사회기반시설 종사자/ 소아 청소년 교육 보육시설 종사자/ 성인 18세~49세\n4분기 대상 : 2차 접종자/ 미접종자 또는 재접종자\n<코로나 백신 접종> 순서, 횟수, 나이, 우선순위, 시기, 방법\n대한민국 국내 코로나 백신 접종 코로나 백신 접종시기 _  먼저 국내 코로나 백신 접종대상은(?) 대상은 전국민 입니다. (단 백신 개발과정에서 임상시험에 포함되지 않은 임신부와 18세 미만 소아청소년은 접종..\nzero-news.tistory.com', '코로나 백신 접종대상자별로 접종시기 안내 후 예방접종 정보제공 누리집을 통해 인터넷으로 사전예약하거나 콜센터 1339번으로 신청하게할 예정입니다. \n 문자 혹은 국민비서서비스를 통해 접종장소 및 일시를 안내하고 예약사실을 확인은 콜센터에서도 가능하도록 할 예정입니다.\n코로나 백신 접종 순서·비용·부작용 안내\n국내에서도 코로나19 백신 접종이 26일부터 본격적으로 시작됩니다. 국내 코로나19 확진자가 나온 지난해 1월 20일 이후 1년 37일 만인데요. 정부는 오는 9월까지 전 국민 70% 임상에 대한 1차 접종을 마치고 11월..\nnaver.me', '8월 하순경 시작이 될 예정입니다. 조만간 정부에서 발표 한다고 하네요. 코로나 19 예방접종관련 자세한 내용은 아래에 잘 정리되어 있는것 같네요 참고하세요^^\n코로나19 예방접종 사전예약 시스템 예약방법 알려드립니다.\n코로나19 예방접종 사전예약 시스템 및 예약방법을 알아보겠습니다. 이 글을 모두 읽으면 코로나19 예방접종 사전예약 시스템 및 예약방법을 알게 될 것이라고 기대하고 있습니다. 코로나19 예방접종 사전예약 시..\ninfo.daeyoungbil.com']",3,https://kin.naver.com/qna/detail.naver?d1id=8&dirId=80511&docId=387811221&qb=67Cx7Iug&enc=utf8&section=kin&rank=330&search_sort=3&spq=0,동물의료상담
33,2021.04.21,"['아스트라제네카', '아스트라제네카접종', '만30세미만', '코로나19', '코로나백신']","아스트라제네카 만 29세
(1991.10.27)

의료보건 종사자입니다
아직 만 29세인데 31살인데 아스트라제네카접종 대상자인가요?
만나이로 30세미만은 접종대상 제외인가요?",,"['언니 백신 맞지마요 20대 간호사언니말고도 며칠전에도 40대 젊은간호사아줌마가 사지마비걸렸데요.\n백신때문에 사고나면 배상해준다는거 다 뻥이에요.', '92년 1월 1일 이전 출생자들은 해당되어\n저도 맞고왔어요 만 29세지만..']",2,https://kin.naver.com/qna/detail.naver?d1id=7&dirId=710&docId=387812247&qb=67Cx7Iug&enc=utf8&section=kin&rank=329&search_sort=3&spq=0,"의료기관, 의료인"
34,2021.04.21,[],"우리나라 언제 망할까요 이러다 진짜 망할 것 같은데. 한쪽에서는 차이나타운 세운다 그러고 한쪽에서는 방사능 흘려보낼꺼라하고
백신 맞아서 전신 마비 됐다고 청원도 올라오는데 그래도 백신 맞아야한다고 정부는 다 국민탓이고 우리는 잘하고 있다 이러는데 세금도 맨날 이상한 곳에나 쓰는 것 같고 진짜 답답해서 뒤질 것 같은데...",,"['한국 잘나가는데 망한다고 ?\n일본이 망하면 더 빨리 망했지\n한국이 망할일은 없음~', '백신이 문제가 있다 해도\n문제가 없다고 해도\n누구의 잘못이라고 하기에는 무리가\n있는 것 같습니다.\n백신 이상반응은 누구에게나 일어날 수 있는 것이고,\n그럴때 의사분들께서 빨리 대처를 한다면\n좋은 예후를 볼 수 있다고 하더라고요.\n그리고\n나라와 나라간의 문제는 국민들을 위해 열심히 뛰고 있으니,\n정부를 믿고 너무 슽레스 받지 않기를 바라요.\n긍정적인 생각이 건강한 몸과 마음을 가진다고 하더라고요.\n좋은 시간 보내세요^^', '원래 사회는 안좋은것 자극적인 것들이 우선적으로 보이기 마련입니다\n단순히 안좋은 것들이 나라를 망친다고 한다면 우리 나라보다 먼저 망햇을 나라들이 지구의 절반이 넘었을것이라 생각이 듭니다\n지금 답답하더라도 참고 견디는 수밖에 없습니다']",3,https://kin.naver.com/qna/detail.naver?d1id=8&dirId=814&docId=387807591&qb=67Cx7Iug&enc=utf8&section=kin&rank=337&search_sort=3&spq=0,기타
31,2021.04.21,"['과학', '포스터', '상상화', '#문제풀이']",중학교 1학년 과학 상상화나 포스터 그리기 주제 추천해주세요!!,"제가 내일까지 밑그림을 그려가야 되서
급하게 글을 올리게 됬습니다!! 가능한 빨리 추천 해주세요!!","['20년 후의 미래모습을 그려보세요', '과학이라해서 기초과학만 과학이 아니랍니다.\n블록체인이나 비트코인 추천합니다.\n코로나 테마또한 괜찮습니다.\n백신이나 치료제']",2,https://kin.naver.com/qna/detail.naver?d1id=13&dirId=130104&docId=387825290&qb=67Cx7Iug&enc=utf8&section=kin&rank=308&search_sort=3&spq=0,과학
30,2021.04.21,[],노트북 영상 재생 문제가 있습니다. (유튜브),"안녕하세요?
우선 노트북 기종은 갤럭시북 이온2입니다.
노트북에서 영상 재생이 문제가 있어서 질문 올립니다.
유튜브 등 웹사이트에서 동영상을 재생할 때 5초 정도 재생이 되다가 웹사이트 자체가 먹통이 되면서 영상이 끊깁니다.
노트북을 껐다 키면 정상적으로 작동이 되지만, 매번 껐다 키는 것이 힘들어서 해결책을 구합니다.
기기를 산 지 얼마 되지 않았고, 사용도 딱히 자주 하는 편이 아닙니다.
백신을 중복으로 설치한 적이 있어서, 급하게 하나를 삭제했습니다. 혹여나 이것이 문제가 됐을까요?
제가 노트북에 대해 자세히 알지 못해, 더 필요한 정보가 있으시면 추가로 올리겠습니다.
좋은 답변 올려주시면 감사합니다.",['백신하고는 상관이 없을겁니다 노트북을 껐다 켜야만 정상으로 재생이 된다면 노트북의 문제로 보입니다 구입한지 얼마되지 않았다면 제조사에 무상 수리 의뢰하세요'],1,https://kin.naver.com/qna/detail.naver?d1id=1&dirId=10102&docId=387829384&qb=67Cx7Iug&enc=utf8&section=kin&rank=298&search_sort=3&spq=0,노트북
31,2021.04.21,[],과연 예전처럼 아무상관없는 세상은 언제쯤 돌아올까요?,"사람들 아무리 많아도 상관없고

클럽에서 수십명씩 놀아도 상관없고

편하게 놀수있는날이 언제쯤 올까요???

머 어짜피 마스크쓰는게 더좋다는걸 알았으니

마스크는 평생쓸 예정이고

과연 언제나되면 완전 옛날처럼 될수있을까요???

5년? 10년? 더가면 놀러다닐 기운도 없겠구만 ㅠㅠ","['1년이면 됩니다..\n그리고 아래 글은 제가 하는 무료채굴 코인인데 광고라 생각마시고 한번 잘읽어보세요. 대박 날수도 있습니다.\n우연한 이글이 당신의 미래를 바꿀수도 있습니다. 5분만 투자해서 읽어보세요. \n솔까 비트코인으로 돈번사람들 보면 배아프지 않나요? \n10년전 비트코인 초창기 저사양 컴으로도 하루 50개씩 채굴 가능했습니다. 지금 가격으로 따지면 하루 30억씩 번거죠. 그때 비트코인하는 사람들 사기라고 비웃은 사람들 많을겁니다. 역사는 반복 됩니다. \n지금 다시 기회가 왔습니다. 수만가지 암호화폐중 비트코인이 독보적인 이유는 최초이기 때문입니다. 이젠 모바일 시대 모바일 채굴 최초 파이코인을 시작해 보세요. 비트코인 이후 가장 유망한 코인으로 이미 제2의 비트코인이란 타이틀을 얻었습니다.\n스마트폰만 있음 가입절차가 아주 쉽고 하루 5초만 투자하시면 됩니다. 채굴버튼 클릭후 앱을 끄고, 핸드폰을 끄도 자동채굴 됩니다. 절대 위험한 앱이나 핸드폰에 악영향을 주지 않습니다. 밑져봐야 본전인데 이글을 보고도 안하시면 인생에 3번 오는 기회중 한번을 또 놓치시는 겁니다. \n현재 상장전이고 상장되면 그 값어치는 엄청나게 뛸겁니다. 상장까지 1년정도 보고 있습니다. 빨리 시작해서 같이 부자 되시죠. \n지금 코인에 투자하긴 겁나시죠 . 잘못하면 많은 돈을 잃을수도 있으니깐요. 하지만 이건 전혀 부담없이 시작해서 잘하면 대박을 터트릴수도 있고 안되도 적지 않은 돈을 만지실수 있을겁니다. 지금 파이코인 시작 하시면 단돈 1원도 안들이고 미래가 바뀔수 있습니다. \n채굴방법 . 아래 블로그 가시면 보충 자료와 채굴 방법 쉽고 자세하게 설명해 드립니다.\nhttps://m.blog.naver.com/PostView.nhn?blogId=sanghee0401&logNo=222276589500&navType=tl\n#세계적인 결재대행 페이팔에서 코인 무료 에어드랍 이벤트하네요. 이거도 무조건 해보세요.. 아래클릭\nhttps://m.blog.naver.com/sanghee0401/222290350304?afterWebWrite=true', '진짜 잘 듣는 백신이 전세계에 보급되지 않는이상 불가능할거같아요 ㅠ ', '신을 접종받은 인구는 1억2873만명으로 전 세계 인구(78억명)의 1.7% 수준이다. 영국 정부가 지난해 12월 8일 국제사회에서 처음으로 화이자 백신 접종을 시작하며 지구촌이 본격적인 접종 총력전에 돌입했지만 두 달이 지난 후에도 전세계 접종률은 2%에도 미치지 못하고 있다. 전문가들은 인구의 75%가 백신을 접종해야 집단면역이 생긴다고 보고 있는데 이 기준에 따르면 58억5000만명은 백신을 맞아야 면역이 생긴다는 계산이다.블룸버그 통신은 현재 속도로 백신 접종이 진행될 경우, 전 세계 인구의 75%가 접종받는 데 7년이 걸릴 것이라고 추산했다. 국가마다 접종 속도가 다른 데다 백신 물량 부족 탓에 백신을 구경하지 못한 국가들도 많기 때문이다.\n[출처: 언제끝나냐]', '앞으로도ㅈ된거죠뭐\n적어도 2~3년은 존버해야해요 \n채택바람 ']",4,https://kin.naver.com/qna/detail.naver?d1id=8&dirId=80101&docId=387825359&qb=67Cx7Iug&enc=utf8&section=kin&rank=306&search_sort=3&spq=0,"연애, 결혼"
29,2021.04.21,[],신장이식환자가 아스트라제네카 백신을 맞아도 문제가 없나요?,"저는 신장이식환자로 기저질환(고혈압,당뇨,부정맥,심장스태트)이 있는 사람입니다
오늘 보건소에서 아스트라제네카 백신 접종 통고를 받았는데
과연 맞는게 좋을까요?
정말 모르겠습니다","['아스트라제네카 등 \n코로나 백신은 기저질환환자 / 약물 투여자 / 감기기운등 증상이 있는자는\n먼저 병원에 의사와 상담후 접종해야 한다 아래 코로나 접종안내 문구에 나옵니다[출처]\n<코로나 백신 접종> 순서, 횟수, 나이, 우선순위, 시기, 방법\n대한민국 국내 코로나 백신 접종 코로나 백신 접종시기 _  먼저 국내 코로나 백신 접종대상은(?) 대상은 전국민 입니다. (단 백신 개발과정에서 임상시험에 포함되지 않은 임신부와 18세 미만 소아청소년은 접종..\nzero-news.tistory.com', '코로나 걸리는것보다는 백신을 맞는게 낫죠.\n기저질환자로 코로나 걸리면 너무 위험해지는데요.\n신장이식 환자도 꼭 매년 맞아야 하는 독감 백신과 같습니다.']",2,https://kin.naver.com/qna/detail.naver?d1id=7&dirId=7010105&docId=387836045&qb=67Cx7Iug&enc=utf8&section=kin&rank=283&search_sort=3&spq=0,신장내과
29,2021.04.21,[],신장이식환자가 아스트라제네카 백신을 맞아도 문제가 없나요?,"저는 신장이식환자로 기저질환(고혈압,당뇨,부정맥,심장스태트)이 있는 사람입니다
오늘 보건소에서 아스트라제네카 백신 접종 통고를 받았는데
과연 맞는게 좋을까요?
정말 모르겠습니다","['아스트라제네카 등 \n코로나 백신은 기저질환환자 / 약물 투여자 / 감기기운등 증상이 있는자는\n먼저 병원에 의사와 상담후 접종해야 한다 아래 코로나 접종안내 문구에 나옵니다[출처]\n<코로나 백신 접종> 순서, 횟수, 나이, 우선순위, 시기, 방법\n대한민국 국내 코로나 백신 접종 코로나 백신 접종시기 _  먼저 국내 코로나 백신 접종대상은(?) 대상은 전국민 입니다. (단 백신 개발과정에서 임상시험에 포함되지 않은 임신부와 18세 미만 소아청소년은 접종..\nzero-news.tistory.com', '코로나 걸리는것보다는 백신을 맞는게 낫죠.\n기저질환자로 코로나 걸리면 너무 위험해지는데요.\n신장이식 환자도 꼭 매년 맞아야 하는 독감 백신과 같습니다.']",2,https://kin.naver.com/qna/detail.naver?d1id=7&dirId=7010105&docId=387836045&qb=67Cx7Iug&enc=utf8&section=kin&rank=282&search_sort=3&spq=0,신장내과
29,2021.04.21,[],이스라엘은,"후진국이죠?
우리나라보다 못 사는 나라고요.
방역도 못하니까요.","['아니요!!!!!!!!!그렇게 못사는 나라는 아니에요!!!!!!!!!!!!!!!!!', '선진국이라고 하긴 애매하지만\n지리적인 여건으로 볼 때\n나름 지역에서 강대국이면서 \n경제력도 우리나라 못지 않은 잘사는 나라입니다.\n코로나 백신 접종률도 54%로 세계1위 입니다.\n방역역시 나름 잘 하고 있구요.\n이스라엘은 전세계적으로 거래를 잘하면서\n매우까다롭게 일을 하는 나라입니다.\n중국보다 한수 위인 나라죠.']",2,https://kin.naver.com/qna/detail.naver?d1id=6&dirId=6130201&docId=387836453&qb=67Cx7Iug&enc=utf8&section=kin&rank=281&search_sort=3&spq=0,"외국국기, 국가정보"
28,2021.04.21,[],우리나라보다 방역 못하는 나라는,이스라엘 밖에 없죠?,"['?이건 뭔소리.\n인도, 일본, 프랑스, 이탈리아, 터키, 브라질, 스페인, 아르헨티나, 멕시코 등등등 정말 수도 없이 많은데요? 백신까지 감안하더라도.\n우리나라 오늘 확진자 731명, 전세계 오늘 확진자 72만 명입니다. 사망자는 우리나라 4명, 전세계 14000명이고요. 확진자만 봐도 1000배나 되잖아요. 우리나라랑 전세계 인구는 150배 차이 밖에 안 나는데\n더 자세한 통계를 알고 싶으면 여기에 국가별 확진자 사망자 치명률 확진율 등등 다 나와있습니다.\nhttps://coronaboard.kr/\n코로나19(COVID-19) 실시간 상황판\n코로나19(신종 코로나바이러스)에 관한 세계 각 국가들의 통계 및 뉴스 등을 취합하여 실시간 정보를 제공합니다.\ncoronaboard.kr']",1,https://kin.naver.com/qna/detail.naver?d1id=6&dirId=612&docId=387836659&qb=67Cx7Iug&enc=utf8&section=kin&rank=280&search_sort=3&spq=0,재난재해
28,2021.04.21,[],이스라엘은,우리나라보다도 백신접종률이 낮은 국가죠?,['세계에서  가장  높습니다.'],1,https://kin.naver.com/qna/detail.naver?d1id=9&dirId=90201&docId=387837229&qb=67Cx7Iug&enc=utf8&section=kin&rank=279&search_sort=3&spq=0,아시아
28,2021.04.21,[],코로나 백신(화이자) 맞고 난후 질문입니다.,"이번주 화요일에 화이자 백신접종을 하였습니다
궁금한점이있어 질문 올립니다
1. 운동(헬스 및 개인 pt)은 언제부터 가능한가요?
2. 술은 언제부터 마실수 있을까요?","['코로나 백신 접종 후\n1. 3일정도 무리한 운동 쉬는게 좋다 하네요\n2. 당일 음주는 금지합니다\n<코로나 백신 접종 후 주의사항> 부작용, 이상반응, 샤워, 증상, 음주\n코로나 백신 접종 후 이상반응 코로나 백신 접종 부작용 주의사항 안내 _ 전세계적으로 코로나 백신 접종이 시작됬습니다 대한민국 국내에서도 코로나19 백신 접종도 시작됬습니다 코로나 백신은 코로나 바이러스..\nzero-news.tistory.com\n자료 참고하세요', '백신 접종 주의사항 알려드릴게요\n코로나 백신 맞아도 될까? 부작용은? 접종 후 건강상태는? 부작용 신고는? https://youtu.be/9tEiEDFO5js\n아스트라제네카 백신과 혈전 논란! 일단 혈전 예방은 하는게 좋지 않을까요? https://youtu.be/G99ZvBJCIUU']",2,https://kin.naver.com/qna/detail.naver?d1id=7&dirId=70101&docId=387837897&qb=67Cx7Iug&enc=utf8&section=kin&rank=278&search_sort=3&spq=0,내과
28,2021.04.21,[],코로나 백신(화이자) 맞고 난후 질문입니다.,"이번주 화요일에 화이자 백신접종을 하였습니다
궁금한점이있어 질문 올립니다
1. 운동(헬스 및 개인 pt)은 언제부터 가능한가요?
2. 술은 언제부터 마실수 있을까요?","['코로나 백신 접종 후\n1. 3일정도 무리한 운동 쉬는게 좋다 하네요\n2. 당일 음주는 금지합니다\n<코로나 백신 접종 후 주의사항> 부작용, 이상반응, 샤워, 증상, 음주\n코로나 백신 접종 후 이상반응 코로나 백신 접종 부작용 주의사항 안내 _ 전세계적으로 코로나 백신 접종이 시작됬습니다 대한민국 국내에서도 코로나19 백신 접종도 시작됬습니다 코로나 백신은 코로나 바이러스..\nzero-news.tistory.com\n자료 참고하세요', '백신 접종 주의사항 알려드릴게요\n코로나 백신 맞아도 될까? 부작용은? 접종 후 건강상태는? 부작용 신고는? https://youtu.be/9tEiEDFO5js\n아스트라제네카 백신과 혈전 논란! 일단 혈전 예방은 하는게 좋지 않을까요? https://youtu.be/G99ZvBJCIUU']",2,https://kin.naver.com/qna/detail.naver?d1id=7&dirId=70101&docId=387837897&qb=67Cx7Iug&enc=utf8&section=kin&rank=277&search_sort=3&spq=0,내과
