page,date,tags,questions,questions_add,answers,N_answer,url,category
2,2020.07.11,[],컴퓨터 원격조종&해킹 당한 이유가 알고싶습니다.," 솔직히 얘기하겠습니다. 그당시 사건 기억나는대로 써봅니다.(애매한 대답이나 
 뭐대충 이런저런 이유갓다붙여서 말하실거면 적지마세요. 적을시 신고합니다.

그당시 백신프로그램은 V3,알약(무료버전) 사용 중 이였습니다.

잘 정밀검사나 이런거 백신검사 잘 하지도 않앗던 시절이였고

야X 같은거 많이 다운받아 봣던 시절이엿죠. 그러다가 어느 새벽에

갑자기 컴퓨터에서 소리가 들리는 소리에 깨서 일어낫는데 컴퓨터가 혼자 움직이더니

원격조종 프로그램인지.. 아니면 개인정보를 빼내기위한 어떤 프로그램인지 기억은

나지않습니다만 어느 프로그램을 깔면서 제 게임 아이템등을 모조리 쓸어 가더군요.

그리곤 잘난척을 하려는듯이 그당시 현재 디스코드 같은 프로그램인 (스카이프) 로

제 지인을 불러서 나중에  또 털러온다 이놈 컴퓨터 내가 털엇다는 식으로 하고 

자랑하고 가더군요.. 그리곤 저는 놀라서 컴퓨터를 끄고 포맷을 햇습니다만...

그당시 해킹당한 그대로 무슨 파일 및 로그 뭐시기뭐시기 신고하기도 힘들게 해놧더군요....

그래서 결국 신고는 흐지부지 되고 그렇게 잊어버리게 되다가 다시 기억나서

적어봅니다..

!결론!

그 사람이 원격조종 한 경로 및 현재도 그것이 가능한가??

현재 쓰는 백신:어베스트 프리미엄 , 그 사건이후 포맷은 여러번 하였음.

원격조종 지금도 당할 가능성이 있는가... (야X은 솔직히 좀 있음니다..크흠)..;;","[' 그럼 결론 아래 질문만 적어보겠습니다. 다만, 예/아니오로 딱 부러지게 답변하기는 불가능한 점을 참고해주세요.\n1) 그 사람이 원격조종 한 경로 및 현재도 그것이 가능한가?? = 아닐 가능성이 큼.\n 그 ""사건""이 옛날이면 옛날일수록 이 가능성은 더 낮아집니다. 예전에 사용했던 취약점일수록 그만큼 더욱 더 패치로 막혔을 가능성이 크기 때문입니다.\n2) 원격조종 지금도 당할 가능성이 있는가...  = 있습니다.\n 공격자가 질문자님의 기기를 한번 해킹한 경험이 있으므로 해당 구조에 대해선 일부라도 알고 있을 가능성이 크며, 취약점은 새로 계속 나오기 때문에 비록 저번과 같은 경로, 방향은 아니나 다른 방식으로 또 원격조종을 할 수도 있습니다. 다만 백신도 그만큼 발전을 하는지라 가능성이 높다고 할 수는 없지요.']",1,https://kin.naver.com/qna/detail.naver?d1id=1&dirId=11001&docId=362240891&qb=67Cx7Iug&enc=utf8&section=kin&rank=17&search_sort=3&spq=0,해킹
2,2020.07.11,[],코로나 임상실험 시작하면 백신나오는데 어느정도에 걸리나요?.,오래걸리나요?,"['코로나 바이러스는 감기류의 바이러스와 비슷합니다. 즉 변이가 자주 발생하여서 백신을 만들어도 항체가 변이를 일으킨 바이러스에게는 영향을 못줍니다. \n코로나바이러스 백신을 만들었다면, 감기 백신은 이미 만들어졌어야 합니다. \n개인적인 의견을 좀 섞어봤습니다. 감기처럼 유행을 타면서 계속 우리 삶을 괴롭힐 것 같습니다.', '오래걸립니다\n2021년쯤 나올거에요\n빠르면 2020년12월 이고요\n느리면 2022년에 나올거에요\n이상 허접한  답변이였습니다', '네, 코로나 임상실험을 하면 4차까지 해야 한다고 하는데요.\n수많은 사람들을 상대로 실험을 해야 하고 부작용이 있는지를 확인을 해 허가를 내주게 됩니다.\n너무 심한 부작용이 있다면 백신이 허가를 내주지 않게 되는 것이죠.\n백신이 빠르면 올해내로 나온다고 합니다.\n다음 기사내용을 참고 하시기를 바랍니다.\nhttps://biz.chosun.com/site/data/html_dir/2020/07/09/2020070903951.html?utm_source=naver&utm_medium=original&utm_campaign=biz\n선진국끼리 코로나19 백신 쟁탈전... 동맹 맺고 사재기까지\n미국⋅영국 입도선매 경쟁… 유럽은 과당경쟁 막기위해 공동구매로 가닥아스트라제네카⋅존슨앤존슨 ""저소득 국가엔 백신 판매 수익 챙기지 않겠다""세계보..\nbiz.chosun.com\n백신이 개발이 된다고 해도 한국이 모든 국민들에게 백신을 제공을 할 양을 확보를 할지 궁금합니다.\n감사합니다.', '변종이 심한 .. 백신 아무도 언제 만들어질지 모릅니다 ..', '안녕하세요?\n코로나 종결 때까지 새로 나오는 대응지침 요점만 정리해 알려드리는 황닥입니다.\n결과 등에 따라서 달라질수 있어요\n 코로나 최신현황 사이트 정리 https://blog.naver.com/ekgo83/221804594015\n코로나 19 확진자 현황! 질병관리본부 확진자 동선 및 정부 발표 live\n안녕하세요 닥터원더 입니다.코로나 19 (우한폐렴 신종코로나바이러스) 관련 도움 받을 수 있는 고시에...\nblog.naver.com\n코로나 백신 현재 개발 상황 https://www.youtube.com/watch?v=WGiYeCYBmaU']",5,https://kin.naver.com/qna/detail.naver?d1id=6&dirId=612&docId=362241335&qb=67Cx7Iug&enc=utf8&section=kin&rank=16&search_sort=3&spq=0,재난재해
2,2020.07.11,[],우한 코로나 백신 언제 나올까요,"진짜 이제 마스크 그만 쓰고 다니고싶고
다시 예전처럼 아무 걱정 없이 놀러다니고싶은데
백신이 현실적으로 언제 쯤 나올까요ㅜㅜ","['네, 신종 코로나 바이러스 백신은 전세계가 개발중인데 빠르면 올해내로 나온다고 합니다.\n다음 기사내용을 참고 하시기를 바랍니다.\nhttps://biz.chosun.com/site/data/html_dir/2020/07/09/2020070903951.html?utm_source=naver&utm_medium=original&utm_campaign=biz\n선진국끼리 코로나19 백신 쟁탈전... 동맹 맺고 사재기까지\n미국⋅영국 입도선매 경쟁… 유럽은 과당경쟁 막기위해 공동구매로 가닥아스트라제네카⋅존슨앤존슨 ""저소득 국가엔 백신 판매 수익 챙기지 않겠다""세계보..\nbiz.chosun.com\n백신이 개발이 된다고 해도 과연 한국이 5,000만명 백신을 모두 확보를 할수 있을지 궁금합니다.\n올 겨울에는 독감도 백신을 맞아야 하고 코로나 백신이 나온다면 코로나 백신도 맞아야 하는데 독감과 코로나 증상이 비슷해 두가지를 모두 맞는게 안전하지 않을까 생각을 합니다\n감사합니다.', '하 저도 마스크 안쓰고 돌아다니고 싶어요 ㅠㅠ\n제가 전문가는 아니지만\n뉴스로 볼때 코로나 바이러스는 변종이 많아서\n한가지 백신으로도 안된다는거 본적잇는거 같아요.', '내년이나 되여 어느정도 윤곽이 보일듯합니다.\n코로나증상 비교해보시고 확진자동선 체크후 그래도 의심이 된다면 1339번에 전화후 안내 받으시기 바랍니다.\n코로나19 자가진단 코로나세이프 자가진단 받으러 가기\nhttps://dangcare.tistory.com/1329\n코로나19 자가진단 서비스가 개발됐다. 코로나세이프 자가진단 받으러 가기\n코로나19 자가진단 서비스가 개발됐다. 코로나세이프 자가진단 받으러 가기 고고 코로나19 선별 진료소에서 근무하는 공중보건의 등 현직 의사 9명과 MBN 측이 함께 만든 자가진단 서비스는 언제, 어디서나 손쉽..\ndangcare.tistory.com\n코로나맵’ 이어 주변 진료소 정보까지 확인 가능한 ‘코로나 알리미’\n동선확인하시고 주의하세요 *********\nhttps://dangcare.tistory.com/1226\n코로나맵’ 이어 주변 진료소 정보까지 확인 가능한 ‘코로나 알리미’ 등장\n코로나맵’ 이어 주변 진료소 정보까지 확인 가능한 ‘코로나 알리미’ 등장 최근 ‘신종 코로나바이러스’가 국내에 확산됨에 따라 이에 대한 정보를 확인할 수 있는 창구가 하나둘씩 등장하고 있다. 지난달 30일..\ndangcare.tistory.com\n인후통코로나 증상 목아픔코로나 증상 발현 시기코로나 증상 설사코로나 증상 두통코로나코로나 증상\n대전코로나,광주코로나,익산코로나,경기도코로나,서울코로나,인천코로나,코로나확진,수원코로나\n채택시 해피빈은 코로나 관련해서 전액기부됩니다.\n코로나는 아닐거에요 , 건강한 하루되세요']",3,https://kin.naver.com/qna/detail.naver?d1id=11&dirId=111604&docId=362241584&qb=67Cx7Iug&enc=utf8&section=kin&rank=15&search_sort=3&spq=0,해부학
2,2020.07.11,"['#지식인카드', '#캐나다입국', '#지식인카드']",캐나다입국,지금 외국인 신분으로 캐나다 못들어가나요??만약 못들어간다면 내년에는 풀릴까요??,"['그것은 코로나 상황이 더 호전될지 아닐지에 달려 있기 때문에 지금으로써는 예측이 힘들어요.\n치료제나 백신이 언제 개발될 지가 영향을 많이 줄 것 같아요.', '캐나다 유락 전문가 다둥아빠 대니입니다.\n현재는 7월 말까지는 여행 목적의 외국인 입국을 제한하고 있습니다. \n8월전에 추가 조치가 나올 것으로 예상되니 정부 발표를 조금 더 기다려 보심 \n좋을것 같아요~^^', '안녕하세요\n문의주신 부분 관련 간단히 답변드립니다.\n우선 캐나다 정부에서 발표한 7월31일까지는 외국인 입국 금지입니다.\n7월말이 되면 입국 관련으로 추가 발표가 있을것으로 예상되어 그때까지 조금 더 기다려보셔야 될 것 같습니다.\nhttp://www.woorieducation.com/\n캐나다 유학/이민 전문 우리에듀케이션 입니다.\n온타리오 캐슬린 윈 수상 네트워킹 리셉션 동영상으로 만나는 우리에듀 언론에 소개된 우리에듀 실시간 수속현황 392명 수속진행중 캐나다 김*애님, 세네카 컬리... 2020-07-09 캐나다 이*환님, UIS plan ... 2020-07-09 캐나다 서*델님, 유학 및 국... 2020-07-09 캐나다 정*라님, 컬리지 어드... 2020-07-09 질문과 답변 무엇이든 물어보세요! 생물화학질문이요 2020-07-07 와인양조학과 질문 2020-07-06 [토론토] 비자연장 문의 2020-05-01 토론토 본사에서 비자연장을......\nwww.woorieducation.com', '안녕하세요\n캐나다 SOS유학원입니다. \n현재 7월 31일까지는 캐나다에서는 예외의 경우를 제외하고는 외국인에 대한 입국을 금지하고 있습니다. \n서두에서 말씀을 드린것 처럼 7월 31일까지로 캐나다 이민국에서 외국인에 대한입국을 금지를 하고 있지만 언제 풀릴것이라는건 캐나다 이민성의 업데이트를 기다리는 방법밖에는 없을것 같습니다. 빠르면 8월에 풀릴수도 있는것이고 늦으면 올해까지도 보고는 있긴합니다. 관련해서는 캐나다 뉴스 및 캐나다 메거진들을 통해서 업데이트를 받는것이 좋을것 같아요. 캐나다 입국관련해서 추가적으로 궁금하신점으 언제든지 아래의 배너를 확인해주세요. 감사합니다. ', 'https://blog.naver.com/cisccokr/222017840181\n캐나다 외국인 입국 금지 조치, 7월 31일까지 연장\n#캐나다이민 #캐나다입국금지 #캐나다영주권 #캐나다여행 #캐나다비자캐나다 입국금지 조치, 결국 연장 결...\nblog.naver.com\n현재 기준으로는 7월 31일 해제 예정입니다! 예정 대로 해제가 된다면 8월엔 입국이 가능하실 수 있어요.\n다만 자세한 내용은 조금 더 지켜봐야할 겁니다.\n캐나다도 관광에 대한 경제적 손실이 큰 나라이기 때문에 내년까지는 풀 수 밖에 없을 것으로 예상하고 있어요.\n도움되셨다면 채택 부탁드려요.']",5,https://kin.naver.com/qna/detail.naver?d1id=9&dirId=9020202&docId=362242116&qb=67Cx7Iug&enc=utf8&section=kin&rank=14&search_sort=3&spq=0,캐나다
2,2020.07.11,"['컴퓨터고장', '컴퓨터']",컴퓨터 뭘 잘못만졌는지는 모르는데 컴퓨터가 안되고 이 화면만 떠요 어떻게하는지 아시는분 계신가요??ㅠㅠㅠ내공100드릴게요 급해요,,"['그대로 끝내기를 안누르신상태인가요? 그럼 끝내기누르시면됩니다\n끝내기를 누르셔도 안되시면 강제종료후 다시부팅해보세요', '윈도우7경우 컴키자마자  f8 이나  del 키 연타하면 안전모드로 부팅할수있고 \n윈도우 8서 10경우는 컴키고 40초정도 기다린후에 본체전원 꾹눌러 강제종료하고 \n이런행동을 4번정도 반복하다보면 복구모드로 부팅하게돼고 \n그기서 고급옵션 --> 시작설정--> 안전모드로 부팅할수있어요 \n이래 안전모드로 부팅했으면 \n바탕화면 좌측하단에 시작클릭하고 검색창에 msconfig입력하고 관리자권한으로 실행해서 시작프로그램탭으로이동후  체크해있는거 모두다 체크해제하고 \n나오고 \n바탕화면 좌측하단 시작클릭하고 명령프롬포트입력하고 관리자권한으로 실행하고 \nsfc /scannow\n위 명령어 입력하고 확인눌러 \n100% 다할동안기다리고 \n컴 다시시작해서 바탕화면 진입하면 \n멀웨어바이트 안티멀웨어를\nhttps://www.malwarebytes.com/\n사이트 좌측 home 아래 explore으로 마우스커서가져가고아래 free downloder 클릭하면14일동안 유료처럼이용할수있어요 이상태서 검사 치료하세요 기간 14일지나면 실시간 보호기능사라지나 업데이트 검사 치료기능제공하니 의심날대 검사 치료하기좋아요\n그리고 모든프로그램설치시에는 체크돼있는 제휴프로그램들이있을거니 체크됀거를 유심히보시고 본인에게 필요없는거면 체크해제하고 설치하셔야해요 이거도 안보고 그냥 있는대로 다설치하면 광고엄청나오죠 이런거는 아무리 최고백신프로그램이용해도 사용자가 동의해서 설치한거라 이상무로나오죠 이부분 주의하시고요 \nIObit Uninstaller 를 \nhttps://download.cnet.com/IObit-Uninstaller/3000-2096_4-75161625.html\n사이트 download now 요글자만 한번누르면 3초정도후 다운받아지니 다른거 더누르지말고\n다운받아 설치시 체크됀제휴프로그램인 어드밴쳐시스템케어 있을거니 체크해제하고 설치하시고\n설치한프로그램중에 nat service 35439 그거부터 삭제하세요 \n요프로그램이뭐냐면 웹하드이용시 설치돼는프로그램으로 다운다받은파일을 다른분들도 질문자님컴서 맥스스피드로다운받아지게하는거라 컴이 매우느려지죠 \n웹하드이용한다면 다운다받았으면 요프로그램 위 iqbit 로삭제하시고 이용하시면돼요 \n그리고 v3 이거 그다지좋은프로그램아니니 삭제하시는데 먼저 설정에들어가셔서 자체보호기능체크해있는거 체크해제하고 위 iqbit 로 삭제하고 강력검사진행해서 찌꺼기파일도 체크다해삭제하세요 \n그리고 microsoft corporation ,samsung electronics co ltd,realtek ,intel corporation, 이런 프로그램은 삭제하지마시고 나머지프로그램들경우 이름메모해서 네이버 구글검색해서 나쁘다라고나오는거 iqbit로 삭제하고 강력검사진행해서 찌거기파일도 체크다해 삭제하세요 \nhttps://www.ccleaner.com/ccleaner/download/portable\n위 사이트 클릭하면 자동으로 집파일 다운받아지니 알집풀고 실행만해서 인터넷 이용전후에 정리나 레지스트리 눌러 청소하고 (영어이니 세팅으로이동해서 한국어로하면돼요)\n시작프로그램 눌러 이상한게체크해있다면 체크해제하고 예약 프로그램탭이동해서도 이상한게체크해있다면 체크해제하고 그프로그램이뭐인지도 메모해서 검색하고 이상한거다하면 위에 iqbit로 삭제하고 강력검사진행해서 찌꺼기파일도 체크다해삭제하고 이용하세요\n늘 즐거운 하루되세요']",2,https://kin.naver.com/qna/detail.naver?d1id=1&dirId=10101&docId=362242705&qb=67Cx7Iug&enc=utf8&section=kin&rank=13&search_sort=3&spq=0,데스크톱
3,2020.07.11,[],윈도우10 바이러스 및 위협방지 작업이 권장됩니다,"설정에서 업데이트 및 보안을 누르고 보니깐
첫번째 사진처럼 나와있길래 바이러스 및 위협방지를 클릭했더니 두번째 사진처럼 뜨는데
어떻게 해야하는건가요? 컴퓨터 산지 3일째되서 앱이 없어서 그런가 싶어서
앱찾기 누르고 바이러스, 백신 등 쳐봤지만 안나오는데 새 앱이 필요해도 뭘해야하는지
모르겠어요 가르쳐주세요 ㅠㅠ",['그냥 그거 대신 알약이나 v3 백신 까시면 안전합니다.\n구지 마이크로소프트에서 제공하는거 까실 필요 없어요'],1,https://kin.naver.com/qna/detail.naver?d1id=1&dirId=1010703&docId=362235292&qb=67Cx7Iug&enc=utf8&section=kin&rank=22&search_sort=3&spq=0,윈도우태블릿
2,2020.07.11,[],해킹 당한거 같아요,"드라마 다시보기 사이트가 있길래 들어가서 봤는데 광고같이 어떤 사이트로 들어가 졌어요.
그 사이트에는 핸드폰에 바이러스가 있다고 했어요 그러더니 캘린더로 들어가져서 자기 맘대로 일정을 설정해놓고 문자가 계속 와요. 그리고 일정을 지우지도 못하게되있고 캘린더를 지워도 문자가 계속 날라와요. 그리고 알림을 안오게 시간을 없음으로 해놔도 다시 원해대로 돌아와있어요.
이런 경우에는 어떻게 해야해요.그리고 이럴때 쓰는 백신프로그램이 있나요?","['질문내용만으로 추측했을 때에는 iOS 계열의 제품에서 캘린더 구독을 하신것으로 보입니다.\n아래 내용 참고하셔서 조치 바랍니다.\n위 이미지 처럼 캘린더 구독창이 표시되는 경우, 올바른 링크에 접근했을 때 표시되는 것인지 확인하고, 출처를 알 수 없는 캘린더 구독은 삼가하시기 바랍니다.\n해당 캘린더는 구독 형태의 스팸으로 아래와 같이 제거 가능합니다.\n참고 : https://blog.supersu.kr/security/smartphone/ios_calendar_subscription_spam_warning\n1. 설정 -> 암호 및 계정 (혹은 계정 및 암호로 표시될 수 있음)을 누릅니다.\n2. 구독한 캘린더를 누릅니다.\n3. 추가하지 않은 캘린더를 찾아 ""계정 삭제"" 를 누릅니다.']",1,https://kin.naver.com/qna/detail.naver?d1id=1&dirId=11001&docId=362243559&qb=67Cx7Iug&enc=utf8&section=kin&rank=12&search_sort=3&spq=0,해킹
1,2020.07.11,[],ssd 교체 후 os 설치관련 질문드립니다.,"일단 저가 노트북 사용 중이라 거기에 맞는 삼성 ssd를 주문했습니다.
ssd가 오기 전 먼저 하드 c를 정리하고 오면 노트북 뚜따하고 ssd를 바꿔끼웁니다.
그 후 윈도우를 설치하고 백신(v3, 알약 등) 설치하는것까지는 알고있는데 그 후를 잘 모르겠습니다.
현재 제 컴퓨터 하드c에
cdspace8
geforce experience
hd vdeck
intel(r) hd graphics control panel
가 설치되어있는데 os 설치 후 이것도 공식홈페이지에 들어가서 설치를 해야하나요?
안전모드? 그 바이오스로 들어가는 단축키가 어떤건가요?

위에 없는 내용 및 하드교체, os 설치 등 부족한 부분 지적과 설명 부탁드립니다.

채택 반드시하겠습니다.
자세한 설명 꼭 부탁드립니다.
처음이라 많이 무섭습니다.",['먼저 교체할 필요없이 삼성 SSD 설치 미디어에 포함된 마이그레이션 프로그램(Data Migration Tool)을 이용해서 하드 디스크의 내용을 SSD로 이전하시는 것이 가장 빠른 방법 입니다. 별도 설치 미디어(CD나 DVD) 없거나 하면 삼성 사이트에 가시면 다운로드 가능합니다.'],1,https://kin.naver.com/qna/detail.naver?d1id=1&dirId=10303&docId=362249214&qb=67Cx7Iug&enc=utf8&section=kin&rank=10&search_sort=3&spq=0,맥OS
1,2020.07.11,"['노트북용량', '컴퓨터용량']",컴퓨터 용량이 별로 안남았어요,"지금 노트북이 105기가인데

게임이 메이플 서든어택 이 두개만 깔려있습니다.

근데 남은 용량이 12기가라고 하더라고요

무슨 불 필요한게 있는거같은데 왜 게임 두개만 깔았는데

용량이 이거밖에 안남았을까요?","['윈도우 : 30~40 기가\n메이플 : 여유공간 20GB 이상 (최소/권장사양)\n서든어택 : 여유공간 20GB 이상 (최소/권장사양)\n게임 용도 사용 경우 기본 용량이 작다고 판단되며 아래 방법들 참고하세요\n 1. 최적화/레지스트리정리 기능 있는 프로그램 실행/활용 ex) 백신/최적화 프로그램\n 2. 디스크정리/조각모음 실행 (단, SSD 사용 시 조각모음 불필요)\n 3. 불필요 시 삭제 가능 목록 정리(제어판,프로그램 폴더등)']",1,https://kin.naver.com/qna/detail.naver?d1id=8&dirId=80704&docId=362251441&qb=67Cx7Iug&enc=utf8&section=kin&rank=9&search_sort=3&spq=0,사행성오락
1,2020.07.11,['컴퓨터'],컴퓨터 인터넷익스플로러 창이 계속 뜰때,"안녕하세요 컴퓨터 때문에 질문드려요ㅜㅜ
인터넷 익스플로러 창이 클릭도 안했는데 혼자서 여러개가 켜집니다ㅜㅜ 바이러스 검사도하고, 프로세션 초기화해주는 앱도 깔아서 했는데 안됩니다ㅠㅠ 물론 제어판 삭제도 해봤고요ㅠㅠ 해결방법이 있을까요..? 있는내공 없는내공 다 드립니다ㅠㅠ","[' 애드웨어 감염 증상입니다. 물론 악성코드 전체에 넓게 초점을 맞추는 일반 백신도 이런 애드웨어를 잡을 수 있지만, 잘 해결되지 않는 경우 애드웨어 자체에만 초점을 맞춰서 찾아서 제거하는 애드웨어 전용 제거 프로그램 사용을 추천드립니다. 프로그램 형식으로 동작하는 애드웨어도 있지만 그렇게 잡히지 않는 유형이 더 많다는 것을 참고해 두세요.\n 무료로 자유배포되고 있는 adware removal tool (by TSA) 제품을 한번 이용해보세요.\nHome - Adware Removal tool\nFree Adware Removal Tool Easily get rid of hard to remove adwares, PUP, Toolbars and Hijackers Free Download V 5.1 Clean browser hijackers This tool help you to get rid of Browser Hijackers. Easily clean unwanted toolbars If you are unable to uninstall any toolbar with normal way this software can...\nadwareremovaltool.org', '아래 점검 방법들이 있으며, 해결되지 않으면 다음 단계 점검 방법\n① 제어판 목록 점검\n② 해당 폴더안 목록 점검 → Program Files , Program Files (x86)\n③ 해당 폴더안 목록 점검 → Local , LocalLow , Roaming , ProgramData\n프로그램 사용해서 삭제 원할 경우 mzk 검색(확인)후 결정하세요 (무료/가입불필요/광고없음)']",2,https://kin.naver.com/qna/detail.naver?d1id=1&dirId=11002&docId=362253211&qb=67Cx7Iug&enc=utf8&section=kin&rank=8&search_sort=3&spq=0,바이러스
