page,date,tags,questions,questions_add,answers,N_answer,url,category
20,2021.06.27,[],고3 코로나 백신 질문,"현재 고3 인데요 

학교에서 백신 맞을건지 정하라는데 저는 3월달에 코로나 확진이 됬다가 치료되서 학교 다니는중인데 
확진자였는데 백신 맞는게 좋을까요? 
하지마 저는 특성화고를 다니고있어서 수능을 안보는데 백신을 맞는게 맞을지 고민이 되네요 ㅜㅜ 
코로나 백신맞으면 나중에 마스크 벗고돌아다닐수있는건가요? 아니면 안맞아도 같이 벗고 돌아다닐수있는건가요.","['코로나 백신은 치료제가 아닙니다. 약화된 세균이나 바이러스, 또는 그 시체를 몸 속에 넣는겁니다.\n우리 몸은 외부에서 공격이 들어오면 항체를 만들어 싸우는데요. 이전까지 몸 속에 들어온 적 없는 새로운 세균과 바이러스가 들어오면 항체를 생성하여 이들을 몰아내는데까지 시간이 많이 걸립니다.\n하지만 일단 한번 싸워본 세균과 바이러스는 우리 몸에서 기억을하죠. 나중에 똑같은 세균과 바이러스가 들어온다면 기억을 더듬어 이들을 처리할 항체를 빨리 만들어냅니다.\n이 원리를 이용하여, 우리 몸에 일부러 세균과 바이러스를 넣고 우리 몸이 기억하게 하는것이 백신의 역할입니다.\n그러니 코로나 백신 맞는다고 \n- 100% 코로나 안걸린다 예상 못합니다 \n- 코로나 백신 맞는다고 종식하는거 아니에요 확정짓기 어렵다고 전문가들은 말합니다\n추가로 아래 내용 참고해보세요[출처]\n<코로나 백신 접종> 순서, 횟수, 나이, 우선순위, 시기, 방법\n대한민국 국내 코로나 백신 접종 코로나 백신 접종시기 _  먼저 국내 코로나 백신 접종대상은(?) 대상은 전국민 입니다. (단 백신 개발과정에서 임상시험에 포함되지 않은 임신부와 18세 미만 소아청소년은 접종..\nzero-news.tistory.com', '확진자였다가 나아서 자연항체가 있는 분은\n백신 부작용이 두세배 높습니다\n그거 감수하고 맞을 이유가 없습니다\n백신 항체 길어야 6개월 갈텐데\n님이 가진 자연면역은 그거보다 훨~~~씬 길게 갑니다\n백신 맞은 사람 야외 마스크 벗고 다닐때\n같이 벗고 돌아다니세요\n백신 맞은지 안맞은지 어떻게 구분하나요\n그냥 벗으세요\n야외마스크 자체가 넌센스입니다.\n백신 맞아 항체 있다고 마스크 벗는다면\n님이야말로 백신 맞은사람보다 훨씬 코로나 면역이 쎕니다', ""확진자였더라도 다시 감염이 될 수 있기 때문에 백신 접종을 하는 것이 좋습니다.\n백신을 맞는다고 하더라도 당장 마스크를 벗을 수는 없습니다.\n안맞으면 당연히 벗을 수 없겠지요.\n자세한 코로나 백신 접종의 혜택은 아래 글에서 확인해보세요.\n[백신 인센티브] 코로나 백신 접종 인센티브 총정리(feat. 1,2,3차 혜택, 접종이력 확인)\n코로나 19와 관련하여 백신 접종자를 대상으로 한 예방접종 완료자 일상 회복 지원방안, 흔히들 말하는 '백신 인센티브'에 대하여 지난 5월 26일 중앙재난안전대책본부에서 논의하였는데요. 백신을 접종하는 국민..\njinioff.tistory.com"", '양성판정 받아도 재감염 위험이 있습니다.\n백신 맞는걸 추천합니다.', '네 백신 접종 하는게 좋죠.\n고등학교3학년, 재수생, N수생을 대상으로 7월 화이자 백신\n접종을 할 예정입니다. 왜 고3학생들에게 화이자 백신이 접종 되는지\n그 이유, 부작용 정리해두었습니다.\n고등학교 3학년 화이자 백신 신청 시기 부작용\n고등학교 3학년 학생분들은 고민이 많으실것 같습니다. 바로 코로나 백신 접종 때문입니다. 얼른 접종을 해서 공부하고 수능실험을 치뤄야하는데 백신 일정이 공개가 되지 않았기 때문입니다. 그런데 오늘 7월 고..\nm.site.naver.com', '코로나 4차 대유행이 심각해졌으므로... 백신을 다시 맞는 것이 좋을 것 같습니다..\n고3 백시 ㄴ관련은 아래 참고해보시길 바랍니다.https://00831.tistory.com/497\n고3 코로나 백신 접종 예약 신청 및 화이자 심근염 증상 원인 부작용 2022 수능 백신 의무 재수생\n고3 코로나 백신 예약 현재 고3 코로나 백신 예약 접종 대상자 확인 과정중입니다. 2021년 7월 19일부터 고등학교 3학년 학생 코로나19 백신 접종 시작이 됩니다. 3분기 예방접종 시행 계획에 따라 고3 학생 화이..\n00831.tistory.com', '코로나 감염 후 회복된 후에도 항체가 생기지 않았을 가능성이 있기 때문에\n코로나에 걸린 이력이 있으면 백신 효과가 더 좋다는 연구 결과도 있으니 \n백신 맞으시면 더 좋지 않을까요?\n혹시 있을지 모르는 화이자백신 부작용 걱정되시면 아래 링크 참고 하세요\nhttps://rich-informer.tistory.com/93\n화이자 백신 부작용, 백신 접종 후 관리방법\n화이자 백신 부작용에 대해서 알아보겠습니다. 화이자 백신은 미국 화이자와 독일 바이오테크가 공동 개발한 백신, 보관 및 유통 조건이 까다로워 초저온 냉동 시스템이 필요하여 2~8℃에서 유통할수 있는 기간은..\nrich-informer.tistory.com', '절대 맞을 필요가 없습니다.\n미국 상원의회에서 증언한 벤 에드워즈 의사의 이야기를 들어주세요. \n일례로 사스 생존자는 17년이 지난 때까지도 사스에 대해 강력한 면역 체계를 가지고 있었습니다. 이스라엘 연구에 따르면 자연 면역이 백신 면역보다 7배 정도 강력하구요. 그리고 예를 들자면 수두 백신도 직접 수두에 걸려서 항체가 생기는 것보다 효과가 떨어지고, 다른 백신들도 마찬가지입니다. 코로나19 백신의 항체 지속기간은 5개월 정도인 것이 발표되었고, 오명돈 교수의 말에 따르면 집단면역은 달성되지 않습니다.\n무엇보다 벤 에드워즈 의사 영상 꼭 봐주세요.\n소아랑tv와 이왕재 교수 영상도 봐주세요\n- 다음은 벤 에드워즈 의사 영상 중에서\n자연면역 가진 사람이 백신 맞으면 부작용 확률이 2~3배 늘어납니다. \n이 점 유의해서 현명한 결정 하시기를 간절히 부탁드립니다. 백신 맞고 후회하는 일 없도록 꼭 피하셨으면 합니다.', '이왕재 교수님의 영상을 꼭 보시길 추천 드립니다\nhttps://youtu.be/54ek4Nv8ME0\n그리고 아스트라 손발저림 카페 꼭 가보셔요\nhttps://cafe.naver.com/blue0bum4\n아스트라 손발저림 : 네이버 카페\n백신 접종 후 부작용 증세에 고생하시는 분들이 모인 카페 입니다. 치료 후기, 증상 공유 목적 입니다.\ncafe.naver.com\n현재 코@@ 백@ 부작용으로 모인 회원만 6천3백여명 입니다\n이 카페에서 백@ 반대를 외치면 강퇴 된다고 합니다\n직접 찾아 보시고 판단해 보셔요\n크베어댕큰 코리아 카페에 오시면 많은 자료들을 보실 수 있습니다\nhttps://cafe.naver.com/querdenkenkorea\n크베어댕큰 코리아 : 네이버 카페\n정의와 민주주의 그리고 표현및 언론의 자유를 원하는 사람들 그리고 자주적, 독립적 사고를 하는사람들\ncafe.naver.com\n직접 찾아보시고 판단 하세요\n득이 될지 독이 될지를요', '코로나 감염 후 백신 접종 관련 내용이 있어 공유 합니다.\n코로나에 감염후 회복 되었던 사람도 백신을 맞아야 하는지?\n코로나에 이미 감염이 되었다가 회복한 사람은 코로나 항체가 생성된다고 하는데, 그럼에도 백신 접종을 하여야 할까요? 이에 대한 미국 질병통제예방센터 (CDC)의 공식 답변입니다. CDC 원문 링크 함께 참고 하시..\nalmond-golf.tistory.com\n백신 접종은 강제 사항은 아니니 좋은 결정 하시기 바랍다. :)\n고 3 수험생 백신 접종 기간, 백신 종류 등\n고 3 수험생 백신 접종 코로나가 아직도 기승을 부리면서 곧 다가오는 수능과 대입을 준비하고 있는 수험생들의 안전이 여전히 염려가 되고 있는 상황입니다. 이에 수험생들의 안전한 대입 준비를 지원하기 위..\ncocotree.tistory.com']",10,https://kin.naver.com/qna/detail.naver?d1id=11&dirId=1130&docId=393266978&qb=67Cx7Iug&enc=utf8&section=kin&rank=194&search_sort=3&spq=0,심리학
