page,date,tags,questions,questions_add,answers,N_answer,url,category
24,2018.07.24,"['#출장세차창업', '#세차창업', '#출장세차', '#창업', '#출장세차창업', '#출장세차']","안녕하세요 출장세차 창업때문에 이렇게 질문하게되었습니다. 여러가지사정으로 24살이란 나이에 돈만벌수있는 일들만 하다가 이대로는 평생 이렇게 살것같아서 용기내어 도전해보려고하는데 어떻게 시작하는지 전혀모르겠어서 질문드립니다.
정말 많은 출장세차창업사이트가 많지만 어떤곳을 선택해야할지 또한 시작하고나서 교육기간이얼마인지 필요자금은 대출을 하려고하는데 얼마가필요한지 기타 사이트들은 광고성이 다소 심한것같아 이렇게 질문드립니다~~!",,"['제일 좋은것은 상담을 해보는것입니다..직접 찾아가서 하는것이 껄끄러우시면 무료상담방법을\n이용해보세요.출처에 상담 url남겨드릴께요..\n제동생은 큰돈은 못벌어도 창업비용 2달만에 뽑았고 그냥 중소기업다니는정도의 수익을 내고 있습니다..', '안녕하세요 대한민국 no1 출장세차 킹카워시 입니다.\n출장세차 창업을 준비 중이시군요\n여러 브랜드가 있지만 사실상 어디가좋다 어디가 별로다 이런 말들은\n광고적인부분이 많기 때문에 질문자님께서 직접 상담도 해보시고 비교도 해보시는 방법이\n가장 좋다고 생각합니다 ! 용기내어 도전하는 창업만큼 비교를 꼼꼼히 해보는게 좋겠죠 ^^\n질문자님의 나이는 출장세차업을 하시는 분들중에는 굉장히 빠른편입니다.\n저희 킹카워시 점주님들중에도 20대 초중반의 비슷한 연령대의 점주님들이 계시기 때문에\n생생한 창업후기 나 질문자님께서 가장 궁금해 하실만한 수익 부분도\n공개해 드릴수 있으니 꼼꼼하게 비교, 준비 하는 과정에 킹카워시를 빼놓으시면 안됩니다 ~~\n금액적인 부분은 답변에 직접적으로 달수 없는 점 양해 부탁드립니다. 대출을 필요로 하신다고 하는데\n저희는 창업자금의 50% 까지 제휴 금융사를 통해 무이자 대출이 가능하십니다.\n교육기간은 세차 교육만을 진행했을때 2,3일 교육후 나머진 숙달과정이라고 생각하시면 되시구요\n본사에서 교육이 어려우신 분들을 위해 저희는 직접 해당지역 방문후 방문교육도 진행을 하니 \n참고하시면 도움이 되실거 같습니다. 더 궁금한 사항 있으시면 네이버에 킹카워시 혹은\n저희 네임카드에 주소로 방문가능하시면 됩니다.\n귀하의 성공적인 창업을 기원합니다.\n감사합니다.', '고소득 유망 창업 아이템 출장세차 창업 스팀닥터, 지금 상담받아보세요\n상담 신청하기 : http://aywer.me/t5mr1lu0vg\n\n[실제 연봉 7천만 원 성공사례]\n- 지역 별 점장들 의 성공사례를 토대로 3개월 만에 연봉 7천만 원 가능\n- 정확한 상권 분석을 통한 A급 상권을 부여받아 본사의 영업지원받은 것이 성공 열쇠\n- 기존 출장세차 업체들과 달리 출장 세차 이외 프리미엄 광택 및 내, 외장 관리""를 통한 매출 확보가 가능\n\n[월 13,000명의 고정 \'출장 세차\' 고객 확보]\n- KB 손해보험과 전략적 제휴로 매월 1만 건, 매년 10만 건 이상의 고객 확보로 안정된 수익 보장\n- 영업력이 없어도, 기술이 없어도 누구나 성공할 수 있는 고객 지원 시스템, 18년간의 역사가 보장\n- 1:1 기술 전수로 누구나 100% 창업 가능\n\n[창업비용은?]\n- 초기 비용 920만 원으로 창업 가능\n- 단, 창업 계약 총비용은 1,880만 원이며 960만 원은 24개월 무이자 할부 납부 가능\n- 사업 시작과 함께 고수익이 발생하기 때문에 리스크가 없습니다.\n\n[스팀닥터 예상 수익 - 월 25일 근무 기준 ]\n- 일 3대 : 월 매출 300만 원\n- 일 4대 : 월 매출 400만 원\n- 일 5대 : 월 매출 500만 원\n- 일 6대 : 월 매출 600만 원\n\n[고객 모집은 직접 해야 하나요]\n- 세차 및 광택 고객은 스팀닥터와 제휴된 KB손해보험과 교보악사 다이렉트, MG손해보험, 농협 중앙회의\n연간 신규 고객 10만 명을 확보해 별도의 영업 없이 안정적인 수익 창출이 가능합니다.\n\n[그 외 본사의 마케팅은]\n- 온. 오프라인 마케팅 이외 롯데홈쇼핑 등을 통한 공격적인 마케팅을 통해 회원 확보를 하여\n\'스팀닥터 지점장님\'들에게 고객 유치해 드리려고 노력합니다.\n\n[예상 수익과 창업 후 안정되는 시기는]\n- 디테일링 세차 교육 및 광택 교육이 끝나면 바로 현장에 투입되어 고객지원을 받기 때문에\n첫 달부터 안정된 수익이 가능하며 창업 후 2개월 차부터는 연봉 5천만 원 이상의 고소득이 가능합니다.\n- 월 600만 원 고정 수입 가능\n\n고소득 유망 창업 아이템 출장세차 창업 스팀닥터, 지금 상담받아보세요', '24살이시면 출장세차 창업도 괜찮으실 것 같네요.\n손세차이건 스팀세차이건 확실히 힘이 안들지는 않거든요.\n\n그나마 덜 힘들고, 시간대비 수익이 괜찮은\n\n스팀세차 창업을 추천해드립니다.\n\n보통 창업비용은 초기비용 천만원으로도 가능하며,\n\n교육기간도 필수적인 노하우를 제공하고\n\n장비운용에 대한 교육으로 길게는 2~3주정도 생각하시면 됩니다.\n\n\n\n가장 유명하고 안정적인 업체는 스팀닥터이구요,\n\n본사에서 영업부분도 전폭지원해주기 때문에\n\n부담스러운 영업활동은 크게 신경쓰지 않아도 되는\n\n장점도 가지고 있습니다.\n\n\n관심이 있으시다면 아래의 사진을 참고하셔서\n\n안내 페이지를 방문해 보시기 바랍니다.', '자동차내외장관리전문업체\n샤이닝모빌입니다.\n\n선택은 본인이 하는겁니다.\n허나 정확한 정보가 뒷받침이 되어야하겠죠!\n샤이닝모빌을 선택하지 않으셔도 좋습니다.\n상담받아보세요.\n거짓과 부풀림없이 상담해드리겠습니다.\n\n네이버에서 샤이닝모빌 검색해주세요~', '현재 MD오토 출장세차 창업 컨설팅 을 맡고 있는사람입니다.\n출장세차 창업 직접 물어보는게 답이라고 생각합니다.\n각 본사들은 자기들위주 장점만으로 광고성 홍보성 이야기 를하고 광고를 하는것이 당연합니다...\n저역시도 마찬가지라고 생각하구요 인터넷 검색하셔서 실재 가맹점을 하고계시는 가맹점분들에게\n직접 물어보는게 정답이라구 생각합니다.\n가맹점수 만족도가 높은업체가 좋은업체라 생각합니다...\n정답은 알려드리것 같으니 가맹점을 알아보세요 ^^  감사합니다..\n참.... 제가맡고있는 MD오토 여기도 알아보시구요 감사합니다.', '참..답변들 보니 과간이네요.. 광고성이 많아 지식인에 답변했는데 여기서도 광고질이네요..에혀..\n\n간단하게 도움드릴 수 있었으면 좋겠네요. \n\n혼자 창업하시는거는 완전 비추입니다. 출장세차는 완전한 레드오션 시장입니다. 저자본창업에\n\n세차는 누구나 쉽게 배울 수 가 있기 때문에 진입장벽이 낮지요.. 그래서 혼자 끙끙 앓으며 고민하고\n\n생각해서 창업했다가 실패를 맛보지 마시고...기존에 잘 해온 업체를 몇몇 선정하여 전화상담 말고\n\n직접 찾아가서 들어보고 꼼꼼히 따져보시고 진행하는 것을 추천합니다. \n\n기존 업체와의 분쟁, 마찰 등이 심합니다.\n\n법인 아닌 듣보 개인사업체, 말만 그럴싸한,, 장비만 좋은,,, 경영자의 능력,,, 뭐 이런거 다 알아보고 선택하시면 됩니다.\n\n가짜에 현혹되지 마시고 진짜를 알아보시길 바랍니다. 잘되고 안되는 데는 이유가 다 있습니다.\n\n줄을 잘 서야 어린나이에.. 힘들지 않게 할 수 있어요~', '올인원카입니다 고민도걱정도많으시겠네요 저희뿐만아니라 질문자님께맞는것을찾아분석하고상담해드립니다 단순히 일세차대수곱하기얼마이런식이아닌진짜제데로상담해드리겠습니다 네이버에올인원카검색후연락한번주십시요', '고민이많으신것같네요 헌데 글로 설명하기가참... 난해하네요 지금질문자님이 원하시는것과 또한 지금경제적인상황등 모든것을 파악후에 어느정도 답변이 나올듯한데요 이렇게 지식인에 물어보시기보다는\n직접 발로 뛰며 상담받아보시는것이 좋을듯합니다 새로운 인생을위해 도전하려고하시는건데 그깟발품팔이가 뭐그렇게 대수이겠습니까 다른곳처럼 얼마면창업한다 자체대출해준다 이런거 보다는 현실적인 상담을해드리겠습니다 둘러보시는중에 잊지마시고 네이버에 올인원카 한번검색해보시고 오셔서 상담한번받아보세요 이쪽계통의 모든 속사정까지 낱낱이 알려드리겠습니다', '현재 출장세차 업을 하는 사람입니다\n얼핏 봤을땐 이일을 하는 사람들이 별로 없는것 같지만 알고보면 엄청나게 많은 출장세차 업자가 있는것을 알게 될것입니다\n가격도 너무 낮고 이동하는데 시간도 많이 걸리고~~~등등\n세상에 쉬운일이 어딧겠습니까\n풍부한 노하우와 경험이 있거나\n후견인이 있어서 잘 이끌어주는 상황이라면 조금이나마 가능성이 있겠지만 정말 어렵습니다\n저는 나름 오랜 경험과 노하우로 완전히 저만의 많은 비법들을 개발해서 충분한 단가를 받고 수입도 제법 괜찮은 편입니다\n정말 심사숙고 해야 합니다\n자신만의 노하우가 없으면 살아남기 어렵고 돈만 날려요', '안녕하세요 질문자님^^\n\n출장세차창업을 생각하고 계시나봐요.\n\n현재 언론에서 화재가 되고 있는 출장세차 창업 스팀닥터 소개해드릴게요.\n\n스팀닥터는 18년의 광택 / 코팅 / 스팀 세차 노하우와 10년의 마케팅 대행사가 만나 \n관련기술을 개발\n\n덴트복원, 부분도장, 광택 서비스와 같은 서비스를 제공하고\n오직 한 길을 걸으며 쌓아온 노하우를 바탕으로\n\n자동차 내/외장관리 직영사업장도 함께 운영하고 있습니다.\n\n3개월 만에 월 고정수입이 600만원에 달하는데 총 창업지 1880만원.\n\nKB손해보험과 스팀닥터가 제휴하여\n더 확실하게 성공적인 창업을 하실 수 있게 도와 드리고 있으며\n\n본사 금융지원 시스템으로 총 창업비 920만원으로 성공이 가능합니다.\n\n특별한 기술이 없다구요?\n 1:1 전담 마케팅과 기술전수로 누구나 창업을 하실 수 있습니다.\n\n출장세차창업 스팀닥터에 대해서 더 많은 정보를 알아보고 싶으신가요?\n\n\n\n▼▼▼  출장세차창업 스팀닥터에 대해 자세히 알아보세요▼▼▼\n\n- PC이용시  : 답변 내용상단 닉네임 오른쪽 V 클릭후 확인되는 URL 주소 바로 클릭\n\n- 모바일 : 답변 상단 닉네임 클릭후, 화면 왼쪽으로 넘기고 주소 클릭', '출장세차창업을 알아보시는 중이시네요^^\n안전하고 믿을수 있는 업체 추천해드리려고 해요\n고정수익이 높은데 초기창업 비용은 920만원으로\n저비용으로 시작이 가능하고 창업지원금 제도도 있기 때문에\n부담스럽지 않게 사업을 시작하시고 안정적인 수익을 얻으실수가 있습니다.\n교육기간도 2주밖에 안되기 때문에 실제 오픈까지 소요되는 기간이 짧고\n요즘 뜨고있는 창업인만큼 정확하고 꼼꼼하게 알아보시고 진행하시길 바래요^^\n더 궁금하신 사항이나 상담은 네임카드를 클릭해주세요^^', '출장세차창업 추천해드립니다 ', ""출장세차창업은 교육기간은 5주입니다.\n필요자금에 대해서는 밑에 설명 드리도록 하겠습니다.\n각종 언론에 보도 되어 현대판 우렁각시라는 \n명칭까지 붙은 스팀*터입니다.\n요즘 한 가정당 차 한대씩은 다 가지고 있습니다.\n그런데 시간이 없어서 세차를 못하시는 분들이 정말 많으십니다.\n그래서 시간이 없어서 세차를 못하시는분들이 \n출장세차를 많이 찾고 계십니다.\n그래서 무점포소자본창업으로 '스팀닥*'가 인기가 정말 많습니다.\n여러 언론에서 소개된것을 보실수 있으실겁니다.\n국민일보부터 내외뉴스통신,한국경제TV,DailyGrid,뉴스렙등\n다양한곳에서 소개가 된 창업입니다.\n그리고 대기업과의 MOU(양해각서:약속문서) 쳬결로\n확실한 성공 창업을 하실수 있으실겁니다.\nKB손해보험부터 MG손해보험,NH협동기획,AXA다이렉스,\nCJ오쇼핑,르노삼성자동차,마이복지,현대자동차,KB차차차등\n과 MOU체결을 하였습니다.\n체계회된 전문교육과 최고의 강사진과 함께\n초보자도 프로로 만들어주는 전문교육을 진행을 합니다.\n그래서 경쟁력 있는 기술 창업을 선택하는 것이\n성공창업의 지름길이라는것을 아시게 되실겁니다.\n하나부터 열까지 꼼꼼하게 교육을 해 주셔서\n배우시는데 어려움 없이 배우실수 있으실겁니다.\n외부스팀세차부터 내부스팀세차까지.\n그외에도 왁스코팅,타이어광택,\n휠 코팅,연무소독,유리 유막제거,\n유리발수코팅,타르제거,스케일링세차,\n실내크리닝,차량하부시트탈거,\n차량시트케어,이론기술교육,\n닥터듀얼광택,닥터세라믹코팅으로\n스팀닥터 노하우 기술을 배우실수 있으십니다.\n그리고 스팀*터만의 창업비용 무이자 할부를 지원해 주는\n프로그램이 있습니다.\n창업비용 1,888만원을 창업초기비용 920만원을 내면\n남은 금액은 무이자 할부로 960만원을 금융 지원 받으실수 있으세요.\n그리고 스팀닥*는 타사에 비교해\n출장스팀세차부터 실내크리닝,광택과코팅,썬팅과시트복원과\n라이트복원과 언더코딩을 따로 창업비용을 받는게 아닌\n몇가지이든 단 1,880만원의 비용만 받고 있습니다.\n그리고 가맹비와 보증금이나 추가비용도 없으며\n무이자 할부 가능하며 고객지원까지 해주고 있는 곳입니다.\n한 가구당 차 한두대는 다 가지고 있습니다.\n시간이 없으신분들은 세차를 잘 못하십니다.\n그래서 그런 분들을 위해서 직접 찾아가는 서비스를 해드리는 것이구요.\n그렇기 때문에 출장 세차가 핫 하다는 것입니다.\n3개월만에 월 700만원 이상 버시는 분도 계십니다.\n한번 고객이 되면 평생 고객이 되신다고 합니다.\n그러니 밑에 출처 남겨 드릴테니 남자소자본창업에 대해서 더 자세히 알아보시기 바랍니다."", '소자본 창업 알아보신다면 한번 읽어보세요!\n요식업, 오프라인매장 등 점포를 운영한다면 먼저 걱정해야 할게\n보증금, 월세, 인테리어 등의 비용이 상당히 부담스럽죠..\n하지만 무점포 창업이라면 임대료, 인테리어 비용걱정 없이\n꾸준하게 오랫동안 운영을 할수가 있습니다.\n게다가 기술적인 세차, 광택 이라면 더욱더 오랜시간동안\n꾸준히 운영을 할수가 있습니다.\n1인창업도 가능해서 인건비 걱정 안해도 되는뿐더러\n자기 자신의 인건비용만큼 수익을 창출할수 있는 높은 마진률,\n비가오나 눈이오나 끊이지않는 고객\n등등 스팀세차 창업에 여러가지 메리트가 있는데요\n신중하게 결정 하시라고 무료체험 스쿨과 부담과 강요성 없는 24시간 문의\n(클릭시 전화연결▶ : 언제든지 고민하지 마시고 문의 주세요)\n▼아래 사진 클릭하면 더 자세한 정보를 보실수 있습니다.▼', '최근 경기불황, 일자리 감소, 취업난, 실업률 등 여러 가지 이유로 생활 및 생계유지가 힘들고,\n직장인 월급만으로는 생활이 어렵다 생각하여 창업 계획을 세우고 알아보고 계시는 분들이 많으며 \n그 중 세차 창업은 해마다 관심 받고 있는 창업 중 하나\n 스팀닥터 TV/언론보도\n월 700만원 이상의 수익!\n국가 브랜드대상 1위 수상\n 한국 품질 만족도 1위 수상\n스팀닥터가 또 앞서 갑니다\n3개월만에 월 수익 700만원, 현재는 연봉 1억 이상 도전!\n전국 1등기업 스팀닥터! 출장 광택, 코팅 시장을 열어갑니다.\n 스팀닥터는 메리츠화재 4억원 영업배상 책임보험에 가입했습니다.\n 경쟁력 있는 기술 창업을 선택하는 것이 성공 창업의 지름길입니다.\n 스팀닥터 성공 스타트 5주 플 스팀닥터 TV/언론보도\n스팀닥터가 또 앞서 갑니다랜으로 3개월만에 수익 월 700만원 달성\n 스팀닥터는 성공 스타트 5주 플랜으로 인해 빠르게 수익성을 창출합니다.\n체계화된 전문교육과 최고의 강사진과 함께 초보자도 프로로 만들어주는 전문교육을 진행합니다.\n네임카드에 스팀닥터 주소록이 있습니다 연락처 남겨주시면 자세한 사항 안내 해드립니다', '코로나시대가 오면서 삶의 환경은 거의 모든것이 비대면으로 이루어 지고 있습니다. \n백신이 7~8월경부터 접종이 시작된다고 하더라도, 이미 마스크 착용은 2~3년은 더 해야 할 거고\n마스크 착용한 사람, 특히 모르는 사람과는 접촉하고 싶지 않겠죠... 그래서 비대면을 더욱더 선호할 수 밖에 없는\n세상입니다... \n즉슨, 고민하시는 출장 세차 또한 비대면으로 이루어 지고 있어 고객들이 받아들이는 느낌은 긍정적이라는 거죠\n그리고 이러한 출장 세차 창업은 소자본창업, 무자본 창업으로도 가능하다고 해요. \n이것에 대한 전망은? 최근 뉴스를 통해 인도 빙하 범람으로 인한 인명 사태가 있었죠?\n해당 사건이 큰 계기가 되었는지 모르지만 기상악화로 수소, 전기차 박차를 가한다고 하죠\n출장세차는 기름차가 수소 전기로 간다고 해도 자동차는 자동차죠. \n그리고 수요는 여전히 유지 될 거에요. 대한민국 거의 모근 국민들이 집은 안사도 차는 산다고 할 정도니...\n보다 정확한 정보는 아래 주소를 클릭해 보세요~\nhttps://jamongpick.com/19/11975']",17,https://kin.naver.com/qna/detail.naver?d1id=4&dirId=407&docId=306274421&qb=67Cx7Iug&enc=utf8&section=kin&rank=233&search_sort=3&spq=0,창업
24,2020.06.26,"['출장세차', '창업', '부업', '스팀세차', '소자본창업', '#출장세차창업', '#소자본창업']",출장세차 비용이 얼마나 들까요?,"출장세차 알아보고 있습니다. 시간상, 일일이 세차를 하로 못가니 좋은곳 추천 부탁드려요~","[""지역마다 차이가 있습니다.\n업체는 검색하시면 나오는대 인지도가 있는 업체는 \n'카페인워시' '카앤피플' '스팀 닥터' 등이 있습니다. \n차종과 상태에 따라 다르겠지만 대략 중형차 기준으로 4만원 예상하셔야 합니다.\n도움이 되셨나요^^?"", '업체는 검색하시면 나오는대 인지도가 있는 업체는 \n다양하고 많은걸로 알고 있습니다\n일단 전 카앤피플로 추천까지는 아니지만 상담정도는 받아보시면 어떨까라는 생각이 들것 같습니다\n그리고 세차 비용이 요즘 차종도 다양해져서 상태에 따라 달라져서 얼마인지는 상담을 받아 보시는게 확실할것 같습니다\n카앤피플 - 비디오 서비스 플랫폼 자몽pick\n카앤피플 소자본 무점포에 체험스쿨 프로그램으로 생생한 현장 정보공유까지 좋았어요! - jamongpick\njamongpick.com', '출장세차 실패 확률 적고, 노력한 만큼 수익 얻을 수 있는\n요즘 뜨고 있는 창업 아이템으로 추천 드립니다.\n- 소자본 무점포 \n작은 자본과 점포 없이도 창업이 가능해 1인 창업 아이템으로도 관심도가 높은 업종입니다.\n- 본사의 아낌없는 창업비용 지원\n평균 출장세차업의 창업 비용은 2400만원의 수준입니다.\n하지만, 카앤피플은 본사의 창업 지원 서비스로 980만원의 금액대로 창업에 도전할 수 있습니다.\n- 신뢰도 있는 출장세차 브랜드\n출장세차업의 창업을 생각하고 있다면, 업체 중에서도 가장 인지도 높고 신뢰있는 곳을 선정하는것이 중요합니다.\n카앤피플은 2019년 출장세차와 소비자브랜드 부분에서 만족지수 1위를 차지하며 높은 인지도를 구축,보다 나은 서비스로 믿음을 주기 위해 노력합니다.\n출장세차창업 무료상담 홈페이지 \n네임카드 링크 남겨드릴 테니, 도움 받아 보세요.\n https://bit.ly/37LkLqQ\n카앤피플\n이름 연락처 인증번호 궁금하신 내용 개인정보수집에 동의 [보기] 이름 연락처 인증번호 궁금하신 내용 개인정보수집에 동의 [보기]\nbit.ly\n해당 포스팅은 업체로 부터 일정 수수료를 받고 작성된 글입니다.', '자동차 출장 세차 창업에 관련된 영상하나 보여드립니다! \n관심있으시면 한 번 둘러보시는 것도 좋을 듯 합니다\nhttps://jamongpick.com/19/4938\n카앤피플 - 비디오 서비스 플랫폼 자몽pick\n카앤피플 소자본 무점포에 체험스쿨 프로그램으로 생생한 현장 정보공유까지 좋았어요! - jamongpick\njamongpick.com\n#출장세차창업 #창업비용지원', '출장세차창업시 도움될만한 정보 드려요~\n소자본무점포창업이고 창업비용까지원까지 해준다 하니 한 번 연락하고 상담받아보시는게 어떨지?\n요즘 코로나때문에 부업이나 직종변경에 대해 많이들 알아보고 계시는것 같은데 출장세차쪽으로 생각 정하셨으면\n발빠르게 움직이시는게 좋을것 같습니다.\n창업관련 영상링크 첨부해드리니 한 번 보시고 고민해보세요~\n힘든 시국이지만 항상 힘내시고 내일의 희망을 보고 살아갑시다.\nhttps://jamongpick.com/19/7115\n카앤피플 - 비디오 서비스 플랫폼 자몽pick\n카앤피플 소자본 무점포에 체험스쿨 프로그램으로 생생한 현장 정보공유까지 좋았어요! - jamongpick\njamongpick.com', '코로나시대가 오면서 삶의 환경은 거의 모든것이 비대면으로 이루어 지고 있습니다. \n백신이 7~8월경부터 접종이 시작된다고 하더라도, 이미 마스크 착용은 2~3년은 더 해야 할 거고\n마스크 착용한 사람, 특히 모르는 사람과는 접촉하고 싶지 않겠죠... 그래서 비대면을 더욱더 선호할 수 밖에 없는\n세상입니다... \n즉슨, 고민하시는 출장 세차 또한 비대면으로 이루어 지고 있어 고객들이 받아들이는 느낌은 긍정적이라는 거죠\n그리고 이러한 출장 세차 창업은 소자본창업, 무자본 창업으로도 가능하다고 해요. \n이것에 대한 전망은? 최근 뉴스를 통해 인도 빙하 범람으로 인한 인명 사태가 있었죠?\n해당 사건이 큰 계기가 되었는지 모르지만 기상악화로 수소, 전기차 박차를 가한다고 하죠\n출장세차는 기름차가 수소 전기로 간다고 해도 자동차는 자동차죠. \n그리고 수요는 여전히 유지 될 거에요. 대한민국 거의 모근 국민들이 집은 안사도 차는 산다고 할 정도니...\n보다 정확한 정보는 아래 주소를 클릭해 보세요~\nhttps://jamongpick.com/19/11975', '안녕하세요 청년세차 입니다,\n도움드릴수 있는 부분 도움 드리겠습니다.\n창업비용 , 300만원 입니다.\n010 - 9660 -4335 입니다.']",7,https://kin.naver.com/qna/detail.naver?d1id=11&dirId=1122&docId=360882702&qb=67Cx7Iug&enc=utf8&section=kin&rank=232&search_sort=3&spq=0,환경공학
