page,date,tags,questions,questions_add,answers,N_answer,url,category
1,2020.08.26,[],악성 코드에 대해 질문드립니다,"제가하는 게임 실행파일이 이런 악성코드가 뜨면서 사라졌는데

몇년동안 이 게임이 들어있는 폴더를 수 없이 검사해도 아무것도 안걸렸는데
약 한달 전부터 이런 악성코드가 뜨면서 검역이 되기 시작하더라구요
(탐지일시는 복구하고 걸리고 북고하고 걸리고 해서 시간이이렇지 약 한달 전부터 시작 된 것이 맞습니다)

게임 실행파일에 걸려있는 이 악성코드는 무엇인지
또 위험하거나 꼭 삭제해야 할 경우인지 확인 부탁드립니다","['해당 내용을 신고하기를 통하여 제출하시기 바랍니다.\n진단명 중 Gen은 Generic 진단으로, 정식 탐지가 아니며, 해당 파일을 분석해야만 합니다.\n정상적인 파일 실행 중 오류는, 바이러스 백신업체에서 해당 파일을 분석한 후, 데이터베이스에 예외처리를\n해야만 오진하지 않습니다.\n참고하시고 도움이 되시길 바랍니다.']",1,https://kin.naver.com/qna/detail.naver?d1id=1&dirId=11002&docId=366307438&qb=67Cx7Iug&enc=utf8&section=kin&rank=3&search_sort=3&spq=0,바이러스
1,2020.08.26,[],바람 장난ㅇㅏ니네요,"이제 날씨 전쟁 이차전 시작인가요?
장마가니 태풍오고 잠재된 코로나로 국민들은 애어른할것없이 고생이고...
평범한 일상은 언제쯤올까요????","['평범한 일상은 아직 좀 더 기다려야 하지 않을까요..', '별일 없구만.\n언론과 정부가 호들갑 떠는 것만 빼면 사실 평범한 일상 아닌지? ', '제가 생각하기로는 코로나가 감기처럼 일상생활에 녹아들 것 같습니다.\n다만 백신, 항체가 생기면 충분히 평범한 일상으로 돌아갈 수 있다고 생각합니다.\n지금은 많이 힘들고 불편하지만 조금만 힘내서 힘든 시기를 같이 헤쳐나갔으면 좋겠습니다.\n오늘 하루 수고 많으셨습니다!!^^']",3,https://kin.naver.com/qna/detail.naver?d1id=6&dirId=61303&docId=366306698&qb=67Cx7Iug&enc=utf8&section=kin&rank=4&search_sort=3&spq=0,사람과 그룹
1,2020.08.26,[],코로나백신 나와도 종식 안돼,https://mnews.joins.com/amparticle/23856407,"['하....', '신종플루도 엄밀히 말하면 종식 아닙니다. 코로나도 진행하다보면 일반적인 감기, 독감 수준으로 약해질 것입니다', 'Sheikh Khalifa Specialty Hospital 진단검사의학과 과장 홍덕진 의사님\n가톨릭대학교 인천성모병원 가정의학과 임상부교수 서민석 의사님\n께서 소견을 내주셨습니다\nhttps://www.a-ha.io/questions/4d25df930238f859b6891266ddf0f37e?recBy=3PEGVU\n코로나 백신 언제 나오나요? 그리고 백신이 나와도 코로나는 안 끝나나요? | 전문 지식 검색은 아하!\n의료 - 코로나19 백신이 개발 중에 있는데 정확히 언제쯤 상용화되고 나오는지 알고 싶습니다. 또한 백신이 나와도 코로나19가 끝이 아니라는데 왜 이런 얘기가 나오는지도 알고 싶습니다. 감사합니다.\nwww.a-ha.io']",3,https://kin.naver.com/qna/detail.naver?d1id=6&dirId=61303&docId=366306535&qb=67Cx7Iug&enc=utf8&section=kin&rank=5&search_sort=3&spq=0,사람과 그룹
1,2020.08.26,[],코로나사태 이전으로 돌아갈수 없다,왜 그런가요?,"['애미뒤진 중공 짱깨들 때문입니다', '코로나의 영원한 종식은 거의 불가능하기 때문입니다.\n백신이나 치료제를 무력화 시키는 변종바이러스로 인해\n일시적인 효과를 가질 뿐 감기나 독감같이 우리 주변에 상존하며\n면역력이 떨어지거나 기저질환을 가지는 경우 언제든 발현이 될 수 있으니까요.']",2,https://kin.naver.com/qna/detail.naver?d1id=6&dirId=61303&docId=366305984&qb=67Cx7Iug&enc=utf8&section=kin&rank=6&search_sort=3&spq=0,사람과 그룹
1,2020.08.26,"['검색질문', '통합검색궁금증', '통합검색질문하기']",데스크탑 사려고 하는데 추천 부탁드려요,"용도는 포토샵, 일러스트, 인디자인, 영상편집을 하면서 베그를 돌려도 될 정도...인데

제가 컴퓨터 쪽은 정말 잘 몰라서요ㅠㅠ...


예산은 모니터까지 해서 100만원~120만원 정도 예상...해요

자세히 추천 부탁드립니다 감사합니다","['i5 - 10400\n써모랩 트리니티 쿨러\n16GB\nH410\nGTX1660 super\nSSD500GB\nHDD 2TB(영상작업 하시니 넣었어요)\n3RSYS J700\n시소닉 A12 500\nLG 24GL600F (게임이 주 목적이시라면 이것 하시고)\nLG 27MK430H (영상편집이 주 목적이시라면 이것!)', "" 안녕하세요 질문자님\n스마트인입니다.^ㅡ^\n해당 사항에 대해서 고민이 많으신거 같네요\n제가 도와드리겠습니다.!♥\n질문자님에게 딱맞는 상품을\n인기있는 상품으로 열심히 검색 해보았어요 ㅠㅠ!\n80만원정도면 배그 풀옵 돌릴수있어요^^\n질문자님에게 도움이 되셧으면 합니다^^\n관련 기사글과 영상도 참고하시면\n상품 고르시는데 도움이 되실거같아요~\n채택받은 해피빈은 불우한 이웃에게 기부하는데 \n쓰고 있습니당. ^ㅡ^\n사람들이 찾는덴 이유가 있었네요 나만알고싶은 게이밍컴퓨터 꿀템 이구요. 추천!\n    no.1\n컴맹닷컴 CMA350C-165SH 조립PC (라이젠5 3500 WIN10 DDR4 16GB SSD 240GB GTX1650 SUPER), 기본형\n819,000원\n후기확인 (82)\n    no.2\n초이스컴 게이밍 조립컴퓨터 올인원 풀세트 모니터포함 고사양PC, 기본형, 풀세트 1번-9100F+GTX1050Ti+8G\n799,000원\n후기확인 (92)\n    no.3\n컴맹닷컴 게이밍 조립 PC (i5-9500F WIN10 DDR4 16G SSD240G GTX1660 6G), CM955FC-166H\n1,090,000원\n후기확인 (164)\n    no.4\n컴맹닷컴 게이밍 마스터 PC CM97KFC-278H(인텔 i7-9700KF RTX2070 SUPER 8GB RAM 16GB SSD 500GB WIN10), CM97KFC-278H, 기본형\n1,899,000원\n후기확인 (24)\n    no.5\n포유컴퓨터 MD추천 게임용에디션 인텔 AMD 조립컴퓨터PC, 에디션PC, 02번 에디션PC\n289,000원\n후기확인 (222)\n    no.6\nPC온스튜디오 게이밍 컴퓨터 고사양 조립 PC 라이젠 GTX RTX 게임용 본체, 기본형, 게이밍 - 05\n668,000원\n후기확인 (207)\n    no.7\n초이스컴 게이밍 조립컴퓨터 풀세트 모니터 윈도우포함 고사양PC, 10th풀세트 1번-i3-10100+GTX1050Ti+16GB, 기본형\n899,000원\n후기확인 (6)\n    no.8\n컴맹닷컴 하이엔드 마스터 PC CM99KFC-28TH(인텔 i9-9900KF RTX2080Ti 11GB RAM 32GB SSD 500GB WIN10), CM99KFC-28TH, 기본형\n3,249,000원\n후기확인 (3)\n    no.9\n쿠팡 로켓추천 PC No.1 (R3-3200G WIN미포함 RAM 8GB SSD 240GB Vega 8), 기본형\n332,000원\n후기확인 (9)\n    no.10\n프리플로우 HELLO CREATOR 3506S GAMING 조립PC (라이젠5 3500 WIN미포함 16GB NVMe250GB GTX1660 SUPER 6GB) 화이트, 기본형\n819,000원\n후기확인 (29)\n    no.11\n컴퓨터도매집 게이밍 조립식 컴퓨터 본체 배틀그라운드 로스트아크 롤 서든어택 오버워치 피파온라인4 조립 PC, 모델선택, 게임용3번\n639,900원\n후기확인 (1290)\n    no.12\n대한컴퓨터 게이밍컴퓨터 94001650 조립PC (9세대 i5-9400F WIN미포함 8GB SSD240GB GTX1650), 기본형\n659,000원\n후기확인 (5)\n    no.13\n컴맹닷컴 게이밍 데스크탑 조립PC CM954FC-166SH (i5-9400F WIN10 DDR4 16GB SSD 240GB GTX1660), 기본형\n1,086,000원\n후기확인 (23)\n    no.14\n대한컴퓨터샵 게이밍 컴퓨터 조립PC (i3-9100F WIN미포함 RAM 8GB SSD 240GB GTX1650 4GB), 기본형, 단일상품\n529,040원\n후기확인 (3)\n    no.15\n포유컴퓨터 샵다나와 게이밍 조립 컴퓨터 본체 롤 리그오브레전드 PC 라이젠 데스크탑 3200G 8G 사무용까지, PC본체, SHOP_3200G\n367,370원\n후기확인 (6)\n    no.16\n프리플로우 GAMING i5 RGB 블랙 게이밍 PC SG-500D12S(인텔 i5-9400F 삼성 8GB GTX1660 6GB 120GB SSD WIN미포함), SG-500D12S, 기본형\n649,000원\n후기확인 (43)\n    no.17\n한성컴퓨터 게이밍 데스크탑 화이트 TFG MX9465SW (i5-9400F WIN10 RAM 16GB 교체장착 SSD 240GB GTX 1650 SUPER), 기본형\n868,460원\n후기확인 (3)\n    no.18\n아싸컴 게임용 조립 PC AS-IM25V7 (라이젠5 마티스 3500X WIN미포함 DDR4 16GB SSD 240GB GTX1660 슈퍼) + 게이밍 장패드 + 안티 바이러스 백신, 기본형\n798,210원\n후기확인 (0)\n    no.19\nPC온스튜디오 게이밍 컴퓨터 고사양 하이엔드 조립 PC 데스크탑 본체, 1. 기본형, 게이밍 - H02\n933,000원\n후기확인 (7)\n    no.20\n컴맹닷컴 12코어 하이엔드 조립PC CMA39XC-288SH (라이젠9 3900X WIN10 Home DDR4 32GB SSD 500G RTX2080 SUPER), 기본형\n2,850,000원\n후기확인 (3)\n<게이밍컴퓨터 관련 인터넷 뉴스입니다>\n린백, 미리 준비하는 가을맞이 게이밍 의자 최저가 행사 진행\n마이크로닉스, 마이크 노캔과 7.1채널 지원 게이밍 헤드셋 'MANIC HS-301' 출시\n에이픽스게이밍, 친환경 E0등급 컴퓨터책상 'GD001 1200 화이트' 출시\n[XENICS] 제닉스, 아레나 제로 외 4종 게이밍의자 위메프 투데이특가 할인 실시\n제닉스, 사무실가구 라인업 오비스 & 게이밍의자 위메프 프로모션 실시\n존재하지 않는 이미지입니다.\n#컴퓨터본체, #게이밍노트북, #컴퓨터, #게이밍의자, #가성비게이밍컴퓨터\n[ 더 많은 게이밍컴퓨터 찾아보기 ]\n<관련영상>\n이 포스팅글은 제휴광고가 포함되므로 수익이 발생될 수 있어요 ᵕ◡ુᵕ"", '안녕하세요. 컴퓨터 추천할게요.\nhttps://coupa.ng/bITv0j\n초이스컴 게이밍 조립컴퓨터 올인원 풀세트 모니터포함 고사양PC\nCOUPANG\ncoupa.ng\n15% 세일가로 판매중인 제품입니다.\n79만원대 구매 가능하며,\n100여개 상품평 모두\n가격대비 성능과 품질면에서 \n5점 만점인 제품입니다.\n답변 채택 부탁드립니다.^^\n“파트너스 활동을 통해 일정액의 수수료를 제공받을 수 있음""', '모니터는 20-30만원 내외로 구매가 가능하며 종류가 다양하오니 충분한 상담 후 구매 권유 드리고\n2개 견적 중 어느걸로 진행하셔도 영상편집 작업은 문제 없이 사용 가능한 점 양지 부탁 드립니다 !\n추천 드리는 2가지 견적서 이며 메모리카드 8GB 를 추가하여 16GB 로 이용 하시거늘 FHD 60Hz\n모니터 기준으로 배틀그라운드, 60만원대로는 중옵션/ 70만원대로는 중상옵션 이상 쾌적하게\n플레이 가능합니다 !\n60만원대로 구매 하시거늘 롤, 서든, 피파, 던파 등 동급들의 게임들 모두 풀옵션은 물론이며,\n게임 방송 까지 이용이 가능한 스펙의 견적 구성이며 오버워치, 블소 등 동급들의 게임들도\n상옵션 이상으로 플레이 가능하며 GTA5와 같은 스팀 게임들도 중옵션 이상으로 플레이\n가능합니다.\n70만원대로 구매 하시거늘 롤, 서든, 피파, 던파 등 동급들의 게임들 모두 풀옵션은 물론이며,\n게임 방송 까지 이용이 가능한 스펙의 견적 구성이며 오버워치, 블소 등 동급들의 게임들도\n풀옵션으로 플레이 가능하며 GTA5 와 같은 스팀 게임들도 상옵션 이상으로 쾌적하게 플레이\n가능합니다.\n예산에 여유가 되시고 저장 공간을 다소 많이 사용 하시는 편이시라면 하드디스크 1TB 정도\n추가하여 구매 하시는 것을 권유 드립니다.\n기업이 아닌 개인이 게임용/ 작업용/ 가정용으로 이용 하시는거라면 브랜드 완제품 보다는\n당연히 조립식 컴퓨터로 구매 하시는게 좋습니다. \n같은 부품임에도 불구하고 가격 차이는 천지 차이 입니다.\n더불어 요즘은 오프라인보다 온라인으로 발품 파셔서 구매 하시는게 더 저렴하고 좋습니다.\n※ 조립 컴퓨터를 구매 하시기 앞서 용도와 예산을 정확하게 생각하고 계셔야 하며, 용도에\n있어서 오버되거나 부족하지 않게 견적 구성을 하신 뒤 가격 비교를 하여 구매 하시는게\n가장 좋습니다.\n저희 네이버 현컴 카페에서 다나와 최저가 기준으로 구매 가능하오니, 오셔서 보다 더\n견적상담 자세하게 받아보시고 가세요 ! 답변 하단 현컴 배너 이미지를 클릭하여 카페로\n이동이 가능합니다 !']",4,https://kin.naver.com/qna/detail.naver?d1id=1&dirId=10101&docId=366305727&qb=67Cx7Iug&enc=utf8&section=kin&rank=7&search_sort=3&spq=0,데스크톱
1,2020.08.26,[],휴대폰 해킹,아이폰 쓰는데요.성인 사이트를 vpn으로 보다가 휴대폰 설정을 통해서 해킹 되었다고 문자오면서 vpn 깔라는데 뭔가요....문자온 시기는 vpn 지운 시기에요.쓰던 vpn에도 경고 떠서 놀라서 지웠었어요......어쩌죠,"[' 해당 광고는 매우 흔하게 발생하는 허위 보안 광고로, 보통 기기가 감염되거나 통신이 도청당한다는 식의 있지도 않은 가짜 보안 위협을 만들어서 사용자를 혼란스럽게 만든 다음, 제대로 작동하지 않지만 유료 결제 등 사용자에게 피해를 주는 가짜 VPN, 백신 앱, 휴대폰 클리너 앱 등을 설치하게 합니다.\n 따라서 그냥 해당 광고는 무시하셔야 하며, 그 어떤 것도 사이트에서 광고하는 건 설치하시면 안 됩니다.', '안녕하세요 판다vpn지식인 상담사입니다\n무료 vpn을 이용했을때, \n또는 보안이 안전하지않은 사이트에 접속을 하였을 경우\n발생하는 악성광고이니 무시하셔도됩니다.\n무료VPN의 수익구조는 정보판매라는\n소문이 있을정도로 피해사례가 많이 있습니다!\n혹시나 지금 무료vpn을 이용하시고 계시다면 지우시는게 좋을 것 같습니다!\n저희 판다vpn은 전세계에서 한국서버 50개이상 보유 \n게임유저들의 위한 게임서버 다수보유, 각종 해외서버도 보유중입니다 ^^\n네이버에 ""판다VPN"" 를 검색해주세요']",2,https://kin.naver.com/qna/detail.naver?d1id=1&dirId=11001&docId=366303076&qb=67Cx7Iug&enc=utf8&section=kin&rank=8&search_sort=3&spq=0,해킹
1,2020.08.26,[],인텔 견적추천,인텔 게이밍용 컴 견적 부탁드립니다. 용도는 레식이고 가격은 80~100만원 사이로 부탁드립니다.,"['추천 드리는 2가지 견적서 이며 메모리카드 8GB 를 추가하여 16GB 로 이용 하시거늘 FHD 60Hz\n모니터 기준으로 배틀그라운드, 60만원대로는 중옵션/ 70만원대로는 중상옵션 이상 쾌적하게\n플레이 가능합니다 !\n60만원대로 구매 하시거늘 롤, 서든, 피파, 던파 등 동급들의 게임들 모두 풀옵션은 물론이며,\n게임 방송 까지 이용이 가능한 스펙의 견적 구성이며 오버워치, 블소 등 동급들의 게임들도\n상옵션 이상으로 플레이 가능하며 GTA5와 같은 스팀 게임들도 중옵션 이상으로 플레이\n가능합니다.\n70만원대로 구매 하시거늘 롤, 서든, 피파, 던파 등 동급들의 게임들 모두 풀옵션은 물론이며,\n게임 방송 까지 이용이 가능한 스펙의 견적 구성이며 오버워치, 블소 등 동급들의 게임들도\n풀옵션으로 플레이 가능하며 GTA5 와 같은 스팀 게임들도 상옵션 이상으로 쾌적하게 플레이\n가능합니다.\n예산에 여유가 되시고 저장 공간을 다소 많이 사용 하시는 편이시라면 하드디스크 1TB 정도\n추가하여 구매 하시는 것을 권유 드립니다.\n기업이 아닌 개인이 게임용/ 작업용/ 가정용으로 이용 하시는거라면 브랜드 완제품 보다는\n당연히 조립식 컴퓨터로 구매 하시는게 좋습니다. \n같은 부품임에도 불구하고 가격 차이는 천지 차이 입니다.\n더불어 요즘은 오프라인보다 온라인으로 발품 파셔서 구매 하시는게 더 저렴하고 좋습니다.\n※ 조립 컴퓨터를 구매 하시기 앞서 용도와 예산을 정확하게 생각하고 계셔야 하며, 용도에\n있어서 오버되거나 부족하지 않게 견적 구성을 하신 뒤 가격 비교를 하여 구매 하시는게\n가장 좋습니다.\n저희 네이버 현컴 카페에서 다나와 최저가 기준으로 구매 가능하오니, 오셔서 보다 더\n견적상담 자세하게 받아보시고 가세요 ! 답변 하단 현컴 배너 이미지를 클릭하여 카페로\n이동이 가능합니다 !', '현금몰에서 구매하시면 좀 더 저렴합니다.\n가격이 부담 스러우시면 그래픽카드를 1650 SUPER로 낮추세요.', "" 안녕하세요 질문자님\n스마트인입니다.^ㅡ^\n해당 사항에 대해서 고민이 많으신거 같네요\n제가 도와드리겠습니다.!♥\n질문자님에게 딱맞는 상품을\n인기있는 상품으로 열심히 검색 해보았어요 ㅠㅠ!\n질문자님에게 도움이 되셧으면 합니다^^\n관련 기사글과 영상도 참고하시면\n상품 고르시는데 도움이 되실거같아요~\n채택받은 해피빈은 불우한 이웃에게 기부하는데 \n쓰고 있습니당. ^ㅡ^\n사람들이 찾는덴 이유가 있었네요 나만알고싶은 게이밍컴퓨터 꿀템 이구요. 추천!\n    no.1\n컴맹닷컴 CMA350C-165SH 조립PC (라이젠5 3500 WIN10 DDR4 16GB SSD 240GB GTX1650 SUPER), 기본형\n819,000원\n후기확인 (82)\n    no.2\n초이스컴 게이밍 조립컴퓨터 올인원 풀세트 모니터포함 고사양PC, 기본형, 풀세트 1번-9100F+GTX1050Ti+8G\n799,000원\n후기확인 (92)\n    no.3\n컴맹닷컴 게이밍 조립 PC (i5-9500F WIN10 DDR4 16G SSD240G GTX1660 6G), CM955FC-166H\n1,090,000원\n후기확인 (164)\n    no.4\n컴맹닷컴 게이밍 마스터 PC CM97KFC-278H(인텔 i7-9700KF RTX2070 SUPER 8GB RAM 16GB SSD 500GB WIN10), CM97KFC-278H, 기본형\n1,899,000원\n후기확인 (24)\n    no.5\n포유컴퓨터 MD추천 게임용에디션 인텔 AMD 조립컴퓨터PC, 에디션PC, 02번 에디션PC\n289,000원\n후기확인 (222)\n    no.6\nPC온스튜디오 게이밍 컴퓨터 고사양 조립 PC 라이젠 GTX RTX 게임용 본체, 기본형, 게이밍 - 05\n668,000원\n후기확인 (207)\n    no.7\n초이스컴 게이밍 조립컴퓨터 풀세트 모니터 윈도우포함 고사양PC, 10th풀세트 1번-i3-10100+GTX1050Ti+16GB, 기본형\n899,000원\n후기확인 (6)\n    no.8\n컴맹닷컴 하이엔드 마스터 PC CM99KFC-28TH(인텔 i9-9900KF RTX2080Ti 11GB RAM 32GB SSD 500GB WIN10), CM99KFC-28TH, 기본형\n3,249,000원\n후기확인 (3)\n    no.9\n쿠팡 로켓추천 PC No.1 (R3-3200G WIN미포함 RAM 8GB SSD 240GB Vega 8), 기본형\n332,000원\n후기확인 (9)\n    no.10\n프리플로우 HELLO CREATOR 3506S GAMING 조립PC (라이젠5 3500 WIN미포함 16GB NVMe250GB GTX1660 SUPER 6GB) 화이트, 기본형\n819,000원\n후기확인 (29)\n    no.11\n컴퓨터도매집 게이밍 조립식 컴퓨터 본체 배틀그라운드 로스트아크 롤 서든어택 오버워치 피파온라인4 조립 PC, 모델선택, 게임용3번\n639,900원\n후기확인 (1290)\n    no.12\n대한컴퓨터 게이밍컴퓨터 94001650 조립PC (9세대 i5-9400F WIN미포함 8GB SSD240GB GTX1650), 기본형\n659,000원\n후기확인 (5)\n    no.13\n컴맹닷컴 게이밍 데스크탑 조립PC CM954FC-166SH (i5-9400F WIN10 DDR4 16GB SSD 240GB GTX1660), 기본형\n1,086,000원\n후기확인 (23)\n    no.14\n대한컴퓨터샵 게이밍 컴퓨터 조립PC (i3-9100F WIN미포함 RAM 8GB SSD 240GB GTX1650 4GB), 기본형, 단일상품\n529,040원\n후기확인 (3)\n    no.15\n포유컴퓨터 샵다나와 게이밍 조립 컴퓨터 본체 롤 리그오브레전드 PC 라이젠 데스크탑 3200G 8G 사무용까지, PC본체, SHOP_3200G\n367,370원\n후기확인 (6)\n    no.16\n프리플로우 GAMING i5 RGB 블랙 게이밍 PC SG-500D12S(인텔 i5-9400F 삼성 8GB GTX1660 6GB 120GB SSD WIN미포함), SG-500D12S, 기본형\n649,000원\n후기확인 (43)\n    no.17\n한성컴퓨터 게이밍 데스크탑 화이트 TFG MX9465SW (i5-9400F WIN10 RAM 16GB 교체장착 SSD 240GB GTX 1650 SUPER), 기본형\n868,460원\n후기확인 (3)\n    no.18\n아싸컴 게임용 조립 PC AS-IM25V7 (라이젠5 마티스 3500X WIN미포함 DDR4 16GB SSD 240GB GTX1660 슈퍼) + 게이밍 장패드 + 안티 바이러스 백신, 기본형\n798,210원\n후기확인 (0)\n    no.19\nPC온스튜디오 게이밍 컴퓨터 고사양 하이엔드 조립 PC 데스크탑 본체, 1. 기본형, 게이밍 - H02\n933,000원\n후기확인 (7)\n    no.20\n컴맹닷컴 12코어 하이엔드 조립PC CMA39XC-288SH (라이젠9 3900X WIN10 Home DDR4 32GB SSD 500G RTX2080 SUPER), 기본형\n2,850,000원\n후기확인 (3)\n<게이밍컴퓨터 관련 인터넷 뉴스입니다>\n린백, 미리 준비하는 가을맞이 게이밍 의자 최저가 행사 진행\n마이크로닉스, 마이크 노캔과 7.1채널 지원 게이밍 헤드셋 'MANIC HS-301' 출시\n에이픽스게이밍, 친환경 E0등급 컴퓨터책상 'GD001 1200 화이트' 출시\n[XENICS] 제닉스, 아레나 제로 외 4종 게이밍의자 위메프 투데이특가 할인 실시\n제닉스, 사무실가구 라인업 오비스 & 게이밍의자 위메프 프로모션 실시\n존재하지 않는 이미지입니다.\n#컴퓨터본체, #게이밍노트북, #컴퓨터, #게이밍의자, #가성비게이밍컴퓨터\n[ 더 많은 게이밍컴퓨터 찾아보기 ]\n<관련영상>\n이 포스팅글은 제휴광고가 포함되므로 수익이 발생될 수 있어요 ᵕ◡ુᵕ"", 'http://shop.danawa.com/short/ZwysFB\nPC견적 : 샵다나와\n나만의 PC를 구성하고 견적비교, 조립까지 한번에 구매하세요.\nshop.danawa.com\n이정도 견적이면 충분합니다! 사양도 좋아요!! \n3300x가 4코어 8쓰레드 1칩렛이라싱글코어성능이괜찮은제품입니다. 1ccx 4코어로나와서구조적인약점을개선해서게임프레임이상당히잘나옵니다.가성비 rx570그래픽카드와조합하면배그국민옵으로100~110프레임정도가나오는정도입니다.\n 3300x가램오버,cpu오버클럭이가능한cpu여서더높은성능을끌어낼수도있고am4 소켓이올해말에나오는제품과호환이가능해서보드를바꾸지않더라도업그레이드가가능해서가성비존버용으로커뮤니티에서좋은평을받고있습니다.오버클럭을못하시는분들은 3200램을꽂아서사용하시기도하고요.\nhttps://youtu.be/tFZvR9sLseM']",4,https://kin.naver.com/qna/detail.naver?d1id=1&dirId=10103&docId=366298952&qb=67Cx7Iug&enc=utf8&section=kin&rank=9&search_sort=3&spq=0,"컴퓨터 부품, 조립"
1,2020.08.26,"['해킹', '해킹의심', '해킹당한건가요', '내공100무조건채택합니다ㅠㅠ', '내공100', '제발알려주세요부탁드려요', '급해요']",해킹 당할거같아요,제가 구글에 들어가서애니같은거 막 찾아보고 했었는데 갑자기 39개의 바이러스가 발견됬다고 무슨 앱ㅇ깔라고 해서 깔고 너무 무서워요 어떻게 해야하나요 그래서 깔긴깔았고 너무 무서워요 어떻게 해야할까요?? 빨리요 ㅜㅜㅠ 진짜 급해요 ㅜㅠㅠ,['흠 저도 많이 걸려봐서 아는데 바이러스가 발견되었다고 뜨는것은 겁주려고 하는 겁니다. 거기서 그 사이트 들어가셔서 앱 다운받으시면 그게 바이러스 걸리는거에요. 그냥 팝업뜨시면 그 탭 지우시고 새탭키시면 됩니다. 괜히 들어가시지 마세요. 이미 걸리셨으면 딱히 방법은 없습니다. 모바일 백신으로 치료하시든지 하시고 만약 늦었다면 포맷밖에 답이 없어요.'],1,https://kin.naver.com/qna/detail.naver?d1id=1&dirId=11001&docId=366297010&qb=67Cx7Iug&enc=utf8&section=kin&rank=10&search_sort=3&spq=0,해킹
2,2020.08.26,"['컴퓨터바이러스', '바이러스검사', '바이러스치료', '보안', '보안프로그램', '바이러스제로', '고민', '컴맹좀도와주세요']",바이러스검사했는데 이거는 어떤 바이러스인가요? 심각한건가요???,"""C:\Users\ksy96\AppData\Roaming\relatedpop"" (격리/제거 성공
■ 악성 및 유해 가능 <HKEY_CURRENT_USER> 레지스트리 제거 :
""HKCU\Software\RelatedPop"" (격리/제거 성공)
■ 악성 및 유해 가능 프로그램 설치 정보 레지스트리 제거 :
""HKLM\Software\Wow6432Node\Microsoft\Windows\CurrentVersion\Uninstall\RelatedPop"" (격리/제거 성공)
처음으로 빨간색 화면이 뜨길래 엄청 당황했네요 위에 3개가 떴습니다...
심각한건가요???",['relatedpop은  심각한 악성코드는 아니니 염려를 하지 않아도됩니다.\nrelatedpop는 악성 인터넷광고 팝업창 을 띄우는 프로그램입니다.\n백신에서 처리를 하였으니 염려를 하지 않아도 될 것 같습니다.'],1,https://kin.naver.com/qna/detail.naver?d1id=1&dirId=11002&docId=366296293&qb=67Cx7Iug&enc=utf8&section=kin&rank=11&search_sort=3&spq=0,바이러스
