page,date,tags,questions,questions_add,answers,N_answer,url,category
24,2021.06.26,[],50대 백신 예약시 선택일자 기간은 얼마나 되나요?,"7-8월중 백신 맞을 예정인 50대 후반 회사원입니다.
몇가지 궁금해서요.
사전예약을 할때 원하는 접종날짜도 본인이 정하나요?
그리고 사전예약시 접종할수 있는기간은 얼마나 되나요?
구체적으로 7/26일 부터 언제까지 접종할수 있는지 알고싶습니다.","[""코로나 백신 예약 일정\n- 70~74세(1947년~1951년), 만성호흡기장애인 : 2021.05.06(목) ~ 06.03(목)\n- 65~69세 (1952년~1956년) : 2021.05.10(월) ~ 06.03(목)\n- 60~64세 (1957년~1961년), 어린이집/유치원/초등1,2교사 등 : 2021.05.13(목) ~ 06.03(목)\n네이버 노쇼 백신 예약\n네이버에서 잔여 백신을 조회할 경우에는 네이버 앱·네이버 지도앱 또는 네이버 웹에 접속해 검색창에 '잔여 백신'을 검색하면 지도 플랫폼에 위탁의료기관 및 남은 백신 수량이 표시된다.\n잔여백신 카카오톡\n카카오에서는 카카오톡 하단의 샵(#) 탭에서 '잔여 백신' 탭을 선택하거나 카카오 맵 앱을 통해서 잔여 백신 조회가 가능하다. 잔여백신 수량이 3개 이하로 남아있을 경우에는 빨간색, 4∼6개까지는 노란색, 7개 이상은 초록색 표지가 각 접종기관 위에 나타난다.\nhttps://453010star.tistory.com/1507\n잔여 백신 예약 대상 조회 및 신청방법 [카카오톡 네이버]\n잔여 백신 예약 대상 조회 및 신청방법 [카카오톡 네이버] 5월 27일부터 네이버와 카카오 앱으로 신종 코로나바이러스 감염증(코로나19) '잔여 백신'을 조회하고 당일 예약으로 접종까지 받을 수 있다...\n453010star.tistory.com\nㅡㅡ"", '백신 접종일은 본인이 선택할 수 있습니다.\n기간은 아직 정확하게 나오지 않았지만 정부에서 발표한 3분기 접종계획을 참고하시면 도움이 되실 겁니다.\n3분기 백신접종계획, 50대,40대이하,30대미만은 언제?(feat.화이자,모더나,아스트라제네카)\n21년 6월 현재 국민의 27%인 1,400만 명이 코로나 백신을 1회 이상 접종한 가운데 정부에서는 이달 17일에 3분기 백신 접종계획을 발표했습니다. 내달부터는 18-59세의 국민들과 대학 수학능력시험 수험생, 어린..\njinioff.tistory.com', '네 접종 예약 시간, 병원도 지정할 수 있습니다. \n백신접종 사전예약 안내입니다.\n코로나 백신접종 시기와 예약방법(50대 40대 30대)\n코로나 백신 접종 시기 발표가 나왔습니다. 나이대별로 50대 40대 30대등, 그리고 수험생, 교직원 등을 대상으로 하는 접종 계획 등이 발표되었습니다. 7월 백신 접종은 다음과 같은 순으로 이루어지게 됩니다...\ngamemer.tistory.com\n예약방법도 확인해보시기 바랍니다.\n코로나 백신 접종 예약 방법 종류 신청 방법\n코로나19 백신 접종 예약 신청이 가능해졌습니다. 질병관리청에 따르면 코로나19 예방접종 사전예약 시스템을 오픈하여 운영한다고 합니다. 온라인 예방접종 신청방법과 절차, 백신 종류와 선택 등 여러가지 백신..\ngamemer.tistory.com', ""코로나 백신 예약 일정\n- 70~74세(1947년~1951년), 만성호흡기장애인 : 2021.05.06(목) ~ 06.03(목)\n- 65~69세 (1952년~1956년) : 2021.05.10(월) ~ 06.03(목)\n- 60~64세 (1957년~1961년), 어린이집/유치원/초등1,2교사 등 : 2021.05.13(목) ~ 06.03(목)\n네이버 노쇼 백신 예약\n네이버에서 잔여 백신을 조회할 경우에는 네이버 앱·네이버 지도앱 또는 네이버 웹에 접속해 검색창에 '잔여 백신'을 검색하면 지도 플랫폼에 위탁의료기관 및 남은 백신 수량이 표시된다.\n잔여백신 카카오톡\n카카오에서는 카카오톡 하단의 샵(#) 탭에서 '잔여 백신' 탭을 선택하거나 카카오 맵 앱을 통해서 잔여 백신 조회가 가능하다. 잔여백신 수량이 3개 이하로 남아있을 경우에는 빨간색, 4∼6개까지는 노란색, 7개 이상은 초록색 표지가 각 접종기관 위에 나타나타납니다. \nhttp://m.site.naver.com/0O61B\n잔여백신 예약 조회 및 당일 예약 가능(네이버, 카카오)\n잔여백신 예약 조회 및 당일 예약 가능(네이버, 카카오) 5월 27일부터 네이버와 카카오의 지도 앱에서 잔여 백신 예약을 할 수 있게 되었습니다. 잔여 백신 예약 시스템은 현재 시범 운..\nm.site.naver.com"", '원하는 접종 날짜, 접종 기관 선택할 수 있습니다. \n접종 기간은 7월말~8월 중순 입니다.\n더 자세한 내용은 아래 채널 및 포스팅을 참고해주세요~\n잔여백신 예약 신청\n잔여백신 예약 신청\npf.kakao.com\n50대 백신 접종 시기 예약 바로가기\n3분기 코로나 백신 접종 계획이 발표되면서 50대 백신 접종 시기에 대한 관심이 높아지고 있습니다. 50대 백신 접종 예약 바로가기 안내 및 잔여백신 예약 정보는 아래 카카오톡 채널에 잘 정리되어 있습니다. 채..\nwealthinfo.tistory.com']",5,https://kin.naver.com/qna/detail.naver?d1id=7&dirId=7010107&docId=393251165&qb=67Cx7Iug&enc=utf8&section=kin&rank=232&search_sort=3&spq=0,감염내과
25,2021.06.26,[],백신2차접종 다음날 수술전검사 가능할까요?,"2차 접종일 문자를 받았는데
마침 수술전 검사하는 다음날이예요.
만으로 24시간이 채 안될텐데 검사받아도 될까요?","['수술전 검사를 미루시는게 낫겠네요', '백신 접종과 수술 전 검사는 크게 관련성은 없습니다.\n하지만 백신 접종 후에 나타날 수 있는 일반적인 부작용 증상 등을 감안하면 \n수술전 검사를 미루는 것이 더 안정적이겠지요.\n백신접종 전후의 주의사항 또는 이상반응이 궁금하시면 아래 글을 참고해주세요.\n코로나백신 예방접종 주의사항은?(feat.술,운동,타이레놀,이상반응 등)\n날씨도 점점 더워지는 6월이 되면서 아스트라제네카, 얀센, 화이자 등 각종 코로나 백신 접종이 본격적으로 진행되고 있습니다. 일부 특정 직업군과 고령층 위주로 진행하던 예방접종이 얀센 백신 접종을 시작으..\njinioff.tistory.com']",2,https://kin.naver.com/qna/detail.naver?d1id=1&dirId=1060101&docId=393242914&qb=67Cx7Iug&enc=utf8&section=kin&rank=243&search_sort=3&spq=0,지식iN
25,2021.06.26,[],내년 2월에 일본으로 출국할 수 있는 가능성이 얼마나 될까요?,"일본으로 교환학생을 가고 싶은데 다 막혀서,, 내년 1학기 목표로 하고 있거든요,, 
가능성이 있긴 한가요? ㅍ",['아무도 모릅니다.\n단순히 현재상황으로서는 백신접종 진행상황에 따라 갈수 있을것도 같긴한데... \n일반인 1차접종이 7월 8월정도면 얼추 마무리 되고 2차까지해도 가을이면 어느정도 접종률 올라올거같긴하지만... \n문제는 인도 델타변이 바이러스라서\n이게 어찌될지 아무도 모르는겁니다. '],1,https://kin.naver.com/qna/detail.naver?d1id=11&dirId=11080401&docId=393243712&qb=67Cx7Iug&enc=utf8&section=kin&rank=242&search_sort=3&spq=0,"일본어 어원, 어휘"
27,2021.06.26,[],입벌릴때 통증,"20세 남자입니다
중학생때부터 입 벌리면 딱딱 소리가 좀 크게 났습니다
그러나 통증은 없고 턱 빠진 적도 없어서 몇 년 동안
그냥 냅뒀습니다. 근데 며칠 전부터 입을 벌릴때나
음식물을 씹을 때마다 턱이 멍든것처럼 아프기 시작했습니다
이거 턱관절 디스크 일까요???
단순히 부정교합으로만 생각했었는데..","['안녕하세요. 대한치과의사협회-네이버 지식인 상담치과의사 허재식 입니다.\n턱관절 증상입니다. 턱관절 증상은 보통 악습관에 의해서 발생됩니다. \n주무실때, 이갈이, 이악물기를 하시면 파괴적이고 과도한 힘이 얼굴 근육과 턱관절 주변의 조직, 근욕, 인대, 캡슐, 조직액 등에 영향을 미쳐서 깼을때 뻐근하거나 아프실 수 있습니다. 가끔 소리가 난다고 하시는 분들도있구요. \n이런 분들은 혀와 뺨쪽 점막을 보면 울퉁불퉁하게 하얀 라인이 보이기도 하고, 치아의 마모가 심하기도 합니다. \n우선 턱관절 분석 검사를 통해 현 상태를 파악하고 물리치료, 약물치료, 습관 조절, 그리고 스플린트(악교합안정장치)라는 장치를 착용하기도 합니다. \n밤에 일어나는 악습관 자체를 교정할 수 는 없습니다. 주무시고 계시기 때문이죠. 다만 이 악습관으로 우리몸의파괴가 일어나는 것을 차단하는 관리 치료를 받으시는 겁니다. \n주변 교정 전문의나 턱관절을 보시는 병원에 내원하셔서 턱관절 분석 검사와 적절한 치료를 받으시는것이방법입니다. \n근육은 부드럽게 풀어주면 좋습니다: 사우나, 찜질, 마사지, 목욕, 스트레칭, 그리고 가벼운 운동 등이도움이됩니다. \n술, 과도하게 집중하는 일, 그리고 스트레스는 피하셔야 하구요~ 이런 것들을 꾸준히 하는 것이 제일 좋으나, 꾸준하게 하기 쉽지 않으시죠! ^^;; 그래도 시도는 해보시길 추천드립니다. \n답변이 도움이 되었는지 모르겠습니다. \n그래도 도움이 되고 마음을 편하게 해드렸기를 바랍니다. \n이제 곧 백신도 접종이 될테고 우리 삶이 다시금 정상으로 빨리 되돌아가기를 바래봅니다. \n감사와 기쁨이 넘치시는 하루하루 되시기를 바라겠습니다\n에스플란트 치과병원장 허 재식 올림']",1,https://kin.naver.com/qna/detail.naver?d1id=7&dirId=70201&docId=393194208&qb=67Cx7Iug&enc=utf8&section=kin&rank=269&search_sort=3&spq=0,치아교정
27,2021.06.26,"['심장', '두통', '정신건강의학과', '순환기내과', '신경외과', '공황장애', '불면증', '협심증']",심장/정신/신경 어디과로 가야할지.....,"제발 도와주세요 하루하루가 너무 무섭고 죽을 듯이 괴롭고 지쳐서 너무 힘드네요

제가 공황장애를 4년전에 처음 만났고 그때는 아무것도 몰라 심장쪽이 아프고 불편해서 응급실에 실려갔는고 대학병원에서도 심장은 문제가 없다고 해서 정신과를 갔는데 공황장애라고 하더군요.
그래도 공황장애를 2년정도 치료하니 완치가 되었는데,
직장을 가지니 불명증이 생겨버리고 
최근에는 또 다시 심장쪽이 아파오기 시작했고 코로나 백신 접종하고 1주가 지났는데 두통이 5~6일 지속됩니다. 머리는 ct촬영했지만 이상이 없다고 하는데....
또 다시 예민한 심장부위와 머리 부분이 아프니 답답하고 너무 고통스러워
이대로 잠들면 죽겠다 싶어 잠을 안자려고 버티다 새벽 2~4시에 지쳐서 잠이 드네요

문제는 병원을 무슨과로 가야할지 몰라서 지식인 분들께 여쭈어 봅니다.
제발 살려주세요",['안녕하세요. 대한의사협회·네이버 지식iN 상담의사 홍인표 입니다.\n너무 힘드시겠습니다. 검사에서 이상이 없다고 한다면 정신건강의학과 진료를 받으시고 빨리 회복하세요'],1,https://kin.naver.com/qna/detail.naver?d1id=7&dirId=70117&docId=393195776&qb=67Cx7Iug&enc=utf8&section=kin&rank=268&search_sort=3&spq=0,가정의학과
27,2021.06.26,"['치아교정', '충치치료', '치과치료', '치과']",치아교정중인데 충치치료 다른병원에서 하면,"배신자같죠?ㅜㅜ교정중인데 충치있다고 치료하라는데 가격이 세서 부담돼여..

다른병원에서 치료하면 좀 그런가요",['안녕하세요. 대한치과의사협회-네이버 지식인 상담치과의사 허재식 입니다.\n괜찮습니다!!!! 전혀 문제되지 않습니다. ^^\n답변이 도움이 되었는지 모르겠습니다. \n그래도 도움이 되고 마음을 편하게 해드렸기를 바랍니다. \n이제 곧 백신도 접종이 될테고 우리 삶이 다시금 정상으로 빨리 되돌아가기를 바래봅니다. \n감사와 기쁨이 넘치시는 하루하루 되시기를 바라겠습니다\n에스플란트 치과병원장 허 재식 올림'],1,https://kin.naver.com/qna/detail.naver?d1id=7&dirId=70201&docId=393199412&qb=67Cx7Iug&enc=utf8&section=kin&rank=267&search_sort=3&spq=0,치아교정
27,2021.06.26,[],남자 콘딜로마에 걸리면 어떻게되나요?,"남자이구요 
약 5~6년전부터 그림상의 위치에 정말 엄청작은 쥐젖? 같은게 3~4개정도 났었는데 
그대로 방치해두고 있었거든요, 여기서 더 커지거나 번지는건 없었구 아직까지 형태가 유지되고있습니다. 제가 알기론 콘딜로마(곤지름)에 걸리면 닭벼슬 포도송이처럼 송송송 나는걸로 알고있는데 한달전 std12종, hpv, 에이즈 검사 했을때 (소변, 혈액) 모두 음성이 떴는데, 크게 걱정은 안 해도 되겠죠..?","['안녕하세요. 하이닥-네이버 지식iN 상담의 및 원주 콘딜로마 치료 비뇨기과 전문의입니다. \n음경에 뾰루지나 여드름과 같은 양상을 보이는 피부병변이 있을 때  남자 콘딜로마가 아닌가 하는 걱정이 들어 확인을 위해 내원하시는 분들이 계십니다.  진찰과 함께 피부 브러쉬 HPV PCR검사를 시행하기도 하는데 콘딜로마 예방을 위해 가다실 9가 백신접종도 늘어나고 있는 추세입니다. \n질문과 함께 올리신 그림과 설명에 따르면 포피소대 양측에 좁쌀처럼 작은 돌기들이 대칭적으로 여러개 확인되는 상태인 것으로 보입니다.  여타 다른 성기 피부에 확인되는 무통성의 돌기 병변이라면 곤지름을 강력하게 의심하지만 소대 양측으로 대칭을 이루는 점, 시간이 지나도 크기나 갯수에 변화가 없다는 점을 고려한다면 흔히 성기 콘딜로마로 착각하시는 음경 진주양구진일 가능성이 높다고 보여집니다. \n진주양 구진은 흔한 정상피부소견으로서 곤지름, 헤르페스 등과는 다르게 성병이 아니며 별도의 검사나 치료를 필요로 하지 않기 때문에 걱정하실 필요는 없습니다. 수년간 현재까지 양상의 변화가 없었다면 그냥 두셔도 무방하며 만일 양상 변화가 있는 경우에는 가까운 남성병원에 방문하시어 진료를 받아보시기 바랍니다.  \n질문사항에 도움이 되셨기 바라며 남자 콘딜로마 연관하여 원주 비뇨의학과에서 답변드립니다. ']",1,https://kin.naver.com/qna/detail.naver?d1id=7&dirId=70113&docId=393201912&qb=67Cx7Iug&enc=utf8&section=kin&rank=266&search_sort=3&spq=0,비뇨의학과
27,2021.06.26,[],고3 코로나 백신 동의서 내도 불안하면 안맞도 되나요,"제가 코로나 백신 접종 대상자인데
목 이물감 느끼고 그러고 삼킬때 통증이 있는데 코로나 백신 동의서 받았거든요.
만약에 코로나 백신 접종 동의했는데 문자가 오면 불안하면 코로나 백신 안맞아도 되나요?","['코로나가 불안한 사람을 위해서 \n백신을 무료로 접종해 주겠다는 것이지... \n의무접종(?) 까지는 아니라서... 원치 않으면 접종하지 않아도 되며 \n백신을 접종하지 않더라도... 수능을 볼 수 있습니다.', '물론 안 맞아도 됩니다.\n사실 접종일에 몸 컨디션이 안 좋아요\n맞지 않는 분들도 많아요\n다음 기회에 맞으면 됩니다.', '질문자님!안녕하세요^^저도 고3 학생 입니다.\n사실 저도 오늘 엄마가 그러셨는데 어제인가 백신접종 희망자 조사를 했나봐요....\n저도 사실 애초에 불안하고 효과가 과연 있을지를 몰라서...또한 부작용도 걱정되고요..안 맞을 생각인데..그래서 신청 거부 했어요...\n딱히 코로나바이러스를 조심하는 이상 안 맞아도 된다고 저는 생각이 들어요...\n아침에 뉴스 못 보셨나요??모 연예인이 얀센 백신맞았다가 코로나 걸렸다는거여...\n그만큼 자가 관리가 저는 더 중요하다고 생각듭니다!!', '동의서 내도 당일날 안나가면 돼요\n그걸 노쇼라고 해요\n전국민이 예약해놓고도 노쇼 많이 해요\n문자는 오겠죠.  7월 몇일날 접종 받으러 나오라고\n쌩까면 됩니다\n잠수타세요\n깔끔히 노쇼하시길\n아무 문제 없음\n백신은 자유선택이니까\n선생님이 뭐라하든 믿지 마셈\n수능 불이익 없음\n백신 안맞는다고 남한테 피해 없어요\n그런 이상한 논리를 펴는 선생들이 있나 보대요\n그렇게 떠밀어서 자기 제자 부작용오면\n그 죄를 어찌 받을건지']",4,https://kin.naver.com/qna/detail.naver?d1id=7&dirId=7010107&docId=393207210&qb=67Cx7Iug&enc=utf8&section=kin&rank=265&search_sort=3&spq=0,감염내과
27,2021.06.26,[],자가면역질환인 국소성경피증과 갑상선염을 가지고 있는 33세인데요 코로나백신 접종을 해야는지 알고싶어요,,['안녕하세요. 하이닥-네이버 지식iN 상담의 이정찬 입니다.\n현재 나와 있는 논문을 보면 류마티스 질환이 있는 환자들은 코로나 예방접종을 꼭 하는 것이 좋다는 의견입니다. 그러니 꼭 접종을 받으시길 바랍니다.\n감사합니다.'],1,https://kin.naver.com/qna/detail.naver?d1id=7&dirId=7010108&docId=393213221&qb=67Cx7Iug&enc=utf8&section=kin&rank=264&search_sort=3&spq=0,류마티스내과
27,2021.06.26,['새끼강아지산책'],새끼강아지가 오늘 5차 예방 접종을 맞았는데 오늘 산책 나갈 수 있나요?,주사 맞자마자 산책 나가도 괜찮ㄴ나요?,"['산책 나갈수 있습니다.', '5차 까지 다 맞은거면\n산책 가셔도 좋습니다\n바로도 가능해요\n애기와 좋은추억 쌓으시길 바래요^^', '안녕하세요! \n어바웃펫 펫케어 24입니다. \n강아지는 보통 생후 6주 전후로 접종을 시작하여\n2주 간격으로 5차까지 기초접종을 하게 되어요.\n종합백신(파보, 간염, 홍역) 5회,\n코로나 2회, \n켄넬코프(기관지염) 2회,\n인플루엔자 2회,\n광견병 1회 \n의 기초 예방접종을 하게 되고\n접종을 한번 진행할 때, 2~3 종류의 접종이 들어가게 되어요. \n이렇게 5차 접종까지 끝나면, \n아이가 접종 맞은 바이러스에 대한 항체가 잘 생겼는지 확인하기 위해 \n""항체가 검사""를 받게 되는데요,\n아이의 건강을 위해서 항체가 검사를 마친 후 산책하는 것을 추천드려요.\n또한 예방접종은 아이가 해당 바이러스에 대한 면역력을 키울 수 있도록\n바이러스를 접종하는 것으로, \n아이마다 차이가 있을 수 있지만,\n접종하는 것만으로도 아이에게 스트레스를 주며, \n무리를 하는 것일 수 있으니 \n가급적이면 5차 접종을 하고 며칠 뒤 산책해주시는 것을 추천드려요.\n따라서 항체가 검사를 완료한 후,\n접종을 끝마치고 며칠 뒤 산책해주시는 것을 권해드려요.\n추가로 궁금하신 사항이 있으시면 바로 답변 가능한\n어바웃 펫케어24상담 이용도 권해드리고 싶어요.\n저희는 보호자분들에 걱정을 덜어드리기 위하여,\n24시간 채팅 상담을 진행하고 있어, 빠른 상담을 도와드릴 수 있어요.\n보호자님과 아이의 건강한 반려 생활이 되길 바라며,\n저희 답변이 조금이나마 도움이 되셨길 바랍니다.\n감사합니다.']",3,https://kin.naver.com/qna/detail.naver?d1id=8&dirId=80511&docId=393214528&qb=67Cx7Iug&enc=utf8&section=kin&rank=263&search_sort=3&spq=0,동물의료상담
27,2021.06.26,[],컴퓨터 바이러스 관련 질문인데 이게 뭐죠??,이게 뭐죠? 허용해도  되나요?,"['해당 증상 발현 원인은 알기 어렵지만 악성코드는 아닌 거로 판단이 됩니다. \n아래 드리는 링크의 제 이전 답변을 참고하세요. \nhttps://kin.naver.com/qna/detail.nhn?d1id=1&dirId=11001&docId=392172848\n컴퓨터 해킹(?)인가요 도와주세요 내공5000\n이런거랑 비슷한게 자주뜨는데 엑세스 허용해도되나요\nkin.naver.com', '윈도우즈에 내장된 방화벽은 눈뜬 장님이나 마찬가지입니다. 쓸데없는 이유로, 알 수 없는 그와 같은 차단을 내보내고 있으니... 사용자에게 불안감만 줄 뿐입니다.\n아래 코모도 방화벽을 이용하세요.  코모도 인터넷 시큐리티에는 백신도 포함되어 있지만, 방화벽만 설치하세요.\n더이상 바이러스백신은 믿을만한 프로그램은 아닙니다. 분명한 한계가 있습니다. 시스템자원을 가장 많이 낭비하는 요소입니다. 그러나 인터넷 환경에서는 제대로 된 방화벽을 이용하셔야 합니다.\n무료 통합보안제품 코모도 인터넷 시큐리티 2020(Comodo Internet Security 2020) 설치와 기본설정 방법\n그리고 리부트 리스토어 알엑스를 설치하세요. 이것을 설치하시면 백신이 필요없습니다. 여러분의 컴퓨터를 불사조로 만들어줄 것입니다.\nhttps://youtu.be/FUo45K2geFQ\nhttps://youtu.be/Z2Fz3ME0jE4']",2,https://kin.naver.com/qna/detail.naver?d1id=1&dirId=11002&docId=393215158&qb=67Cx7Iug&enc=utf8&section=kin&rank=262&search_sort=3&spq=0,바이러스
27,2021.06.26,"['충치', '충치예방법']",충치 예방하는 법 알려주세요ㅠㅠ,"제가 현재 2년 동안 교정을 하고 있는데 어금니 쪽에 충치가 생겼습니다. 하지만 교정 중이라 당장 치료하기가 어렵다고 하셔서 교정기를 때야 충치치료가 가능하다고 하셨어요. 근데 교정기를 때는 날이 정확하게 언제인지는 잘 모르겠지만 곧 뺄것 같거든요. 그래서 그러는데 한달에서 두달 동안은 이 충치를 가지고 살아야 합니다. 근데 충치가 있는 곳이 좀 아프고, 구멍도 생겼다고 하는데 이 정도면 심각한 거 아닌가요? 그리고 충치치료를 바로 할 수가 없어서 여기서 더 충치가 악화 안 되게 예방을 해야 하는데 예방하는 방법 알려주세요ㅠㅠ",['안녕하세요. 대한치과의사협회-네이버 지식인 상담치과의사 허재식 입니다.\n충치를 예방하는 가장 좋은 방법은 좋은 양치질 입니다. 하지만 이미 발생된 충치를 멈추게 하기는 어렵습니다. ㅜㅜ\n다른 치아들이 추가적 충치가 생기지 않도록 예방하는 방법은 양치질 입니다. \n좋은 유투브영상이 있어서 올려드립니다. \nhttps://www.youtube.com/watch?v=QgBZEvRvdKo&t=6s\n답변이 도움이 되었는지 모르겠습니다. \n그래도 도움이 되고 마음을 편하게 해드렸기를 바랍니다. \n이제 곧 백신도 접종이 될테고 우리 삶이 다시금 정상으로 빨리 되돌아가기를 바래봅니다. \n감사와 기쁨이 넘치시는 하루하루 되시기를 바라겠습니다\n에스플란트 치과병원장 허 재식 올림'],1,https://kin.naver.com/qna/detail.naver?d1id=7&dirId=70201&docId=393215532&qb=67Cx7Iug&enc=utf8&section=kin&rank=261&search_sort=3&spq=0,치아교정
26,2021.06.26,"['치아교정', '치과', '발치', '교정', '앞니']",교정 발치 관련 질문,"제가 윗니에 공간이 부족해 발치를 하였는데 앞니를 뽑았거든요. 근데 의사분이 브라켓을 어금니만 붙이고 앞니 쪽은 아예 안붙였는데 다음 예약이 한달 뒤거든요. 그럼 저는 앞니가 빈 상태로 한달을 있어야 되는건지 아니면 한달동안 조금이라도 치아들이 모아지는지 궁금합니다. 참고로 저는 21살이며 앞니 없는데 초등학생도 아니고 스트레스가 너무 많네요. 따라서 지금 윗니 어금니,앞니 없는 상태이고 브라켓은 어금니쪽만 붙여져있는 상태에 철사 끼워져 있는데 한달동안 치아들이 이동하는지 아님 그대로 있는지만 알려주세요ㅠ",['안녕하세요. 대한치과의사협회-네이버 지식인 상담치과의사 허재식 입니다.\n발치를 하게 되면 발치된 공간으로 주변 치아들이 자연스럽게 이동하면서 앞니들의 삐뚤어진 정도가 저절로 펴지는 경우가 많습니다. ^^ 그래서 가끔 이런 치료를 하시는 분들도 계십니다. 전체 교정치료에 문제가 되지 않으니 걱정하지 않으셔도 됩니다. \n답변이 도움이 되었는지 모르겠습니다. \n그래도 도움이 되고 마음을 편하게 해드렸기를 바랍니다. \n이제 곧 백신도 접종이 될테고 우리 삶이 다시금 정상으로 빨리 되돌아가기를 바래봅니다. \n감사와 기쁨이 넘치시는 하루하루 되시기를 바라겠습니다\n에스플란트 치과병원장 허 재식 올림'],1,https://kin.naver.com/qna/detail.naver?d1id=7&dirId=70201&docId=393215820&qb=67Cx7Iug&enc=utf8&section=kin&rank=260&search_sort=3&spq=0,치아교정
