page,date,tags,questions,questions_add,answers,N_answer,url,category
8,2021.02.11,[],아기강아지 파보바이러스 질문,"안녕하세요 이제 곧 3개월되는 토이푸들 키우고있던 사람입니다
한 열흘전 펫샵에서 분양받아온 아이입니다. 4일전에 2차접종 시기가 와서 병원에 가려는데 가기전 집에서 갑자기 애가 구토를 하길래 병원가서 바로 검사를 해보니 파보바이러스 줄이 희미하게 나왔습니다. 열도 40도였고요

저희가 데려온 펫샵에서 데려간지 15일 이내에 병이 생길시 치료를 다 펫샵에서 부담한다고 했어서 다시 펫샵에 애를 데려갔습니다. 저는 솔직히 펫샵은 못믿겠고 거기서 돈 많이든다고 병원도 안데려갈거같고 방치만 할거같아서 저는 바로 그냥 병원에 입원시키고 싶었지만 학생이라 돈도없고 결국 펫샵으로 갔습니다.

펫샵에 보내고 거의 포기한 심정으로 지내고 있는데, 펫샵에선 매일매일 건강하답니다. 변도 잘보고 상태도 좋고 토도 아직까지 한번도 안하고 밥도 잘먹는대요. 영상도 보내주고 오늘은 사진 보내줬어요. 애가 좀 말라보이고 안쓰러워 보여도 살아는 있어서 너무 다행이기도 하고 아직까지 걱정되기도 합니다.

벌써 파보 증상이 시작되고 펫샵에 보낸지 4일째인데 아직까지 살아있는거 보면 우리 아이가 파보바이러스를 잘 이겨낸건걸까요? 참고로 펫샵에선 병원도 안데려간거같고 약도 안먹이는거 같던데 이렇게 알아서 이겨내는 경우도 있나요..? 하루하루 보고싶어서 너무 힘듭니다..","[""일단 강아지에게 치명적인 전염병중 하나인건 알고 계실 겁니다.\n일반적으로 위험하다 알려져있는 질병이 파보와 홍역이죠.\n파보의 경우 전염율이 높고, 치사율 또한 상당히 높은 위험한 질병입니다.\n게다가 병원 치료를 진행할 경우 격리된 곳에서 입원치료를 진행해야만 하며(다른 강아지의 전염을 막기위해)\n수액과 기타 파보관련 치료를 병행하게 되면 입원치료비용은 100만원을 훨씬 넘는 것으로 알고 있습니다.\n위에 적어주신 것처럼 파보 키트로 양성이 확인된 경우에 의양성이라고 해서 약하게 줄이 뜨는 경우가 있는데,\n이는 애초에 면역력이  약한 강아지들의 경우 백신 접종시(백신은 항체를 만들기 위한 약한 생 독 입니다) \n백신으로 인해 키트에 약한 두줄이 뜨는 경우가 있습니다. 의양성이라면 그래도 경과가 좋은 편에 속하므로\n일단은 기다려보시는게 좋을 듯 합니다. 파보의 특징상 밥과 물만 잘 먹어도 이겨내는 경우가 많기 때문에\n잘 먹고 있는지만 확인해 보시면 될 듯 하네요.\n결국 반려동물의 건강은 면역력의 높고 낮음으로 나뉘어질 수 있습니다.\n면역력이 높으면 균의 침투에 잘 대처하고 이겨낼 수 있지만, 면역력이 약한 아이들, 나이가 들어가면서 면역력이\n떨어지는 노견,노묘는 쉽게 질병에 걸릴 수 있듯이 말입니다.\n저희 나마네펫에서 출시한 '펫필굿' 유산균은 자체 연구결과 면역력 증가에 탁월한 효과를 보이는게 확인된 \n반려동물 전용 유산균제품입니다. 현재 동물병원에서도 '특별 처방식 유산균제'로 활용중인 믿을 수 있는\n제품이구요.\n아이들 건강이 걱정되신다면 꾸준한 '펫필굿' 급여로 건강관리를 해보시는걸 추천드립니다!\n꼭 완쾌하기를 빌겠습니다.\nhttp://www.namanepet.com""]",1,https://kin.naver.com/qna/detail.naver?d1id=8&dirId=80511&docId=381654781&qb=67Cx7Iug&enc=utf8&section=kin&rank=78&search_sort=3&spq=0,동물의료상담
12,2021.02.11,[],이거 못 없애나요?,항상 컴퓨터 켜면 우측 하단에 뜹니다. 없애는 방법좀 알려주세요.,['v3 lite 설치하시면 뜨는 광고로 보입니다.\n강제적으로 광고를 삭제하는 방법은 있지만  정식으로는 백신을 무료로 사용하시는 방법입니다.'],1,https://kin.naver.com/qna/detail.naver?d1id=1&dirId=102&docId=381617931&qb=67Cx7Iug&enc=utf8&section=kin&rank=116&search_sort=3&spq=0,소프트웨어
