page,date,tags,questions,questions_add,answers,N_answer,url,category
20,2020.05.06,[],코로나 군대,"제가 신입생이데 지금 코로나 때문에 대학도 못가봤거든요. 그래서 이럴때 빨리 군대를 갔다오는 게 나을지 아니면 조금 있다가 가는게 나을지 조언 좀 해주세요
결론은 1학기 마치고 군대 vs 1학년 마치고 군대","['1학년 마치고 군대가시는사 추천드려요', '지금군대가면  코로나 강제로 백신접종할수도있어요 군인이어서\n그리고 외출외박휴가도 못나가요 지금 코로나가 천명이 넘어서 매우 심각 \n그리고 역학조사 해야함', '지금가야 개꿀이져 ; 어차피 언젠간 가야하는데 조금이라도 빨리 가는게 이득이고\n1학년마치고 간다고 코로나가 끝난다는 법도 없고 그때가서도 휴가 외박 통제일지도 모르는데여 \n군대는 최대한 빨리가는게 꿀입니다 갔다와서 친구들 뺑이치는거 놀리는맛인데ㅋㅋ ']",3,https://kin.naver.com/qna/detail.naver?d1id=6&dirId=6030205&docId=355553411&qb=67Cx7Iug&enc=utf8&section=kin&rank=194&search_sort=3&spq=0,대체복무
20,2020.07.28,['인도'],2020년 12월 20일 예언 정말 맞을까요?,"인도에 천재 소년 예언 치면 영상이 뜨잖아여
(제가 본 것 입니다)
https://youtu.be/6JUZNft5OyU
이 내용이 정말 일까요?
진짜 일까봐 무서워요
2020년 12월 20일은 일요일이라고 하던데 일요일에 무슨 일이 일어날까요..?
이 사람이 예언한거도 잘 맞았나요?
예언한거가 잘맞았는지는 추가로 알려주시고 이 예언 맞을지 알려주세요ㅠㅠ
ㅠㅠ 제발 답변 부탁드려요","['음...아무래도 지금까지 한예언이 잘맞아떨어져서 저도 현재불안한데요...아마 멸망급은 아니고 우리가 2차적으로 최근 뉴스에 나온것처럼 몬스터바이러스X(메르스+코로나19,메로나바이러스가 나올수도.)그래도  너무 크게 걱정말아요!우리가 그래도 의학기술이 많이발전해서 버팁니다.몸조심하세용~~^^', '코로나 변종은 이미 나오고 있고 더 심한 변종이 나올 수도 있겠죠. 그 예언한 인도 소년이 12월 20일 어쩌구 저쩌구 했는데 그건 신의 영역이라고 봅니다. 그 소년이 신도 아니고.... 당분간 코로나는 종식이 될 수 없으니 최대한 조심하고 다니는 것이 최선입니다. 너무 걱정하지 마시고 몸 관리 잘하시길...', '저도 그 예언 보았는데요, 지금까지 예언한것들이 다 맞아떨어졌으니  실제가 될 상황이 크고, 그걸 예방하려면 사람들이 조심하는것 말고는 없을것 같네요. 그럼 몸 조심하세요!! 변종 바이러스 예방을 위해서라도....', '오늘이 20일인데 영국 코로나변종 뉴스터졌네요...\n그 차트를달리는남자 - 세계의 예언가들에서\n코로나 백신 나오지만 12월 20일에 코로나 변종 예언\n그거 보고 오늘만 기다렸는데 진짜로 터졌네...', '오늘 영국서 나옴', '신기하게도 12월 20일에 코로나 변종 나옴', '어제 코로나 변종 바이러스가 나왔어요ㅠㅠ\n그 소년의 말이 진짜였네요ㅠㅠ그래도 3월 27일에 코로나가 끝난다고 했으니\n우리 함께 이겨내고 극복합시다!!!^^\n크리스마스 재미있게 보내세요!', '코로나19는 일반적인 바이러스가 아닙니다.\n하늘이 내린 무서운 ""벌""입니다.\n코로나가 전하는 메시지를 알아차려야 합니다.']",8,https://kin.naver.com/qna/detail.naver?d1id=9&dirId=9020105&docId=363722110&qb=67Cx7Iug&enc=utf8&section=kin&rank=193&search_sort=3&spq=0,인도
20,2020.11.07,[],코로나 치료 안받아도 나을 수 있나요,현재 코로나 백신이 없는 상태잖아요 증상 치료하는 약만 먹고. 만약 코로나에 걸리고 증상이 있는데 아무 약도 먹지 않고 가만히 냅두면 시간 지나서 저절로 증상도 없어지고 완치가 될 수도 있는건가요?,"['그런 경우는 극히 드문 경우입니다 아무 치료를 안 하고 방치하면 더 악화 돼서 생명의 지장을 초래하는 경우가 많습니다', '심한 독감에 걸려도 정상적으로 면역이 작동하는 건강한 사람이라면 약을 안 쓰고도 자연적으로 회복이 되지만 다른 심각한 질병을 앓고 있거나 나이가 많은 노인들은 위험할 수 있죠.\nhttps://cafe.naver.com/8sunway/671\n8체질로 본 코로나19 [ 2 ]\n집단면역(Herd Immunity)에 의해 집단구성원 상당수가 전염병에 면역력을 갖게 되면 감염이 확산되지 않는다. 코로나19가 전세계적으로 창궐할 때 다른 모든 나라에서는 ...\ncafe.naver.com', '다나와 뉴스에서 동영상으로 본적이 있어서 아들에게도 알려주었습니다.\n유명 전문박사님이 인터뷰하신 내용인데 방법도 간단했어요~\n36명 임상해서 모두 며칠만에 완치된 내용인데 신뢰가 가는 인터뷰 내용입니다.\n해외친구에게 들었는데 미국에서는 많은 분들이 도움을 받았다고 하네요\n모두 예전처럼 자유롭게 직장도 다니고 가족과 여행도 자유롭게 하는날이 \n빨리 왔으면 좋겠습니다.\n좋은 정보는 빨리 전달해서 우리나라에서 전염병이 퇴출되기를 바랍니다.\n다음,줌 에서 다나와뉴스 검색\nwww.danawanews.com\nhttps://www.youtube.com/watch?v=PAvlozUG1zc&t=36s', '[코로나시대 전염병을 이기는 법 ] \n(2021년1월23일현제 2,114,578명 사망 어제하루동안15,714명 사망)\n이 숫자는https://www.worldometers.info/coronavirus/에 있는 국제 통계자료 입니다.\n미국을 비롯한 선진국에서 대량의 사망자가 나오고 있음은 확실한 치료와 예방법이 없음을 숫자가 증명하고 있습니다.\n현재 나와 있는 백신의 부작용과 계속적인 바이러스의 변이로 인한 대책이 불 투명한 상태에서 서양의 여러 저명한 의학자 들의 치료 임상시험과 완치사례중 일부를 공유해서 소중한 생명을 구할 수 있기를 간절히 바라는 마음으로 아래 글을 올립니다.(번역기를 사용해 좀 어색한부분이 있습니다 양해하시고 읽어 주시기 바랍니다.)\n(바이러스의 구조와 생물 특성)\n바이러스는 세포 형태가 아닌 생물체 혹은 생물 입자로서 핵산과 단백질 두 가지 성분을 포함하며 그 과립의 크기는 세포의 1000분의 1 정도다. 말하자면 바이러스는 세포 내에서 세포를 구성하는 입자 사이를 드나들 수 있다. 또한 대사계통이 없어서 살아 있는 세포 내에 기생해 생명 활동을 한다. 바이러스는 세포보다 더욱더 미시적이므로 세포 구조를 가진 모든 생명체를 감염시킬 수 있다.\n바이러스가 일단 인체에 들어가면 숙주의 세포 물질을 이용해 자신의 모양에 따라 끊임없이 복제하는 한편, 대량의 새 바이러스를 만들어내며, 최종적으로 세포에 손상 주고 분열시켜 사망에 이르게 한다.\n이러한 ‘남에게 손해를 끼쳐 자신의 이익을 챙기는’ 바이러스의 생물학적 특성은 그 에너지가 살상력을 갖추고 있어, 상술한 악념으로 생성된 부정적인 에너지를 지닌 미시적 물질과 동질성이 있다.\n‘중공 바이러스(우한 폐렴)’는 전파경로, 전파속도, 잠복기, 감염성, 치사율과 감염자 임상 증상 등 면에서 인류를 해치는 기타 전염병의 모든 특징을 갖추고 있다. 또 이 바이러스 출처에 대한 정보가 부족해 유효한 치료 약물이나 백신을 제조하기도 어렵다.\n바이러스는 세포보다 미시적이므로 인류가 세포층에서 제조한 어떠한 약물로도 미시적인 데로 들어가 이 바이러스를 소멸할 방법이 없다. 더욱더 미시적이고 바른 에너지를 지닌 입자 혹은 생명 입자만이 바이러스를 소멸할 수 있다.\n다시 말해 인류에게 현재 중공 바이러스에 감염된 환자를 치료할 수 있는 약물이 없다. 그러므로 중공 바이러스는 인류 생존과 안전에 유례없는 위협을 조성하고 있다.\n세포학 전문가, ‘아홉 글자 진언’에서 나오는 에너지 믿어\n선념(善念)에서는 긍정적 에너지, 악념(惡念)에서는 부정적 에너지가 발생\n(‘아홉 글자 진언’을 외워 우주 중의 바른 에너지를 받아들이다)\n[밍후이왕] [밍후이기자 줘줘(卓擢) 보도] ‘아홉 글자 진언[九字真言]’은 이번 ‘중공 바이러스(우한폐렴, 코로나19)’에 감염된 일부 환자들의 생명을 구했다. 환자가 위독한 증상이 나타난 후 진심으로 ‘아홉 글자 진언’인 ‘파룬따파 하오(法輪大法好-파룬따파는 좋습니다), 쩐싼런 하오(真善忍好-진선인은 좋습니다)’를 외우면 신기하게 건강을 회복했지만 많은 사람이 그 이유에 대해 이해하지 못했다.\n이에 대해 다년간 세포 연구를 해온 덴마크 오르후스대학 생화학 병리 연구실의 올레센 연구원은 물질과 정신은 일성(一性)이라며, 과학기술의 발전에 따라 더욱더 많은 사람이 이를 받아들이고 있으며, 정신은 물질이고 물질은 정신이 물화된 일종 체현이라고 설명했다.\n(선념(善念)에서는 긍정적 에너지, 악념(惡念)에서는 부정적 에너지가 발생)\n올레센 연구원은 사람 정신 활동에 관한 신경 과학자들의 연구를 통해, 사람의 대뇌에서 발생한 사유 활동은 전기화학 과정이며 또 물질의 운동 과정으로 밝혀졌다고 말했다. 이는 사람의 육안으로 보이지 않지만 실제로 존재하는 물질 활동이다.\n의식이 일종 물질 활동이라면 사람의 의식은 좋고 나쁨, 선과 악의 구분이 있다. 그렇다면 선념(善念)과 악념(惡念)으로 생성된 의식 활동이 전기화학 반응으로 미시적인 물질을 형성하는데, 바로 우리가 말하는 긍정적 에너지, 혹은 부정적 에너지다. 선념으로 생성된 미시적 물질이 방사하는 것은 긍정적인 에너지로서 밝고 따뜻하며 사심이 없는 특성이 있다. 하지만 악념으로 생성된 미시적인 물질은 부정적인 에너지로서 어둡고 음침하며 이기적인 특성이 있다.\n(‘아홉 글자 진언’을 외워 우주 중의 바른 에너지를 받아들이다)\n그렇다면 어째서 중공 바이러스에 감염된 환자가 진심으로 ‘파룬따파 하오(法輪大法好), 쩐싼런 하오(真善忍好)’라는 아홉 글자 진언을 외우면 병이 나을까?\n‘진선인(真·善·忍)’은 우주의 특성이며 비할 바 없이 강대한 바른 에너지를 지녔다. ‘파룬따파 하오, 쩐싼런 하오’를 외울 때 사실은 우주의 특성과 연결된 것으로, 전반 우주의 바른 에너지와 통한다. 진심으로 외워 머릿속에 파룬따파와 진선인을 생각하여 모두 정념(正念)으로 대체되면서 우주로부터 자신에게 극히 미시적인 바른 에너지가 흘러들어온다. 진선인(真·善·忍), 이 강대하고 극히 미시적인 에너지는 외우는 사람의 세포 속을 관통할 수 있기에 중공 바이러스를 물리칠 수 있다.\n또 어째서 모든 마음을 기울여 외워야 한다고 하는가? 왜냐하면 환자가 지닌 많은 음성(陰性)적인 물질은 ‘중공 바이러스’가 기생하기 좋은 숙주 객체이므로 체질을 바꾸려면 반드시 모든 마음을 기울여 외워야만 효과가 있다.\n올레센 연구원은 또 매체에서 보도한 적지 않은 사례를 살펴보면 ‘아홉 글자 진언’을 외워 건강을 회복한 대부분 사람은 파룬따파 수련자의 친척이나 친구라고 언급했다. 그들은 평소에 파룬따파를 늘 보고 듣고 익숙해서 일정한 기초가 있으므로, 위험과 재난 중에서 선입견을 내려놓고 마음의 문을 열었으며 죽음의 궤도에서 아주 빨리 벗어날 수 있었다.\n올레센 연구원은 자신도 구하고 타인에게도 도움을 줄 수 있는 ‘아홉 글자 진언’을 많은 사람이 배우기를 바랐다.\n자세한 내용은 아래 사이트에서 보실수 있습니다.\nhttp://www.danawatv.kr/']",4,https://kin.naver.com/qna/detail.naver?d1id=7&dirId=70122&docId=372653124&qb=67Cx7Iug&enc=utf8&section=kin&rank=192&search_sort=3&spq=0,응급의학과
20,2020.11.11,[],녹십자랩셀 이슈 있나요,"녹십자랩셀 실검에 떳는데
투자해볼만한 포인트가 있는지
녹십자랩셀 주가전망좀 알려주세요.","['녹십자랩셀 면역항암제 개발 이슈도 있고\n크게는 화이자 관련주로도 분류됩니다.', '네, 아직 상승세는 유지 하고 있습니다.\n추가적인 상승은 찾아 올 것 같습니다.\n하지만 문제는 그 상승이 지속 되기보다는 \n상승 후 갑자기 쭈욱 빠질 수 있으니, \n목표가를 잘 설정해서 바로 수익 실현하는 것이 무엇보다 중요합니다.\n그 만큼 매도 타이밍이 중요하다 할 수 있는데요.\n주식은 정말 다양한 종목이 있습니다.\n아무리 좋은 종목이라도 고점에 물리게 되면 큰 손해를 볼 수 있으니,\n아직 저평가된 숨은 가치주를 찾아 투자하는 것이 무엇보다 중요합니다.\n특히, 주식은 실전이 중요하고\n전문가가 어떤 식으로 어떤 종목을 투자하는 지\n잘 분석하고 배우는 것이 중요합니다.\n무료리딩 3일간 받아 보세요.\n주식에 대한 생각이 많이 달라지실 겁니다.\n주식관련 사이트추천 네임카드 링크드립니다.\n도움받아보세요.\n주식투자 무료체험 \nhttps://bit.ly/2WNoaB4\nMAKE FLY\nbit.ly\n해당 포스팅은 업체로 부터 일정 수수료를 받고 작성된 글입니다.', '면역항암제 개발로 중장기로 보시면 될거같습니다.\n빠르고 정확한 정보만 제공하는 핵심 포트폴리오 + 최고 주식 전문가들의 매매전략 + 개인투자자들을 위한 맞춤 종목 서비스 3일무료로 받아보세요\n::: 청개구리투자클럽 :::\n실제 달성자 후기 누적수익률 니스 구조\nbit.ly', ""실화입니다.\n10여년 전에 한 고등학생이 가상화폐라는 것을 알았고, 비트코인을 채굴하기 시작했습니다.\n그당시 일반 컴퓨터로도 얼마든지 채굴이 가능했죠.\n한참 채굴하다 그냥 내버려 두었었는데 10여년이 흐른 뒤 비트코인이 1코인에 몇년 만원이 되고\n본인이 오래전 채굴했던 가상화폐가 있다는 것이 생각나 그것을 팔아서 아파트를 사고, 차를 사고 했던 뉴스가 있습니다.\n제 지인은 같은 시기 비트코인을 1500개 이상 채굴 했었는데 돈도 안되고 쓸모도 없다고 해서 그냥 버렸습니다.\n그 지인분께서는 지금 비트코인만 생각하면 땅을 치고 후회 하십니다.\n현재 가격으로만 환산을 해도 255억을 버린것과 같기 때문입니다.\n모두 무료채굴이었습니다.\n한때 하루에 수십개씩 무료 채굴하던 그 비트코인 지금은 누구도 무시할 수 없는 존재가 되어버렸습니다.\n이제 앞으로는 디지털화폐시대가 올 것입니다.\n중국, 일본, 유럽 정부에서 디지털화폐 발행을 하겠다고 발표를 하였고, 얼마전에 우리나라 한국은행에서도 내년에 디지털화폐를 발행하겠다는 \n뉴스를 내보내기도 하였습니다.\n여기 제2비트코인이라 불리고 이미 전세계에서 부동산, 자동차, 모든 생필품을 거래 화폐로 이용하는 디지털화폐가 나왔습니다.\n전세계인들이 무료 채굴중이고 실제 물건을 사고 팔고 디지털화폐로 거래를 합니다.\n우리나라에서도 국제거래가 성사되었죠.\n시간이 지나고 왜 그때 하지 않았을까 후회하지 마시고 지금 무료 채굴 가능할 때 하십시요.\n절대 후회하지 않을 거라 확신합니다.^^\n누군가는 이제 가상화폐에 투자할 때가 아니라고 말합니다.\n그러나 그건 현재 거래가 되고 있는 가상회폐를 의미하고 현존하는 가상화폐는 모두 시장이 없습니다.\n다만, 전세계적으로 이목이 집중되고 있는 가상화폐라고 하면 상황은 다릅니다.\n스탠포드 대학 박사 출신들이 개발한 코인으로 pi(파이코인)이며, 현재 100% 무료, 최초로 스마트폰으로 채굴하는 코인입니다.\n현재 전세계 800만명 이상이 채굴 중에 있고, 모든 흐름이 과거 비트코인과 유사하기에 제2의 비트코인이란 칭호가 붙습니다.\n- 전세계인이 채굴 중인 디지털화폐.\n- 중국: 상점(옷, 음식, 악세서리, 귀금속, 생필품 등) 본 디지털화폐로 결제 가능.\n- 미국, 유럽 : 1코인에 100불 가치로 거래 중.\n- 필리핀 : 물세, 전기세 및 식사권을 이 화폐로 결제\n- 오스트리아 : 통신료를 이 화폐로 결제\n- 아랍, 베트남, 인도 등 또한 각종 식료품 및 자동차까지 거래 함.\n- 2000만명 이상을 거느린 중국의 개인방송인이 1800만명이 보는 앞에서 이 화폐를 홍보.\n- 미국의 스텐포드 대학의 박사 학위 3명이 개발.\n- 전세계 800만명이 화폐 모집 중.\n- KYC 인증 절차 진행 중.\n- 제 2 비트코인 이라고 불릴 정도!\n- 현재 1비트코인은 1300만원 상회 중.(2020.08.29)\n- 화폐 전송속도 전세계 디지털화폐 중 1위.\n- 한국은행에서도 내년에 디지털화폐를 발행한다고 합니다.\n- 중국의 한 성에서는 내년에 정식 디지털화폐를 출시한다고 하네요.\n스마트폰만 있으면 됩니다.\n그 어떤 돈벌이를 하든 하루 5초만 투자하면 됩니다.\n시간은 돈 입니다.\n디지털화폐는 시간과의 싸움입니다.\n우리나라 정부에서 디지털화폐에도 내년부터 거래세를 20% 부여한다 발표 했습니다.\n자산으로 인정하겠다는 뜻입니다.\n지금 무료채굴인 시점에 하루라도 빨리 하시는 것이 이득 입니다.\n채굴방법\n1. 플레이스토어나 Apple 스토어에서 Pi Network앱을 다운받아 가입하시거나 또는 http://minepi.com/sibbillion 로 바로 다운 가능합니다.\n2. 핸드폰 번호 또는 페이스북으로 가입하기 둘중 하나로 가입이 가능합니다.\n3. 핸드폰 가입시 나라는 South korea(+82) 체크하고 핸드폰번호 입력.\n4. 비밀번호 8자리 이상 입력.문 대소문자, 숫자하나는 있어야 합니다)\n5. 이름 (first name) 성(last name)입력\n6. usename에 원하는 아이디 입력(향후 추천 받으실 때 사용됩니다.)\n7. invitation code 추천인 아이디(sibbillion) 입력 (입력해야 체굴 속도가 더 빨라집니다.^^)\n8. Get started 클릭해주고, Tap to earn 눌러주고 계속 start 엔터만 클릭해주면 채굴되기 시작하며, 채굴 된 수량은 가장 상단에 나타납니다.\n◆ 채굴은 앱 상단에 표시되며 24시간 단위로 되며 번개표시 눌러야 지속적으로 채굴이 진행됩니다.(누르지 않을시 채굴 중단 됩니다.)\n추천인 'sibbillion' 입력해서 속도 업 받으세요.\n하시고 안하시고는 님께 달렸습니다.\n가까운 미래에 큰 부를 얻으실 수 있는 절호찬스입니다.\n잃을 것 없는 기회이니 잘 판단 하십시요.^^\n만약 하시기로 결정 하셨다면 꼭 현금화 하실 때까지 하루도 빠지지 않고 하십시요.\n중도 포기 하시면 함께 하는 것 자체가 아무 의미 없습니다.\n절대 후회하지 않을거라 확신 합니다.\n파이정보제공 페이스북: https://www.facebook.com/digitalpicoin/\n파이정보제공 네이버밴드 : https://band.us/n/a4aa43I1l8A18\n파이정버제공 네이버블로그 : https://m.blog.naver.com/mastmind"", '녹십자랩셀의 투자포인트는 차세대 항암제으로 주목받고있는 nk세포치료제와 코로나 백신 콜드체인 이슈입니다.\n밑에 블로그를 참고하세요~\nhttps://petergoods.tistory.com/57\n녹십자랩셀 (모더나/화이자) 콜드체인 관련주\n지난 12월 12일 녹십자랩셀의 임상정보와 NK세포 치료제에 대해서 포스팅했습니다. NK세포 치료제의 매력과 투자포인트를 알려드렸었죠. 신약개발업체의 성장가능성을 분석하기 위해서 기본으로 임상정보 및 관련..\npetergoods.tistory.com\nhttps://petergoods.tistory.com/53\n녹십자랩셀 주가 전망 feat. NK세포치료제\n최근 녹십자랩셀 주가가 심상치 않습니다. 10월 말 43,000원대에서 한달 보름만에 2배가까운 상승을 보여줬는데요. 앞으로 얼마나 더 갈수 있을지? 투자포인트는 어디에 있는지 알아보겠습니다. 20년대 트랜드! N..\npetergoods.tistory.com']",5,https://kin.naver.com/qna/detail.naver?d1id=4&dirId=40102&docId=372983571&qb=67Cx7Iug&enc=utf8&section=kin&rank=191&search_sort=3&spq=0,"주식, 증권"
