page,date,tags,questions,questions_add,answers,N_answer,url,category
55,2019.01.16,[],마곡에 생리불순 치료 잘하는 여의사분 계신 산부인과 추천해주세요!,"생리불순이 너무 심해서요ㅠㅠ
어릴땐 그냥 대수롭지 않았는데 이제 결혼도 하고 출산도 생각하다보니 걱정되네요..
다낭성? 증후군? 뭐 그런거라고 했는데 이거 치료 가능한가요??

마곡에 여의사분 계신 산부인과 아는 곳 있으세요??","['마곡 근처 가양역 1번출구 쪽으로 예나산부인과라고 있어요~\n다낭성 심하지 않으면 따로 치료는 안하는 것 같던데..\n임신 준비중이시면 의사쌤 상담 함 해보세요~\n약으로 생리불순 치료할 수 있을거에요^^\n\n건강관리 잘 하시고 이쁜아기 갖으시길 바래용~', '생리통, 생리불순, 자궁근종, 다낭성난소증후군 등..\n생활 중 고통과, 소중한 생명의 임신을 어렵게 만드는 ‘여성질환’\n\n여성질환의 원인을 찾아 없애주는 것이 중요합니다.\n여성질환의 대부분의 원인은 순환대사의 문제입니다.\n혈액과 호르몬 등의 비정상적인 대사의 문제로 인해\n불임, 생리통, 생리불순, 냉증, 자궁질환, 다낭성난소증후군 등의\n복잡한 문제들이 발생합니다.\n\n몸속의 순환을 방해하는 독소, 노폐물, 지방 등..\n혈액, 호르몬 등의 신체의 중요한 대사물질의 흐름을 방해하는 물질들을 없애주어\n순환대사를 원활하게 해주어 몸이 따뜻하게 만들어 준다면\n문제들이 개선되는 것을 경험할 수 있을 것입니다.\n\n평소 몸을 따뜻하게 유지해주시고\n따뜻한 물을 조금씩 자주 마셔주는 것도 도움이 됩니다.\n혈액을 맑게 하여 자율신경이 정상화되도록 해주는 것과,\n근력을 높여주어 체온을 높여주는 것,\n건강한 식생활 습관으로 몸을 바꾸어 주는 것도 개선방법입니다.\n\n인체정화요법을 진행해 보시길 권합니다.\n김세현 저 ""5%는 의사가 고치고 95%는 내 몸이고친다"" 책과\n권란 저 ""기적의 솔잎기름"" 이 도움이 될 거 같습니다.\n\n네임카드를 클릭하여 ""생리불순"" 또는 ""다낭성"" 이라 검색하여 둘러보시면\n도움되는 내용들이 있으니 참조하시길 바랍니다.', '안녕하세요 \n서울 강서구 마곡, 발산역 인근에 개원하여 미혼여성 진료를 하고 있는 산부인과 여의사입니다. \n심한 생리통이나 생리불순, 복통, 냉대하 등의 증상이 있으시다면 산부인과 검진을 통해 원인을 확인해보시기 바랍니다. 오랜 시간 방치하면 다양한 합병증이 발병할 수 있습니다. \n아직까지도 산부인과 방문을 꺼려하시는 분들이 많습니다.\n하지만 여성으로서 마땅히 진료를 받아보고 본인의 상태를 체크하여 혹시 모를 건강상의 문제를 적극적이고 신속하게 치료할 수 있어야 합니다. \n산부인과는 임신 및 출산만을 위한 곳이 아니며, 산부인과 전문의가 여성의 건강 관리를 돕는 여성건강 주치의라고 할 수 있습니다. \n예를 들면 초경부터는 자궁경부암 백신 접종과 생리 관련 상담, 성인기에 성인 백신 접종과 자궁경부암 정기검진, 피임 및 계획임신, 출산과 산후 관리의 도움을 받고, 폐경기 이후에는 폐경 이후의 건강관리 등 나만을 위한 여성건강 주치의로부터 도움을 받을 수 있습니다. \n평소 한번도 검진을 받아본적이 없으시다면 일단 기본적으로 자궁경부암 검사, 자궁 및 난소 초음파 검사를 추천드립니다.\n만약 성관계를 하는 상태라면, 필요에 따라 성병검사도 체크해볼 필요가 있습니다.\n성병은 여러종류가 있는데요. 검사방법은 혈액검사와 질분비물 채취 검사가 있습니다.\n필요한 검사로만 구성된 다양한 패키지 프로그램도 마련되어 있지만, 모든 검사를 다 받으실 필요는 없으며, 산부인과 전문의와 상담 후에 필요한 검사만 골라서 따로 받으실 수도 있습니다.\n저희 산부인과에서는 특히 부적절한 검사는 제외하고 꼭 필요한 검사만 받으시도록 미국 CDC(질병관리본부)에서 마련한 가이드라인에 따라 상담 후에 검진을 시행하고 있습니다.  \n병의원마다 차이가 있지만, 많이 비싼 경우는 꼭 나에게 필요한 검사인지 상담 후에 항목별로 따져보고 받으시는 것이 좋습니다.\n검진을 받고 특별한 이상이 없으시다면 1년에 한번씩만 받으셔도 충분합니다.\n감사합니다.']",3,https://kin.naver.com/qna/detail.naver?d1id=7&dirId=701&docId=318962708&qb=67Cx7Iug&enc=utf8&section=kin&rank=544&search_sort=3&spq=0,건강상담
55,2019.01.22,[],산전검사 하려는데 마곡에 여의사 산부인과,"올해 말 정도부터 임신 준비하려고요~
엽산도 챙겨먹고 있긴한데, 임신 전에 산전검사 어디서 하면 좋을까요?
항목은 뭐뭐 있나요? 아무산부인과나 가면 되는건지, 아시는 분들 정보 좀 부탁드려요!!

마곡에 여의사 계신 곳으로 산전검사 할만한 곳 추천해 주세요~~ ","['안녕하세요 ㅎㅎ\n가양역에 예나라고 원장님 경력도 오래되셨고 진료도 잘보셔용~\n산전검사라고 특별한건 없고 그냥 자궁에 문제 있는지 없는지\n일반적인 검사들 해주실 거에요~~ 10만원 내외였던걸로 기억하네용 ^^\n\n풍진이나 매독같은것도 항체 없으시믄 주사 맞으시는게 좋다네용~', '안녕하세요 \n서울 강서구 마곡, 발산역 인근에 개원하여 미혼여성 진료를 하고 있는 산부인과 여의사입니다. \n임신 전 검사에 대해 궁금하셔서 질문주셨네요\n임신 계획 중이라면 더욱 산부인과 전문의와 상의하는 것이 좋습니다. 태아에 악영향을 주는 약물을 모르고 복용하거나 바르는 일이 없도록 임신 전에 미리 체크하고, 태아의 신경관 결손을 예방해 주는 엽산제 복용을 미리 시작하는 등 건강한 아기의 임신과 출산에 여러모로 도움을 받을 수 있습니다. \n웨딩검진은 산부인과 전문의의 문진으로 과거 병력, 생리 양상, 가족력 등을 체크하고, 필요에 따라 성인백신 접종, 여성암 검진, 질염 및 원인균 검사, 자궁·난소 초음파 검사 등을 선택해 받는 식으로 진행됩니다. 필요한 백신에는 풍진, 자궁경부암 백신 외에도 A·B형 간염 항체 여부 확인 및 백신 접종이 포함됩니다. 평소 질염이 자주 재발한다면 균 검사를 통해 원인균에 대한 치료를 받을 수도 있습니다. \n자궁 및 난소 검사를 받아본 경험이 없다면, 임신과 출산에 지장이 주는 요소가 없는지 골반 초음파 검사로 자궁과 난소를 확인해 보는 것도 좋습니다. 성 경험 또는 부인과 진료 경험이 없다면, 복부 초음파로도 검사를 할 수 있습니다. \n생리 예정일보다 생리가 10일 이상 늦어진다면 3~15분 사이에 정확한 임신 결과를 알 수 있는 임신테스트도 산부인과에 따라 가능합니다. \n자녀를 당장 가질 계획이 없더라도 웨딩검진은 반드시 필요합니다. 원하는 시기에 원하는 수만큼의 자녀를 가지려면, 부부의 라이프스타일에 맞는 피임상담은 물론 임신에 지장을 줄 질환은 없는지 미리 확인해 두는 것이 좋기 때문입니다. \n평소 한번도 검진을 받아본적이 없으시다면 일단 기본적으로 자궁경부암 검사, 자궁 및 난소 초음파 검사를 추천드립니다. 만약 성관계를 하는 상태라면, 필요에 따라 성병검사도 체크해볼 필요가 있습니다.\n성병은 여러종류가 있는데요. 검사방법은 혈액검사와 질분비물 채취 검사가 있습니다.\n필요한 검사로만 구성된 다양한 패키지 프로그램도 마련되어 있지만, 모든 검사를 다 받으실 필요는 없으며, 산부인과 전문의와 상담 후에 필요한 검사만 골라서 따로 받으실 수도 있습니다.\n저희 산부인과에서는 특히 부적절한 검사는 제외하고 꼭 필요한 검사만 받으시도록 미국 CDC(질병관리본부)에서 마련한 가이드라인에 따라 상담 후에 검진을 시행하고 있습니다. \n병의원마다 차이가 있지만, 많이 비싼 경우는 꼭 나에게 필요한 검사인지 상담 후에 항목별로 따져보고 받으시는 것이 좋습니다.\n답변이 도움이 되었으면 합니다. \n감사합니다. ', '마곡에 산전검사, 신경 잘 써주고 괜찮은 산부인과 많이 있어요\n알아보시는 데에 도움 되시라고 마곡 산부인과 잘하는곳 모아놓은 사이트가 있어 소개해드릴게요\n여러 병원 보기 편하게 나와있어서 참고해보시면 도움 되실 것 같아요\n여러 곳에서 상담받아보시고 비교해보신 후 결정하시길 바랄게요!\n*\nhttp://soonwidot.co.kr/rank/search.php?stx=%EB%A7%88%EA%B3%A1+%EC%82%B0%EB%B6%80%EC%9D%B8%EA%B3%BC\n마곡 산부인과 - 인기순위 순위닷\n맛집순위, 여행순위, 교육순위, 보험순위, 신용카드순위, 자동차순위, 대출 순위 등 다양한 순위 정보 제공 사이트\nsoonwidot.co.kr']",3,https://kin.naver.com/qna/detail.naver?d1id=7&dirId=701&docId=319442122&qb=67Cx7Iug&enc=utf8&section=kin&rank=543&search_sort=3&spq=0,건강상담
55,2020.04.01,[],서울 강서구 산부인과 추천,"자궁경부암 주사를 맞으려고하는데,
강서구에 괜찮은 산부인과가 어디있을까요","['강서구에  있는  유광사   여성병원  추천 합니다 ', '안녕하세요.\n서울 강서구 마곡 발산역 인근에 개원하여 미혼여성검진 및 자궁경부암 백신접종 검진, 치료를 하고 있는 여의사 김화정입니다.\n저희 산부인과에서는 편안하게 진료받으실 수 있도록 여의사가 진료하고 있으니 \n부담갖지 마시고 방문하여서 필요한 분야에 대해 상담받아보시기 바랍니다. \n여성질환 검진도 다른 진료와 마찬가지로 경험많은 의료진이어야 \n환자의 상태에 대한 정확한 진단을 할 수 있습니다.\n자궁경부암은 성감염성 질환입니다. \n자궁경부암은 고위험군 인유두종 바이러스(HPV)의 감염으로부터 시작되는 질병으로, \n발병 원리가 밝혀진 만큼 정기검진과 백신 접종 등을 통해 예방이 가능한 유일한 암입니다. \n자궁경부암/곤지름 예방백신에 관해서 안내를 드리겠습니다.\n백신은 현재 2가지가 나와 있는데요.\n각각 가다실과 가다실 9(nine)이라고 불립니다.\n가다실은 4가 백신으로 자궁경부암과 곤지름 예방을 목적으로 하고,\n가다실 9(nine)는 9가 백신으로 9가지 바이러스 타입에 예방효과가 있어\n가다실 (4가)보다 효과가 좋습니다.\n저희 병의원(서울 양천지역)에서는 보통 20~30대 여성에게는 가다실 9(nine)을 40대 이후에는\n가다실을 주로 추천하고 있습니다.\n가다실이 치료백신은 아니라서 지금 있는 곤지름은 없애주지는 못하지만,\nHPV에 의해 생길 수 있는 더 심각한 질환인 자궁경부암을 비롯한 여성암을 예방해주기 때문에 반드시 필요합니다.\n산부인과는 임신 및 출산만을 위한 곳이 아니며, 산부인과 전문의가 여성의 건강 관리를 돕는 여성건강 주치의라고 할 수 있습니다. \n예를 들면 초경부터는 자궁경부암 백신 접종과 생리 관련 상담, 성인기에 성인 백신 접종과 자궁경부암 정기검진, 피임 및 계획임신, 출산과 산후 관리의 도움을 받고, 폐경기 이후에는 폐경 이후의 건강관리 등 나만을 위한 여성건강 주치의로부터 도움을 받을 수 있습니다. \n혹시 수도권에 사시거나 지방에서 사셔서 좀 멀더라도 체계적인 치료를 원하시는 경우\n예약 후 방문주시면 정확한 진찰 후에 속 시원한 상담과 치료를 해드리도록 하겠습니다.\n감사합니다. ', '서울 강서구에 괜찮은 병원 많이 있어요\n알아보시는 데에 도움 되시라구 강서구 산부인과 모아놓은 사이트가 있어 소개해드릴게요\n여러 병원 보기 편하게 나와있어서 참고해보시면 도움 되실 것 같아요\n여러 곳 비교해보신 후 도움되셨길 바랄게요!\n*\nhttp://soonwidot.co.kr/rank/search.php?stx=%EA%B0%95%EC%84%9C%EA%B5%AC+%EC%82%B0%EB%B6%80%EC%9D%B8%EA%B3%BC\n강서구 산부인과 - 인기순위 순위닷\n맛집순위, 여행순위, 교육순위, 보험순위, 신용카드순위, 자동차순위, 대출 순위 등 다양한 순위 정보 제공 사이트\nsoonwidot.co.kr']",3,https://kin.naver.com/qna/detail.naver?d1id=7&dirId=70114&docId=351825186&qb=67Cx7Iug&enc=utf8&section=kin&rank=542&search_sort=3&spq=0,산부인과
55,2020.08.17,"['컴퓨터', '컴퓨터버벅임', '컴퓨터버벅거림', '디스크100', '윈도우10', '윈도우10오류']","윈도우 10 디스크 100%, CPU 100%, 메모리 100% 로 인한 버벅임 현상","컴퓨터를 새로 샀는데요 (쿠팡에서 조립컴 70정도 주고 샀어요.) 
처음에는 괜찮다가 정말 너무 심각하게 렉걸리고 
버벅거리는 현상이 자꾸 나타납니다.

특히 카톡만 켰는데도 렉이 걸린다거나, 
워드 문서 작업 몇 자 치고 있는데도 렉이 걸린다거나 해서
컴퓨터를 박살내고 싶은 충동이 하루이틀이 아닙니다.....

심지어 지금 네이버 웨일 하나만 열고 
이 질문 쓰는데도 버벅거려서 진짜 힘드네요....

컴퓨터에 어도비가 깔려있긴 한데요, 그런 프로그램을 돌릴 때가 아닌! 
정말 아무것도 사용하지 않을 때도 자꾸 이렇게 메모리 점유율이 널뛰기를 하면서
화면이나, 마우스 커서가 멈추고, 응답없음이 뜨고 풀리고를 반복하니까 
진짜 스트레스 받아요.

온라인에 나온 윈도우 어쩌고 사용안함으로 설정하거나 그런 걸 다 해도 
이 문제가 해결되지를 않네요. 중고부품을 써서 채굴이라도 하고 있는 걸까요? 
아니면 윈도우 10의 고질적인 문제일까요? 

바이러스 검사도 프로그램 다 깔아서 돌리고 지우고, 
윈도우 세이프티 어쩌고도 돌려서 치료했는데 도저히 나아질 기미가 보이지 않습니다. 
이러다가 10년 전 모니터 부수기 게임을 현실에서 실행하게 될 것 같아요. 
이거 고칠 방법 없을까요? 

심지어 대체 뭐가 이렇게 점유하고 있는지 봤는데
숫자를 봐도 알 수 없어서 더 답답해요.

나름 큰 돈 주고 산 컴퓨터인데 진짜 열받네요. 
새로 살 돈도 없는데 진짜....열받네요. 이거.","['간단합니다. 산지 얼마 안됐는데 그렇다면\n컴퓨터를 판매한 곳에서 AS 부르세요.\n1년도 안됐으면 100% 무상 AS가 가능합니다.\n사용자 실수로 고장낸게 아니라면요.', '비슷한경험이있는데\n윈도우10  기준으로 백신은 알약대신 다른거 차라리 v3라이트 (전 이셋이라는 백신 유료로 씁니다)\n알약 관련되서 알집 알씨 이스트 소프트 개쓰레기구요\n알집대신 반디집  알씨 대신 꿀뷰 추천드립니다\n은행 사이트 들어갔다오면 깔려있는 보안프로그램있는데 그거 구라제거기라는 프로그램 거진 5년째 쓰는데 그걸로 싹지우시구요\n휴지통모양의 임시폴더 청소기라고있는데 이것도 사용하시면좋구요 (클릭하면 숫자올라가면서 파일들제거)\n되고\nMZK라고 네이버에서 검색하시면  무료 악성코드 제거 있어서 실행하시고 (실행하시면 아무것도 못함, 설명서 잘봐서 하시구요 )\n그러면 왠만해선  최소 50% 빨라지심 그러고 인터넷은 당연히  SKT 이런 쓰렉이 보다 KT  쓰세요 ']",2,https://kin.naver.com/qna/detail.naver?d1id=1&dirId=10301&docId=365413177&qb=67Cx7Iug&enc=utf8&section=kin&rank=541&search_sort=3&spq=0,윈도우
54,2020.12.01,"['#주식', '#모더나관련주']",모더나 관련주 지금 매수하는 건 어떤가요?,이번에 코로나 백신 사용신청 했다고 해서 들어가 볼 생각인데 모더나 관련주 늦은 건 아닌가 걱정돼서요.,"['예 , 괜찮음.', 'http://m.blog.naver.com/okiii1205/222151828989\n국내외 코로나백신 및 치료제 현황[화이자관련주, 모더나관련주, 셀트리온, SK케미칼(SK바이오사이언스),삼성바이오로직스]\n전세계 코로나19 확진자 수가 가파르게 늘어나고 있는 상황에서 코로나19 백신 소식이 나와서 얼...\nm.blog.naver.com\n관련주는 단타용일지도요.^^', '모더나 관련주 참고하시면 도움이될 듯 합니다.\nhttps://dailylifeoft.tistory.com/73\n<코로나 백신 관련주> 화이자 모더나 수혜 주식 정리!\n<코로나 백신 관련주> 화이자 모더나 수혜 주식 정리! 코로나로 떠들썩한 요즘입니다. 어제는 우리나라에서 무려 191명의 확진자가 나왔습니다. 한 동안 두자리수로 안정감을 찾던 코로나가 다시금 위험상..\ndailylifeoft.tistory.com', '재료노출 재료소멸 하락예정\n내가 수익이 나지 않고 손실만 난다면?!\n그 투자의 반대로 하셔야죠^^ 바로 청개구리투자클럽!\n12년 전통 소비자만족 1위 ! 주식정보회사 !\n주식으로 1억만들기 남일이 아닙니다. 청개구리투자클럽과 함께 억대개미가 되보세요.\n아래링크에서 짧은 영상 15초 시청하시고 무료체험 요청하세요^^\nhttps://jamongpick.com/31/2752\n청개구리투자클럽 - 비디오 서비스 플랫폼 자몽pick\n청개구리투자클럽 주식수익 1억만들기 프로젝트! 청개구리투자클럽! - jamongpick\njamongpick.com', '안녕하세요 질문자님^^\n모더나 관련주 관련하여 질문을 남겨주셨네요.\n현재 모더나는 미국과 미국 외 지역으로 나눠 코로나19 백신을 생산 및 유통하고 있는 중입니다. \n모더나가 한국 자회사를 설립할 가능성이 높은 가운데 국내 기업을 위탁생산(CMO)기관으로 활용할 가능성이 높다는 분석이 나왔습니다. 그래서 투자자들은 모더나 관련주 종목에 대해 많은 관심을 가지게 되었는데요. \n모더나 관련주 종목으로는 파미셀, 에이비프로바이오, 엔투텍, 소마젠 등이 있습니다.\n이 외에도 리딩이 필요하시다면 아래 링크 통해서 전문가 무료상담 받아보시길 추천드릴게요!', '현재 모더나 관련주로 알려진\n에이비프로바이오가 상승세에요 ㅎㅎ\n자세한 내용 참고하세요.\n에이비프로바이오 주가 현재 상황 및 향후 전망 (+모더나 관련주)\n주식의 모든 것. 주피셜입니다. 오늘은 에이비프로바이오에 대해 재조명 해보겠습니다. 오전 10시 기준 에...\nm.search.naver.com', '아무래도 이슈성이 있기 때문에 안정적으로 장투하시는것은 고려해보시는게 좋습니다.\n단기적으로는 괜찮아 보이네요.\n참고하시구요.\n주식 테마주, 실적 호재, 급등주 등 실시간 주식 정보를 알려주는 업체들이 있습니다.\n그래도 공부한 사람들이 추천해주는거라, 잘 모르실땐 이런 업체를 참고하셔도 도움 되실수 있습니다.\n참고하시라고 급등주 추천 업체 순위 정리된 곳 추천드립니다.\nhttp://soonwidot.co.kr/rank/search.php?stx=%EA%B8%89%EB%93%B1%EC%A3%BC+%EC%B6%94%EC%B2%9C\n급등주 추천 - 인기순위 순위닷\n맛집순위, 여행순위, 교육순위, 보험순위, 신용카드순위, 자동차순위, 대출 순위 등 다양한 순위 정보 제공 사이트\nsoonwidot.co.kr']",7,https://kin.naver.com/qna/detail.naver?d1id=4&dirId=40102&docId=374621355&qb=67Cx7Iug&enc=utf8&section=kin&rank=540&search_sort=3&spq=0,"주식, 증권"
