page,date,tags,questions,questions_add,answers,N_answer,url,category
16,2020.08.25,['#숨찬데좋은음식'],제가 한 2월부터 숨쉬기가 답답했는데 집 근처 작은병원가서 주사한번 맞았는데 한 2일정도 괜찮아졌다가 계속 숨쉬기 힘들었는데 이번달에 숨쉬기 답답하면 머리도 어지럽고 한번씩 헛구역질도 나오고 밤이나 아침에는 목에 가래낀 느낌도 있어요 열은 없는데 혹시 막 코로나 그런거는 아니죠???,,"['코로나바이러스는 급성호흡기및 폐질환입니다.\n일반적인 코로나의 증상은 오한및 38도 이상의 발열 기침,가래 증상이 있습니다.\n혹 무증상자도 있답니다 검사를 안해보고 증상만으로 코로나 진단을 하는건 불가능 합니다.\n코로나 진단건사를 하실려면 1339번이나 가까운 보건소로 전화하세요\n코로나보다는 다른 기관지염 같습니다.\n천식 이란? 기관지내 근육세포 표면이 섬모돌기라는 부드럽고 촉촉한 표면으로 유지 되어야 하는데 어떤 연유로 기관지 근육 벽이 딱딱 해지면서 좁아지고 염증도 생겨 색색 거리는 청명음과 기침 가래도 동반되는 난치병입니다.\n기관지확장증은 천식의 반대 입니다 기관지 내벽이 손상되어 통로가 넓어지는병 인데 호흡곤란과 가래가 많이 생기는게 특징 입니다.\n기관지확장증도치료법이 없는 난치병인데 가래배출이 용이하고 줄어 든다던가 호흡곤란증세가 좋아지는게 치료라고 생각 하시면 됩니다.\n천식과 마찬가지로 치료약 보다는 치료 보조 역할을 하는 처방이 대부분 입니다.\n스테로이드나 네볼라이저등 호흡기 약물투여를 하는데 더하다 덜하다를 반복합니다.\n근본적인 치료는 내몸에서 면역력이나 차가 치유력이 복원되어 스스로 정상을 찾는게 진정한 치유방법 입니다.\n심하면 사망에 이르기도 합니다.\n만약 천식이나 기관지 확장증에 확실히 도움이되는 음식 식품이 있습니다.\n수백년을 이어온 은행마을 은행식초입니다 \n천식이나 기관지확장증이 낫고 안낫고는 제3자가 판단할 사항이고 환자가 병원 치료 방법이나 약 보다 이구동성으로 낫다고 만족하다고 하면  고통을 덜어주는데 도움이 되고 싶습니다.\n은행이 기침 가래 해소 기관지 폐 에 좋다고는 옛부터 알려져 왔지만 이렇게까지 좋을줄은 정말 꿈에도 몰랐습니다.\n그동안 수천명의 환자들에게 복용 시켜 보았는데 만족하지 않은분이 없었습니다 일상생활에 지장 없을만큼 좋아 지는데 시간이 좀 필요할 뿐입니다.\n식품으로 좋아진다고 하면 약장사로 과대 광고 한다고 처벌 받을수도 있겠지만 지금 이 시간에도 호흡기질환으로 고통 받고있는 환자들 생각에 글을 올립니다.\n10년숙성은행식초는 임산부는 물론 수유어린이 노약자가 드셔도 부작용이 없는 진짜 천연발효식초입니다.\n한국은행나무연구소\n ', '코로나19는 기본적으로 독감의 제증상과 유사합니다. 지속적인 38도 이상의 고열, 근육통, 심한 기침(호흡곤란), 무기력증, 정신혼미, 두통 등... 순서대로 세가지 이상이 해당되면 의심할 만 합니다..\n그런데 코로나19의 무증상전파 및 전국확산단계가 가시화되어 매우 위험한 상황입니다.\n유감스럽게 코로나 19는 공인된 백신이나 치료제가 아직은 없습니다. 그나마 다행인 것은 신체의 면역력이 최상으로 유지되고 있으면, 예방은 물론이고 경증인 경우 자연적인 치료까지 가능합니다.\n따라서 예방과 치료를 위한 확실한 해결책은 면역력강화 뿐입니다. 똑 같이 노출되어도 천차만별인 것은 면역력의 차이때문입니다!!!\n비타민C 메가도스요법으로 면역력을 강화할 수 있으며, 비용도 하루 몇백원에 불과합니다.\n비타민C의 면역력강화기능은 수많은 논문으로 입증되었으며, 80년간 지속된 대안요법입니다. 다만 제도권의료계에서는, 면역력강화기능을 의약품으로 분류하지 않으므로, 이를 예방약이나 치료약으로 사용하지 않을 뿐입니다.\n비타민C로 면역력을 극대화하려면, 몸무게에 정비례하여, 예를들면 체중 60키로는 하루에 9그램을 3~6회로 나누어서 복용하기를 계속합니다.\n정상적인 사람이 이렇게 하면, 사실상 백신을 맞은 것처럼, 코로나19를 비롯한 전염병에 강한 면역력이 생기고 유지됩니다.\n더 상세한 내용은 구글플레이북에서 ""비타민C 메가도스""를 구독하세요. 코로나19를 포함한, 30여 가지 질병의 성공적인 치료사례가 함께 수록되어 있습니다(73~75페이지에 코로나19 예방/치료 집중설명).\n더우기 이 책에는 미국CDC(질병관리본부)가, 자가격리 중인 코로나19환자에게 ""타이레놀과 비타민C""만으로 치료하라고 비공식적으로 처방하는, 그리고 치료되었다는 내용이 수록되어 있습니다.\n직업상 또는 개인적인 사유로 대면접촉이 많은 사람이라면, 꼭 비타민C 메가도스를 실행하여 면역력을 강화하세요. 마스크와 손씻기만으로는 완벽한 예방이 어렵습니다.', '안녕하세요. \n가슴 답답증과 호흡곤란, 어지럼증과 헛구역질 등이 있으시군요.\n이런 증상들은 코로나는 아니고 발과 발가락 고장으로 몸의 구조에 변형이 오면서 나타나는 것입니다. \n이것은 폐에 문제가 있거나 심장에 문제가 있는 것이 아니라 몸이 앞으로 굽어서 오는 것입니다. \n이것들은 발과 발가락 신경이 고장 나서 힘을 잃고 약해지게 될 때 오는 문제들입니다. \n신경 고장으로 힘이 약해지게 되는데, 몸을 세울 수 있는 힘이 없어서 상체가 앞으로 굽으면서 가슴흉곽이 아래로 내려 앉아 심장이 눌리기 때문에 가슴이 답답하고 통증이 오며 호흡곤란이 오게 됩니다. 이 때 호흡량이 적어서 핏속에 산소결핍이 일어나면서 가슴통증이나 명치끝에 통증이 오기도 하며 쉽게 피로증을 느끼게 됩니다. 이것은 특히 잠자려고 누울 때 가슴흉곽이 더욱 심장을 압박하기 때문에 호흡하기가 더 힘들어집니다.\n어지럼증 또한 발과 발가락 힘이 약해지면서 좌우 발에서 한쪽 발이 더 약해지게 될 때, 머리의 평형을 잡아 주는 귀밑에 있는 목근육(흉쇄유돌근)도 신경이 고장 나면서 경직되어 힘이 약해지게 되고, 좌우 목근육의 힘이 불균형이 초래되어 머리의 평형을 잡아줄 수 없게 되면서 어지럼증이 오게 됩니다. \n이와 같이 이런 문제들이 발과 발가락 고장으로 인해서 오는데, 그만큼 이 부위가 발과 발가락과 유기적으로 긴밀하게 연결되어 영향을 받고 기능을 하게 되기 때문입니다.\n이런 문제들에서 벗어나시려면 새로 발견된 자연의학의 자연치유의 방법(KSNS 스본스도)으로 고장 나서 힘을 잃고 약해져 있는 발과 발가락 신경을 풀어 주고 경직된 근육을 풀어 주게 되면, 마치 전기 스위치를 위로 올리면 불이 들어 오는 것처럼, 힘이 들어 오기 시작합니다. 이 때 걷는 운동을 통해서 스스로 활성화시키고 강화시키면서 차츰 강하고 튼튼한 발과 발가락으로 변해가게 됩니다. \n그래서 결국 발과 발가락 힘이 세 지고 튼튼해지게 되어 몸을 똑 바로 세울 수 있게 되면 가슴이 펴지면서 심장이 더 이상 눌리지 않게 되어 가슴통증과 호흡곤란이 풀리게 됩니다. \n이런 상태에서 목근육 신경도 풀어 주고 근육도 풀어 주면 차츰 근육이 부드러워지고 유연해져 피가 잘 통하게 되면서 힘이 나오고 차츰 세 지게 됩니다. 그래서 좌우 목근육이 균형을 이룰 때 머리의 평형도 잡아줄 수 있게 되어 어지럼증이 사라지게 됩니다. 따라서 이처럼 근본 원인이 되고 있는 발과 발가락 힘이 강해지기 전에는 그 어떤 것으로도 이런 증상이 사라지지 않는 것입니다. \n그렇기 때문에 이런 문제는 자연의학의 관점에서 다루어야 낫고 완치될 수 있습니다. 왜 그럴까요? 근원 치료로서 문제의 원인을 찾아 제거하기 때문입니다. 그렇지 않고 다른 방법으로 이런 문제들 다루게 될 때, 아무리 해도 낫지 않고 호전되지 않는 것을 경험하게 되실 것입니다. 왜일까요? 이것은 마치 헛다리를 짚는 것과 같기 때문입니다. \n이것은 이미 수 많은 치유사례들을 통해서 입증된 것이므로 기쁜 마음으로 알려 드리는 것입니다. 그러므로 아무리 해도 낫지 않고 답답하고 정말 막막하실 때, 지푸라기라도 붙들고 싶으신 심정과 꼭 낫고 싶으신 간절함과 믿음만이 반드시 낫는 완치의 길로 이끌 것입니다. \n이것을 믿는 자에게 복이 있을 것입니다. \n부디 하루 빨리 완치되어 건강하게 살아 가실 수 있게 되기 바랍니다. \n감사합니다.\nAnthony Choi (010 9019 5963 Seoul)\nhsglobal.choi@gmail.com ', '코로나증상과 비교해보시고 체크후\n의심이 된다면 1339번에 전화후 안내 받으시기 바랍니다.\n코로나19 자가진단 코로나세이프 자가진단 받으러 가기\nhttps://dangcare.tistory.com/1329\n코로나19 자가진단 서비스가 개발됐다. 코로나세이프 자가진단 받으러 가기\n코로나19 자가진단 서비스가 개발됐다. 코로나세이프 자가진단 받으러 가기 고고 코로나19 선별 진료소에서 근무하는 공중보건의 등 현직 의사 9명과 MBN 측이 함께 만든 자가진단 서비스는 언제, 어디서나 손쉽..\ndangcare.tistory.com\n코로나맵’ 이어 주변 진료소 정보까지 확인 가능한 ‘코로나 알리미’\n동선확인하시고 주의하세요 ..............\nhttps://dangcare.tistory.com/1226\n코로나맵’ 이어 주변 진료소 정보까지 확인 가능한 ‘코로나 알리미’ 등장\n코로나맵’ 이어 주변 진료소 정보까지 확인 가능한 ‘코로나 알리미’ 등장 최근 ‘신종 코로나바이러스’가 국내에 확산됨에 따라 이에 대한 정보를 확인할 수 있는 창구가 하나둘씩 등장하고 있다. 지난달 30일..\ndangcare.tistory.com\n인후통코로나 증상 목아픔코로나 증상 발현 시기코로나 증상 설사코로나 증상 두통코로나코로나 증상\n롯데리아코로나 ,서울시 모든 종교시설 집합제한, 확진자수,여의도순복음교회\n사회적거리두기,용인 우리제일교회코로나 ,결혼식 50명,동대문코로나,사랑제일교회\n캐리비안베이 코로나,수젠텍,코로나진단키트 맥도날드 서울역점,마스크\n채택시 해피빈은 코로나 관련해서 전액기부됩니다.\n코로나는 아닐거에요 , 건강한 하루되세요']",4,https://kin.naver.com/qna/detail.naver?d1id=7&dirId=7010101&docId=366191690&qb=67Cx7Iug&enc=utf8&section=kin&rank=157&search_sort=3&spq=0,호흡기내과
15,2020.08.25,[],숨쉴 때 목에 공기가 너무 잘 느껴져요.,며칠 목이 간질간질하더니 갑자기 숨쉬는데 숨 목구멍이 커진 것처럼 숨을 쉬는게 너무 잘 느껴져요.. 이제 목은 안 간지럽고요. 기침도 안하고 열도 없는데 코로나는 아니겠죠..?,"['저도 그런적 있었는데 며칠뒤에 안그러더라고요 코로나는 아니고 자연스러운 거에요 크게 걱정 안하셔도 될것 같아요. 도움이 되셨다면 채택 부탁드립니다!', '코로나19는 기본적으로 독감의 제증상과 유사합니다. 지속적인 38도 이상의 고열, 근육통, 심한 기침(호흡곤란), 무기력증, 정신혼미, 두통 등... 순서대로 세가지 이상이 해당되면 의심할 만 합니다..\n그런데 코로나19의 무증상전파 및 전국확산단계가 가시화되어 매우 위험한 상황입니다.\n유감스럽게 코로나 19는 공인된 백신이나 치료제가 아직은 없습니다. 그나마 다행인 것은 신체의 면역력이 최상으로 유지되고 있으면, 예방은 물론이고 경증인 경우 자연적인 치료까지 가능합니다.\n따라서 예방과 치료를 위한 확실한 해결책은 면역력강화 뿐입니다. 똑 같이 노출되어도 천차만별인 것은 면역력의 차이때문입니다!!!\n비타민C 메가도스요법으로 면역력을 강화할 수 있으며, 비용도 하루 몇백원에 불과합니다.\n비타민C의 면역력강화기능은 수많은 논문으로 입증되었으며, 80년간 지속된 대안요법입니다. 다만 제도권의료계에서는, 면역력강화기능을 의약품으로 분류하지 않으므로, 이를 예방약이나 치료약으로 사용하지 않을 뿐입니다.\n비타민C로 면역력을 극대화하려면, 몸무게에 정비례하여, 예를들면 체중 60키로는 하루에 9그램을 3~6회로 나누어서 복용하기를 계속합니다.\n정상적인 사람이 이렇게 하면, 사실상 백신을 맞은 것처럼, 코로나19를 비롯한 전염병에 강한 면역력이 생기고 유지됩니다.\n더 상세한 내용은 구글플레이북에서 ""비타민C 메가도스""를 구독하세요. 코로나19를 포함한, 30여 가지 질병의 성공적인 치료사례가 함께 수록되어 있습니다(73~75페이지에 코로나19 예방/치료 집중설명).\n더우기 이 책에는 미국CDC(질병관리본부)가, 자가격리 중인 코로나19환자에게 ""타이레놀과 비타민C""만으로 치료하라고 비공식적으로 처방하는, 그리고 치료되었다는 내용이 수록되어 있습니다.\n직업상 또는 개인적인 사유로 대면접촉이 많은 사람이라면, 꼭 비타민C 메가도스를 실행하여 면역력을 강화하세요. 마스크와 손씻기만으로는 완벽한 예방이 어렵습니다.']",2,https://kin.naver.com/qna/detail.naver?d1id=7&dirId=7010101&docId=366205703&qb=67Cx7Iug&enc=utf8&section=kin&rank=148&search_sort=3&spq=0,호흡기내과
16,2020.08.25,[],물론 아예 나몰라라 가만히 있는것 보단 낫지만,"아직까지 코로나에 대한 지식도 부족한거 같아요

그리고 코로나는 변종 잘하는 RNA 예요 DNA 가 아니예요

근데 어찌 훌륭한 백신을 만들어요...

https://sedaily.com/NewsView/1Z6OW4NSA8

https://www.hankyung.com/international/article/202008253802i",['작성자 분의 말씀이 맞습니다!\n다들 각자 경각심을 갖고 코로나 예방에 힘쓰면 좋겠습니다\n오늘도 좋은 하루 보내세요^^'],1,https://kin.naver.com/qna/detail.naver?d1id=6&dirId=61303&docId=366195046&qb=67Cx7Iug&enc=utf8&section=kin&rank=155&search_sort=3&spq=0,사람과 그룹
16,2020.08.25,[],무슨 증상인가요,두두러기로 3주간 고생을 하고 있는데 오늘 아침부터 계속은 아니지만 폐에 가래가 있는 느낌이고 숨을 쉴 때 답답해요그리고 오늘 생라통도 심하게 와서 몸살도 좀 있고..코로나 의심해봐야 하나요 이 증상들이 두드러기랑 생라통 때문인지 코로나 때문인지 너무 헷갈려요,"['코로나바이러스는 급성호흡기및 폐질환입니다.\n일반적인 코로나의 증상은 오한및 38도 이상의 발열 기침,가래 증상이 있습니다.\n혹 무증상자도 있답니다 검사를 안해보고 증상만으로 코로나 진단을 하는건 불가능 합니다.\n코로나 진단건사를 하실려면 1339번이나 가까운 보건소로 전화하세요', '코로나19는 기본적으로 독감의 제증상과 유사합니다. 지속적인 38도 이상의 고열, 근육통, 심한 기침(호흡곤란), 무기력증, 정신혼미, 두통 등... 순서대로 세가지 이상이 해당되면 의심할 만 합니다..\n그런데 코로나19의 무증상전파 및 전국확산단계가 가시화되어 매우 위험한 상황입니다.\n유감스럽게 코로나 19는 공인된 백신이나 치료제가 아직은 없습니다. 그나마 다행인 것은 신체의 면역력이 최상으로 유지되고 있으면, 예방은 물론이고 경증인 경우 자연적인 치료까지 가능합니다.\n따라서 예방과 치료를 위한 확실한 해결책은 면역력강화 뿐입니다. 똑 같이 노출되어도 천차만별인 것은 면역력의 차이때문입니다!!!\n비타민C 메가도스요법으로 면역력을 강화할 수 있으며, 비용도 하루 몇백원에 불과합니다.\n비타민C의 면역력강화기능은 수많은 논문으로 입증되었으며, 80년간 지속된 대안요법입니다. 다만 제도권의료계에서는, 면역력강화기능을 의약품으로 분류하지 않으므로, 이를 예방약이나 치료약으로 사용하지 않을 뿐입니다.\n비타민C로 면역력을 극대화하려면, 몸무게에 정비례하여, 예를들면 체중 60키로는 하루에 9그램을 3~6회로 나누어서 복용하기를 계속합니다.\n정상적인 사람이 이렇게 하면, 사실상 백신을 맞은 것처럼, 코로나19를 비롯한 전염병에 강한 면역력이 생기고 유지됩니다.\n더 상세한 내용은 구글플레이북에서 ""비타민C 메가도스""를 구독하세요. 코로나19를 포함한, 30여 가지 질병의 성공적인 치료사례가 함께 수록되어 있습니다(73~75페이지에 코로나19 예방/치료 집중설명).\n더우기 이 책에는 미국CDC(질병관리본부)가, 자가격리 중인 코로나19환자에게 ""타이레놀과 비타민C""만으로 치료하라고 비공식적으로 처방하는, 그리고 치료되었다는 내용이 수록되어 있습니다.\n직업상 또는 개인적인 사유로 대면접촉이 많은 사람이라면, 꼭 비타민C 메가도스를 실행하여 면역력을 강화하세요. 마스크와 손씻기만으로는 완벽한 예방이 어렵습니다.']",2,https://kin.naver.com/qna/detail.naver?d1id=7&dirId=7010101&docId=366196615&qb=67Cx7Iug&enc=utf8&section=kin&rank=154&search_sort=3&spq=0,호흡기내과
16,2020.08.25,"['코로나바이러스증상', '코로나바이러스인가요']",코로나인가요?,머리가 조금 어지럽다 안 어지럽고 열은 아예 없고 침 삼킬 때 목이 좀 아프고 가래가 나오면 코로나인가요?,"['현재 코로나 때문에 질문자님처럼 몸이 아파서 불안함을 느끼시는 분들이 많네요..\n아무래도 코로나 증상들이 기존 감기증상 장염증상을 동반하다보니.. 일단 지속적으로 아프다면 병원을 가는게 제일좋겠죠?\n저는 냉방병 때문에 인후통, 코막힘 때문에 고생을 해서 유튜브로 관련 정보를 찾았는데 불안감이 조성될 정도로 많고 다양한 증상이 있더라고요..\n일단 가까운 병원을 찾아보시는 게 좋을 것 같습니다. 발열이 심한 환자(37.5 이상)가 아니라면 내원 환자 진료해 주는 걸로 알고 있습니다.\n코막힘이 심해서 일상생활이 불편하다면 이비인후과나 내과를 가는 걸 추천드립니다. 그리고 가급적 완전히 낫기 전에는 외출을 삼가주세요!\n냉방병 증상은 대체적으로 감기와 비슷한 증상들이 나타납니다\n-감기및 호흡기 증상 : 콧물, 재채기, 두통, 목 통증, 코막힘, 피로감, 관절의 통증, 열이 날 수 있음\n-위장 장애 증상 : 소화불량, 복부의 이물감, 설사 등등\n-여성 : 생리통 or 생리주기가 불규칙해짐\n코로나는 37.5이상의 발열, 기침 . 호흡곤란, 오한, 근육통, 두통, 인후통, 후각/미각 손실, 폐렴등등\n요즘은 더 다양한 증상도 있다고하니 혹여나 의심증상이 있으시면 관련기간에 연락을 취해보세요. \n1399나 지역콜센터 120에 문의해보시길바래요', '코로나증상과 비교해보시고 체크후\n의심이 된다면 1339번에 전화후 안내 받으시기 바랍니다.\n코로나19 자가진단 코로나세이프 자가진단 받으러 가기\nhttps://dangcare.tistory.com/1329\n코로나19 자가진단 서비스가 개발됐다. 코로나세이프 자가진단 받으러 가기\n코로나19 자가진단 서비스가 개발됐다. 코로나세이프 자가진단 받으러 가기 고고 코로나19 선별 진료소에서 근무하는 공중보건의 등 현직 의사 9명과 MBN 측이 함께 만든 자가진단 서비스는 언제, 어디서나 손쉽..\ndangcare.tistory.com\n코로나맵’ 이어 주변 진료소 정보까지 확인 가능한 ‘코로나 알리미’\n동선확인하시고 주의하세요 ..............\nhttps://dangcare.tistory.com/1226\n코로나맵’ 이어 주변 진료소 정보까지 확인 가능한 ‘코로나 알리미’ 등장\n코로나맵’ 이어 주변 진료소 정보까지 확인 가능한 ‘코로나 알리미’ 등장 최근 ‘신종 코로나바이러스’가 국내에 확산됨에 따라 이에 대한 정보를 확인할 수 있는 창구가 하나둘씩 등장하고 있다. 지난달 30일..\ndangcare.tistory.com\n인후통코로나 증상 목아픔코로나 증상 발현 시기코로나 증상 설사코로나 증상 두통코로나코로나 증상\n롯데리아코로나 ,서울시 모든 종교시설 집합제한, 확진자수,여의도순복음교회\n사회적거리두기,용인 우리제일교회코로나 ,결혼식 50명,동대문코로나,사랑제일교회\n캐리비안베이 코로나,수젠텍,코로나진단키트 맥도날드 서울역점,마스크\n채택시 해피빈은 코로나 관련해서 전액기부됩니다.\n코로나는 아닐거에요 , 건강한 하루되세요', '코로나19는 기본적으로 독감의 제증상과 유사합니다. 지속적인 38도 이상의 고열, 근육통, 심한 기침(호흡곤란), 무기력증, 정신혼미, 두통 등... 순서대로 세가지 이상이 해당되면 의심할 만 합니다..\n그런데 코로나19의 무증상전파 및 전국확산단계가 가시화되어 매우 위험한 상황입니다.\n유감스럽게 코로나 19는 공인된 백신이나 치료제가 아직은 없습니다. 그나마 다행인 것은 신체의 면역력이 최상으로 유지되고 있으면, 예방은 물론이고 경증인 경우 자연적인 치료까지 가능합니다.\n따라서 예방과 치료를 위한 확실한 해결책은 면역력강화 뿐입니다. 똑 같이 노출되어도 천차만별인 것은 면역력의 차이때문입니다!!!\n비타민C 메가도스요법으로 면역력을 강화할 수 있으며, 비용도 하루 몇백원에 불과합니다.\n비타민C의 면역력강화기능은 수많은 논문으로 입증되었으며, 80년간 지속된 대안요법입니다. 다만 제도권의료계에서는, 면역력강화기능을 의약품으로 분류하지 않으므로, 이를 예방약이나 치료약으로 사용하지 않을 뿐입니다.\n비타민C로 면역력을 극대화하려면, 몸무게에 정비례하여, 예를들면 체중 60키로는 하루에 9그램을 3~6회로 나누어서 복용하기를 계속합니다.\n정상적인 사람이 이렇게 하면, 사실상 백신을 맞은 것처럼, 코로나19를 비롯한 전염병에 강한 면역력이 생기고 유지됩니다.\n더 상세한 내용은 구글플레이북에서 ""비타민C 메가도스""를 구독하세요. 코로나19를 포함한, 30여 가지 질병의 성공적인 치료사례가 함께 수록되어 있습니다(73~75페이지에 코로나19 예방/치료 집중설명).\n더우기 이 책에는 미국CDC(질병관리본부)가, 자가격리 중인 코로나19환자에게 ""타이레놀과 비타민C""만으로 치료하라고 비공식적으로 처방하는, 그리고 치료되었다는 내용이 수록되어 있습니다.\n직업상 또는 개인적인 사유로 대면접촉이 많은 사람이라면, 꼭 비타민C 메가도스를 실행하여 면역력을 강화하세요. 마스크와 손씻기만으로는 완벽한 예방이 어렵습니다.']",3,https://kin.naver.com/qna/detail.naver?d1id=7&dirId=7010101&docId=366199500&qb=67Cx7Iug&enc=utf8&section=kin&rank=153&search_sort=3&spq=0,호흡기내과
