page,date,tags,questions,questions_add,answers,N_answer,url,category
8,2020.10.09,[],시작프로그램 관리,노트북을 사용하는 유저입니다. 동생이 컴퓨터를 쓰고나니 줌이라던지 여러 사이트가 컴퓨터를 켜면 동시에 켜집니다. 어떤 프로그램을 삭제해야 뜨지 않을까요? 그리고 불필요해서 삭제해도 될 프로그램도 알려주세요!,"['http://download.sysinternals.com/files/Autoruns.zip\n이걸로 권리자 권한으로 하셔서 하시고요 하나씩 모두 체크 해제 해서 찾아 보세요 파일 이름을 구글에 검색 해서 본인이 직접 체크 하는 것이 가장 빨라요.', '고클린에서 해결못하고,\nMZK나 이지클린을 설치해서 멀웨어제거를 하세요.\n속도 빨라지게 하려면,\n이지클린에서 은행보안프로그램도 모두 지우면됩니다.', '1] 컴 부팅 시 예전 사용한 페이지 생성 경우 https://blog.naver.com/tibung/221301582305\n윈도우10 빠른시작(부팅시 인터넷창/어플 자동실행기능) 끄기.\n*RS5에서는 전원쪽 설정이 안보이네요.대신 후반부에 계정쪽 설정만 했는데 되긴합니다.안되면 저도 몰라...\nblog.naver.com\n2] 1번 해당되지 않을 경우 - 제어판 설치된 목록 캡처 이미지 추가 후 질문 주세요\n3] 시작 프로그램 목록 경우 - 하늘 밑줄 [ 유지 ] 터치패드, 백신, 마우스', '이런것들 한번에 자동으로 싹 지워주는 프로그램 나왔어요.\n네이버자료실에서 클린업 검색하세요.\nhttps://software.naver.com/software/summary.nhn?softwareId=GWS_003427&categoryId=B0400000\n클린업\n삭제해도 되는 프로그램 알리미\nsoftware.naver.com\nhttps://www.pccleaner.co.kr/\n클린업\n컴퓨터 정리 프로그램\nwww.pccleaner.co.kr']",4,https://kin.naver.com/qna/detail.naver?d1id=1&dirId=10102&docId=370230249&qb=67Cx7Iug&enc=utf8&section=kin&rank=71&search_sort=3&spq=0,노트북
5,2020.10.09,[],희망을 잃지말아야 하는 이유가 뭔가요?,"요즘 코로나 때문에
암울하고 특히 취업이나 인생에서도
암울한데도 
TV나 주변에선 희망을
잃지 말고 이겨내자고
격려하던데
왜 그래야 하는 건가요?
현실에선 사람들이 우울하고
되는 일이 하나도 없고
취업도 안되고 코로나도
아직도 안 없어지는 데
이 상황에서 어떻게
희망을 가져야 하는 지 
의문이 드네요.",['희망  이나   꿈  은  반드시 가져야 하는 건 아니지만 \n태초부터 있어온 장래의 보답입니다.\n힘들고  지친 시대에 뭘 믿고 희망을  가질 수 있느냐고 하지만 \n그것마저 없다면 너무 삭막하지 않을까요.\n자~~~~~~~~~~~~~~~~~~\n코로나가 심해 지면 아마 내년 말쯤에는 인구의   절반이 목숨을 잃게 되고. . . .\n이것보다는\n곧 코로나의 백신이 개발 될것이고 지구상에서 코로나는 이겨낼 수 있는 질병일 뿐인 날이 올 것입니다.\n어느 것을 택하시겠습니까.\n꿈을 가지고 희망을 걷어차지 마십시오\n응원합니다  잘  될 겁니다.'],1,https://kin.naver.com/qna/detail.naver?d1id=6&dirId=61303&docId=370244948&qb=67Cx7Iug&enc=utf8&section=kin&rank=48&search_sort=3&spq=0,사람과 그룹
7,2020.10.09,[],코로나바이러스가 아직도 유행기 인가요.?,,['네!\n백신이 완전히 안정기에 접어들때까지는 그럴것 같아요!\n이제 인류와 쭉 함께갈것 같기도 하네요....!'],1,https://kin.naver.com/qna/detail.naver?d1id=7&dirId=70105&docId=370230810&qb=67Cx7Iug&enc=utf8&section=kin&rank=68&search_sort=3&spq=0,흉부외과
7,2020.10.09,['기본간호학'],간호사 의사분들 답좀해주세여,저는 백신 접종(IM)할때 주사기 뒤로 당겨보지 않는걸로 알고있는데요 혹시 아닌가요? 보통의 IM과같이 그렇게 접종하면 되나요?,['근육주사(IM)으로 접종하는 백신은 \n바늘을 찔러넣은후 혈액이 나오는지 뒤로 당겨보아야 합니다.\n바늘의 끝이 혹시나 (근육이 아니라) 혈관안에 위치해 있지는 않나 확인해야 하기 때문입니다.'],1,https://kin.naver.com/qna/detail.naver?d1id=7&dirId=710&docId=370231913&qb=67Cx7Iug&enc=utf8&section=kin&rank=67&search_sort=3&spq=0,"의료기관, 의료인"
7,2020.10.09,[],윈도우10 블루스크린,"항상그러지는 않고 가끔씩그럽니다
방금은 컴퓨터 키려고 본체만 눌러놓고 잠시후에왔는데도
이럽니다

화면도깨져보이네요","['윈도우에 오류가 생겨서 그렇습니다. 블루스크린은 원인도 많고, 한번생기면 지속적으로 계속 발생되기 때문에 윈도우를 재설치해주는 것이 가장 좋습니다. \nMS사의 홈페이지에서 설치용 USB를 만드실수 있습니다. \n참고 : http://intunknown.tistory.com/66\n설치후 강제인증프로그램 또는 정품인증키를 이용해서 정품인증을 하시면 됩니다.', '이벤트 관리자를 여서서 보세요. 가끔 그럼.. 그래픽 카드 고장일 가능성이 높아요 가장 빨리 고장나서요.\n아니면 하드나 여러가지 체크 해보세요. \n때론 백신 때문에 그럴수도 있어요 클랙 같은 것을 사용 할 경우 망가지는대. 윈도우 빌드 업데이트 하면서 클랙 하고 백신 하고 잠봉 되어.. 윈도우가 망가지는 건대. 이럴 경우 포멧 하면 되고 정품으로 사용 하면 좋아지네요', '1. 컴퓨터 본체 전원 차단하고 열어서 램과 외장 그래픽카드를 빼서 금색 접지 부분을 지우개로 문질러 주고 지우개 찌꺼기는 잘 제거를 합니다. 그런 후에 램과 외장 그래픽카드를 다시 장착을 해주고 사용을 해보세요..\n2. 그래도 동일하다면 이번에는 외장 그래픽카드를 빼고 cpu가 내장 그래픽을 지원한다면 본체 뒤쪽 위에 내장 그래픽으로 모니터 케이블 연결하고 컴퓨터 사용을 해보세요 문제가 없다면 다시 외장 그래픽카드를 장착해서 사용을 해보세요 또 문제가 있다면 외장 그래픽카드 드라이버를 재설치 해보세요 내장 그래픽으로 할 때는 문제 없는데 외장 그래픽카드 장착해서 문제가 발생하면 외장카드 문제입니다.\n3. 컴퓨터 켜자마자 블루스크린 뜨거나 화면이 깨지는 걸로 봐서는 윈도우 문제보다는 램이나 그래픽카드 쪽에 문제가 더 높다고 보여집니다. 테스트가 필요해 보입니다.', '컴퓨터본체에있는메모리카드를뺏다가디시겨보시면해결됩니다\n메모리카드접촉불량으로블루스크린이뜰수있어요']",4,https://kin.naver.com/qna/detail.naver?d1id=1&dirId=10301&docId=370233321&qb=67Cx7Iug&enc=utf8&section=kin&rank=65&search_sort=3&spq=0,윈도우
7,2020.10.09,[],touch vpn,"제가 배그라이트를 하는데 touch vpn 사용하고 있거든요 근데
connect 누르면 다시 connect 만 떠요 ㅠㅠㅠ (내공 200)","['안녕하세요 판다vpn 지식인 상담원입니다\nvpn이 제대로 연결이 되지않은거 같습니다 \n인터넷네트워크 변경하시거나 기기재부팅한번 해보시고 그래도 안되시면 해당 업체에 문의하셔야될거같습니다 ^^\nvpn업체같은경우는 이런경우를 대비해 소통이 잘되는 업체를 이용하셔야되는데요 ~ \n저희 판다vpn은 실시간상담채팅을 갖추고 있어 문제가있을경우\n빠른 상담으로 빠른 문제해결을 해드릴수 있습니다 ^^ \n서버도 게임유저들을 위한 게임서버 , 해외서버 \n또 한국서버 50개이상 서버를 보유중입니다 ^^\n일일무료체험도 가능하시니 충분히 이용해보시고 결정해보세요 ^^\n판다vpn - 한국 중국 일본 미국 홍콩 러시아 유럽 대만 싱가폴 빠른vpn 1일무료체험 - Google Play 앱\n※ 판다VPN을 선택해야 하는 이유! ◆ 가입만 해도 하루를 무료로 사용할수 있어요 ! ◆ 로그인 후 판다만 누르면 가장 빠른 곳으로 연결되어 사용이 매우 편리해요 ! ◆ 한국어로 실시간 상담이 가능합니다 ! ◆ 빠른 속도로 걱정없이 스트리밍을 즐길수 있습니다 ! ◆ 안전하고 믿을수 있으며 보안이 높은 VPN을 제공하고 있어요 ! ※ 사용방법 ◆ 로그인 > 판다를 누른다 > 연결후 인터넷 접속 OK 해외서버 사용법 ◆ 로그인 > 서버목록 > 해당 국가를 누른다 > 연결후 인터넷 접속 OK ※ 그밖의 기능 ◆DNS 변경 ◆차이나패스(...\nplay.google.com', '안녕하세요 킹콩 vpn 지식인 상담원입니다 ^^\n현재 연결이 잘 안되고 있으신건가요~?\n다른 프로그램(vpn이나 백신 등)이랑 충돌이 있는건 아닌지 확인해보시는게 좋겠네요~\nvpn이용하시면서 궁금하신 점 많으실텐데\n저희 킹콩vpn은 실시간 상담이 가능해서\n이용하시다 궁금하신점 언제든 문의가능하세요~\n서버랑 접속방식도 다양하게 제공해드리고 있구요 ^^\n현재 저희 킹콩vpn 홈페이지에서 일일 무료체험 가능하시니 부담없이 사용해보세요^^', '안녕하세요~~! VPN 대한 궁금증이 많으실 것 같은데요.\n저도 이곳저곳 알아보고 여러글 살펴보다가 무료 VPN 사용법, 무료 VPN다운로드,설치 방법,추적안당하는법까지!\n잘 정리된곳이 있어서 정보드립니다~!\n고민 해결하시는데 도움이 되었으면 하는 바램입니다. 기타 궁금하신 점은 아래 링크 남겨드릴테니 참고하시면 도움이 되실 것 같네요.\n▼무료 VPN 사용법, 무료 VPN다운로드,설치 방법(+링크첨부) VPN 사용시 추적을 피할수 있을까?\nhttps://salgoonews.tistory.com/277\n무료 VPN 사용법, 무료 VPN다운로드,설치 방법(+링크첨부) VPN 사용시 추적을 피할수 있을까?\n안녕하세요. 살구뉴스입니다. 최근 N번방 방지법으로 인해 VPN 다운받는방법에 대해 문의가 많아서 정리해드립니다. 1.VPN 이란? 2.VPN을 사용하면 추적에 걸리지 않을까? 3.VPN PC버전 다운로드 방법 4.VPN 모바..\nsalgoonews.tistory.com']",3,https://kin.naver.com/qna/detail.naver?d1id=1&dirId=1010702&docId=370230618&qb=67Cx7Iug&enc=utf8&section=kin&rank=70&search_sort=3&spq=0,안드로이드태블릿
1,2020.10.09,[],필요없는 프로그렘 알려주세요! (제어판 삭제),"필요없는 프로그렘 알려주세요! (제어판 삭제)

미니 노트북을 받았는데 (정말 단순히 들고다니는 용도로 사용하는) 용량이 너무 적어서요.

딱 아래한글로 문서 작업만 하는 용도로 사용하려고 합니다 (그 문서도 USB에 저장하고 컴터에는 저장하지 않을 계획- 용량이 정말 너무 작아서)

필요없는 프로그램이나 삭제할 프로그램이 있을까요?",['그냥 포맷으로 싸악 밀어버리시는게...일단 뭐 반디캠같은 것들 지우셔도 되고요 백신은 알약이나 V3 둘중 하나는 지우세요. 개인적으론 V3 추천하고요..그리고 LG 관련 저것들 쓸일 없으시면 싹 미셔도 됩니다.'],1,https://kin.naver.com/qna/detail.naver?d1id=1&dirId=101&docId=370296143&qb=67Cx7Iug&enc=utf8&section=kin&rank=1&search_sort=3&spq=0,"컴퓨터, 하드웨어"
5,2020.10.09,"['검색질문', '통합검색궁금증', '통합검색질문하기']",추억앨범 trojan malware,제 전화기가 추억앨범 trojan malware에 걸려서 상태가 안 좋고 제거도 안 됩니다. 어디서 누가 만든거며 왜 제거도 안 되고 왜 구글 트위터 다 먹통이지요,"['먼저, 감지한 백신이 무엇이지요?\n구글 트위터 다 먹통이라니 바이러스는 맞는 듯 한데...\n진단명이 android.trojan/malware이라니...\n너무 단순해서 의심이 가네요\n만약 저 창이 인터넷에서 뜬 것이라면 믿지 마시고요,\n저 백신이 무엇인진 모르겠지만 진단명 등으로 따져 보았을때는 저 백신앱이 바이러스일 가능성이 높습니다.\n댓글 또는 추가질문으로 백신 이름을 알려 주시면 더 자세히 알려드리도록 하겠습니다.']",1,https://kin.naver.com/qna/detail.naver?d1id=1&dirId=11002&docId=370247830&qb=67Cx7Iug&enc=utf8&section=kin&rank=45&search_sort=3&spq=0,바이러스
2,2020.10.09,"['검색질문', '통합검색궁금증', '통합검색질문하기']","여행 자유가 되려면 국내 코로나확진자가 어느정도 되면 가능할까요.
관광업에 종사자인데 이대로 있으면 죽을수밖에없네요",,"['여행 자유??? 지금도 자유잖아요. 해외여행이 문제있는거구요.\n한국뿐만아니라 전세계가 다같이 줄어야합니다.\n매일 오후 12시마다 갱신되는 초특가 세일 최대 80%\n▶ https://coupa.ng/bINJUT\n!! 삼성 브랜드 위크 전 품목 할인 행사중!! 최대 40%\n▶ https://coupa.ng/bFURsZ\n!! 애플(아이폰 아이패드등등) 전제품 브랜드 초특가 할인중 !!\n▶ https://coupa.ng/bINK9m\n!! 아이패드 에어▶ https://coupa.ng/bISdnL\n!! 아이패드 프로▶ https://coupa.ng/bISdqx\n!! 아이패드 7세대▶ https://coupa.ng/bISdvW\n!! 아이폰 시리즈 ▶ https://coupa.ng/bISndy\n!! 맥북 시리즈 ▶ https://coupa.ng/bI1pMA\n!! 애플펜슬 1세대 ▶ https://coupa.ng/bISdH6\n!! 애플펜슬 2세대 ▶ https://coupa.ng/bISdSt\n!!! 애플 워치 6 시리즈 ▶ https://coupa.ng/bKcPK7\n!! 에어팟 2세대 유선충전 ▶ https://coupa.ng/bKPflk\n!! 에어팟 2세대 무선충전 ▶ https://coupa.ng/bKPfwx\n!! 에어팟 프로 ▶ https://coupa.ng/bKPfCG\n!! 신학기 노트북 초특가 할인중 !!\n▶ https://coupa.ng/bINLDr\n!! KF 마스크 특가 한눈에 보기 !!\n▶ https://coupa.ng/bINKic\n안마의자 특가 행사중 (최대64%할인) \n▶ https://coupa.ng/bD3eFd\n파트너스 활동의 일환으로 일정액의 수수료를 제공 받습니다.', '네, 대한믹국을 입국 금지를 한 나라가 160여개국 이상이라고 하는데 국내 코로나 바이러스 확진자와 관계가 없이 세계 코로나 확진자가 줄어야 가능합니다.\n전세계 코로나 확진자가 3,600만명 그리고 사망자가 105만명으로 계속 확산이 되고 있으며 세계보건기구는 확진자가 실제로는 20배 이상 많고 사망자는 2배 이상 많을 것으로 예측을 하고 있습니다.\n올해에 백신이 나온다고 해도 한국은 3,000만명의 백신을 만들려면 내년이 되어야 하고 세계 인구 70억 이상의 백신을 모두 만들려면 2년정도 걸릴수도 있다고 합니다.\n아직 백신과 치료제가 개발이 되지 않아 항상 마스크를 쓰고 사람들과 접촉을 피하며 손을 자주 씻어 코로나를 예방을 해야 할것입니다.\n감사합니다.\nhttp://news.khan.co.kr/kh_news/khan_art_view.html?artid=202010060006001&code=970100\nWHO ""전세계 인구 10%는 코로나19 감염자""…20배 이상\n세계보건기구(WHO)는 전 세계 인구의 10%가 코로나19에 걸렸을 것으로 추정했다. 지금까지 알려진 전 세계 ...\nnews.khan.co.kr', ' 코로나현황 전세계 상황을 실시간으로 볼수 있는 다양한 사이트소개합니다\n제도 여행관련 일을 하고 있는데\n답답해서 조사하고 정리해봤습니다.\n도움이 되시길 바랍니다.\n특히 조지 홉킨스 대학 데쉬보드 참고하시면\n자세한 상황을 알수 있습니다.\n https://mbcreport.tistory.com/2', '코로나로인해서 다들 하루하루 버티기가 어렵네요~~\n우리 조금만 힘냅시다~~내년 후반이면 답이나오겠네요']",4,https://kin.naver.com/qna/detail.naver?d1id=2&dirId=2011304&docId=370268444&qb=67Cx7Iug&enc=utf8&section=kin&rank=20&search_sort=3&spq=0,지역
2,2020.10.09,"['좀비아포칼립스', '소설제목추천', '제목추천부탁드려요', '채티소설']",소설 제목 추천해주세유,좀비아포칼립스이고.. 주인공포함 4명이서 5층건물에서 생활하고 밖에서 좀비 때려잡고 음식구하고 치료제나 백신 나올때까지 버티는 생존기인데 좋은제목 정해주세유..이왕이면 여러개로..내공 150걸어유,"['안녕하세요~\n많이 고민되시죠?\n저는 이 상품이 제일 좋았어요 ㅎㅎ\nhttps://coupa.ng/bKWSt0\n좀비 아포칼립스:오픈 하드웨어를 이용한 인류 생존 가이드\nCOUPANG\ncoupa.ng\n요즘 어떤게 잘나가는지도 알려드릴게요\n도서 인기순위 확인하기\n                  ', '그들의 5층\n생존일지\n핏물로 물든 세상\n피비린내\n지옥 속에서']",2,https://kin.naver.com/qna/detail.naver?d1id=3&dirId=3070102&docId=370268458&qb=67Cx7Iug&enc=utf8&section=kin&rank=19&search_sort=3&spq=0,"공포, 추리 소설"
2,2020.10.09,[],사이버 강의에대해...,"도저히 사람 만나는 걸 싫어하는 성격이라 어쩔수 없네요 ㅠㅠ
내년에도 코로나땜에 비대면할까요?","['백신이 개발된다해도 한동안은 비대면으로 진행될 듯 하네요~', ""학교마다 상이하기 때문에 확답은 드릴 수 없지만\n내년에도 지금과 같은 상황이 계속 된다고 한다면 비대면으로 할 가능성이 크겠지요~!\n학교에서 정하고 공지할 수도 있고, 학생들의 의견을 수렴하기 위해\n'대면/비대면' 중 선택해야 할 때, 비대면 선택이 더 많을 경우 비대면으로 진행이 될 것입니다!"", '내년에 학교 다니게 될겁니다.\n계속 4년을 사이버 강의 들을순 없잖아요.']",3,https://kin.naver.com/qna/detail.naver?d1id=6&dirId=61303&docId=370270033&qb=67Cx7Iug&enc=utf8&section=kin&rank=18&search_sort=3&spq=0,사람과 그룹
2,2020.10.09,[],코로나19의 백신이 빠르면 언제쯤 나올 수 있을까요?????,,['빠르면 내년에는 나오겠죠.  추측입니다'],1,https://kin.naver.com/qna/detail.naver?d1id=8&dirId=814&docId=370272146&qb=67Cx7Iug&enc=utf8&section=kin&rank=17&search_sort=3&spq=0,기타
2,2020.10.09,"['빠른답변부탁드려요최대한빨리요ㅠㅠㅠㅠ답', '답변이길면더좋아요']",코로나 극복 방법,코로나를 극복하기위해 저희는 (국가는) 어떻게 해야할까요? 두개다 알려주세요!,['일반 국민들은 코로나 예방 생활수칙들을 지켜야하고 국가는 최대한 빨리 백신 개발을 해야하겠죠'],1,https://kin.naver.com/qna/detail.naver?d1id=9&dirId=9020203&docId=370272182&qb=67Cx7Iug&enc=utf8&section=kin&rank=16&search_sort=3&spq=0,남아메리카
2,2020.10.09,[],코로나가 올해 끝나나요,,"['가능성없을거같네요', '말 그대로 재앙의 시대입니다.\n백신 나오기 전에는 끝나지 않을 거 같네요.']",2,https://kin.naver.com/qna/detail.naver?d1id=7&dirId=705&docId=370274571&qb=67Cx7Iug&enc=utf8&section=kin&rank=15&search_sort=3&spq=0,대체의학
2,2020.10.09,[],휴대폰 해킹 본인인증,저한테 문자가 왔어요. 택배 주소가 틀리면 주소를 변경하러 사이트에 들어가라는 겁니다.그래서 앱을 눌렀는데 다운받으래요. 그래서 다운로드를했는데 어플이 안 뜨더라고요. 계속 다운받아서 안 되니까 대한통운이었는데 대한통운어플을 또 다운받았는데 링크에서 보던 것과는 많이 달라요. 뭔가 차가웠는데 갑자기.제가 하지도 않은 본인 인증 메일이 많이 오기 시작했어요 지금 10개 넘게 온 것 같은데어쩌죠?해킹이라고 생각합니다.,"['안녕하세요 지식파트너 가비아입니다.최근 유행하고 있는 스미싱으로 사회공학적인 해킹 기법 중 하나입니다. 내용대로 특정 스팸 URL을 클릭하여 다운로드 받을 경우 택배회사의 어플리케이션이 아닌해커가 제공하는 악성코드가 있는 파일이 스마트폰에 다운로드된 것으로 이미 본인인증문자메시지가 온다는 것은 스마트폰의 어떤 개인정보가 이미 해커에게 넘어갔을 가능성이 높습니다.1.해킹이 의심된다면 가장 먼저 인터넷을 차단해야 합니다. 모든 정보는인터넷을 통해 인증번호가 전송되고 전송되며 통신이 이루어지므로 차단을해야만 해요. 백신 프로그램을 통해 점검해야 합니다. 백신 프로그램으로 점검을통해 어떤 악성코드의 감염 여부를 확인하고, 어떤 피해가 발생하는지를 확인해야 합니다.']",1,https://kin.naver.com/qna/detail.naver?d1id=5&dirId=5010601&docId=370274640&qb=67Cx7Iug&enc=utf8&section=kin&rank=14&search_sort=3&spq=0,아이폰
2,2020.10.09,"['독감백신', '상온노출백신', '독감무료접종', '독감유료', '#상온노출']",올해 독감 백신 맞아도될까요?,"상온노출 및 백신 논란이많네요,,
맞기가 찝찝하네요.
코로나생각하면 맞아야하는데말이죠.

무료말고 유료로 맞는게 나을까요?","['오늘도 백신에 흰 부유물이 뜬것이  61만개나 발견 되었다니\n찜찜 합니다.\n올해는 백신 안맞고 견더 볼랍니다', '안녕하세요? 황닥입니다.\n그러게요 ㅠㅠ 상온노출 때문에 너무 걱정스러운 상황입니다\n유통 과정에서 문제 없는지 꼭 확인 하고 맞는게 좋은 방법일거 같아요\n2020 독감예방접종 https://www.youtube.com/watch?v=MKCSxo2zS38', ""위에 질문주신 내용은 정확히 모르겠네요. 혹시나 아래 내용도 참고해보시면 좋을 것 같습니다.\n무료독감 백신 예방접종 및 신청방법 대해서 정리하였습니다. 한번 참고해 보시면 도움이 될 것 같습니다. 도움이 되셨다면 채택 부탁드립니다.\n▼ 무료 독감 백신 예방 접종 신청방법 (++홈페이지 링크)\nhttps://info.dinoa.xyz/140\n무료 독감 백신 예방 접종 신청방법 (++홈페이지 링크)\n하늘 아래 다양한 정보를 전달하는 하 늘 정 보 입니다. 오늘은 '무료 독감백신 예방접종' 에 대해서 알아보겠습니다. 목차 2020년 무료 독감백신 예방접종 신청방법 국가에서는 '인플루엔자 국가예방접종 지..\ninfo.dinoa.xyz""]",3,https://kin.naver.com/qna/detail.naver?d1id=7&dirId=7010101&docId=370282199&qb=67Cx7Iug&enc=utf8&section=kin&rank=13&search_sort=3&spq=0,호흡기내과
2,2020.10.09,[],코로나 종식,코로나 때문에 마스크를 못 벗은지 벌써 7~8개월이 되다니요..... 그래서 그런지 요즘 우울하고 막 드라마 ost 들으면 그때 정말 행복했었는데라고 돌이킬 수 없는 과거를 회상하고 있네요..... 내가 친구들 얼굴을 본 건 언제였는지... 에휴 코로나 종식이 빨리 왔으면 좋겠네요..... 혹시 언제 종식이 될지 예상이 되나요?! 아님 백신이라도....,"['네, 코로나 바이러스가 종식이 되려면 백신과 치료제가 개발이 되어야 하는데 지금 만들고 있기에 빠르면 내년에 그리고 2년 정도면 종식이 되지 않을까 생각을 합니다.\n전세계 코로나 확진자가 3,600만명 그리고 사망자가 106만명으로 계속 확산이 되고 있는데 세계보건기구는 확진자가 실제로는 20배 이상 많고 사망자는 2배 이상 많을 것으로 예측을 하고 있습니다.\n이처럼 엄청난 확진자로 인해 70억 이상의 백신이 만들어 져야만이 코로나 바이러스가 종식이 될수가 있는데 한국은 내년에 3,000만명분이상의 백신을 만들어 전 국민들의 60% 이상을 백신을 맞아 집단면역을 하려고 하고 그리고 세계는 70억 이상의 백신이 공급이 되어야 하기에 길게는 2년 정도를 잡아야 코로나가 막을 내릴것 같습니다.\n그러나 완전한 종식이 아니라 독감 바이러스 같이 해마다 코로나 백신을 맞아야 할것 같습니다.\n감사합니다.\nhttp://news.khan.co.kr/kh_news/khan_art_view.html?artid=202010060006001&code=970100\nWHO ""전세계 인구 10%는 코로나19 감염자""…20배 이상\n세계보건기구(WHO)는 전 세계 인구의 10%가 코로나19에 걸렸을 것으로 추정했다. 지금까지 알려진 전 세계 ...\nnews.khan.co.kr', '점점 더 확산되는 추세입니다\n 코로나현황 전세계 상황을 실시간으로 볼수 있는 다양한 사이트소개합니다\n제가 여행관련 일을 하고 있는데\n답답해서 조사하고 정리해봤습니다.\n도움이 되시길 바랍니다.\n특히 조지 홉킨스 대학 데쉬보드 참고하시면\n자세한 상황을 알수 있습니다.\n https://mbcreport.tistory.com/2\n전세계 코로나19 세계지도 코로나실시간상황주요사이트 홈페이지소개\nGIS 대시보드는 현재 진행 중인 전세계적 공중보건 비상사태에 대응하여, 존스 홉킨스 대학 시스템 과학 엔지니어링 센터(CSSE)에서 전세계적으로 보고된 사례들을 실시간으로 시각화하고 추적하기 위해 개발한 인..\nmbcreport.tistory.com']",2,https://kin.naver.com/qna/detail.naver?d1id=3&dirId=3021102&docId=370282507&qb=67Cx7Iug&enc=utf8&section=kin&rank=12&search_sort=3&spq=0,드라마음악
