page,date,tags,questions,questions_add,answers,N_answer,url,category
16,2020.10.19,"['백신', '주사']",이번에 백신 주사를 맞았는데,이번에 백신 주사를 맞고 병원 건물에서 나오고 몇초후에 눈앞이 잘안보이고 귀가 따뜻해지면서 구역질도 나서 계단에 앉아있었는데 다시 괜찮아지고 지금은 아무렇지도 않은데 왜이런건가요?,"['백신이 한마디로 약한 독감균 넣는거라 조금은 아플거에요', '독감주사의 부작용은 사람마다 차이가 있습니다.\n만약에 다시 그런 증상들이 있으면 그때는 병원  방문해보세요']",2,https://kin.naver.com/qna/detail.naver?d1id=8&dirId=8030404&docId=371181247&qb=67Cx7Iug&enc=utf8&section=kin&rank=153&search_sort=3&spq=0,"주사, 약물 요법"
16,2020.10.19,[],돈 내고 맞은 독감백신은 괜찮은거죠?,저는 개인병원에서 돈내고 맞은 독감백신은 괜찮은거죠?ㅠㅠ 불안해요 ㅠㅠ 이름이 sk뭐시기라던데..,"['현재 무료독감만 문제가 터졌고\n유료는 아직 괜찮아요...\n독감백신 상온노출 (상온노출 백신 부작용)\n무료독감 상온노출 상온노출 백신 지역 (부작용 증상) _ 사건의 시작 질병관리청이 독감 백신의 무료 접종 시행을 하루 앞두고 안전상의 이유로 전면 중단했다. 일부 업체가 냉장 상태를 유지해야하는 백신을 상..\nzero-news.tistory.com\n상온노출 독감백신 이후 너무 무섭네요...\nㅇㅇ', ""위에 질문주신 내용은 정확히 모르겠네요. 혹시나 아래 내용도 참고해보시면 좋을 것 같습니다.\n무료독감 백신 예방접종 및 신청방법 대해서 정리하였습니다. 한번 참고해 보시면 도움이 될 것 같습니다. 도움이 되셨다면 채택 부탁드립니다.\n▼ 무료 독감 백신 예방 접종 신청방법 (++홈페이지 링크)\nhttps://info.dinoa.xyz/140\n무료 독감 백신 예방 접종 신청방법 (++홈페이지 링크)\n하늘 아래 다양한 정보를 전달하는 하 늘 정 보 입니다. 오늘은 '무료 독감백신 예방접종' 에 대해서 알아보겠습니다. 목차 2020년 무료 독감백신 예방접종 신청방법 국가에서는 '인플루엔자 국가예방접종 지..\ninfo.dinoa.xyz\nhttps://realtime.dinoa.xyz/362\n독감 무료예방접종 사업 다시 시작 (++최신 업데이트)\n독감 무료예방접종 신청 목차 독감 무료예방접종 사업 재개 유통 중 '상온 노출' 사고로 접종이 중단되었던 2020∼2021절기 겨울철 인플루엔자(독감) 예방접종 사업이 13일부터 전국 보건소와 2만1000여곳의 접종..\nrealtime.dinoa.xyz"", '안녕하세요? 황닥입니다.\n걱정되는 상황입니다ㅠㅠ 병원에 한번 문의 해보셔요\n상온노출독감주사 확인하는 법 https://m.blog.naver.com/ekgo83/222108219353\n상온노출된 독감주사인지 확인하는방법\n코로나 19 유행 때문에 이번에 독감 예방 접종은 아주 중요합니다.독감 접종 왜 해야 할까요? https://ww...\nm.blog.naver.com\n2020 독감예방접종 https://www.youtube.com/watch?v=MKCSxo2zS38']",3,https://kin.naver.com/qna/detail.naver?d1id=7&dirId=710&docId=371179110&qb=67Cx7Iug&enc=utf8&section=kin&rank=160&search_sort=3&spq=0,"의료기관, 의료인"
17,2020.10.19,[],코로나...,원래 일요일마다 축구동호회하는데요...코로나 치료제나 백신나오면 종식이안되도 축구랑 피시방가도될까요...?,"['어느정도 상용화되면 가는게 좋을거 같네요', '네 확실한 치료제나 백신이 개발이 되서\n상용화가 된 상태라면 축구나 피시방 모두 가고\n예전의 삶으로 돌아가실수 있습니다ㅜㅜ\n그래서 저도 하루 빨리 백신이 개발 되길 바랍니다..\n그럼 오늘도 건강 유의하셔서 좋은 하루 되세요~']",2,https://kin.naver.com/qna/detail.naver?d1id=10&dirId=10010102&docId=371168124&qb=67Cx7Iug&enc=utf8&section=kin&rank=169&search_sort=3&spq=0,프로축구
16,2020.10.19,['사이토카인폭풍'],독감주사 맞고 사이토카신 폭풍 일어날 수 있나요?,제목그대로 가능한 일인가요? 우잉 독감주사 원리를 생각하믄 가능하지 않을까 싶은데 또 이게 일반 독감걸렸을때 뭐랄까 바이러스 수도 비교했을때 확연한 차이가 있을거고.. 모르겠네용 갑작스런 호기심에 질문해봅니당,['기존의 독감 백신은 - 사이토카인을 효과적으로 감소시키는 일련의 장치가 되어있어요.  \n물론 특이 체질에서 이상 반응을 할 수 있다는 가능성은 있습니다.'],1,https://kin.naver.com/qna/detail.naver?d1id=7&dirId=7010101&docId=371181810&qb=67Cx7Iug&enc=utf8&section=kin&rank=152&search_sort=3&spq=0,호흡기내과
18,2020.10.19,[],"코로나가 다시 터질까요 안터질까요, 허허
내나이이제80곧갈때가됬네요즘화장실도많ㅇㅣ가는데",,"['코로나는 이제 감기처럼 백신 맞으며 싸워야 할 것 같다고 예상하더라구요,,', '코로나가 없어지면 다시 오지는 않겠지만 현재 코로나는 2022년까지 간다는 설이 많습니다 ', '코로나는 현재 수준을 유지할 것으로 보입니다.\n내년 백신 출시 이슈도 있기 때문에 긍정적으로 보심이..\n건강하시고 더 자세한 내용이 필요하시면 하기 글 참고바랍니다!\nhttps://east-june.tistory.com/7\n[이슈 정리]13일 코로나 19 확진자 102명. 백신은 언제쯤 가능할까?(ft. 아스트라제네카, SK바이오사이언스, SK케미칼)\n<코로나 19 백신 이슈 간단 요약> 1. 10월 12일 사회적 거리두기 1단기 하향 조치 이후 12일 확진자 102명(국내 69명, 해외 33명)으로 발표 2. 글로벌 백신 기업 중 모더나(3상), 아스트라제네카(2/3상), 화이자&..\neast-june.tistory.com']",3,https://kin.naver.com/qna/detail.naver?d1id=8&dirId=80101&docId=371163370&qb=67Cx7Iug&enc=utf8&section=kin&rank=171&search_sort=3&spq=0,"연애, 결혼"
17,2020.10.19,[],삼성을 위한 클리너 업데이트 이건 뭔가요?,"자꾸 이게 뜨던데, 설치 해야 하는건가요,

아님 제 폰이 문제가 있는건가요?

만약에 문제가 있다면 어떻게 해야 하나요?",['악성 광고 입니다.\n그거 설치 누르면 바이러스 설치되서 핸드폰 골로갑니다.\n절대로 누르지 말고 나가시길 바랍니다.\n만일 설치 눌렀다면 백신돌려보시거나 초기화 해주시길 바랍니다 :)\n그리고 바이러스가 발견되면 삼성이 소프트웨어 업뎃으로 펌을 올리지 저렇게 갑자기 팝업으로 올리지 않아요.\n저런거 전부 광고니 무시해 주세요~'],1,https://kin.naver.com/qna/detail.naver?d1id=1&dirId=107040201&docId=371164804&qb=67Cx7Iug&enc=utf8&section=kin&rank=170&search_sort=3&spq=0,삼성
19,2020.10.19,[],TMhardware.sys가 뭐하는 파일이죠?,"시스템 파일에 보니까 있던데 윈도우 디펜더에서 바이러스로 잡더라구요
이게 제가쓰는 프로그램에서 깔린 파일인건지 진짜 트로이목마 바이러스인지 모르겠는데 이 파일에 대해 아시는 분 있나요?",['일단 백신프로그램을 받아서 깔아보신뒤에 윈도우 디팬더 명이 안나오면  윈도우 디팬명 오진입니다...'],1,https://kin.naver.com/qna/detail.naver?d1id=1&dirId=11002&docId=371122573&qb=67Cx7Iug&enc=utf8&section=kin&rank=187&search_sort=3&spq=0,바이러스
19,2020.10.19,['#유원대'],보건행정학과 면접 질문이요,"최근 보건행정에 관련된 책이나 뉴스나 영화 알려주세여ㅠㅠㅠㅠ
 ","['최근 상온 노출 독감 백신에 대해\n알아보심이 좋을 것 같습니다.\n보건행정학과로 지원한다면\n면허취득이 가능한 4년제 대학교인\n유원대학교도 함께 알아보시기 바랍니다.\n유원대 수시 : 상위 9개 과목 60 + 면접 40\n유원대 정시 : 4과목 선택(탐구1과목) 60 + 면접 40\n*수능 미응시자 지원 가능 / 국사 선택 가능*\n평균등급이 낮더라도 면접으로 커버가\n가능하고 등급이 상향으로 나오니\n유원대식 등급을 산출하여 \n지원해 보시기 바랍니다 \n● 최초합 150만원 장학지급\n● 서울시 산하 의료원과 산학협력\n● 의료정보관리사 면허증 취득\n● 국가공인 병원행정사,건강보험사취득\n● 제약회사 마케팅 및 국제의료코디네이터\n● 손해사정사 및 CKLU 금융보험과목\n● 손사계열MOU 취업보장학과\n● 신입학생 전원 기숙사진원 \n존재하지 않는 이미지입니다.\n유원대학교\n유원대학교 입시상담^^ 입시(수시,정시,편입학)에 관련하여 궁금한 분들은 언제든지 문의주세요.\npf.kakao.com']",1,https://kin.naver.com/qna/detail.naver?d1id=11&dirId=11050402&docId=371129436&qb=67Cx7Iug&enc=utf8&section=kin&rank=186&search_sort=3&spq=0,사회과학대학
19,2020.10.19,"['대상포진', '대상포진예방접종', '#대상포진예방접종']",대상포진 예방접종,"대상포진 20대에도 예방접종 맞아도 되나요?
요즘은 젊은 나이에도 많이 걸려서 맞고싶은데요
50대부터만 맞을 수 있는건 아닌걸로 아는데
20대에 맞으면 효과가 없는건가요?
있다면 어느정도 가는지.. 재접종은 언제 해야하는지 궁금합니다","['효과 있으니 맞으세요 전 50대 인대도 맞음!', '대상포진은 전염될 수 있습니다. 초기증상이 보인다 생각되시면 \n얼른 병원으로 가셔서 치료를 받으시는 것이 좋습니다. \n아래 글 참고하시면 도움이 될 것 같아서 첨부해드릴게요.\n대상포진병원 어떤과로 가나요? 전염되나요?\n 안녕하세요. 리상입니다. 여러분 혹시 대상포진 이라는 병에 대해 들어본 적 있으신가요?? 찬바람이 불기 시작하는 10월부터 대상포진으로 인해 병원을 찾으시는 분이 많아진다고 합니다. 오늘은 대상포진이라는..\ninfosol.tistory.com', '20대에 예방접종을 하셔도 효과가 있습니다.  ^0^, 미리 맞으시면 안전합니다.  ^0^      ^-^      ^0^,', '안녕하세요. 성남시 수진역 4번출구 인근에서 성인예방접종(폐렴, 대상포진, 자궁경부암-가다실)을 중점적으로 치료하는 산부인과 전문의 변재광 입니다. \n수두 앓은 적 있는 중년은 대상포진 예방접종 필요한데요.\n코로나 사태로 백신의 필요성이 더욱 중요해진 이때, 백신은 면역이 약한 유·소아들만 접종하는 것으로 생각하기 쉬운데, 고령층은 물론 성인도 백신 접종 대상의 예외가 아닙니다. 유년기에 수두를 앓은 적이 있다면, 치료 후에도 사라지지 않고 척수 속에 잠복해 있던 바이러스가 면역력이 약해지면서 대상포진으로 발병하게 됩니다. \n50대 이상 연령이 접종 대상이지만, 개인의 면역력에 따라 젊은 연령층에서도 환자가 빈번히 발생하고 있습니다. \n2019년 경우 찬바람이 부는 11월 초부터 지자체별로 벌써 어린이 수두 환자가 작년보다 35% 이상 늘어난 곳도 있다고 합니다. 어린이에게 잘 발생하는 수두는 감염되면 미열을 시작으로 온몸에 발진성 수포가 1주일가량 나타나는 데 수두는 환자의 피부 접촉이나 호흡기 분비물을 통해 감염되며, 날씨가 추워지는 11월부터 이듬해 1월 사이 많이 발생하기 때문에 따라서 외출 후에는 손을 깨끗이 씻어야 하고, 아동 보호자는 생후 12~15개월에 예방접종을 놓치지 말고 지금이라도 접종을 해주어야 합니다.\n수두균은 어른에게 발병할 때 더욱 치명적인 대상포진으로 나타나는 데 유년기에 수두를 앓은 적이 있다면, 치료 후에도 사라지지 않고 척수 속에 잠복해 있던 바이러스가 면역력이 약해졌을 때 대상포진으로 발병하기도 합니다. \n대상포진은 처음에는 두통, 호흡곤란, 복부 통증, 근육통 등으로 시작되지만, 수일 내에 물집이 나타나면서 대상포진임을 알게 되는데 치료를 위해서는 항바이러스제를 신속하게 복용하는 것이 중요합니다.\n대상포진은 지독한 통증으로도 유명한데, 신경을 타고 바이러스가 이동하면서 어느 부위에 발병하느냐에 따라 뇌수막염, 시력저하, 청력저하, 관절 신경통 등의 합병증이나 후유증을 남기기도 하는 무서운 질병입니다.\n따라서 영유아기부터 유년기에 수두를 앓은 적이 있다면, 대상포진 예방접종은 미리 해 두는 것이 좋구요. 백신은 대상포진을 유발하는 바이러스의 재활성화를 방지하여 대상포진과 대상포진 후 신경통을 예방해 주기 때문입니다.\n대상포진 외에도 춥고 건조한 계절에는 폐렴을 예방하기 위한 폐구균 예방접종도 필요합니다. 폐구균은 폐렴, 패혈증, 뇌막염의 원인이 되고, 축농증과 중이염도 일으키는 균이라서, 겨울을 잘 나기 위해서는 예방접종을 해 주는 것이 좋습니다. 65세 이상 연령대는 보건소에서 무료 접종이 가능하지만, 보다 여러 가지 폐구균 예방 효과를 얻을 수 있는 프리베나13 등을 접종하고 싶다면 가까운 병의원을 방문하면 됩니다.\n대상포진이나 감기 및 폐렴 같은 감염성 질환은 면역력이 저하될 때 생기는 질환인 만큼, 외출 후에는 반드시 손을 깨끗이 씻고 예방접종을 해두는 것이 필요합니다. 평소 면역력 관리를 위해 건강한 식습관과 규칙적인 운동, 금연과 절주 등 건강한 생활습관을 유지하는 것도 겨울을 건강하게 나는 방법입니다.\n독감 예방 접종을 받으면 의사가 증상을 보고 코로나19 진단을 내리는 데 도움이 될 수 있고 유아 등 취약계층에 독감이 퍼지는 것도 예방할 수 있습니다. 독감 백신으로는 코로나19를 예방할 수 없지만, 독감 예방 주사는 보통 면역력을 강화시키는 쪽으로 작용하기 때문에 일반적으로 건강에 도움이 됩니다. 심한 독감에 걸리면 코로나19를 포함한 다른 질병에 더 취약해질 가능성이 높습니다. 가족 단위 예방접종으로 본인과 가족의 건강을 지켜주세요.\n폐렴은 독감의 대표적인 합병증으로 독감 백신을 접종할 때 폐렴 백신도 함께 접종하는 것이 좋구요. 또 폐렴구균 백신이 코로나 19 예방주사는 아니지만 2차로 올 수 있는 폐렴구균 폐렴이나 폐렴구균 감염 합병증을 예방하는 데 도움이 됩니다.\n면역력을 생각하면 자궁경부암예방접종도 생각하셔야 하는 데요. 성관계시 인유두종바이러스를 옮길 수 있으므로 남성분도 함께 맞으시는것을 권합니다. 요즘 자궁경부암예방백신의 광고모델에 남성이 주인공으로 나오고 있죠. \n인유두종바이러스(HPV)는 성적 접총을 통해 주로 전염되며 성생활을 하는 남녀 누구나 감염될 수 있는 바이러스로 성인인구의 70%는 일생동안 한번의 생식기 HPV감염을 경험할 수 있습니다. HPV는 자궁경부암의 약 70%, 여성 생식기사마귀(곤지름, 콘딜로마)의 약 90%의 원인으로 알려져있습니다. \n2006-2011년 만 18-79세의 우리나라 성인 여성 6만명 대상 조사 결과, 평균 약 3명 중 1명에서 HPV 감염이 보고되었고 그중 만 18-29세의 젊은 여성에서 가장 높은 약 50%에 가까운 높은 HPV 유병률을 보였습니다. 미국에서는 성생활을 하는 여성 중 50세가 될 때까지 HPV에 감염될 수 있는 비율이 80% 이상이라고 예측하고 있습니다.\n자궁경부암 예방접종은 미혼이나 관계를 시작하기 전에 접종할 수록 효과가 높습니다. 그리고 기혼자나 성관계를 하신 분들에게 성관계 경험이 있는 경우도 70~80%의 예방효과가 있습니다.\n코로나19 시대에 면역력을 위해서 예방접종을 빠뜨리지 마세요. ', '맞으셔도 상관은 없습니다.\n하지만 면역력에 크게 문제가 있는 상태가 아니시라면 20대의 경우 권장하지는 않습니다.\n대상포진 예방접종은 대게 50대 이상에게 권장되고 있고,\n50대 이후에는 조금이라도 빨리 맞는 것이 예방 효과가 크다고 합니다.\n아래에 대상포진 예방접종 관련 글을 확인해보시면 도움이 되실 것 같아요.\n그럼 건강하세요!\nhttps://dotworks.tistory.com/61\n대상포진 예방접종 가격과 시기\n대상포진이란 무엇일까? 대상포진은 수두-대상포진 바이러스가 몸속에 잠복상태로 존재하고 있다가 다시 활성화되면서 발생하는 질병입니다. 보통은 수일 사이에 피부에 발진과 특징적인 물집 형태가 나타나고 해..\ndotworks.tistory.com']",5,https://kin.naver.com/qna/detail.naver?d1id=7&dirId=7010107&docId=371135509&qb=67Cx7Iug&enc=utf8&section=kin&rank=185&search_sort=3&spq=0,감염내과
19,2020.10.19,"['백신', '코로나백신', '독감백신']",백신 고민,"백신을 미루고 미루면서 안맞았는데 뉴스에 보니까 백신맞고 즉사 했다는 뉴스가 나오네요;
맞을까요 말까요
엄청 고민되네요","['저도 백신을 맞을까 말까 계속 고민하다가 지금까지 안맞았는데 일단 상황을 더 지켜보고 결정하는게 좋을것 같습니다! 근데 코로나 예방을 위해서 마스크도 철저히 쓰고 손도 잘 씻는만큼 백신 또한 예방이 될것같아서 만약 백신이 정말 위험하다는 결과가 나오면 그냥 맞지않아도 될것같아요~', '백신 예방 접종은 선택입니다.\n물론 접종을 하더라도 체내에서 그 영향을 끼치는건 겨우 6개월 정도로,\n불안하신 마음이 생기신다면 안맞고 넘어가셔도 크게 문제는 없을 것 같습니다.\n받으셔도 되지만, 올 겨울만큼은 개인 건강 관리 잘 하시며 넘어가는 것도 좋을것 같네요.\n관련 자료 첨부드립니다.\nhttps://hello-onl.tistory.com/131\n독감 백신 예방접종 후 음주, 목욕, 운동 가능여부 및 발열, 간지럼 증상 등 이상 증상 조치\n독감 백신 예방 접종 이제 10월도 중순이 지나가고 있습니다. 아침저녁으로 쌀쌀하던 날씨가 어느새 낮 시간까지도 찬 기운이 느껴지는데요. 10월~11월은 독감 예방 접종을 받아야 하는 시기로 한 겨울 독감이 유..\nhello-onl.tistory.com']",2,https://kin.naver.com/qna/detail.naver?d1id=7&dirId=7010107&docId=371139708&qb=67Cx7Iug&enc=utf8&section=kin&rank=183&search_sort=3&spq=0,감염내과
19,2020.10.19,"['박보영', '보영']",( 박보영 ) 보영배우가 18일 브이라이브에서 독감백신 맞는다고 얘기했나요 ?,"기억하시는분 있을까요 ,","[""위에 질문주신 내용은 정확히 모르겠네요. 혹시나 아래 내용도 참고해보시면 좋을 것 같습니다.\n무료독감 백신 예방접종 및 신청방법 대해서 정리하였습니다. 한번 참고해 보시면 도움이 될 것 같습니다. 도움이 되셨다면 채택 부탁드립니다.\n▼ 무료 독감 백신 예방 접종 신청방법 (++홈페이지 링크)\nhttps://info.dinoa.xyz/140\nhttps://realtime.dinoa.xyz/362\n무료 독감 백신 예방 접종 신청방법 (++홈페이지 링크)\n하늘 아래 다양한 정보를 전달하는 하 늘 정 보 입니다. 오늘은 '무료 독감백신 예방접종' 에 대해서 알아보겠습니다. 목차 2020년 무료 독감백신 예방접종 신청방법 국가에서는 '인플루엔자 국가예방접종 지..\ninfo.dinoa.xyz"", '안녕하세요~!!\n코로나19로 인해 뒤숭숭한 요즘\n정부에서 독감 무료접종을 실시한다고 합니다.\n무료접종 관련 자세한 내용은 아래글을 참고해보세요~!!\n▼독감 무료접종 예방접종 바로가기', ""위에 질문주신 내용은 정확히 모르겠네요. 혹시나 아래 내용도 참고해보시면 좋을 것 같습니다.\n무료독감 백신 예방접종 대해서 정리하였습니다. 한번 참고해 보시면 도움이 될 것 같습니다. 도움이 되셨다면 채택 부탁드립니다.\n▼ '무료 독감 백신 사망자 계쏙 발생' 이대로 괜찮은가? (++보건복지부 입장)\nhttps://info.dinoa.xyz/158\n전국 16명 사망 무료 독감 백신 이대로 괜찮은가? (++보건복지부 입장)\n무료 독감 백신 안전한가? 목차 11번째 사망자 발생 대전에서 독감 백신을 맞은 후 의식 불명에 빠졌던 70대 여성이 끝내 숨졌습니다. 대전에서 독감 백신 접종 후 숨진 두 번째 사례입니다. 전국에서는 11번째입..\ninfo.dinoa.xyz""]",3,https://kin.naver.com/qna/detail.naver?d1id=3&dirId=3031101&docId=371140468&qb=67Cx7Iug&enc=utf8&section=kin&rank=182&search_sort=3&spq=0,영화배우
19,2020.10.19,"['자궁경부암예방주사', '검색질문', '통합검색궁금증', '통합검색질문하기']","자궁경부암백신을 맞았는데 10년되었어요 남자친구보고 맞으라고 해서 권유했는데 같이 가보니 백신주사를 같이맞아야 한다고
의사선생님께서 몇가지 맞았었냐고 물어보셔서요


근데 그게 무슨주사였는지 기억이 나지도 않고
그 의원은 없어졌다고하고 정확한 정보좀 알고싶어요

2달전부터 생리를 안해서 가보니
우선 이제 배란일이라 하고
피검사랑 소변검사하니 다행히 여성호르몬수치는 정상이라고 나왔어요..

최근에나온 9가지 주사를 맞는다는데 남자친구는
그 백신주사를 맞는다네요

진단기록을 확보하려면 어떻게 하면 좋을까요..
또 백신주사기록은 공단에 물어봐야 하는지 궁금하네요",,['안녕하세요~! 반갑습니다!\n많은분들이 궁금해 하시는 해당 글이 도움이 될까 하여 자궁경부암 총정리글 첨부해 두고 가겠습니다!\n참고하셔서 조금이라도 도움이 되셨으면 합니다^^\n항상 좋은 일들만 가득하길 바랍니다!\n▼자궁경부암 관련글 총정리 바로가기\n   '],1,https://kin.naver.com/qna/detail.naver?d1id=7&dirId=7011404&docId=371145702&qb=67Cx7Iug&enc=utf8&section=kin&rank=181&search_sort=3&spq=0,여성질환
18,2020.10.19,['독감'],스카이셀플루4가 독감도 위험한건가요?,"저번달에 SK바이오사이언스의

스카이셀플루4가 독감주사 맞았는데

오늘 국가백신맞은 사람이 죽었대서요

이것도 위험한건가요?","['안녕하세요~~! 최근 독감주사로 인해 사망사건이 발생했다고 합니다... 독감주사 맞기전에 어디제품인지 확인하고 맞으시는걸 추천드립니다... 그게 더욱 안전하니까요 ㅠㅠ저도 이곳저곳 알아보고 여러글 살펴보다가 독감 예방접종 시기 가격 정리 ,무료로받는 꿀팁까지!!잘 정리된곳이 있어서 정보드립니다~!\n고민 해결하시는데 도움이 되었으면 하는 바램입니다. 기타 궁금하신 점은 아래 링크 남겨드릴테니 참고하시면 도움이 되실 것 같네요.\n▼독감주사 사망 가장 충격적인 이유(+성분 부작용 두통 신성약품 인천)\nhttps://speedsalgoo.tistory.com/683▼독감\n독감주사 사망 가장 충격적인 이유(+성분 부작용 두통 신성약품 인천)\n독감주사 사망 가장 충격적인 이유(+성분 부작용 두통 신성약품 인천) 인천에서 17세 청소년이 독감백신을 맞고 이틀 뒤 사망한 사례가 확인됐습니다. 정은경 정부 중앙방역대책본부장은 2020년 10월 1..\nspeedsalgoo.tistory.com\n▼독감 예방접종 시기 가격 정리 (+ 독감 무료접종 대상자 예약기간)\nhttps://speedsalgoo.tistory.com/485\n독감 예방접종 시기 가격 정리 (+ 독감 무료접종 대상자 예약기간)\n가을이 되면서 독감과 신종 코로나바이러스 감염증의 동시 유행을 뜻하는 더블 팬데믹에 대한 우려가 커지고 있습니다. 정부는 독감과 코로나 19 환자가 뒤섞일 경우 방역 체계에 혼란이 올 수 있는 만큼, 올해는..\nspeedsalgoo.tistory.com']",1,https://kin.naver.com/qna/detail.naver?d1id=7&dirId=7010101&docId=371148508&qb=67Cx7Iug&enc=utf8&section=kin&rank=180&search_sort=3&spq=0,호흡기내과
