page,date,tags,questions,questions_add,answers,N_answer,url,category
14,2020.10.20,['#신성약품'],독감주사 사망 신성약품꺼 맞나요?? 사망이유가 뭔가요ㅠㅠ?? 너무 무서워요,독감주사 사망한거 업체 신성약품꺼 맞아요?? 거기 이번에 문제있던곳 아닌가요??? 부작용때문인가요?? 사망률 치사율이 높나요??,"['네 이번 독감주사 사망했는데 더욱 논란이 되는건 신성약품 제품이라고 합니다 ㄷㄷ \n조심하세요 ㅠ\n▼독감주사 사망 가장 충격적인 이유(+성분 부작용 두통 신성약품 인천)\n독감주사 사망 가장 충격적인 이유(+성분 부작용 두통 신성약품 인천)\n독감주사 사망 가장 충격적인 이유(+성분 부작용 두통 신성약품 인천) 인천에서 17세 청소년이 독감백신을 맞고 이틀 뒤 사망한 사례가 확인됐습니다. 정은경 정부 중앙방역대책본부장은 2020년 10월 1..\nspeedsalgoo.tistory.com\n독감 예방접종 시기 가격 정리 (+ 독감 무료접종 대상자 예약기간)\n가을이 되면서 독감과 신종 코로나바이러스 감염증의 동시 유행을 뜻하는 더블 팬데믹에 대한 우려가 커지고 있습니다. 정부는 독감과 코로나 19 환자가 뒤섞일 경우 방역 체계에 혼란이 올 수 있는 만큼, 올해는..\nspeedsalgoo.tistory.com', '독감주사 사망\n무료백신 독감주사 맞은 17세 학생이\n사망했습니다.\n또한 사망한 청소년이 맞은 백신은 신성약품이 공급한 국가조달 백신이지만, 유통상 상온 노출 등의 문제가 없어 회수 대상이 아니었다고 정부는 밝혔다.\n이날까지 독감백신 관련 이상반응 신고는 총 353건이었다. 주사부위 통증 등 국소반응 98건, 알레르기·피부발진 등 99건, 발열 79건, 기타 69건 순이었다.\n독감백신 상온노출 (상온노출 백신 부작용)\n무료독감 상온노출 상온노출 백신 지역 (부작용 증상) _ 사건의 시작 질병관리청이 독감 백신의 무료 접종 시행을 하루 앞두고 안전상의 이유로 전면 중단했다. 일부 업체가 냉장 상태를 유지해야하는 백신을 상..\nzero-news.tistory.com\n= 정부는 문제 없다 하지만\n사람들은 아직도 상온노출 사건을 의심한다 합니다...', '근데 약품은 녹십자에서 구매해온 겁니다.\n구매해온 이후 상온노출로인한 관리소홀인것인지\n아니면 애초에 녹십자 백신이 문제인건지 아직 모릅니다', ""정말 너무무섭네요..\n[독감 백신] 예방접종을 맞으면 안되는 사람들\n독감 백신을 맞고 16일 오전에 사망한 17세 남성 사망원인 조사 중 질병관리청, '사망자\ndailyfeed.kr"", '반갑습니다.중한번역업체 위드노마드입니다.\nhttps://with.muv.kr/\n위드노마드\n해외구매대행 중문 상세페이지 전문 번역 및 포토샵 작업 회사 입니다\nwith.muv.kr\n저도 아이가있는 엄마이고 저랑 아이들모두 신성약품으로\n독감주사를 맞았습니다.\n현재까지는 독감 백신 맞은 2일 후 사망이라, 독감 사망으로 알려져있지만 역학조사중이라\n확실히 정확한 사인에 대해서는 조사가 필요할 것으로 보여집니다.\n그리고 질문하신대로 현재 신성약품의 백신으로 언론에 나와있고 많은분들이 맞으신걸로\n알고있습니다.\n자세한 내용은 아래의 뉴스기사 남겨드려요.\nhttps://www.sedaily.com/NewsView/1Z96XJ1HRY\n신성약품 독감백신 맞은 17세 男 사망\n신성약품이 유통한 인플루엔자(독감) 백신을 맞은 10대가 사망했다.정은경 질병관리청 청장은 19일 독감 백신 수급 및 접종 상황 브리핑에서 “올해 독감 백신을 접종한 뒤 신고된 이상 반응은 총 353건으로 이 가운..\nwww.sedaily.com\n도움이 되셨기를 바랍니다']",5,https://kin.naver.com/qna/detail.naver?d1id=7&dirId=70122&docId=371188951&qb=67Cx7Iug&enc=utf8&section=kin&rank=137&search_sort=3&spq=0,응급의학과
14,2020.10.20,['#영화제목찾기'],뱀파이어 영화 내용인데 제목이 기억이 안나요 오래된 영화입니다,"잘은 기억은 안나는데 뱀파이어들이 우글거리고
어떤사람이 미션인가 뭔가를 받는데 무슨 가방을 갖고오라고 했었던것 같아요
근데 거기엔 어떤 어린 소년인가 소녀가 있었는데
그아이가 인간백신 비스무리 한것 같았어요 이 아이를 보호하려하고
뱀파이어는 이 아이를 없애고 싶어한것 같았어요
이 아이를 물면 뱀파이어는 인간이 되는 영화
나중에 뱀파이어가 이 아이를 물었는데 그 뱀파이어가 인간이 되고
인간이 되버린 것을 다른 뱀파이어가 보고는 또 달려들어 물어서 인간이 되고
막 그랬었던것 같아요","['울트라바이올렛\n감독\n커트 위머\n출연\n밀라 요보비치\n개봉\n2006. 07. 20.', '울트라바이올렛\n감독\n커트 위머\n출연\n밀라 요보비치\n개봉\n2006. 07. 20.\n데이브레이커스\n감독\n마이클 스피어리그, 피터 스피어리그\n출연\n에단 호크, 윌렘 대포, 이사벨 루카스, 샘 닐\n개봉\n2010. 03. 18.\n두 영화를 섞어서 기억하시는 것 같습니다. 울트라바이올렛과 데이브레이커스의 내용입니다.']",2,https://kin.naver.com/qna/detail.naver?d1id=3&dirId=30305&docId=371189045&qb=67Cx7Iug&enc=utf8&section=kin&rank=136&search_sort=3&spq=0,"공포, 스릴러 영화"
14,2020.10.20,[],바이러스 검사중 gen variant graftor이 발견됐는데..,"트로이목마라고 하더라고요

실행했을 시 위험한 거죠??

실행안하고 바로 삭제했다면 괜찮은거죠??",['백신으로 검사해서 진단되서 검사해서 나와서 치료/삭제 나오면 괜찮은거고요..\n그냥 실행 안하고 삭제 해도 무방합니다..그럼 '],1,https://kin.naver.com/qna/detail.naver?d1id=1&dirId=11002&docId=371190847&qb=67Cx7Iug&enc=utf8&section=kin&rank=134&search_sort=3&spq=0,바이러스
14,2020.10.20,[],강아지 첫 접종 종합백신 주사할려는데 주사량은 몇cc인가요?,"소형견이고 시골이라 동물약국에서 종합백신 사와서 맞혀야 합니다.
그런데 주사기에 넣어보면 끝까지 가득 주사약이 차는데 몇cc주사하면 되나요?
뭘 맞히라는건 있어도 몇cc맞히라는건 없네요ㅠㅠ",['백신 한병 1ml입니다.\n한병 전체 다 주사하면 됩니다'],1,https://kin.naver.com/qna/detail.naver?d1id=8&dirId=8050105&docId=371191739&qb=67Cx7Iug&enc=utf8&section=kin&rank=133&search_sort=3&spq=0,"미용, 건강관리"
14,2020.10.20,"['트로이목마', '트로이목마바이러스', '트로이목마_치료', '트로이목마치료', '트로이목마바이러스알약', '트로이목마없애기']",트로이 목마 질문입니다..,"오늘 압축파일을 하나 내려받았는데,
그게 실행파일인 .exe 파일이 들어있는 압축파일이였습니다.

그리고 압축파일을 받고 압축을 푸는데
알집이 gen:variant.midie.71687 라는 악성코드를 잡은겁니다.

이녀석 이거 일단 지우고나서 로그에 남아있길래 
검색해보니 Trojan.Win32.Agent.4!c 라고해서 트로이목마네 싶었는데,

여기서부터 질문입니다.

1. 압축파일을 푸는 과정에서 악성코드가 적발되어 바로 지워버렸습니다.
.exe파일을 실행하지 않은 상태라서 혹시 바이러스가 감염되지 않았을까요?

2. 알집과 KISA 인터넷보호나라 & KrCERT ( 한국과학기술정보통신부와 한국인터넷진흥원이 여는곳 ) 라는 곳에서 제 트로이 목마 코드를 치료하는 프로그램을 제공하여
( https://www.krcert.or.kr/download/dedicatedVaccine/download.do ) 구동해서 검사한결과 또 아무것도 뜨지 않았습니다.

위으 두 가지 사항을 종합하였을때, 악성코드가 적발되어 인식하고 지우는데까지 걸린시간은 10초 남짓,
컴퓨터에 이상이 없을까요?","['프로그램 감염되지 않은상태에서 삭제 되면 윈도우 자체에 아무런 영향이 안생깁니다...\n만일 불안하시다면 백신하나 까신뒤에 진단을 해보시기 바랍니다.', 'https://malzero.xyz/\nMalware Zero - 무료 악성코드 제거 도구\n악성코드 및 애드웨어 등 각종 유해 프로그램에 의한 고통에서 해방되기 위해 설치 없이 사용 가능한 무료 악성코드 제거 도구\nmalzero.xyz\n사용해보세요']",2,https://kin.naver.com/qna/detail.naver?d1id=1&dirId=11002&docId=371192179&qb=67Cx7Iug&enc=utf8&section=kin&rank=132&search_sort=3&spq=0,바이러스
14,2020.10.20,[],꿈 해몽좀...,꿈에서 제가 어떤 병원의 직원이었는데요. 저 말고도 다른 직원이 2명이나 더 있었는데... 그러니까 3명이서 병원에 있었죠. 그런데 갑자기 정확한 수는 모르겠는데 열명이상의 사람들이 들어와서 자기들 멋대로 방에 들어가 티비를 보고 어지르고 병원 컴퓨터를 켜고 여튼 어지르면서 제멋대로 구는 거에요. 나가라고 해도 무시하고요. 그래서 경찰을 불렀는데 제가 어디 갔다 온 사이 경찰이 와서 다 데리고 나갔더라고요. 그러면서 여기저기 건물 타일도 깨진 것을 보고 이거 어떻게 하나 이러다 깼는데.. 이 이상한 꿈 뭔가요 ? ,"['질문자님이 언젠가 영화나, 드라마, 소설 같은데서 아니면 현실에서 병원을 방문했을 때 어떤 강한 연상작용으로 그 병원 장면이 뇌리에 남았을겁니다.\n사람의 뇌라는 것은 아주 신비하고 오묘하여 많은 것을 기억하고 저장합니다. 마치 컴퓨터 하드디스켓처럼요  그런데 무한정 뇌를 굴릴수는 없고  다음날 또 다른 작업을 위하여 잠자는 동안  렉에 걸린 파일, 바이러스 감염된 파일 등을 찾아서 백신을 놓아주는 작업을 합니다.\n그 과정에서 우리의 꿈속이 혼란스럽게 과거의 기억, 어떤 자극적이거나 인상적으로 저장된 기억의 조각들을 제 자리로 배치하는 과정에서 꿈으로 나타나는 경우가 아주 많습니다.\n꿈은 꿈일뿐입니다. 현실과는 많이 틀립니다.  큰 의미두지 마시고 상쾌한 하루 시작하기 바랍니다.']",1,https://kin.naver.com/qna/detail.naver?d1id=3&dirId=31505&docId=371193670&qb=67Cx7Iug&enc=utf8&section=kin&rank=131&search_sort=3&spq=0,"꿈, 해몽"
13,2020.10.20,[],열은 없고 목감기 기운이 있는데 담날b형 예방접종3차를 맞아야하는데 갠찮은가요??,,['감기완쾌 후 백신접종이\n좋을듯싶네요\n내과캐어하세요\n도움줄거로봅니다.'],1,https://kin.naver.com/qna/detail.naver?d1id=7&dirId=7010104&docId=371194180&qb=67Cx7Iug&enc=utf8&section=kin&rank=130&search_sort=3&spq=0,혈액종양내과
13,2020.10.20,[],이번에 독감 예방주사 안전할까요?,가족이랑 같이 맞으러 가는데 학생이 죽었다는 뉴스를 보고 걱정이 됩니다.,"['독감백신은 맞아야되는거네요\n일부 뉴스에서 사고가 있었지만\n사고 원인은 여러가지 원인일 수 있습니다\n참고되시기바랍니다.', ""아래를 꼭 보시고 맞아야합니다..사망사고도 있고..무섭네요\n[독감 백신] 예방접종을 맞으면 안되는 사람들\n독감 백신을 맞고 16일 오전에 사망한 17세 남성 사망원인 조사 중 질병관리청, '사망자\ndailyfeed.kr""]",2,https://kin.naver.com/qna/detail.naver?d1id=7&dirId=7010101&docId=371194295&qb=67Cx7Iug&enc=utf8&section=kin&rank=129&search_sort=3&spq=0,호흡기내과
14,2020.10.20,"['독감백신', '주사', '스카이셀플루4가프리필드시린지']",유료 독감백신은 괜찮나요 ㅠ,어제 유료로 sk스카이?백신 맞았는데 이건 문제 없는건가요?괜찮은건가요..?,"['네.. 그건 괜찮아요\n안내자료보면 이번 상온노출 등 문제 독감 악품은\n독감백신 상온노출 (상온노출 백신 부작용)\n무료독감 상온노출 상온노출 백신 지역 (부작용 증상) _ 사건의 시작 질병관리청이 독감 백신의 무료 접종 시행을 하루 앞두고 안전상의 이유로 전면 중단했다. 일부 업체가 냉장 상태를 유지해야하는 백신을 상..\nzero-news.tistory.com\n무료백신 중에 신성약품 만 으로 나옵니다.', '현재 독감백신으로 인한 사망인지 여부조차 밝혀지지 않은 상태이기 때문에 괜찮은지 말할 단계는 아니지만 일단 문제가 발생한 것은 신성약품 것이므로 해당되지 않으니 괜찮다고 보시는 게 맞겠습니다.\n접종 후 1~2일 이내에 발열, 통증, 몸살 등의 증상이 발현될 수 있습니다. 증상이 수 일 지속되면 가까운 병원에 방문하시는 것이 좋습니다.\n예방접종 후 주의사항\n접종 당일과 다음날은 과격한 운동을 하지 않도록 조심시켜야 합니다.\n접종 당일은 목욕을 하지 않습니다.\n접종부위는 청결하게 합니다.\n접종 후 고열, 경련 등이 있을 때에는 의사의 진찰을 받도록 합니다.\n접종 후 15～30분 정도 부작용의 여부를 관찰하도록 합니다.\n독감 무료접종 대상 완벽정리(최신)\n독감 무료접종 대상 완벽정리(최신) 요즘 독감 무료접종이 핫이슈입니다. 바로 상온 노출로 인한 변질의 우려와 해당 물량이 풀리게 되면서 자칫 변질된 백신을 투여받게 되는게 아닌가 하는 불안감 때문에 더욱..\nkingthecarrot.tistory.com', '안녕하세요~~! 최근 독감주사로 인해 사망사건이 발생했다고 합니다... 독감주사 맞기전에 어디제품인지 확인하고 맞으시는걸 추천드립니다... 그게 더욱 안전하니까요 ㅠㅠ저도 이곳저곳 알아보고 여러글 살펴보다가 독감 예방접종 시기 가격 정리 ,무료로받는 꿀팁까지!!잘 정리된곳이 있어서 정보드립니다~!\n고민 해결하시는데 도움이 되었으면 하는 바램입니다. 기타 궁금하신 점은 아래 링크 남겨드릴테니 참고하시면 도움이 되실 것 같네요.\n▼독감주사 사망 가장 충격적인 이유(+성분 부작용 두통 신성약품 인천)\nhttps://speedsalgoo.tistory.com/683\n독감주사 사망 가장 충격적인 이유(+성분 부작용 두통 신성약품 인천)\n독감주사 사망 가장 충격적인 이유(+성분 부작용 두통 신성약품 인천) 인천에서 17세 청소년이 독감백신을 맞고 이틀 뒤 사망한 사례가 확인됐습니다. 정은경 정부 중앙방역대책본부장은 2020년 10월 1..\nspeedsalgoo.tistory.com\n▼독감 예방접종 시기 가격 정리 (+ 독감 무료접종 대상자 예약기간)\nhttps://speedsalgoo.tistory.com/485\n독감 예방접종 시기 가격 정리 (+ 독감 무료접종 대상자 예약기간)\n가을이 되면서 독감과 신종 코로나바이러스 감염증의 동시 유행을 뜻하는 더블 팬데믹에 대한 우려가 커지고 있습니다. 정부는 독감과 코로나 19 환자가 뒤섞일 경우 방역 체계에 혼란이 올 수 있는 만큼, 올해는..\nspeedsalgoo.tistory.com', ""사망사고도 있고요즘 너무 무섭네요..아래 꼭 보시고 맞으세요ㅠ\n[독감 백신] 예방접종을 맞으면 안되는 사람들\n독감 백신을 맞고 16일 오전에 사망한 17세 남성 사망원인 조사 중 질병관리청, '사망자\ndailyfeed.kr""]",4,https://kin.naver.com/qna/detail.naver?d1id=1&dirId=10802&docId=371187203&qb=67Cx7Iug&enc=utf8&section=kin&rank=140&search_sort=3&spq=0,초고속인터넷
16,2020.10.20,"['독감예방접종', '독감예방주사', '독감예방주사부작용', '항생제', '역류성식도염', '감기', '독감', '예방접종']",독감 예방 접종 있잖아요,18살 여자인데요 살면거 독감 예방 접종을 한번도 안맞아봤거든요? 그리고 이번 년도 들어서 몸이 많이 아프고 감기도 엄청 잘 걸리고 한번 걸리면 몇달 가고 막 이럴만큼 몸이 안좋았구요. 이번년에만 병원을 여러곳을 다니며 감기약 여러종류 그리고 역류성 식도염약 축농증약 비염 등등 특히 받는 약마다 항생제도 들어있었고 그걸 꾸준히 먹었었어요 그리고 시험기간이기도 해서 스트레스도 많고 운동량도 적고 식습관도 좋지않습니다 .... 그래서 지금 아마 면역력이 최고바닥일텐데 이 상태에서 독감예방접종 주사 맞아도 되는걸까요? 처음엔 부작용에 대해서 공포감이 조금 있었지만 이번에 예방 주사 맞고 사망했다는 기사를 듣고 더 불안하고 무섭네요... 안맞는게 맞을까요? 진짜 진지하게 답변해주세요 너무 무섭거든요....ㅠㅠㅠㅠㅠㅠㅠ,"['1. 독감주사는 의무가 아닌 선택 입니다.\n2. 독감이 코로나 만큼 무서운거 아시죠..?\n개인적으로 맞길 바랍니다...\n<독감 무료접종 대상> 독감 예방접종 대상자\n독감 예방접종 무료대상 3가 4가 2020 독감 무료접종 대상자 조회/기간 _ ■독감 무료접종 대상 2020년 9월 8일부터 어린이와 임신부, 어르신을 대상으로 무료 독감 예방접종이 시작된다. 2020년은 올해는 중고생..\ndingdo.tistory.com', '1. 면역력이 최고 바닥일때 맞지 마시고 되도록 건강을 회복하여 접종하는 것을 권장드립니다.\n2. 사망에 대한 불안감이 크다면 현재 부검중이라고 하니 완전한 결과가 나온 후 접종하시면 될 듯합니다. \n저도 3일전에 맞았는데 그냥 편하게 생각하고 있습니다. 현재까지 무료접종만 900만명이 접종하였고 예전에도 매년 2~3천만명씩 맞는게 독감백신인데 독감백신으로 죽은건 확률이... 비행기가 추락할 확률보다 낮지않을까? 하고 말이죠 ㅎㅎ\n독감예방접종 관련 궁금한 점 총정리 (Q&A)\n지난 9월부터 독감예방접종이 시작되면서 독감예방접종에 대한 관심이 날이 갈수록 커져가고 있는 가운데 최근 독감백신의 실온 보관등으로 한차례 접종에 혼선을 빚기도 했었습니다. 이런 저런 이슈들이 더해지면..\nkingthecarrot.tistory.com', ""사망사고도 너무 많아서..정말 아래꼭 보시고맞아야됩니다..\n[독감 백신] 예방접종을 맞으면 안되는 사람들\n독감 백신을 맞고 16일 오전에 사망한 17세 남성 사망원인 조사 중 질병관리청, '사망자\ndailyfeed.kr"", '금년독감 예방접종 탈도 많고 사고도 많네요\n사망사고가 충격적이었는데\n하루 하루 늘어가고 있네요~\n그래서 과연 예방접종해야 하나 말아야 하나 고민도 됩니다.\n그 해답을 소개합니다.\n독감예방접종 해야 한 말아야 하나\n그 전문가의 해답을 알려드립니다\n제가 직접 조사하고 정리한 내용입니다\n참고하세요~~~\nhttps://covid-19.joying.site/2\n독감주사 맞아야 하나? 독감백신사망사고 예방접종 주의사항\n독감백신 예방접종 해야 하나? 정답은 백신부작용의 위험성이 있지만 백신을 안맞을 때 위험성이 더 크다. 1)몸상태를 확인 후 접종하고 접종후 의료기관에서 15~30분 머물라 2)접종당일 심한 운동 피함 3)이상 반..\ncovid-19.joying.site']",4,https://kin.naver.com/qna/detail.naver?d1id=7&dirId=7010101&docId=371182450&qb=67Cx7Iug&enc=utf8&section=kin&rank=151&search_sort=3&spq=0,호흡기내과
1,2020.10.20,[],노트북이 사용중에 꺼져요,"노트북이 갑자기 몆일전 쿨러 돌아가는 소리가 커지기 시작하더니 전원이 나가더라구여..
첨엔 노트북 쿨러쪽에 먼지가 꼇나 하고 청소도 해보고 윈도우까지 재설치를 했는데요
증상이 동일하더라구요.
그레서 노트북을 열어보려 했는데 열진 못하겠고 해서 그냥 다시 써보려다가 백신 설치중에도 동일한 쿨러가 세게 도는 소리가 나길레 작업관리자를 봣더니 cpu사용량이 99%나 되더라구요
백신하나 설치하길...
그러고선 노트북이 꺼져요..
이거 cpu 가 맛이 간걸까요..??

이유는 알거같은데 원인을 모르니 해결방법이 없네여..ㅠㅠ
아시는분 있으면 도와주세요","['cpu점유율이 그렇게 높으면서 쿨러소음 심해지면서 꺼지는거면\ncpu온도가 너무 높아져서 강제종료되는 것 같네요\n청소만으로도 해결이 안되면 서멀구리스 다시 발라봐야 합니다.\n보통 cpu 적정 구동 온도는 30도~60도 사이입니다.\n전원이 강제로 꺼지는 경우는 거의 90도 100도 나온다는 거에요\n쿨러가 고장난거라면 쿨러교체해봐야 하겠지만\n쿨러돌아가는게 문제가 없다면 cpu방열판을 떼서 서멀구리스 닦아내고 다시 발라봐야 합니다.\n온도확인하는 방법은 고클린 다운받아서 설치하시면 cpu, 그래픽온도를 확인할 수 있는 항목이 있습니다.\n부팅해서 아무것도 안하고 있을때 온도도 보시고\n유튜브 영상같은거 하나 틀어서 온도가 얼마나 올라가는지 확인해보시고\n위험온도에 올라간다 싶으면바로 창 닫고 종료해주세요.\n그리고 그전에 중요한 자료 있으면 미리 백업해두시구요\n노트북 씨피유서멀구리스 다시 바라는 건 쉽지 않은 작업이니\n컴터 잘하는 분이나 주변 컴터매장에 맡기시기 바랍니다.']",1,https://kin.naver.com/qna/detail.naver?d1id=1&dirId=1010302&docId=371269769&qb=67Cx7Iug&enc=utf8&section=kin&rank=1&search_sort=3&spq=0,CPU
10,2020.10.20,[],저 어제 독감백신 맞았는데 자다가 죽으면 어떡하죠,진지합니다,['ㅋㅋㅋㅋㅋㅋㅋㅋㅋ안 죽어 ㅡㅡ'],1,https://kin.naver.com/qna/detail.naver?d1id=7&dirId=7010101&docId=371211278&qb=67Cx7Iug&enc=utf8&section=kin&rank=100&search_sort=3&spq=0,호흡기내과
3,2020.10.20,[],아직 독감예방주사맞지도않았는데,"아직코로나때문인지 독감예방주사 맞지도않았어요

독감 맞고난후 어르신처럼 숨멎은거아니죠?",['이번 독감 사망 사건 때문에\n그러신가요?\n문제백신 신성약품등만 피하시면 문제없어요...\n독감백신 상온노출 (상온노출 백신 부작용)\n무료독감 상온노출 상온노출 백신 지역 (부작용 증상) _ 사건의 시작 질병관리청이 독감 백신의 무료 접종 시행을 하루 앞두고 안전상의 이유로 전면 중단했다. 일부 업체가 냉장 상태를 유지해야하는 백신을 상..\nzero-news.tistory.com\n상온노출 사건부터 말이 많네요\n이번 독감....'],1,https://kin.naver.com/qna/detail.naver?d1id=8&dirId=8030404&docId=371253538&qb=67Cx7Iug&enc=utf8&section=kin&rank=28&search_sort=3&spq=0,"주사, 약물 요법"
3,2020.10.20,[],독감예방접종 한 달,"독감주사를 한 달전에 맞았고
상온백신이라는 연락이 안 온걸 보니
정상적인 백신을 맞은것같은데
무서워서요 ㅠㅠ
괜찮은거겠죠","['한달전이고\n지금 아무런 이상(부작용) 없으면\n괜찮아요 ㅎㅎ...\n<독감 부작용 증상> 두드러기, 발열, 근육통 (독감 예방접종 부작용)\n독감주사 부작용 독감 부작용 (구토, 두드러기, 미열, 현기증) _ 독감예방주사 우리는 대체로 9월 이후 12월 사이 환절기 부터 추운 겨울이 되면 독감주사를 맞는 시즌이 옵니다. 독감 바이러스들은 뜨겁고 습한..\ndingdo.tistory.com']",1,https://kin.naver.com/qna/detail.naver?d1id=7&dirId=70123&docId=371251851&qb=67Cx7Iug&enc=utf8&section=kin&rank=29&search_sort=3&spq=0,종합병원
3,2020.10.20,[],백신부작용인가요?,그 백신을 6시쯤에 접종했는데 명치쪽이 찌릿찌릿하네요. 부작용인가요?,['뉴스 보고 겁먹지 마셔요.\n불안해 하면 \n자꾸만  더  불안해 집니다.\n독감 백신 맞으면\n약한 감기 몸살 증세가 나는 수도 있답니다.'],1,https://kin.naver.com/qna/detail.naver?d1id=7&dirId=7010101&docId=371251210&qb=67Cx7Iug&enc=utf8&section=kin&rank=30&search_sort=3&spq=0,호흡기내과
