page,date,tags,questions,questions_add,answers,N_answer,url,category
25,2020.03.26,[],코로나에 이어 한타바이러스 발생,제가 지금 뉴스를 봤는데 코로나 뿐만 아니라 한타바이러스도 나왔다고 했어요. 그러면 한타바이러스도 전 세계가 난리나고 있어요???,"['안녕하세요~ ""유캔두 학점은행제"" \n여러분의 유캔두 학습설계팀입니다!\n중국에서는 이미 한타바이러스 백신을 보유하고 있으며\n아직 사람 간 감염은 나타나지 않아서\n코로나 만큼의 타격은 없을 것으로 보입니다\n도움이 되셨다면 채택 부탁드립니다', '안녕하세요! 즐거움이 가득한 진로뉴스 ‘자스트미디어’입니다.\n한타바이러스에 대한 정보를 출처와 함께 남겨뒀으니 참고해주세요!\n중국 코로나 이후 또 다른 재앙 한탄바이러스 발생 1명 사망\n출처: https://jastmedia.tistory.com/57\n중국 코로나 이후 또 다른 재앙 한탄바이러스 발생 1명 사망\n([서울] 자스트 미디어) 중국 윈난성(雲南) 출신의 노동자 톈모씨(田)는 일터가 있는 산둥성(山東)으로 이동 중 지난 23일 산시성(山西)을 지나다 사망했다. 노동자 톈모씨(田)는 사후 검사 결과 한탄바이러스(Ha..\njastmedia.tistory.com', '지금은 특별히 난리가 한타바이러스 때문에 나고 있진 않습니다. 다만 중국에서 1명이 사망했죠.. 한타 바이러스는 들쥐한테서 전염이 되고, 백신은 있기때문에 큰 타격은 주지 않을 것 같습니다. 채택 부탁드려요~♡', '중국에 1명이 나왔을 뿐입니다. 걱정마세요.\nhttps://smartdata-shop.com/blog/hantavirus/\n한타바이러스 중국 또 다른 바이러스 시작? > 내일을 바꾸는 습관\n한타바이러스 중국 또 다른 바이러스 시작 - 바이러스는 살아 있는 세포 안에서만 활동을 하는 전염성 감염원이다. 세균과 바이러스의 차이점을 알아보고 한타 바이러스 예방법을 바로 알자. 국민 스스로 바이러스의 예방을 철저히 하고 현명하게 대처하자.\nsmartdata-shop.com', '한타바이러스백신있어요', '한타바이러스는 전세계 몇 군데에서도 일어나는 바이러스 입니다.\n그리고 백신도 이미 있지만\n이번에 백신맞은 군인이 사망했다는 보도가 나왔습니다.\n<한타바이러스 증상> 예방법, 백신, 잠복기 (한타바이러스 관련주)\n한타바이러스 감염증 백신 한타바이러스 관련주 한타바이러스 예방 _ 강원도 철원의 한 군부대에서 풀 깎기 작업을 했던 병사 1명이 들쥐로부터 옮는 한타바이러스 의심증세로 숨졌습니다. = 제초작업중 사망 예..\ndingdo.tistory.com\n위는 한타바이러스 증상\n(예방법, 백신) 잠복기등 안내 입니다.', '그래도 약이 있긴 다행이죠 그래도 정말 조심해야합니다.', ""날씨가 풀리면서 야외 활동을 즐기는 분들이 늘어나고 있는데요. 일단 환자가 많이 발생했던 지역에서는 들쥐 등을 특히나 조심해야 합니다. 코로나19와 달리 한국과 중국 등에서 관찰되는 한타바이러스 백신은 이미 개발이 되어 있지만 미국, 캐나다 등 남미 한타바이러스는 백신과 치료제가 아직 개발되지 못했습니다.\n한타바이러스 감염증 원인은 설치류, 증상 및 치사율은?\n코로나19 발원지 중국에서 한타바이러스로 사망자가 발생하자 또 다시 전염병이 유행할지도 모른다는 우려가 쏟아지고 있습니다. 코로나19 처럼 무방비로 당하지 않기 위해 현재 많은 사람들이 '#hantavirus' 해시..\nalltop4.tistory.com\n한타바이러스 감염증 원인은 설치류, 증상 및 치사율 입니다."", '한타바이러스란?\n폐렴과 유행성 출혈열을 일으키는 바이러스이며\n최소한 7종류가 알려져 있다.\n국내 한탄강에서 처음으로 발견되어 붙여진 명칭이다.\n한타바이러스는 들쥐 같은 설치류에 의해 소변이나 침, 대변을 통해\n사람에게 감염되는 것으로 알려지며 감염되면 고열과 출혈, 신장 손상 등이 생긴다.\n한타바이러스 등장? (+증상,예방법)\n25일 SBS 8시뉴스에서는 강원도 철원 소속의 한 병사가 한타바이러스 증상으로 사망했다고 전해졌다. 육군 관계자에 따르면 25일 육군에 따르면 6사단 소속 A 일병은 이달 11∼12일 부대에서 제초 작업..\nclantown1733.tistory.com', '아닙니다. 한타바이러스는 예전부터 계속적으로 발생했던 바이러스입니다. 한국전쟁당시에도 미군 3천여명이 걸려 수백명이 죽었습니다. 하지만 현재는 이호왕박사님이 최초로 한탄바이러스 병원체를 발견하셔서 백신도 만들어진 상태입니다. 아시아, 유럽에서 유행하는 신장증후군출혈열에 대해서만 백신이 있는상태이고 북미에서 유행하는\n치사율이 50%되는 폐증후군 한타바이러스는 아직 백신이나 치료제가 없는상태입니다. 더 자세한 사항은\n참고하시기 바랍니다.\nhttps://haruharu88.tistory.com/112\n한타바이러스 감염증 증상, 치사율, 예방접종\n한타바이러스는 설치류를 숙주로 삼지만 설치류에게는 질병을 유발시키지는 않습니다. 하지만 인간은 설치류의 침, 소변, 대변을 통해 한타 바이러스에 감염될 수 있습니다. 한타바이러스 중에서도 몇몇 종은 인간..\nharuharu88.tistory.com']",10,https://kin.naver.com/qna/detail.naver?d1id=6&dirId=60906&docId=351130153&qb=67Cx7Iug&enc=utf8&section=kin&rank=243&search_sort=3&spq=0,소규모종교
25,2020.08.05,[],Wlan optimizer 프로그램 질문,"지금 무선 랜카드 이용중인데 핑이 너무 높아서 해결법을 찾다가 wlan optimizer 이라는 프로그램을 찾아서 다운을해서 실행을 했는데 핑이 완화게 됐어요
근데 wlan optimizer프로그램이 저의 개인정보 와 와이파이 정보 같은거 해킹할수 있나요?",['일단 알약이나 V3 그 외 백신 프로그램이 깔려있다고 가정하에 웬만한 보안 위반 프로그램 다잡습니다\n이미 프리웨어로 웹에 많은 사람들이 쓰는걸로 문제없고요\n그리고 동작방식은 주변 신호를 검색하지 않아 포커스 맞춰서 속도 향상하는 프로그램입니다.'],1,https://kin.naver.com/qna/detail.naver?d1id=1&dirId=10801&docId=364487061&qb=67Cx7Iug&enc=utf8&section=kin&rank=242&search_sort=3&spq=0,"개인망, 인트라넷"
25,2020.08.20,[],빌게이츠가 코로나 만들었다는게 뭔소리예요?,빌게이츠랑 코로나가 무슨 연관성이에요?,"['빌게이츠는 코로나19가 인류 생명을 많이 빼앗아 갈거라고 경고하였다고 뉴스를 들었어요. ', '빌게이츠는 세계 인구 줄이기를 강력하게 주장합니다\n빌게이츠가 공산당 지지하죠\n중국을 끔찍하게 좋아합니다\n우한 연구소에 거액 투자했죠\n지금으로부터 5년전 바이러스를 예언합니다\n그 바이러스는 지금 코로나와 전염성은 물론이고 증상도 일치합니다\n이젠 바이러스 종식을 예언하죠\n그리고는 백신만드는데 투자합니다\n이게 예언일까요 계획일까요', '빌게이츠가 코로나 만들고\n그리고 일부로 백신 팔아먹으려고 만든거다\n음모론 때문 입니다..\n<빌게이츠 음모론> 빌게이츠 일루미나티 코로나 바이러스 예언 (빌게이츠 관련주)\n빌게이츠 예언 빌게이츠 바이러스 일루미나티 코로나19 바이러스 음모론 _ 최근 유튜브, 인터넷 커뮤니티 사이트를 보면 빌게이츠 음모론이 화제 입니다. 심지어 빌게이츠도 ""코로나로 수백만명 더 사망, 2021년..\ndingdo.tistory.com\n위는 빌게이츠 음모론\n(일루미나티 예언카드 코로나 예상?)\n안내 입니다.', '음모론 아니라 진짜예요 \n현재 실제로 미국에서는 \n백신 절대 안 맞는다고 50%가 주장중이예요 \n빌게이츠가 코로나 만든 거 알기 때문이고 \n그 백신도 믿음직스럽지 않으니깐요 \n그리고 미국에서 반 넘게 일루미나티의 존재를 \n알고 있고 그들에게 굴복 하지 않는다는 이유로 \n백신 안 맞으려고 합니다 ( 저의 지인중 현재 미국 거주중인 사촌에게 실제로 들은겁니다)  \n여러분 뉴스를 보세요 \n사실만을 얘기 할까요?? 아뇨 \n 국민들을 안심시키기 위해  다 거짓뉴스와 \n눈속임 하는거예요 \n유투브에 \n”빌게이츠 일루미나티” \n“일루미나티”\n“코로나 일루미나티” \n쳐 보세요 한 명이라도 이 사실을 \n알 게 돼었으면 좋겠어요 \n제 답변은 빌게이츠(일루미나티 한패) 가 \n코로나 만든 거 맞습니다. ', '빌게이츠가 진짜 자선사업가 일까요?? 윈도우로 부자된 미친놈입니다', '이상한 음모론들이 있어서 조금 정리해보겠습니다. 사실 대부분 내용 근거로 올려둔 영상을 풀영상으로 보면 말이 안되는 내용이 조금 많습니다.\n-빌게이츠는 세계 인구 줄이기를 강력하게 주장합니다\n-빌게이츠가 공산당 지지하죠\n-중국을 끔찍하게 좋아합니다\n-우한 연구소에 거액 투자했죠\n-지금으로부터 5년전 바이러스를 예언합니다\n밑에 분이 참 이해하기 좋게 정리하셨네요\n1.빌게이츠는 세계 인구 줄이기를 강력하게 주장합니다\n먼저 맨 위에 인구 줄이기를 주장했다고 되있는데 저걸 주장하는 분들이 인용하는 내용이 빌게이츠의 ted강연 중에 탄소 중립이라는 주제로 강연한 내용입니다. \n(참고:https://www.ted.com/talks/bill_gates_innovating_to_zero/transcript#t-282299)\nTranscript of ""Innovating to zero!""\nTED Talk Subtitles and Transcript: At TED2010, Bill Gates unveils his vision for the world\'s energy future, describing the need for ""miracles"" to avoid planetary catastrophe and explaining why he\'s backing a dramatically different type of nuclear reactor. The necessary goal? Zero carbon emissions gl...\nwww.ted.com\n문제가 되는 부분이 \n첫번째는 인구입니다. 현재 지구에는 68억이 살고 있죠. 이 수치는 90억까지 늘어날 것입니다. 우리가 정말로 훌륭하게 새로운 백신, 보건, 출산 의료 서비스의 과업을 잘 해낸다면, 10-15%까지 낮출 수 있겠죠. 하지만, 여전히 1.3 배 정도 증가합니다. \n이부분인데 전체 영상의 맥락은 지구에서 전체 co2의 배출량은 =인구수*서비스당 탄소사용량*효율*단위 애너지 생산 당 co2배출량 이라는 공식에서 "" 인구수는 계속 증가하는 추세고 몇가지 변수가 있어도 계속 증가할 것이다.""라는 언급만 잘라서 만들어진 가짜뉴스입니다.\n2. 밑에 세부분 그러니까\n-빌게이츠가 공산당 지지하죠\n-중국을 끔찍하게 좋아합니다\n-우한 연구소에 거액 투자했죠\n이건데 사실 모르겠습니다. 뭐 빌게이츠가 돈이 잘 벌려서 중국 공산당을 좋아하려나? 뭐 그럴지도 모르겠네요. 그냥 공식적인 자료가 없이 카더라는 내용이라 이건 뭐 반론도 못하겠어요.\n 그나마 맨 마지막 우한연구소에 거액 투자는 찾아봐도 나오는 것도 없고 그나마 중국 SNS(웨이보)에서 사실 코로나는 중국에서 나온게 아니라 미국에서 빌게이츠가 일부러 뿌린거다 라는 주장의 일부로 언급했다는거는 찾았는데 빌게이츠가 어떤 연구소에 투자를 했는지 부터 나오는게 없어서 진실인지도 잘 모르겠네요.\n3.마지막\n-지금으로부터 5년전 바이러스를 예언합니다\n이것을 주장하시는 분들이 인용하는 것도 역시 빌게이츠가 TED에서 올린 강연에 일부분입니다.\n(참고:https://www.ted.com/talks/bill_gates_the_next_outbreak_we_re_not_ready/transcript?language=ko#t-462239)\nTranscript of ""다음에 전염병이 출현하면? 우리는 준비되지 않았습니다.""\nTED Talk Subtitles and Transcript: 2014년, 세상은 끔찍한 국제 에볼라 질병 발발을 모면했습니다. 고맙게도 헌신적인 의료 기관 종사자들 덕분이었죠. 또, 솔직히, 좋은 운도 따라줬습니다. 강조하자면, 우리는 우리가 무엇을 더 잘했었어야 하는지 알고 있습니다. 그래서 지금, 빌 게이츠는 우리의 모든 좋은 아이디어를 시나리오 계획안에서 백신 연구로, 의료 기관 종사자들의 교육으로 실행하도록 조언합니다. 그는 이렇게 말합니다, ""두려워하지 마십시오... 대신 우리는 계속 진보해야 합니다.""\nwww.ted.com\n이거는 반쯤은 맞는말이네요 빌게이츠가 5년 전에 바이러스를 예언했다. 정확히는 예측한겁니다.\n문제의 내용은 \n오늘날 세계적인 재앙의 최대 위험은 이렇게 생긴 것이 아닙니다. 그보다는, 이렇게 생겼습니다. 앞으로 몇 십년간 만약 무엇인가 천만명이 넘는 사람들을 죽인다면, 그것은 아마도 전쟁이 아니라 매우 전염성이 강한 바이러스일 겁니다. 미사일이 아니고 미생물일 것입니다. \n이부분인데 이 영상을 풀 영상으로 보면 이것도 무슨 예언자가 나와서 점찍듯 그렇거다 한게 아닙니다. 당시 에볼라 바이러스의 분석을 가지고 만약 이러한 바이러스가 초반에 잘 대처가 되지 않았다면? 만약 공기중으로 감염이 일어났다면? 시골 몇개 도시가 아닌 사람이 많은 대도시에서 퍼졌다면? 무증상으로 인한 숨은 감염자가 속출했다면?\n이런 가정으로 문제가 생길 수 있으니 미리 전염병에  대응 시스템을 설계하고 준비하자는 내용입니다.\n가짜뉴스가 가장 위험한 이유는 저희가 알려고 하지 않기 때문입니다. 주변에도 참 이상한 글들이 많네요, 항상 인터넷으로 보실때는 정보를 걸러보시는 것을 추천드립니다.']",6,https://kin.naver.com/qna/detail.naver?d1id=8&dirId=814&docId=365693526&qb=67Cx7Iug&enc=utf8&section=kin&rank=241&search_sort=3&spq=0,기타
24,2020.08.23,"['생명학과', '바이러스연구원', '백신연구원', '바이러스학', '연구원', '생명연구원', '생명공학과', '#선문대학교']",바이러스 연구원이 되려면,"바이러스나 백신 관련해서 연구원이 되려면
어떤 학과에 가야 하나요?
바이러스나 백신보다 세부적으로 하고 싶은 걸 정해서 관련 학과를 가는 게 맞을까요?","['제약이나 화학 관련 학과로 진학하시면 됩니다\n참고하시기 바라며 관련 학과로\n선문대 제약생명공학과 소개해드릴게요\n선문대 제약생명공학과는\n제약 산업에 특화 된 능력 및 소양과\n글로컬 마인드를 가진 인재를 키우는 학과입니다\n* 첨단생명공학 / 화학 및 생물 분야의 유능한 교수진\n* 생명유전학 / 바이오 의약품 관련 산업과 연계한 연구 프로그램\n* 실무, 진학 중심의 교육과정 운영\n* 대학생 & 재학생 브릿지 및 연구실 인턴\n* 멘토멘티 프로그램, 특성화 전공 동아리 운영\n* HPLC 교육, 캡스톤 디자인, 현장실습 실시\n지역 제약 산업을 도우며\n지역을 통한 국제화를 실현할 전문가가 되고 싶다면\n선문대 제약생명공학과에 지원해보시기 바랍니다\n선문대 교과&학종 관련 영상 남겨드리겠습니다:)\nhttps://youtu.be/GNfgGCoyPB0\nhttps://youtu.be/44i8o4iOhfU']",1,https://kin.naver.com/qna/detail.naver?d1id=11&dirId=11050403&docId=365995448&qb=67Cx7Iug&enc=utf8&section=kin&rank=240&search_sort=3&spq=0,자연과학대학
22,2020.08.24,[],코로나 인가요?,"제가 몇일전부터 갑자기 입맛이 사라지고 기운이 빠지고
머리가 어질어질한 느낌이 들고
열은 안나고 36.9 37이렇게 나오고 가슴쪽이 답답한 느낌이 납니다 입안에서는 피맛이 올라오고요
코로나 일까요? 열도 심하지 않고 기침이나 목이 아프진 않습니다. 그리고 몸도 갑자기 뻐근하다가 괜찮아 졌습니다 그런데 저랑 같이 다니던 사람들은 전부 몸이 괜찮다고 하네요","['그냥 몸이 안좋으신 듯 싶으신데 혹시 모르니 병원에가서 진단을 받아보시기 바랍니다.\n아무리 증상을 말씀해주셔도 실제로 진단을 받는거랑 수준이 다릅니다.', '코로나는 아니고 다른 병인 것 같네요 빈혈 증상 같기도 합니다 계속 그런 증상이 지속되신다면 병원에 찾아가보시길 바랍니다 코로나는 아닌 것 같네요 도움이 되셨다면 채택 부탁드려요!', '안녕하세요 현재 보건소에서 근무 중인 사람입니다.\n열 같은 경우는 37.5도로 평균적인 코로나 발열을 체크한건데요. \n가장 좋은 것은 가까운 병원을 방문해주셔서 진료를 받아보시거나 약국가셔서 처방을 받아 보신 뒤\n증상을 지켜보시는게 좋아보입니다. \n그래도 증상이 완화되지 않고 심해지거나 지속되시면 자치구 보건소로 한번 방문을 해주셔서 선별 진료소 의사선생님께 진료를 받아보시는게 좋아 보이네요\n개인적인 생각이지만 코로나는 아닐 겁니다ㅎㅎ', '코로나19는 기본적으로 독감의 제증상과 유사합니다. 지속적인 38도 이상의 고열, 근육통, 심한 기침(호흡곤란), 무기력증, 정신혼미, 두통 등... 순서대로 세가지 이상이 해당되면 의심할 만 합니다..\n그런데 코로나19의 무증상전파 및 전국확산단계가 가시화되어 매우 위험한 상황입니다.\n유감스럽게 코로나 19는 공인된 백신이나 치료제가 아직은 없습니다. 그나마 다행인 것은 신체의 면역력이 최상으로 유지되고 있으면, 예방은 물론이고 경증인 경우 자연적인 치료까지 가능합니다.\n따라서 예방과 치료를 위한 확실한 해결책은 면역력강화 뿐입니다. 똑 같이 노출되어도 천차만별인 것은 면역력의 차이때문입니다!!!\n비타민C 메가도스요법으로 면역력을 강화할 수 있으며, 비용도 하루 몇백원에 불과합니다.\n비타민C의 면역력강화기능은 수많은 논문으로 입증되었으며, 80년간 지속된 대안요법입니다. 다만 제도권의료계에서는, 면역력강화기능을 의약품으로 분류하지 않으므로, 이를 예방약이나 치료약으로 사용하지 않을 뿐입니다.\n비타민C로 면역력을 극대화하려면, 몸무게에 정비례하여, 예를들면 체중 60키로는 하루에 9그램을 3~6회로 나누어서 복용하기를 계속합니다.\n정상적인 사람이 이렇게 하면, 사실상 백신을 맞은 것처럼, 코로나19를 비롯한 전염병에 강한 면역력이 생기고 유지됩니다.\n더 상세한 내용은 구글플레이북에서 ""비타민C 메가도스""를 구독하세요. 코로나19를 포함한, 30여 가지 질병의 성공적인 치료사례가 함께 수록되어 있습니다(73~75페이지에 코로나19 예방/치료 집중설명).\n더우기 이 책에는 미국CDC(질병관리본부)가, 자가격리 중인 코로나19환자에게 ""타이레놀과 비타민C""만으로 치료하라고 비공식적으로 처방하는, 그리고 치료되었다는 내용이 수록되어 있습니다.\n직업상 또는 개인적인 사유로 대면접촉이 많은 사람이라면, 꼭 비타민C 메가도스를 실행하여 면역력을 강화하세요. 마스크와 손씻기만으로는 완벽한 예방이 어렵습니다.']",4,https://kin.naver.com/qna/detail.naver?d1id=7&dirId=7010101&docId=366081998&qb=67Cx7Iug&enc=utf8&section=kin&rank=219&search_sort=3&spq=0,호흡기내과
22,2020.08.24,[],코로나19 증상 인가요?,쉰 목소리가 나는데 코로나19 증상 인가요?,"['확진자 동선 겹치는지 파악부터 하세요', '코로나증상과 비교해보시고 체크후\n의심이 된다면 1339번에 전화후 안내 받으시기 바랍니다.\n코로나19 자가진단 코로나세이프 자가진단 받으러 가기\nhttps://dangcare.tistory.com/1329\n코로나19 자가진단 서비스가 개발됐다. 코로나세이프 자가진단 받으러 가기\n코로나19 자가진단 서비스가 개발됐다. 코로나세이프 자가진단 받으러 가기 고고 코로나19 선별 진료소에서 근무하는 공중보건의 등 현직 의사 9명과 MBN 측이 함께 만든 자가진단 서비스는 언제, 어디서나 손쉽..\ndangcare.tistory.com\n코로나맵’ 이어 주변 진료소 정보까지 확인 가능한 ‘코로나 알리미’\n동선확인하시고 주의하세요 ..............\nhttps://dangcare.tistory.com/1226\n코로나맵’ 이어 주변 진료소 정보까지 확인 가능한 ‘코로나 알리미’ 등장\n코로나맵’ 이어 주변 진료소 정보까지 확인 가능한 ‘코로나 알리미’ 등장 최근 ‘신종 코로나바이러스’가 국내에 확산됨에 따라 이에 대한 정보를 확인할 수 있는 창구가 하나둘씩 등장하고 있다. 지난달 30일..\ndangcare.tistory.com\n인후통코로나 증상 목아픔코로나 증상 발현 시기코로나 증상 설사코로나 증상 두통코로나코로나 증상\n롯데리아코로나 ,서울시 모든 종교시설 집합제한, 확진자수,여의도순복음교회\n사회적거리두기,용인 우리제일교회코로나 ,결혼식 50명,동대문코로나,사랑제일교회\n캐리비안베이 코로나,수젠텍,코로나진단키트 맥도날드 서울역점,마스크\n채택시 해피빈은 코로나 관련해서 전액기부됩니다.\n코로나는 아닐거에요 , 건강한 하루되세요', '코로나19는 기본적으로 독감의 제증상과 유사합니다. 지속적인 38도 이상의 고열, 근육통, 심한 기침(호흡곤란), 무기력증, 정신혼미, 두통 등... 순서대로 세가지 이상이 해당되면 의심할 만 합니다..\n그런데 코로나19의 무증상전파 및 전국확산단계가 가시화되어 매우 위험한 상황입니다.\n유감스럽게 코로나 19는 공인된 백신이나 치료제가 아직은 없습니다. 그나마 다행인 것은 신체의 면역력이 최상으로 유지되고 있으면, 예방은 물론이고 경증인 경우 자연적인 치료까지 가능합니다.\n따라서 예방과 치료를 위한 확실한 해결책은 면역력강화 뿐입니다. 똑 같이 노출되어도 천차만별인 것은 면역력의 차이때문입니다!!!\n비타민C 메가도스요법으로 면역력을 강화할 수 있으며, 비용도 하루 몇백원에 불과합니다.\n비타민C의 면역력강화기능은 수많은 논문으로 입증되었으며, 80년간 지속된 대안요법입니다. 다만 제도권의료계에서는, 면역력강화기능을 의약품으로 분류하지 않으므로, 이를 예방약이나 치료약으로 사용하지 않을 뿐입니다.\n비타민C로 면역력을 극대화하려면, 몸무게에 정비례하여, 예를들면 체중 60키로는 하루에 9그램을 3~6회로 나누어서 복용하기를 계속합니다.\n정상적인 사람이 이렇게 하면, 사실상 백신을 맞은 것처럼, 코로나19를 비롯한 전염병에 강한 면역력이 생기고 유지됩니다.\n더 상세한 내용은 구글플레이북에서 ""비타민C 메가도스""를 구독하세요. 코로나19를 포함한, 30여 가지 질병의 성공적인 치료사례가 함께 수록되어 있습니다(73~75페이지에 코로나19 예방/치료 집중설명).\n더우기 이 책에는 미국CDC(질병관리본부)가, 자가격리 중인 코로나19환자에게 ""타이레놀과 비타민C""만으로 치료하라고 비공식적으로 처방하는, 그리고 치료되었다는 내용이 수록되어 있습니다.\n직업상 또는 개인적인 사유로 대면접촉이 많은 사람이라면, 꼭 비타민C 메가도스를 실행하여 면역력을 강화하세요. 마스크와 손씻기만으로는 완벽한 예방이 어렵습니다.', '코로나19 증상에 대해 잘 나와있는 글이 있어 공유드려요 도움이되셨으면 좋겠어요\n코로나19 증상 알아보자\n전국적으로 코로나19 확산세가 더 심해지고 있다고 합니다. 혹시 내가 코로나19에 감염된게 아닌가 생각하시는 분들도 많으실텐데요. 지금부터 코로나19 증상에 대해 자세히 알아보도록 하겠습니다. 코로나19에..\nchickyu.tistory.com']",4,https://kin.naver.com/qna/detail.naver?d1id=7&dirId=7010107&docId=366093380&qb=67Cx7Iug&enc=utf8&section=kin&rank=218&search_sort=3&spq=0,감염내과
