page,date,tags,questions,questions_add,answers,N_answer,url,category
23,2021.04.26,"['강아지', '반려견']",강아지 검버섯 저승꽃?,"올해로 3살되는 말티즈 여아에요
이런적이없었는데 갑자기
등이랑 허벅지 배 엉덩이 밑 등등
나이많은 강아지들이 생기는것처럼 반점??들이
갑자기 많이생겼어요ㅠㅠ
평소 아프지않고 건강했고 심장사상충 매달 꼬박꼬박하고
신종플루엔자. 코로나장염. 종합백신. 광견병. 켄넬코프 등
절때 날짜 오차없이 다 주사맞고 있어요ㅠㅠ
애들 스트레스 받는거 싫어해서
가위컷 그런거 안하고 항상3mm 전체미용하는데요
항상했던곳에서 하는터라 이런적이없었는데
갑자기 이러니 걱정되서요ㅠㅠㅠ
3일전 미용 후 알게된거구요 ㅜㅜ
왜때문에 그런거죠ㅠㅠ?

등은 목욕할때 물에 젖어야 저런 반점들이나와서
등 빼고 사진 첨부해요ㅠㅠ","['사진에 보이는건 일종의 점 입니다. \n원래 하얀색의 말티즈들은 어릴땐 피부가 깨끗하지만 나이 들 수록 점박이가 되어갑니다. \n햇빛을 봐서 그런거에요. 나이들수록 점점 많이 생길거에요. \n일종에 점 같은거고 병도 아니고 돌아오지도 않으므로 너무 걱정안하셔도 됩니다. ', '안녕하세요. 반려견의 피부질환으로 인해 고민이 정말 많으실것 같습니다.\n아래 내용들이 도움이 되셨으면 좋겠습니다.\n사람뿐 아니라 반려동물 역시 비타민D를 통해 전체적인 면역력을 올리면 피부질환도 완전치유가 가능합니다.\n비타민D는 대표적으로 칼슘과 인의 대사에 필수 인자로써 뼈 형성과 근육활동에 절대적인 기능을 한다고 알려져있습니다. 또한, 인체 대부분의 조직과 세포를 수리,복구하고 유지하는 기능을 가지고 있고 유전자의 발현에 영향을 주고 조절을 담당하는 기능을 하고 있습니다.\n다양한 종류의 염증을 예방하는데 도움을 주는 특정 항균 펩티드를 증가시켜 우리 몸 스스로 항생역활을 할 수 있도록 도와주는 항생제 기능이 있습니다.\n유전자 변이에 의한 암세포가 확산되는 것을 막아주고, 다른 곳으로 침투하여 전이되는 가능성을 낮춰주는 세포분화 증대기능도 있습니다.\n바람직한 비타민D 섭취방법은 음식과 햇빛을 통한 방법입니다.\n계란이나 생선, 간 같은 음식을 통해서도 섭취할 수 있지만 필요한 양의 10%밖에 충족을 못 시키기때문에 햇빛을 통해 자신의 피부로 광합성을 하는것이 가장 좋습니다.\n음식외에 비타민D를 섭취하는 방법에는 보충제, 햇빛, 조사기 이렇게 세가지 방법이 있습니다.\n널리 알려진 방법은 보충제지만 보충제로 먹는것은 비타민D의 수치가 크게 오르지 않아 정상 수치로 오르기가 힘들고 부작용과 장기 복용시 중독중을 일으킬 수 있습니다.\n조사기는 자신의 피부로 자연합성하여 비타민D를 생성시키는 방법입니다.\n부작용이 없고 집에서 편안하게 하실수 있습니다.\n반려동물 - 비타민D 자외선요법 : 네이버 카페\n썬드림_비타민D 자외선요법을 통해 반려동물의 다양한 질환을 자가치유하는 환우들의 모임\ncafe.naver.com\n카페에 오시면 반려동물 피부질환에 관련된 다양한 후기를 볼 수 있습니다.\n한번 놀러오세요.\n#반려동물피부병#자외선치료#반려견피부#반려묘피부질환#자외선요법#자연치유법#면역력개선#면역력강화#비타민D#조사기']",2,https://kin.naver.com/qna/detail.naver?d1id=8&dirId=80511&docId=388264764&qb=67Cx7Iug&enc=utf8&section=kin&rank=226&search_sort=3&spq=0,동물의료상담
23,2021.04.26,[],구글계정 해킹,"학원끝나고 와보니 2단계인증도뚫고 비번까지 바꿔져있더라구요
어케해야 할까요.... 전번인증해보니 계속 팅기고...ㅠㅠ",['이렇게 집요한데 백신도 안먹힌다면 초기화만이 답입니다..ㅠㅠ'],1,https://kin.naver.com/qna/detail.naver?d1id=13&dirId=1305&docId=388265101&qb=67Cx7Iug&enc=utf8&section=kin&rank=225&search_sort=3&spq=0,생활
23,2021.04.26,[],코로나백신후 골다공증 예방주사,코로나 백신후 15일뒤에 골다공증 예방주사가 있는데 맞아도 될까요???,"['코로나 백신후 15일뒤에 골다공증 예방주사가 있는데 맞아도 될까요???\n= 2주뒤에 맞는게 좋습니다\n아래 참고하세요\n<코로나 백신 접종 후 주의사항> 부작용, 이상반응, 샤워, 증상, 음주\n코로나 백신 접종 후 이상반응 코로나 백신 접종 부작용 주의사항 안내 _ 전세계적으로 코로나 백신 접종이 시작됬습니다 대한민국 국내에서도 코로나19 백신 접종도 시작됬습니다 코로나 백신은 코로나 바이러스..\nzero-news.tistory.com', '골다공증 예방주사? 어떤 성분인지 확인 하고 백신과 무관한지 확인 하시는게 좋을거 같아요\n코로나 백신 맞아도 될까? 부작용은? 접종 후 건강상태는? 부작용 신고는? https://youtu.be/9tEiEDFO5js']",2,https://kin.naver.com/qna/detail.naver?d1id=8&dirId=8030404&docId=388265565&qb=67Cx7Iug&enc=utf8&section=kin&rank=224&search_sort=3&spq=0,"주사, 약물 요법"
23,2021.04.26,[],코로나백신후 골다공증 예방주사,코로나 백신후 15일뒤에 골다공증 예방주사가 있는데 맞아도 될까요???,"['코로나 백신후 15일뒤에 골다공증 예방주사가 있는데 맞아도 될까요???\n= 2주뒤에 맞는게 좋습니다\n아래 참고하세요\n<코로나 백신 접종 후 주의사항> 부작용, 이상반응, 샤워, 증상, 음주\n코로나 백신 접종 후 이상반응 코로나 백신 접종 부작용 주의사항 안내 _ 전세계적으로 코로나 백신 접종이 시작됬습니다 대한민국 국내에서도 코로나19 백신 접종도 시작됬습니다 코로나 백신은 코로나 바이러스..\nzero-news.tistory.com', '골다공증 예방주사? 어떤 성분인지 확인 하고 백신과 무관한지 확인 하시는게 좋을거 같아요\n코로나 백신 맞아도 될까? 부작용은? 접종 후 건강상태는? 부작용 신고는? https://youtu.be/9tEiEDFO5js']",2,https://kin.naver.com/qna/detail.naver?d1id=8&dirId=8030404&docId=388265565&qb=67Cx7Iug&enc=utf8&section=kin&rank=223&search_sort=3&spq=0,"주사, 약물 요법"
23,2021.04.26,[],다리가 부어 혈전인가 의심되는 상황인데 어떻게 해야하나요,"오른쪽 다리가 2년 전부터 항상 부어있어서 혈전 때문이 아닌가 의심이 됩니다. 근처 흉부외과를 작년에 가봤을 때는 하지정맥류가 아니라고 했는데 결국 남은건 혈전 때문이 아닌가 생각이 들어서요. AZ백신 관련해서 혈전 증상이 저랑 비슷한 거 같기도 하구요.

그런데 어떻게 치료를 해야 할지 모르겠어요. 동네 의원부터 가야 하나요? 아니면 바로 대학병원 등 큰 병원을 가야 하나요? 어느 과에 가야 하는지도 모르겠습니다. 내과를 가야하나요?

1개월 후에 공무원 체력 관련 시험을 보게 되었는데 입원까지 해야하면 지금 치료를 헤야하는지도 잘 모르겠고... 너무 괴로운 상황입니다. 어떻게 해야 하나요?",['혈전이 생겨서 부어오르는 증상을 격으셨으면 2년간 그냥 지낼수 없습니다 '],1,https://kin.naver.com/qna/detail.naver?d1id=7&dirId=710&docId=388265721&qb=67Cx7Iug&enc=utf8&section=kin&rank=222&search_sort=3&spq=0,"의료기관, 의료인"
23,2021.04.26,"['아스트라제네카', '백신', '백신접종', '백일해', '백일해예방접종']",AZ백신 접종과 백일해 주사 간격,"현재 직업군인으로 5/4 AZ백신 접종예정이고
올해 7월 19일 둘째 아이가 출산 예정일이라
5/14 백일해도 접종 할 예정입니다

근데 백신이랑 백일해 접종간격이 10일밖에 차이가
나지 않아서 혹시나해서 여쭤봅니다

전문가 의료인분 답변 기다리겠습니다!","['안녕하세요. 대한의사협회·네이버 지식iN 상담의사 최연철 입니다.\n코로나19 백신과 다른 백신과의 동시접종이나\n가까운 시일에 접종했을 때의 상호작용에 대해서는\n아직까지 연구결과와 경험이 부족합니다.\n그러므로 혹시모를 서로간의 영향을 최소화하기 위해\n코로나19 백신과 다른 백신은 최소한 2주 이상의 간격을 두고\n접종하도록 안내되어 있습니다.\n코로나19 예방접종 일정을 앞당기기는 어려우실테니,\n백일해 접종일정을 4일 이상 미루시길 권장드립니다.\n백일해 접종은 늦더라도 신생아와 접촉하기 2주전까지 접종하시면 되므로 \n지금 계획하신 일정보다 지연되더라도 문제되지 않습니다.\n도움이 되었길 바랍니다. 감사합니다.']",1,https://kin.naver.com/qna/detail.naver?d1id=7&dirId=70115&docId=388265835&qb=67Cx7Iug&enc=utf8&section=kin&rank=221&search_sort=3&spq=0,소아청소년과
22,2021.04.26,"['#문제풀이', '#문제풀이']",코로나19 바이러스는 올해안에 종식되기에는 무리인가요?,,"['올해안에는 무리일거 같네요\n아무리 백신을 맞는다 해도 변종이 너무생겨나니까', '종식은 전 세계에서 코로나가 사라져야 완전한 종식이 가능한데 \n이렇게 될 가능성이 희박하므로 (계속 새로운 변이 바이러스가 생기고 있고 인도는 3중 변이바이러스가 생겼음)\n종식이 아니라 풍토병으로 일본독감,말라리아처럼 예방접종으로 예방하고 코로나와 함께갈 가능성이 크다고 예상하고 있습니다.\n우리나라도 예방접종이 진행되고 있지만 \n집단면역을 형성할 만큼 충분한 양을 공급하기엔 수개월이 걸릴것으로 보여\n올해안에 종식은 여려운 것으로 전문가들이 예견하고 있습니다. ']",2,https://kin.naver.com/qna/detail.naver?d1id=11&dirId=1116&docId=388266189&qb=67Cx7Iug&enc=utf8&section=kin&rank=220&search_sort=3&spq=0,"생물학, 생명공학"
22,2021.04.26,"['샤프심', '샤프심박힘', '샤프심박혔어요', '빨간약', '과산화수소', '후시딘']",샤프심에 깊게 베였어요 ㅜㅜㅜ 급합니다(사진참고),"학원에서 어쩌다가 샤프심으로 손가락 검지 한 마디가
주와악 하고 찢겼어여
첨에 베였을땐 피가 오질라게 낫는데 걍 후시딘바르고
밴드 붙였어요
근데 욱신욱신 거려요 아니 지금 밤10신데 한 9시 40분에
찢겼었던거 같아요 밤이라 약국도 안여는데 ㅜㅜ
이거 찾아보니까 소염제 사서 먹고 식염수 바르고 후시딘
하고 밴드 붙이라는데 식염수랑 소염제는 편의점에도
안팔고 ㅜㅜ
빨간약 바르면 안되겠져 ?
과산화 수소수도 안되겠져 ?
아님 그냥 내일 학교 보건실 가서 치료 할려는데
그때 까지 냅도둬 되나요 ?? ㅜㅜ
샤프심이 박힌거 같진 않아요
빠른 답변 부탁 드립니다 ㅠㅠ

아니근데 아까 찢겼을때 막 주변살 누르면 갈려있고
그랬는데 후시딘 바르고 나서 집와서 보니까 벌써 새살이
돋은건 아니겠져 ?? 돋았는데 소독하면 소용 없는고
아니겠져 ? 저상태로 진짜 하루만 냅둬도 되나욘 ??? ㅜㅜ","['네...저는 현장일 하는사람인데요~ \n지금 질문자님의 상처보다 훨씬 더 큰 상처를 매일같이  달고 삽니다^^\n조금 불편하시더라고 시간이 지나면 괜찮아 집니다^^ 너무 걱정하지마세요~', '저도 저런 적이 있는데 염증이 생겻거든요..!!\n저 상태에선 최대한 다친 부분을 깨끗하게 유지하시공ㅇ담날 약국이나 병원가보셔요 !!!\n저는 깊게 쫙 찢어진건 아니라 일주일 ~ 9일만에 나앗서요', '물에 몇 초 동안 씻은담에\n연고 바르고 밴드 붙이세요\n안 나으시면 병원 가시고요', '여기에 저 같은 비전문가의 답변이나 장난 대로 하다가 큰일 나니 병원가서 치료 하시구요 과산화수소는 자극적이고 최근 발암위험으로 잘 사용이 되지 않고요 공사장에서 일하시는 분은 10년마다 맞아야하는 파상품예방접종을 안하시면 만약 상처로 세균이 침투해서 증식하면 파상풍과 폐혈증으로 사망할수 있어요 빨간약으로 소독하고 소독한 카드나 주민등록 등으로 끝을 밀어 샤프심 박혔으면 빼내시고 빨간약 바르고 병원가서 파상풍백신 뇌수막염 예방접종 3가지 맞으셔요 보건소가서 자궁근종예방접종도 하시어요 청소년은 무료 인데 성인은 20만원 이래요 남녀 다 맞는거래요 ']",4,https://kin.naver.com/qna/detail.naver?d1id=7&dirId=7010104&docId=388266628&qb=67Cx7Iug&enc=utf8&section=kin&rank=219&search_sort=3&spq=0,혈액종양내과
22,2021.04.26,[],백신 화이자 말곤 다른건 안맞는게 맞겠죠???,,['화이자는 혈전 부작용은 없지만 쇼크의 가능성이 있습니다 '],1,https://kin.naver.com/qna/detail.naver?d1id=7&dirId=7010107&docId=388266967&qb=67Cx7Iug&enc=utf8&section=kin&rank=218&search_sort=3&spq=0,감염내과
22,2021.04.26,[],아빠 화이자백신,저희 아빠가 당뇨가 있으신데 화이자 백신을 맞으셨는데 괜찮으시겠죠 걱정돼요 ㅠㅠ 정말 괜찮겠져?,['백신을 맞으시고 지금까지 별 이상 반응이 없으시면 괜찮으신 겁니다. \n그러나 며칠 간은 주의관찰을 해 보시는 것이 좋을 것 같습니다.'],1,https://kin.naver.com/qna/detail.naver?d1id=7&dirId=7010106&docId=388268458&qb=67Cx7Iug&enc=utf8&section=kin&rank=217&search_sort=3&spq=0,내분비대사내과
22,2021.04.26,[],제가 자궁경부암 주사 맞아야 할까요?,"올해 33살 남자이고 9년 만난 여자친구가 있습니다

저는 여자친구 말고는 다른 여자랑은 키스 성관계 등의 성접촉 일절 없었고 동성애자도 아니고 최근 성병검사도 했는데 아무런 바이러스? 그런거없이 깨끗한 상태라고 합니다

그런 저도 자궁경부암 주사를 맞을 필요가 있나요?","['안녕하세요. 대한산부인과의사회-네이버 지식iN 상담의사 신연승 입니다.\n양천구 목동에서 20여년간 산부인과 진료하고 있고, 여의사 전문의와 같이 무월경, 갱년기 등 부인과질병, 질염, 성인예방접종(자궁경부암, 대상포진, 폐렴, A형간염 등)을 중점적으로 진료하고 있는 산부인과 전문의입니다.\nHPV는 여성뿐 아니라 남성에게도 생식기사마귀, 두경부암(편도암, 구강암 등), 음경암, 항문암 등을 일으키는 원인이 되어 최근 남성에게도 백신 접종을 권고하고 있습니다. 가다실 남자 접종 권장 캠페인 광고도 보셨을 겁니다. \n가다실9의 자궁경부암 예방률은 90%지만 접종전 성경험이 있을 경우 이보다 낮습니다. 가다실4는 70%정도구요. 남자분도 같이 맞으시면 더 예방률이 높아지겠죠. \n인유두종바이러스는 성적 접촉을 통해서 우리 몸에 들어오게 됩니다. 이후 대부분은 자연 소멸이 되나 일부의 경우 지속적인 감염으로 문제가 됩니다. \n가다실9은 가다실(4가)과 비교하여 만 16-26세 여성에서 HPV 31, 33, 45, 52, 58형 관련 자궁경부암, 외음부암, 질암 및 전암 병변에 대한 96.7%의 예방 효과를 보였습니다. 가다실9은 HPV 감염에 의한 자궁경부암, 외음부암, 질암 (여성 해당), 항문암 및 생식기 사마귀 등을 예방할 수 있는 국내 유일 9가 HPV 백신입니다.\n자궁경부암 예방접종으로 코로나시대에 면역력을 키워주세요.\n이외에도 성인예방접종 알아두시면 좋으실텐데요.\n대상포진 예방접종 백신은 조스타 박스이며 접종 방법은 50세 이상에서 1회 접종합니다.\n폐렴 사슬 알균 예방접종 백신 종류는 단백결합백신(프리베나13, 신플로릭스10)과 다당질백신(프로디악스23, 뉴모23) 두종류 입니다. 모든 성인에서 단백결합백신(10가혹은13가)을 접종하고 65세 이상은 국가에서 무료 접종 가능하므로 다당질백신(23가)을 추가 접종하시면 됩니다\n수두 예방접종은 항체 검사상 음성인 경우 실시하며 접종 방법은 2회 접종 (0,1-2 개월)합니다. 생백신이므로 접종후 1개월간 피임이 필요합니다.\n풍진 예방접종은 항체 검사상 음성인 경우 접종 하며, 접종 방법은 1회 접종합니다 생백신이므로 접종후 1개월 정도 피임을 해야 합니다 만약 이기간에 임신이 된 경우라도 현재까지 기형아가 출생 하였다는 보고는 없었습니다.\nA형 간염 예방접종 백신종류는 하브릭스, 아박심, 이팍살베르나가 있으며 서로 교차 접종이 가능합니다\n접종 방법은 2번 접종 (0, 6-18 개월)합니다\nA형 간염을 접종해야 하는 고위험군은 만성 간질환자, 어린이 보육시설 종사자, 요식업체 종사자, A형간염에 노출될 위험이 있는 의료진/실험실 종사자, A형간염 유행지역으로 여행/근무 예정자, 최근 2주 이내에 A형간염 환자와 접촉한 사람입니다.\nB형 간염 예방접종은 항체 검사상 음성인 경우 접종하며 접종 방법은 3회 접종(0,1,6개월) 합니다. 접종 후에도 항체가 생기지 않는 경우에는 총 3주기(9번)까지 반복 접종합니다.\n파상풍-디프테리아-백일해 예방접종 백신 종류는 파상풍-디프테리아-백일해(Tdap) 과 파상풍-디프테리아(Td)백신가 있으며 10년 마다 접종 합니다. 가임기 여성은 Tdap백신을 임신 전에 접종하거나, 임신 중이면 임신27-36주 사이 혹은 출산 후 접종합니다. Tdap 백신 접종 대상자은 생후 12개월 미만의 영유아와 밀접한 접촉자인 의료기관이나 보육시설 종사자, 신생아가 있는 가족내 성인(부모/조부모)입니다.\n여성질환 검진에서는 무엇보다 중요한 것은 많은 수술경험과 노하우를 갖고 있는 산부인과전문의에게 차별화된 시술을 받는 것입니다. 경험많은 진료가 시술전 환자의 상태에 대한 정확한 진단를 할 수 있습니다.\n수술이나 피부레이저시술로 인한 대기시간때문에 불편해하시는 분들은 피부미용진료나 여성성형수술을 하지않고 산부인과 외래환자를 중점적으로 보는 산부인과에서 빠르게 부인과 진료를 보실 수 있습니다.\n진료 비용을 적극 고려하시는 분이시라면 원칙대로 최대한 의료보험진료가 가능하게 진료받으실 수 있도록 웨딩검진, 부인암 검진, 갱년기 폐경 검진 등 검진 패키지와 자궁경부암 백신접종, 비정상생리, 성인예방백신접종(폐렴, 대상포진, 자궁경부암, 곤지름, a형간염 등), 배란, 피임, 자궁난소질환, 요로질환, 질염, 성병, 유방 검진, 미레나 등에서 보험진료로 받으실 수 있는 혜택을 모바일홈페이지에 정리했는 데 참고하시기 바랍니다.\n성인백신으로 면역 건강에 대비하시기 바랍니다.']",1,https://kin.naver.com/qna/detail.naver?d1id=7&dirId=7011404&docId=388268765&qb=67Cx7Iug&enc=utf8&section=kin&rank=216&search_sort=3&spq=0,여성질환
