page,date,tags,questions,questions_add,answers,N_answer,url,category
5,2021.04.27,[],구직 사이트 보면 캐나다 영주권 지원해 준다고 카페 일자리 지원할 사람 모집하던데.,"여기 거액 제시하는 그런 브로커죠?
말이 안 되는 것 같아서요.
카페에서 일하는 사람 구한다고 하고 영주권 도움 준다고 하는 거 보면,
알선책이나 브로커, 큰돈 요구하는 그런 브로커 같아서요.

혹시 아시는 분 계신가요?","['그런곳도 있고, 아닌곳도 있고,\n근데 생각보다 쉬운일인데, 구인을 하는 캐나다 사업체라면 거의 100% 돈을 요구하거나 돈을 요구함 + 월급도 갈취일 확율이 큽니다.\n뭐 이런거죠. \n너 어차피 영주권 받잖아? 우리가 그거 도와줄꺼니깐 거의 무급에 가깝게 일해. 그게 조건이야!\n생각보다 많습니다.\n특히 시골 모텔 주유소 이런데에....\n특히 30대뿐 아니라 40대들\n특히 40대 이상은 거의 이런류로 이민해요.\n어거지로 참아가면서 일하는건데\n뭐 자녀 무상교육되고, 부인이 취업비자 나오니깐 맞벌이해서 \n겨우 본전정도 하는거죠.\n문제는 사실 그 뒤가 문제에요.\n한국은 기본적으로 ""한국인""이란 기반이 있습니다.\n최소한 한국에서 나고 자라서 크면서 인맥이란걸 형성했을거고\n그게  흔히 말해서 고향친구, 학교친구, 동네친구가 있다는거죠.\n그에 비해서 캐나다에서는\n고향친구도 없고, 학교친구도 약하고, 동네친구는 더더욱 없다싶이하기 때문에\n인적교류가 한국보다 확 줄어들고요. 그만큼 무엇을 할때 현지인(캐나다에서 나고 자란사람들)보다 못한거죠.\n영주권 받으면 사실상 그제서야 겨우 기본입니다. 밑바닥이 생긴거죠.\n문제는 영주권 받을때까지 한 5년정도 거의 노예처럼 고생하는데\n그제서야 받은 영주권을 막상 받아보면, \n영주권을 받았다고 캐나다 정부가 억만금을 주느냐? 그런것도 아니지만,\n캐나다 정부가 뭐 세금을 줄여준다든지 복지해택을 바로 준다든지 하는게 1도 없거든요.\n사실상 캐나다에 취업비자 스폰으로 올때받던 복지수준이 영주권 받고도 거의 동일해요.\n그래서\n취업비자때 세금이 높다고(한국보다 한 5배이상 높음. 체감상은 10배느낌이긴 하지만) 영주권 받으면 나아지겠지. 하는데 전혀 나아지지 않구요.(세금은 외국인 노동자로 취업비자 일때랑 영주권자일때랑 1도 달라지지 않습니다.)\n보통 영주권 받고 맨붕이 온다고 하는데\n진심으로 저도 맨붕 받아봤구요. 영주권이 마치 엄청난것 같지만, 막상 받고나면 딱 캐나다에서 오래살수있는 비자. 그이상도 그이하도 아닙니다.\n어차피 내가 사는 작은 아파트 비싼 월세는 계속 나갈것이고,\n한국보다 비싼 공과금에, 한국보다 높은 세금을 내지만,\n막상 월급은 한국에서 같은 직업에 비해서 같거나 낮은 그런 상황이 대부분이죠.\n한국은 주휴수당이 있음으로써 최저임금이 어느정도 보충되는 부분이 있지만,\n캐나다는 주휴수당도 없습니다.(전세계적으로 주휴수당이 없는 나라가 더 많습니다.)\n영주권 받을때 조건이 10년간 복지기금 받아먹지 않는 조건이라서\n10년간 어떤 복지기금을 타먹을수도 없구요.(물론 자녀에 대해서 나오는 보육수당은 외국인일때부터도 나오긴 합니다. 그래서 외국인 노동자로 취업비자일때와 영주권자일때 차이가 더 없습니다.)\n(그리고 사실 복지기금이란게 정말 똥꾸멍이 찢어지게 가난하고 노동을 할수 없는 병신이어야 나오는데, 캐나다가 아무리 한국에 비해서 복지국가라고 하지만, 사지 멀쩡한 사람에게 복지기금을 주지는 않거든요. 그리고 일반적인 한국사람이면 그거 받고 가난하게 사느니, 차라리 일해서 더 많이 벌지. 이런 마인드도 있구요)\n솔찍히 그래서 20~30대 젊은 분들이야\n영주권 받고, 그 다음에 자기 커리어를 쌓아갈 테크트리를 쌓는데 비해서\n40대분들이야 이제 인생 황혼을 바라보는 시점에서 자녀들 교육과 미래때문에 캐나다를 선택하는데\n막상 본인들은 캐나다에서 어려운 삶을 사는게 일반적이더라구요.\n솔찍히 제가 캐나다 오던 10년전에는\n모든 복지지표가 캐나다가 우월했는데 \n지금은 그 10년사이에 한국의 복지 지표가 캐나다를 많이 따라왔습니다.\n그리고 사실 10년전에는 캐나다 보건의료가 더 선진국이었던거 같은데(뭐 예를들어 무상의료라든지)\n그리고 실제로 몇번 경험해보건데, 개인적으로 신뢰도는 높다고 생각합니다만....\n이번 코로나로 인해서 공중보건위생이 아예 붕괴되는 모습 + 마스크 마져도 캐나다 생산이 없는 모습 + 백신도 미국에 구궐하는 모습에서 큰 실망감이 남습니다.\n정치세력의 경쟁으로 한국의 복지가 오히려 보수당 정권인 10년 사이에 많이 발전하는 아이러니가 좀 있었지만,\n솔찍히 한국이 미세먼지 이런거 빼고는 오히려 미래의 발전적인 모습으로는 더 나은 미래를 가지지 않을까 개인적으로 생각해봅니다.\n솔찍히 캐나다는 이정도 경제규모를 유지하는건,\n넓은 땅에 무한대에 가까운 지하자원과\n넓은 땅을 활용한 농임업이 경제의 기본 큰 바탕이기 때문에\n지금의 경제규모인거지,\n정치가 불안했다거나,\n영어를 안썼다거나,\n미국이란 엄청난 국가가 이웃이 아니었다면, 딱 캐나다도 러시아와 다를바 없지 않았을까? 싶을때가 많습니다.']",1,https://kin.naver.com/qna/detail.naver?d1id=9&dirId=9020202&docId=388328725&qb=67Cx7Iug&enc=utf8&section=kin&rank=48&search_sort=3&spq=0,캐나다
5,2021.04.27,[],맥아피가 백신인게 맞나요?,"맨날 보안 프로그램이 만료됐다면서 알림이 뜨는데 끄기 버튼이 안 먹힙니다.
이정도면 백신이 아니라 바이러스 아닌가요?
알림이 뜰때마다 화면의 1/9을 가릴 정도로 큰 알림이 안 꺼지다니","['윈도우10과 함께 기본으로 설치되어 있는 McAfee(맥아피)는 안티바이러스 프로그램으로 90일를 무료로 사용할 수 있는 쉐어웨어로 제공되구요. \n컴퓨터 사용시 McAfee 웹어드바이저가 경고창을 띄우거나 사용 기간이 임박하면 결제를 요구하며 PC가 위험하다는 메시지를 보여주기도 합니다. \n맥아피는 익스플로러와 크롬에도 추가 기능이 설치되어 인터넷 서핑을 느리게 하는 단점이 있어 삭제를 하고 싶어도 컴퓨터 초보자 같은 경우 맥아피에서 보여주는 경고성 메시지 때문에 맥아피를 삭제하면 큰일이 나는줄 아는 경우도 있는데, 삭제 방법은 제어판의 프로그램 및 기능으로 이동한 다음 ‘McAfee 라이브세이프 – 인터넷 시큐리티’를 마우스 오른쪽 버튼을 클릭 후 ‘제거/변경’을 선택후에 삭제해 주시면 됩니다. \n다른 바이러스 프로그램을 사용하시는게 좋습니다. ']",1,https://kin.naver.com/qna/detail.naver?d1id=1&dirId=11002&docId=388329432&qb=67Cx7Iug&enc=utf8&section=kin&rank=47&search_sort=3&spq=0,바이러스
5,2021.04.27,[],코로나 백신접종 이후 몸살날 때 코로나 검사하면?,"백신 접종으로 인해서 몸살기운이 있을 때에
만약 코로나 검사를 한다면 양성으로 나오게 되나요???",['안녕하세요. 대한의사협회·네이버 지식iN 상담의사 홍인표 입니다.\n감염된것이 아니어서 양성으로 나오지 않습니다'],1,https://kin.naver.com/qna/detail.naver?d1id=7&dirId=70117&docId=388330417&qb=67Cx7Iug&enc=utf8&section=kin&rank=46&search_sort=3&spq=0,가정의학과
5,2021.04.27,[],주식 물타기 관련 질문있습니다,"안녕하세요.
코로나 백신이 나오고 백신여권이 나온다고 했을때 항공주,여행주 들을 매수해놨었는데 코로나 재확산으로인해 주가가 하락하고있네요..
1년이든 2년이든 시간이지나서 코로나가 종식되면 다시 사람들이 여행을가게되고 주가가 상승하니깐 지금이 평단가를 낮출수있는 저가추가매수찬스인가요?
조언해주시면 감사하겠습니다","['저도개인적으로는\n항공, 영화, 관광사업쪽 관련주가 코로나끝나면 상승탈거같습니다.\n장기적으로 들고있을수만있으시다면\n개인적으로는 추가매수타이밍으로잡고 물타기하셔도될듯한거같아요.\n답변이 됐길 바랍니다\n혹시 제2의비트코인이라고 불리는 파이코인에대해서 들어보셨나요?\nhttps://blog.naver.com/deletein/222268209919\n모바일코인 파이네트워크(PI) 가입방법\n파이코인은 이미 전세계 1천만명 이상이 참여하고 있으며성공궤도를 달리고 있는 코인으로아직도 늦지 않았...\nblog.naver.com', '안녕하세요\n물타기는 끝물을 잘 읽어서 하시는게 제일 좋습니다.\n그리고 물타기를 하실때는 확실히 매단을 낮출 수 있는 자금이 투입이 되셔야 안전합니다.\n그 계산을 먼저 해보시고 물타기를 시도하셔야 할거구요\n막연히 그럴거다 보다는 지금 차트의 흐름을 잘 확인하시는게 좋습니다.\n만약 하향세를 이어가고 있다면 물타기 절대 시도 하시면 안됩니다.\n하향세를 벗어나 주가 안정세가 왔을때 시도를 하셔야 리스크를 줄이실 수 있습니다.\n조금이나마 도움이 되셨길 바랍니다.\nhttps://cafe.naver.com/dowajocar\n도와주CAR - (중고차 고민 상담 ... : 네이버 카페\n중고차 구매 / 판매 / 대차 / 할부 / 렌트 / 리스 / 신차 / 경매차 등등 차에 관한 모든고민 해소공간\ncafe.naver.com']",2,https://kin.naver.com/qna/detail.naver?d1id=4&dirId=40102&docId=388330796&qb=67Cx7Iug&enc=utf8&section=kin&rank=45&search_sort=3&spq=0,"주식, 증권"
5,2021.04.27,[],우리나라백신도품절됬나요?,,['코로나 백신에 대한 질문이라면... \n도입되는 수량에 맞추어... 우선접종 대상자에게 접종하고 있으며 \n그외 일반인에 대한 접종을 시작하는 3분기가 되면 \n지금보다는 도입되는 백신 물량이 훨씬 늘어날 예정입니다.'],1,https://kin.naver.com/qna/detail.naver?d1id=3&dirId=316&docId=388331516&qb=67Cx7Iug&enc=utf8&section=kin&rank=44&search_sort=3&spq=0,초자연현상
5,2021.04.27,[],크롬 브라우져 실행이 안되요,"어느날 갑자기 크롬 브라우져가 실행이 되지 않습니다.
인터넷 검색을 해서 알약 업데이트 받아 검색해 보고, 전용 백신이라는 (역시 알약) 받아 검색 해 보았지만 아무런 악성코드, 바이러스도 검색되지 않았고, 크롬 브라우져 역시 실행이 되지 않습니다.

해결 방법 없을까요?",['제어판에서 제거 하신후 제 설치 해보십쇼..\n도움되시고 유익하셨다면 채택으로 마음을 표현해주세요 감사합니다'],1,https://kin.naver.com/qna/detail.naver?d1id=1&dirId=10201&docId=388332045&qb=67Cx7Iug&enc=utf8&section=kin&rank=43&search_sort=3&spq=0,웹브라우저
5,2021.04.27,[],코로나 걸렸던 사람은 백신주사 안 맞는 건가요?,,"['코로나 걸린 사람도\n코로나 백신 맞아야 합니다\n<코로나 백신 접종> 순서, 횟수, 나이, 우선순위, 시기, 방법\n대한민국 국내 코로나 백신 접종 코로나 백신 접종시기 _  먼저 국내 코로나 백신 접종대상은(?) 대상은 전국민 입니다. (단 백신 개발과정에서 임상시험에 포함되지 않은 임신부와 18세 미만 소아청소년은 접종..\nzero-news.tistory.com', '면역기간 짧거나 없답니다\n그러니 맞아야한다고합니다']",2,https://kin.naver.com/qna/detail.naver?d1id=7&dirId=70117&docId=388332842&qb=67Cx7Iug&enc=utf8&section=kin&rank=42&search_sort=3&spq=0,가정의학과
5,2021.04.27,[],코로나백신 관련,"제가 백의고혈압이라서 병원에서 혈압을 재면 엄청 높게 나옵니다
코로나백신 접종 전 혈압을 재는가요?
만약 혈압이 높게 나온다면 백신은 접종 못 받는지 궁금 합니다","['코로나 백신은 기저질환환자 / 약물 투여자 / 감기기운등 증상이 있는자는 증상이 나타나는 자는\n먼저 병원에 의사와 상담후 접종해야 한다 아래 코로나 접종안내 문구에 나옵니다[출처]\n<코로나 백신 접종> 순서, 횟수, 나이, 우선순위, 시기, 방법\n대한민국 국내 코로나 백신 접종 코로나 백신 접종시기 _  먼저 국내 코로나 백신 접종대상은(?) 대상은 전국민 입니다. (단 백신 개발과정에서 임상시험에 포함되지 않은 임신부와 18세 미만 소아청소년은 접종..\nzero-news.tistory.com']",1,https://kin.naver.com/qna/detail.naver?d1id=7&dirId=7010103&docId=388333134&qb=67Cx7Iug&enc=utf8&section=kin&rank=41&search_sort=3&spq=0,순환기내과
4,2021.04.27,[],코로나백신 2차접종 날짜 변경가능한가요?,"오늘 1차접종 하고 왔는데
2차 접종 날짜를 보니 그날 근무라 못가는데
2차 사전예약 날짜 변경이 가능한가요?
예약취소가 있긴한데 전체가 취소되는건지?
병원에 전화해서 날짜변경 가능할까요?","['코로나 백신 1차접종 하고 왔는데\n2차 접종 날짜를 보니 그날 근무라 못가는데\n2차 사전예약 날짜 변경이 가능한가요?\n예약취소가 있긴한데 전체가 취소되는건지?\n병원에 전화해서 날짜변경 가능할까요?\n= 문의처에 문의해서\n변경요청 하세욤\n<코로나 백신 접종> 순서, 횟수, 나이, 우선순위, 시기, 방법\n대한민국 국내 코로나 백신 접종 코로나 백신 접종시기 _  먼저 국내 코로나 백신 접종대상은(?) 대상은 전국민 입니다. (단 백신 개발과정에서 임상시험에 포함되지 않은 임신부와 18세 미만 소아청소년은 접종..\nzero-news.tistory.com', '기관에 문의하시는게 가장 확실할거 같아요\n코로나 백신 효과 15% 올릴 수 있는 방법 https://www.youtube.com/watch?v=PIFqVZyfIFY']",2,https://kin.naver.com/qna/detail.naver?d1id=7&dirId=7010107&docId=388333580&qb=67Cx7Iug&enc=utf8&section=kin&rank=40&search_sort=3&spq=0,감염내과
4,2021.04.27,[],연예인 가수 아이돌 배우 백신접종 안하면 어떻게 되나요?,제목이 곧 내용인데 백신 주사 안 맞으면 어떻게 되나요?,"['그냥 안맞는거죠 어떻게 되는게 아니라', '접종 대상자로 떳는대 안맞았다 그러면 사회적으로 비난 받겠죠\n방콕해라 나오지마라 돌아댕기지마라 이러것죠 ']",2,https://kin.naver.com/qna/detail.naver?d1id=3&dirId=30104&docId=388334478&qb=67Cx7Iug&enc=utf8&section=kin&rank=39&search_sort=3&spq=0,방송연예인
