page,date,tags,questions,questions_add,answers,N_answer,url,category
19,2020.08.25,[],인유두종바이러스 콘딜로마 곤지름 성병 잠복기 있나요,"남친은 6개월만에 저랑 처음 한거고
저는 저번달까지 관계 경험이 있고요
얘가 저랑 관계후 다음날 바로 성기에 여드름같이 뭐가 생겼다고 성병있는지 물어보더라고요
저는 얘랑 할 때 아무런 증상이나 이상은 없었는데 혹시나해서 병원가서 검사는 해놓은 상태고요ㅠ
잠복기 없이 바로 증상이 올라올 수 있는 성병들이 있나요?","['  <경고>\n 아래 해당되는 사람은 아예 읽지 마세요\n질문을 하면서 자기 기분에 맞게 안써있거나 충고하는 글이면 \n욕하거나 비난하거나 하는 것이 습관인 사람들이 1%정도 있더군요.\n또한 지나가다가 보고 심심해서 욕하는 사람도 1%정도 있더군요.\n그런 사람을 위하여 쓴 글이 아니니 아예 읽지를 마세요\n반드시 경찰에 신고해줍니다.\n그런 사람들로 인하여 마음의 상처를 받는 사람이 많습니다.\n 아래 글은 매우 길어서 \n다 읽을 인내심이 없다면 읽다가 포기할 것이니 \n다 읽을 자신이 없다면 절대로 읽지 마세요. \n님에게 잘못된 생각을 심어줄수 있으니 정확히 잘 읽던지 지금 그냥 읽지 마시고 \n무시하고 다른 분의 답변을 읽으시길 권합니다.\n아래 글은 매우 공격적이라 배려심이 없는 사람은 기분이 상할수 있답니다. \n 질문이 성의가 없게 느껴질 정도로 간단하거나 \n(정말 답변을 얻고자 하면 궁금해서 자세히 길게 쓰겠지요.) \n마감률이 저조하면 \n(마감률이 저조하다는 것은 답변달아주면 \n질문자가 답변을 보는지 안보는지 알길이 없는 \n답변자쪽에 보면 안본다는 의미로 해석될 수밖에 없쟎아요.)\n저의 답변은 안달립니다.\n 이글을 보는 사람중\n질문수가 많고 성의없는 답변으로 인하여 마감률이 저조하시다면 \n네이버는 3개의 아이디를 주니 새롭게 만들어보세요.\n채택률과 마감률이 같은 분은\n채택없이 마감하는 방법을 배워서 마감률(90%이상)은 높이시고 \n질문은 성의를 가지고 길게 하시길 바랍니다. \n채택을 하고 마감을 하든, 채택없이 마감을 한다는 것은\n님의 질문이 장난이 아니고 필요해서 질문하였다는 \n님의 마음의 표현이라 마감률은 중요하답니다. \n채택률은 중요한 것이 아니랍니다. \n답변은 문답식으로 되어 있습니다.\n자 이제 답변을 시작해볼까요?\n  질문수\n14 채택률\n54.5% 마감률\n54.5%\n 채택은 도움이 된 글만 채택하시면 됩니다.\n마감률은 저조하니 마감은 채택없이 가능하오니 올리시길 바랍니다.\n질문수가 적으니 마감률을 100%로 올리는 것이 가능할 것입니다.\n질문은 너무 간단하죠\n다음 질문에는 성의를 조금더 더해보시길 바랍니다.\n??\n인유두종바이러스 콘딜로마 곤지름 성병 잠복기 있나요\n인유두종 바이러스==콘딜로마==곤지름==성기사마귀 ==hpv\n위가 다 같은 말이랍니다.\n모르는 것이 많군요\n아래 참고하여 더 많은 공부를 하시길 바랍니다.\n남친은 6개월만에 저랑 처음 한거고\n저는 저번달까지 관계 경험이 있고요\n얘가 저랑 관계후 다음날 바로 성기에 여드름같이 뭐가 생겼다고 성병있는지 물어보더라고요\n저는 얘랑 할 때 아무런 증상이나 이상은 없었는데 혹시나해서 병원가서 검사는 해놓은 상태고요ㅠ\n굳\n잘하셨네요\n잠복기 없이 바로 증상이 올라올 수 있는 성병들이 있나요?\nㅎㅎㅎㅎㅎㅎㅎㅎㅎㅎㅎㅎㅎ\n역시나 잘 모르는 분이군요\n이번기회에 아래 참고하여 여러가지를 잘 공부를 해놓으시길 바랍니다.\n잠복기라는 것은 균이 침투하여 균수가 적으면 바로 증상이 없답니다.\n그래서 균수가 어느정도 생길떄까지는 잠복기라고 하는데 \n그것은 그 사람의 건강상태에 따라서 또는 환경에 따라서 증식속도가 달라지기 때문에 잠복기라는 것의 의미가 없답니다.\n위를 잘 이해하였다면 이제 \n건강상태가 안좋으면 그 즉시 나타날수도 있는 것이니 \n모든 성병이 다 즉시 발현될수도 있는 것이랍니다.\n반대로 님에게 안일어나는 경우도 그럴수가 있는 것이니 성병검사를 해놓기를 잘한 것이랍니다.\n 님의 기분을 맞추려고 쓰는 글이 아니니 \n맞춰주기를 바라면 아래 글은 무시하고 읽지 마시길 바랍니다.\n제글은 제대로 읽어보고 잘못을 알고 고칠 마음의 준비가 된 사람을 위한 글이랍니다.\n 아래는 hpv에 대한 것인데 \n이글을 본다는 것은 님이 아무것도 모르거나 잘못알고 있는 분이라는 것을 의미합니다.\n아래 보시고 아래 설명을 기반으로 알고 있어야 할 것이 많으니 네이버에서 더 찾아서 공부하시길 바랍니다.\n네이버에서 \n곤지름 콘딜로마 hpv 인유두종바이러스 성기사마귀 \n를 하나의 단어로 보고 \n열심히 찾아서 공부하시고 \n그래도 의문이 생기면 이메일로 상담등록후 질문하시면 질문한 것에 대하여만 알려드립니다.\n아래 내용에 자궁경부암과 이형성증도 같이 찾아보세요\n 여기서는 간단히만 언급하고마칩니다.\n일단 hpv는 바이러스질환이라 치료방법이 없답니다.\n그말인즉 일단 걸리면 평생 몸안에 가지고 살아야 합니다.\n감기도 바이러스 질환이라 치료법이 없고 \n증상완화하는 것이 치료의 전부랍니다.\n그래서 사마귀를 레이저로 없애면 치료가 되는 줄 아는데\n외부에 증상을 없앤 것일 뿐이랍니다. 그것이 치료의 전부입니다.\nhpv예방주사는 간단히 자궁경부암 주사라고 일반에서 말하는 주사로 \n맞으면 다예방하는 것이 아니라 현제 최고 9개만 예방될 뿐이니 \n병이 없는 남자를 잘 골라서 사귀세요.\n치료는 기다리면 항체가 생기는 데 그럼 전염성도 없어지고 \n재발하는 것도 없어집니다. 그러니 항체가 지속적으로 생기게 건강유지만 잘하면 됩니다.\n같은 경우로 감기에 걸려 몸안에 감기바이러스를 가지고 살아간다고 하여 아무런 문제가 없는 것과 같습니다.\n보통 8-18개월정도면 항체가 생기니 그동안 조심하시고 그후에도 건강관리를 잘 하세요.\n건강관리를 잘 안해서 항체가 줄어들면 언제든 재발합니다.\n경부암은 hpv에 의해서는 90% 나머지 10%는 다양한 이유(성병, 질염, 잦은 성관계등등)입니다.\n곤지름에 걸렸다면 정청법을 반드시 배워서 하세요\n그럼 재발을 완전히 막아주지는 못하지만 조금은 자주 생기는 것을 막아줍니다. \n곤지름의 가장 큰문제는 경부를 나쁘게 하는데 그것도 조금은 상태가 나빠지는 것을 \n막아줍니다. 경부염증에 대하여 조금은 좋게 해주니 이형성증으로 수술하게 되는 경우를 최대한 막아보세요.\n   배려심도 있고 인내심도 있는 사람만을 위하여 답변을 달고 있으며\n그 목적을 위하여 아래 내용은 일부러 매우 길게 써 있으며 \n중요한 내용은 힌트만 되어 있지 자세한 내용이 언급조차 되어 있지 않으니\n목적에 맞는 분이 아니면 이글을 읽지 마시고 다른 분의 글을 읽으시길 바랍니다. \n배려심도 인내도 없으면 이글을 읽다보면 힘들고 짜증 나게 되고 해로울수 있습니다.\n 아래 글은 그대로 믿지 마시고 스스로 판단하여 행동하시길 바랍니다.\n못믿겠다 싶으면 무시하시고 해볼만 하다면 하시길 바랍니다. 선택은 님의 자유입니다.\n님이 산부인과가면 공통적으로 검사를 해봐야 하는 필수적은 검사를 아래 써 놓으니 되도록 검사를 받으시길 바랍니다.\n성기쪽은 필수적으로 \n질분비물검사(관계하였다면 성병검사까지, 처녀막이 있으면 보통 질분비물 검사를 안해주니 해주는 병원을 잘 찾아보세요) \n경부검사(관계경험이 있는 사람만) \n초음파검사(관계가 있었으면 질초음파, 없으면 복부초음파)를 하세요. \n위정도는 거의 공통적인 필수적인 검사랍니다. \n님의 질문을 읽으면서 선택적으로 해봤으면 하는 검사가 있다면 여기 써 놓습니다.\n없다면 제가 지식이 부족하여 모르거나 위정도 검사하면 충분하다는 것을 의미합니다.\n다른 검사가 필요하다고 병원의 검진의가 판단하면 위 검사외에 다른 검사도 할 것입니다.\n 위에 써진 정도 검사중 이미 2주이내에 검사한 것이 있다면 그것은 빼고 받으셔도 됩니다.\n 아래는 질염으로 고생하는 사람을 위하여 영원히 벗어나는 방법의 힌트만이 써 있으니 완벽한 방법을 찾는다면 아래 글은 읽으실 필요가 없습니다.\n간혹 이메일로 상담신청을 하여 방법을 배우려고 하는데 방법을 알았다고 하여 질염이 낫지 않습니다. 그래서 여기 써 놓을 수도 없습니다. 실제 상담을 해보면 방법은 당일 다 알게 됩니다만 그것을 제대로 쓰는 요령을 아는데 시간이 매우 오래 걸리게 됩니다. 방법은 아주 쉽답니다. 그래서 저는 되도록 스스로 방법을 만들고 실패도 해가면서 책도 찾아보고 하여 스스로 깨닫기를 권하는 쪽입니다.\n그래서 저는 의견란 질문 안받고 1대1질문도 안받습니다. 이메일로 상담신청을 하는 경우만 배우게 되는데, 방법을 배워 응용할수 있는 그 과정을 겪어낼수 있는 의지가 강한 선한 사람만을 선별하기에 대부분 거절되어 실제 상담은 1%이하의 극소수만 하게 됩니다. 상담은 무료지만 상담절차를 거쳐야 하고 그 절차를 거치는 동안에 선량함, 배려심, 인내심, 낫으려는 강한 의지, 이 4가지중 하나라도 없는 사람은 완벽하게 다 걸러내고 있습니다. 그러니 한번 해볼까하는 기분속에서 이메일을 주었다가는 기분이 엄청나게 상할수 있으니 상담하고자 괜히 이메일보내지 마시길 당부드립니다.(이렇게 하니 상담하면 저절로 낫는 줄 알거나 게으른 사람, 자기생각을 고집하는 사람들, 심지어 하라는 것을 안하고도 했다고 거짓말하는 사람까지 다 걸러져서 좋더군요. 그런 분들 백날 알려줘도 안낫거든요. 아파서 상담신청한 사람이니 알려주면 얼마나 열심히 하겠냐고 생각하겠지만 실상은 신경도 안쓰는 사람들이 대부분이랍니다. 웃기죠? 도움을 주는 입장에서 도움을 줘도 되는 사람인지를 가려야 되는 세상이 된 것같습니다.) 그래서 거의 상담을 안해주는 쪽이니 상담하려고 하지 마시고 스스로 해보시길 바랍니다. 그래서 이메일 주소도 여기 안써 놓습니다. 필요하면 찾겠지요.\n까다롭죠? 그러니 스스로, 되도록 스스로, 만들어서 하시길 바랍니다.\n님의 목적은 질병치료겠지만 저의 목적은 도움을 주면 좋은 세상이 만들어질까?해서 무료로 상담해주는 것일 뿐이랍니다. 서로의 목적이 다르답니다.\n서로 돕는 세상에는 감사란 단어가 없고 모든 것이 다 당연한 것일 뿐이랍니다.\n님도 언젠가 여유가 생기시면 그 당연한 일을 님도 해보시길 바랍니다.\n   아래는 정청법에 대한 이야기입니다. 아래 참고하여 스스로 만들어 보면서 실패도 해보면서 여러 가지 책도 보시고 하면서 스스로 깨달아 가면서 좋은 방법을 만들어 보시길 바랍니다. 그것이 제일 좋은 방법입니다. 방법을 알아도 낫지 않고 낫게 하려면 그 방법의 원리를 깨달아 응용할 줄 알아야 낫게 되니까요. 상담을 해도 깨닫는 것은 님의 몫이기에 되도록 상담을 안하시길 권유합니다.\n그러니 아래글을 참고하여 스스로 정청법을 만들어 실패도 하면서 정확한 방법과 그 응용법도 스스로 찾아보시길 바랍니다. (정청법은 (정)확한 성기(청)결방(법)을 의미하고 저만이 쓰는 단어입니다.)\n질염은 냉증으로부터 시작됩니다. 냉증은 질병이 아니라서 병원을 가도 치료대상이 아니랍니다. 다만 스스로 불편하고 질병에 걸리기 쉬운 상태가 되는 것이 문제라 냉증부터 없애야 합니다. 일주일에 한번이라도 팬티에 냉이 묻으면 냉증입니다. (냉은 질에서 나오는 피를 제외한 모든 분비물을 다 냉이라고 합니다.) \n네이버에 보면 증상으로 질염을 판단하고 정확하다고 우기는 사람들이 많은데, 질염진단은 증상으로 판단하는 것이 아니랍니다. 의사도 눈으로 보고 진단하는 경우 맞을 확률이 30%도 안됩니다. 그러니 반드시 산부인과에서 질분비물검사를 해서 확실하게 진단을 한 경우만 믿으시길 바랍니다. 당연히 질분비물검사를 안하는 병원은 다시는 안가야될 것이고 약국에서 약사말로 또는 자가 진단으로 약을 구입하는 것은 어리석은 일이겠지요. \n실제 일어나는 예를 하나 알려드리면 질염이 보통 하나만 걸리는 것이 아니라 여러개가 동시에 걸리는 경우가 많아서 병원을 여러번 가다보니 대충 이병이다 생각하여 그약을 사서 치료하게 되는데 그약에 해당되는 균이 없어지니 증상이 호전하게 되고 그러면 스스로는 제대로 치료한다고 믿게 되는데 어느정도 가면 더 이상 안낫게 되고 심지어 더 악화가 되는 경우가 발생한답니다. 약물과잉으로 인하여 치료하려면 더 어려운 문제로 발전되는 경우가 많습니다. 그러니 반드시 병원가서 검사하고 그 검사결과를 바탕으로 치료받으시길 권유합니다. 저의 말이든 의사의 말이든 검사결과와 일치하여야 비로서 의미가 있는 말이 되는 것임을 명심하시길 바랍니다.\n질염에서 낫으려면 아래 세가지를 해주면 영원히 벗어나게 됩니다.\n첫째 균수를 줄이거나 죽이는 것, 둘째 균이 증식하기 어려운 환경을 만드는 것, 셋째 인체의 자생적 방어가 극대화되게 그 환경을 보전하는 것\n첫째는 병원의 약이 하는 일이라 반드시 병원은 가야 됩니다.\n둘째는 약을 먹으면서 정청법을 같이 할 때 일어나는 현상이고 \n셋째가 정청법을 지속할 시에 일어나는 현상입니다. 이하 내용은 이 3가지를 설명하는 것이니 여기까지 보시고 스스로 위 3가지를 만족하는 방법을 만들 수 있다면 아래 내용은 안읽으셔도 되고 스스로 치료를 해보시길 바랍니다.\n 그래서 일의 순서를 반드시 산부인과에 가서 질분비물검사를 해서 질염의 정확한 원인균을 확정하고 약을 드시면서 균을 죽이면서 정청법을 같이 하고, 다 낫고 나서도 지속적으로 정청법을 해 주어야 질염에서 완전히 벗어나게 됩니다. 정청법은 질염이 완벽히 낫기 전에는 거의 매일 해주어야 하는데 완전히 낫고나면 일주일 한번이나 두 번정도면 충분합니다.\n질염은 자연상태 그대로 두면 반드시 생길 수밖에 없습니다. 마치 얼굴을 한번도 안씻고 살수 없는 것과 같습니다. 정청법은 인체가 외부 균으로부터 스스로 지킬수 있는 정도를 유지시키는 정도에 지나지 않습니다. 정청법을 하게 되면 균이 줄고 잘 자라지 못하는 환경이 되어 인체스스로가 이겨낼수 있게 되어 질염에서 완전히 벗어난 것처럼 보일뿐 질염균의 공격은 계속되고 있는 것이고 그것을 이겨내는 상태를 만드는 것에 지나지 않습니다. 다만 좋은 것은 아무런 약도 쓰지 않고 스스로의 청결유지로 이루어내는 것이라 부작용이 아예 없다는 것입니다.\n어려서 초경을 하기전에도 성기는 더러워지게 됩니다만 그정도가 심하지 않아서 어려서는 대부분은 문제가 되지 않습니다만 중고생부터는 문제가 시작됩니다. 중학생 고등학생의 경우 질염이 처음이라 심하지 않고 아주 건강하여서 아무런 조치를 안해도 증상이 없어지는 경우가 많이 있습니다. 그래서 그대로 방치하고 넘어가죠. 하지만 낫은 것이 아니라 증상이 잠시 좋아진 것이라서 서서히 악화가 되어 가는데 다음에 증상이 나타날 때마다 조금씩 심한 증상으로 가게 됩니다. 치료하지 않으면 재발하게 되고 치료를 하면 시간이 좀 오래 걸려서 재발하게 됩니다. 치료는 반드시 해야 하는데 이유는 질염이 질염에서만 끝나면 좋은데 균이란 질안에서만 살지 않고 다른 곳으로 옮겨가게 되는데 그러면 성기 내부 장기까지 문제가 될 수 있기 때문에 치료는 재발을 한다 해도 반드시 해주어야 합니다. 재발은 병원의 치료가 잘못되어서가 아니라, 재발을 할 수밖에 없는 이유는 님에게 있는 것입니다. 님이 성기청결을 위하여 평소 관리하는 방식에 문제가 있어서 랍니다. 그 방식이 정확하게 청결유지상태에 맞다면 재발은 안하게 됩니다.\n그래서 정청법이라고 이름을 붙힌 것입니다. 제일 중요한 것이 “정확한 청결방식”인 것입니다. \n보통의 경우 성기라 병원가기도 싫고 하니, 그대로 방치하면서 병을 키우게 되고, 결국은 견딜수 없이 악화가 되어서야, 그때에 병원가는 경우가 대부분입니다. 초기부터 치료하는 것이 좋습니다. 치료를 한다고 하여 재발이 안되는 것이 아니라 재발이 되는 시간이 길어질 뿐입니다. 그래도 반드시 치료를 해야 다른 곳으로 병이 번지는 것을 막을수가 있으니 반드시 치료해야 한답니다.\n재발의 악순환은 병원을 간다고 해결되는 것이 아니라, 님이 스스로 정확한 성기청결방법을 만들어서 하시면서 병원치료를 같이 받으면 됩니다.\n님이 하는 방법이 정확한 것에 가까울수록 재발하는 시간은 점점 길어지게 됩니다.\n완벽히 질염에서 벗어나는 방법은 없답니다. 인간이 사는 곳에는 질염균이 항상 존재하기 때문이고 그 균과 같이 호흡하고 살아가기 때문입니다. 그래서 그 균이 성기에서 자랄수 없게 성기 환경을 만들어서 균이 정착하여 질염으로 가지 못하게 막는 것이 유일한 길인 것입니다. 그런 환경을 만든다고 여러 가지 제품이(청결제, 유산균 등등) 나와 있습니다만 제가 볼때는 약간의 도움을 주는 수준정도라서 권하지 않고 그냥 정청법 하나만 제대로 만들어서 하시면 된다고 알려드립니다. 완전히 낫은 후에 청결유지비용은 정청법을 한달에 4번 한다고 가정할 때에 싸게 구입하게 되면 한달에 현시가로 모든 비용을 합하여 1,500원정도면 충분합니다. 단순히 한달 세수할때의 비용과 같다고 보시면 됩니다. 실제 약간 다를 뿐 거의 세수와 같으니까요. 세수 안하고 살수는 없쟎아요?\n 초기증상일때에 정청법을 하면 아주 쉽게 잡힙니다. 치료시기를 넘기면 이제 질염이 1년에 한번정도 발생하게 되면서 이제 점차로 질염에 다시 걸리게 되는 시간이 짧아집니다. 결국 만성으로 갑니다. 만성이란 2달에 한번이상 걸리면 만성으로 분류합니다. \n특별한 이유가 있어서 질염에 걸리는 경우는 극히 드물고, 대부분은 아무런 행동도 안해도 걸리게 됩니다. 그러니 질염이 성관계를 했느냐 안했는냐를 판단할수 있는 근거가 아니랍니다. 중고생이 성관계의심을 받을까봐 부모님과 같이 병원가는 것을 꺼리는데 그럴 필요가 전혀 없습니다. 질염은 성관계를 안해도 걸리게 되니까요. \n이 경우 병원을 가서 치료를 해도 다시 시간이 지나면 자연스럽게 다시 재발하는 것입니다. 간단히 치료전이나 치료후가 달라진 것이 없으니 어느정도 시간이 흐르게 되면 다시 걸릴 수밖에 없다는 것이 명백한 사실인 것입니다.\n그래서 질염은 여성의 감기라고 병원가면 자주 듣게 되는데 같은 이유로 정청법을 하여 치료전과 후의 환경을 다르게 만드는 데 성공하게 되면 재발이 없어지게 됩니다. \n정청법의 원리와 여성의 감기라고 하는 병원의 말은 같은 원리위에 있는 것입니다.\n냉증을 그대로 두면 질염으로 가고 그 상태에서도 방치하면 균이 피부로 가면 피부질환, 방광으로 가면 방광염, 골반내부로 가면 골반염등 여러 가지 증상을 일으키게 됩니다.\n그래서 반드시 정청법을 해서 연결고리를 끊어내야 하고 설사 몰라서 못하게 된다고 하여도 병원가서 치료해도 재발을 하겠지만 그래도 치료를 받아야 다른 문제가 생기게 되는 것을 막을수가 있답니다.\n정청법은 단순히 씻는다고 되는 것이 아니랍니다. 하루 여러번 씻으면 더 악화되기 쉽답니다. 간단히 자주 씻어주는 싱크대는 눈으로 보아도 매우 깨끗하고 청결해 보이지만 실제는 화장실의 변기에 비하여 균의 수가 훨씬 많습니다.\n위 싱크대처럼 성기를 씻어서 깨끗하게 해주어도 질염에 걸리게 되는 데 그 이유가 싱크대가 더러운 이유와 근본적으로 같은 이유랍니다. \n그래서 반드시 정청법을 널리 퍼치고 알려주면 좋은데 방법을 안다고 하여 되는 것이 아니라, 그 방법을 상황에 따라 적용할 줄을 알아야 하는데 그것이 어려운 과정입니다.\n그러니, 방법을 배우고자 하여 상담을 하려고 하지 마시고, 스스로 만들면서 실패도 해가면서 정확한 방법을 찾아내고 왜 실패를 했나 생각해보면서 스스로 책도 찾아 보시길 권유합니다. 그렇게 하다보면 스스로 적용하는 응용력도 생기게 되니 제일 좋은 것이랍니다. 실제 상담에서 응용력을 키워서 제대로 하는데까지 보통 3개월이 걸립니다.방법은 간단하나 제대로 쓰기까지는 3개월이 걸리니 아주 쉽게 생각해낼수 있는 것도 아니지만 쉽게 터득할수 있는 것도 아니니 쉽게 상담을 하려고 하지 마시길 당부드립니다. 다만 임신시에 질염에 걸리면 난감해지니 그전에 방법을 찾으시고 어릴때에 할수록 더 좋으니 스스로 잘 만들어서 해보시길 바랍니다.\n 명심할 것은 정청법은 치료법이 아닙니다. 예방법이니 반드시 병원치료와 같이해야 합니다.\n여성중 20%정도는 평생 질염이 없다고 책에 나오는데 그런 사람을 살펴보면 본인들은 모르지만 정청법과 유사한 방법으로 청결유지를 하고 있습니다. \n인터넷이나 다른 여자분들의 경험속에서 여러 가지 방법이 나옵니다. 주로 청결제고, 그 외에 건조시키기 위한 다양한 방법이 나오는데 제가 아는 한 다 소용없습니다. 질염이 발생되는 시기를 조금 늦추어주는 정도의 이상의 효과를 보는 방법은 전혀 없었다는 것입니다. \n심지어 상담을 거절당하던 분이 병원가서 완벽하게 낫었다고 자랑까지 하더군요. 축하한다고 칭찬하였습니다만 속으로는 웃었겠지요. 하하하하 그런 방법은 있을수가 없습니다. 병원이 치료를 못해서가 아니랍니다. 자동차 아시죠? 새로 차를 사면 매우 깨끗합니다. 차를 쓰게 되죠. 그러면 더러워지기 시작합니다. 그대로 차를 안쓰고 방치하여도 먼지가 쌓입니다. 먼지를 안쌓이게 할수 있는 보관법은 없답니다. 이제 세차를 해야 되죠. 세차를 하든 안하든 결국 한번정도는 깨끗하게 세차해주는 전문가를 찾아가야 아주 깨끗해집니다. 바로 그 전문가가 병원인 것이죠. 전문가는 약품을 쓰고 기구를 쓰고 하죠. 그럼 세차 전문가에게 세차한 후에는 더러워지지 않나요? 다만 더디게 더러워질 뿐이죠. 신차가 더러워지기 어렵듯이요. 어차피 더러워지게 되어 있답니다. 질염균을 우리가 피할수 있는 방법은 없답니다. 그러니 이제 신차처럼 완벽하게 깨끗한 상태가 아니더라도 거의 근사하게 깨끗한 상태를 유지하려면 세차하는 요령을 배워야 하는 것입니다. 바로 세차하는 방법을 배워서 신차처럼 매우 깨끗하지는 않아도 거의 근사하게 깨끗함을 유지하는 방법을 만들던지 배워야 합니다. 바로 그것이 정청법일 뿐입니다. 세차를 하다보면 이상한 얼룩이 나오죠. 그럴 경우는 좀 다르게 세차해야 하죠. 그래서 정청법도 응용을 할줄 알아야 합니다. 그러면 거의 새차처럼 깨끗한 상태를 유지할수 있게 되는 것입니다. 그정도가 되면 질염에서 완벽하게 벗어나게 됩니다. 병원에서 질염치료는 질염균의 수를 줄여주거나 거의 없게 해주는 정도에서 끝나게 됩니다. 위에서 알려드렸다시피 질염균은 항상 유리켵에 있습니다. 그러니 다시 번식하여 질염이 재발하는 것은 당연한 것입니다.\n질염에서 완전히 벗어나려면 어떻게 해야 하느냐? 님이 잘 관리를 해야 합니다.\n그렇다고 질염에 걸렸는데 어차피 재발할 것이니 병원을 안간다면 이는 문제를 더 크게 만들게 되고 그것이 골반염으로 번지게 되면 이제 입원까지 해야 되는 상황까지 가게 됩니다. 질염에서 골반염까지 가려면 보통의 경우 매우 긴 시간이 필요하지만 특수한 경우는 빠르게 되기도 한답니다. 그러니 질염증상이 있으면 병원을 가시길 바랍니다. 돈을 아끼려고 약국에서 약이나 사서 드시는데 위험한 생각이고, 병원가서도 의사가 검사도 없이 처방하는 곳은 피해야 합니다. 반드시 검사를 한 후 처방을 해주는 병원을 가시길 바랍니다.\n또한 균은 약이 죽이는 것이고 그 상태를 보전하는 것은 정청법이니 둘다를 해야 합니다.\n  인터넷에는 부끄러운지도 모르고 욕이나 이상한 말을 해서 타인에게 해를 주는 사람들이 있습니다. 그런 사람들에게는 반드시 100% 경찰에 신고를 해주는데 처리가 늦어지는 경우가 많더군요. 그래서 기다리다 보면 잊을만 할 때 쯤에 경찰통지가 갈 것입니다. \n -스스로 어리석다는 것을 깨닫기 제일 어려운 사람은 정답을 가장 잘 맞추는 사람이다.-\n-ㄹ-\n  ', '안녕하세요.\n16년째 여성곤지름(콘딜로마, 여성성기사마귀)을 주로 치료를 하고 있는 노원 산부인과 전문의 조병구입니다.\n곤지름을 의심하고 계시군요.\n우선 이것이 곤지름이 맞는지 병의원에서 정확히 진찰을 받아보시는 것이 중요합니다.\n치료에 관해서는 곤지름이 맞는지 확인한 후에 결정하시면 되는데요.\n곤지름은 육안으로 90%이상 진단이 가능하지만, 10%에서는 다른 질환과 구분이 되지 않아\n조직검사를 통해 확인해야합니다.\n확인 후 곤지름이 맞으면 바로 치료가 가능합니다.\n저희 병의원에서는 곤지름 치료 시에 약물요법은 사용하지 않습니다.\n재발율이 높고, 자주 치료를 받아야하기 때문입니다.\n주로 레이저나 고주파 전기소작술을 이용한 치료를 해드리는데요.\n재발을 해도 한 달 간격으로 2~3회 정도면 대부분 완치될 수 있습니다.\n불편을 줄이기 위해 수면마취가 필요할 수 있으며 마취 수준에 따라 추가비용이 발생할 수 있습니다.\n곤지름 치료 시에 외음부, 질 속, 항문 속까지 모두 진찰해서 발견한 곤지름을\n의사에게 제대로 제거 시술 받아야 재발율과 재치료율이 낮습니다.\n저희 병의원은 질 속과 외음부 항문 속 요도 안쪽까지 모든 부분의 곤지름을 제거할 수 있는 유일한 의료기관입니다.\n일상생활의 불편을 줄이기 위해 곤지름은 재발을 하더라도 보통 한 달에 한번 정도만 진찰을 하고 치료해드리고 있습니다.\n국소마취 시 비용은 8~10만원 정도이고, 수면마취는 10~15만원 정도 추가비용이 있습니다.\n곤지름 진찰 시에는 보통 성병종합검사를 같이 받아야하는데요.\n곤지름 자체가 성병의 일종이라서 감염이 가능한 모든 성병에 관한 검사와 치료가\n반드시 필요합니다.\n비용은 8~13만원 정도입니다.\n병의원마다 검사의 종류가 다양하고 검사해야하는 이유도 다양하지만, 처\n음 진료 받을 때\n제대로 검사 받는 것이 중요합니다.\n이전에 여타 병의원에서 검사받으신 적이 있으시면 결과지를 가지고 오시거나 정확히 결과를 알고 오시면 중복되는 검사는 받지 않으셔도 됩니다.\nHPV에 의한 자궁경부암과 곤지름을 예방하기 위해 곤지름을 경험하신 분들은\n향후 예방을 위해 자궁경부암 백신을 반드시 맞도록 하고 있습니다.\n자궁경부암/곤지름 예방백신에 관해서도 함께 안내를 드리겠습니다.\n백신은 현재 2가지가 나와 있는데요.\n각각 가다실과 가다실 9(nine)이라고 불립니다.\n가다실은 4가 백신으로 자궁경부암과 곤지름 예방을 목적으로 하고,\n가다실 9(nine)는 9가 백신으로 9가지 바이러스 타입에 예방효과가 있어\n가다실 (4가)보다 효과가 좋습니다.\n저희 병의원(서울 강북지역)에서는 보통 20~30대 여성에게는 가다실 9(nine)을 40대 이후에는\n가다실을 주로 추천하고 있습니다.\n가다실이 치료백신은 아니라서 지금 있는 곤지름은 없애주지는 못하지만,\nHPV에 의해 생길 수 있는 더 심각한 질환인 자궁경부암을 비롯한 여성암을 예방해주기 때문에 반드시 필요합니다.\n혹시 수도권에 사시거나 지방에서 사셔서 좀 멀더라도 체계적인 치료를 원하시는 경우\n예약 후 방문주시면 정확한 진찰 후에 속 시원한 상담과 치료를 해드리도록 하겠습니다.\n빨리 완치되시길 바랍니다.', '인유두종바이러스와관련해\n식이유황(MSM)이 치료제랍니다치료제 ^^\n나른하다거나 조금어지럽긴할텐데\n보름이상을, 식이유황 1.0g\n이렇게드시고 병원가서 검사받아보셔요\n소멸 내지는 소멸에가까운결과를 얻을 수 있으실거랍니다\n좋은일만 가득하길^^']",3,https://kin.naver.com/qna/detail.naver?d1id=7&dirId=7011404&docId=366154683&qb=67Cx7Iug&enc=utf8&section=kin&rank=189&search_sort=3&spq=0,여성질환
