page,date,tags,questions,questions_add,answers,N_answer,url,category
6,2020.06.28,['시작프로그램'],컴퓨터 시작프로그램,컴알못 입니다. 시작프로그램이 무엇인가요? 개념 설명 좀 해주세요.,"['컴퓨터는 부팅과 동시에 사실상 매우 많은 프로그램들이 실행이 됩니다.\n작업관리자로 들어가면 \n수십개의 프로세스가 있지요... 이게 자동으로 실행되는 프로그램들입니다..\n그런데, 운영체제에서 사용하는 프로그램외에,\n사용자가 추가로 컴퓨터가 시작되자마자 실행되게 하고 싶은 프로그램이 있을 겁니다.\n예를들면 백신이랄지, 카카오톡 이라든지...이런것들을 \n시작프로그램에 등록해 놓고 자동으로 실행되게 하는 것이죠..\n그런데, 진짜 중요하고 꼭 필요한 것들은 시작프로그램이 아니라\n서비스에 등록이 됩니다. (물론 다 중요한 것은 아닙니다. )\n사실상 시작프로그램들은 별로 중요하지 않습니다.\n디스플레이 설정이랄지 오디오설정이랄지 ... \n이런것들은 한 번 설정하면 거의 변경할 일이 없거나, \n그냥 간단하게 다시 실행시킬 수도 있습니다.\n그러므로, 시작프로그램에 등록할 필요가 없어요..\n- 평상시 거의 사용하지 않으면서 시스템 리소스만 갉아 먹거든요..\n그리고, 필요하면 언제든지 사용자가 실행시킬 수 있는 것이고요..\n그래서, 난 시작프로그램을 한 개도  등록하지 않습니다.\n시작프로그램에는 윈도우 디펜더외에 다른 백신을 사용하면,\n그것만 시작프로그램에 남겨 놓으세요..\n(윈도우 디펜더 사용하면 그것도 등록할 필요가 없습니다. )\n은행보안프로그램이나 각종 자동업데이트 프로그램등은 \n시작프로그램에 있어봤자 속도만 떨어지게 만듭니다..\n보안프로그램은 필요하면 자동으로 다시 설치될 것이고,  \n업데이트 등은 필요하면 그때그때 다시 실행시키면 되는 것입니다. ']",1,https://kin.naver.com/qna/detail.naver?d1id=1&dirId=10206&docId=361013146&qb=67Cx7Iug&enc=utf8&section=kin&rank=59&search_sort=3&spq=0,유틸리티
6,2020.06.28,"['랜섬웨어', '메모장속성', '#Magniber']","랜섬웨어, 메모장 속성 등","파일이 랜섬웨어 당했습니다. 여러번. 근데, 파일을 망가트릴 때마다 메모장 파일을 하나씩 남겨놓습니다. (사진1) 그 메모장 파일의 속성을 보면 사진2.  사진3. 입니다.

질문

1. 사진1 의 메모장 내용 부탁합니다. 뭐, 파일 열려면 돈 내놔라 하는 내용이겠으나 구체적 내용 알고싶어요. 완전한 영문 번역 아니라도 내용 인지 가능한 영문 해석 정도?  부탁드립니다.

2. 사진2.와 사진3은 각기 다른 날짜에 랜섬웨어가 침투하고 남긴 텍스트인데 그 메모장 파일을 각 속성입니다. 근데, 사진2는 만든날짜, 수정한 날짜, 억세스 날짜가 동일하고 사진3은 각 날짜 틀리는데, 그 각 3가지 날짜의 의미들과 어째서 사진2는 3개날짜 동일하고 사진3은 그러하지 아니할까 부탁드립니다.

3. 제컴은 V3 또는 알약을 실시간 감시로 항상 작동중인데 가끔씩 악성코드나 바이러스를 자동으로 잡아 치료해주는데 랜섬웨어는 한번도 잡은적이 없는것 같아요. 랜섬웨어 방지대책으로는 무엇이 있을까요?","['토르 브라우저 로 들어가서 뭐 하라는거 같은데여ㅛ', '1.메모장 내용\n랜섬노트 (메모장)의 내용:\n(정확하진 않지만 방식은 비슷함)\n당신의 모든 문서,파일,데이터 배이스등 기타 중요 문서들이 암호화 되었습니다!\n즉, 당신의 파일들은 손상되지 않았다는 뜻입니다! 단지 조금 수정만 되었을 뿐입니다!\n파일을 원래대로 되돌리고 사용하게 만들려면 다음 지시를 따르십시오.\n1.토르 브라우저에 가서 비트코인 지갑을 만든다.\n2.비트코인을 다음 주소로 전송한다.\n[무슨 링크]\n당신은 오직 토르 브라우저로만 할수 있습니다!\n또한, 당신은 아래의 임시 주소로도 접속할수 있습니다.\n[링크1]\n[링크2]\n[링크3]\n[링크4]\n경고, 위 링크는 임시 주소일 뿐입니다! 일정 시간동안만 이용할수 있습니다!\n==================\n대충 이정도로 해석이 되고요.\n2.사진2,사진3의 시각\n사진 2는 랜섬웨어 침투 당시에 더 빨리 암호화가 되어 (보통 랜섬웨어에 걸리면 파일들의 수정 날짜는 랜섬웨어가 침투한 날로 설정됨)그런것 같구요. 사진 3은.. 오류가 난 것 같습니다. 그것밖에  지금은... 믿을수가 없는것 같아요..\n3.백신\nV3와 알약을 동시에 쓰는게 아애 잘못됬습니다.\n하나를 영구삭제 하세요. 그리고 백신추천은 알약을 강추드립니다. \n알약이 용량은 다른백신에 비해 좀 큰 편이지만 권리자권한을 주지 않아도 잡는걸로 알고 클릭 한 동시에 차단해버려서;; 오진도 적은 편으로 저는 느끼네요.  V3는 약간 시한폭탄 같은 느낌이기때문에 알약을 추천드립니다 ^-^;', 'Magniber 랜섬웨어에 감염된 것으로 복구 방법은 없습니다.\n해당 감염 원인은 Windows 7 + Internet Explorer 웹 브라우저 환경에서 보안 업데이트를 하지 않고 웹 사이트 접속 중 자동 감염됩니다.\n예방법은 지원이 종료된 Windows 7은 사용하지 마시고 Windows 10 운영 체제를 사용하시기 바랍니다.']",3,https://kin.naver.com/qna/detail.naver?d1id=1&dirId=11002&docId=361015469&qb=67Cx7Iug&enc=utf8&section=kin&rank=58&search_sort=3&spq=0,바이러스
6,2020.06.28,[],해킹잡는법,"알약,v3이런 백신앱으로 해킹이나 바이러스를 잡을수있나요?","['아뇨', ' 100% 가능하지는 않지만 안티바이러스 프로그램(백신)의 실시간 탐지나 클라우드 분석 등의 기능을 통해 바이러스나 불법적인 접근 시도(해킹 시도)를 상당 부분 막아낼 수는 있습니다. 다만, 새로운 공격 방법과 바이러스 등이 계속 나와서 완전하게 커버는 불가능한지라 사용자의 주의도 필요합니다.']",2,https://kin.naver.com/qna/detail.naver?d1id=1&dirId=11001&docId=361016745&qb=67Cx7Iug&enc=utf8&section=kin&rank=56&search_sort=3&spq=0,해킹
5,2020.06.28,"['빌게이츠', '빌게이츠2020프로젝트', '빌게이츠음모', '코로나바이러스', '코로나', '감기', '북한도발']",코로나바이러스 믿는사람이 있나요?,"단순한 감기를 왜 코로나바이러스라고 단정지으는건지 어이가 없네요.
감기는 열나고.기침하고.몸살나고.몸이 으스스한데.
이거를 코로나바이러스라고 기사를 퍼트리는건지 화가납니다
솔직히 마스크 안하고 다녀도 되는건데.
이리저리 죄다 마스크하라고 난리니 ㅡㅡ
너무 세뇌가 된건지 멍청한건지 나라에서 죽으라고 하면 죽을건가요?
빌게이츠가 2020프로젝트 제발 없앴으면 ...언제까지 전세계인류들한테 갖고 놀 것인지...진짜 답답합니다.
중국우한이랑 손잡아서 아오
빌게이츠가 백신에 왜 고집을 피는건지?
이미 아프리카에서 수많은 사람을 죽인 백신으로 실패 본 살인마인데!
누군가가 차라리 속보발표에서 코로나바이러스 사실이 아니라고
기사가 났으면 좋겠네요.
북한에서는 전쟁준비중이고..핵이 서울로 퍼트리는순간 다 죽게 되는데...국적포기하고 안전한 나라로 이민가야되나싶고..이러다가 남한 망하게 될듯 ..
트럼프는 미군부대철수하라 난리!
북한은 돈 안준다고 난리..
언제까지 북한눈치만 봐야할지...
그냥 각자나라에서 오순도순하게 잘 지냈으면 좋을련만..
남한땅에서 지진이 일어나질 않나..
남한 땅굴 열씨미 파고 있는 북한군인 ...
하...기사가 진짜 문제다.
가짜뉴스
가짜기사
이거 너무 심각합니다.
마스크 진짜 찢어버리고 싶다
마스크 안 해도 되는걸 왜 하라고 하는건지!!!!!!
너무 세뇌됐다 심각하다 .
국가에서는 만만한 장소에서만 집합명령을 내리질 않나?
식당이랑카페는 왜 제외하는건지?
거기가 더 심각한데?
진짜 모든게 다 가짜고 믿지않는다
검사하는사람들도 국가에서 시켜서 하고 있는 느낌이다.
다 쇼같은 느낌이다.","['거지같은 마스크에 거지같은 북한에 거지같은 코로나 때문에 스트레스 장난아니조?\n저도 스트레스 인데요 ㅜ 아래 기사를 보시면 알듯이 현재까지 계속해서 확진자가 나오고 있어요. 북한이 서울에 핵을 떨어트린다? 핵반경이 우리나라에만 영향을 끼치면 쉽게 가능하나 서울에 핵을 터트리면 그 반경이 쑥대밭이 되는데 북한도 포함입니다... 북한도 같이 날라가서 중-미 전쟁으로 한반도 먹겠쥬? 아래 기사 보고 사태 파악 바랍니다\nhttp://www.newspic.kr/view.html?nid=2020062801403372150&pn=420&cp=b3Khd93q&utm_medium=affiliate&utm_source=adpick\n마포구, 코로나 19 확진자 35번 확인→이동 동선 공개\n(서울=국제뉴스) 한경상 기자 = 마포구는 공식 불로그를 통해 코로나 19 확진자(35번)\nwww.newspic.kr', '어마어마하시네요. 코로나 바이러스로 인하여 전세계가 뒤집어지고 난리인데, 이것을 조종할 만한 자본을 가진 세력이 있다고 생각하시는 건가요? 마스크 때문에 짜증나고 힘든것은 알겠으나, 본인이 지나가면서 인터넷에서 발견한 글이 전부라고 생각하시는건 아닌지 다시 생각해보셨으면 하네요']",2,https://kin.naver.com/qna/detail.naver?d1id=6&dirId=612&docId=361022776&qb=67Cx7Iug&enc=utf8&section=kin&rank=50&search_sort=3&spq=0,재난재해
6,2020.06.28,[],코로나에 대하여,"코로나는 전에 흑사병, 스페인 독감처럼 집단면역 이나 저절로 종식될수 있나요?","['백신이있어야 종식가능해요..', '아뇨  없어요 백시 ㄴ개발되야되요', '질병은 저절로 종식되지 않습니다. 스페인 독감도 감염추적학자 또는 역학조사관들의 움직임으로 최초감염자(퍼이선트 제로)를 발견하여 원인과 적절한 대응으로 멈추는 것이 가능했던것입니다. 각 국가마다 공공보건국의 살균제 대량살포도 효과가 있었죠 그러므로 코로나-19도 일종의 면역 항균방안이 없으면 저절로 종식 될 수는 없다고 생각됩니다.']",3,https://kin.naver.com/qna/detail.naver?d1id=8&dirId=814&docId=361021023&qb=67Cx7Iug&enc=utf8&section=kin&rank=54&search_sort=3&spq=0,기타
6,2020.06.28,[],전염병에 대하여,"예전 흑사병, 스페인 독감은 백신, 치료제 없이 걸릴 사람 다 걸려서 저절로 종식 됬는데 왜 코로나는 백신 없으면 종식 못해요?","['네', '예전 전염병에 비해서 전파력이 강하기 때문에 그렇습니다']",2,https://kin.naver.com/qna/detail.naver?d1id=6&dirId=61303&docId=361021142&qb=67Cx7Iug&enc=utf8&section=kin&rank=53&search_sort=3&spq=0,사람과 그룹
6,2020.06.28,['#문제풀이'],생활 속에 있는 표준화 알려주세요ㅠㅠ,"표준화된 제품을 영역별 5개 씩 조사 해오라는데 암만 찾아 봐도 못 찾겠어요..
제조기술, 건설기술, 수송기술, 정보통신기술, 생면기술 이렇게 다섯 개인데 내일까지라..
최대한 빨리 부탁드릴게요ㅠㅠㅠ","['1. 제조 기술- 볼펜의 규격(0.5, 1.0 등), A4 용지 등\n2. 건설 기술- 출입문 크기, 아파트 평수(면적)\n3. 수송 기술- 트럭의 크기(25톤, 1톤 등 용량), 2000cc와 같은 자동차 배기량 등\n4. 정보 통신 기술- CPU, 메모리, USB, 블랙박스 메모리 등\n5. 생명 기술- 백신, 소화제, 진통제, 항생제 등', 'ㄷㅂ 2학년이다!!']",2,https://kin.naver.com/qna/detail.naver?d1id=11&dirId=110311&docId=361022198&qb=67Cx7Iug&enc=utf8&section=kin&rank=52&search_sort=3&spq=0,기술가정
6,2020.06.28,[],꼭~ 도와주십시오~3,"그 실례로 제 아들이 증상이 나타나 온 가족이 경악을 금치 못했지만 그 특정한 노래를 부르게 했더니 거짓말처럼 곧 완쾌되었습니다.
그러므로 지금 무섭게 확산되고 있는 코로나바이러스를 조기에 퇴치시키려면 이 노래를 조속히 세상에 널리 알려 모든 사람들이 백신 대신 불러야 합니다.","['As an example, my son had symptoms, and the whole family was astonished, but when I had him sing that particular song, he was soon cured like a lie.\nTherefore, in order to eradicate the scary and rapidly spreading coronavirus, we must release this song  to the world as soon as possible and everyone should sing it instead of the vaccine.']",1,https://kin.naver.com/qna/detail.naver?d1id=11&dirId=11080308&docId=361022294&qb=67Cx7Iug&enc=utf8&section=kin&rank=51&search_sort=3&spq=0,"영어 공부, 시험"
7,2020.06.28,[],국제 금값의,"중장기 주가전망은?
미보유자 매수 시점은?","['안녕하세요\n코로나팬데믹으로 각 국가들이 경기부양을 위해서 돈을 풀고 있는 상황이기에 전문가들은 올해 말까지는 금값이 상승할것이라고 말하고 있습니다.  제 블로그로 오셔서 엄선된 최신 경제, 사회 뉴스를 보시면 판단하시는데 도움이 되리라 생각합니다.\n앵글이의 우리 경제 사회 이슈 : 네이버 블로그\n세계 경제와 사회 이슈에 관련된 기사들을 엄선하여 제공해 드리고 있습니다. 오늘도 행복한 하루 보내세요^^\nm.blog.naver.com', '1. 국제 금값의 중장기 주가전망은? : 금값은 주가와 역상관관계입니다. 즉, 주가가 상승하면 금값은 하락하고, 주가가 하락하면 금값은 상승합니다. 귀하께서도 잘 아시겠지만 2020년 1월 21일부터 발생한 코로나19 악재로 현재 주가는 많이 하락한 상태입니다. 백악관 코로나19 대응 TF(태스크포스)의 주축인 파우치 박사는 연말까지 코로나19 백신이 나올 수 있다며 ""예상치 못한 문제만 없다면 2020년 12월까지 백신을 배포하는 것이 가능하다.""고 말하였습니다. 코로나19 신약이 개발된다면 2020년 12월부터는 주가가 상승할 것입니다. 그러므로 2020년 12월부터는 금값은 하락할 것입니다.\n2. 미보유자 매수 시점은? : 2020년 12월경에 매수하시면 됩니다. 그 이유는 2020년 12월경에는 코로나19 신약이 개발되어 주가가 상승하면서 금값이 하락할 확률이 높기 때문입니다. ']",2,https://kin.naver.com/qna/detail.naver?d1id=4&dirId=40102&docId=361010987&qb=67Cx7Iug&enc=utf8&section=kin&rank=62&search_sort=3&spq=0,"주식, 증권"
5,2020.06.28,[],컴퓨터 껏다키면,이상한 팝업창이 떠요 인터넷같은 팝업창,"['시작프로그램을 켜놓으시거나 애드웨어일 가능성이 높은데, 시작프로그램일 경우 작업 관리자에서 시작프로그램에 들어가셔서 모두 사용 안함 으로 바꾸시면 됩니다. 애드웨어라면 백신을 통해서 추적해 하나씩 삭제하는 방법밖에 없습니다.']",1,https://kin.naver.com/qna/detail.naver?d1id=1&dirId=10101&docId=361023335&qb=67Cx7Iug&enc=utf8&section=kin&rank=49&search_sort=3&spq=0,데스크톱
6,2020.06.28,[],성인 폐렴 접종후 열 나요,"65세 이상 성인 폐렴접종후 팔이 심하게 붓고 열이나는데
어찌할까요?

접종후 이틀열 나고 몸살기운도 있다고 하네요
선별진료소 가셨어요

원래 성인도 열 나나요?
혹시 폐렴 백신이니 코로나 확진되지 많을까요?
정말 궁금합니다 ㅠㅠ",['예방접종후에는  열이날수 있어요  백신때문이라면   코로나 검사에서나오지는 않을겁니다'],1,https://kin.naver.com/qna/detail.naver?d1id=7&dirId=70117&docId=361019190&qb=67Cx7Iug&enc=utf8&section=kin&rank=55&search_sort=3&spq=0,가정의학과
7,2020.06.28,[],"코로나는 언제 끝나는 걸""까요?","이것때문에 집에만 있어야하니 이젠 지치다못해
정신이상까지 생기는듯해새요",['코로나는 백신이나 치료제가 개발 되어야 끝날 것 같아요.\n그 끝이라는 것이 완전한 소멸이 아닌 감기처럼 되는 것이지요.\n이것은 제 생각이 아닌 전문가님들이 발표한 내용을 근거로 한 것입니다.\n그러니 마음을 넉넉하게 가지는 것이 좋을 듯합니다.'],1,https://kin.naver.com/qna/detail.naver?d1id=7&dirId=705&docId=361009712&qb=67Cx7Iug&enc=utf8&section=kin&rank=63&search_sort=3&spq=0,대체의학
7,2020.06.28,[],백신 프로그램 Avast Free Antivirus,Avast Free Antivirus 을 삭제하려고 제어판으로 들어가 삭제를 누르니 액세스 권한이 부족해서 제거할 수 없다고 뜹니다 어떻게 지울 수 있나요??,['https://www.avast.com/ko-kr/uninstall-utility\nAvast 제거 유틸리티 | Avast 제거를 위한 aswClear 다운로드\n제거 유틸리티 avastclear를 사용한 소프트웨어 제거 경우에 따라 제어판의 프로그램 추가/제거를 사용하여 Avast 소프트웨어를 제거할 수 없습니다. 이 경우 제거 유틸리티인 avastclear 를 사용하십시오. 데스크톱에 avastclear.exe 를 다운로드합니다. Windows를 안전 모드로 시작합니다. 제거 유틸리티를 엽니다(실행). 기본이 아닌 다른 폴더에 Avast를 설치했다면 찾으십시오. 참고: 선택한 폴더의 모든 내용이 삭제되므로 주의하십시오. 제거를 클릭합니다. 컴퓨터를 다시 시작합니다. 대한민국 유용한 링크 ...\nwww.avast.com\n이걸로 제거 해보시고요 권한은 관리자 권한으로 로그인 하신건지 보세요. 만약 아니시면 관리자 권한으로 계정을 만드시거나 거기로 로그인 하셔야 해요. 업체나 그런 곳에는 관리자가 있어요 전산실에 '],1,https://kin.naver.com/qna/detail.naver?d1id=1&dirId=11002&docId=361004033&qb=67Cx7Iug&enc=utf8&section=kin&rank=69&search_sort=3&spq=0,바이러스
7,2020.06.28,"['코로나19확진자', '코로나19', '코로나19세계현황', '#코로나19', '#코로나19']",코로나19 확진자 수 세계현황 바로바로 업데이트되는 곳 있나요?,"코로나19 확진자수랑 세계현황 보는 사이트들마다 숫자가 뭔가 다 제각각 다른거같은데...
수치 실시간으로 잘 정리된 곳 있을까요?

곧 여름휴가철인데..갠적으로 여행좋아하는사람입장으로서
빨리 백신도 나오고 전세계적으로 사태가 잠잠해지고 입국금지풀려서
맘편히 여행다닐수있음 좋겠네요...","['안녕하세요~^^ 코로나19 확진자수와 세계현황에 대해 질문주셨는데요\n먼저 국내 확진자 현황은 매일 아침 11시에 집계가 되고 오후 5시즈음 업데이트가 됩니다.\n그리고 세계현황은 각 나라별 시차가 달라 집계되는 시간이 조금씩 다른데요,\n아래 코로나19 확진자수 국내 현황과 세계 현황에 대해 잘 정리가 되어있는 링크입니다.\n코로나19 세계현황, 국내 확진자수 실시간 업데이트\n2019년 12월 우한에서 처음 발생한 코로나 바이러스가 아시아를 넘어서 유럽에 큰 영향을 끼치고 있습니다. 이탈리아에서는 여러 지역을 폐쇄했는데도 불구하고, 수 많은 확진자들이 나오고 있습니다. 이에, 대한..\nkakaobankloan.tistory.com\n참고부탁드리며 건강 잘챙기시길 바라겠습니다.\n도움이 되셨다면 채택 부탁드립니다~^^', '코로나19 세계 현황 기준으로 확진자 수를 바로바로 집계하기에는 \n어느 정도 어려움이 있습니다. \n나라별로 시간 차이가 있기 때문이죠. 우리나라에서는 아침에 바로바로 집계되더라도 \n지구 반대편에 있는 나라에서는 새벽시간대기 때문에 집계에 어려움이 있을 수밖에 없죠 \n코로나19 확진자 수 국내 상황판은 잘 정리되어 있는 사이트들이 많습니다. \n네이버나 구글에서 검색하면 바로 제일 위에 보기 좋게 정리되어 있습니다. \n자세히 보기에 들어가면 코로나19 세계 현황도 한눈에 보실 수 있습니다. \n답변에 도움이 되셨길 바랍니다. \n그럼 여름철 건강 조심하시길 바라겠습니다.', '코로나19 세계현황은 현재 전세계적으로 확진자가 천만명을 넘어섰으며 \n미국에서 260만명, 브라질에서 128만명으로 가장 많이 발생하고있습니다. \n요즘 코로나19 세계현황을 실시간으로 업데이트해 보여주는 사이트들이 많이 나와있습니다. \n네이버에서도 상단에 잘 정리해서 보여주고있으니 참고하시면 좋을것 같아요 \n답변이 도움되셨으면 채택해주시면 고맙겠습니다^^', ""코로나나우 여기가 가장 낫지 않을까 싶네요.\n국내 확진자, 세계 확진자 동시에 확인할 수 있고 업데이트 빠르거든요.\n자세한 사항은 하단 Q&A를 통해 확인 부탁드리겠습니다.\n중학생이 만든 '코로나나우(CoronaNOW)' 등장, 접속방법은?\n코로나19(신종 코로나바이러스 감염증)에 대한 정보와 실시간 상황 대시보드를 제공하는 '코로나나우(CoronaNOW)'가 등장했다. 코로나나우 주요 기능은 세계 코로나19 감염 현황과 현재 국내에서 검사 중인 환자수..\nme2.do\n답변이 도움 되셨다면 채택과 감사포인트로 마음을 전해 주세요^^"", '최대한 빠르고 신속한 세계 코로나 현황을 볼수있는  사이트예요. .\n나라를 누르면 지역별로 감염자숫자 뜹니다 참고하세요\n제가 여때껏 가본 사이트들 중에 젤 보기편하고 신속하고 정확도도 높은거같네요\n도움 되셨으면 좋겟네요~\nhttps://www.worldometers.info/coronavirus/\nCoronavirus Update (Live): 10,081,545 Cases and 501,298 Deaths from COVID-19 Virus Pandemic - Worldometer\nThis website uses cookies to ensure you get the best experience on our website. Learn more Got it! COVID-19 Coronavirus Pandemic Last updated: June 28, 2020, 02:09 GMT Graphs - Countries - Death Rate - Symptoms - Incubation - Transmission - News Coronavirus Cases: 10,081,545 view by country Deaths: ...\nwww.worldometers.info']",5,https://kin.naver.com/qna/detail.naver?d1id=4&dirId=409&docId=361009241&qb=67Cx7Iug&enc=utf8&section=kin&rank=65&search_sort=3&spq=0,"경제 동향, 이론"
