page,date,tags,questions,questions_add,answers,N_answer,url,category
15,2020.08.24,[],"사파리로 인터넷하다가 이상한 팝업창이 떠서 실수로 구독을 눌렀는데 갑자기 캘린더에 이런게 떴어요 어떡해야되죠??
아이폰이라서 앱스토어에 백신프로그램도 마땅한걸 모르겠어서요,,",,"['https://kin.naver.com/qna/detail.nhn?d1id=1&dirId=1070202&docId=344713914\n아이폰 캘린더\n저도 모르는새 아이폰 캘린더에 이런게 있던데 삭제가 안됩니다 어떻게 해야하나요?? ㅠㅠ\nkin.naver.com', '안녕하세요. 킹콩VPN 지식IN 상담원입니다^^ \n아이폰 설정-암호 및 계정-구독한 캘린더 선택하시고 계정삭제를 눌러주세요~\n아마 크롬사용하시면서 IP우회프로그램 사용하시다가 바이러스가 생겼다며\n나오는 광고앱입니다~\n절대 설치 하시지마시구요~설치하시면 결제되세요~\n크롬들어가셔서\n메뉴-설정-사이트설정-알림-허용됨-해당광고사이트 주소-삭제 및 재설정 눌러주세요~\n다 그런건 아니지만 무료VPN의 수익구조 자체가 광고수익이나 개인정보판매라는\n소문이 있을 정도로 보안에 취약하다고 합니다..\nVPN을 사용하신다면 안전하고 믿을 수 있는 VPN을 사용하셔야 합니다!\n실시간 상담, 빠른 피드백이 가능하고 가성비 좋은 VPN 찾으시면 \n저희 킹콩VPN은 어떠신가요~^^\n저희 킹콩VPN은 체계적으로 서버관리를 하고 있어 막힐 걱정없이 이용가능합니다! \n속도면에서도 AS대처면에서도 빠른 VPN을 찾으신다면 \n킹콩VPN을 강력추천해드립니다!!!\n무료 체험가능하시니 부담없이 저희 킹콩 VPN이용해보세용~', '안녕하세요 판다vpn지식인 상담사입니다\n무료 vpn을 이용했을때, \n또는 보안이 안전하지않은 사이트에 접속을 하였을 경우\n발생하는 악성광고 입니다!\n이런경우\n아이폰 설정> 암호및계정>구독한캘린더>해당캘린더삭제 \n이렇게 하시면 간단하게 해결 가능하십니다!\n무료VPN의 수익구조는 정보판매라는\n소문이 있을정도로 피해사례가 많이 있습니다!\n혹시나 지금 무료vpn을 이용하시고 계시다면 지우시는게 좋을 것 같습니다!\n저희 판다vpn은 전세계에서 한국서버 50개이상 보유 \n게임유저들의 위한 게임서버 다수보유, 각종 해외서버도 보유중입니다 ^^\n네이버에 ""판다VPN"" 를 검색해주세요']",3,https://kin.naver.com/qna/detail.naver?d1id=1&dirId=106&docId=366038233&qb=67Cx7Iug&enc=utf8&section=kin&rank=142&search_sort=3&spq=0,인터넷
15,2020.08.24,[],코로나 19예방,"저는 82세 고령자 입니다. 코로나 예방약을 추천 바랍니다
현재  저녁식사 후 감기약 처방용 타이레놀 650mg 1알을 복용하고 있읍니다. 예방에 도움이 되는지요?
그리고 혈장약이 도움이 된다고 하는데 혈장약은 무슨 약이며 처방받을 수 있는 약인가요?","['코로나는 아직 백신이 개발되지 않았다고 알려져 있습니다.약보다는 손씻기 및 마스크 착용을 \n신경써 주세요.국가의 말대로 지역간의 이동및해외여행 등을 자제해 주시고,코로나 의심증상이 있을시 119또는1339로 연락해주세요.코로나 검사는 선별진료소 에서 받으실 수 있습니다.\n채택 부탁드립니다.. \n-달나무.']",1,https://kin.naver.com/qna/detail.naver?d1id=7&dirId=70404&docId=366043565&qb=67Cx7Iug&enc=utf8&section=kin&rank=141&search_sort=3&spq=0,"약 효능, 성분"
14,2020.08.24,"['코로나', '종식']","해외여행, 월드컵, 올림픽은 코로나 땜에 종말되나요?","코로나땜에 저는 가고 싶었던 포르투갈 여행도, 
한국팀을 응원하고 싶었던 도쿄올림픽도, 
유일한 삶의 낙이자 스트레스 해소었던 축구직관도, 
못하고 있는 상태입니다.... 

정말로 코로나 땜에 해외여행, 월드컵, 올림픽은 종말되는건가요? 
그리고 스포츠, 공연, 행사 등 구릉관중과 응원, 만석은 두번다시 못 보는건가요?...

마스크는 대체 언제까지 껴야하나요?... 


저는 코로나가 종식되면, 포르투갈 가고 싶습니다.
혼자서 한달간 자유여행으로요.. 그래서 저는 코로나땜에 못갔던 한을 풀기위해 
포르투갈어 공부중인데..
요즘 코로나 사태땜에 공부에 집중이 안됩니다.

코로나가 끝나면 저는 포르투갈에 갈 수 있을까요? 


어제 영국 면역학자 曰 ""코로나는 우리 인류와 영원히 함께.. 
백신으로 종식 불가능"" 이란 보도 보고 멘붕...

심지어 저는 일에도 못 나가고 집에 틀어박혀 산 지 반년 넘었습니다.
저는 지금 일하러 나가고 싶습니다. 

코로나 땜에 저는 일하러 두번다시 나가지 못할까봐 걱정되고...


작년까지의 평범한 일상이 이 사태로인해 얼마나 소중한 지 깨달았습니다.... ","['코로나가 내년 상반기까지는 종식되지 않을 겁니다.하지만 내년 상반기까지 코로나가 종식된다면 해외 여행도 가능하고 월드컵과 올림픽도 정상적으로 개최합니다.스포츠 공연 행사 구릉관중 응원 등도 코로나가 종식되면 할 수 있어요.\nhttps://n.news.naver.com/article/016/0001716238\n“코로나19 내년 상반기까지 종식 안 될 것”\n[헤럴드경제(수원)=박정규 기자] 경기문화재단 실학박물관(김태희 관장)은 코로나19 사태 속에 시민들의 상황 인식과 박물관 이용 의사에 관해 설문조사를 하고 결과를 25일 발표했다. 조사 기간은 7월 7일부터 31일\nn.news.naver.com', '코로나는 앞으로도 영원히 종식되지 않을 가능성이 큽니다.\n마음의 준비 단단히 하세요. \n저도 솔직히 코로나가 종식되었으면 좋겠지만.. 이건 결코 종식될 수 없는 바이러스라고 생각합니다.\n앞으로 한 100년 어쩌면 천년동안은 해외여행은 불가능 해질 것이고 \n많은 국가들이 문을 걸어 잠글 겁니다.\n해외여행은 이제 VR로만 가능한 시대가 오고 있는 겁니다.\n마음의 준비 단단히 하세요. 이젠 홀로 살아가야 하는 우울한 사회입니다.\n사람과 사람이 서로 웃으며 만날 수 있는 시간은 끝났습니다.']",2,https://kin.naver.com/qna/detail.naver?d1id=9&dirId=9020308&docId=366055966&qb=67Cx7Iug&enc=utf8&section=kin&rank=140&search_sort=3&spq=0,"스페인, 포르투갈"
13,2020.08.24,['백신'],코로나19 백신 언제쯤 공급가능할까요?,"기사보니까 미국에서 첫백신성공이라는데, 근데 공급이 2021년이후에도 공급이 안될수잇다고 생체실험, 임상실험 ,등등여러변수기간이남아잇어서요..... 정말이아니길... 정말인지요..","['일단 물량이 풀리는 건 빨리 잡아야 내년 중이죠. 얼마든지 더 늦어질 수 있는거고요.', '일단 코로나가 종식되기위해서는\n1.바이러스 전염력 낮아지며, 확진자수를 줄이기\n2.백신개발 (빨리개발되길..)\n이 2가지가 둘다 되어야 하는데요.\n지금까지의 유사한 바이러스의 종식시기를 살펴보면\n사스---2002년 11월->2003년 7월 (9개월)\n메르스 --2015년 5월->2015년 12월 (8개월)\n전문가 사이에서는 이번 신종 코로나바이러스의 확산이 사스와 비슷한 양상을 보일 것이란 예측이 나온다. 사스처럼 날씨가 따뜻해질수록 확산이 더뎌질 수 있다는 것이다. 특히 신종 코로나바이러스와 사스는 같은 베타코로나바이러스 계열이며, 유전적 유사성도 약 80%라고 하는데요!!!\n종합정리!!!!\n종합해보면 전문가마다 말이 많이다른데요..날씨가 따뜻해지면 대부분의 바이러스는 전염력이 낮아진다고 합니다!( 메르스,사스의 경우 날씨가 따뜻해졌을때 전염성이 낮아짐)그런데 날씨가 따뜻해졌는데도 코로나는 없어질 기미가 없는거 같습니다...\n제가 조사해보면서 느낀결과 그래도 최소 12월까지는 갈꺼 같은데요... 빨리 종식되서  일상생활도 빨리 돌아왔으면 좋겠습니다.마스크가 너무 불편합니다...\n▼아래전문가 의견,백신개발 동향 정리되어있습니다.\nhttps://salgoonews.tistory.com/150\n코로나19 언제까지갈까? 백신은 언제나올까? 치료된사람은 어떤식으로? 앞으로의 일상변화? 전문가의견 +총정리+\n안녕하세요 살구뉴스입니다!!! 신종 코로나바이러스 감염증의 확산은 언제까지 이어질까요...!? 국내 확진환자 발생이 잇따르고 있는 가운데 감염증 종식 시기에 관심이 쏠리고 있어서 저번에 작성했던 글에 이어..\nsalgoonews.tistory.com', '가톨릭대학교 인천성모병원 가정의학과 임상부교수 서민석 의사님\nSheikh Khalifa Specialty Hospital 진단검사의학과 과장 홍덕진 의사님\n께서 소견을 내주셨습니다.\nhttps://www.a-ha.io/questions/4d25df930238f859b6891266ddf0f37e?recBy=3PEGVU\n코로나 백신 언제 나오나요? 그리고 백신이 나와도 코로나는 안 끝나나요? | 전문 지식 검색은 아하!\n의료 - 코로나19 백신이 개발 중에 있는데 정확히 언제쯤 상용화되고 나오는지 알고 싶습니다. 또한 백신이 나와도 코로나19가 끝이 아니라는데 왜 이런 얘기가 나오는지도 알고 싶습니다. 감사합니다.\nwww.a-ha.io', '가톨릭대학교 인천성모병원 가정의학과 임상부교수 서민석 의사님\nSheikh Khalifa Specialty Hospital 진단검사의학과 과장 홍덕진 의사님\n께서 소견을 내주셨습니다.\nhttps://www.a-ha.io/questions/4d25df930238f859b6891266ddf0f37e?recBy=3PEGVU\n코로나 백신 언제 나오나요? 그리고 백신이 나와도 코로나는 안 끝나나요? | 전문 지식 검색은 아하!\n의료 - 코로나19 백신이 개발 중에 있는데 정확히 언제쯤 상용화되고 나오는지 알고 싶습니다. 또한 백신이 나와도 코로나19가 끝이 아니라는데 왜 이런 얘기가 나오는지도 알고 싶습니다. 감사합니다.\nwww.a-ha.io']",4,https://kin.naver.com/qna/detail.naver?d1id=11&dirId=111601&docId=366110327&qb=67Cx7Iug&enc=utf8&section=kin&rank=121&search_sort=3&spq=0,분자생물학
14,2020.08.24,['디스코드에러'],디스코드 에러 떴어여 살려주세여,살려주세여 님드라,"['아래의 방법대로 따라서 하신후 다시 설치 해보시기 바랍니다.\n방법 따라하시기전에 안내사항\n백신 알약 때문에 안되는 증상이 보이고 있습니다.\n그외 AVAST , AVG 등등 다른 백신들도 문제가 되고있으며\n   아래의 방법을 따라하시기전 \n사용하고 계시는 백신 의  실시간 감지,게임모드를 \n잠시 끄시고 설치하시기 바랍니다.\n   해당 문제는 보통은 디스코드가 실행되어있는 상태로 설치를 진행해서 발생하는 오류입니다.\n자동으로 지우는 방법\n첨부파일에 있는 Discord Remove를 다운받습니다.\n(지식인에서 보시는 경우 -> 고양이 블로그 <- 고양이 블로그를 눌러 첨부파일 받으세요.)\n(Discord Remove 버전: v0.4)\n  Discord Remove에 마우스 커서를 갔다대고 마우스 우클릭 - 관리자 권한으로 실행합니다.\n여기서 키보드에서 알파벳 Y를 누르면 제거가 진행됩니다.\n진행이 다됐다면 모든 작업이 완료되었다고 뜹니다.\n이렇게 되었다면 다시 디스코드 설치 파일을 켜서 설치를 진행해보시기 바랍니다.\n수동으로 지우는 방법\n윈도우 키 혹은 화면의 맨 왼쪽 아래에 있는 윈도우 모양을 한번 누르신 다음\ncmd를 검색하시고 cmd 혹은 명령프롬프트라고 나온 것에\n 마우스 커서를 갔다 대고 마우스 우클릭 - 관리자 권한으로 실행 합니다.\n관리자 권한으로 키시면 검은색 창이 하나 뜰건데요.\n   거기에 아래의 내용을 위부터 아래까지 복사 후 붙여넣기 하신 뒤 엔터합니다.\n복사하는 방법입니다.\n아래에 나온 ""↓ 여기서부터 ↓"" ""↑ 여기까지 ↑"" 사이의 안에 내용물을 마우스 좌클릭 꾹 눌러서 드래그합니다.\n그런 후에 키보드에 Ctrl을 꾹 누르시고 C(알파벳)을 누르시면 복사됩니다.\n붙여넣기 하는방법은 2가지입니다.\n1.키보드에 Ctrl 꾹누르시고 V(알파벳)을 누르는 방법\n2. 검은 도스창 안에서 마우스 우클릭 - 붙여넣기 하는방법\n여기서 내용이 안옮겨지시는 분들은 복사가 제대로 안된것이니 복사 다시해보시고\n그래도 안되신다면 자동으로 지우는 도구를 이용하세요.\n↓ 여기서부터 ↓\ntaskkill /f /im discord.exe\ntaskkill /f /im update.exe\nreg delete ""HKCU\\Software\\Microsoft\\Windows NT\\CurrentVersion\\AppCompatFlags\\Layers"" /v ""%localappdata%\\discord\\update.exe"" /f\nreg delete ""HKLM\\Software\\Microsoft\\Windows NT\\CurrentVersion\\AppCompatFlags\\Layers"" /v ""%localappdata%\\discord\\update.exe"" /f\n%localappdata%\\discord\\update.exe --uninstall -s\npushd %temp%\ntaskkill /f /im discord.exe\ntaskkill /f /im update.exe\nmove /y ""%Appdata%\\Discord_old"" ""%Temp%""\nrmdir /q ""%temp%\\Discord_old""\nren ""%Appdata%\\Discord"" ""Discord_old""\nmove /y ""%Appdata%\\Discord_old"" ""%Temp%\\Discord_old""\nrmdir /q ""%temp%\\Discord_old""\nmove /y ""%LocalAppdata%\\Discord_Localold"" ""%Temp%""\nrmdir /q ""%temp%\\Discord_Localold""\nren ""%LocalAppdata%\\Discord"" ""Discord_old""\nmove /y ""%LocalAppdata%\\Discord_old"" ""%Temp%\\Discord_Localold2""\nrmdir /q ""%temp%\\Discord_Localold2""\nmove /y ""%programdata%\\SquirrelMachineInstalls"" ""%Temp%""\nrmdir /s /q ""%temp%\\SquirrelMachineInstalls""\nreg delete ""HKCU\\Software\\Discord"" /f\nreg delete ""HKCU\\Software\\Classes\\Discord"" /f\nreg delete ""HKEY_CLASSES_ROOT\\Discord"" /f\nreg delete ""HKCU\\Software\\Microsoft\\Windows\\CurrentVersion\\Run"" /v ""Discord"" /f\nreg delete ""HKLM\\SOFTWARE\\WOW6432Node\\Microsoft\\Windows\\CurrentVersion\\Run"" /v ""Discord"" /f\nreg delete ""HKCU\\Software\\Microsoft\\Windows\\CurrentVersion\\Uninstall\\Discord"" /f\npopd\n↑ 여기까지 ↑\n그리고 디스코드를 다시설치해보세요.\n만약 백신을 끄고 설치를 해서 에러를 해결했으나 백신 실시간 검사를 다시 켰을때 \n에러가 다시 발생하는 경우는 지금 사용하고있는 백신을 지우고\n다른 백신을 쓰시는 것을 권유드립니다.\n만약에 백신 문제도 아니고 위에 방법을 그대로 동일하게 따라했음에도 불구하고\n동일한 에러가 난다면 시스템적으로 꼬였을 가능성이 높습니다.\n이 경우는 블로그에 덧글을 남겨주시거나\n-> 2차 특정 윈도우7 및 디스코드 포터블 이용하기 <- 이것을 이용하여\n윈도우7이신 분들은 방법을 따라해보시고\n윈도우7이 아닌 윈도우8,10분들의 경우 디스코드 포터블을 설치하셔서\n이용하시는 것밖에는 답이 없습니다.\n이 글에서 에러가 해결이 안됐다는건 위의 적은대로 시스템적으로 꼬였기 때문에\n2020-3-5일 현재까지로는 1. 디스코드 포터블 이용 , 2. 윈도우 재설치\n이 두가지밖에 길이 없습니다.']",1,https://kin.naver.com/qna/detail.naver?d1id=1&dirId=10302&docId=366071394&qb=67Cx7Iug&enc=utf8&section=kin&rank=138&search_sort=3&spq=0,"유닉스, 리눅스"
14,2020.08.24,[],재난지원금 또 줄수 있답니다!!,"그 전 모시기 사랑제일교회 뭐시기 때문에 이런 사태가 나왔는데 !!! 응원합시다!!! 그리고 백신도 서서히 나오고 있고 혈장치료제와 기타 치료제가 어떡해서든 나오고 있고 백신도 나오고 있으니 응원합시다!!
이래서 자본주의가 무섭군요 만들면 돈이 되니깐 돈 벌기위해 ㅋㅋㅋㅋㅋㅋ 사람들이 기를 쓰네요 ㅋㅋ 자본주의 아니면 절대로 빨리 나올 수 없죠 ㅋㅋㅋㅋ",['얼른 받기를 그거라도 받아야 숨통이 트일거 같습니다 \n공감공감!!!!'],1,https://kin.naver.com/qna/detail.naver?d1id=5&dirId=50803&docId=366063489&qb=67Cx7Iug&enc=utf8&section=kin&rank=139&search_sort=3&spq=0,"다이어트, 운동기구"
14,2020.08.24,[],"코로나 백신 나오면 완전히 끝나는건가요?
유튜브에 막 백신 나와도 완전히 끝내지는
못할거라고 그래서..
백신 나오면 끝나겠져, ?",,"['안녕하세요\n백신이 나오면 어느 정도 진정이 되겠지만\n치료제까지 나와야 완벽하게 끝낼 수 있을 것 같습니다.\n다만, 변이가 된 바이러스가\n나오지 않는다는 가정 하에서요.', '올해는 그냥 지나 갔어요 물건너 갔어요 내년쯤에 코로나 바이러스 신약 나온다고 발표 나긴 했습니다 .', '일단 코로나 백신이 나온다해도 완전히 종식시키지는 못하고 계절성 전염병으로 공존하게될 가능성이 높습니다. \n인류가 의지와 노력으로 퇴치한 바이러스는 역사상 단1종류 천연두바이러스밖에 없고 그마저도 180년이 걸렸지요 \n바이러스 하나가 완전종식이 되기위해서는 백신을 개발한다고 다되는게 아니라 6개월이내로 지구상의 모든 인류가 접종을 받아야하는데 현실적으로 불가능합니다 가령 1월에 미국에서 첫접종을 했는데 콩고에서 7월 접종완료면 말짱 도루묵이라는겁니다.. 그나마 희망적인적은 대부분 바이러스가 그렇듯 전염성은 높아진 반면 치사율은 낮아지는 형태로 변이하고있다는겁니다. 아마 높은확률로 독감예방주사처럼 매년 맞는형태로 갈것이고 백신보다는 치료제 개발쪽이 더 희망적이라고 볼수있습니다.']",3,https://kin.naver.com/qna/detail.naver?d1id=11&dirId=111604&docId=366078929&qb=67Cx7Iug&enc=utf8&section=kin&rank=137&search_sort=3&spq=0,해부학
14,2020.08.24,[],제발 알려주세요 ㅜㅜ,이거 자꾸 이렇게 뜨는데 어떻게해여하나요 ㅠㅠ,"['아마도 저거 구독 취소해야 될겁니다. 본인도 모르게 구독을 눌러 버렸나 봐요.', '설정 계정및암호 캘린더 구독계정삭제', '안녕하세요. 킹콩VPN 지식IN 상담원입니다^^ \n아이폰 설정-암호 및 계정-구독한 캘린더 선택하시고 계정삭제를 눌러주세요~\n아마 크롬사용하시면서 IP우회프로그램 사용하시다가 바이러스가 생겼다며\n나오는 광고앱입니다~\n절대 설치 하시지마시구요~설치하시면 결제되세요~\n크롬들어가셔서\n메뉴-설정-사이트설정-알림-허용됨-해당광고사이트 주소-삭제 및 재설정 눌러주세요~\n다 그런건 아니지만 무료VPN의 수익구조 자체가 광고수익이나 개인정보판매라는\n소문이 있을 정도로 보안에 취약하다고 합니다..\nVPN을 사용하신다면 안전하고 믿을 수 있는 VPN을 사용하셔야 합니다!\n실시간 상담, 빠른 피드백이 가능하고 가성비 좋은 VPN 찾으시면 \n저희 킹콩VPN은 어떠신가요~^^\n저희 킹콩VPN은 체계적으로 서버관리를 하고 있어 막힐 걱정없이 이용가능합니다! \n속도면에서도 AS대처면에서도 빠른 VPN을 찾으신다면 \n킹콩VPN을 강력추천해드립니다!!!\n무료 체험가능하시니 부담없이 저희 킹콩 VPN이용해보세용~', 'Vpn, 바이러스 백신 설치를 유도하는 일부 악성 업체의 광고입니다. \n아이폰 설정> 암호및계정>구독한캘린더>해당캘린더삭제 \n이렇게 하면 간단하게 해결할 수 있습니다.\n 안전하고 안정적인 VPN 아이피 서비스\nIpany.net']",4,https://kin.naver.com/qna/detail.naver?d1id=8&dirId=814&docId=366080823&qb=67Cx7Iug&enc=utf8&section=kin&rank=136&search_sort=3&spq=0,기타
14,2020.08.24,"['아이폰', '이게뭔가요', '해킹당한건가요', '알려주세요ㅠㅠ', '최대한빠른답변부탁드립니다ㅠㅠ']",캘린더에 이런거 계속 알람 울리데...,"캘린더에 이런거 계속 알람 울리는데 혹시 뭔가요?설마..핸드폰 해킹 당한거 아니죠..ㅠㅠ
(만약에 해킹 당하거면 빨리 해결하는 방법 알려주세요 ㅠㅠ)
최대한 오늘 안에 빨리 알려주세요","['https://kin.naver.com/qna/detail.nhn?d1id=1&dirId=1070202&docId=344713914\n아이폰 캘린더\n저도 모르는새 아이폰 캘린더에 이런게 있던데 삭제가 안됩니다 어떻게 해야하나요?? ㅠㅠ\nkin.naver.com', '위 이미지 처럼 캘린더 구독창이 표시되는 경우, 올바른 링크에 접근했을 때 표시되는 것인지 확인하고, 출처를 알 수 없는 캘린더 구독은 삼가하시기 바랍니다.\n해당 캘린더는 구독 형태의 스팸으로 아래와 같이 제거 가능합니다.\n참고 : https://blog.supersu.kr/security/smartphone/ios_calendar_subscription_spam_warning\n1. 설정 -> 암호 및 계정 (혹은 계정 및 암호로 표시될 수 있음)을 누릅니다.\n2. 구독한 캘린더를 누릅니다.\n3. 추가하지 않은 캘린더를 찾아 ""계정 삭제"" 를 누릅니다.', '안녕하세요. 킹콩VPN 지식IN 상담원입니다^^ \n아이폰 설정-암호 및 계정-구독한 캘린더 선택하시고 계정삭제를 눌러주세요~\n아마 크롬사용하시면서 IP우회프로그램 사용하시다가 바이러스가 생겼다며\n나오는 광고앱입니다~\n절대 설치 하시지마시구요~설치하시면 결제되세요~\n크롬들어가셔서\n메뉴-설정-사이트설정-알림-허용됨-해당광고사이트 주소-삭제 및 재설정 눌러주세요~\n다 그런건 아니지만 무료VPN의 수익구조 자체가 광고수익이나 개인정보판매라는\n소문이 있을 정도로 보안에 취약하다고 합니다..\nVPN을 사용하신다면 안전하고 믿을 수 있는 VPN을 사용하셔야 합니다!\n실시간 상담, 빠른 피드백이 가능하고 가성비 좋은 VPN 찾으시면 \n저희 킹콩VPN은 어떠신가요~^^\n저희 킹콩VPN은 체계적으로 서버관리를 하고 있어 막힐 걱정없이 이용가능합니다! \n속도면에서도 AS대처면에서도 빠른 VPN을 찾으신다면 \n킹콩VPN을 강력추천해드립니다!!!\n무료 체험가능하시니 부담없이 저희 킹콩 VPN이용해보세용~', '안녕하세요 판다vpn지식인 상담사입니다\n무료 vpn을 이용했을때, \n또는 보안이 안전하지않은 사이트에 접속을 하였을 경우\n발생하는 악성광고 입니다!\n이런경우\n아이폰 설정> 암호및계정>구독한캘린더>해당캘린더삭제 \n이렇게 하시면 간단하게 해결 가능하십니다!\n무료VPN의 수익구조는 정보판매라는\n소문이 있을정도로 피해사례가 많이 있습니다!\n혹시나 지금 무료vpn을 이용하시고 계시다면 지우시는게 좋을 것 같습니다!\n저희 판다vpn은 전세계에서 한국서버 50개이상 보유 \n게임유저들의 위한 게임서버 다수보유, 각종 해외서버도 보유중입니다 ^^\n네이버에 ""판다VPN"" 를 검색해주세요', 'Vpn, 바이러스 백신 설치를 유도하는 일부 악성 업체의 광고입니다. \n아이폰 설정> 암호및계정>구독한캘린더>해당캘린더삭제 \n이렇게 하면 간단하게 해결할 수 있습니다.\n 안전하고 안정적인 VPN 아이피 서비스\nIpany.net']",5,https://kin.naver.com/qna/detail.naver?d1id=1&dirId=11001&docId=366084151&qb=67Cx7Iug&enc=utf8&section=kin&rank=135&search_sort=3&spq=0,해킹
