page,date,tags,questions,questions_add,answers,N_answer,url,category
10,2020.06.26,['바이러스'],바이러스가 컴퓨터에있는지 확인을어떻게하나요?,"컴퓨터에 알약은깔려있구요
예전에하던 고전게임이하고싶어서 윈도우ios랑 게임파일검색하다가 이곳저곳들어갔는데 아무래도불안해서요 ㅠㅠ
알약으로정밀체크해봣고 다운받은거는 다시다지웟는데 감염되잇으면어떡하죠?
제노트북이예전에도 하드가 다운되고 손상되고그런적이잇어서 좀 많이걱정되서요
혹시 컴퓨터 상세하게 체크하고 관리하는법아시는분잇으면알려주셔요","['네이버에 들어가서 고클린이라는 파일을 다운받으세요 무료입니다!\n저도 컴퓨터를 잘 몰라서 남자친구가 한번씩 컴퓨터를 봐주는데요\n게임이나 파일같은걸 다운받으면 바이러스가 있을수도 있고 필요없는 용량이 차있을수가 있어서 고클린으로 컴퓨터 청소를 합니다!\n다운받으면 불필요한파일 정리, 인터넷이 느려질때,파일검사 등등 모든게 있으니 \n고클린 다운받아서 사용해보세요!\n컴맹인 저도 혼자사 사용가능한 프로그램이라 추천드립니다^^', '알약의 정밀 체크로 검색을 해보셨으면, 기본적인 바이러스에는 감염되지 않았습니다. 굳이 걱정이 되시면 windows 안전모드로 부팅 하셔서 백신 프로그램( 알약도 괜찮음)으로 검색해 보세요. 그리고 안전하지 않은 사이트나 토렌트 사이트 등에서 게임을 다운 받는것은 위험함으로 다운하지 않는것을 추천합니다.  ']",2,https://kin.naver.com/qna/detail.naver?d1id=1&dirId=11002&docId=360895020&qb=67Cx7Iug&enc=utf8&section=kin&rank=98&search_sort=3&spq=0,바이러스
