page,date,tags,questions,questions_add,answers,N_answer,url,category
26,2021.05.13,[],트로이목마 바이러스,"알약으로 트로이목마바이러스 감염됐다고
해서 청소했더니 컴퓨터껏다 키니깐 또생기고 또생기고ㅡㅡ
이거먼가요? 왜생기는거고 어떻게없애죠?
그리고 이게있으면 뭐가해킹되는건가요?
컴퓨터에 공인인증서 다지워야할까요?
빠른답변 쉽게할수있는방법 알려주세요ㅠㅠ","['현재 주신 증상 정보만으론, 정확하게 문제 해결을 하는데 있어, 어려움이 생길 수 있습니다.\n또한, 아래의 절차를 진행한 상태에서, 시스템 손상에 의해 부팅이 안되는 경우, \n시스템 재설치를 검토하셔야 합니다.\n1. 일반 모드로 부팅한 상태에서, 아래의 요소들을 점검합니다.\n* PC에 반드시 필요한 서류등의 문서가 있다면, 시스템 드라이브 외의 다른 물리 드라이브 또는 USB/외장 하드디스크/ 웹하드 등에 백업처리합니다.\n* 사용중인 별도의 바이러스 백신이 없다면, 아래의 백신들을 사전에 설치합니다.\n(ALYac, Kaspersky Free, V3 Lite)\n* 또한, 최신 버전의 엔진으로, 모두 업데이트를 진행합니다.\n2. 안전모드로 컴퓨터를 부팅합니다.\nWindows 10에서 안전 모드로 PC 시작\nWindows 10에서 안전 모드로 PC 시작 Windows 10 안전 모드는 파일 및 드라이버의 제한된 집합을 사용하여 Windows를 기본 상태로 시작합니다. 안전 모드에서 문제가 발생 하지 않는 경우 기본 설정 및 기본 장치 드라이버가 문제의 원인이 아님을 의미 합니다. 안전 모드에서 창을 관찰 하면 문제의 원인을 좁혀 PC의 문제를 해결 하는 데 도움이 될 수 있습니다. 다음 두 가지 안전 모드가 있습니다. 안전 모드 및 안전 모드(네트워킹 사용). 네트워킹이 있는 안전 모드는 네트워크의 인터넷 및 다른 컴퓨터에 액세스 하는...\nsupport.microsoft.com\n3. 바이러스 백신을 별도로 사용중이라면, 사용중인 바이러스 백신을 검색하신 후, 백신 프로그램을 통해\n정밀 검사를 진행합니다.(모든 드라이브를 선택합니다.)\n4. 해당 과정을 거친 상태에서 일반 모드로 다시 시작을 눌러 부팅한 후, 문제가 발생하는지 확인해봅니다.\n문제가 없다면, 바로 최신 버전의 Windows 업데이트를 모두 설치합니다.', '다잡아 프로그램으로 정밀 검사 후 치료하세요.\n청소년 1년 무료 체험권 \n#8. 다잡아 청소년 무료 사용방법\n안녕하세요. 다잡아입니다. 오늘은 다잡아의 청소년 무료 사용방법에 대해서 알아보도록 하겠습니다. 청소...\nblog.naver.com\n일일 무료 체험권\n#7. 다잡아 무료체험 사용방법\n안녕하세요. 다잡아입니다. 오늘은 다잡아 무료체험 사용방법에 대해서 알아보도록 하겠습니다. 다잡아의 ...\nblog.naver.com\n다잡아 프로그램 다운로드\n다잡아\n악성코드, 랜섬웨어 예방, 광고창 치료프로그램\nsoftware.naver.com']",2,https://kin.naver.com/qna/detail.naver?d1id=1&dirId=11002&docId=389649328&qb=67Cx7Iug&enc=utf8&section=kin&rank=254&search_sort=3&spq=0,바이러스
27,2021.05.13,[],"화이자 백신 1차 맞고 어지러움과 혈압상승으로 열흘정도 병원내원하여 식염수와 치료하였으나 결국 어지러움과 혈압이 안떨어져 혈압약 먹는데요 지금은 혈압약 투여로 혈압이 잡혔어요. 평소에 혈압정상이었고 이것으로인해 MRI와 귀이도 검사 혈액검사 했지만 정상입니다
2차 맞아도 될까요?",,['백신맞기전에 백신을 맞아도 되는 상태인지 보건소나 접종센터에서 체크를 하잖아요.\n백신 맞은 후 상태와 진료내용 말해서 접종을 해야하는지 알아봐야 할꺼같네요.\n무조건 접종해서 또 그런다면 질문자님이 힘들어지는 것이니 꼭 그 부분 체크해서 선택하셔야 할 듯 하네요'],1,https://kin.naver.com/qna/detail.naver?d1id=4&dirId=40102&docId=389645776&qb=67Cx7Iug&enc=utf8&section=kin&rank=268&search_sort=3&spq=0,"주식, 증권"
27,2021.05.13,[],"코로나백신 공황장애 괜찮을까요?

여기저기 공황카페 글을봐도
다들 처음인지라 고민들 하시는듯
합니다 접종후 증상이 공황증상과
비슷해서 말이죠 접종후 약복용이
가능할까요? 미리 걱정이네요
요즘은 이석증 재발로 더 어지러운
상태라 걱정입니다",,"['공황장애에 때문에 혼자서 고민하시는것보다는 여러분들과 고통을 나눠서 도움을 받아보시는 것은 어떠실까요\n좋은 생활 습관을 유지하셔서 공황장애에 관해서 문제점을 떨져내시기 바랍니다\n언제나 마음을 편안하게 하도록 꼭 노력을 하십시오\n요즘에 공황장애 때문에 고민하시는 분들이 정말 많은거 같더라구요\n누구에게나 힘들일은 일어날수 있으나 그걸 잘 극복해나가는 것이 중요합니다\n꾸준한 취미생활과 꾸준히 뭔가 연구를 할만한 무언가를 찾아보시는것은 어떠실까요', '공황발작은 불안장애의 일종입니다. 공황발작이란 갑자기 시작되는 짧은 시간동안의 극도로 공포, 고통, 불안에 사로잡히는 경우로 신체증상 및 감정적 증상이 동반됩니다. 공황발작은 생각보다 흔하게 느낄수도 있습니다. \n원인\n공황장애의 원인은 정신적 요소 뿐 아니라, 유전적, 심리사회적 요인들이 함께 작용하는 경우가 많습니다. 검사를 진행해보면 몸에 아무런 이상이 없는 진단이 나오기도 합니다. 또한 일부 공황발작은 특정 상황에 반응하여 발생하기도 합니다.\n증상\n공황발작시 강렬한 공포, 불편과 함께 다음과 같은 신체적, 감정적 증상이 최소 4개정도 나타납니다.\n공황장애 공황발작 증상과 진단에 대해 참고하시면 좋을듯합니다.\nhttp://ssunpick.com/7463\n공황장애 공황발작 증상과 진단\n공황발작은 불안장애의 일종입니다. 공황발작이란 갑자기 시작되는 짧은 시간동안의 극도로 공포, 고통, 불안에 사로잡히는 경우로 신체증상 및 감정적 증상이 동반됩니다. 공황발작은 생각보다 흔하게 느낄수도 있습니다. 보통은 한두번에 그치는 경우가 많지만 공황발작이 자주 반복되며, 원인이 불분명하다면 공황장애로 진단을 내립니다. Close-up of a blurred face of a young girl with split personality disorder against black background 원인 공황장애의\nssunpick.com', '코로나 백신은 기저질환환자 / 약물 투여자 / 감기기운등 증상이 있는자는 증상이 나타나는 자는\n먼저 병원에 의사와 상담후 접종해야 한다 아래 코로나 접종안내 문구에 나옵니다[출처]\n<코로나 백신 접종> 순서, 횟수, 나이, 우선순위, 시기, 방법\n대한민국 국내 코로나 백신 접종 코로나 백신 접종시기 _  먼저 국내 코로나 백신 접종대상은(?) 대상은 전국민 입니다. (단 백신 개발과정에서 임상시험에 포함되지 않은 임신부와 18세 미만 소아청소년은 접종..\nzero-news.tistory.com']",3,https://kin.naver.com/qna/detail.naver?d1id=7&dirId=70109&docId=389645567&qb=67Cx7Iug&enc=utf8&section=kin&rank=269&search_sort=3&spq=0,정신건강의학과
27,2021.05.13,[],국내에서 생산하는 백신은 아스트라제네카와 노바백스 인가요?,,"['현재는 아스트라 제네카 한가지인줄 압니다.', '현재는 아스트라제네카 백신을 \n국내 안동공장에서 위탁생산하는 중이고 \n노바백스는 \n국내에 생산설비를 구축하는 중으로 \n빠르면 6월에 출시될 것으로 예상되고 있습니다.\n그외 모더나도 \n국내 위탁생산을 협의하는 중 입니다.']",2,https://kin.naver.com/qna/detail.naver?d1id=8&dirId=814&docId=389646288&qb=67Cx7Iug&enc=utf8&section=kin&rank=267&search_sort=3&spq=0,기타
27,2021.05.13,[],국내에서 생산하는 백신은 아스트라제네카와 노바백스 인가요?,,"['현재는 아스트라 제네카 한가지인줄 압니다.', '현재는 아스트라제네카 백신을 \n국내 안동공장에서 위탁생산하는 중이고 \n노바백스는 \n국내에 생산설비를 구축하는 중으로 \n빠르면 6월에 출시될 것으로 예상되고 있습니다.\n그외 모더나도 \n국내 위탁생산을 협의하는 중 입니다.']",2,https://kin.naver.com/qna/detail.naver?d1id=8&dirId=814&docId=389646288&qb=67Cx7Iug&enc=utf8&section=kin&rank=266&search_sort=3&spq=0,기타
27,2021.05.13,[],여러분 급해요ㅠㅠ 급급급해요,제가 학생인데 백신 맞을 수 있다면 바로 맞을 예정인데 제가 예전에 가습기 땜에 폐렴을 앓았었ㄷ는데 아무 영향도 없겠죠..? 안전하겠죠?? 아프시다는 분이 많길래,['안녕하세요. 대한의사협회·네이버 지식iN 상담의사 홍인표 입니다.\n가습기 폐렴으로 후유증이 있다면 더욱 접종을 고려하셔야 합니다'],1,https://kin.naver.com/qna/detail.naver?d1id=7&dirId=70117&docId=389646643&qb=67Cx7Iug&enc=utf8&section=kin&rank=265&search_sort=3&spq=0,가정의학과
27,2021.05.13,"['코로나', '백신', '아스트라제네카']","아스트라제네카 백신, 고지혈증환자 문의","63세 어머니시구요, 평소 관절염약과 고지혈증약을 드시고계시구요, 고지혈증은 약간 심한편이세요


아스트라제네카백신이 혈전 관련 이슈가 있어서 걱정인데
고지혈증환자가 접종받아도 문제 없을지 궁금합니다","['아스트라제네카 등 코로나 백신은 기저질환환자 / 약물 투여자 / 감기기운등 증상이 있는자는 증상이 나타나는 자는\n먼저 병원에 의사와 상담후 접종해야 한다 아래 코로나 접종안내 문구에 나옵니다[출처]\n<코로나 백신 접종> 순서, 횟수, 나이, 우선순위, 시기, 방법\n대한민국 국내 코로나 백신 접종 코로나 백신 접종시기 _  먼저 국내 코로나 백신 접종대상은(?) 대상은 전국민 입니다. (단 백신 개발과정에서 임상시험에 포함되지 않은 임신부와 18세 미만 소아청소년은 접종..\nzero-news.tistory.com', '아스트라제네카 백신의 혈전 부작용 보다는 \n코로나에 감염되는 경우... 혈전으로 인한 피해가 훨씬 크다보니... \nhttp://news.mt.co.kr/mtview.php?no=2021042113592174683\n""혈전이 무섭다면 백신 맞아라"" 혈전 전문가들의 조언 - 머니투데이\n최근 아스트라제네카(AZ)와 존슨앤드존슨(얀센)의 코로나19(COVID-19) 백신이 희귀 혈전(혈액 응고) 부작용 논란에 휩싸이면서 접종 거부감이 커지고 있다. 하지만 ...\nnews.mt.co.kr\n다른 사람과의 접촉이 적어 \n코로나에 감염될 가능성이 낮다면... 접종을 미루는 방법도 있겠지만... \n현실적으로... 다른 사람과의 접촉을 줄이기 힘들고 \n고령에 \n기저질환자라면\n코로나에 감염되는 경우 치명률이 높다보니... \n담당의사와 상담후에... 접종을 고려해 보시는 것이 바람직 합니다.\n참고로 한국의 경우 \n코로나 확진자 약 13만명 중에 사망자는 1,884명 인 반면 \n아스트라제네카 백신을 접종한 202만명 중에서 사망사례는 54건 \n화이자 백신을 접종한 167만명 중에서 사망사례는 49건 으로 \n현재로서는 백신 보다는 코로나 치명률이 훨씬 높다보니 \n백신 접종을 원치 않다면... 다른 사람과의 접촉을 줄여 코로나에 감염되지 않도록 주의하십시오.']",2,https://kin.naver.com/qna/detail.naver?d1id=7&dirId=7010103&docId=389647134&qb=67Cx7Iug&enc=utf8&section=kin&rank=263&search_sort=3&spq=0,순환기내과
27,2021.05.13,"['코로나', '백신', '아스트라제네카']","아스트라제네카 백신, 고지혈증환자 문의","63세 어머니시구요, 평소 관절염약과 고지혈증약을 드시고계시구요, 고지혈증은 약간 심한편이세요


아스트라제네카백신이 혈전 관련 이슈가 있어서 걱정인데
고지혈증환자가 접종받아도 문제 없을지 궁금합니다","['아스트라제네카 등 코로나 백신은 기저질환환자 / 약물 투여자 / 감기기운등 증상이 있는자는 증상이 나타나는 자는\n먼저 병원에 의사와 상담후 접종해야 한다 아래 코로나 접종안내 문구에 나옵니다[출처]\n<코로나 백신 접종> 순서, 횟수, 나이, 우선순위, 시기, 방법\n대한민국 국내 코로나 백신 접종 코로나 백신 접종시기 _  먼저 국내 코로나 백신 접종대상은(?) 대상은 전국민 입니다. (단 백신 개발과정에서 임상시험에 포함되지 않은 임신부와 18세 미만 소아청소년은 접종..\nzero-news.tistory.com', '아스트라제네카 백신의 혈전 부작용 보다는 \n코로나에 감염되는 경우... 혈전으로 인한 피해가 훨씬 크다보니... \nhttp://news.mt.co.kr/mtview.php?no=2021042113592174683\n""혈전이 무섭다면 백신 맞아라"" 혈전 전문가들의 조언 - 머니투데이\n최근 아스트라제네카(AZ)와 존슨앤드존슨(얀센)의 코로나19(COVID-19) 백신이 희귀 혈전(혈액 응고) 부작용 논란에 휩싸이면서 접종 거부감이 커지고 있다. 하지만 ...\nnews.mt.co.kr\n다른 사람과의 접촉이 적어 \n코로나에 감염될 가능성이 낮다면... 접종을 미루는 방법도 있겠지만... \n현실적으로... 다른 사람과의 접촉을 줄이기 힘들고 \n고령에 \n기저질환자라면\n코로나에 감염되는 경우 치명률이 높다보니... \n담당의사와 상담후에... 접종을 고려해 보시는 것이 바람직 합니다.\n참고로 한국의 경우 \n코로나 확진자 약 13만명 중에 사망자는 1,884명 인 반면 \n아스트라제네카 백신을 접종한 202만명 중에서 사망사례는 54건 \n화이자 백신을 접종한 167만명 중에서 사망사례는 49건 으로 \n현재로서는 백신 보다는 코로나 치명률이 훨씬 높다보니 \n백신 접종을 원치 않다면... 다른 사람과의 접촉을 줄여 코로나에 감염되지 않도록 주의하십시오.']",2,https://kin.naver.com/qna/detail.naver?d1id=7&dirId=7010103&docId=389647134&qb=67Cx7Iug&enc=utf8&section=kin&rank=262&search_sort=3&spq=0,순환기내과
27,2021.05.13,[],65세 코로나백신,"65세 할머니께서 백신을 맞으시려고 하는데 당뇨, 고혈압 있으시고 몇년전에 협심증?도 발생하셔서 시술같은것도 받으셨어요 AZ백신 맞으셔도 될까요?","['코로나 백신은 기저질환환자 / 약물 투여자 / 감기기운등 증상이 있는자는 증상이 나타나는 자는\n먼저 병원에 의사와 상담후 접종해야 한다 아래 코로나 접종안내 문구에 나옵니다[출처]\n<코로나 백신 접종> 순서, 횟수, 나이, 우선순위, 시기, 방법\n대한민국 국내 코로나 백신 접종 코로나 백신 접종시기 _  먼저 국내 코로나 백신 접종대상은(?) 대상은 전국민 입니다. (단 백신 개발과정에서 임상시험에 포함되지 않은 임신부와 18세 미만 소아청소년은 접종..\nzero-news.tistory.com']",1,https://kin.naver.com/qna/detail.naver?d1id=7&dirId=7010101&docId=389647124&qb=67Cx7Iug&enc=utf8&section=kin&rank=264&search_sort=3&spq=0,호흡기내과
26,2021.05.13,[],코로나 언제 끝나나요 대체,"일일 확진자 700명에 매일 등교인 것도 어이가 없는데
아침 7시에 집 나가서부터 밤 12시까지 뭐 먹을 때 빼고 하루종일 마스크쓰는 걸 거의 일 년 가까이 하고 있네요...
겨울이면 그나마 괜찮지만 이제 날씨도 엄청 더워질텐데 벌써 걱정이네요ㅠㅠ
30도 날씨에 답답하게 마스크 쓰고 찜통더위 속을 걸어가는 기분을 대통령님은 아실까요?",['일일 확진자 700명에 매일 등교인 것도 어이가 없는데 \n아침 7시에 집 나가서부터 밤 12시까지 뭐 먹을때 빼고 하루종일 마스크쓰는 걸 거의 일 년 가까이 하고 있네요...\n겨울이면 그나마 괜찮지만 이제 날씨도 엄청 더워질텐데 벌써 걱정이네요ㅠㅠ\n30도 날씨에 답답하게 마스크 쓰고 찜통더위 속을 걸어가는 기분을 대통령님은 아실까요? \n_코로나 11월달까지는 백신주사 맞으셔야지 그나마 면영력이 생겨서 \n내년 1~2월달이면은 끝나지 않을까 판단됩니다_\n수많은 보험사의 보험료를 한번에 간편히 비교견적을 받을수 있는곳입니다.\n아래 사이트에서 한번에 내 보험료를 무료 비교견적 받아보세요\n무료보험상담 http://m.site.naver.com/0w8jm'],1,https://kin.naver.com/qna/detail.naver?d1id=6&dirId=60213&docId=389647821&qb=67Cx7Iug&enc=utf8&section=kin&rank=260&search_sort=3&spq=0,손해배상
26,2021.05.13,"['곤지름', '콘딜로마', '비뇨기과', '산부인과', 'hpv바이러스', 'pcr검사']",곤지름으로 인해 포경수술을 했습니다.,"기혼자이고 제목 그대로 곤지름으로 포경수술을 진행하고
고위험군인지 다른 성병유무 파악을위해
Pcr검사 (소변 혈액 채취)를 하고 오늘 전화로
검사결과 통보받았는데
아무 균도 검출되지 않았다라고만 전달받았는데
분명 곤지름이 있는데 이게 가능한가요??

와이프도 혹시 몰라 산부인과에서
STD.HPV 바이러스검사 진행했는데 음성이 나왔습니다

1.Pcr검사로는 곤지름 바이러스를 파악할수 없나요
2.와이프도 음성이고 저도 아무것도 없다는데
분명 다발성증상과 사마귀모양이 곤지름맞는데
이게 가능한 일인가요..","['안녕하세요. 하이닥-네이버 지식iN 상담의 및 원주 포경수술 시행 비뇨의학과 전문의입니다. \n음경에서 확인되는 곤지름 치료와 재발방지 목적으로 포경수술을 병행하신 듯 합니다. \n과거와 달리 포피제거는 의무적인 절차로 받아들여지지는 않지만 몇가지 질환치료나 질병예방목적으로는 필요성이 인정되고 있으며 성기 헤르페스, 곤지름과 같은 재발성 바이러스 성병들은 잠복과 재활성화로 인한 재발을 억제할 목적으로 포경수술이 권장되고 있습니다. \n곤지름 여부는 의심되는 병변이 있을시 병변을 떼어내어 HPV PCR을 시행할 수 있으며 명확한 병변이 없는 경우에는 피부를 샅샅히 도발하여 바이러스 검출여부를 확인합니다.  소변으로 확인하는 pcr검사는 곤지름 유발 바이러스인 hpv를 확인하는 목적이 아니며 요도염, 질염을 유발하는 임질균이나 클라미디아 등의 세균을 진단하는 목적으로 시행합니다. 혈액 pcr 성병검사는 시행하지 않고 헤이즈, 매독 등 성병에 대한 항체검사를 시행합니다. \n따라서 소변, 혈액 pcr을 시행하셨다면 당연히 hpv는 검출되지 않습니다. 다만, 추가 검체검사에서 별다른 이상은 보이지 않으니 다행인 소견이며 향후 곤지름이 재발하는지 예의주시하고 가다실9가 백신접종도 고려해보실 수 있을 것으로 사료됩니다.  문의내용에 참고가 되기 바라며 곤지름과 포경수술 관련 원주 비뇨의학과에서 답변드립니다. ']",1,https://kin.naver.com/qna/detail.naver?d1id=7&dirId=70113&docId=389648021&qb=67Cx7Iug&enc=utf8&section=kin&rank=259&search_sort=3&spq=0,비뇨의학과
26,2021.05.13,[],자궁경부암 주사 생일 지났는데 맞을 수 있나요?,"제가 올해 14살인데 생일이 지났는데 애들은 다 생일 지나기 전에 맞았다고 그러더라고요 엄마는 이런거에 무관심 하셔서
일본 뇌염 주사도 안맞았고 자궁경부암 1차도 안맞았는데 어떡하죠?내공 20","['자궁경부암 감염 예방을 위한 HPV(인유두종바이러스) 예방 백신은 국가에서 만 12세 여성 청소년을 대상으로 무료로 접종해 줍니다\n2021년 올해는 2008~2009년생들이 무료 접종 대상자입니다\n= 지났으면 별도로 금액을 지불해야해요..\n<자궁경부암 예방접종> 무료대상, 가격, 부작용, 남자, 시기 등 (총정리)\n자궁경부암 총정리 자궁경부암 대상자 확인 _ 자궁경부암 이란? 자궁경부암은 한국인이 가장 많이 걸리는 5대 암 중 하나 입니다. 건강보험심사평가원에 따르면 국내에서 자궁경부암으로 병원을 찾은 환자는 점차..\ndingdo.tistory.com\n위는 자궁경부암 예방접종\n(무료대상, 비용, 시기, 백신종류, 맞아야하는 이유 등 안내)\n= 남자도 맞아야 하나?', '안녕하세요~! 반갑습니다!\n많은분들이 궁금해 하시는 해당 글이 도움이 될까 하여 자궁경부암 총정리글 첨부해 두고 가겠습니다!\n참고하셔서 조금이라도 도움이 되셨으면 합니다^^\n항상 좋은 일들만 가득하길 바랍니다!\n▼자궁경부암 관련글 총정리 바로가기\n   ']",2,https://kin.naver.com/qna/detail.naver?d1id=7&dirId=7011404&docId=389648966&qb=67Cx7Iug&enc=utf8&section=kin&rank=258&search_sort=3&spq=0,여성질환
26,2021.05.13,[],자궁경부암 주사 생일 지났는데 맞을 수 있나요?,"제가 올해 14살인데 생일이 지났는데 애들은 다 생일 지나기 전에 맞았다고 그러더라고요 엄마는 이런거에 무관심 하셔서
일본 뇌염 주사도 안맞았고 자궁경부암 1차도 안맞았는데 어떡하죠?","['자궁경부암 감염 예방을 위한 HPV(인유두종바이러스) 예방 백신은 국가에서 만 12세 여성 청소년을 대상으로 무료로 접종해 줍니다\n2021년 올해는 2008~2009년생들이 무료 접종 대상자입니다\n보건복지상담센터에 문의해 보세요\n보건복지상담센터\nhttps://www.129.go.kr\n보건복지상담센터\n사회적 거리두기! 함께 지켜요 개인위생! 모두 함께 이겨내요! 코로나 19 극복 및 응원 캠페인 함께해요. 희망의 전화 129! 전국 어디서나 국번없이 129! 보건복지 관련 정보와 상담 서비스를 신속/정확하게 제공해 드리겠습니다 사회적 거리두기! 함께 지켜요 개인위생! 모두 함께 이겨내요! 코로나 19 극복 및 응원 캠페인 함께해요. 희망의 전화 129! 전국 어디서나 국번없이 129! 보건복지 관련 정보와 상담 서비스를 신속/정확하게 제공해 드리겠습니다 사회적 거리두기! 함께 지켜요 개인위생! 모두 함께 이겨내요! 코로나 19 ...\nwww.129.go.kr\n상담 전화 : 국번없이 129', '아쉽지만\n자궁경부암 예방접종은 만 12세만 무료 입니다\n이 나이 지나면 돈내야해요..\n<자궁경부암 예방접종> 무료대상, 가격, 부작용, 남자, 시기 등 (총정리)\n자궁경부암 총정리 자궁경부암 대상자 확인 _ 자궁경부암 이란? 자궁경부암은 한국인이 가장 많이 걸리는 5대 암 중 하나 입니다. 건강보험심사평가원에 따르면 국내에서 자궁경부암으로 병원을 찾은 환자는 점차..\ndingdo.tistory.com\n위는 자궁경부암 예방접종\n(무료대상, 비용, 시기, 백신종류, 맞아야하는 이유 등 안내)\n= 남자도 맞아야 하나?']",2,https://kin.naver.com/qna/detail.naver?d1id=7&dirId=7011404&docId=389649030&qb=67Cx7Iug&enc=utf8&section=kin&rank=257&search_sort=3&spq=0,여성질환
