page,date,tags,questions,questions_add,answers,N_answer,url,category
4,2021.06.27,[],코로나 백신 접종 전 막걸리,백신 접종 전날 막걸리 두잔 마셔도 문제없겠죠..?,"['아뇨\n코로나 백신 전날 음주는 금지 입니다\n<코로나 백신 접종> 순서, 횟수, 나이, 우선순위, 시기, 방법\n대한민국 국내 코로나 백신 접종 코로나 백신 접종시기 _  먼저 국내 코로나 백신 접종대상은(?) 대상은 전국민 입니다. (단 백신 개발과정에서 임상시험에 포함되지 않은 임신부와 18세 미만 소아청소년은 접종..\nzero-news.tistory.com', '안됩니다. 백신 접종 전날, 그리고 접종하고 나서 일주일간은 금주하시는게 좋습니다.\n코로나 백신 접종 사전예약 연령 시기 피해보상\n코로나 백신 접종이 중요한 시기입니다. 하지만 코로나 접종 일정등이 여러가지 방법으로 공유되다보니 한눈에 파악하기 힘든게 사실입니다. 오늘 제가 한눈에 볼수있도록 코로나 백신 접종에 관해 알려드리겠습니..\nm.site.naver.com', '백신 접종 전 그리고 접종 후 당일, 일주일은 음주 절대하시면 안됩니다.\n백신과 알콜 반응을 예측하지 못하기 때문입니다.\n코로나 백신 3분기 연령별 접종 시기 예약 신청 부작용\n코로나 백신 접종을 기다리는 분들이 정말 많을것 같습니다. 특히 2분기 백신 접종대상자에서 소외되었던 분들은 3분기 접종 계획에 더 많은 분들이 집중하고 있는게 사실입니다. 그럼 코로나 백신 3분기 연령별..\nm.site.naver.com']",3,https://kin.naver.com/qna/detail.naver?d1id=7&dirId=70101&docId=393318938&qb=67Cx7Iug&enc=utf8&section=kin&rank=38&search_sort=3&spq=0,내과
3,2021.06.27,"['해외여행', '일본여행']",졸업여행 질문,현제 고등학교 다니는 고2학년인데요 내년에 친구랑 졸업여행을 코로나 시기지만 일본으오 가고 싶은데 일본 가려면 뭐가 필요한지 자가격리는 어지서 어떻게 언제까지 하는지 알려 주실분 있나요,['1. 내년에 가시는데에 자가격리가 필요 할지 모르겠습니다. ( 백신 접종 후에는 자가격리가 없어 질지도 모르기 때문)\n2. 일본 가시는데에는 기본적으로 여권만 준비하시면 됩니다. \n3. 미성년자끼리 갈때에는 숙소 구하는게 어렵습니다. (보호자 동의서를 조건으로 투숙이 가능한 숙소를 알아 보셔야 합니다.)\n4. 내년에 코로나 사태가 어떻게 될지 모르기에 정확한 답변을 드릴 수가 없습니다. '],1,https://kin.naver.com/qna/detail.naver?d1id=5&dirId=51003&docId=393323275&qb=67Cx7Iug&enc=utf8&section=kin&rank=29&search_sort=3&spq=0,여행상품
3,2021.06.27,[],고3남학생 코로나백신 맞아도될까요?,"안녕하세요 제동생이 약십년전 7살쯤 2009년에 신종플루당시 신종플루 백신도 맞았는데 맞은후 10일정도후에 신종플루확진을받고 입원치료를했던적이있습니다
그당시 증상이심각해 무기폐까지갔었고 다행히회복되었지만 그후에 독감백신을맞았을때도 접종부위가 많이부어오른적이있습니다ㆍㆍ
7월중순경부터 고3코로나백신접종예약이 시작된다는데 이런적이있는경우 맞아도괜찮을까요..?
당연히맞고면역력이생기면좋겠지만 예전처럼 백신을맞았는데도 확진이되어 폐가안좋아진다던지 접종부위가부어오르는게 백신부작용이있진않을까 걱정이되어서 질문을드립니다 ..","['코로나 백신은 기저질환환자 / 약물 투여자 / 감기기운등 증상이 있는자는 증상이 나타나는 자는\n먼저 병원에 의사와 상담후 접종해야 한다 아래 코로나 접종안내 문구에 나옵니다[출처]\n<코로나 백신 접종> 순서, 횟수, 나이, 우선순위, 시기, 방법\n대한민국 국내 코로나 백신 접종 코로나 백신 접종시기 _  먼저 국내 코로나 백신 접종대상은(?) 대상은 전국민 입니다. (단 백신 개발과정에서 임상시험에 포함되지 않은 임신부와 18세 미만 소아청소년은 접종..\nzero-news.tistory.com']",1,https://kin.naver.com/qna/detail.naver?d1id=7&dirId=7010101&docId=393323938&qb=67Cx7Iug&enc=utf8&section=kin&rank=27&search_sort=3&spq=0,호흡기내과
