page,date,tags,questions,questions_add,answers,N_answer,url,category
1,2020.07.18,"['수원애견분양', '#수원애견분양', '#수원강아지분양', '#참견']",수원애견분양 청결하고 건강한곳,"안녕하세요 수원애견분양 알아보는 중입니다 어린강아지를 분양 하는건
처음이라 청결하고 강아지들이 아프지않은 건강한 수원애견분양 
수원애견분양 하는 곳 알려주세요!!","['안녕하세요 질문자님 수원애견분양 질문주셨군요!!\n수원애견분양 의 모든것! 저희가 답변 해드리겠습니다 ㅎㅎ\n먼저 질문자님께서 위생적인 수원애견분양 샵을 찾고 계신것같은데요!!\n질문자님의 말씀대로 강아지를 분양 하실때는 위생적인 환경이 정말 정말\n중요한데요! 어린강아지들은 면역이 약해서 주변환경에 굉장히 예민하기 때문입니다!\n저희는 매일아침 방역과 소독을 실시하고 있습니다 ! 또한 매시간 아이들의 \n건강상태와 위생상태를 기록중입니다 그래서 수원애견분양 을 하러오시는 많은 분들이 방문하셔서\n강아지냄새가 나지 않는다고 깨끗한 위생환경에 많이 놀라십니다 ㅎㅎ\n이러한 노력을 바탕으로 저희는 자신있게 질병1년보장제도를 실시 하고 있습니다!!\n15일만 보장하는 타샵과 다르게 1년동안 질병보장을 실시하는 이유는 \n저희는 그만큼 아이들의 건강에 자신 있기 때문입니다 \n면역이 약한 새끼 강아지들을 위한 유기농 이유식과 \n동물병원과 동일한 혈청주사와 종합백신접종을 통해 아이들의 건강을 어렸을때부터 케어 해서 분양을 보내\n분양을 나가서도 평생 건강하게 자랄 수 있도록 하였습니다^^\n제휴병원을 통한 검진시 평~~생 30~40% 할인 해드리고 있습니다ㅎㅎ !\n물론 추후에도 중성화수술할때도 마찬가지입니다 ㅎㅎ\n또한 분양 후에도 배변훈련과 행동교정 등등 여러가지 훈련 멘토링도 진행 하고 있습니다^^\n수원애견분양 더 궁금하신내용은 문의 주시면 친절 하게 답변 도와 드릴께요~~!!\n홈페이지\nwww.yogidog.co.kr / www.yogidogcat.com\n인스타\nhttps://www.instagram.com/yogidog.co.kr/\n유투브\nhttps://www.youtube.com/channel/UCm6qmX8Bxbki-HPNq4mC1cg', '안녕하세요 미유펫인천점입니다. \n얼마전에도  수원분이 오셔서 분양을받아가셨는데^^; 수원에서 \n분양받을곳을 찾고계시군요\n매장 방문시 120마리 이상의 강아지 고양이를 보실수있는 인천최대규모입니다.^^\n분양후에는 수의사선생님께서 직접 건강검진을 무료로 해드리구 있습니다.\n아가의 건강과 청결을 중요하시는 브랜드입니다.\n분양받으신후에도 위생미용평생무료/의료비할인/미용비 할인등 다양한 혜택이있습니다^^\n키우시다가 문제있거나~ 어려운 부분이 발생하시면 전화상담24시간 해드리니 언제든 찾아서 \n상담가능하십니다^^\n거리가있어도 분양이가능합니다. 전국 배송서비스도 가능합니다. !!\n밑에 카페 링크걸어드리니 직접 실분양중인 아가들을 만나보세요^^\n★인천점의 1주년기념 초강력 이벤트!...\n인천강아지분양 ""미유펫 "" 입니다.인천점의 올 여름 최저가 이벤트!미유펫(인천...\ncafe.naver.com\n50m\n© NAVER Corp.\n미유펫 강아지고양이 인천점\n인천광역시 연수구 아트센터대로 198', '안녕하세요. \n반려견에 대한 궁금증을 해결해주는 ""하트독"" 입니다.\n반려견은 애견샵을 이용하거나 가정견 분양을 통해서 가능합니다.\n분양샵을 이용하는 경우에는 계약서를 꼼꼼하게 체크하시길 바라고,\n가정견을 분양받을때는 모견등을 꼭 확인하세요.\n작년에 강아지 공장이 이슈가 되면서,\n좀 더 쾌적한 환경에서 자란 반려견을 분양받고자 하는 분들이 많습니다.\n대도시에는 고급 샵이 많고 이곳에서는 향후 발생되는 문제들에 대해서\n책임을 다하는 곳이 많은 이유로 대도시를 선호하는데요,\n최근에는 동물 보호법의 개정으로 좀 더 믿을 수 있는 샵들도 많아 졌습니다.\n가정견을 분양받고 싶은 경우에는 ""참견"" 이라는 어플을 사용하시면 좋고,\n애견샵에서 분야받고 싶다면 ""페밀리"" 어플을 사용해 보세요.\n답변이 도움이 되셨다면 채택도 부탁드립니다.']",3,https://kin.naver.com/qna/detail.naver?d1id=1&dirId=1070202&docId=362887507&qb=67Cx7Iug&enc=utf8&section=kin&rank=7&search_sort=3&spq=0,휴대전화사용
1,2020.07.18,['#문제풀이'],코로나바이러스감염증-19 백신이 언제쯤 나오나요?,코로나바이러스감염증-19가 장기화 되면서 국민들이 불안을 떨고 있는데 백신이 언제쯤 나올련지요?,['개발해도 바이러스 변이가 될수있어서 가능할지 모르겠네요..\n빨라도 내년쯤이라고 하네요.\n빨리 나왔으면 좋겠습니다'],1,https://kin.naver.com/qna/detail.naver?d1id=11&dirId=1116&docId=362890435&qb=67Cx7Iug&enc=utf8&section=kin&rank=6&search_sort=3&spq=0,"생물학, 생명공학"
1,2020.07.18,[],"코로나 365 항상 존재하는거죠?
가망 없는거죠?",,"['가망이 없진 않죠 사람은 미래를 모르기 때문입니다', '악덕업주가 도태되서 사라지고 있으니 그것만 이라도 감사하게 생각해야죠 \n코로나가 철들게하고 있으니 업주는 성숙해져서 변하리라 믿어요 ', '코로나19로 어려운 요즘\n사람에대한 경계를 게을리하다가는 걸리기 쉽다고 합니다.\n상대방이 누구를 만나 코로나에 감염되었는지 알수가 없기에 답답한 요즘 힘들게 \n연세드신 어르신들 모시고 생활하고 있습니다.\n외출도 힘들고 방문객도 자제하고~~~\n코로나가 번지고 있는 요즘은 긴장하며 생활하고 있습니다.\n코로나 비록 365일 우리를 노리고 있지만 \n손소독과 마스크 착용 그리고 거리두기를 생활하고 있으니 \n잘 견디고 있고 미국에서 백신을 개발했다는 기쁜 소식에 희망을 가져봅니다.\n하루 빨리 우리나라에서도 백신이 개발되길 기도합니다.\n힘내셔요\n화이팅 입니다.', '백신이 연말에 발표할 예정입니다\n미국주도하에 1~2종\n의료보급이 잘된국가는 종식입니다.\n========= 현재 특가 상품 ==========\n!!SNS에서 난리인 다이어트 음료 헐리우드 48시간 원조 클렌즈 음료! 32% 할인행사중!!\n▶https://coupa.ng/bFQWrX\n!! 삼성 가전 브랜드 위크 40% 할인 행사중!!\n▶https://coupa.ng/bFURsZ\n!! 여름 뷰티 용품 행사 기획전 77% 할인중!!\n▶https://coupa.ng/bGbK0f\n!!뱃살 다이어트 품목 행사 할인중!!\n▶https://coupa.ng/bFQW5K\n!!갤럭시 버즈 플러스 BTS 에디션 한정판 출시!!!\n▶https://coupa.ng/bFI0JJ\n오늘의 특가 세일 리스트 최대 50%\n▶https://coupa.ng/bGowm2\n!!게이밍 컴퓨터 특집!! 할인중!!\n▶ https://coupa.ng/bFBalZ\n!!쿠쿠 브랜드 특가 할인 행사중!!\n▶https://coupa.ng/bFQXhO\n!! 에어컨 할인 특가 한눈에 보기 !!\n▶ https://coupa.ng/bEYoii\n!! 여름 가전 특가 한눈에 보기 !!\n▶https://coupa.ng/bEYmWF\n!! 인터넷 방송 장비 특가 한눈에보기!!\n▶https://coupa.ng/bFBezN\n여름 향수 브랜드 전품목 최대 60% 세일중\n여자 여름 향수 특가 한눈에 보기\n▶ https://coupa.ng/bEhHHz\n남자 여름향수 특가 한눈에 보기\n▶https://coupa.ng/bEhHQk\n행사중!! 썸머 화장품 기획전 브랜드 상품 최대 64% 할인행사중입니다.\n인기 여름 화장품 한눈에 보기 \n▶ https://coupa.ng/bEhOo0\n물과 땀에 지워지지않는 워터프루프 제품 한눈에 보기\n▶ https://coupa.ng/bEhKP0\n안마의자 최대 64% 할인 기획전\n▶ https://coupa.ng/bD3eFd\n모여봐요 동물의 숲 할인 행사중!! \n▶ https://coupa.ng/bD3fsq\n게이밍 모니터 특가 행사중\n▶ https://coupa.ng/bDZOfQ\n게이밍 데스크탑 특가 행사중\n▶ https://coupa.ng/bDZOpv\n냉장고 특가 한눈에 보기\n▶ https://coupa.ng/bDZQvO\n주방 가전 특가 한눈에 보기\n▶ https://coupa.ng/bDZSVk\n김치냉장고 특가 한눈에 보기\n▶ https://coupa.ng/bD3ez4\n========= 코로나 대비 상품 =========\n!! FDA 인증 여름용 덴탈 마스크 50매/100매 \n▶ https://coupa.ng/bEaIOi\n!! KC 인증 여름용 덴탈 마스크 장당 240원!! \n▶ https://coupa.ng/bEamgg\n!! KC 인증 여름용 덴탈 마스크 50장!!\n▶ https://coupa.ng/bEaIsf\n!! 여름용 쿨 메쉬 원단 마스크 세탁가능\n▶https://coupa.ng/bEaNkR\n<비말 차단 마스크 KF-AD> 특가 한눈에 보기\n▶ https://coupa.ng/bDPwlM\n<덴탈 마스크> 특가 한눈에 보기!\n▶ https://coupa.ng/bCdPT5\n<아이 전용 마스크> 특가 한눈에 보기!\n▶ https://coupa.ng/bDZLnP\n<KF94 필터 마스크> 특가 한눈에 보기!\n▶ https://coupa.ng/bCdP2a\n<면 마스크> 특가 한눈에 보기!\n▶ https://coupa.ng/bCdQiu\n<휴대용 손소독제!> 들고다니면서 뿌려요! 향수같은 향기 \n▶ https://coupa.ng/bAeAnZ\n<휴대용 손소독제!> 깔끔한 에탄올 70% 손소독제! \n▶https://coupa.ng/bAeBpD\n========= 필수 영양제 상품 =========\n필수 <면역력> 영양제 한눈에 보기!\n▶ https://coupa.ng/bCy7C3\n필수 <수험생> 영양제 한눈에 보기!\n▶ https://coupa.ng/bCIyp4\n필수 <다이어트> 에 좋은 영양제 한눈에 보기!\n▶ https://coupa.ng/bCZ7xg\n필수 <정력> 에 좋은 영양제 한눈에 보기!\n▶ https://coupa.ng/bCZ9eH\n필수 <여성> 영양제 한눈에 보기! \n▶ https://coupa.ng/bB5XI2\n필수 <갱년기> 영양제 한눈에 보기!\n▶ https://coupa.ng/bCjf4c\n=========여름 바캉스 패키지=========\n곧 여름 바캉스 시즌입니다. 미리 예약하시고 큰 혜택 보시기바랍니다. 조기 매진 주의\n전지역 프리미엄 펜션 (풀빌라) 20% 할인중 특가 한눈에 보기\n▶ https://coupa.ng/bDZL3V\n제주 여행 특가 행사전 (항공권/입장권/패키지상품)\n▶ https://coupa.ng/bDZNtt\n캠핑 용품 특가 행사중!! 최대 48%\n▶https://coupa.ng/bD7gc0\n낚시 용품 특가 한눈에 보기!!\n▶https://coupa.ng/bD7gvE\n초보자 입문자도 쉽게 낚시 한다 원투 낚시!\n원투 낚시 세트 한눈에 보기!!\n▶https://coupa.ng/bElXmG\n========= 여행 및 생필품 특가 상품 =========\n순백 3겹 라벤더 바닐라 롤 화장지 30롤\n▶https://coupa.ng/bD3c0b\n탐사수 20병 팩 \n▶https://coupa.ng/bD3dkh\n아기 물티슈 100매짜리 10팩\n▶https://coupa.ng/bD3dBt\n농심 육개장 사발면 6개 패키지\n▶https://coupa.ng/bD3dKG\n깨끗한 소중한 우리쌀 \n▶https://coupa.ng/bD3dU0\n======= 오늘의 반찬 특가 =======\n호주산 와규 양념 불고기 (냉장) 100g당 990원\n▶ https://coupa.ng/bD6MFq\n한돈 1등급 삼겹살 구이용 (냉장) 100g당 1466원\n▶ https://coupa.ng/bD6NgR\n한우 1+ 등급 채끝 스테이크 (냉장) 200g \n▶ https://coupa.ng/bD6NvW\n참맛나라 신선한 알이 듬뿍 알탕\n▶https://coupa.ng/bD6OSW\n빠네 크림 파스타\n▶https://coupa.ng/bD6OZe\n리코타 치즈 샐러드 2팩\n▶ https://coupa.ng/bD6N1S\n채소믹스 패키지 요새 핫한제품입니다!\n▶ https://coupa.ng/bD6OhK\n삼립 아침엔 우유토스트 식빵 2팩 3960원\n▶ https://coupa.ng/bD6Oqm\n춘천 닭갈비 (냉장) 특가 세일중\n▶ https://coupa.ng/bEv3Q8\n충남 농협 GAP 인증 대추방울 토마토 1KG 4900원 특가 행사중\n▶ https://coupa.ng/bEv31P\n동원 비엔나 소세지 1KG 3980원 특가 행사중\n▶ https://coupa.ng/bEv4dc\n파트너스 활동의 일환으로 일정액의 수수료를 제공 받습니다.']",4,https://kin.naver.com/qna/detail.naver?d1id=6&dirId=61303&docId=362895207&qb=67Cx7Iug&enc=utf8&section=kin&rank=5&search_sort=3&spq=0,사람과 그룹
1,2020.07.18,[],"일본의 GOTO 반값 여행 계획 입국 규제 완화, 8 월 중순부터 9 월","질문
일본의 GOTO 반값 여행 성과
GOTO 반값 여행 계획 감염자를 세척, 소독, 양치질, 마스크, 비 접속 형 접객 방법 등을 이용하여 여행자의 확산을 막을 수있는 데이터가 나온 때의 구분을 폐지 여행 규제 완화를 실시하는 것 같습니다.
2 박 3 일의 여행에서 14 일의 격리 불합리이기 때문에
격리 가능한 비즈니스 유학생의 순으로 완화 한 후에 격리 불가능한 관광객으로 규제 완화한다고 생각합니다.

여행자끼리, 지역 주민과의 접근 감염은 각자의 자기 책임으로 호텔, 여관, 음식점 등에서 어떻게 방지 할 수 있는지를 시도하고 있다고 생각합니다.
GOTO 반값 여행 기획에서 여행자의 비율보다 감염 피해가 증가해야한다면 9 월 무렵, 한국, 대만 등 아시아 지역의 후 미국 등의 지역에서 여행자를 받아 들일 체제를 취하고 분리를 폐지했다 후 일부 규제 완화 전면적 규제 완화에 나설 계획입니다.
GOTO 반값 여행 계획에 따라 크게 감염자가 증가하는 도중에 기획 중지하고 다시 비상 사태 선언을 발령한다고 생각합니다.
실패했을 경우, 외국인의 수용은 연내 불가능하다고 생각됩니다.

그러나 언젠가는 규제 해제해야한다고 생각 합니다만,
도쿄의 감염자가 증가하고 현재의 자살 행위라고 밖에 생각되지 않습니다.

외국인의 규제 완화하면 어떻게 될까? 이란 데이터를 데리고
이 시국에 GOTO 반값 여행 계획을 실시했다고도 생각됩니다.
국내 여행이라면 곧바로 비상 사태 선언을 낼 수 있지만, 외국인 등의 경우
사전 협의 나 통보도 필요하기 때문에.

일본의 전략을 어떻게 생각하십니까?
경제를 살리기 위해 1 조엔을 투입 계획이 옳다고 생각하십니까?","['확실히 현재 시행방안은 모순점이 많다고 생각합니다. 하지만 대안을 가져오라고 한다면 불가능한 상황입니다.\n일반 국민들은 그렇게 생각하지 않을지도 모르겠습니다만, 올 해 일본이든 한국이든 외국인 입국 규제 완화는 불가능하다는 것이 각 전문가들의 중론입니다. 백신이 나오지도 않았는데 외국인 관광객을 받아들이는 것은 진짜 자살행위입니다.\n여기에 이런 질문을 올릴 정도의 지식을 갖고 있는 일본인이시라면 아시겠지만, 도쿄올림픽을 내각에서 꼭 유치하려고 하는 것도 결국 경제를 어느정도 살리기 위함입니다.\n언제 南海地震과 東海地震가 올지 모르는 상황에, 코로나 때문에 올림픽도 미뤄지고...일본은 지금 1분 1초가 아쉬운 상황입니다.\n아마도 한국인 못지않게 일본인들도 각 회사의 조치와는 정반대의 성향을 보이는 내각을 이해하기 어려울 것이라 생각됩니다. 하지만 마땅히 대안이 있습니까 ? 글쎄요.\n도시에서 사는 사람들이야 지역을 벗어날 일이 없으니 시정촌 주민들과 다소 의견이 다를 것이라고 생각합니다.\n시정촌, 특히 관광수요를 어떻게든 만들어서 먹고사는 사람들 입장에서는 지금 지옥과 같은 생활일겁니다.\n현재로써는 아베의 재선이 실패하는 방향으로 흘러가고 있지만, 결국 당의 입장에서도 민심을 잡기위해서는 어느정도 일 하는 척은 해야하는 것입니다. ', '여행업계 즉 숙박업등이 지금 다들 무너지고 있는 상황입니다. 정말 어려운 상황이죠.\n그 호텔에 관련된 청소업체 부터해서 각종 관련 업체들이 다 같이 죽어가고 있는 상황입니다.\n어떻게든 그시장을 활성화를 시켜야 하지만 ,\n역시 무리 감도 없지 않아 있습니다. 그렇지만 그렇게라도 하지 않으면 호텔과 관련된 업계는 3월부터 계속 적자로 가고 있는 상태이니 나라에선 경제를 살릴 방법은 그 선택밖에 없는겁니다', '안녕하세요, 일본에서 여행사에 근무하고 있는 사람입니다.\n개인적인 의견으로 저는 이번 조치가 올림픽을 살리기 위한 자구책이라고 생각되는데요.\n왜냐하면 지금 일본은 올림픽을 무척 하고싶어하죠.\n사실 올림픽을 하지 못하면 일본 전체의 경제가 매우 위험한 상황입니다.\n이미 세금은 쏟아부었는데 전혀 회수가 되지 않으니까요.\n그리고 올림픽에는 수많은 여행사, 관광업계가 많은 투자를 했습니다.\n하지만 코로나 이후 일본 관광업계는 말 그대로 줄도산 직전에 있죠.\n굳이 이름은 거론하지 않겠지만 일본내 가장 거대 규모의 여행사 3사가 이미 100억이 넘는 적자를 기록했습니다.\n즉, GO to 캠패인은 올림픽에 어마무지한 투자를 했고 향후 올림픽을 개최하는데 없어서는 안될 여행업계를 살리기 위한 궁여지책인 셈이죠.\n자살행위라고 하는 질문자님의 의견에도 물론 동의하지만 일본의 관광업계에는 수많은 한국인들이 근무하고 있고\n이대로는 모두 생활 기반을 잃게 될 상황인만큼, 조금 더 코로나 대책을 확실히 해서 믿고 이용할 수 있는 캠페인으로 만들어주었으면 하는 바람이네요.']",3,https://kin.naver.com/qna/detail.naver?d1id=9&dirId=9020101&docId=362903052&qb=67Cx7Iug&enc=utf8&section=kin&rank=4&search_sort=3&spq=0,일본
1,2020.07.18,[],코로나 끝나는 시기,코로나 언제 끝나죠 내공 80이요! 제발 정확하게 해주세요,"['빨라도 내년 9월쯤에 백신이 개발되고 3년쯤 간다고 하네요....ㅠㅠㅠ', 'https://penguinworld9.tistory.com/205\n코로나19 팬데믹(대유행), 종식, 전망은?\n신종 코로나바이러스(코로나19)가 한국은 물론 전 세계로 확산되고 있다. 한국에서는 이미 코로나19 확진자 수 가 천명을 넘어섰다. 1월부터 시작된 환진자 발생은 31번째 확진자를 중심으로 크게 증가하여, 하루..\npenguinworld9.tistory.com\nhttps://penguinworld9.tistory.com/205\n코로나19 팬데믹(대유행), 종식, 전망은?\n신종 코로나바이러스(코로나19)가 한국은 물론 전 세계로 확산되고 있다. 한국에서는 이미 코로나19 확진자 수 가 천명을 넘어섰다. 1월부터 시작된 환진자 발생은 31번째 확진자를 중심으로 크게 증가하여, 하루..\npenguinworld9.tistory.com']",2,https://kin.naver.com/qna/detail.naver?d1id=8&dirId=814&docId=362904710&qb=67Cx7Iug&enc=utf8&section=kin&rank=3&search_sort=3&spq=0,기타
